movieId,title,genres,imdbId,tmdbId,overview,tmdb_vote_average,tmdb_vote_count,tmdb_genres,rating
5620,Sweet Home Alabama (2002),Comedy|Romance,256415,11529.0,"New York fashion designer, Melanie Carmichael suddenly finds herself engaged to the city's most eligible bachelor. But her past holds many secrets—including Jake, the redneck husband she married in high school, who refuses to divorce her. Bound and determined to end their contentious relationship once and for all, Melanie sneaks back home to Alabama to confront her past.",6.405,1597,"['Comedy', 'Romance']",3.5
5943,Maid in Manhattan (2002),Comedy|Romance,252076,7303.0,"Marisa Ventura is a struggling single mom who works at a posh Manhattan hotel and dreams of a better life for her and her young son. One fateful day, hotel guest and senatorial candidate Christopher Marshall meets Marisa and mistakes her for a wealthy socialite. After an enchanting evening together, the two fall madly in love. But when Marisa's true identity is revealed, issues of class and social status threaten to separate them. Can two people from very different worlds overcome their differences and live happily ever after?",6.13,1983,"['Comedy', 'Drama', 'Romance']",3.0
5952,"Lord of the Rings: The Two Towers, The (2002)",Adventure|Fantasy,167261,121.0,"Frodo Baggins and the other members of the Fellowship continue on their sacred quest to destroy the One Ring--but on separate paths. Their destinies lie at two towers--Orthanc Tower in Isengard, where the corrupt wizard Saruman awaits, and Sauron's fortress at Barad-dur, deep within the dark lands of Mordor. Frodo and Sam are trekking to Mordor to destroy the One Ring of Power while Gimli, Legolas and Aragorn search for the orc-captured Merry and Pippin. All along, nefarious wizard Saruman awaits the Fellowship members at the Orthanc Tower in Isengard.",8.409,22940,"['Adventure', 'Fantasy', 'Action']",4.0
5957,Two Weeks Notice (2002),Comedy|Romance,313737,2642.0,"Dedicated environmental lawyer Lucy Kelson goes to work for billionaire George Wade as part of a deal to preserve a community center. Indecisive and weak-willed George grows dependent on Lucy's guidance on everything from legal matters to clothing. Exasperated, Lucy gives notice and picks Harvard graduate June Carter as her replacement. As Lucy's time at the firm nears an end, she grows jealous of June and has second thoughts about leaving George.",6.368,2128,"['Romance', 'Comedy']",3.5
5989,Catch Me If You Can (2002),Crime|Drama,264464,640.0,"A true story about Frank Abagnale Jr. who, before his 19th birthday, successfully conned millions of dollars worth of checks as a Pan Am pilot, doctor, and legal prosecutor. An FBI agent makes it his mission to put him behind bars. But Frank not only eludes capture, he revels in the pursuit.",7.979,16369,"['Drama', 'Crime']",2.5
5995,"Pianist, The (2002)",Drama|War,253474,423.0,"The true story of pianist Władysław Szpilman's experiences in Warsaw during the Nazi occupation. When the Jews of the city find themselves forced into a ghetto, Szpilman finds work playing in a café; and when his family is deported in 1942, he stays behind, works for a while as a laborer, and eventually goes into hiding in the ruins of the war-torn city.",8.381,9693,"['Drama', 'War']",3.5
6155,How to Lose a Guy in 10 Days (2003),Comedy|Romance,251127,9919.0,"It's the battle of wills, as Andie needs to prove she can dump a guy in 10 days, whereas Ben needs to prove he can win a girl in 10 days. Now, the clock is ticking—and the wildly entertaining comedy smash is off and running in this irresistible tale of sex, lies and outrageous romantic fireworks!",6.854,4240,"['Comedy', 'Romance']",3.5
6218,Bend It Like Beckham (2002),Comedy|Drama|Romance,286499,455.0,"Jess Bhamra, the daughter of a strict Indian couple in London, is not permitted to play organized soccer, even though she is 18. When Jess is playing for fun one day, her impressive skills are seen by Jules Paxton, who then convinces Jess to play for her semi-pro team. Jess uses elaborate excuses to hide her matches from her family while also dealing with her romantic feelings for her coach, Joe.",6.327,1953,"['Comedy', 'Drama', 'Romance']",4.0
6266,What a Girl Wants (2003),Comedy|Drama|Romance,286788,10735.0,"An American girl, Daphne, heads to Europe in search of the father she's never met. But instead of finding a British version of her bohemian mother, she learns the love of her mom's life is an uptight politician. The only problem now is that her long-lost dad is engaged to a fiercely territorial social climber with a daughter who makes Daphne's life miserable.",6.296,1675,"['Comedy', 'Romance', 'Drama', 'Family']",3.0
6373,Bruce Almighty (2003),Comedy|Drama|Fantasy|Romance,315327,310.0,"Bruce Nolan toils as a ""human interest"" television reporter in Buffalo, NY, but despite his high ratings and the love of his beautiful girlfriend, Bruce remains unfulfilled. At the end of the worst day in his life, he angrily ridicules God — and the Almighty responds, endowing Bruce with all of His divine powers.",6.722,11093,"['Fantasy', 'Comedy']",2.5
6377,Finding Nemo (2003),Adventure|Animation|Children|Comedy,266543,12.0,"Nemo, an adventurous young clownfish, is unexpectedly taken from his Great Barrier Reef home to a dentist's office aquarium. It's up to his worrisome father Marlin and a friendly but forgetful fish Dory to bring Nemo home -- meeting vegetarian sharks, surfer dude turtles, hypnotic jellyfish, hungry seagulls, and more along the way.",7.817,19930,"['Animation', 'Family']",3.5
6539,Pirates of the Caribbean: The Curse of the Black Pearl (2003),Action|Adventure|Comedy|Fantasy,325980,22.0,"After Port Royal is attacked and pillaged by a mysterious pirate crew, capturing the governor's daughter Elizabeth Swann in the process, William Turner asks free-willing pirate Jack Sparrow to help him locate the crew's ship—The Black Pearl—so that he can rescue the woman he loves.",7.814,21462,"['Adventure', 'Fantasy', 'Action']",3.5
6586,American Wedding (American Pie 3) (2003),Comedy,328828,8273.0,"With high school a distant memory, Jim and Michelle are getting married — and in a hurry, since Jim's grandmother is sick and wants to see him walk down the aisle — prompting Stifler to throw the ultimate bachelor party. And Jim's dad is reliable as ever, doling out advice no one wants to hear.",6.218,4208,"['Comedy', 'Romance']",2.0
6776,Lagaan: Once Upon a Time in India (2001),Comedy|Drama|Musical|Romance,282674,19666.0,"In 1890s India, an arrogant British commander challenges the harshly taxed residents of Champaner to a high-stakes cricket match.",7.3,602,"['Adventure', 'Drama', 'History']",4.0
6873,Intolerable Cruelty (2003),Comedy|Romance,138524,11775.0,A revenge-seeking gold digger marries a womanizing Beverly Hills lawyer with the intention of making a killing in the divorce.,5.948,1563,"['Comedy', 'Romance', 'Crime']",2.5
6942,Love Actually (2003),Comedy|Drama|Romance,314331,508.0,Eight very different couples deal with their love lives in various loosely interrelated tales all set during a frantic month before Christmas in London.,7.103,7052,"['Comedy', 'Romance', 'Drama']",4.5
7082,That Touch of Mink (1962),Comedy|Romance,56575,12708.0,"Cathy Timberlake is en route to a job interview when a car transporting businessman Philip Shayne covers her in mud. He sends his assistant, Roger, to apologize, but upon meeting Cathy, Roger knows that she would be a suitable match for his boss. Despite their mutual attraction, Cathy and Philip want different things. Philip wants a fling, while Cathy wants a marriage. As they travel to exotic locales, their differing motivations are put to the test.",6.421,178,"['Comedy', 'Romance']",3.5
7142,Honey (2003),Drama|Romance,322589,10028.0,"Honey Daniels dreams of making a name for herself as a hip-hop choreographer. When she's not busy hitting downtown clubs with her friends, she teaches dance classes at a nearby community center in Harlem, N.Y., as a way to keep kids off the streets. Honey thinks she's hit the jackpot when she meets a hotshot director casts her in one of his music videos. But, when he starts demanding sexual favors from her, Honey makes a decision that will change her life.",6.4,1199,"['Music', 'Drama', 'Romance']",3.0
7153,"Lord of the Rings: The Return of the King, The (2003)",Action|Adventure|Drama|Fantasy,167260,122.0,"As armies mass for a final battle that will decide the fate of the world--and powerful, ancient forces of Light and Dark compete to determine the outcome--one member of the Fellowship of the Ring is revealed as the noble heir to the throne of the Kings of Men. Yet, the sole hope for triumph over evil lies with a brave hobbit, Frodo, who, accompanied by his loyal friend Sam and the hideous, wretched Gollum, ventures deep into the very dark heart of Mordor on his seemingly impossible quest to destroy the Ring of Power.​",8.5,25482,"['Adventure', 'Fantasy', 'Action']",4.0
7154,Mona Lisa Smile (2003),Drama|Romance,304415,11820.0,"Katherine Watson is a recent UCLA graduate hired to teach art history at the prestigious all-female Wellesley College, in 1953. Determined to confront the outdated mores of society and the institution that embraces them, Katherine inspires her traditional students, including Betty and Joan, to challenge the lives they are expected to lead.",6.928,1824,"['Drama', 'History', 'Romance']",4.0
7255,Win a Date with Tad Hamilton! (2004),Comedy|Romance,335559,13476.0,"A small-town girl wins a date with a Hollywood star through a contest. When the date goes better than expected, a love triangle forms between the girl, the celebrity, and the girl's best friend.",5.7,501,"['Comedy', 'Romance']",3.5
7293,50 First Dates (2004),Comedy|Romance,343660,1824.0,"Henry is a player skilled at seducing women. But when this veterinarian meets Lucy, a girl with a quirky problem when it comes to total recall, he realizes it's possible to fall in love all over again…and again, and again. That's because the delightful Lucy has no short-term memory, so Henry must woo her day after day until he finally sweeps her off her feet.",6.873,7446,"['Comedy', 'Romance']",3.0
7345,Agent Cody Banks 2: Destination London (2004),Action|Adventure|Children|Comedy,358349,17047.0,"With all-new gadgets, high-flying action, exciting chases and a wisecracking new handler, Derek (Anthony Anderson), Cody has to retrieve the device before the world's leaders fall under the evil control of a diabolical villain.",5.614,656,"['Comedy', 'Action', 'Adventure', 'Family', 'Romance']",2.0
7366,Jersey Girl (2004),Comedy|Drama|Romance,300051,9541.0,"Ollie Trinke is a young, suave music publicist who seems to have it all, with a new wife and a baby on the way. But life deals him a bum hand when he's suddenly faced with single fatherhood, a defunct career and having to move in with his father. To bounce back, it takes a new love and the courage instilled in him by his daughter.",6.184,1093,"['Comedy', 'Romance', 'Drama']",3.0
7375,"Prince & Me, The (2004)",Comedy|Romance,337697,11137.0,"A fairy tale love-story about pre-med student Paige who falls in love with a Danish Prince ""Eddie"" who refused to follow the traditions of his parents and has come to the US to quench his thirst for rebellion. Paige and Edward come from two different worlds, but there is an undeniable attraction between them.",6.203,1020,"['Comedy', 'Romance']",3.5
7444,13 Going on 30 (2004),Comedy|Fantasy|Romance,337563,10096.0,"After total humiliation at her thirteenth birthday party, Jenna Rink wants to just hide until she's thirty. Thanks to some magic wishing dust, Jenna's prayer has been answered. With a knockout body, a fabulous wardrobe, an athlete boyfriend, a dream job, and superstar friends, this can't be a better life. But soon Jenna realizes that adult life isn’t as easy as she hoped for.",6.761,5345,"['Comedy', 'Fantasy', 'Romance']",3.5
7450,Laws of Attraction (2004),Comedy|Romance,323033,11141.0,"Amidst a sea of litigation, two New York City divorce lawyers find love.",5.8,437,"['Comedy', 'Romance']",4.0
8033,How to Steal a Million (1966),Comedy|Crime|Romance,60522,3001.0,A woman must steal a statue from a Paris museum to help conceal her father's art forgeries.,7.5,623,"['Comedy', 'Crime', 'Romance']",3.5
8362,Raising Helen (2004),Comedy|Drama|Romance,350028,4599.0,"Helen Harris has a glamorous, big-city life working for one of New York's hottest modeling agencies. But suddenly her free-spirited life gets turned upside down when she must chose between the life she's always loved, and the new loves of her life!",6.134,673,"['Drama', 'Comedy', 'Romance']",3.0
8372,Garfield: The Movie (2004),Animation|Children|Comedy,356634,8920.0,"Garfield, the fat, lazy, lasagna lover, has everything a cat could want. But when Jon, in an effort to impress the Liz - the vet and an old high-school crush - adopts a dog named Odie and brings him home, Garfield gets the one thing he doesn't want. Competition.",5.727,4139,"['Comedy', 'Family']",2.5
8526,Around the World in 80 Days (2004),Adventure|Children|Comedy,327437,10204.0,"A bet pits a British inventor, a Chinese thief and a French artist on a worldwide adventure that they can circle the globe in 80 days.",5.95,2587,"['Action', 'Adventure', 'Comedy']",3.0
8529,"Terminal, The (2004)",Comedy|Drama|Romance,362227,594.0,"An Eastern European tourist unexpectedly finds himself stranded in JFK airport, and must take up temporary residence there.",7.353,8284,"['Comedy', 'Drama']",3.0
8531,White Chicks (2004),Action|Comedy|Crime,381707,12153.0,"Two FBI agent brothers, Marcus and Kevin Copeland, accidentally foil a drug bust. To avoid being fired they accept a mission escorting a pair of socialites to the Hamptons--but when the girls are disfigured in a car accident, they refuse to go. Left without options, Marcus and Kevin decide to pose as the sisters, transforming themselves from black men into rich white women.",6.9,4268,"['Comedy', 'Crime']",2.0
8533,"Notebook, The (2004)",Drama|Romance,332280,11036.0,"An epic love story centered around an older man who reads aloud to a woman with Alzheimer's. From a faded notebook, the old man's words bring to life the story about a couple who is separated by World War II, and is then passionately reunited, seven years later, after they have taken different paths.",7.891,12084,"['Romance', 'Drama']",2.5
8643,"Cinderella Story, A (2004)",Comedy|Romance,356470,11247.0,"Routinely exploited by her wicked stepmother, the downtrodden Samantha Montgomery is excited about the prospect of meeting her Internet beau at the school's Halloween dance.",6.581,3295,"['Comedy', 'Family', 'Romance']",3.0
8644,"I, Robot (2004)",Action|Adventure|Sci-Fi|Thriller,343818,2048.0,"In 2035, where robots are commonplace and abide by the three laws of robotics, a technophobic cop investigates an apparent suicide. Suspecting that a robot may be responsible for the death, his investigation leads him to believe that humanity may be in danger.",6.957,12219,"['Action', 'Science Fiction']",3.0
8808,"Princess Diaries 2: Royal Engagement, The (2004)",Comedy|Romance,368933,11130.0,"Mia Thermopolis is now a college graduate and on her way to Genovia to take up her duties as princess. Accompanied by her friend Lilly, Mia continues her 'princess lessons', like riding horses side-saddle and archery. But her already complicated life is turned upside down once again when she learns that she is to take the crown as queen earlier than expected, all while she meets a mysteriously charming young man.",6.713,3326,"['Comedy', 'Drama', 'Family', 'Romance']",3.0
8814,Without a Paddle (2004),Comedy,364751,10762.0,"Three friends, whose lives have been drifting apart, reunite for the funeral of a fourth childhood friend. When looking through their childhood belongings, they discover a trunk which contained details on a quest their friend was attempting. It revealed that he was hot on the trail of the $200,000 that went missing with airplane hijacker D.B. Cooper in 1971. They decide to continue his journey, but do not understand the dangers they will soon encounter.",5.614,671,"['Comedy', 'Action', 'Adventure', 'Mystery']",2.5
8866,Wimbledon (2004),Comedy|Romance,360201,11823.0,"Britain’s Peter Colt has never quite lived up to his dreams of tennis stardom. Once ranked as high as number 11 in the world, the journeyman veteran has watched his number slip to 119 as his confidence on the court slowly ebbs away.  Now, on the eve of his leaving the world of professional tennis, he’s granted a wild card, allowing him to play his final Wimbledon tournament…make that his final tournament ever.",6.226,1039,"['Comedy', 'Romance']",3.5
8869,First Daughter (2004),Comedy|Romance,361620,13969.0,"Samantha MacKenzie, the daughter of the president of the United States, arrives at college with a group of Secret Service agents. Samantha, however, resents their presence and decides she wants to attend school just like a normal student. Her father agrees to recall the agents but secretly assigns James, an undercover agent, to pose as a student.",6.167,971,"['Family', 'Comedy', 'Drama', 'Romance']",3.0
8961,"Incredibles, The (2004)",Action|Adventure|Animation|Children|Comedy,317705,9806.0,"Bob Parr has given up his superhero days to log in time as an insurance adjuster and raise his three children with his formerly heroic wife in suburbia. But when he receives a mysterious assignment, it's time to get back into costume.",7.718,18299,"['Action', 'Adventure', 'Animation', 'Family']",3.0
8965,"Polar Express, The (2004)",Adventure|Animation|Children|Fantasy|IMAX,338348,5255.0,"When a doubting young boy takes an extraordinary train ride to the North Pole, he embarks on a journey of self-discovery that shows him that the wonder of life never fades for those who believe.",6.721,6599,"['Animation', 'Adventure', 'Family', 'Fantasy']",3.0
8970,Finding Neverland (2004),Drama,308644,866.0,"During a writing slump, playwright J.M. Barrie meets a widow and her four children, all young boys—who soon become an important part of Barrie’s life and the inspiration that lead him to create his masterpiece. Peter Pan.",7.322,3638,"['Drama', 'Fantasy']",3.5
8971,Veer Zaara (2004),Drama|Musical|Romance,420332,4251.0,"Squadron Leader Veer Pratap Singh, a pilot in the Indian Air Force, rescues the stranded Zaara, a woman from Pakistan, following a bus accident, and their lives are forever bound.",7.413,286,"['Drama', 'Romance']",4.0
8984,Ocean's Twelve (2004),Action|Comedy|Crime|Thriller,349903,163.0,"Despite pulling off one of the biggest heists in Las Vegas history and splitting the $160 million take, each of the infamous Ocean's crew have tried to go straight, lay low and live a legit life ... but that's proven to be a challenge. Casino owner Terry Benedict demands that Danny Ocean return the money, plus millions more in interest. Unable to come up the cash, the crew is forced to come together to pull off another series of heists, this time in Rome, Paris, and Amsterdam – but a Europol agent is hot on their heels.",6.564,7547,"['Thriller', 'Crime']",4.0
8985,Blade: Trinity (2004),Action|Fantasy|Horror|Thriller,359013,36648.0,"For years, Blade has fought against the vampires in the cover of the night. But now, after falling into the crosshairs of the FBI, he is forced out into the daylight, where he is driven to join forces with a clan of human vampire hunters he never knew existed—The Nightstalkers. Together with Abigail and Hannibal, two deftly trained Nightstalkers, Blade follows a trail of blood to the ancient creature that is also hunting him—the original vampire, Dracula.",5.9,4106,"['Action', 'Horror', 'Science Fiction']",3.0
27163,Something Is Happening (Kuch Kuch Hota Hai) (1998),Comedy|Musical|Romance,172684,11854.0,"Per her mother's last wish, an 8 year old girl sets out to reunite her father with his college best friend who was in love with him.",7.5,402,"['Romance', 'Drama', 'Comedy']",4.5
27362,"Sometimes Happiness, Sometimes Sorrow (Kabhi Khushi Kabhie Gham) (2001)",Drama|Musical|Romance,248126,10757.0,"Years after his father disowns his adopted brother for marrying a woman of lower social standing, a young man goes on a mission to reunite his family.",7.7,572,"['Comedy', 'Drama']",4.5
27518,D.C.H. (Dil Chahta Hai) (2001),Comedy|Drama,292490,14752.0,"Three inseparable childhood friends are just out of college. Nothing comes between them - until they each fall in love, and their wildly different approaches to relationships creates tension.",6.9,308,"['Drama', 'Romance']",1.5
27729,Kal Ho Naa Ho (2003),Comedy|Drama|Romance,347304,4254.0,An uptight MBA student falls for the charismatic new neighbor who charms her troubled family – but he has a secret that forces him to push her away.,7.4,417,"['Comedy', 'Drama', 'Romance']",4.5
27808,Spanglish (2004),Comedy|Drama|Romance,371246,2539.0,"Mexican immigrant and single mother Flor Moreno finds housekeeping work with Deborah and John Clasky, a well-off couple with two children of their own. When Flor admits she can't handle the schedule because of her daughter, Cristina, Deborah decides they should move into the Clasky home. Cultures clash and tensions run high as Flor and the Claskys struggle to share space while raising their children on their own, and very different, terms.",6.028,1338,"['Drama', 'Comedy']",4.0
30822,In Good Company (2004),Comedy|Drama,385267,1901.0,"Dan Foreman is a seasoned advertisement sales executive at a high-ranking publication when a corporate takeover results in him being placed under naive supervisor Carter Duryea, who is half his age. Matters are made worse when Dan's new supervisor becomes romantically involved with his daughter an 18 year-old college student Alex.",6.1,648,"['Comedy', 'Drama', 'Romance']",3.0
30825,Meet the Fockers (2004),Comedy,290002,693.0,"Hard-to-crack ex-CIA man Jack Byrnes and his wife Dina head for the warmer climes of Florida to meet the parents of their son-in-law-to-be, Greg Focker. Unlike their happily matched offspring, the future in-laws find themselves in a situation of opposites that definitely do not attract.",6.252,4942,"['Comedy', 'Romance']",3.0
31422,Are We There Yet? (2005),Children|Comedy,368578,11637.0,"The fledgling romance between Nick, a playboy bachelor, and Suzanne, a divorced mother of two, is threatened by a particularly harrowing New Years Eve. When Suzanne's work keeps her in Vancouver for the holiday, Nick offers to bring her kids to the city from Portland, Oregon. The kids, who have never liked any of the men their mom dates, are determined to turn the trip into a nightmare for Nick.",5.677,1015,"['Family', 'Adventure', 'Comedy', 'Romance']",2.0
31685,Hitch (2005),Comedy|Romance,386588,8488.0,"Dating coach Alex 'Hitch' Hitchens mentors a bumbling client, Albert, who hopes to win the heart of the glamorous Allegra Cole. While Albert makes progress, Hitch faces his own romantic setbacks when proven techniques fail to work on Sara Melas, a tabloid reporter digging for dirt on Allegra Cole's love life. When Sara discovers Hitch's connection to Albert – now Allegra's boyfriend – it threatens to destroy both relationships.",6.57,6002,"['Comedy', 'Drama', 'Romance']",3.0
31694,Bride & Prejudice (2004),Comedy|Musical|Romance,361411,57825.0,Mrs. Bakshi is eager to find suitors for her four unmarried daughters when a family friend introduces them to handsome American Will Darcy. A Bollywood-style modern adaptation of Jane Austen's classic novel.,6.467,391,"['Drama', 'Comedy', 'Romance']",3.5
32289,Ice Princess (2005),Children|Comedy|Drama,396652,13374.0,"With the help of her coach, her mom, and the boy who drives the Zamboni, nothing can stop Casey Carlyle from realizing her dream to be a champion figure skater.",6.4,917,"['Family', 'Drama', 'Comedy']",3.0
32296,Miss Congeniality 2: Armed and Fabulous (2005),Adventure|Comedy|Crime,385307,10040.0,"After her triumph at the Miss United States pageant, FBI agent Gracie Hart becomes an overnight sensation -- and the new ""face of the FBI"". But it's time to spring into action again when the pageant's winner, Cheryl, and emcee, Stan, are abducted.",5.8,1904,"['Action', 'Comedy']",2.5
33004,"Hitchhiker's Guide to the Galaxy, The (2005)",Adventure|Comedy|Sci-Fi,371724,7453.0,"Mere seconds before the Earth is to be demolished by an alien construction crew, Arthur Dent is swept off the planet by his friend Ford Prefect, a researcher penning a new edition of ""The Hitchhiker's Guide to the Galaxy.""",6.677,4032,"['Adventure', 'Comedy', 'Science Fiction']",3.5
33499,Monster-in-Law (2005),Comedy|Romance,369735,4379.0,"Office temp Charlotte Cantilini thinks she's found Mr. Right when she starts dating gorgeous surgeon Dr. Kevin Fields. But there's a problem standing in the way of everlasting bliss: Kevin's overbearing and controlling mother, Viola. Fearing she'll lose her son's affections forever, Viola decides to break up the happy couple by becoming the world's worst mother-in-law.",6.226,1703,"['Romance', 'Comedy']",2.0
33615,Madagascar (2005),Adventure|Animation|Children|Comedy,351283,953.0,Four animal friends get a taste of the wild life when they break out of captivity at the Central Park Zoo and wash ashore on the island of Madagascar.,6.916,11298,"['Family', 'Animation', 'Adventure', 'Comedy']",3.0
33679,Mr. & Mrs. Smith (2005),Action|Adventure|Comedy|Romance,356910,787.0,"A husband and wife struggle to keep their marriage alive until they realize they are both secretly working as assassins. Now, their respective assignments require them to kill each other.",6.687,10806,"['Action', 'Comedy', 'Drama', 'Thriller']",2.5
