movieId,title,genres,imdbId,tmdbId,overview,tmdb_vote_average,tmdb_vote_count,tmdb_genres,rating
58998,Forgetting Sarah Marshall (2008),Comedy|Romance,800039,9870.0,"When actress Sarah Marshall dumps aspiring musician Peter Bretter for rock star Aldous Snow, Peter's world comes crashing down. His best friend Brian suggests that Peter should get away from everything and to fly off to Hawaii to escape all his problems. After arriving in Hawaii and meeting the beautiful receptionist Rachel Jansen, Peter is shocked to see not only Aldous in Hawaii, but also Sarah.",6.502,3531,"['Comedy', 'Romance', 'Drama']",3.0
59220,Outsourced (2006),Comedy|Romance,425326,7861.0,"After his entire department is outsourced, an American novelty products salesman heads to India to train his replacement.",6.4,164,"['Comedy', 'Drama', 'Romance']",3.5
59315,Iron Man (2008),Action|Adventure|Sci-Fi,371746,1726.0,"After being held captive in an Afghan cave, billionaire engineer Tony Stark creates a unique weaponized suit of armor to fight evil.",7.654,27339,"['Action', 'Science Fiction', 'Adventure']",4.0
59333,Made of Honor (2008),Comedy|Romance,866439,10761.0,"Tom and Hannah have been platonic friends for 10 years. He's a serial dater, while she wants marriage but hasn't found Mr. Right. Just as Tom is starting to think that he is relationship material after all, Hannah gets engaged. When she asks Tom to be her 'maid' of honor, he reluctantly agrees just so he can attempt to stop the wedding and woo her.",6.45,1719,"['Comedy', 'Romance']",3.0
59784,Kung Fu Panda (2008),Action|Animation|Children|Comedy|IMAX,441773,9502.0,"When the Valley of Peace is threatened, lazy Po the panda discovers his destiny as the ""chosen one"" and trains to become a kung fu hero, but transforming the unsleek slacker into a brave warrior won't be easy. It's up to Master Shifu and the Furious Five -- Tigress, Crane, Mantis, Viper and Monkey -- to give it a try.",7.306,12125,"['Animation', 'Family', 'Comedy', 'Action', 'Adventure']",3.5
60040,"Incredible Hulk, The (2008)",Action|Sci-Fi,800080,1724.0,"Scientist Bruce Banner scours the planet for an antidote to the unbridled force of rage within him: the Hulk. But when the military masterminds who dream of exploiting his powers force him back to civilization, he finds himself coming face to face with a new, deadly foe.",6.225,12258,"['Science Fiction', 'Action', 'Adventure']",2.5
60074,Hancock (2008),Action|Adventure|Comedy|Crime|Fantasy,448157,8960.0,"Hancock is a down-and-out superhero who's forced to employ a PR expert to help repair his image when the public grows weary of all the damage he's inflicted during his lifesaving heroics. The agent's idea of imprisoning the antihero to make the world miss him proves successful, but will Hancock stick to his new sense of purpose or slip back into old habits?",6.35,9908,"['Fantasy', 'Action']",3.0
60397,Mamma Mia! (2008),Comedy|Musical|Romance,795421,11631.0,A spirited young bride-to-be living with her single mother on a small Greek island secretly invites three of her mother's ex-boyfriends in hope of finding her biological father to walk her down the aisle.,7.0,6780,"['Comedy', 'Romance']",3.5
61123,High School Musical 2 (2007),Comedy|Drama|Musical|Romance,810900,13649.0,"The East High Wildcats are gearing up for big fun as they land the coolest summer jobs imaginable. Troy, Gabriella, Chad, and Taylor have scored sweet gigs at the Lava Springs Country Club owned by Sharpay and Ryan's family. Sharpay's first rule of business: Get Troy. As Troy experiences a life of privilege he's never known, will he give up the Wildcats and Gabriella to rise to the top?",6.51,3795,"['Comedy', 'Drama', 'Family', 'Music', 'Romance', 'TV Movie']",2.0
62155,Nick and Norah's Infinite Playlist (2008),Comedy|Drama|Romance,981227,12182.0,"Nick cannot stop obsessing over his ex-girlfriend, Tris, until Tris' friend Norah suddenly shows interest in him at a club. Thus begins an odd night filled with ups and downs as the two keep running into Tris and her new boyfriend while searching for Norah's drunken friend, Caroline, with help from Nick's band mates. As the night winds down, the two have to figure out what they want from each other.",6.444,1226,"['Romance', 'Comedy', 'Music', 'Drama']",4.0
62265,"Accidental Husband, The (2009)",Comedy|Romance,809504,13401.0,"Emma, a radio host, is about to be married to Richard, her perfect match. But right before her wedding, she learns she's already married to Patrick, a charming but irresponsible fireman. Furthermore, Patrick has a secret: he has arranged this little trick because Emma advised Patrick's ex-fiancée to end their relationship. However, Patrick may find that the trick is on him, for he soon begins to fall in love with his uptight adversary.",5.5,568,"['Comedy', 'Romance']",3.5
62439,My Best Friend's Girl (2008),Comedy|Romance,1046163,13596.0,"Lovestruck Dustin is dating Alexis, his ideal girlfriend, but when she dumps him for coming on too strong, Dustin takes drastic measures to win her back. He asks his best friend Tank to take her on the worst rebound date imaginable - his side job - so that she will come running back to him, and Tank reluctantly agrees. However, Alexis is more than a match for Tank's shock tactics and he begins to really fall for her, leaving him torn between loyalty to Dustin and his growing attraction toward Alexis.",5.642,768,"['Romance', 'Comedy']",3.0
62912,High School Musical 3: Senior Year (2008),Musical,962726,11887.0,"As seniors in high school, Troy and Gabriella struggle with the idea of being separated from one another as college approaches. Along with the rest of the Wildcats, they stage a spring musical to address their experiences, hopes and fears about their future.",6.548,3538,"['Comedy', 'Romance', 'Drama', 'Family', 'Music']",2.5
63992,Twilight (2008),Drama|Fantasy|Romance|Thriller,1099212,8966.0,"When Bella Swan moves to a small town in the Pacific Northwest, she falls in love with Edward Cullen, a mysterious classmate who reveals himself to be a 108-year-old vampire. Despite Edward's repeated cautions, Bella can't stay away from him, a fatal move that endangers her own life.",6.288,13974,"['Fantasy', 'Drama', 'Romance']",1.5
64716,Seven Pounds (2008),Drama,814314,11321.0,An IRS agent with a fateful secret embarks on an extraordinary journey of redemption by forever changing the lives of seven strangers.,7.605,6984,['Drama'],2.5
65230,Marley & Me (2008),Comedy|Drama,822832,14306.0,"A newly married couple, in the process of starting a family, learn many of life's important lessons from their trouble-loving retriever, Marley. Packed with plenty of laughs to lighten the load, the film explores the highs and lows of marriage, maturity and confronting one's own mortality, as seen through the lens of family life with a dog.",7.193,4673,"['Comedy', 'Family']",3.5
67788,Confessions of a Shopaholic (2009),Comedy|Romance,1093908,20048.0,"In the glamorous world of New York City, Rebecca Bloomwood is a fun-loving girl who is really good at shopping – a little too good, perhaps. She dreams of working for her favorite fashion magazine, but can't quite get her foot in the door – until ironically, she snags a job as an advice columnist for a financial magazine published by the same company.",6.5,2670,"['Comedy', 'Romance']",2.5
68099,Apollo 13: To the Edge and Back (1994),Documentary,180443,128857.0,"Apollo 13: To the Edge and Back tells the gripping, true story of the catastrophic flight of the Apollo 13 and the heroic struggle to bring the astronauts back alive. With first-hand accounts from the pilots, their families, and the people of mission control, it documents a thrilling struggle against time and all odds and serves as a reminder that, in the words of James Lovell, ""We do not realize what we have on Earth until we leave it.""",7.0,1,['Documentary'],4.5
68319,X-Men Origins: Wolverine (2009),Action|Sci-Fi|Thriller,458525,2080.0,"After seeking to live a normal life, Logan sets out to avenge the death of his girlfriend by undergoing the mutant Weapon X program and becoming Wolverine.",6.277,10877,"['Adventure', 'Action', 'Science Fiction']",3.5
68358,Star Trek (2009),Action|Adventure|Sci-Fi|IMAX,796366,13475.0,"The fate of the galaxy rests in the hands of bitter rivals. One, James Kirk, is a delinquent, thrill-seeking Iowa farm boy. The other, Spock, a Vulcan, was raised in a logic-based society that rejects all emotion. As fiery instinct clashes with calm reason, their unlikely but powerful partnership is the only thing capable of leading their crew through unimaginable danger, boldly going where no one has gone before. The human adventure has begun again.",7.426,10156,"['Science Fiction', 'Action', 'Adventure']",3.0
68954,Up (2009),Adventure|Animation|Children|Drama,1049413,14160.0,"Carl Fredricksen spent his entire life dreaming of exploring the globe and experiencing life to its fullest. But at age 78, life seems to have passed him by, until a twist of fate (and a persistent 8-year old Wilderness Explorer named Russell) gives him a new lease on life.",7.959,20983,"['Animation', 'Comedy', 'Family', 'Adventure']",3.0
69136,Don (1978),Action|Comedy|Crime|Drama|Musical|Thriller,77451,33104.0,"A ruthless gangster named Don is killed during a scuffle with the police. Since only DSP D'Silva knows of this incident, he recruits Vijay, who is a spitting image of Don, to replace the original Don and infiltrate his gang. D'Silva plans to nab the entire gang, but when he dies during a raid, the secret that Vijay is not Don is also buried with him.",6.5,76,"['Action', 'Adventure', 'Comedy', 'Crime', 'Thriller']",3.5
69269,Salaam Namaste (2005),Comedy|Musical|Romance,456165,15084.0,"Salaam Namaste is about two Indians who have left their houses to make a life on their own, and how they meet and how they tackle their own relationships and problems and overcome them themselves without their families",6.2,91,"['Comedy', 'Romance', 'Drama']",2.5
69406,"Proposal, The (2009)",Comedy|Romance,1041829,18240.0,"When she learns she's in danger of losing her visa status and being deported, overbearing book editor Margaret Tate forces her put-upon assistant, Andrew Paxton, to marry her.",7.154,7166,"['Comedy', 'Romance', 'Drama']",3.5
69606,Ghosts of Girlfriends Past (2009),Comedy|Fantasy|Romance,821640,12556.0,"Celebrity photographer Connor Mead lives life in the fast lane, committed to lifelong bachelorhood and simultaneous relationships with multiple women. On the eve of his younger brother Paul's wedding, Connor's mockery of love proves a real buzz-kill for everyone - including his childhood crush, Jenny, the one woman who always seemed immune to his considerable charms. Later that night, he gets a wake-up call from the ghost of his late Uncle Wayne, the hard-partying, legendary ladies' man who was Connor's mentor. Uncle Wayne has an urgent message which he delivers through three ghosts who guide Connor on an eye-opening tour of his romantic past, present and future. Along the way, they attempt to discern whether he will ever be able to change his ways -- and if there is any hope of him finding true love.",6.0,2356,"['Romance', 'Comedy', 'Fantasy']",3.0
69757,(500) Days of Summer (2009),Comedy|Drama|Romance,1022603,19913.0,"Tom, greeting-card writer and hopeless romantic, is caught completely off-guard when his girlfriend, Summer, suddenly dumps him. He reflects on their 500 days together to try to figure out where their love affair went sour, and in doing so, Tom rediscovers his true passions in life.",7.297,10599,"['Comedy', 'Drama', 'Romance']",3.0
69844,Harry Potter and the Half-Blood Prince (2009),Adventure|Fantasy|Mystery|Romance|IMAX,417741,767.0,"As Lord Voldemort tightens his grip on both the Muggle and wizarding worlds, Hogwarts is no longer a safe haven. Harry suspects perils may even lie within the castle, but Dumbledore is more intent upon preparing him for the final battle fast approaching. Together they work to find the key to unlock Voldemorts defenses and to this end, Dumbledore recruits his old friend and colleague Horace Slughorn, whom he believes holds crucial information. Even as the decisive showdown looms, romance blossoms for Harry, Ron, Hermione and their classmates. Love is in the air, but danger lies ahead and Hogwarts may never be the same again.",7.682,20147,"['Adventure', 'Fantasy']",3.5
70183,"Ugly Truth, The (2009)",Comedy|Drama|Romance,1142988,20943.0,"A romantically challenged morning show producer is reluctantly embroiled in a series of outrageous tests by her chauvinistic correspondent to prove his theories on relationships and help her find love. His clever ploys, however, lead to an unexpected result.",6.5,3644,"['Comedy', 'Romance']",3.5
71520,"Invention of Lying, The (2009)",Comedy,1058017,23082.0,"Set in a world where the concept of lying doesn't exist, a loser changes his lot when he invents lying and uses it to get ahead.",6.204,2212,"['Comedy', 'Fantasy', 'Romance']",3.0
71688,Jab We Met (2007),Comedy|Drama|Romance,1093370,11807.0,A depressed wealthy businessman and a spunky carefree young woman embark on an unexpected journey that changes their lives.,7.3,290,"['Drama', 'Comedy', 'Romance']",4.5
72407,"Twilight Saga: New Moon, The (2009)",Drama|Fantasy|Horror|Romance|Thriller,1259571,18239.0,"Forks, Washington resident Bella Swan is reeling from the departure of her vampire love, Edward Cullen, and finds comfort in her friendship with Jacob Black, a werewolf. But before she knows it, she's thrust into a centuries-old conflict, and her desire to be with Edward at any cost leads her to take greater and greater risks.",5.994,9471,"['Adventure', 'Fantasy', 'Drama', 'Romance']",1.0
72737,"Princess and the Frog, The (2009)",Animation|Children|Fantasy|Musical|Romance,780521,10198.0,"A waitress, desperate to fulfill her dreams as a restaurant owner, is set on a journey to turn a frog prince back into a human being, but she has to face the same problem after she kisses him.",7.2,5897,"['Animation', 'Romance', 'Fantasy', 'Family']",3.5
72953,Less of Sugar (Cheeni Kum) (2007),Comedy|Drama|Musical|Romance,976026,16576.0,"Buddhadev Gupta, a 64-year-old chef, falls in love with a 34-year-old software engineer, Nina. However, their future becomes uncertain when he discovers that her father is six years his junior.",6.2,38,"['Romance', 'Drama']",3.5
73017,Sherlock Holmes (2009),Action|Crime|Mystery|Thriller,988045,10528.0,Eccentric consulting detective Sherlock Holmes and Doctor John Watson battle to bring down a new nemesis and unravel a deadly plot that could destroy England.,7.216,14345,"['Action', 'Adventure', 'Crime', 'Mystery']",3.0
73170,Aaja Nachle (2007),Comedy|Musical|Romance,986213,14159.0,"Dia is a divorced mom living in New York and must go back to India after she receives news that her guru is on his death bed. When she arrives she finds he is gone and has left her the responsibility of saving and reviving the Ajanta Theater where she used to dance. The problem is that the political officers want it torn down and turned into a shopping mall. The storyline follows Dia and her challenge to stand up for what she believes in and fight the cause to the end, while trying to win back the love and support of the people of the town whom she walked out on ten years prior.",6.564,39,"['Romance', 'Drama']",4.0
73319,Leap Year (2010),Comedy|Romance,1216492,25195.0,"When yet another anniversary passes without a marriage proposal from her boyfriend, Anna decides to take action. Aware of a Celtic tradition that allows women to pop the question on Feb. 29, she plans to follow her lover to Dublin and ask him to marry her. Fate has other plans, however, and Anna winds up on the other side of the Emerald Isle with handsome, but surly, Declan -- an Irishman who may just lead Anna down the road to true love.",6.901,2088,"['Romance', 'Comedy']",3.0
73513,"Swades: We, the People (Our Country) (2004)",Drama,367110,15774.0,"A successful Indian scientist returns home to his village to take his nanny back to America with him, and in the process rediscovers his roots.",7.3,346,['Drama'],4.5
73881,3 Idiots (2009),Comedy|Drama|Romance,1187043,20453.0,"Rascal. Joker. Dreamer. Genius... You've never met a college student quite like ""Rancho."" From the moment he arrives at India's most prestigious university, Rancho's outlandish schemes turn the campus upside down—along with the lives of his two newfound best friends. Together, they make life miserable for ""Virus,"" the school’s uptight and heartless dean. But when Rancho catches the eye of the dean's daughter, Virus sets his sights on flunking out the ""3 idiots"" once and for all.",8.0,2537,"['Drama', 'Comedy']",4.5
73900,Hum Tum (2004),Comedy|Drama|Musical|Romance,378072,4253.0,"The encounters of two people who run into each other on several occasions under circumstances ranging from friendly to hostile to loving. Along many years and countless run-ins, the two despise each other, befriend each other, and fall in love with each other—in no particular order.",6.377,110,"['Romance', 'Family', 'Comedy', 'Drama']",3.5
74154,When in Rome (2010),Comedy|Romance,1185416,13477.0,"Disillusioned with romance, Beth, an ambitious New Yorker, travels to Rome for her sister's wedding, where she plucks magic coins from a special fountain of love. The coins attract unwanted attention from an assortment of odd yet ardent suitors:  a sausage merchant, a street magician, an artist, and a male model. But when the best man from the wedding, persistent reporter Nick, throws his hat in the ring, Beth wonders if his love is the real thing.",5.9,1238,"['Comedy', 'Fantasy', 'Romance']",2.0
74275,I Love You Phillip Morris (2009),Comedy|Drama|Romance,1045772,8952.0,"Steven Russell leads a seemingly average life – an organ player in the local church, happily married to Debbie, and a member of the local police force. That is until he has a severe car accident that leads him to the ultimate epiphany: he’s gay and he’s going to live life to the fullest – even if he has to break the law to do it. Taking on an extravagant lifestyle, Steven turns to cons and fraud to make ends meet and is eventually sent to the State Penitentiary where he meets the love of his life, a sensitive, soft-spoken man named Phillip Morris. His devotion to freeing Phillip from jail and building the perfect life together prompts him to attempt (and often succeed at) one impossible con after another.",6.426,1721,"['Comedy', 'Crime', 'Drama', 'Romance']",2.5
74426,Mohabbatein (2000),Drama|Musical|Romance,213890,11518.0,"At a prestigious all-male university, three friends seek love outside of the school grounds; at the same time, a newly-hired music teacher seeks to befriend and loosen up the militantly strict headmaster.",7.009,265,"['Drama', 'Romance']",4.5
74450,Valentine's Day (2010),Comedy|Romance,817230,32856.0,Intertwining couples and singles in Los Angeles break-up and make-up based on the pressures and expectations of Valentine's Day.,5.9,3094,"['Comedy', 'Romance']",2.5
74508,Persuasion (2007),Drama|Romance,844330,13949.0,"Royal Navy Captain Wentworth was haughtily turned down eight years ago as suitor of pompous baronet Sir Walter Elliot's daughter Anne, despite true love. Now he visits their former seaside country estate, rented by his brother-in-law, Admiral Croft, so the financially stressed baronet can afford a fashionable, cheaper residence in trendy Bath. The former lovers meet again on the estate, where they feel vibes again, but neither dares admit them until it seems too late.",7.3,277,"['Drama', 'Romance', 'TV Movie']",3.0
76251,Kick-Ass (2010),Action|Comedy,1250777,23483.0,"Dave Lizewski is an unnoticed high school student and comic book fan who one day decides to become a super-hero, even though he has no powers, training or meaningful reason to do so.",7.123,12007,"['Action', 'Crime']",3.0
76269,Chalte Chalte (2003),Drama,346723,4252.0,A man pursues a woman who is already engaged and eventually gets married to her. Differences between the two lead to a bitter separation that threatens to destroy their relationship forever.,6.3,98,"['Comedy', 'Drama', 'Romance']",3.5
77561,Iron Man 2 (2010),Action|Adventure|Sci-Fi|Thriller|IMAX,1228705,10138.0,"With the world now aware of his dual life as the armored superhero Iron Man, billionaire inventor Tony Stark faces pressure from the government, the press and the public to share his technology with the military. Unwilling to let go of his invention, Stark, with Pepper Potts and James 'Rhodey' Rhodes at his side, must forge new alliances – and confront powerful enemies.",6.848,21740,"['Adventure', 'Action', 'Science Fiction']",3.0
78264,"Back-up Plan, The (2010)",Comedy|Romance,1212436,34806.0,"When Zoe tires of looking for Mr. Right, she decides to have a baby on her own. But on the day she's artificially inseminated, she meets Stan, who seems to be just who she's been searching for all her life. Now, Zoe has to figure out how to make her two life's dreams fit with each other.",6.14,1444,"['Comedy', 'Romance']",2.0
78316,Letters to Juliet (2010),Drama|Romance,892318,37056.0,"An American girl on vacation in Italy finds an unanswered ""letter to Juliet"" -- one of thousands of missives left at the fictional lover's Verona courtyard, which are typically answered by the ""secretaries of Juliet"" -- and she goes on a quest to find the lovers referenced in the letter.",7.004,2933,"['Comedy', 'Drama', 'Romance']",3.0
78772,"Twilight Saga: Eclipse, The (2010)",Fantasy|Romance|Thriller|IMAX,1325004,24021.0,"Bella once again finds herself surrounded by danger as Seattle is ravaged by a string of mysterious killings and a malicious vampire continues her quest for revenge. In the midst of it all, she is forced to choose between her love for Edward and her friendship with Jacob, knowing that her decision has the potential to ignite the ageless struggle between vampire and werewolf. With her graduation quickly approaching, Bella is confronted with the most important decision of her life.",6.202,8998,"['Adventure', 'Fantasy', 'Drama', 'Romance']",1.0
79702,Scott Pilgrim vs. the World (2010),Action|Comedy|Fantasy|Musical|Romance,446029,22538.0,"As bass guitarist for a garage-rock band, Scott Pilgrim has never had trouble getting a girlfriend; usually, the problem is getting rid of them. But when Ramona Flowers skates into his heart, he finds she has the most troublesome baggage of all: an army of ex-boyfriends who will stop at nothing to eliminate him from her list of suitors.",7.489,8213,"['Action', 'Comedy', 'Romance']",3.0
80166,"Switch, The (2010)",Comedy|Romance,889573,41210.0,"Kassie is a smart, fun-loving single woman who, despite her neurotic best friend Wally’s objections, decides it’s time to have a baby – even if it means doing it herself… with a little help from a charming sperm donor. But, unbeknownst to her, Kassie’s plans go awry because of a last-minute switch that isn’t discovered until seven years later… when Wally gets acquainted with Kassie’s cute, though slightly neurotic, son.",6.229,1944,"['Comedy', 'Romance', 'Drama']",3.0
80549,Easy A (2010),Comedy|Romance,1282140,37735.0,"Olive, an average high school student, sees her below-the-radar existence turn around overnight once she decides to use the school's gossip grapevine to advance her social standing. Now her classmates are turning against her and the school board is becoming concerned, including her favorite teacher and the distracted guidance counselor. With the support of her hilariously idiosyncratic parents and a little help from a long-time crush, Olive attempts to take on her notorious new identity and crush the rumor mill once and for all.",6.81,7114,['Comedy'],4.0
80858,You Again (2010),Comedy,1414382,38303.0,"History -- make that high school -- may repeat itself when Marni learns that Joanna, the mean girl from her past, is set to be her sister-in-law. Before the wedding bells toll, Marni must show her brother that a tiger doesn't change its stripes. On Marni's side is her mother, while Joanna's backed by her wealthy aunt.",6.283,1266,"['Comedy', 'Romance']",2.0
80860,Life as We Know It (2010),Comedy|Romance,1055292,38408.0,"After a disastrous first date for caterer Holly and network sports director Messer, all they have in common is a dislike for each other and their love for their goddaughter Sophie. But when they suddenly become all Sophie has in this world, Holly and Messer must set their differences aside. Juggling careers and social calendars, they'll have to find common ground while living under the same roof.",6.905,3197,"['Comedy', 'Romance', 'Drama']",3.0
81229,Red (2010),Action|Comedy,1245526,39514.0,"After surviving an assault from a squad of hit men, retired CIA black ops agent Frank Moses reassembles his old team for an all-out war. Frank reunites with old Joe, crazy Marvin and wily Victoria to uncover a massive conspiracy that threatens their lives. Only their expert training will allow them to survive a near-impossible mission -- breaking into CIA headquarters.",6.701,6909,"['Action', 'Adventure', 'Comedy', 'Crime', 'Thriller']",3.0
81564,Megamind (2010),Action|Animation|Children|Comedy|Sci-Fi|IMAX,1001526,38055.0,"After Megamind, a highly intelligent alien supervillain, defeats his long-time nemesis Metro Man, Megamind creates a new hero to fight, but must act to save the city when his ""creation"" becomes an even worse villain than he was.",7.01,7165,"['Animation', 'Action', 'Comedy', 'Family', 'Science Fiction']",2.5
