movieId,title,genres,imdbId,tmdbId,overview,tmdb_vote_average,tmdb_vote_count,tmdb_genres,rating
96821,"Perks of Being a Wallflower, The (2012)",Drama|Romance,1659337,84892.0,"Pittsburgh, Pennsylvania, 1991. High school freshman Charlie is a wallflower, always watching life from the sidelines, until two senior students, Sam and her stepbrother Patrick, become his mentors, helping him discover the joys of friendship, music and love.",7.799,10817,['Drama'],4.0
96829,"Hunt, The (Jagten) (2012)",Drama,2106476,103663.0,"A teacher lives a lonely life, all the while struggling over his son’s custody. His life slowly gets better as he finds love and receives good news from his son, but his new luck is about to be brutally shattered by an innocent little lie.",8.097,4480,['Drama'],4.5
96911,"Royal Affair, A (Kongelig affære, En) (2012)",Drama|Romance,1276419,88273.0,"A young queen falls in love with her physician, and they start a revolution that changes their nation forever.",7.374,905,"['Drama', 'History', 'Romance']",4.0
97024,Rust and Bone (De rouille et d'os) (2012),Drama|Romance,2053425,97365.0,"Put in charge of his young son, Ali leaves Belgium for Antibes to live with his sister and her husband as a family. Ali's bond with Stephanie, a killer whale trainer, grows deeper after Stephanie suffers a horrible accident.",7.165,1417,"['Drama', 'Romance']",4.5
97913,Wreck-It Ralph (2012),Animation|Comedy,1772341,82690.0,"Wreck-It Ralph is the 9-foot-tall, 643-pound villain of an arcade video game named Fix-It Felix Jr., in which the game's titular hero fixes buildings that Ralph destroys. Wanting to prove he can be a good guy and not just a villain, Ralph escapes his game and lands in Hero's Duty, a first-person shooter where he helps the game's hero battle against alien invaders. He later enters Sugar Rush, a kart racing game set on tracks made of candies, cookies and other sweets. There, Ralph meets Vanellope von Schweetz who has learned that her game is faced with a dire threat that could affect the entire arcade, and one that Ralph may have inadvertently started.",7.35,12705,"['Family', 'Animation', 'Comedy', 'Adventure']",4.0
97921,Silver Linings Playbook (2012),Comedy|Drama,1045658,82693.0,"After losing his job and wife, and spending time in an institution, a former teacher winds up living with his parents. He wants to rebuild his life and reconcile with his wife, but his father would be happy if he shared his obsession with the Philadelphia Eagles. Things get complicated when he meets Tiffany Maxwell who offers to help him reconnect with his wife if he will do something very important for her in exchange.",7.147,12289,"['Drama', 'Comedy', 'Romance']",4.0
98595,Peppermint Soda (Diabolo menthe) (1977),Comedy|Drama,75939,80220.0,"In the fall of 1963, Anne is becoming a teenager. She lives in Paris with her mother and her older sister, Frédérique. They're just back from summer at the beach with their father. School starts. A turbulent year awaits them both.",6.477,108,"['Comedy', 'Drama']",4.0
98797,Barbara (2012),Drama,2178941,88284.0,"In 1980s East Germany, Barbara is a Berlin doctor banished to a country medical clinic for applying for an exit visa. Deeply unhappy with her reassignment and fearful of her co-workers as possible Stasi informants, Barbara stays aloof, especially from the good natured clinic head, Andre.",7.192,343,['Drama'],4.5
99841,Sister (L'enfant d'en haut) (2012),Crime|Drama,2062969,102000.0,A drama set at a Swiss ski resort and centered on a boy who supports his sister by stealing from wealthy guests.,6.7,164,['Drama'],4.5
99917,Upstream Color (2013),Romance|Sci-Fi|Thriller,2084989,145197.0,"A man and woman are drawn together, entangled in the lifecycle of an ageless organism. Identity becomes an illusion as they struggle to assemble the loose fragments of wrecked lives.",6.327,761,"['Drama', 'Science Fiction']",3.5
100277,Tabu (2012),Drama|Romance,2153963,93858.0,"Lisbon, Portugal, 2010. Pilar, a pious woman devoted to social causes, maintains a peculiar relationship with her neighbor Aurora, a temperamental old woman obsessed with gambling who lives tormented by a mysterious past.",7.0,171,"['Drama', 'Romance']",3.5
100383,Side Effects (2013),Crime|Drama|Mystery|Thriller,2053463,109421.0,A woman turns to prescription medication as a way of handling her anxiety concerning her husband's upcoming release from prison.,6.609,3182,"['Thriller', 'Crime', 'Drama']",3.5
100440,Lore (2012),Drama|Thriller|War,1996310,121835.0,"After being abandoned by their Nazi parents at the end of World War II, five German siblings embark on a harrowing journey across their war-torn country. Led by the eldest, 14 year-old Lore, the children are forced to confront their parents’ actions and the reality of a new world.",6.8,294,"['Drama', 'War', 'Thriller']",4.0
100714,Before Midnight (2013),Drama|Romance,2209418,132344.0,"It has been nine years since we last met Jesse and Celine, the French-American couple who once met on a train in Vienna. They now live in Paris with twin daughters but have spent a summer in Greece at the invitation of an author colleague of Jesse's. When the vacation is over and Jesse must send his teenage son off to the States, he begins to question his life decisions, and his relationship with Celine is at risk.",7.504,2546,"['Romance', 'Drama']",4.5
101498,In the House (2012),Comedy|Drama|Mystery|Thriller,1964624,121875.0,"A sixteen-year-old boy insinuates himself into the house of a fellow student from his literature class and writes about it in essays for his French teacher. Faced with this gifted and unusual pupil, the teacher rediscovers his enthusiasm for his work, but the boy’s intrusion will unleash a series of uncontrollable events.",7.246,877,"['Comedy', 'Drama', 'Mystery', 'Thriller']",4.0
101954,Alex in Wonderland (1970),Comedy|Drama,65380,32599.0,"Bohemian Alex Morrison has just finished directing his first feature length movie. In its previews, the movie is considered a critical, artistic and surefire commercial success. As such, Alex seemingly has his choice of what his next project will be.  As he makes the rounds both in the Hollywood community and European movie centers for ideas, he fantasizes about movie scenarios of those everyday situations he is in.",5.8,18,"['Comedy', 'Drama']",4.5
102123,This Is the End (2013),Action|Comedy,1245492,109414.0,"While attending a party at James Franco's house, Seth Rogen, Jay Baruchel and many other celebrities are faced with the apocalypse.",6.232,6572,"['Action', 'Comedy']",4.0
102194,Mud (2012),Adventure|Crime|Drama,1935179,103731.0,Two teenage boys find a fugitive hiding out on an island in the Mississippi River and help him reunite with his lover and escape an avenging family and their armed posse.,7.063,2924,['Drama'],4.0
102407,"Great Gatsby, The (2013)",Drama,1343092,64682.0,"An adaptation of F. Scott Fitzgerald's Long Island-set novel, where Midwesterner Nick Carraway is lured into the lavish world of his neighbor, Jay Gatsby. Soon enough, however, Carraway will see through the cracks of Gatsby's nouveau riche existence, where obsession, madness, and tragedy await.",7.361,12616,"['Drama', 'Romance']",2.5
102753,"Past, The (Le passé) (2013)",Drama|Mystery|Romance,2404461,152780.0,"After four years apart, Ahmad returns to his wife Marie in Paris in order to progress their divorce. During his brief stay, he cannot help noticing the strained relationship between Marie and her daughter Lucie. As he attempts to improve matters between mother and daughter Ahmad unwittingly lifts the lid on a long buried secret...",7.248,582,"['Drama', 'Mystery']",4.0
103980,Blue Jasmine (2013),Drama,2334873,160588.0,"After experiencing a traumatic misfortune, Jasmine French, a wealthy woman from New York, moves to San Francisco to live with her foster sister Ginger and the firm purpose of getting a new life, but she will be haunted by anxiety and memories of the past.",6.986,3524,['Drama'],4.0
103984,"Great Beauty, The (Grande Bellezza, La) (2013)",Comedy|Drama,2358891,179144.0,"Jep Gambardella has seduced his way through the lavish nightlife of Rome for decades, but after his 65th birthday and a shock from the past, Jep looks past the nightclubs and parties to find a timeless landscape of absurd, exquisite beauty.",7.507,3203,['Drama'],5.0
104361,Ain't Them Bodies Saints (2013),Drama,2388637,152748.0,"Bob Muldoon and Ruth Guthrie, an impassioned young outlaw couple on an extended crime spree, are finally apprehended by lawmen after a shootout in the Texas hills. Although Ruth wounds a local officer, Bob takes the blame. But four years later, Bob escapes from prison and sets out to find Ruth and their daughter, born during his incarceration.",6.1,443,"['Crime', 'Drama', 'Romance', 'Western']",3.0
104841,Gravity (2013),Action|Sci-Fi|IMAX,1454468,49047.0,"Dr. Ryan Stone, a brilliant medical engineer, is on her first Shuttle mission, with veteran astronaut Matt Kowalsky in command of his last flight before retiring. But on a seemingly routine spacewalk, disaster strikes. The Shuttle is destroyed, leaving Stone and Kowalsky completely alone-tethered to nothing but each other and spiraling out into the blackness of space. The deafening silence tells them they have lost any link to Earth and any chance for rescue. As fear turns to panic, every gulp of air eats away at what little oxygen is left. But the only way home may be to go further out into the terrifying expanse of space.",7.162,15818,"['Science Fiction', 'Thriller', 'Drama']",3.0
104879,Prisoners (2013),Drama|Mystery|Thriller,1392214,146233.0,"Keller Dover is facing every parent’s worst nightmare. His six-year-old daughter, Anna, is missing, together with her young friend, Joy, and as minutes turn to hours, panic sets in. The only lead is a dilapidated RV that had earlier been parked on their street.",8.099,12461,"['Drama', 'Thriller', 'Crime']",4.0
105159,Alps (Alpeis) (2011),Drama,1859446,81857.0,"A nurse, a paramedic, a gymnast and her coach offer a service for hire wherein they stand in for dead people by appointment, hired by relatives, friends or colleagues of the deceased, to assist with the grieving process.",6.251,323,['Drama'],3.0
105355,Blue Is the Warmest Color (La vie d'Adèle) (2013),Drama|Romance,2278871,152584.0,"Adèle's life is changed when she meets Emma, a young woman with blue hair, who will allow her to discover desire, to assert herself as a woman and as an adult. In front of others, Adele grows, seeks herself, loses herself, finds herself.",7.071,4721,"['Romance', 'Drama']",5.0
105835,"Double, The (2013)",Comedy|Drama|Thriller,1825157,146015.0,An awkward office drone becomes increasingly unhinged after a charismatic and confident look-alike takes a job at his workplace and seduces the woman he desires.,6.523,1029,"['Thriller', 'Drama']",3.0
106100,Dallas Buyers Club (2013),Drama,790636,152532.0,"Loosely based on the true-life tale of Ron Woodroof, a drug-taking, women-loving, homophobic man who in 1986 was diagnosed with HIV/AIDS and given thirty days to live.",7.92,8747,"['Drama', 'History']",4.0
106163,"Touch of Sin, A (Tian zhu ding) (2013)",Drama,2852400,187022.0,Four independent stories set in modern China about random acts of violence.,7.2,355,"['Drama', 'Crime']",4.5
106452,Ida (2013),Drama,2718492,209274.0,"In 1960s Poland, young novitiate Anna is on the verge of taking her vows when she discovers a family secret dating back to the years of the German occupation.",7.246,1013,['Drama'],4.5
106766,Inside Llewyn Davis (2013),Drama,2042568,86829.0,"In Greenwich Village in the early 1960s, gifted but volatile folk musician Llewyn Davis struggles with money, relationships, and his uncertain future.",7.2,2795,"['Drama', 'Music']",1.0
106782,"Wolf of Wall Street, The (2013)",Comedy|Crime|Drama,993846,106646.0,"A New York stockbroker refuses to cooperate in a large securities fraud case involving corruption on Wall Street, corporate banking world and mob infiltration. Based on Jordan Belfort's autobiography.",8.028,25018,"['Crime', 'Drama', 'Comedy']",4.0
106916,American Hustle (2013),Crime|Drama,1800241,168672.0,"A conman and his seductive partner are forced to work for a wild FBI agent, who pushes them into a world of Jersey power-brokers and the Mafia.",6.856,7480,"['Drama', 'Crime']",4.0
106918,"Secret Life of Walter Mitty, The (2013)",Adventure|Comedy|Drama,359950,116745.0,A timid magazine photo manager who lives life vicariously through daydreams embarks on a true-life adventure when a negative goes missing.,7.206,7917,"['Adventure', 'Comedy', 'Drama', 'Fantasy']",3.5
106920,Her (2013),Drama|Romance|Sci-Fi,1798709,152601.0,"In the not so distant future, Theodore, a lonely writer, purchases a newly developed operating system designed to meet the user's every need. To Theodore's surprise, a romantic relationship develops between him and his operating system. This unconventional love story blends science fiction and romance in a sweet tale that explores the nature of love and the ways that technology isolates and connects us all.",7.846,14774,"['Romance', 'Science Fiction', 'Drama']",4.0
106983,Young & Beautiful (2013),Drama,2752200,184314.0,"Isabelle, a 17-year-old student, loses her virginity during a quick holiday romance. When she returns home, she begins a secret life as a prostitute for a year.",6.506,1275,['Drama'],4.0
108729,Enemy (2013),Mystery|Thriller,2316411,181886.0,A mild-mannered college professor discovers a look-alike actor and delves into the other man's private affairs.,6.854,6152,"['Thriller', 'Mystery']",3.5
108932,The Lego Movie (2014),Action|Adventure|Animation|Children|Comedy|Fantasy,1490017,137106.0,"An ordinary Lego mini-figure, mistakenly thought to be the extraordinary MasterBuilder, is recruited to join a quest to stop an evil Lego tyrant from conquering the universe.",7.421,8147,"['Animation', 'Family', 'Adventure', 'Comedy', 'Fantasy']",4.0
108981,Nymphomaniac: Volume II (2013),Drama|Mystery,2382009,249397.0,The continuation of Joe's sexually dictated life delves into the darker aspects of her adult life and what led to her being in Seligman's care.,6.712,3020,"['Drama', 'Mystery']",4.0
109374,"Grand Budapest Hotel, The (2014)",Comedy|Drama,2278388,120467.0,"The Grand Budapest Hotel tells of a legendary concierge at a famous European hotel between the wars and his friendship with a young employee who becomes his trusted protégé. The story involves the theft and recovery of a priceless Renaissance painting, the battle for an enormous family fortune and the slow and then sudden upheavals that transformed Europe during the first half of the 20th century.",8.0,15427,"['Comedy', 'Drama']",3.5
109487,Interstellar (2014),Sci-Fi|IMAX,816692,157336.0,The adventures of a group of explorers who make use of a newly discovered wormhole to surpass the limitations on human space travel and conquer the vast distances involved in an interstellar voyage.,8.461,37933,"['Adventure', 'Drama', 'Science Fiction']",4.0
109981,Such Good Friends (1971),Comedy|Drama,67801,118915.0,"Julie Messinger, a repressed woman, grapples with her hidden passions when a routine hospital visit for her husband, Richard, spirals into chaos. As secrets unravel, her quest for authenticity clashes with societal expectations.",5.1,10,"['Comedy', 'Drama']",4.0
111661,"Two Faces of January, The (2014)",Thriller,1976000,192149.0,"1962. A con artist, his wife, and a dangerous stranger are caught up in the murder of a private detective and are forced to try and escape Athens.",5.8,703,['Thriller'],3.5
111759,Edge of Tomorrow (2014),Action|Sci-Fi|IMAX,1631867,137113.0,"Major Bill Cage is an officer who has never seen a day of combat when he is unceremoniously demoted and dropped into combat. Cage is killed within minutes, managing to take an alpha alien down with him. He awakens back at the beginning of the same day and is forced to fight and die again... and again - as physical contact with the alien has thrown him into a time loop.",7.632,14446,"['Action', 'Science Fiction']",3.0
112138,22 Jump Street (2014),Action|Comedy|Crime,2294449,187017.0,"After making their way through high school (twice), big changes are in store for officers Schmidt and Jenko when they go deep undercover at a local college. But when Jenko meets a kindred spirit on the football team, and Schmidt infiltrates the bohemian art major scene, they begin to question their partnership. Now they don't have to just crack the case - they have to figure out if they can have a mature relationship. If these two overgrown adolescents can grow from freshmen into real men, college might be the best thing that ever happened to them.",6.831,8204,"['Crime', 'Comedy', 'Action']",4.0
112183,Birdman: Or (The Unexpected Virtue of Ignorance) (2014),Comedy|Drama,2562232,194662.0,"A fading actor best known for his portrayal of a popular superhero attempts to mount a comeback by appearing in a Broadway play. As opening night approaches, his attempts to become more altruistic, rebuild his career, and reconnect with friends and family prove more difficult than expected.",7.451,13178,"['Drama', 'Comedy']",4.0
112290,Boyhood (2014),Drama,1065073,85350.0,"The film tells a story of a divorced couple trying to raise their young son. The story follows the boy for twelve years, from first grade at age 6 through 12th grade at age 17-18, and examines his relationship with his parents as he grows.",7.5,5329,['Drama'],4.5
112421,Frank (2014),Comedy|Drama|Mystery,1605717,171372.0,A young wannabe musician discovers he has bitten off more than he can chew when he joins an eccentric pop band led by the mysterious and enigmatic Frank.,6.9,1659,"['Comedy', 'Drama', 'Mystery']",4.0
112450,They Came Together (2014),Comedy|Romance,2398249,180296.0,A small business owner is about to lose her shop to a major corporate development.,5.6,423,['Comedy'],4.5
112556,Gone Girl (2014),Drama|Thriller,2267998,210577.0,"With his wife's disappearance having become the focus of an intense media circus, a man sees the spotlight turned on him when it's suspected that he may not be innocent.",7.89,19293,"['Mystery', 'Thriller', 'Drama']",4.0
113064,"Trip to Italy, The (2014)",Comedy|Drama,2967006,242088.0,"Years after their successful restaurant review tour of Northern England, Steve Coogan and Rob Brydon are commissioned for a new tour in Italy.",6.325,249,"['Comedy', 'Drama']",4.0
113240,Winter Sleep (Kis Uykusu) (2014),Drama,2758880,265169.0,"Aydın is a hotel owner and a retired actor in rural Turkey. As winter emerges he begins navigating the conflicts within the relationships with his wife, sister and existence.",7.542,589,['Drama'],4.5
113705,"Two Days, One Night (Deux jours, une nuit) (2014)",Drama,2737050,221902.0,Sandra is a young woman who has only one weekend to convince her colleagues they must give up their bonuses in order for her to keep her job — not an easy task in this economy.,6.9,971,['Drama'],4.0
115569,Nightcrawler (2014),Crime|Drama|Thriller,2872718,242582.0,"When Lou Bloom, desperate for work, muscles into the world of L.A. crime journalism, he blurs the line between observer and participant to become the star of his own story. Aiding him in his effort is Nina, a TV-news veteran.",7.705,11245,"['Crime', 'Drama', 'Thriller']",3.5
115713,Ex Machina (2015),Drama|Sci-Fi|Thriller,470752,264660.0,"Caleb, a coder at the world's largest internet company, wins a competition to spend a week at a private mountain retreat belonging to Nathan, the reclusive CEO of the company. But when Caleb arrives at the remote location he finds that he will have to participate in a strange and fascinating experiment in which he must interact with the world's first true artificial intelligence, housed in the body of a beautiful robot girl.",7.573,13724,"['Drama', 'Science Fiction']",4.0
117517,Listen Up Philip (2014),Drama,3093546,251736.0,"Anger rages in Philip as he awaits the publication of his second novel. He feels pushed out of his adopted home city by the constant crowds and noise, a deteriorating relationship with his photographer girlfriend Ashley, and his own indifference to promoting the novel. When Philip's idol Ike Zimmerman offers his isolated summer home as a refuge, he finally gets the peace and quiet to focus on his favorite subject: himself.",5.84,147,"['Comedy', 'Drama']",3.0
117881,Still Alice (2014),Drama,3316960,284293.0,"Alice Howland, happily married with three grown children, is a renowned linguistics professor who starts to forget words. When she receives a devastating diagnosis, Alice and her family find their bonds tested.",7.475,3170,['Drama'],4.0
118246,Clouds of Sils Maria (2014),Drama,2452254,246860.0,A veteran actress comes face-to-face with an uncomfortable reflection of herself when she agrees to take part in a revival of the play that launched her career 20 years earlier.,6.595,778,['Drama'],4.0
118898,A Most Violent Year (2014),Action|Crime|Drama|Thriller,2937898,241239.0,"A thriller set in New York City during the winter of 1981, statistically one of the most violent years in the city's history, and centered on the lives of an immigrant and his family trying to expand their business and capitalize on opportunities as the rampant violence, decay, and corruption of the day drag them in and threaten to destroy all they have built.",6.605,1471,"['Crime', 'Drama', 'Thriller']",4.0
119141,The Interview (2014),Action|Comedy,2788710,228967.0,"Dave Skylark and his producer Aaron Rapaport run the celebrity tabloid show ""Skylark Tonight"". When they land an interview with a surprise fan, North Korean dictator Kim Jong-un, they are recruited by the CIA to turn their trip to Pyongyang into an assassination mission.",6.2,6003,"['Action', 'Comedy']",3.0
121169,The Duke of Burgundy (2014),Drama,2570858,250225.0,"Day in and day out, lovers Cynthia and Evelyn enact an elaborate sadomasochistic fantasy as mistress and maid. But as their ritual of domination and submission begins to turn stale, Cynthia yearns for something more conventional, while Evelyn tries to push their taboos even further.",6.3,349,"['Drama', 'Mystery', 'Romance']",4.0
122886,Star Wars: Episode VII - The Force Awakens (2015),Action|Adventure|Fantasy|Sci-Fi|IMAX,2488496,140607.0,"Thirty years after defeating the Galactic Empire, Han Solo and his allies face a new threat from the evil Kylo Ren and his army of Stormtroopers.",7.256,19980,"['Adventure', 'Action', 'Science Fiction']",3.5
122900,Ant-Man (2015),Action|Adventure|Sci-Fi,478970,102899.0,"Armed with the astonishing ability to shrink in scale but increase in strength, master thief Scott Lang must embrace his inner-hero and help his mentor, Doctor Hank Pym, protect the secret behind his spectacular Ant-Man suit from a new generation of towering threats. Against seemingly insurmountable obstacles, Pym and Lang must plan and pull off a heist that will save the world.",7.1,20333,"['Science Fiction', 'Action', 'Adventure']",3.0
122904,Deadpool (2016),Action|Adventure|Comedy|Sci-Fi,1431045,293660.0,"The origin story of former Special Forces operative turned mercenary Wade Wilson, who, after being subjected to a rogue experiment that leaves him with accelerated healing powers, adopts the alter ego Deadpool. Armed with his new abilities and a dark, twisted sense of humor, Deadpool hunts down the man who nearly destroyed his life.",7.623,31944,"['Action', 'Adventure', 'Comedy']",3.0
122910,Captain Marvel (2018),Action|Adventure|Sci-Fi,4154664,299537.0,"The story follows Carol Danvers as she becomes one of the universe’s most powerful heroes when Earth is caught in the middle of a galactic war between two alien races. Set in the 1990s, Captain Marvel is an all-new adventure from a previously unseen period in the history of the Marvel Cinematic Universe.",6.793,16268,"['Action', 'Adventure', 'Science Fiction']",3.0
122940,Clear History (2013),Comedy,2279864,133790.0,"Nathan Flomm, in order to avoid the humiliation of having missed out on a hugely successful business, assumes a new identity on Martha's Vineyard. He plots revenge when his former business partner moves to the same town.",6.036,266,"['Comedy', 'TV Movie']",3.0
126775,The Blue Room (2014),Crime,3230082,266034.0,"In their blue hotel room, a clandestine couple of two married lovers plan an impossible future, as death shutters their already frail tranquillity. Now, the noose tightens more and more around innocents and sinners; but, was there a crime?",6.034,134,"['Crime', 'Romance', 'Thriller']",3.5
127116,Experimenter (2015),Drama,3726704,309299.0,"Yale University, 1961. Stanley Milgram designs a psychology experiment that still resonates to this day, in which people think they’re delivering painful electric shocks to an affable stranger strapped into a chair in another room. Despite his pleads for mercy, the majority of subjects don’t stop the experiment, administering what they think is a near-fatal electric shock, simply because they’ve been told to do so. With Nazi Adolf Eichmann’s trial airing in living rooms across America, Milgram strikes a nerve in popular culture and the scientific community with his exploration into people’s tendency to comply with authority. Celebrated in some circles, he is also accused of being a deceptive, manipulative monster, but his wife Sasha stands by him through it all.",6.489,471,"['Drama', 'History']",3.5
127260,The Things of Life (1970),Drama|Romance,64165,3423.0,"The mind of Pierre Bérard, a successful middle-aged architect, is torn between his unstable present with Hélène, his younger lover, and his happy memories of the past with Catherine, his ex-wife; but his true destiny awaits him at a crossroads on his way to Rennes…",7.112,240,"['Drama', 'Romance']",4.0
