movieId,title,genres,imdbId,tmdbId,overview,tmdb_vote_average,tmdb_vote_count,tmdb_genres,rating
31963,Bed & Board (Domicile conjugal) (1970),Comedy|Drama,65651,258.0,"Parisian everyman Antoine Doinel has married his sweetheart Christine Darbon, and the newlyweds have set up a cozy domestic life of selling flowers and giving violin lessons while Antoine fitfully works on his long-gestating novel. As Christine becomes pregnant with the couple's first child, Antoine finds himself enraptured with a young Japanese beauty. The complications change the course of their relationship forever.",7.113,296,"['Comedy', 'Drama', 'Romance']",4.0
32291,Melinda and Melinda (2004),Comedy|Drama,378947,9688.0,"While dining out with friends, Sy suggests the difficulty of separating comedy from tragedy. To illustrate his point, he tells his guests two parallel stories about Melinda ; both versions have the same basic elements, but one take on her state of affairs leans toward levity, while the other is full of anguish. Each story involves Melinda coping with a recent divorce through substance abuse while beginning a romantic relationship with a close friend's husband.",6.19,478,"['Comedy', 'Drama', 'Romance']",3.0
32509,This Sporting Life (1963),Drama,57578,18774.0,"In Northern England in the early 1960s, Frank Machin is mean, tough and ambitious enough to become an immediate star in the rugby league team run by local employer Weaver.",7.0,113,['Drama'],3.5
32525,The Earrings of Madame de... (1953),Drama|Romance,46022,27030.0,"In late 19th century France, the Countess Louise, wife of a wealthy general, sells the earrings her husband gave her on their wedding day to pay off her secret debts, then claims to have lost them. Her husband quickly learns of the deceit, which is the beginning of many tragic misunderstandings, all involving the earrings, the general, the countess, and her new lover, the Italian Baron Donati.",7.502,245,"['Drama', 'Romance']",4.0
32649,"Special Day, A (Giornata particolare, Una) (1977)",Drama|War,76085,42229.0,Two neighbours — a persecuted journalist and a resigned housewife — forge a strong bond on the day of Adolf Hitler's historic 1938 visit to Rome.,8.056,717,"['Drama', 'Romance']",4.5
32792,"Red Desert (Deserto rosso, Il) (1964)",Drama,58003,26638.0,"In an industrializing Italian town, a married woman, rendered mentally unstable after a traffic accident, drifts into an affair with a friend of her husband.",7.381,477,['Drama'],4.0
32892,Ivan's Childhood (a.k.a. My Name is Ivan) (Ivanovo detstvo) (1962),Drama|War,56111,31442.0,"In WW2, twelve year old Soviet orphan Ivan Bondarev works for the Soviet army as a scout behind the German lines and strikes a friendship with three sympathetic Soviet officers.",7.828,783,"['Drama', 'War']",4.5
33288,Kes (1969),Drama,64541,13384.0,"Bullied at school and ignored and abused at home by his indifferent mother and older brother, Billy Casper, a 15-year-old working-class Yorkshire boy, tames and trains his pet kestrel falcon whom he names Kes. Helped and encouraged by his English teacher and his fellow students, Billy finally finds a positive purpose to his unhappy existence.",7.459,410,['Drama'],4.5
33564,Divorce - Italian Style (Divorzio all'italiana) (1961),Comedy,55913,20271.0,"Ferdinando Cefalù is desperate to marry his cousin, Angela, but he is married to Rosalia and divorce is illegal in Italy. To get around the law, he tries to trick his wife into having an affair so he can catch her and murder her, as he knows he would be given a light sentence for killing an adulterous woman. He persuades a painter to lure his wife into an affair, but Rosalia proves to be more faithful than he expected.",7.901,500,"['Comedy', 'Crime']",4.0
33767,Good Neighbor Sam (1964),Comedy,58153,3011.0,"To help his divorced neighbor claim a substantial inheritance, a family man poses as her husband. The ruse spills over into his career in advertising, and his recent promotion relies on his wholesome and moral appearance.",6.582,49,['Comedy'],4.0
33794,Batman Begins (2005),Action|Crime|IMAX,372784,272.0,"Driven by tragedy, billionaire Bruce Wayne dedicates his life to uncovering and defeating the corruption that plagues his home, Gotham City.  Unable to work within the system, he instead creates a new identity, a symbol of fear for the criminal underworld - The Batman.",7.717,21820,"['Drama', 'Crime', 'Action']",4.0
33817,My Summer of Love (2004),Drama|Romance,382189,9709.0,"In the Yorkshire countryside, working-class tomboy Mona meets the exotic, pampered Tamsin. To seal their friendship, Mona introduces Tamsin to her born-again Christian brother and helps her spy on her adulterous father. Bound together by their secrets, the two girls see their friendship deepen and enter into dangerous waters.",6.165,297,"['Drama', 'Romance']",4.0
33880,Me and You and Everyone We Know (2005),Comedy|Drama,415978,1382.0,"Single dad Richard meets Christine, a starving artist who moonlights as a cabbie. They awkwardly attempt to start a romance, but Richard’s divorce has left him emotionally damaged. Meanwhile, Richard’s sons—one a teenager, the other 6-years-old—take part in clumsy experiments with the opposite sex.",7.0,352,"['Comedy', 'Drama']",0.5
33945,"New Land, The (Nybyggarna) (1972)",Drama|Western,69035,42488.0,"A Swedish immigrant family struggles to adapt to their new life on the American frontier during the second half of the 19th century amidst civil war, native uprising and the lure of gold in California.",7.6,98,"['Drama', 'Western', 'History']",4.0
34162,Wedding Crashers (2005),Comedy|Romance,396269,9522.0,"John and his buddy, Jeremy are emotional criminals who know how to use a woman's hopes and dreams for their own carnal gain. Their modus operandi: crashing weddings. Normally, they meet guests who want to toast the romantic day with a random hook-up. But when John meets Claire, he discovers what true love – and heartache – feels like.",6.493,4518,"['Comedy', 'Romance']",4.0
34437,Broken Flowers (2005),Comedy|Drama,412019,308.0,Introverted Don Johnston receives an anonymous letter from an ex-lover informing him that he has a son who may be looking for him. A freelance sleuth neighbor motivates Don to embark on a cross-country search for his past flames seeking answers.,6.92,1405,"['Comedy', 'Drama', 'Mystery', 'Romance']",4.0
35836,"40-Year-Old Virgin, The (2005)",Comedy|Romance,405422,6957.0,"Andy Stitzer has a pleasant life with a nice apartment and a job stamping invoices at an electronics store. But at age 40, there's one thing Andy hasn't done, and it's really bothering his sex-obsessed male co-workers: Andy is still a virgin. Determined to help Andy get laid, the guys make it their mission to de-virginize him. But it all seems hopeless until Andy meets small business owner Trish, a single mom.",6.413,6947,"['Comedy', 'Romance']",4.0
36276,Hidden (a.k.a. Cache) (Caché) (2005),Drama|Mystery|Thriller,387898,445.0,"George, host of a television show focusing on literature, receives videos shot on the sly that feature his family, along with disturbing drawings that are difficult to interpret. He has no idea who has made and sent him the videos. Progressively, the contents of the videos become more personal, indicating that the sender has known George for a long time.",7.055,1176,"['Mystery', 'Drama', 'Thriller']",4.5
36517,"Constant Gardener, The (2005)",Drama|Thriller,387131,1985.0,"Justin Quayle is a low-level British diplomat who has always gone about his work very quietly, not causing any problems. But after his radical wife Tessa is killed he becomes determined to find out why, thrusting himself into the middle of a very dangerous conspiracy.",7.008,1601,"['Drama', 'Mystery', 'Thriller']",4.0
37733,"History of Violence, A (2005)",Action|Crime|Drama|Thriller,399146,59.0,An average family is thrust into the spotlight after the father commits a seemingly self-defense murder at his diner.,7.161,3485,"['Drama', 'Thriller', 'Crime']",4.5
38159,"Short Film About Love, A (Krótki film o milosci) (1988)",Drama|Romance,95467,31056.0,"19-year-old Tomek whiles away his lonely life by spying on his opposite neighbour Magda through binoculars. She's an artist in her mid-thirties, and appears to have everything - not least a constant stream of men at her beck and call. But when the two finally meet, they discover that they have a lot more in common than appeared at first sight...",7.782,393,"['Drama', 'Romance']",4.5
39941,"Love on the Run (Amour en fuite, L') (1979)",Comedy|Drama|Romance,78771,259.0,"Antoine is now 30, working as a proofreader and getting divorced from his wife. It's the first ""no-fault"" divorce in France and a media circus erupts, dredging up Antoine's past. Indecisive about his new love with a store clerk, he impulsively takes off with an old flame.",7.0,205,"['Romance', 'Drama', 'Comedy']",3.0
41285,Match Point (2005),Crime|Drama|Romance,416320,116.0,"Chris, a former tennis pro, takes a job as an instructor and befriends his wealthy young student, Tom. After being introduced to his family, Chris is soon engaged to Tom's sister, Chloe. Despite the professional and financial advantages that this relationship affords him, Chris becomes obsessed with Tom's fiancee, American actress Nola.",7.357,4209,"['Drama', 'Romance', 'Thriller']",4.5
42584,We All Loved Each Other So Much (C'eravamo tanto amati) (1974),Comedy|Drama,75793,42269.0,"Three partisans bound by a strong friendship return home after the war, but the clash with everyday reality puts a strain on their bond.",8.286,621,"['Drama', 'Comedy']",4.0
43460,Tristram Shandy: A Cock and Bull Story (2005),Comedy|Drama,423409,8435.0,"Steve Coogan, an arrogant actor with low self-esteem and a complicated love life, is playing the eponymous role in an adaptation of ""The Life and Opinions of Tristram Shandy, Gentleman"" being filmed at a stately home. He constantly spars with actor Rob Brydon, who is playing Uncle Toby and believes his role to be of equal importance to Coogan's.",6.2,142,"['Comedy', 'History']",4.0
43497,Love in the Afternoon (Chloe in the Afternoon)  (L'amour l'après-midi) (1972),Drama|Romance,68205,12116.0,"Frederic leads a bourgeois life; he is a partner in a small Paris office and is happily married to Helene, a teacher expecting her second child. In the afternoons, Frederic daydreams about other women, but has no intention of taking any action. One day, Chloe, who had been a mistress of an old friend, begins dropping by his office. They meet as friends, irregularly in the afternoons, till eventually Chloe decides to seduce Frederic, causing him a moral dilemma.",7.3,199,"['Drama', 'Romance']",4.0
43762,"Mississippi Mermaid (Sirène du Mississipi, La) (1969)",Crime|Drama|Romance,64990,1651.0,"A tobacco planter on Réunion island in the Indian Ocean becomes engaged through correspondence to a French woman he does not know. The woman that arrives does not look like the picture he received, but he marries her anyway.",6.6,208,"['Romance', 'Drama', 'Crime', 'Thriller']",3.0
44073,Stromboli (1950),Drama,41931,4173.0,"After the end of WWII, a young Lithuanian woman and a young Italian man from Stromboli impulsively marry, but married life on the island is more demanding than she can accept.",7.1,206,['Drama'],3.5
44124,Every Man for Himself (Slow Motion) (Sauve qui peut (la vie)) (1980),Drama,79854,113479.0,"A look at the sexual and professional lives of three people — a television director, his ex-girlfriend, and a sex worker.",6.2,74,['Drama'],4.0
44195,Thank You for Smoking (2006),Comedy|Drama,427944,9388.0,"Nick Naylor is a charismatic spin-doctor for Big Tobacco who'll fight to protect America's right to smoke -- even if it kills him -- while still remaining a role model for his 12-year old son. When he incurs the wrath of a senator bent on snuffing out cigarettes, Nick's powers of ""filtering the truth"" will be put to the test.",7.19,2276,"['Comedy', 'Drama']",4.0
44199,Inside Man (2006),Crime|Drama|Thriller,454848,388.0,"When an armed, masked gang enter a Manhattan bank, lock the doors and take hostages, the detective assigned to effect their release enters negotiations preoccupied with corruption charges he is facing.",7.399,6064,"['Crime', 'Drama', 'Thriller']",4.5
44555,"Lives of Others, The (Das leben der Anderen) (2006)",Drama|Romance|Thriller,405094,582.0,"In 1984 East Berlin, dedicated Stasi officer Gerd Wiesler begins spying on a famous playwright and his actress-lover Christa-Maria. Wiesler becomes unexpectedly sympathetic to the couple, and faces conflicting loyalties when his superior takes a liking to Christa-Maria.",8.0,3888,"['Drama', 'Thriller']",5.0
44653,Money (L'argent) (1983),Crime|Drama,85180,42112.0,"A forged 500-franc note is passed from person to person and shop to shop, until it falls into the hands of a genuine innocent who doesn't see it for what it is—which will have devastating consequences on his life.",6.985,271,"['Crime', 'Drama']",4.0
44937,"Child, The (L'enfant) (2005)",Crime|Drama,456396,11490.0,"Bruno and Sonia, a young couple living off her benefit and the thefts committed by his gang, have a new source of money: their newborn son. The carefree Bruno, who until then had only cared about the here and now, must now learn to become a father.",7.1,267,['Drama'],4.0
45720,"Devil Wears Prada, The (2006)",Comedy|Drama,458352,350.0,"Andy moves to New York to work in the fashion industry. Her boss is extremely demanding, cruel and won't let her succeed if she doesn't fit into the high class elegant look of their magazine.",7.392,12524,"['Drama', 'Comedy']",3.0
45942,"Mother and the Whore, The (Maman et la putain, La) (1973)",Drama,70359,48693.0,"Aimless young Alexandre juggles his relationships with his girlfriend, Marie, and a casual lover named Veronika. Marie becomes increasingly jealous of Alexandre's fling with Veronika and as the trio continues their unsustainable affair, the emotional stakes get higher, leading to conflict and unhappiness.",7.399,188,"['Drama', 'Romance']",4.5
46578,Little Miss Sunshine (2006),Adventure|Comedy|Drama,449059,773.0,"A family loaded with quirky, colorful characters piles into an old van and road trips to California for little Olive to compete in a beauty pageant.",7.692,7479,"['Comedy', 'Drama']",4.0
46862,Orchestra Rehearsal (Prova d'orchestra) (1978),Drama,79759,47850.0,"An orchestra assembles for a rehearsal in an ancient chapel under the inquisitive eyes of a TV documentary crew, but an uprising breaks out.",6.7,115,"['Comedy', 'Drama', 'Music']",4.0
46970,Talladega Nights: The Ballad of Ricky Bobby (2006),Action|Comedy,415306,9718.0,"The fastest man on four wheels, Ricky Bobby is one of the greatest drivers in NASCAR history. A big, hairy American winning machine, Ricky has everything a dimwitted daredevil could want, a luxurious mansion, a smokin' hot wife and all the fast food he can eat. But Ricky's turbo-charged lifestyle hits an unexpected speed bump when he's bested by flamboyant Euro-idiot Jean Girard and reduced to a fear-ridden wreck.",6.366,1774,['Comedy'],3.5
46976,Stranger than Fiction (2006),Comedy|Drama|Fantasy|Romance,420223,1262.0,Harold Crick is a lonely IRS agent whose mundane existence is transformed when he hears a mysterious voice narrating his life.,7.282,2393,"['Comedy', 'Drama', 'Fantasy', 'Romance']",4.0
47423,Half Nelson (2006),Drama,468489,7859.0,"Despite his dedication to the junior-high students who fill his classroom, idealistic teacher Dan Dunne leads a secret life of addiction that the majority of his students will never know. But things change when a troubled student Drey makes a startling discovery of his secret life, causing a tenuous bond between the two that could either end disastrously or provide a catalyst of hope.",6.645,903,['Drama'],4.0
47894,"Wind That Shakes the Barley, The (2006)",Drama|War,460989,1116.0,"In 1920s Ireland young doctor Damien O'Donovan prepares to depart for a new job in a London hospital. As he says his goodbyes at a friend's farm, British Black and Tans arrive, and a young man is killed. Damien joins his brother Teddy in the Irish Republican Army, but political events are soon set in motion that tear the brothers apart.",7.351,847,"['Drama', 'War']",4.5
47904,"Notti bianche, Le (White Nights) (1957)",Drama|Romance,50782,43231.0,A middle-aged man meets a young woman who is waiting on a canal bridge for her lover's return.,7.466,236,"['Drama', 'Romance']",4.0
47997,Idiocracy (2006),Adventure|Comedy|Sci-Fi|Thriller,387808,7512.0,"To test its top-secret Human Hibernation Project, the Pentagon picks the most average Americans it can find - an Army private and a prostitute - and sends them to the year 2505 after a series of freak events. But when they arrive, they find a civilization so dumbed-down that they're the smartest people around.",6.351,3261,"['Comedy', 'Science Fiction', 'Adventure']",4.5
48165,"Seventh Continent, The (Der siebente Kontinent) (1989)",Drama,98327,32761.0,"Chronicles three years of a middle-class family seemingly caught up in their daily routines, troubled only by minor incidents. Behind their apparent calm and repetitive existence, however, they're planning something much more sinister.",7.474,333,['Drama'],3.5
48342,Conversations with Other Women (2005),Comedy|Drama|Romance,435623,15624.0,"Reunited at a wedding after many years, former lovers again feel the pull of a mutual attraction neither is willing to admit. Escaping the reception for the privacy of a hotel room, the unnamed pair explore the choices of the past that led them to the present.",6.3,169,"['Drama', 'Romance']",4.0
48385,Borat: Cultural Learnings of America for Make Benefit Glorious Nation of Kazakhstan (2006),Comedy,443453,496.0,"Kazakh journalist Borat Sagdiyev travels to America to make a documentary. As he zigzags across the nation, Borat meets real people in real situations with hysterical consequences. His backwards behavior generates strong reactions around him exposing prejudices and hypocrisies in American culture.",6.783,5662,['Comedy'],4.5
48516,"Departed, The (2006)",Crime|Drama|Thriller,407887,1422.0,"To take down South Boston's Irish Mafia, the police send in one of their own to infiltrate the underworld, not realizing the syndicate has done likewise. While an undercover cop curries favor with the mob kingpin, a career criminal rises through the police ranks. But both sides soon discover there's a mole among them.",8.159,15563,"['Drama', 'Thriller', 'Crime']",5.0
48696,Little Children (2006),Drama|Romance,404203,1440.0,"The lives of two lovelorn spouses from separate marriages, a registered sex offender, and a disgraced ex-police officer intersect as they struggle to resist their vulnerabilities and temptations.",7.076,1072,"['Drama', 'Romance']",3.5
48774,Children of Men (2006),Action|Adventure|Drama|Sci-Fi|Thriller,206634,9693.0,"In 2027, in a chaotic world in which humans can no longer procreate, a former activist agrees to help transport a miraculously pregnant woman to a sanctuary at sea, where her child's birth may help scientists save the future of humankind.",7.6,7458,"['Drama', 'Action', 'Thriller', 'Science Fiction']",4.0
48780,"Prestige, The (2006)",Drama|Mystery|Sci-Fi|Thriller,482571,1124.0,"A mysterious story of two magicians whose intense rivalry leads them on a life-long battle for supremacy -- full of obsession, deceit and jealousy with dangerous and deadly consequences.",8.203,16826,"['Drama', 'Mystery', 'Science Fiction']",4.5
49272,Casino Royale (2006),Action|Adventure|Thriller,381061,36557.0,"Le Chiffre, a banker to the world's terrorists, is scheduled to participate in a high-stakes poker game in Montenegro, where he intends to use his winnings to establish his financial grip on the terrorist market. M sends Bond—on his maiden mission as a 00 Agent—to attend this game and prevent Le Chiffre from winning. With the help of Vesper Lynd and Felix Leiter, Bond enters the most important poker game in his already dangerous career.",7.565,11170,"['Adventure', 'Action', 'Thriller']",5.0
50229,"Young Girls of Rochefort, The (Demoiselles de Rochefort, Les) (1967)",Comedy|Musical|Romance,62873,2433.0,"Delphine and Solange are two sisters living in Rochefort. Delphine is a dancing teacher and Solange composes and teaches the piano. Maxence is a poet and a painter. He is doing his military service. Simon owns a music shop, he left Paris one month ago to come back where he fell in love 10 years ago. They are looking for love, looking for each other, without being aware that their ideal partner is very close...",7.7,631,"['Romance', 'Comedy', 'Drama']",4.5
50259,Old Joy (2006),Drama,468526,26518.0,"Soon to be a father, Mark feels the pressure of domestic responsibility closing in, so he is more than happy to accept when his old friend Kurt proposes a camping trip in the Oregon wilderness. During their time together, the men come to grips with the changes in their lives and the effect on their relationship.",6.3,185,['Drama'],4.0
50514,After the Wedding (Efter brylluppet) (2006),Drama,457655,3549.0,"A manager of an orphanage in India is sent to Copenhagen, Denmark, where he discovers a life-altering family secret.",7.133,450,['Drama'],5.0
50685,Waitress (2007),Comedy|Drama|Romance,473308,10758.0,A small town waitress stuck in a lousy marriage finds love when an exciting out-of-towner enters her life.,6.7,545,"['Drama', 'Comedy', 'Romance']",4.0
50872,Ratatouille (2007),Animation|Children|Drama,382932,2062.0,"Remy, a resident of Paris, appreciates good food and has quite a sophisticated palate. He would love to become a chef so he can create and enjoy culinary masterpieces to his heart's delight. The only problem is, Remy is a rat. When he winds up in the sewer beneath one of Paris' finest restaurants, the rodent gourmet finds himself ideally placed to realize his dream.",7.832,17816,"['Animation', 'Comedy', 'Family', 'Fantasy']",4.5
50898,Lola (1961),Drama|Romance,55093,40641.0,"A bored young man meets with his former girlfriend, now a cabaret dancer and single mother, and soon finds himself falling back in love with her.",7.101,283,"['Drama', 'Romance']",4.5
51255,Hot Fuzz (2007),Action|Comedy|Crime|Mystery,425112,4638.0,"Former London constable Nicholas Angel finds it difficult to adapt to his new assignment in the sleepy British village of Sandford. Not only does he miss the excitement of the big city, but he also has a well-meaning oaf for a partner. However, when a series of grisly accidents rocks Sandford, Angel smells something rotten in the idyllic village.",7.562,7936,"['Crime', 'Action', 'Comedy']",4.5
51312,"Consequences of Love, The (Conseguenze dell'amore, Le) (2004)",Crime|Drama,398883,24653.0,"Lugano, Switzerland. Titta Di Girolamo is a discreet and sullen man who has been living for almost a decade in a modest hotel room, a prisoner of an atrocious routine, apparently without purpose. His past is a mystery, nobody knows what he does for a living, he answers indiscreet questions evasively. What secrets does this enigmatic man hide?",7.555,869,"['Drama', 'Thriller']",4.0
51540,Zodiac (2007),Crime|Drama|Thriller,443706,1949.0,"The Zodiac murders cause the lives of Paul Avery, David Toschi and Robert Graysmith to intersect.",7.528,11056,"['Crime', 'Mystery', 'Thriller']",4.0
52495,Straight Time (1978),Crime|Drama,78326,23397.0,"After being released on parole, a burglar attempts to go straight, get a regular job, and just go by the rules. He soon finds himself back in jail at the hands of a power-hungry parole officer.",7.1,185,"['Crime', 'Drama']",4.0
52973,Knocked Up (2007),Comedy|Drama|Romance,478311,4964.0,"A slacker and a career-driven woman accidentally conceive a child after a one-night stand. As they try to make the relationship work, they must navigate the challenges of parenthood and their differences in lifestyle and maturity.",6.298,4098,"['Comedy', 'Romance', 'Drama']",3.5
53318,Cashback (2006),Comedy|Drama|Romance,460740,12225.0,"After a painful breakup, Ben develops insomnia. To kill time, he starts working the late night shift at the local supermarket, where his artistic imagination runs wild.",6.961,1313,"['Drama', 'Comedy', 'Romance']",0.5
53835,Journey to Italy (Viaggio in Italia) (Voyage to Italy) (Voyage in Italy) (1954),Drama|Romance,46511,2748.0,"Married for eight years with no children, Brits Katherine and Alex Joyce are driving to Italy, their ultimate destination just outside of Naples to sell the villa they have just inherited from his uncle, the villa where they will be staying during their time there. On the drive, they come to the realization that this trip marks the first time that they have truly been alone together, and as such don't really know one another in the true sense.",7.3,308,"['Drama', 'Romance']",4.5
53956,Death at a Funeral (2007),Comedy,795368,2196.0,A myriad of outrageous calamities befalls an eccentric English clan with more than a few skeletons in its closets when the family's patriarch dies an unexpected death.,6.9,1827,"['Comedy', 'Drama']",4.0
54256,Hot Rod (2007),Comedy,787475,10074.0,"For Rod Kimble, performing stunts is a way of life, even though he is rather accident-prone. Poor Rod cannot even get any respect from his stepfather, Frank, who beats him up in weekly sparring matches. When Frank falls ill, Rod devises his most outrageous stunt yet to raise money for Frank's operation -- and then Rod will kick Frank's butt.",6.398,1034,"['Comedy', 'Action']",3.0
