movieId,title,genres,imdbId,tmdbId,overview,tmdb_vote_average,tmdb_vote_count,tmdb_genres,rating
6323,Identity (2003),Crime|Horror|Mystery|Thriller,309698,2832.0,"Complete strangers stranded at a remote desert motel during a raging storm soon find themselves the target of a deranged murderer. As their numbers thin out, the travelers begin to turn on each other, as each tries to figure out who the killer is.",7.176,4092,"['Mystery', 'Thriller']",3.5
6476,Shattered (1991),Mystery|Thriller,102900,2071.0,Dan Merrick comes out from a shattering car accident with amnesia. He finds that he is married to Judith who is trying to help him start his life again. He keeps getting flashbacks about events and places that he can't remember. He meets pet shop owner and part time private detective Gus Klein who has supposedly done some work for him prior to the accident. Klein helps Merrick to find out more...,6.1,210,"['Mystery', 'Thriller']",4.0
6502,28 Days Later (2002),Action|Horror|Sci-Fi,289043,170.0,"Twenty-eight days after a killer virus was accidentally unleashed from a British research facility, a small group of London survivors are caught in a desperate struggle to protect themselves from the infected. Carried by animals and humans, the virus turns those it infects into homicidal maniacs -- and it's absolutely impossible to contain.",7.235,7848,"['Horror', 'Thriller', 'Science Fiction']",2.5
6538,Swimming Pool (2003),Drama|Mystery|Thriller,324133,302.0,"A British crime novelist travels to her publisher's upmarket summer house in Southern France to seek solitude in order to work on her next book. However, the unexpected arrival of the publisher's daughter induces complications and a subsequent crime.",6.484,744,"['Crime', 'Thriller']",3.0
6639,Wait Until Dark (1967),Drama|Thriller,62467,11206.0,"After a flight back home, Sam Hendrix returns with a doll he innocently acquired along the way. As it turns out, the doll is actually stuffed with heroin, and a group of criminals led by the ruthless Roat has followed Hendrix back to his place to retrieve it. When Hendrix leaves for business, the crooks make their move -- and find his blind wife, Susy, alone in the apartment. Soon, a life-threatening game begins between Susy and the thugs.",7.344,564,"['Thriller', 'Horror']",2.5
6695,Jeepers Creepers 2 (2003),Horror|Thriller,301470,11351.0,"When their bus is crippled on the side of a deserted road, a team of high school athletes discover an opponent they cannot defeat – and may not survive.",6.154,1728,['Horror'],2.0
6975,Funny Games (1997),Drama|Horror|Thriller,119167,10234.0,"Two psychotic young men take a mother, father, and son hostage in their vacation cabin and force them to play sadistic ""games"" with one another for their own amusement.",7.3,1941,"['Drama', 'Horror', 'Thriller']",4.0
6976,Tales from the Crypt (1972),Horror,69341,38939.0,"Five strangers encounter the mysterious Crypt Keeper while viewing old catacombs in the English countryside. Through a series of terrifying stories, each one learns their fate.",6.864,319,['Horror'],3.0
7001,Invasion of the Body Snatchers (1978),Horror|Mystery|Sci-Fi|Thriller,77745,11850.0,"The residents of San Francisco are becoming drone-like shadows of their former selves, and as the phenomenon spreads, two Department of Health workers uncover the horrifying truth.",7.2,1215,"['Science Fiction', 'Horror']",2.0
7013,"Night of the Hunter, The (1955)",Drama|Film-Noir|Thriller,48424,3112.0,"In Depression-era West Virginia, a serial-killing preacher hunts two young children who know the whereabouts of a stash of money.",7.873,1704,"['Crime', 'Drama', 'Thriller']",2.5
7040,To Live and Die in L.A. (1985),Action|Crime|Drama|Thriller,90180,9846.0,"When his longtime partner on the force is killed, reckless U.S. Secret Service agent Richard Chance vows revenge, setting out to nab dangerous counterfeit artist Eric Masters.",7.124,709,"['Crime', 'Thriller', 'Action']",2.0
7126,"Killing of a Chinese Bookie, The (1976)",Comedy|Crime|Drama|Film-Noir|Musical,74749,32040.0,"Cosmo Vittelli, the proprietor of a sleazy, low-rent Hollywood cabaret, has a real affection for the women who strip in his peepshows and the staff who keep up his dingy establishment. He also has a major gambling problem that has gotten him in trouble before. When Cosmo loses big-time at an underground casino run by mobster Mort, he isn't able to pay up. Mort then offers Cosmo the chance to pay back his debt by knocking off a pesky, Mafia-protected bookie.",7.081,273,"['Thriller', 'Crime', 'Drama']",2.0
7254,The Butterfly Effect (2004),Drama|Sci-Fi|Thriller,289879,1954.0,"A young man struggles to access sublimated childhood memories. He finds a technique that allows him to travel back into the past, to occupy his childhood body and change history. However, he soon finds that every change he makes has unexpected consequences.",7.573,7853,"['Science Fiction', 'Thriller']",4.5
7318,"Passion of the Christ, The (2004)",Drama,335345,615.0,A graphic portrayal of the last twelve hours of Jesus of Nazareth's life.,7.517,4923,['Drama'],3.5
7382,I'm Not Scared (Io non ho paura) (2003),Drama|Mystery|Thriller,326977,25300.0,"In a tiny community enclosed by wheat fields, the adults shelter indoors, while six children venture out on their bikes across the scorched, deserted countryside. Exploring a dilapidated and uninhabited farmhouse, nine-year-old Michele discovers a secret so momentous, so terrible, that he dares not tell anyone about it …",7.115,944,"['Mystery', 'Drama', 'Thriller', 'Crime']",2.0
7445,Man on Fire (2004),Action|Crime|Drama|Mystery|Thriller,328107,9509.0,"Jaded ex-CIA operative John Creasy reluctantly accepts a job as the bodyguard for a 10-year-old girl in Mexico City. They clash at first, but eventually bond, and when she's kidnapped he's consumed by fury and will stop at nothing to save her life.",7.456,5376,"['Action', 'Drama', 'Thriller']",3.0
7454,Van Helsing (2004),Action|Adventure|Fantasy|Horror,338526,7131.0,Famed monster slayer Gabriel Van Helsing is dispatched to Transylvania to assist the last of the Valerious bloodline in defeating Count Dracula. Anna Valerious reveals that Dracula has formed an unholy alliance with Dr. Frankenstein's monster and is hell-bent on exacting a centuries-old curse on her family.,6.384,6283,"['Horror', 'Adventure', 'Action']",1.5
7939,Through a Glass Darkly (Såsom i en spegel) (1961),Drama,55499,11602.0,"Karin hopes to recover from her recent stay at a mental hospital by spending the summer at her family's cottage on a tiny island. Her husband, Martin, cares for her but is frustrated by her physical withdrawal. Her younger brother, Minus, is confused by Karin's vulnerability and his own budding sexuality. Their father, David, cannot overcome his haughty remoteness. Beset by visions, Karin descends further into madness.",7.774,514,['Drama'],2.5
7982,"Tale of Two Sisters, A (Janghwa, Hongryeon) (2003)",Drama|Horror|Mystery|Thriller,365376,4552.0,"Two sisters return home after a stay in a mental institution, only to face disturbing events and a strained relationship with their stepmother. As eerie occurrences unfold, dark family secrets begin to surface, blurring the line between reality and nightmare.",7.1,1258,"['Drama', 'Horror', 'Mystery']",4.0
7987,Dolls (1987),Horror,92906,24341.0,"A precocious girl, her nasty parents, two punk-rock losers and a weak-kneed salesman inadvertently become the guests of two ghoulish senior citizens in their dark, haunted mansion.",6.42,345,"['Fantasy', 'Horror']",3.0
8019,Dark Water (Honogurai mizu no soko kara) (2002),Drama|Horror|Mystery|Thriller,308379,12205.0,A woman in the midst of an unpleasant divorce moves to an eerie apartment building with her young daughter. The ceiling of their apartment has a dark and active leak.,6.811,657,"['Horror', 'Mystery', 'Thriller']",4.0
8261,3 Women (Three Women) (1977),Drama,75612,41662.0,"Two co-workers, one a vain woman and the other an awkward teenager, share an increasingly bizarre relationship after becoming roommates.",7.2,311,['Drama'],2.0
8340,Escape from Alcatraz (1979),Drama|Thriller,79116,10734.0,"San Francisco Bay, January 18, 1960. Frank Lee Morris is transferred to Alcatraz, a maximum security prison located on a rocky island. Although no one has ever managed to escape from there, Frank and other inmates begin to carefully prepare an escape plan.",7.511,2982,"['Drama', 'Thriller']",4.0
8361,"Day After Tomorrow, The (2004)",Action|Adventure|Drama|Sci-Fi|Thriller,319262,435.0,"After paleoclimatologist Jack Hall is largely ignored by UN officials when presenting his environmental concerns about the beginning of a new Ice Age, his research proves true when a superstorm develops, setting off catastrophic natural disasters throughout the world. Trying to get to his son, Sam, who is trapped in New York City with his friend Laura and others, Jack and his crew must travel to get to Sam before it's too late.",6.545,8489,"['Science Fiction', 'Thriller', 'Adventure']",2.0
8395,"Last of Sheila, The (1973)",Crime|Mystery|Thriller,70291,26331.0,"A year after Sheila is killed in a hit-and-run, her multimillionaire husband invites a group of friends to spend a week on his yacht playing a scavenger hunt-style mystery game — but the game turns out to be all too real and all too deadly.",7.0,151,"['Crime', 'Drama', 'Mystery', 'Thriller']",3.0
8405,Hour of the Wolf (Vargtimmen) (1968),Drama|Horror,63759,18333.0,"While vacationing on a remote German island with his younger pregnant wife, an artist has an emotional breakdown while confronting his repressed desires.",7.4,519,"['Drama', 'Horror']",5.0
8482,"Picture of Dorian Gray, The (1945)",Drama|Fantasy|Horror,37988,16559.0,"A corrupt young man somehow keeps his youthful beauty, but a special painting gradually reveals his inner ugliness to all.",7.123,281,"['Drama', 'Horror', 'Fantasy']",3.0
8501,"Hitcher, The (1986)",Action|Thriller,91209,9542.0,"On a stormy night, young Jim, who transports a luxury car from Chicago to California to deliver it to its owner, feeling tired and sleepy, picks up a mysterious hitchhiker, who has appeared out of nowhere, thinking that a good conversation will help him not to fall asleep. He will have enough time to deeply regret such an unmeditated decision.",6.956,992,"['Horror', 'Action', 'Thriller']",3.5
8645,"Maria Full of Grace (Maria, Llena eres de gracia) (2004)",Crime|Drama,390221,436.0,A pregnant Colombian teenager becomes a drug mule to make some desperately needed money for her family.,7.207,405,"['Drama', 'Thriller', 'Crime']",2.5
8798,Collateral (2004),Action|Crime|Drama|Thriller,369339,1538.0,Cab driver Max picks up a man who offers him $600 to drive him around. But the promise of easy money sours when Max realizes his fare is an assassin.,7.235,5934,"['Drama', 'Crime', 'Thriller']",4.0
8836,Wicker Park (2004),Drama|Romance|Thriller,324554,11208.0,"Matthew, a young advertising executive in Chicago, puts his life and a business trip to China on hold when he thinks he sees Lisa, the love of his life who left him without a word two years earlier, walking out of a restaurant one day.",6.831,711,"['Drama', 'Mystery', 'Romance', 'Thriller']",4.0
8870,"Forgotten, The (2004)",Drama|Mystery|Sci-Fi|Thriller,356618,10145.0,"Telly Paretta is a grieving mother struggling to cope with the loss of her 8-year-old son. She is stunned when her psychiatrist reveals that she has created eight years of memories about a son she never had. But when she meets a man who has had a similar experience, Telly embarks on a search to prove her son's existence, and her sanity.",5.9,1174,"['Thriller', 'Mystery', 'Science Fiction', 'Drama']",2.0
8901,Flashpoint (1984),Action|Adventure|Crime|Mystery|Thriller,87268,47825.0,"Two Texas border guards find a jeep buried in the desert, with a skeleton, a scoped rifle, and a box with $800,000 in cash. Before they decide whether to keep the money or report it, they privately investigate the clues and unravel a decades old mystery.",6.3,52,"['Action', 'Crime', 'Drama', 'Mystery', 'Thriller']",2.0
8957,Saw (2004),Horror|Mystery|Thriller,387564,176.0,"Two men wake up to find themselves shackled in a grimy, abandoned bathroom. As they struggle to comprehend their predicament, they discover a disturbing tape left behind by the sadistic mastermind known as Jigsaw. With a chilling voice and cryptic instructions, Jigsaw informs them that they must partake in a gruesome game in order to secure their freedom.",7.42,9662,"['Horror', 'Mystery', 'Crime']",3.0
26076,Scream of Fear (a.k.a. Taste of Fear) (1961),Horror|Mystery|Thriller,55505,64568.0,"A wheelchair-bound young girl returns to her father's estate after ten years, and although she's told he's away, she keeps seeing his dead body on the estate.",7.037,135,"['Thriller', 'Mystery', 'Horror']",3.0
26116,"Hush... Hush, Sweet Charlotte (1964)",Horror|Thriller,58213,10299.0,"An aging, reclusive Southern belle plagued by a horrifying family secret descends into madness after the arrival of a lost relative.",7.301,269,"['Horror', 'Mystery', 'Thriller']",3.0
26122,Onibaba (1964),Drama|Horror|War,58430,3763.0,"While her son, Kichi, is away at war, a woman and her daughter-in-law survive by killing samurai who stray into their swamp, then selling whatever valuables they find. Both are devastated when they learn that Kichi has died, but his wife soon begins an affair with a neighbor who survived the war, Hachi. The mother disapproves and, when she can't steal Hachi for herself, tries to scare her daughter-in-law with a mysterious mask from a dead samurai.",7.7,439,['Horror'],4.0
26349,Night Moves (1975),Crime|Thriller,73453,32042.0,"Private detective and former football player Harry Moseby gets hired on to what seems a standard missing person case - a former Hollywood actress wants Moseby to find and return her daughter. Harry travels to Florida to find her, but he begins to see a connection between the runaway girl, the world of Hollywood stuntmen, and a suspicious mechanic when an unsolved murder comes to light.",6.7,325,"['Mystery', 'Thriller', 'Crime']",2.5
26378,Who Can Kill a Child? (a.k.a. Island of the Damned) (¿Quién puede matar a un niño?) (1976),Horror|Mystery|Thriller,75462,43751.0,"A couple of English tourists arrive at the island of Almanzora, off the Spanish Mediterranean coast, where they discover that there are no adults in a small fishing village, only some children who stare at them and smile mysteriously.",7.038,260,"['Drama', 'Horror', 'Thriller']",3.5
26496,One Deadly Summer (L'été meurtrier) (1983),Comedy|Drama|Mystery,86655,9041.0,"In spring 1976, a 19-year-old beauty, her German-born mother, and her crippled father move to the town of a firefighter nicknamed Pin-Pon. Everyone notices the provocative Eliane. She singles out Pin-Pon and soon is crying on his shoulder (she's myopic and hates her reputation as a dunce and as easy); she moves in with him, knits baby clothes, and plans their wedding. Is this love or some kind of plot? She asks Pin-Pon's mother and aunt about the piano in the barn: who delivered it on a November night in 1955? Why does she want to know, and what does it have to do with her mother's sorrows, her father's injury, this quick marriage, and the last name on her birth certificate?",6.932,212,"['Mystery', 'Drama', 'Crime']",2.0
26663,Monsieur Hire (1989),Crime|Romance|Thriller,97904,38695.0,"A French man spies on a lovely younger woman across the way. When he's spotted by the woman shortly after being questioned by the police about a local murder, the man's simple life becomes more complicated.",7.288,166,"['Crime', 'Drama']",2.5
26875,"Pure Formality, A (Pura formalità, Una) (1994)",Crime|Film-Noir|Mystery|Thriller,110917,19223.0,"Onoff is a famous writer, now a recluse. The Inspector is suspicious when Onoff is brought into the station one night, disoriented and suffering a kind of amnesia. In an isolated, rural police station, the Inspector tries to establish the events surrounding a killing, to reach a startling resolution.",7.433,368,"['Mystery', 'Thriller', 'Crime', 'Drama']",2.5
27317,Audition (Ôdishon) (1999),Drama|Horror|Mystery|Romance|Thriller,235198,11075.0,"Seven years after the death of his wife, widower Shigeharu seeks advice on how to find a new wife from a colleague. Taking advantage of their position as a film company, they stage an audition. Interviewing a series of women, Shigeharu is enchanted by the quiet Asami. But soon things take a twisted turn as Asami isn’t what she seems to be.",7.121,1652,"['Horror', 'Drama']",3.5
27491,Pulse (Kairo) (2001),Horror|Mystery|Thriller,286751,27324.0,"In the immense city of Tokyo, the darkness of the afterlife lures some of its inhabitants who are desperately trying to escape the sadness and isolation of the modern world.",6.644,592,"['Horror', 'Thriller', 'Mystery']",4.0
27584,Dead End (2003),Comedy|Horror|Mystery|Thriller,308152,11427.0,"Christmas Eve. On his way to his in-laws with his family, Frank Harrington decides to try a shortcut, for the first time in 20 years. It turns out to be the biggest mistake of his life.",6.363,562,"['Mystery', 'Horror', 'Thriller']",3.5
27773,Old Boy (2003),Mystery|Thriller,364569,670.0,"With no clue how he came to be imprisoned, drugged and tortured for 15 years, a desperate man seeks revenge on his captors.",8.25,9249,"['Drama', 'Thriller', 'Mystery', 'Action']",4.5
31364,Memories of Murder (Salinui chueok) (2003),Crime|Drama|Mystery|Thriller,353969,11423.0,"During the late 1980s, two detectives in a South Korean province attempt to solve the nation's first series of rape-and-murder cases.",8.059,4213,"['Crime', 'Drama', 'Thriller']",3.5
31410,"Downfall (Untergang, Der) (2004)",Drama|War,363163,613.0,"In April of 1945, Germany stands at the brink of defeat with the Russian Army closing in from the east and the Allied Expeditionary Force attacking from the west. In Berlin, capital of the Third Reich, Adolf Hitler proclaims that Germany will still achieve victory and orders his generals and advisers to fight to the last man. When the end finally does come, and Hitler lies dead by his own hand, what is left of his military must find a way to end the killing that is the Battle of Berlin, and lay down their arms in surrender.",7.9,4060,"['Drama', 'History', 'War']",4.0
32728,"Little Girl Who Lives Down the Lane, The (1976)",Drama|Mystery|Thriller,74806,19971.0,"Quiet, withdrawn 13-year-old Rynn Jacobs lives peacefully in her home in a New England beach town. Whenever the prying landlady inquires after Rynn's father, she politely claims that he's in the city on business. But when the landlady's creepy and increasingly persistent son, Frank, won't leave Rynn alone, she teams up with kindly neighbor boy Mario to maintain the dark family secret that she's been keeping to herself.",7.0,330,"['Drama', 'Mystery', 'Thriller']",2.0
34143,Dark Water (2005),Drama|Horror|Thriller,382628,9009.0,"Dahlia Williams and her daughter Cecelia move into a rundown apartment on New York's Roosevelt Island. Dahlia is in the midst of divorce proceedings, and the apartment, though near an excellent school for her daughter, is all she can afford. From the time she arrives, there are mysterious occurrences—and there is a constant drip from the ceiling in her daughter's bedroom…",5.7,1057,"['Horror', 'Mystery']",2.5
34532,"Skeleton Key, The (2005)",Drama|Horror|Mystery|Thriller,397101,9913.0,A hospice nurse working at a spooky New Orleans plantation home finds herself entangled in a mystery involving the house's dark past.,6.625,2175,"['Drama', 'Horror', 'Mystery', 'Thriller']",3.5
35957,Red Eye (2005),Horror|Thriller,421239,11460.0,"An overnight flight to Miami quickly becomes a battle for survival when Lisa realizes her seatmate plans to use her as part of a chilling assassination plot against the Deputy Secretary of Homeland Security. If she refuses to cooperate, her own father will be killed. As the miles tick by, she's in a race against time to find a way to warn the potential victims before it's too late.",6.392,2413,"['Thriller', 'Mystery']",3.5
37733,"History of Violence, A (2005)",Action|Crime|Drama|Thriller,399146,59.0,An average family is thrust into the spotlight after the father commits a seemingly self-defense murder at his diner.,7.161,3485,"['Drama', 'Thriller', 'Crime']",2.5
38061,Kiss Kiss Bang Bang (2005),Comedy|Crime|Mystery|Thriller,373469,5236.0,A petty thief posing as an actor is brought to Los Angeles for an unlikely audition and finds himself in the middle of a murder investigation along with his high school dream girl and a detective who's been training him for his upcoming role...,7.163,2838,"['Comedy', 'Crime', 'Mystery', 'Thriller']",2.0
39446,Saw II (2005),Horror|Thriller,432348,215.0,"The chilling and relentless Jigsaw killer returns to terrorize the city once again. When a gruesome murder victim emerges with unmistakable traces of Jigsaw's sinister methods, Detective Eric Matthews is thrust into a high-stakes investigation. To his surprise, apprehending Jigsaw seems almost too easy, but what he doesn't realize is that being caught is merely another piece of Jigsaw's intricate puzzle.",6.606,5627,['Horror'],3.0
40617,Creep (2004),Horror|Thriller,381966,8555.0,"Trapped in a London subway station, a woman who's being pursued by a potential attacker heads into the unknown labyrinth of tunnels beneath the city's streets",6.0,790,"['Horror', 'Thriller', 'Mystery']",1.5
40723,Wolf Creek (2005),Crime|Horror|Thriller,416315,9885.0,"Stranded backpackers in remote Australia fall prey to a murderous bushman, who offers to fix their car, then takes them captive.",6.235,1219,"['Horror', 'Thriller']",4.0
40732,"Descent, The (2005)",Adventure|Drama|Horror|Thriller,435625,9392.0,"After a personal tragedy, Sarah joins her friends on a caving expedition in the Appalachian Mountains. But when a rockfall traps them deep underground, their adventure turns into a nightmare. As they search for a way out, the group discovers they are not alone—lurking in the darkness are savage, cave-dwelling creatures. With rising tension and dwindling trust, the women must fight to survive against both the predators and each other.",6.971,4143,"['Adventure', 'Horror']",4.0
41285,Match Point (2005),Crime|Drama|Romance,416320,116.0,"Chris, a former tennis pro, takes a job as an instructor and befriends his wealthy young student, Tom. After being introduced to his family, Chris is soon engaged to Tom's sister, Chloe. Despite the professional and financial advantages that this relationship affords him, Chris becomes obsessed with Tom's fiancee, American actress Nola.",7.357,4209,"['Drama', 'Romance', 'Thriller']",4.5
41941,"Aura, The (Aura, El) (2005)",Crime|Drama|Thriller,420509,13653.0,"A quiet, epileptic taxidermist plans the perfect crime. All he needs is the right opportunity. An accident, perhaps…",6.955,209,"['Drama', 'Thriller']",2.5
42794,Buried Alive (1990),Film-Noir|Horror|Thriller,99188,37865.0,"A married woman and her lover plot to kill her husband to make off with the insurance money. However, their attempt to murder him using poisonous fish toxins backfires in surprising ways.",6.7,165,"['Thriller', 'Crime', 'Horror', 'TV Movie']",3.0
43009,"Ordeal, The (Calvaire) (2004)",Drama|Horror,407621,12517.0,"A few days before Christmas, traveling entertainer Marc Stevens is stuck at nightfall in a remote wood in the swampy Hautes Fagnes region of Liège when his van breaks down. An odd chap who's looking for a lost dog then leads Marc to a shuttered inn.",5.943,333,['Horror'],4.0
43921,Running Scared (2006),Action|Crime|Thriller,404390,7304.0,"A low-ranking thug is entrusted by his boss to dispose of a gun that killed corrupt cops, but things spiral out of control when the gun ends up in wrong hands.",6.981,1078,"['Action', 'Crime', 'Drama', 'Thriller']",3.5
44911,Magic (1978),Drama|Horror|Romance|Thriller,77889,34193.0,A ventriloquist is at the mercy of his vicious dummy while he tries to renew a romance with his high school sweetheart.,6.842,295,"['Drama', 'Horror']",4.0
48304,Apocalypto (2006),Adventure|Drama|Thriller,472043,1579.0,"Set in the Mayan civilization, when a man's idyllic presence is brutally disrupted by a violent invading force, he is taken on a perilous journey to a world ruled by fear and oppression where a harrowing end awaits him. Through a twist of fate and spurred by the power of his love for his woman and his family he will make a desperate break to return home and to ultimately save his way of life.",7.594,5890,"['Action', 'Drama', 'History']",4.0
48780,"Prestige, The (2006)",Drama|Mystery|Sci-Fi|Thriller,482571,1124.0,"A mysterious story of two magicians whose intense rivalry leads them on a life-long battle for supremacy -- full of obsession, deceit and jealousy with dangerous and deadly consequences.",8.203,16826,"['Drama', 'Mystery', 'Science Fiction']",4.0
50447,"Dead Girl, The (2006)",Drama|Mystery|Thriller,783238,13551.0,The clues to a young woman's death come together as the lives of seemingly unrelated women begin to intersect.,6.009,234,"['Mystery', 'Drama', 'Crime', 'Thriller']",3.5
51540,Zodiac (2007),Crime|Drama|Thriller,443706,1949.0,"The Zodiac murders cause the lives of Paul Avery, David Toschi and Robert Graysmith to intersect.",7.528,11056,"['Crime', 'Mystery', 'Thriller']",4.5
51619,"Lathe of Heaven, The (1980)",Sci-Fi,81036,27864.0,"George Orr, a man whose dreams can change waking reality, tries to suppress this unpredictable gift with drugs. Dr. Haber, an assigned psychiatrist, discovers the gift to be real and hypnotically induces Mr. Orr to change reality for the benefit of mankind --- with bizarre and frightening results.",6.6,39,"['Science Fiction', 'Fantasy', 'Drama', 'Thriller', 'TV Movie']",2.5
