movieId,title,genres,imdbId,tmdbId,overview,tmdb_vote_average,tmdb_vote_count,tmdb_genres,rating
1,Toy Story (1995),Adventure|Animation|Children|Comedy|Fantasy,114709,862.0,"Led by Woody, Andy's toys live happily in his room until Andy's birthday brings Buzz Lightyear onto the scene. Afraid of losing his place in Andy's heart, Woody plots against Buzz. But when circumstances separate Buzz and Woody from their owner, the duo eventually learns to put aside their differences.",7.969,19166,"['Family', 'Comedy', 'Animation']",5.0
6,Heat (1995),Action|Crime|Thriller,113277,949.0,Obsessive master thief Neil McCauley leads a top-notch crew on various daring heists throughout Los Angeles while determined detective Vincent Hanna pursues him without rest. Each man recognizes and respects the ability and the dedication of the other even though they are aware their cat-and-mouse game may end in violence.,7.922,7813,"['Crime', 'Drama', 'Action']",4.5
16,Casino (1995),Crime|Drama,112641,524.0,"In early-1970s Las Vegas, Sam ""Ace"" Rothstein gets tapped by his bosses to head the Tangiers Casino. At first, he's a great success in the job, but over the years, problems with his loose-cannon enforcer Nicky Santoro, his ex-hustler wife Ginger, her con-artist ex Lester Diamond and a handful of corrupt politicians put Sam in ever-increasing danger.",8.0,6189,"['Crime', 'Drama']",4.5
25,Leaving Las Vegas (1995),Drama|Romance,113627,451.0,"Ben Sanderson, an alcoholic Hollywood screenwriter who lost everything because of his drinking, arrives in Las Vegas to drink himself to death. There, he meets and forms an uneasy friendship and non-interference pact with prostitute Sera.",7.251,1536,"['Drama', 'Romance']",3.5
50,"Usual Suspects, The (1995)",Crime|Mystery|Thriller,114814,629.0,"Held in an L.A. interrogation room, Verbal Kint attempts to convince the feds that a mythic crime lord, Keyser Soze, not only exists, but was also responsible for drawing him and his four partners into a multi-million dollar heist that ended with an explosion in San Pedro harbor – leaving few survivors. Verbal lures his interrogators with an incredible story of the crime lord's almost supernatural prowess.",8.172,10880,"['Drama', 'Crime', 'Thriller']",4.0
52,Mighty Aphrodite (1995),Comedy|Drama|Romance,113819,11448.0,"When Lenny and his wife, Amanda, adopt a baby, Lenny realizes that his son is a genius and becomes obsessed with finding the boy's biological mother in hopes that she will be brilliant too. But when he learns that Max's mother is Linda Ash, a kindhearted prostitute and porn star, Lenny is determined to reform her immoral lifestyle. A Greek chorus chimes in to relate the plot to Greek mythology in this quirky comedy.",6.723,713,"['Comedy', 'Romance']",4.0
97,"Hate (Haine, La) (1995)",Crime|Drama,113247,406.0,"After a chaotic night of rioting in a marginal suburb of Paris, three young friends, Vinz, Hubert and Saïd, wander around unoccupied waiting for news about the state of health of a mutual friend who has been seriously injured when confronting the police.",8.086,4298,['Drama'],4.5
101,Bottle Rocket (1996),Adventure|Comedy|Crime|Romance,115734,13685.0,"Upon his release from a mental hospital following a nervous breakdown, the directionless Anthony joins his friend Dignan, who seems far less sane than the former. Dignan has hatched a harebrained scheme for an as-yet-unspecified crime spree that somehow involves his former boss, the (supposedly) legendary Mr. Henry.",6.691,1118,"['Comedy', 'Crime', 'Drama']",4.5
111,Taxi Driver (1976),Crime|Drama|Thriller,75314,103.0,"Suffering from insomnia, disturbed loner Travis Bickle takes a job as a New York City cabbie, haunting the streets nightly, growing increasingly detached from reality as he dreams of cleaning up the filthy city.",8.135,12893,"['Crime', 'Drama']",5.0
123,Chungking Express (Chung Hing sam lam) (1994),Drama|Mystery|Romance,109424,11104.0,"Two melancholic Hong Kong policemen fall in love: one with a mysterious underworld figure, the other with a beautiful and ethereal server at a late-night restaurant.",7.971,2015,"['Drama', 'Comedy', 'Romance']",2.5
125,Flirting With Disaster (1996),Comedy,116324,2074.0,"Adopted as a child, new father Mel Colpin decides he cannot name his son until he knows his birth parents, and determines to make a cross-country quest to find them. Accompanied by his wife, Nancy, and an inept yet gorgeous adoption agent, Tina, he departs on an epic road trip that quickly devolves into a farce of mistaken identities, wrong turns, and overzealous and love-struck ATF agents.",6.2,256,['Comedy'],4.5
154,Beauty of the Day (Belle de jour) (1967),Drama,61395,649.0,"Beautiful young housewife Séverine Serizy cannot reconcile her masochistic fantasies with her everyday life alongside dutiful husband Pierre. When her lovestruck friend Henri mentions a secretive high-class brothel run by Madame Anais, Séverine begins to work there during the day under the name Belle de Jour. But when one of her clients grows possessive, she must try to go back to her normal life.",7.321,963,"['Drama', 'Romance']",4.5
187,Party Girl (1995),Comedy,114095,36196.0,"Although Mary has little income, she still finds ways to spend her nights at clubs. After being arrested for throwing an illegal rave, she asks her aunt Judy for bail money. Judy then finds Mary a job at her library so that Mary can repay her. Initially, Mary finds the job as a clerk boring and stifling, and prefers to get to know a street food vendor whom she likes. However, Mary must refocus her life once she loses her job and apartment.",6.4,83,"['Comedy', 'Drama', 'Romance']",4.0
190,Safe (1995),Thriller,114323,32646.0,"Carol White, a Los Angeles housewife in the late 1980s, comes down with a debilitating illness with no clear diagnosis.",7.0,321,['Drama'],3.5
199,"Umbrellas of Cherbourg, The (Parapluies de Cherbourg, Les) (1964)",Drama|Musical|Romance,58450,5967.0,"This simple romantic tragedy begins in 1957. Guy Foucher, a 20-year-old French auto mechanic, has fallen in love with 17-year-old Geneviève Emery, an employee in her widowed mother's chic but financially embattled umbrella shop. On the evening before Guy is to leave for a two-year tour of combat in Algeria, he and Geneviève make love. She becomes pregnant and must choose between waiting for Guy's return or accepting an offer of marriage from a wealthy diamond merchant.",7.4,838,"['Drama', 'Romance']",4.5
215,Before Sunrise (1995),Drama|Romance,112471,76.0,"An unexpected meeting on a train leads two travelers to spend an evening wandering through Vienna. As the night unfolds, they share stories and conversations about life and love, exploring new ideas while a quiet intimacy grows between them, knowing it may be their only night together.",7.964,4423,"['Drama', 'Romance']",5.0
264,"Enfer, L' (1994)",Drama,109731,17961.0,"Forced to work extremely hard to keep things afloat, Paul begins hearing voices in his head questioning his past choices. Convinced that his wife has been unfaithful, he begins to see every male guest as a potential threat. What follows is Paul's downward spiral into the madness of deranged jealousy where he finally discovers that hell is not a state of mind – hell is himself.",6.844,260,"['Drama', 'Thriller']",3.5
306,Three Colors: Red (Trois couleurs: Rouge) (1994),Drama,111495,110.0,"Part-time model Valentine unexpectedly befriends a retired judge after she runs over his dog. At first, the grumpy man shows no concern about the dog, and Valentine decides to keep it. But the two form a bond when she returns to his house and catches him listening to his neighbors’ phone calls.",7.916,1473,"['Drama', 'Mystery', 'Romance']",5.0
307,Three Colors: Blue (Trois couleurs: Bleu) (1993),Drama,108394,108.0,"The wife of a famous composer survives a car accident that kills her husband and daughter. Now alone, she shakes off her old identity and explores her newfound freedom but finds that she is unbreakably bound to other humans, including her husband’s mistress, whose existence she never suspected.",7.652,1783,['Drama'],4.5
308,Three Colors: White (Trzy kolory: Bialy) (1994),Comedy|Drama,111507,109.0,"Polish immigrant Karol Karol finds himself out of a marriage, a job and a country when his French wife, Dominique, divorces him after six months due to his impotence. Forced to leave France after losing the business they jointly owned, Karol enlists fellow Polish expatriate Mikołaj to smuggle him back to their homeland.",7.5,1257,"['Comedy', 'Drama', 'Mystery']",4.0
348,Bullets Over Broadway (1994),Comedy,109348,11382.0,"After young playwright, David Shayne obtains funding for his play from gangster Nick Valenti, Nick's girlfriend Olive miraculously lands the role of a psychiatrist—but not only is she a bimbo who could never pass for a psychiatrist—she's a dreadful actress. David puts up with the leading man who is a compulsive eater, the grand dame who wants her part jazzed up, and Olive's interfering hitman/bodyguard—but, eventually he must decide whether art or life is more important.",7.088,640,"['Comedy', 'Crime']",4.0
356,Forrest Gump (1994),Comedy|Drama|Romance|War,109830,13.0,"A man with a low IQ has accomplished great things in his life and been present during significant historic events—in each case, far exceeding what anyone imagined he could do. But despite all he has achieved, his one true love eludes him.",8.466,28666,"['Comedy', 'Drama', 'Romance']",3.5
372,Reality Bites (1994),Comedy|Drama|Romance,110950,2788.0,"A small circle of friends suffering from post-collegiate blues must confront the hard truth about life, love and the pursuit of gainful employment. As they struggle to map out survival guides for the future, the Gen-X quartet soon begins to realize that reality isn't all it's cracked up to be.",6.573,759,"['Drama', 'Romance', 'Comedy']",3.0
428,"Bronx Tale, A (1993)",Drama,106489,1607.0,"Set in the Bronx during the tumultuous 1960s, an adolescent boy is torn between his honest, working-class father and a violent yet charismatic crime boss. Complicating matters is the youngster's growing attraction - forbidden in his neighborhood - for a beautiful black girl.",7.877,2673,"['Drama', 'Crime']",4.0
431,Carlito's Way (1993),Crime|Drama,106519,6075.0,"Free after years in prison, Carlito Brigante intends to give up his criminal ways, but it's not long before the ex-con is sucked back into the New York City underworld. Reconnecting with his dancer girlfriend, Carlito gets entangled in the shady dealings of his friend Dave Kleinfeld, who also serves as his lawyer. An encounter with shifty gangster Benny Blanco sets the duo on a dangerous path.",7.83,3313,"['Crime', 'Drama', 'Thriller']",3.5
480,Jurassic Park (1993),Action|Adventure|Sci-Fi|Thriller,107290,329.0,"A wealthy entrepreneur secretly creates a theme park featuring living dinosaurs drawn from prehistoric DNA. Before opening day, he invites a team of experts and his two eager grandchildren to experience the park and help calm anxious investors. However, the park is anything but amusing as the security systems go off-line and the dinosaurs escape.",7.961,17140,"['Adventure', 'Science Fiction']",3.5
492,Manhattan Murder Mystery (1993),Comedy|Mystery,107507,10440.0,A middle-aged couple suspects foul play when their neighbor's wife suddenly drops dead.,7.263,1121,"['Comedy', 'Mystery']",4.0
501,Naked (1993),Drama,107653,21450.0,An unemployed Brit vents his rage on unsuspecting strangers as he embarks on a nocturnal London odyssey.,7.251,614,"['Drama', 'Comedy']",3.0
509,"Piano, The (1993)",Drama|Romance,107822,713.0,"When an arranged marriage brings Ada and her spirited daughter to the wilderness of nineteenth-century New Zealand, she finds herself locked in a battle of wills with both her controlling husband and a rugged frontiersman to whom she develops a forbidden attraction.",7.391,1575,"['Drama', 'Romance']",4.0
535,Short Cuts (1993),Drama,108122,695.0,"Many loosely connected characters cross paths in this film, based on the stories of Raymond Carver. Waitress Doreen Piggot accidentally runs into a boy with her car. Soon after walking away, the child lapses into a coma. While at the hospital, the boy's grandfather tells his son, Howard, about his past affairs. Meanwhile, a baker starts harassing the family when they fail to pick up the boy's birthday cake.",7.216,638,"['Drama', 'Comedy']",4.5
593,"Silence of the Lambs, The (1991)",Crime|Horror|Thriller,102926,274.0,"Clarice Starling is a top student at the FBI's training academy.  Jack Crawford wants Clarice to interview Dr. Hannibal Lecter, a brilliant psychiatrist who is also a violent psychopath, serving life behind bars for various acts of murder and cannibalism.  Crawford believes that Lecter may have insight into a case and that Starling, as an attractive young woman, may be just the bait to draw him out.",8.347,17133,"['Crime', 'Thriller', 'Drama']",4.0
599,"Wild Bunch, The (1969)",Adventure|Western,65214,576.0,"An aging group of outlaws look for one last big score as the ""traditional"" American West is disappearing around them.",7.611,1267,['Western'],5.0
608,Fargo (1996),Comedy|Crime|Drama|Thriller,116282,275.0,"Jerry, a small-town Minnesota car salesman is bursting at the seams with debt... but he's got a plan. He's going to hire two thugs to kidnap his wife in a scheme to collect a hefty ransom from his wealthy father-in-law. It's going to be a snap and nobody's going to get hurt... until people start dying. Enter Police Chief Marge, a coffee-drinking, parka-wearing - and extremely pregnant - investigator who'll stop at nothing to get her man. And if you think her small-time investigative skills will give the crooks a run for their ransom... you betcha!",7.851,8587,"['Crime', 'Drama', 'Thriller']",4.5
645,Nelly & Monsieur Arnaud (1995),Drama,113947,12652.0,"Nelly leaves her lazy, unemployed husband to work for retired judge Mr Arnaud, forty years her senior, after he offers to clear her bills for her. While she types his memoirs the two develop a close friendship, but Arnaud becomes jealous when Nelly begins dating his good-looking young publisher.",6.9,138,"['Drama', 'Romance']",4.5
659,Purple Noon (Plein soleil) (1960),Crime|Drama|Thriller,54189,10363.0,"Tom Ripley is a talented mimic, moocher, forger and all-around criminal improviser; but there's more to Tom Ripley than even he can guess.",7.578,566,"['Crime', 'Drama', 'Thriller']",4.0
702,Faces (1968),Drama,62952,753.0,"Middle-aged suburban husband Richard abruptly tells his wife, Maria, that he wants a divorce. As Richard takes up with a younger woman, Maria enjoys a night on the town with her friends and meets a younger man. As the couple and those around them confront a seemingly futile search for what they've lost -- love, excitement, passion -- this classic American independent film explores themes of aging and alienation.",7.1,208,['Drama'],3.0
746,Force of Evil (1948),Film-Noir,40366,26744.0,"Lawyer Joe Morse wants to consolidate all the small-time numbers racket operators into one big powerful operation. But his elder brother Leo is one of these small-time operators who wants to stay that way, preferring not to deal with the gangsters who dominate the big-time.",6.6,125,"['Crime', 'Drama']",4.5
807,"Rendezvous in Paris (Rendez-vous de Paris, Les) (1995)",Comedy|Romance,114266,77056.0,Three stories of love and coincidence around the theme of dates in Paris.,6.6,54,"['Romance', 'Comedy', 'Drama']",4.5
823,"Collector, The (La collectionneuse) (1967)",Drama,61495,4837.0,"A bombastic, womanizing art dealer and his painter friend go to a seventeenth-century villa on the Riviera for a relaxing summer getaway. But their idyll is disturbed by the presence of the bohemian Haydée, accused of being a “collector” of men.",6.9,254,"['Drama', 'Romance']",4.0
858,"Godfather, The (1972)",Crime|Drama,68646,238.0,"Spanning the years 1945 to 1955, a chronicle of the fictional Italian-American Corleone crime family. When organized crime family patriarch, Vito Corleone barely survives an attempt on his life, his youngest son, Michael steps in to take care of the would-be killers, launching a campaign of bloody revenge.",8.686,21874,"['Drama', 'Crime']",5.0
903,Vertigo (1958),Drama|Mystery|Romance|Thriller,52357,426.0,"A retired San Francisco detective suffering from acrophobia investigates the strange activities of an old friend's wife, all the while becoming dangerously obsessed with her.",8.158,6033,"['Mystery', 'Romance', 'Thriller']",5.0
904,Rear Window (1954),Mystery|Thriller,47396,567.0,A wheelchair-bound photographer spies on his neighbors from his apartment window and becomes convinced one of them has committed murder.,8.349,6838,"['Thriller', 'Mystery']",5.0
905,It Happened One Night (1934),Comedy|Romance,25316,3078.0,A runaway heiress makes a deal with the rogue reporter trailing her but the mismatched pair end up stuck with each other when their bus leaves them behind.,7.823,1325,"['Comedy', 'Romance']",4.5
909,"Apartment, The (1960)",Comedy|Drama|Romance,53604,284.0,"Bud Baxter is a minor clerk in a huge New York insurance company, until he discovers a quick way to climb the corporate ladder. He lends out his apartment to the executives as a place to take their mistresses. Although he often has to deal with the aftermath of their visits, one night he's left with a major problem to solve.",8.197,2478,"['Comedy', 'Drama', 'Romance']",5.0
910,Some Like It Hot (1959),Comedy|Crime,53291,239.0,Two musicians witness a mob hit and struggle to find a way out of the city. Their only opportunity comes in the form of joining an all-girl band as they prepare to leave on a tour. The two disguise themselves as women and struggle to keep their identities secret as they deal with the problems this brings.,8.094,3678,"['Comedy', 'Romance', 'Crime']",3.5
912,Casablanca (1942),Drama|Romance,34583,289.0,"In Casablanca, Morocco in December 1941, a cynical American expatriate meets a former lover, with unforeseen complications.",8.155,5733,"['Drama', 'Romance']",5.0
913,"Maltese Falcon, The (1941)",Film-Noir|Mystery,33870,963.0,"A private detective takes on a case that involves him with three eccentric criminals, a beautiful liar, and their quest for a priceless statuette.",7.7,1781,"['Mystery', 'Crime', 'Thriller']",4.0
915,Sabrina (1954),Comedy|Romance,47437,6620.0,"Linus and David Larrabee are the two sons of a very wealthy family. Linus is all work – busily running the family corporate empire, he has no time for a wife and family. David is all play – technically he is employed by the family business, but never shows up for work, spends all his time entertaining, and has been married and divorced three times. Meanwhile, Sabrina Fairchild is the young, shy, and awkward daughter of the household chauffeur, who goes away to Paris for two years, and returns to capture David's attention, while falling in love with Linus.",7.508,1300,"['Comedy', 'Romance', 'Drama']",4.0
916,Roman Holiday (1953),Comedy|Drama|Romance,46250,804.0,"Overwhelmed by her suffocating schedule, touring European princess Ann takes off for a night while in Rome. When a sedative she took from her doctor kicks in, however, she falls asleep on a park bench and is found by an American reporter, Joe Bradley, who takes her back to his apartment for safety. At work the next morning, Joe finds out Ann's regal identity and bets his editor he can get exclusive interview with her, but romance soon gets in the way.",7.885,2159,"['Romance', 'Comedy', 'Drama']",4.5
922,Sunset Blvd. (a.k.a. Sunset Boulevard) (1950),Drama|Film-Noir|Romance,43014,599.0,A hack screenwriter writes a screenplay for a former silent film star who has faded into Hollywood obscurity.,8.292,2753,['Drama'],5.0
923,Citizen Kane (1941),Drama|Mystery,33467,15.0,"Newspaper magnate Charles Foster Kane is taken from his mother as a boy and made the ward of a rich industrialist. As a result, every well-meaning, tyrannical or self-destructive move he makes for the rest of his life appears in some way to be a reaction to that deeply wounding event.",8.001,5764,"['Mystery', 'Drama']",5.0
924,2001: A Space Odyssey (1968),Adventure|Drama|Sci-Fi,62622,62.0,"Humanity finds a mysterious object buried beneath the lunar surface and sets off to find its origins with the help of HAL 9000, the world's most advanced super computer.",8.064,12050,"['Science Fiction', 'Mystery', 'Adventure']",5.0
926,All About Eve (1950),Drama,42192,705.0,"From the moment she glimpses her idol at the stage door, Eve Harrington is determined to take the reins of power away from the great actress Margo Channing. Eve maneuvers her way into Margo's Broadway role, becomes a sensation and even causes turmoil in the lives of Margo's director boyfriend, her playwright and his wife. Only the cynical drama critic sees through Eve, admiring her audacity and perfect pattern of deceit.",8.079,1608,['Drama'],5.0
930,Notorious (1946),Film-Noir|Romance|Thriller,38787,303.0,"In order to help bring Nazis to justice, U.S. government agent T.R. Devlin recruits Alicia Huberman, the American daughter of a convicted German war criminal, as a spy. As they begin to fall for one another, Alicia is instructed to win the affections of Alexander Sebastian, a Nazi hiding out in Brazil. When Sebastian becomes serious about his relationship with Alicia, the stakes get higher, and Devlin must watch her slip further undercover.",7.743,1667,"['Thriller', 'Romance', 'Mystery']",4.0
936,Ninotchka (1939),Comedy|Romance,31725,1859.0,A stern Russian woman sent to Paris on official business finds herself attracted to a man who represents everything she is supposed to detest.,7.5,407,"['Comedy', 'Romance']",3.0
946,To Be or Not to Be (1942),Comedy|Drama|War,35446,198.0,"During the Nazi occupation of Poland, an acting troupe becomes embroiled in a Polish soldier's efforts to track down a German spy.",7.8,780,"['Comedy', 'War', 'Romance']",4.5
947,My Man Godfrey (1936),Comedy|Romance,28010,13562.0,"Fifth Avenue socialite Irene Bullock needs a ""forgotten man"" to win a scavenger hunt, and no one is more forgotten than Godfrey Park, who resides in a dump by the East River. Irene hires Godfrey as a servant for her riotously unhinged family, to the chagrin of her spoiled sister, Cornelia, who tries her best to get Godfrey fired. As Irene falls for her new butler, Godfrey turns the tables and teaches the frivolous Bullocks a lesson or two.",7.5,368,['Comedy'],4.0
950,"Thin Man, The (1934)",Comedy|Crime,25878,3529.0,A husband and wife detective team takes on the search for a missing inventor and almost get killed for their efforts.,7.497,497,"['Comedy', 'Mystery', 'Crime']",4.0
951,His Girl Friday (1940),Comedy|Romance,32599,3085.0,"Walter Burns is an irresistibly conniving newspaper publisher desperate to woo back his paper’s star reporter, who also happens to be his estranged wife. She’s threatening to quit and settle down with a new beau, but, as Walter knows, she has a weakness: she can’t resist a juicy scoop.",7.396,879,"['Comedy', 'Romance']",4.0
954,Mr. Smith Goes to Washington (1939),Drama,31679,3083.0,"After the death of a United States Senator, idealistic Jefferson Smith is appointed as his replacement in Washington. Soon, the naive and earnest new senator has to battle political corruption.",7.8,1118,"['Comedy', 'Drama']",4.5
955,Bringing Up Baby (1938),Comedy|Romance,29947,900.0,"David Huxley is waiting to get a bone he needs for his museum collection. Through a series of strange circumstances, he meets Susan Vance, and the duo have a series of misadventures which include a leopard called Baby.",7.5,1022,"['Comedy', 'Romance']",5.0
969,"African Queen, The (1951)",Adventure|Comedy|Romance|War,43265,488.0,"At the start of the First World War, in the middle of Africa’s nowhere, a gin soaked riverboat captain is persuaded by a strong-willed missionary to go down river and face-off a German warship.",7.3,1000,"['Romance', 'Adventure', 'Drama']",2.5
971,Cat on a Hot Tin Roof (1958),Drama,51459,261.0,"An alcoholic ex-football player drinks his days away, having failed to come to terms with his sexuality and his real feelings for his football buddy who died after an ambiguous accident. His wife is crucified by her desperation to make him desire her: but he resists the affections of his wife. His reunion with his father—who is dying of cancer—jogs a host of memories and revelations for both father and son.",7.654,787,['Drama'],4.0
1057,Everyone Says I Love You (1996),Comedy|Musical|Romance,116242,9716.0,A New York girl sets her father up with a beautiful woman in a shaky marriage while her half sister gets engaged.,6.437,687,"['Comedy', 'Romance']",3.5
1079,"Fish Called Wanda, A (1988)",Comedy|Crime,95159,623.0,"While a diamond advocate attempts to steal a collection of diamonds, troubles arise when he realises he’s not the only one after the collection.",7.204,2301,"['Comedy', 'Crime']",4.0
1082,"Candidate, The (1972)",Drama,68334,21711.0,"Bill McKay is a candidate for the U.S. Senate from California. He has no hope of winning, so he is willing to tweak the establishment.",6.48,171,"['Comedy', 'Drama']",3.5
1084,Bonnie and Clyde (1967),Crime|Drama,61418,475.0,"In the 1930s, bored waitress Bonnie Parker falls in love with an ex-con named Clyde Barrow and together they start a violent crime spree through the country, stealing cars and robbing banks.",7.486,1705,"['Crime', 'Drama']",4.0
