movieId,title,genres,imdbId,tmdbId,overview,tmdb_vote_average,tmdb_vote_count,tmdb_genres,rating
4276,Lost in America (1985),Comedy,89504,27223.0,"David and Linda Howard are successful yuppies from LA. When he gets a job disappointment, David convinces Linda that they should quit their jobs, liquidate their assets, and emulate the movie Easy Rider, spending the rest of their lives traveling around America...in a Winnebago.",6.9,155,['Comedy'],3.5
4283,Fellini's Roma (Roma) (1972),Drama,69191,11035.0,"A virtually plotless, gaudy, impressionistic portrait of Rome through the eyes of one of its most famous citizens.",7.229,339,"['Comedy', 'Drama']",4.0
4289,"City of Women, The (Città delle donne, La) (1980)",Comedy|Drama,80539,11936.0,"The charismatic Snaporaz encounters an alluring woman on a train and pursues her through a forest. He ends up at a hotel populated by women gathered for a feminist conference, where he is an unwanted presence. Snaporaz soon discovers he’s entered a phantasmagoric world where women have taken power.",7.0,279,"['Comedy', 'Adventure', 'Fantasy']",5.0
4306,Shrek (2001),Adventure|Animation|Children|Comedy|Fantasy|Romance,126029,808.0,"It ain't easy bein' green -- especially if you're a likable (albeit smelly) ogre named Shrek. On a mission to retrieve a gorgeous princess from the clutches of a fire-breathing dragon, Shrek teams up with an unlikely compatriot -- a wisecracking donkey.",7.752,17987,"['Animation', 'Comedy', 'Fantasy', 'Adventure', 'Family']",3.5
4325,"Night, The (Notte, La) (1960)",Drama,54130,41050.0,A day in the life of an unfaithful married couple and their steadily deteriorating relationship in Milan.,7.957,705,"['Drama', 'Romance']",4.0
4337,"Sand Pebbles, The (1966)",Drama|Romance|War,60934,5923.0,"Engineer Jake Holman arrives aboard the gunboat USS San Pablo, assigned to patrol a tributary of the Yangtze in the middle of exploited and revolution-torn 1926 China. His iconoclasm and cynical nature soon clash with the 'rice-bowl' system which runs the ship and the uneasy symbiosis between Chinese and foreigner on the river. Hostility towards the gunboat's presence reaches a climax when the boat must crash through a river-boom and rescue missionaries upriver at China Light Mission.",7.2,261,"['Drama', 'War']",3.5
4349,Catch-22 (1970),Comedy|War,65528,10364.0,A WWII military pilot makes a valiant effort to be certified insane in order to be excused from flying missions. But there's a catch.,6.662,321,"['War', 'Comedy']",4.0
4356,Gentlemen Prefer Blondes (1953),Comedy|Musical|Romance,45810,759.0,"Lorelei Lee is a beautiful showgirl engaged to be married to the wealthy Gus Esmond, much to the disapproval of Gus' rich father, Esmond Sr., who thinks that Lorelei is just after his money. When Lorelei goes on a cruise accompanied only by her best friend, Dorothy Shaw, Esmond Sr. hires Ernie Malone, a private detective, to follow her and report any questionable behavior that would disqualify her from the marriage.",7.3,1011,"['Comedy', 'Romance']",4.0
4357,How to Marry a Millionaire (1953),Comedy|Drama|Romance,45891,10297.0,"Three women set out to find eligible millionaires to marry, but find true love in the process.",6.808,534,"['Comedy', 'Romance']",4.0
4359,"Seven Year Itch, The (1955)",Comedy,48605,10653.0,"With his family away for their annual summer holiday, a publishing executive decides to live a bachelor's life. The beautiful but ditzy blonde from the apartment above catches his eye and they soon start spending time together—maybe a little too much time!",7.062,935,"['Comedy', 'Romance']",3.5
4361,Tootsie (1982),Comedy|Romance,84805,9576.0,"When struggling, out of work actor Michael Dorsey secretly adopts a female alter ego – Dorothy Michaels – in order to land a part in a daytime drama, he unwittingly becomes a feminist icon and ends up in a romantic pickle.",7.212,1839,"['Comedy', 'Romance']",4.0
4378,Sexy Beast (2000),Crime|Drama,203119,11826.0,"Ex-safecracker Gal Dove has served his time behind bars and is blissfully retired to a Spanish villa paradise with a wife he adores. The idyll is shattered by the arrival of his nemesis Don Logan, intent on persuading Gal to return to London for one last big job.",7.005,833,"['Crime', 'Thriller', 'Drama']",4.0
4393,Another Woman (1988),Drama,94663,22478.0,"Marion is a woman who has learned to shield herself from her emotions. She rents an apartment to work undisturbed on her new book, but by some acoustic anomaly she can hear all that is said in the next apartment in which a psychiatrist holds his office. When she hears a young woman tell that she finds it harder and harder to bear her life, Marion starts to reflect on her own life. After a series of events she comes to understand how her unemotional attitude towards the people around her affected them and herself.",6.8,277,['Drama'],4.0
4406,"Man Who Shot Liberty Valance, The (1962)",Crime|Drama|Western,56217,11697.0,"Questions arise when Senator Stoddard attends the funeral of a local man named Tom Doniphon in a small Western town. Flashing back, we learn Doniphon saved Stoddard, then a lawyer, when he was roughed up by a crew of outlaws terrorizing the town, led by Liberty Valance. As the territory's safety hung in the balance, Doniphon and Stoddard, two of the only people standing up to him, proved to be very important, but different, foes to Valance.",7.8,1219,['Western'],4.0
4410,Something Wild (1986),Comedy|Crime|Drama,91983,11300.0,"A free-spirited woman ""kidnaps"" a yuppie for a weekend of adventure. But the fun quickly takes a dangerous turn when her ex-con husband shows up.",6.655,368,"['Crime', 'Comedy', 'Romance']",4.5
4419,All That Heaven Allows (1955),Drama|Romance,47811,43316.0,"Two different social classes collide when Cary Scott, a wealthy upper-class widow, falls in love with her much younger and down-to-earth gardener, prompting disapproval and criticism from her children and country club friends.",7.3,319,"['Drama', 'Romance']",4.0
4422,Cries and Whispers (Viskningar och rop) (1972),Drama,69467,10238.0,"As Agnes slowly dies of cancer, her sisters are so immersed in their own psychic pains that they are unable to offer her the support she needs.",7.904,733,['Drama'],3.5
4426,Kiss Me Deadly (1955),Film-Noir,48261,18030.0,"One evening, Hammer gives a ride to Christina, an attractive hitchhiker on a lonely country road, who has escaped from the nearby lunatic asylum. Thugs waylay them and force his car to crash. When Hammer returns to semi-consciousness, he hears Christina being tortured until she dies. Hammer, both for vengeance and in hopes that ""something big"" is behind it all, decides to pursue the case.",7.2,391,"['Mystery', 'Thriller', 'Crime']",3.5
4427,"Lion in Winter, The (1968)",Drama,63227,18988.0,"Henry II and his estranged queen, Eleanor of Aquitaine, battle over the choice of an heir.",7.386,380,"['Drama', 'History']",4.0
4428,"Misfits, The (1961)",Comedy|Drama|Romance|Western,55184,11536.0,"While filing for a divorce, beautiful ex-stripper Roslyn Taber ends up meeting aging cowboy-turned-gambler Gay Langland and former World War II aviator Guido Racanelli. The two men instantly become infatuated with Roslyn and, on a whim, the three decide to move into Guido's half-finished desert home together. When grizzled ex-rodeo rider Perce Howland arrives, the unlikely foursome strike up a business capturing wild horses.",6.957,404,"['Western', 'Drama', 'Romance']",4.5
4432,Sweet Smell of Success (1957),Drama|Film-Noir,51036,976.0,"New York City newspaper writer J.J. Hunsecker holds considerable sway over public opinion with his Broadway column, but one thing that he can't control is his younger sister, Susan, who is in a relationship with aspiring jazz guitarist Steve Dallas. Hunsecker strongly disapproves of the romance and recruits publicist Sidney Falco to find a way to split the couple, no matter how ruthless the method.",7.604,541,['Drama'],5.0
4433,Written on the Wind (1956),Drama,49966,69605.0,"Mitch Wayne is a geologist working for the Hadleys, an oil-rich Texas family. While the patriarch, Jasper, works hard to establish the family business, his irresponsible son, Kyle, is an alcoholic playboy, and his daughter, Marylee, is the town tramp. Mitch harbors a secret love for Kyle's unsatisfied wife, Lucy -- a fact that leaves him exposed when the jealous Marylee accuses him of murder.",6.978,250,"['Drama', 'Romance']",4.0
4447,Legally Blonde (2001),Comedy|Romance,250494,8835.0,"Fashionable sorority queen Elle Woods has it all, but, she wants nothing more than to be Mrs. Warner Huntington III. But he dumps her before heading to Harvard Law School. Elle rallies all of her resources and gets into Harvard, determined to win him back. While there, she figures out that there is more to herself than just good looks.",6.807,4287,"['Comedy', 'Romance']",3.0
4448,"Score, The (2001)",Action|Drama,227445,11371.0,An aging thief hopes to retire and live off his ill-gotten wealth when a young kid convinces him into doing one last heist.,6.701,1746,"['Action', 'Crime', 'Thriller', 'Mystery', 'Drama']",4.0
4687,Billy Liar (1963),Comedy,56868,26535.0,A young Englishman dreams of escaping from his working class family and dead-end job as an undertaker's assistant. A number of indiscretions cause him to lie in order to avoid the penalties. His life turns into a mess and he has an opportunity to run away and leave it all behind.,6.843,120,"['Comedy', 'Romance', 'Drama']",5.0
4701,Rush Hour 2 (2001),Action|Comedy,266915,5175.0,"It's vacation time for Carter as he finds himself alongside Lee in Hong Kong wishing for more excitement. While Carter wants to party and meet the ladies, Lee is out to track down a Triad gang lord who may be responsible for killing two men at the American Embassy. Things get complicated as the pair stumble onto a counterfeiting plot. The boys are soon up to their necks in fist fights and life-threatening situations. A trip back to the U.S. may provide the answers about the bombing, the counterfeiting, and the true allegiance of sexy customs agent Isabella.",6.751,4353,"['Action', 'Comedy', 'Crime']",2.5
4716,Bad Timing: A Sensual Obsession (1980),Drama,80408,33214.0,"Alex Linden is a psychiatrist living in Vienna who meets Milena Flaherty though a mutual friend. Though Alex is quite a bit older than Milena, he's attracted to her young, carefree spirit. Despite the fact that Milena is already married, their friendship quickly turns into a deeply passionate love affair that threatens to overtake them both. When Milena ends up in the hospital from an overdose, Alex is taken into custody by Inspector Netusil.",6.6,156,"['Mystery', 'Drama', 'Thriller']",5.0
4718,American Pie 2 (2001),Comedy,252866,2770.0,"After a year apart - attending different schools, meeting different people - the guys rent a beach house and vow to make this the best summer ever. As it turns out, whether that will happen or not has a lot to do with the girls. Between the wild parties, outrageous revelations and yes, a trip to band camp, they discover that times change and people change, but in the end, it's all about sticking together.",6.248,5088,"['Comedy', 'Romance']",2.5
4816,Zoolander (2001),Comedy,196229,9398.0,"Clear the runway for Derek Zoolander, VH1's three-time male model of the year. His face falls when hippie-chic Hansel scooters in to steal this year's award. The evil fashion guru Mugatu seizes the opportunity to turn Derek into a killing machine. It's a well-designed conspiracy and only with the help of Hansel and a few well-chosen accessories like Matilda can Derek make the world safe for male models everywhere.",6.207,4666,['Comedy'],4.0
4848,Mulholland Drive (2001),Crime|Drama|Film-Noir|Mystery|Thriller,166924,1018.0,"Blonde Betty Elms has only just arrived in Hollywood to become a movie star when she meets an enigmatic brunette with amnesia. Meanwhile, as the two set off to solve the second woman's identity, filmmaker Adam Kesher runs into ominous trouble while casting his latest project.",7.806,6666,"['Thriller', 'Drama', 'Mystery']",3.0
4886,"Monsters, Inc. (2001)",Adventure|Animation|Children|Comedy|Fantasy,198781,585.0,"Lovable Sulley and his wisecracking sidekick Mike Wazowski are the top scare team at Monsters, Inc., the scream-processing factory in Monstropolis. When a little girl named Boo wanders into their world, it's the monsters who are scared silly, and it's up to Sulley and Mike to keep her out of sight and get her back home.",7.846,19135,"['Animation', 'Comedy', 'Family']",5.0
4908,"Little Soldier, The (Petit soldat, Le) (1963)",Drama|War,54177,50785.0,"Despite his lack of political convictions, photojournalist Bruno Forestier is roped into a paramilitary group waging a shadow war in Geneva against the Algerian independence movement.",6.985,170,"['Drama', 'Romance']",4.0
4914,Breathless (À bout de souffle) (1960),Crime|Drama|Romance,53472,269.0,"A small-time thief steals a car and impulsively murders a motorcycle policeman. Wanted by the authorities, he attempts to persuade a girl to run away to Italy with him.",7.514,1908,"['Drama', 'Crime']",5.0
4928,That Obscure Object of Desire (Cet obscur objet du désir) (1977),Drama,75824,5781.0,"After dumping a bucket of water on a beautiful young woman from the window of a train car, wealthy Frenchman Mathieu, regales his fellow passengers with the story of the dysfunctional relationship between himself and the young woman in question, a fiery 19-year-old flamenco dancer named Conchita. What follows is a tale of cruelty, depravity and lies -- the very building blocks of love.",7.444,417,"['Comedy', 'Drama', 'Romance']",3.5
4938,"Aviator's Wife, The (La femme de l'aviateur) (1981)",Drama,80728,27145.0,"A student is devastated when he finds that his girlfriend is cheating on him. In order to find out why she did it, he decides to spy on her and her airline pilot lover. Then he sees the pilot with a blonde woman and he begins to follow them…",7.149,115,"['Drama', 'Comedy', 'Romance']",4.0
4973,"Amelie (Fabuleux destin d'Amélie Poulain, Le) (2001)",Comedy|Romance,211915,194.0,"At a tiny Parisian café, the adorable yet painfully shy Amélie accidentally discovers a gift for helping others. Soon Amelie is spending her days as a matchmaker, guardian angel, and all-around do-gooder. But when she bumps into a handsome stranger, will she find the courage to become the star of her very own love story?",7.913,11945,"['Comedy', 'Romance']",4.0
4979,"Royal Tenenbaums, The (2001)",Comedy|Drama,265666,9428.0,"Royal Tenenbaum and his wife Etheline had three children and then they separated. All three children are extraordinary --- all geniuses. Virtually all memory of the brilliance of the young Tenenbaums was subsequently erased by two decades of betrayal, failure, and disaster. Most of this was generally considered to be their father's fault. ""The Royal Tenenbaums"" is the story of the family's sudden, unexpected reunion one recent winter.",7.466,4756,"['Comedy', 'Drama']",5.0
4995,"Beautiful Mind, A (2001)",Drama|Romance,268978,453.0,"From the heights of notoriety to the depths of depravity, John Forbes Nash Jr. experiences it all. As a brilliant but socially awkward mathematician, he made a groundbreaking discovery early in his career and stands on the brink of international acclaim. But as the handsome and arrogant Nash accepts secret work in cryptography, he becomes entangled in a mysterious conspiracy. His life takes a nightmarish turn and he soon finds himself on a painful and harrowing journey of self-discovery.",7.856,10638,"['Drama', 'Romance']",4.5
5008,Witness for the Prosecution (1957),Drama|Mystery|Thriller,51201,37257.0,An ailing barrister agrees to defend a man in a sensational murder trial where the unconvincing testimony of the defendant's wife becomes a subject of confusion.,8.214,1547,"['Drama', 'Mystery', 'Crime']",4.0
5013,Gosford Park (2001),Comedy|Drama|Mystery,280707,5279.0,"In 1930s England, a group of pretentious rich and famous gather together for a weekend of relaxation at a hunting resort. But when a murder occurs, each one of these interesting characters becomes a suspect.",6.8,1161,"['Drama', 'Mystery', 'Thriller']",4.0
5017,"Big Heat, The (1953)",Drama|Film-Noir,45555,14580.0,"After the suspicious suicide of a fellow cop, tough homicide detective Dave Bannion takes the law into his own hands when he sets out to smash a vicious crime syndicate.",7.7,518,"['Crime', 'Thriller']",4.0
5060,M*A*S*H (a.k.a. MASH) (1970),Comedy|Drama|War,66026,651.0,The staff of a Korean War field hospital use humor and hijinks to keep their sanity in the face of the horror of war.,6.967,1090,"['Comedy', 'Drama', 'War']",4.0
5105,Don't Look Now (1973),Drama|Horror|Thriller,69995,931.0,"While grieving a terrible loss, a married couple meet two mysterious sisters, one of whom gives them a message sent from the afterlife.",6.939,1126,"['Thriller', 'Drama', 'Horror']",4.0
5114,"Bad and the Beautiful, The (1952)",Drama,44391,32499.0,"Told in flashback form, the film traces the rise and fall of a tough, ambitious Hollywood producer, Jonathan Shields, as seen through the eyes of various acquaintances, including a writer, James Lee Bartlow; a star, Georgia Lorrison; and a director, Fred Amiel. He is a hard-driving, ambitious man who ruthlessly uses everyone on the way to becoming one of Hollywood's top movie makers.",7.34,272,"['Drama', 'Romance']",4.0
5118,"Heartbreak Kid, The (1972)",Comedy|Romance,68687,40687.0,"Three days into his Miami honeymoon with needy and unsophisticated Lila, Lenny meets tall, blonde Kelly. This confirms his fear that he has made a serious mistake and he decides he wants to be with Kelly instead.",6.6,95,"['Romance', 'Comedy']",4.5
5119,Saturday Night and Sunday Morning (1960),Drama,54269,37230.0,"A 22-year-old factory worker lets loose on the weekends: drinking, brawling, and dating two women, one of whom is older and married.",7.014,147,"['Drama', 'Romance']",4.0
5142,"Firemen's Ball, The (Horí, má panenko) (1967)",Comedy|Drama,61781,38442.0,"The firemen of a provincial Czechoslovakian town throw a ball in honor of the old chief's retirement. There will be music and dancing, a beauty pageant and a raffle. The whole town will be in attendance. However, the proceedings are dogged by difficulty at every step. Workplace injuries, stolen prizes, a shortage of pretty girls... and fire.",7.067,231,['Comedy'],4.0
5147,Wild Strawberries (Smultronstället) (1957),Drama,50986,614.0,"Crotchety retired doctor Isak Borg travels from Stockholm to Lund, Sweden, with his pregnant and unhappy daughter-in-law, Marianne, in order to receive an honorary degree from his alma mater. Along the way, they encounter a series of hitchhikers, each of whom causes the elderly doctor to muse upon the pleasures and failures of his own life. These include the vivacious young Sara, a dead ringer for the doctor's own first love.",8.104,1728,['Drama'],4.0
5177,"Magnificent Ambersons, The (1942)",Drama|Romance,35015,965.0,The spoiled young heir to the decaying Amberson fortune comes between his widowed mother and the man she has always loved.,7.327,451,"['Drama', 'Romance']",4.5
5187,Hopscotch (1980),Comedy,80889,32030.0,"When CIA operative Miles Kendig deliberately lets KGB agent Yaskov get away, his boss threatens to retire him. Kendig beats him to it, however, destroying his own records and traveling to Austria where he begins work on a memoir that will expose all his former agency's covert practices. The CIA catches wind of the book and sends other agents after him, initiating a frenetic game of cat and mouse that spans the globe.",7.0,168,"['Comedy', 'Adventure']",4.0
5198,"Long Good Friday, The (1980)",Drama|Thriller,81070,14807.0,"In the late 1970s, Cockney crime boss Harold Shand, a gangster trying to become a legitimate property mogul, has big plans to get the American Mafia to bankroll his transformation of a derelict area of London into the possible venue for a future Olympic Games. However, a series of bombings targets his empire on the very weekend the Americans are in town. Shand is convinced there is a traitor in his organization, and sets out to eliminate the rat in typically ruthless fashion.",7.1,393,"['Crime', 'Thriller', 'Drama', 'Mystery']",4.0
5236,"Tale of Springtime, A (Conte de Printemps) (1990)",Drama|Romance,97106,28213.0,"The story of an introverted young girl  just reaching adulthood who takes a liking to an older woman she meets at a party and determines to match her off with her father, despite the latter's already having a lover of his own.",6.86,157,"['Drama', 'Romance']",4.0
5269,"Piano Teacher, The (La pianiste) (2001)",Drama,254686,1791.0,"Erika Kohut, a sexually repressed piano teacher living with her domineering mother, meets a young man who starts romantically pursuing her.",7.3,1180,"['Drama', 'Romance']",5.0
5339,Husbands and Wives (1992),Comedy|Drama,104466,28384.0,"When their best friends announce that they're separating, a professor and his wife discover the faults in their own marriage.",7.0,474,"['Comedy', 'Drama', 'Romance']",4.5
5354,Cactus Flower (1969),Comedy,64117,28289.0,"A dentist pretends to be married to avoid commitment, but when he falls for his girlfriend and proposes, he must recruit his lovelorn nurse to pose as his wife.",7.1,227,"['Comedy', 'Romance']",3.5
5377,About a Boy (2002),Comedy|Drama|Romance,276751,245.0,"Will Freeman is a good-looking, smooth-talking bachelor whose primary goal in life is avoiding any kind of responsibility. But when he invents an imaginary son in order to meet attractive single moms, Will gets a hilarious lesson about life from a bright, but hopelessly geeky 12-year-old named Marcus. Now, as Will struggles to teach Marcus the art of being cool, Marcus teaches Will that you're never too old to grow up.",6.7,2290,"['Drama', 'Comedy', 'Romance']",3.5
5388,Insomnia (2002),Action|Crime|Drama|Mystery|Thriller,278504,320.0,Two Los Angeles homicide detectives are dispatched to a northern town where the sun doesn't set to investigate the methodical murder of a local teen.,6.954,4974,"['Thriller', 'Crime', 'Drama']",4.0
5395,"Gambler, The (1974)",Drama,71532,44800.0,New York City English professor Axel Freed outwardly seems like an upstanding citizen. But privately Freed is in the clutches of a severe gambling addiction that threatens to destroy him.,6.7,116,"['Drama', 'Crime']",4.0
5418,"Bourne Identity, The (2002)",Action|Mystery|Thriller,258463,2501.0,"Wounded to the brink of death and suffering from amnesia, Jason Bourne is rescued at sea by a fisherman. With nothing to go on but a Swiss bank account number, he starts to reconstruct his life, but finds that many people he encounters want him dead. However, Bourne realizes that he has the combat and mental skills of a world-class spy—but who does he work for?",7.469,9662,"['Action', 'Drama', 'Mystery', 'Thriller']",4.5
5445,Minority Report (2002),Action|Crime|Mystery|Sci-Fi|Thriller,181689,180.0,"John Anderton is a top 'Precrime' cop in the late-21st century, when technology can predict crimes before they're committed. But Anderton becomes the quarry when another investigator targets him for a murder charge.",7.351,9170,"['Science Fiction', 'Action', 'Thriller']",3.0
5449,Mr. Deeds (2002),Comedy|Romance,280590,2022.0,"When Longfellow Deeds, a small-town pizzeria owner and poet, inherits $40 billion from his deceased uncle, he quickly begins rolling in a different kind of dough. Moving to the big city, Deeds finds himself besieged by opportunists all gunning for their piece of the pie. Babe, a television tabloid reporter, poses as an innocent small-town girl to do an exposé on Deeds.",5.913,2398,"['Comedy', 'Romance']",2.0
5475,Z (1969),Drama|Mystery|Thriller,65234,2721.0,"Amid a tense political climate, the opposition leader is killed in an apparent accident. When a prosecutor smells a cover-up, witnesses get targeted. A thinly veiled dramatization of the assassination of Greek politician Grigoris Lambrakis and its aftermath, “Z” captures the outrage at the US-backed junta that ruled Greece at the time of its release.",7.8,580,"['Thriller', 'Crime', 'Drama']",4.5
5481,Austin Powers in Goldmember (2002),Comedy,295178,818.0,"The world's most shagadelic spy continues his fight against Dr. Evil. This time, the diabolical doctor and his clone, Mini-Me, team up with a new foe—'70s kingpin Goldmember. While pursuing the team of villains to stop them from world domination, Austin gets help from his dad and an old girlfriend.",5.998,3251,"['Comedy', 'Crime', 'Science Fiction']",3.5
5516,Read My Lips (Sur mes lèvres) (2001),Crime|Drama|Thriller,274117,6173.0,She is almost deaf and she lip-reads. He is an ex-convict. She wants to help him. He thinks no one can help except himself.,7.1,344,"['Crime', 'Drama', 'Romance', 'Thriller']",4.0
5548,Down and Out in Beverly Hills (1986),Comedy,90966,9941.0,Beverly Hills couple Barbara and Dave Whiteman find their lives altered by the arrival of a vagrant who tries to drown himself in their swimming pool.,5.9,267,['Comedy'],3.0
5673,Punch-Drunk Love (2002),Comedy|Drama|Romance,272338,8051.0,A socially awkward and volatile small business owner meets the love of his life after being threatened by a gang of scammers.,7.113,2527,"['Romance', 'Drama', 'Comedy']",4.0
5712,Blow Out (1981),Mystery|Thriller,82085,11644.0,"While recording sound effects for a slasher flick, Jack Terry stumbles upon a real-life horror: a car careening off a bridge and into a river. Jack jumps into the water and fishes out Sally from the car, but the other passenger is already dead — a governor intending to run for president. As Jack does some investigating of his tapes, and starts a perilous romance with Sally, he enters a tangled web of conspiracy that might leave him dead.",7.375,1564,"['Thriller', 'Mystery', 'Crime', 'Drama']",4.5
