movieId,title,genres,imdbId,tmdbId,overview,tmdb_vote_average,tmdb_vote_count,tmdb_genres,rating
32,Twelve Monkeys (a.k.a. 12 Monkeys) (1995),Mystery|Sci-Fi|Thriller,114746,63.0,"In the year 2035, convict James Cole reluctantly volunteers to be sent back in time to discover the origin of a deadly virus that wiped out nearly all of the earth's population and forced the survivors into underground communities. But when Cole is mistakenly sent to 1990 instead of 1996, he's arrested and locked up in a mental hospital. There he meets psychiatrist Dr. Kathryn Railly and the son of a famous virus expert who may hold the key to the Army of the 12 Monkeys; thought to be responsible for unleashing the killer disease.",7.601,8713,"['Science Fiction', 'Thriller', 'Mystery']",4.0
47,Seven (a.k.a. Se7en) (1995),Mystery|Thriller,114369,807.0,"Two homicide detectives are on a desperate hunt for a serial killer whose crimes are based on the ""seven deadly sins"" in this dark and haunting film that takes viewers from the tortured remains of one victim to the next. The seasoned Det. Somerset researches each sin in an effort to get inside the killer's mind, while his novice partner, Mills, scoffs at his efforts to unravel the case.",8.376,22135,"['Crime', 'Mystery', 'Thriller']",4.0
89,Nick of Time (1995),Action|Thriller,113972,2086.0,An ordinary man is suddenly forced into a plot to kill a politician in exchange for his kidnapped daughter's freedom.,6.2,761,"['Thriller', 'Crime', 'Action']",3.5
229,Death and the Maiden (1994),Drama|Thriller,109579,10531.0,A political activist is convinced that her guest is a man who once tortured her for the government.,7.1,525,"['Drama', 'Thriller']",3.5
233,Exotica (1994),Drama,109759,20156.0,"In the upscale Toronto strip club Exotica, dancer Christina is visited nightly by the obsessive Francis, a depressed tax auditor. Her ex-boyfriend, the club's MC, Eric, still jealously pines for her even as he introduces her onstage, but Eric is having his own relationship problems with the club's female owner. Thomas, a mysterious pet-shop owner, is about to become unexpectedly involved in their lives.",6.616,366,['Drama'],3.5
293,Léon: The Professional (a.k.a. The Professional) (Léon) (1994),Action|Crime|Drama|Thriller,110413,101.0,"Léon, the top hit man in New York, has earned a rep as an effective ""cleaner"". But when his next-door neighbors are wiped out by a loose-cannon DEA agent, he becomes the unwilling custodian of 12-year-old Mathilda. Before long, Mathilda's thoughts turn to revenge, and she considers following in Léon's footsteps.",8.3,15470,"['Crime', 'Drama', 'Action']",3.5
318,"Shawshank Redemption, The (1994)",Crime|Drama,111161,278.0,"Imprisoned in the 1940s for the double murder of his wife and her lover, upstanding banker Andy Dufresne begins a new life at the Shawshank prison, where he puts his accounting skills to work for an amoral warden. During his long stretch in prison, Dufresne comes to be admired by the other inmates -- including an older prisoner named Red -- for his integrity and unquenchable sense of hope.",8.713,28941,"['Drama', 'Crime']",4.0
319,Shallow Grave (1994),Comedy|Drama|Thriller,111149,9905.0,"When David, Juliet, and Alex find their new roommate dead with a large sum of money, they agree to hide the body and keep the cash. However, this newfound fortune gradually corrodes their friendship.",7.001,1073,"['Crime', 'Thriller']",4.5
373,Red Rock West (1992),Thriller,105226,10427.0,"When a promised job for Texan Michael fails to materialize in Wyoming, Mike is mistaken by Wayne to be the hitman he hired to kill his unfaithful wife, Suzanne. Mike takes full advantage of the situation, collects the money, and runs. During his getaway, things go wrong, and soon get worse when he runs into the real hitman, Lyle.",6.7,369,"['Crime', 'Drama', 'Thriller']",3.5
457,"Fugitive, The (1993)",Thriller,106977,5503.0,"Wrongfully convicted of murdering his wife and sentenced to death, Richard Kimble escapes from the law in an attempt to find the real killer and clear his name.",7.466,4529,"['Action', 'Thriller', 'Drama']",4.0
474,In the Line of Fire (1993),Action|Thriller,107206,9386.0,"Veteran Secret Service agent Frank Horrigan is a man haunted by his failure to save President Kennedy while serving protection detail in Dallas. Thirty years later, a man calling himself ""Booth"" threatens the life of the current President, forcing Horrigan to come back to protection detail to confront the ghosts from his past.",7.0,1688,"['Action', 'Drama', 'Thriller', 'Crime', 'Mystery']",4.0
475,In the Name of the Father (1993),Drama,107207,7984.0,"A small-time Belfast thief, Gerry Conlon, is wrongly convicted of an IRA bombing in London, along with his father and friends, and spends 15 years in prison fighting to prove his innocence.",7.896,1848,['Drama'],4.0
555,True Romance (1993),Crime|Thriller,108399,319.0,"Clarence marries hooker Alabama, steals cocaine from her pimp, and tries to sell it in Hollywood, while the owners of the coke try to reclaim it.",7.546,2879,"['Action', 'Crime', 'Romance']",4.5
589,Terminator 2: Judgment Day (1991),Action|Sci-Fi,103064,280.0,"Ten years after the events of the original, a reprogrammed T-800 is sent back in time to protect young John Connor from the shape-shifting T-1000. Together with his mother Sarah, he fights to stop Skynet from triggering a nuclear apocalypse.",8.134,13591,"['Action', 'Thriller', 'Science Fiction']",4.0
593,"Silence of the Lambs, The (1991)",Crime|Horror|Thriller,102926,274.0,"Clarice Starling is a top student at the FBI's training academy.  Jack Crawford wants Clarice to interview Dr. Hannibal Lecter, a brilliant psychiatrist who is also a violent psychopath, serving life behind bars for various acts of murder and cannibalism.  Crawford believes that Lecter may have insight into a case and that Starling, as an attractive young woman, may be just the bait to draw him out.",8.347,17133,"['Crime', 'Thriller', 'Drama']",4.0
608,Fargo (1996),Comedy|Crime|Drama|Thriller,116282,275.0,"Jerry, a small-town Minnesota car salesman is bursting at the seams with debt... but he's got a plan. He's going to hire two thugs to kidnap his wife in a scheme to collect a hefty ransom from his wealthy father-in-law. It's going to be a snap and nobody's going to get hurt... until people start dying. Enter Police Chief Marge, a coffee-drinking, parka-wearing - and extremely pregnant - investigator who'll stop at nothing to get her man. And if you think her small-time investigative skills will give the crooks a run for their ransom... you betcha!",7.851,8587,"['Crime', 'Drama', 'Thriller']",3.0
742,Thinner (1996),Horror|Thriller,117894,10280.0,"An obese lawyer finds himself growing ""Thinner"" when an old Romani man places a hex on him. Now the lawyer must call upon his friends in organized crime to help him persuade the old man to lift the curse. Time is running out for the desperate lawyer as he draws closer to his own death, and grows ever thinner.",5.893,641,"['Fantasy', 'Horror']",3.0
841,"Eyes Without a Face (Yeux sans visage, Les) (1959)",Horror,53459,31417.0,"Dr. Génessier is riddled with guilt after an accident that he caused disfigures the face of his daughter, the once beautiful Christiane, who outsiders believe is dead. Dr. Génessier, along with accomplice and laboratory assistant Louise, kidnaps young women and brings them to the Génessier mansion. After rendering his victims unconscious, Dr. Génessier removes their faces and attempts to graft them on to Christiane's.",7.571,766,"['Drama', 'Horror', 'Thriller']",3.5
866,Bound (1996),Crime|Drama|Romance|Thriller,115736,9303.0,"Corky, a tough female ex-convict working on an apartment renovation in a Chicago building, meets a couple living next door, Caesar, a paranoid mobster, and Violet, his seductive girlfriend, who is immediately attracted to her.",7.2,1010,"['Drama', 'Thriller', 'Crime']",4.5
913,"Maltese Falcon, The (1941)",Film-Noir|Mystery,33870,963.0,"A private detective takes on a case that involves him with three eccentric criminals, a beautiful liar, and their quest for a priceless statuette.",7.7,1781,"['Mystery', 'Crime', 'Thriller']",3.0
928,Rebecca (1940),Drama|Mystery|Romance|Thriller,32976,223.0,"Story of a young woman who marries a fascinating widower only to find out that she must live in the shadow of his former wife, Rebecca, who died mysteriously several years earlier. The young wife must come to grips with the terrible secret of her handsome, cold husband, Max De Winter. She must also deal with the jealous, obsessed Mrs. Danvers, the housekeeper, who will not accept her as the mistress of the house.",7.897,1873,"['Mystery', 'Romance', 'Thriller']",4.0
968,Night of the Living Dead (1968),Horror|Sci-Fi|Thriller,63350,10331.0,A ragtag group barricade themselves in an old Pennsylvania farmhouse to remain safe from a horde of flesh-eating ghouls ravaging the Northeast.,7.6,2576,"['Horror', 'Thriller']",2.5
998,Set It Off (1996),Action|Crime,117603,9400.0,"Four inner-city Black women, determined to end their constant struggle, decide to live by one rule — get what you want or die trying. So the four women take back their lives and take out some banks in the process.",7.2,375,"['Crime', 'Drama', 'Thriller']",2.5
1076,"Innocents, The (1961)",Drama|Horror|Thriller,55018,16372.0,A young governess for two children becomes convinced that the house and grounds are haunted by ghosts and that the children are being possessed.,7.466,627,"['Horror', 'Mystery', 'Drama']",5.0
1092,Basic Instinct (1992),Crime|Mystery|Thriller,103772,402.0,"Catherine, a novelist with an insatiable sexual appetite, becomes a prime suspect when her boyfriend is brutally murdered -- a crime she had described in her latest story.",6.928,4137,"['Thriller', 'Mystery']",4.0
1094,"Crying Game, The (1992)",Drama|Romance|Thriller,104036,11386.0,"Irish Republican Army member Fergus forms an unexpected bond with Jody, a kidnapped British soldier in his custody, despite the warnings of fellow IRA members Jude and Maguire. Jody makes Fergus promise he'll visit his girlfriend, Dil, in London, and when Fergus flees to the city, he seeks her out. Hounded by his former IRA colleagues, he finds himself increasingly drawn to the enigmatic, and surprising, Dil.",6.847,797,"['Crime', 'Drama', 'Thriller']",3.0
1127,"Abyss, The (1989)",Action|Adventure|Sci-Fi|Thriller,96754,2756.0,"A civilian oil rig crew is recruited to conduct a search and rescue effort when a nuclear submarine mysteriously sinks. One diver soon finds himself on a spectacular odyssey 25,000 feet below the ocean's surface where he confronts a mysterious force that has the power to change the world or destroy it.",7.348,3212,"['Adventure', 'Thriller', 'Science Fiction']",3.5
1200,Aliens (1986),Action|Adventure|Horror|Sci-Fi,90605,679.0,"Ripley, the sole survivor of the Nostromo's deadly encounter with the monstrous Alien, returns to Earth after drifting through space in hypersleep for 57 years. Although her story is initially met with skepticism, she agrees to accompany a team of Colonial Marines back to LV-426.",7.952,10335,"['Action', 'Thriller', 'Science Fiction']",4.0
1203,12 Angry Men (1957),Drama,50083,389.0,"The defense and the prosecution have rested and the jury is filing into the jury room to decide if a young Spanish-American is guilty or innocent of murdering his father. What begins as an open and shut case soon becomes a mini-drama of each of the jurors' prejudices and preconceptions about the trial, the accused, and each other.",8.548,9422,['Drama'],4.5
1213,Goodfellas (1990),Crime|Drama,99685,769.0,"The true story of Henry Hill, a half-Irish, half-Sicilian Brooklyn kid who is adopted by neighbourhood gangsters at an early age and climbs the ranks of a Mafia family under the guidance of Jimmy Conway.",8.455,13655,"['Drama', 'Crime']",4.0
1214,Alien (1979),Horror|Sci-Fi,78748,348.0,"During its return to the earth, commercial spaceship Nostromo intercepts a distress signal from a distant planet. When a three-member team of the crew discovers a chamber containing thousands of eggs on the planet, a creature inside one of the eggs attacks an explorer. The entire crew is unaware of the impending nightmare set to descend upon them when the alien parasite planted inside its unfortunate host is birthed.",8.165,15624,"['Horror', 'Science Fiction']",4.0
1215,Army of Darkness (1993),Action|Adventure|Comedy|Fantasy|Horror,106308,766.0,"Ash, a handsome, shotgun-toting, chainsaw-armed department store clerk, is time warped backwards into England's Dark Ages, where he romances a beauty and faces legions of the undead.",7.256,3341,"['Fantasy', 'Horror', 'Comedy']",2.5
1219,Psycho (1960),Crime|Horror,54215,539.0,"When larcenous real estate clerk Marion Crane goes on the lam with a wad of cash and hopes of starting a new life, she ends up at the notorious Bates Motel, where manager Norman Bates cares for his housebound mother.",8.421,10520,"['Horror', 'Thriller', 'Mystery']",5.0
1222,Full Metal Jacket (1987),Drama|War,93058,600.0,A pragmatic U.S. Marine observes the dehumanizing effects the U.S.-Vietnam War has on his fellow recruits from their brutal boot camp training to the bloody street fighting in Hue.,8.123,10991,"['Drama', 'War']",3.0
1258,"Shining, The (1980)",Horror,81505,694.0,"Jack Torrance accepts a caretaker job at the Overlook Hotel, where he, along with his wife Wendy and their son Danny, must live isolated from the rest of the world for the winter. But they aren't prepared for the madness that lurks within.",8.209,18210,"['Horror', 'Thriller']",4.0
1259,Stand by Me (1986),Adventure|Drama,92005,235.0,"After learning that a boy their age has been accidentally killed near their rural homes, four Oregon boys decide to go see the body. On the way, Gordie,  Vern, Chris and Teddy encounter a mean junk man and a marsh full of leeches, as they also learn more about one another and their very different home lives. Just a lark at first, the boys' adventure evolves into a defining event in their lives.",7.9,6179,"['Crime', 'Drama']",4.0
1270,Back to the Future (1985),Adventure|Comedy|Sci-Fi,88763,105.0,"Eighties teenager Marty McFly is accidentally sent back in time to 1955, inadvertently disrupting his parents' first meeting and attracting his mother's romantic interest. Marty must repair the damage to history by rekindling his parents' romance and - with the help of his eccentric inventor friend Doc Brown - return to 1985.",8.321,20899,"['Adventure', 'Comedy', 'Science Fiction']",2.5
1305,"Paris, Texas (1984)",Drama|Romance,87884,655.0,"A man wanders out of the desert not knowing who he is. His brother finds him, and helps to pull his memory back of the life he led before he walked out on his family and disappeared four years earlier.",8.1,2058,['Drama'],3.5
1330,April Fool's Day (1986),Horror,90655,24913.0,"As soon as Muffy St. John and her college friends arrive on her parents' secluded island, someone starts trimming the guest list... one murder at a time.",6.1,364,"['Horror', 'Mystery']",3.0
1343,Cape Fear (1991),Thriller,101540,1598.0,"Sam Bowden is a small-town corporate attorney. Max Cady is a tattooed, cigar-smoking, Bible-quoting, psychotic rapist. What do they have in common? 14 years ago, Sam was a public defender assigned to Max Cady's rape trial, and he made a serious error: he hid a document from his illiterate client that could have gotten him acquitted. Now, the cagey Cady has been released, and he intends to teach Sam Bowden and his family a thing or two about loss.",7.249,3640,"['Drama', 'Crime', 'Thriller']",4.0
1345,Carrie (1976),Drama|Fantasy|Horror|Thriller,74285,7340.0,"Withdrawn and sensitive teen Carrie White faces taunting from classmates at school and abuse from her fanatically pious mother. When strange occurrences start happening around Carrie, she begins to suspect that she has supernatural powers.",7.321,4067,"['Horror', 'Thriller']",3.5
1347,"Nightmare on Elm Street, A (1984)",Horror|Thriller,87800,377.0,"Teenagers in a small town are dropping like flies, apparently in the grip of mass hysteria causing their suicides. A cop's daughter, Nancy Thompson, traces the cause to child molester Fred Krueger, who was burned alive by angry parents many years before. Krueger has now come back in the dreams of his killers' children, claiming their lives as his revenge. Nancy and her boyfriend, Glen, must devise a plan to lure the monster out of the realm of nightmares and into the real world...",7.3,5437,['Horror'],3.5
1350,"Omen, The (1976)",Horror|Mystery|Thriller,75005,794.0,"Immediately after their miscarriage, the US diplomat Robert Thorn adopts the newborn Damien without the knowledge of his wife. Yet what he doesn’t know is that their new son is the son of the devil.",7.405,2256,"['Horror', 'Thriller']",4.0
1361,Paradise Lost: The Child Murders at Robin Hood Hills (1996),Documentary,117293,17204.0,A horrific triple child murder leads to an indictment and trial of three nonconformist boys based on questionable evidence.,7.6,187,"['Documentary', 'Crime']",4.0
1387,Jaws (1975),Action|Horror,73195,578.0,"When the seaside community of Amity finds itself under attack by a dangerous great white shark, the town's chief of police, a young marine biologist, and a grizzled hunter embark on a desperate quest to destroy the beast before it strikes again.",7.678,11035,"['Horror', 'Thriller', 'Adventure']",4.0
1406,La Cérémonie (1995),Crime|Drama|Mystery|Thriller,112769,1802.0,"Sophie, a quiet and shy maid working for an upper-class French family, finds a friend in the energetic and uncompromising postmaster Jeanne, who encourages her to stand up against her bourgeois employers.",7.3,368,"['Drama', 'Thriller']",1.5
1407,Scream (1996),Comedy|Horror|Mystery|Thriller,117571,4232.0,"A year after the murder of her mother, a teenage girl is terrorized by a masked killer who targets her and her friends by using scary movies as part of a deadly game.",7.42,7455,"['Crime', 'Horror', 'Mystery']",3.0
1518,Breakdown (1997),Action|Thriller,118771,2163.0,"On their cross-country drive, a married couple, Jeff and Amy Taylor, experience car trouble after their SUV breaks down. Stranded in the New Mexico desert, the two catch a break when a passing truck driver offers Amy a ride to a nearby café to call for help. Meanwhile, Jeff is able to fix the car and make his way to the café, but Amy isn't there. He tracks down the trucker -- who tells the police he's never seen Jeff or his wife before. Jeff then begins a desperate, frenzied search for Amy.",6.9,1017,"['Crime', 'Mystery', 'Thriller', 'Action', 'Drama']",3.0
1674,Witness (1985),Drama|Romance|Thriller,90329,9281.0,"While protecting an Amish boy – the sole witness to a brutal murder – and his mother, a detective is forced to seek refuge within their community when his own life comes under threat.",7.1,1779,"['Crime', 'Drama', 'Romance', 'Thriller']",4.0
1805,Wild Things (1998),Crime|Drama|Mystery|Thriller,120890,617.0,"When teen-socialite Kelly Van Ryan and troubled bad girl Suzie Toller accuse guidance counselor Sam Lombardo of rape, he's suspended by the school, rejected by the town, and fighting to get his life back. One cop suspects conspiracy, but nothing is what it seems...",6.362,1848,"['Mystery', 'Thriller', 'Drama']",3.5
1913,Picnic at Hanging Rock (1975),Drama|Mystery,73540,11020.0,"In the early 1900s, Miranda attends a girls boarding school in Australia. One Valentine's Day, the school's typically strict headmistress treats the girls to a picnic field trip to an unusual but scenic volcanic formation called Hanging Rock. Despite rules against it, Miranda and several other girls venture off. It's not until the end of the day that the faculty realizes the girls and one of the teachers have disappeared mysteriously.",7.226,838,"['Drama', 'Mystery']",3.0
1982,Halloween (1978),Horror,77651,948.0,"Fifteen years after murdering his sister on Halloween Night 1963, Michael Myers escapes from a mental hospital and returns to the small town of Haddonfield, Illinois to kill again.",7.562,5892,"['Horror', 'Thriller']",3.5
2024,"Rapture, The (1991)",Drama|Mystery,102757,1411.0,"A lonely telephone operator leading an empty, amoral life finds God – only to have her faith continually tested in ways beyond what she could have imagined.",5.9,86,"['Mystery', 'Drama', 'Fantasy', 'Thriller']",3.5
2025,Lolita (1997),Drama|Romance,119558,9769.0,"Humbert Humbert is a middle-aged British novelist who is both appalled by and attracted to the vulgarity of American culture. When he comes to stay at the boarding house run by Charlotte Haze, he soon becomes obsessed with Lolita, the woman's teenaged daughter.",7.134,1880,"['Drama', 'Romance']",2.0
2068,Fanny and Alexander (Fanny och Alexander) (1982),Drama|Fantasy|Mystery,83922,5961.0,"As children in the loving Ekdahl family, Fanny and Alexander enjoy a happy life with their parents, who run a theater company. After their father dies unexpectedly, however, the siblings end up in a joyless home when their mother, Emilie, marries a stern bishop. The bleak situation gradually grows worse as the bishop becomes more controlling, but dedicated relatives make a valiant attempt to aid Emilie, Fanny and Alexander.",7.783,822,"['Fantasy', 'Drama', 'Mystery']",4.0
2076,Blue Velvet (1986),Drama|Mystery|Thriller,90756,793.0,"The discovery of a severed human ear found in a field leads a young man on an investigation related to a beautiful, mysterious nightclub singer and a group of psychopathic criminals who have kidnapped her child.",7.609,3594,"['Mystery', 'Thriller', 'Crime', 'Drama']",2.5
2118,"Dead Zone, The (1983)",Thriller,85407,11336.0,"Johnny Smith is a schoolteacher with his whole life ahead of him but, after leaving his fiancee's home one night, is involved in a car crash which leaves him in a coma for 5 years. When he wakes, he discovers he has an ability to see into the past, present and future life of anyone with whom he comes into physical contact.",7.0,1721,"['Thriller', 'Horror', 'Science Fiction']",4.0
2160,Rosemary's Baby (1968),Drama|Horror|Thriller,63522,805.0,"A young couple, Rosemary and Guy, moves into an infamous New York apartment building, known by frightening legends and mysterious events, with the purpose of starting a family.",7.825,4143,"['Drama', 'Horror', 'Thriller']",4.0
2232,Cube (1997),Horror|Mystery|Sci-Fi|Thriller,123755,431.0,"A group of strangers find themselves trapped in a maze-like prison. It soon becomes clear that each of them possesses the peculiar skills necessary to escape, if they don't wind up dead first.",6.809,4977,"['Thriller', 'Science Fiction', 'Mystery']",4.0
2288,"Thing, The (1982)",Action|Horror|Sci-Fi|Thriller,84787,1091.0,"A twelve-man team at a remote Antarctic research station discovers an alien buried in the snow for over 100,000 years. Soon unfrozen, the form-changing creature wreaks havoc, creates terror...And becomes one of them.",8.069,7462,"['Horror', 'Mystery', 'Science Fiction']",4.0
2291,Edward Scissorhands (1990),Drama|Fantasy|Romance,99487,162.0,A small suburban town receives a visit from a castaway unfinished science experiment named Edward.,7.719,13335,"['Fantasy', 'Drama', 'Romance']",4.0
2313,"Elephant Man, The (1980)",Drama,80678,1955.0,"A Victorian surgeon rescues a heavily disfigured man being mistreated by his ""owner"" as a side-show freak. Behind his monstrous façade, there is revealed a person of great intelligence and sensitivity. Based on the true story of Joseph Merrick (called John Merrick in the film), a severely deformed man in 19th century London.",8.048,3731,"['Drama', 'History']",4.0
2320,Apt Pupil (1998),Drama|Thriller,118636,9445.0,"One day in 1984, Todd Bowden, a brilliant high school boy fascinated by the history of Nazism, stumbles across an old man whose appearance resembles that of Kurt Dussander, a wanted Nazi war criminal. A month later, Todd decides to knock on his door.",6.525,676,"['Drama', 'Thriller']",3.0
2329,American History X (1998),Crime|Drama,120586,73.0,"Derek Vineyard is paroled after serving 3 years in prison for killing two African-American men. Through his brother, Danny Vineyard's narration, we learn that before going to prison, Derek was a skinhead and the leader of a violent white supremacist gang that committed acts of racial crime throughout L.A. and his actions greatly influenced Danny. Reformed and fresh out of prison, Derek severs contact with the gang and becomes determined to keep Danny from going down the same violent path as he did.",8.333,12059,['Drama'],3.5
2344,Runaway Train (1985),Action|Adventure|Drama|Thriller,89941,11893.0,A hardened convict and a younger prisoner escape from a brutal prison in the middle of winter only to find themselves on an out-of-control train with a female railway worker while being pursued by the vengeful head of security.,6.965,612,"['Action', 'Thriller', 'Drama', 'Adventure']",4.0
2346,"Stepford Wives, The (1975)",Mystery|Sci-Fi|Thriller,73747,12223.0,"Joanna Eberhart has come to the quaint little town of Stepford, Connecticut with her family, but soon discovers there lies a sinister truth in the all too perfect behavior of the female residents.",6.689,337,"['Mystery', 'Thriller', 'Science Fiction', 'Horror']",3.5
2391,"Simple Plan, A (1998)",Crime|Drama|Thriller,120324,10223.0,"Captivated by the lure of sudden wealth, the quiet rural lives of two brothers erupt into conflicts of greed, paranoia and distrust when over $4 million in cash is discovered at the remote site of a downed small airplane. Their simple plan to retain the money while avoiding detection opens a Pandora's box when the fear of getting caught triggers panicked behavior and leads to virulent consequences.",7.199,995,"['Crime', 'Drama', 'Thriller']",5.0
