movieId,title,genres,imdbId,tmdbId,overview,tmdb_vote_average,tmdb_vote_count,tmdb_genres,rating
101739,Evil Dead (2013),Horror,1288558,109428.0,"Mia, a drug addict, is determined to kick the habit. To that end, she asks her brother, David, his girlfriend, Natalie and their friends Olivia and Eric to accompany her to their family's remote forest cabin to help her through withdrawal. Eric finds a mysterious Book of the Dead at the cabin and reads aloud from it, awakening an ancient demon. All hell breaks loose when the malevolent entity possesses Mia.",6.578,4813,['Horror'],3.0
101864,Oblivion (2013),Action|Adventure|Sci-Fi|IMAX,1483013,75612.0,"Jack Harper is one of the last few drone repairmen stationed on Earth. Part of a massive operation to extract vital resources after decades of war with a terrifying threat known as the Scavs, Jack’s mission is nearly complete. His existence is brought crashing down when he rescues a beautiful  stranger from a downed spacecraft. Her arrival triggers a chain of events that  forces him to question everything he knows and puts the fate of humanity in his hands.",6.661,11087,"['Action', 'Science Fiction', 'Adventure', 'Mystery']",3.0
102066,Resolution (2012),Horror|Thriller,1977895,121606.0,"A man imprisons his estranged junkie friend in an isolated cabin in the boonies of San Diego to force him through a week of sobriety, but the events of that week are being mysteriously manipulated.",6.326,416,"['Horror', 'Thriller', 'Mystery']",3.0
102194,Mud (2012),Adventure|Crime|Drama,1935179,103731.0,Two teenage boys find a fugitive hiding out on an island in the Mississippi River and help him reunite with his lover and escape an avenging family and their armed posse.,7.063,2924,['Drama'],3.0
102905,Lovelace (2013),Drama,1426329,77805.0,"Story of Linda Lovelace, who is used and abused by the porn industry at the behest of her coercive husband, before taking control of her life.",6.021,712,['Drama'],3.0
103685,"Field in England, A (2013)",Drama|Fantasy|Thriller|War,2375574,179111.0,"During the Civil War in 17th-Century England, a small group of deserters flee from a raging battle through an overgrown field. They are captured by an alchemist, who forces the group to aid him in his search to find a hidden treasure that he believes is buried in the field. Crossing a vast mushroom circle, which provides their first meal, the group quickly descend into a chaos of arguments, fighting and paranoia, and, as it becomes clear that the treasure might be something other than gold, they slowly become victim to the terrifying energies trapped inside the field.",6.2,276,"['Horror', 'Thriller', 'Fantasy']",3.0
103688,"Conjuring, The (2013)",Horror|Thriller,1457767,138843.0,"Paranormal investigators Ed and Lorraine Warren work to help a family terrorized by a dark presence in their farmhouse. Forced to confront a powerful entity, the Warrens find themselves caught in the most terrifying case of their lives.",7.54,12214,"['Horror', 'Thriller']",3.0
104879,Prisoners (2013),Drama|Mystery|Thriller,1392214,146233.0,"Keller Dover is facing every parent’s worst nightmare. His six-year-old daughter, Anna, is missing, together with her young friend, Joy, and as minutes turn to hours, panic sets in. The only lead is a dilapidated RV that had earlier been parked on their street.",8.099,12461,"['Drama', 'Thriller', 'Crime']",4.0
104881,"Out of the Furnace (Dust to Dust) (Low Dweller, The) (2013)",Drama|Thriller,1206543,164457.0,"Two brothers live in the economically-depressed Rust Belt, when a cruel twist of fate lands one in prison. His brother is then lured into one of the most violent crime rings in the Northeast.",6.57,2029,"['Thriller', 'Drama', 'Crime']",3.0
106100,Dallas Buyers Club (2013),Drama,790636,152532.0,"Loosely based on the true-life tale of Ron Woodroof, a drug-taking, women-loving, homophobic man who in 1986 was diagnosed with HIV/AIDS and given thirty days to live.",7.92,8747,"['Drama', 'History']",3.5
106782,"Wolf of Wall Street, The (2013)",Comedy|Crime|Drama,993846,106646.0,"A New York stockbroker refuses to cooperate in a large securities fraud case involving corruption on Wall Street, corporate banking world and mob infiltration. Based on Jordan Belfort's autobiography.",8.028,25018,"['Crime', 'Drama', 'Comedy']",3.0
106920,Her (2013),Drama|Romance|Sci-Fi,1798709,152601.0,"In the not so distant future, Theodore, a lonely writer, purchases a newly developed operating system designed to meet the user's every need. To Theodore's surprise, a romantic relationship develops between him and his operating system. This unconventional love story blends science fiction and romance in a sweet tale that explores the nature of love and the ways that technology isolates and connects us all.",7.846,14774,"['Romance', 'Science Fiction', 'Drama']",4.5
107406,Snowpiercer (2013),Action|Drama|Sci-Fi,1706620,110415.0,"In a future where a failed global-warming experiment kills off most life on the planet, a class system evolves aboard the Snowpiercer; a train that travels around the globe via a perpetual-motion engine.",6.908,10015,"['Action', 'Science Fiction', 'Drama']",3.0
108729,Enemy (2013),Mystery|Thriller,2316411,181886.0,A mild-mannered college professor discovers a look-alike actor and delves into the other man's private affairs.,6.854,6152,"['Thriller', 'Mystery']",3.0
109487,Interstellar (2014),Sci-Fi|IMAX,816692,157336.0,The adventures of a group of explorers who make use of a newly discovered wormhole to surpass the limitations on human space travel and conquer the vast distances involved in an interstellar voyage.,8.461,37933,"['Adventure', 'Drama', 'Science Fiction']",3.5
109848,Under the Skin (2013),Horror|Sci-Fi|Thriller,1441395,97370.0,A seductive stranger prowls the streets of Glasgow in search of prey: unsuspecting men who fall under her spell.,6.1,3611,"['Thriller', 'Science Fiction', 'Drama']",4.5
110110,Starred Up (2013),Drama,2567712,209276.0,"19-year-old Eric, arrogant and ultra-violent, is prematurely transferred to the same adult prison facility as his estranged father. As his explosive temper quickly finds him enemies in both prison authorities and fellow inmates — and his already volatile relationship with his father is pushed past breaking point — Eric is approached by a volunteer psychotherapist, who runs an anger management group for prisoners. Torn between gang politics, prison corruption, and a glimmer of something better, Eric finds himself in a fight for his own life, unsure if his own father is there to protect him or join in punishing him.",7.1,973,['Drama'],3.0
110882,Locke (2013),Drama,2692904,210479.0,"Ivan Locke has worked hard to craft a good life for himself. Tonight, that life will collapse around him. On the eve of the biggest challenge of his career, Ivan receives a phone call that sets in motion a series of events that will unravel his family, job, and soul.",6.9,2789,"['Drama', 'Thriller']",4.0
111235,Jodorowsky's Dune (2013),Documentary|Sci-Fi,1935156,191720.0,"In 1974, Chilean-French director Alejandro Jodorowsky embarked on the quixotic project of adapting Frank Herbert's influential novel Dune (1969) for the big screen. After investing two years, and millions of dollars, the gigantic project ended in failure; but the artists Jodorowsky brought together to carry it out continued to work together, and ended up laying the foundations for modern science fiction cinema.",7.8,712,['Documentary'],4.0
111384,Blue Ruin (2013),Thriller,2359024,188166.0,"When the quiet life of a beach bum is upended by dreadful news, he sets off for his childhood home to carry out an act of vengeance. However, he proves an inept assassin and finds himself in a brutal fight to protect his estranged family.",6.8,1530,"['Crime', 'Thriller']",4.0
112552,Whiplash (2014),Drama,2582802,244786.0,"Under the direction of a ruthless instructor, a talented young drummer begins to pursue perfection at any cost, even his humanity.",8.376,15935,"['Drama', 'Music']",4.0
112556,Gone Girl (2014),Drama|Thriller,2267998,210577.0,"With his wife's disappearance having become the focus of an intense media circus, a man sees the spotlight turned on him when it's suspected that he may not be innocent.",7.89,19293,"['Mystery', 'Thriller', 'Drama']",4.0
112582,Life Itself (2014),Documentary,2382298,250766.0,"The surprising and entertaining life of renowned film critic and social commentator Roger Ebert (1942-2013): his early days as a freewheeling bachelor and Pulitzer Prize winner, his famously contentious partnership with Gene Siskel, his life-altering marriage, and his brave and transcendent battle with cancer.",7.489,358,['Documentary'],4.0
112804,I Origins (2014),Drama|Sci-Fi,2884206,244267.0,A molecular biologist's study of the human eye has far-reaching implications about humanity's scientific and spiritual beliefs.,7.582,3330,"['Science Fiction', 'Drama']",3.0
113741,Coherence (2013),Drama|Mystery|Sci-Fi|Thriller,2866360,220289.0,Four couples gather for dinner the night a mysterious and powerful comet passes overhead.,7.2,3165,"['Thriller', 'Science Fiction']",3.0
113862,"Guest, The (2014)",Thriller,2980592,241848.0,"A soldier introduces himself to the Peterson family, claiming to be a friend of their son who died in action. After the young man is welcomed into their home, a series of accidental deaths seem to be connected to his presence.",6.649,2038,"['Mystery', 'Thriller', 'Action']",2.0
114060,The Drop (2014),Crime|Drama|Thriller,1600196,154400.0,"Bob Saginowski finds himself at the center of a robbery gone awry and entwined in an investigation that digs deep into the neighborhood's past where friends, families, and foes all work together to make a living - no matter the cost.",6.806,2290,"['Drama', 'Crime']",3.5
115569,Nightcrawler (2014),Crime|Drama|Thriller,2872718,242582.0,"When Lou Bloom, desperate for work, muscles into the world of L.A. crime journalism, he blurs the line between observer and participant to become the star of his own story. Aiding him in his effort is Nina, a TV-news veteran.",7.705,11245,"['Crime', 'Drama', 'Thriller']",4.0
115713,Ex Machina (2015),Drama|Sci-Fi|Thriller,470752,264660.0,"Caleb, a coder at the world's largest internet company, wins a competition to spend a week at a private mountain retreat belonging to Nathan, the reclusive CEO of the company. But when Caleb arrives at the remote location he finds that he will have to participate in a strange and fascinating experiment in which he must interact with the world's first true artificial intelligence, housed in the body of a beautiful robot girl.",7.573,13724,"['Drama', 'Science Fiction']",3.0
115967,These Final Hours (2014),Drama|Thriller,2268458,199575.0,"What would you do on the last day on Earth?  With the end of the world only hours away, the self-absorbed James heads to the ultimate party-to-end-all-parties. On his way there, he saves the life of a young girl named Rose who is searching desperately for her missing father. This simple act sets James on a path to redemption.",6.5,583,"['Science Fiction', 'Drama', 'Thriller']",3.5
118700,Selma (2014),Drama,1020072,273895.0,"""Selma,"" as in Alabama, the place where segregation in the South was at its worst, leading to a march that ended in violence, forcing a famous statement by President Lyndon B. Johnson that ultimately led to the signing of the Voting Rights Act.",7.388,2259,"['History', 'Drama']",3.5
118898,A Most Violent Year (2014),Action|Crime|Drama|Thriller,2937898,241239.0,"A thriller set in New York City during the winter of 1981, statistically one of the most violent years in the city's history, and centered on the lives of an immigrant and his family trying to expand their business and capitalize on opportunities as the rampant violence, decay, and corruption of the day drag them in and threaten to destroy all they have built.",6.605,1471,"['Crime', 'Drama', 'Thriller']",3.0
118930,Bill Burr: I'm Sorry You Feel That Way (2014),Comedy,3823690,308571.0,"Fresh, unflinching and devastatingly honest, Bill Burr lets loose in this feature length comedy special. Burr shares his essential tips for surviving the zombie apocalypse, exposes how rom-coms ruin great sex and explains how too many childhood hugs may be the ultimate downfall of man.",7.741,160,['Comedy'],3.0
121231,It Follows (2014),Horror,3235888,270303.0,"When carefree teenager Jay sleeps with her older boyfriend for the first time, she learns that she is the latest recipient of a fatal curse that is passed from victim to victim via sexual intercourse. Death, Jay learns, will creep inexorably toward her as either a friend or a stranger. Jay's friends don't believe her seemingly paranoid ravings, until they too begin to see the phantom assassins and band together to help her defend herself.",6.588,6647,"['Horror', 'Mystery']",4.5
122882,Mad Max: Fury Road (2015),Action|Adventure|Sci-Fi|Thriller,1392190,76341.0,"An apocalyptic story set in the furthest reaches of our planet, in a stark desert landscape where humanity is broken, and most everyone is crazed fighting for the necessities of life. Within this world exist two rebels on the run who just might be able to restore order.",7.6,23392,"['Action', 'Adventure', 'Science Fiction']",4.0
127152,Going Clear: Scientology and the Prison of Belief (2015),Documentary,4257858,318224.0,"GOING CLEAR intimately profiles eight former members of the Church of Scientology, shining a light on how they attract true believers and the things they do in the name of religion.",7.589,833,"['Documentary', 'TV Movie']",3.5
128620,Victoria (2015),Crime|Drama|Romance,4226388,320007.0,A young Spanish woman who has newly moved to Berlin finds her flirtation with a local guy turn potentially deadly as their night out with his friends reveals a dangerous secret.,7.61,1273,"['Crime', 'Thriller', 'Romance']",3.5
130840,Spring (2015),Horror|Romance|Sci-Fi,3395184,241855.0,"A young man in a personal tailspin flees the US to Italy, where he sparks up a romance with a woman harboring a dark, primordial secret.",6.633,732,"['Horror', 'Romance', 'Science Fiction']",3.0
133357,The Seven Five (2014),Documentary,4136056,320882.0,Meet the dirtiest cop in NYC history. Michael Dowd stole money and dealt drugs while patrolling the streets of '80s Brooklyn.,7.3,101,['Documentary'],3.5
133832,The Green Inferno (2014),Horror|Thriller,2403021,171424.0,"A group of student activists travel from New York City to the Amazon to save the rainforest.  However, once they arrive in this vast green landscape, they soon discover that they are not alone… and that no good deed goes unpunished.",5.737,1512,"['Adventure', 'Horror']",3.0
134248,Hot Girls Wanted (2015),Documentary,4382552,318256.0,A first-ever look at the realities of the professional “amateur” porn world and the steady stream of 18-to-19-year old girls entering into it.,6.086,683,['Documentary'],3.0
139385,The Revenant (2015),Adventure|Drama,1663202,281957.0,"In the 1820s, a frontiersman, Hugh Glass, sets out on a path of vengeance against those who left him for dead after a bear mauling.",7.536,18694,"['Western', 'Drama', 'Adventure']",3.0
139644,Sicario (2015),Crime|Drama|Mystery,3397884,273481.0,An idealistic FBI agent is enlisted by a government task force to aid in the escalating war against drugs at the border area between the U.S. and Mexico.,7.416,9110,"['Action', 'Crime', 'Thriller']",3.0
139655,Goodnight Mommy (Ich seh ich seh) (2014),Drama|Fantasy|Horror|Thriller,3086442,284303.0,"In the heat of the summer lays a lonesome house in the countryside where nine year old twin brothers await their mother’s return.  When she comes home, bandaged after cosmetic surgery, nothing is like before and the children start to doubt whether this woman is actually who she says she is.",6.671,1639,"['Horror', 'Mystery', 'Thriller']",3.0
140247,The Gift (2015),Drama|Horror,4178092,328425.0,Simon and Robyn are a young married couple whose life is going as planned until a chance run-in with Simon's high school acquaintance sends their world into a tailspin.,6.695,3339,"['Thriller', 'Mystery', 'Drama']",3.5
140267,The Witch (2015),Horror,4263482,310131.0,"In 1630, a farmer relocates his family to a remote plot of land on the edge of a forest where strange, unsettling things happen. With suspicion and paranoia mounting, each family member's faith, loyalty and love are tested in shocking ways.",6.992,7339,"['Horror', 'Fantasy', 'Drama']",5.0
140816,Tangerine (2015),Comedy|Drama,3824458,308084.0,"It's Christmas Eve in Tinseltown and Sin-Dee is back on the block. Upon hearing that her pimp boyfriend hasn't been faithful during the 28 days she was locked up, the working girl and her best friend, Alexandra, embark on a mission to get to the bottom of the scandalous rumor. Their rip-roaring odyssey leads them through various subcultures of Los Angeles, including an Armenian family dealing with their own repercussions of infidelity.",6.9,755,"['Comedy', 'Drama']",3.5
141866,Green Room (2015),(no genres listed),4062536,313922.0,A punk rock band is forced to fight for survival after witnessing an act of violence at a skinhead bar.,6.7,2812,"['Horror', 'Crime', 'Thriller']",3.5
142488,Spotlight (2015),Thriller,1895587,314365.0,"The true story of how the Boston Globe uncovered the massive scandal of child molestation and cover-up within the local Catholic Archdiocese, shaking the entire Catholic Church to its core.",7.813,8492,"['Drama', 'History']",4.0
143657,The Invitation (2015),Horror|Thriller,2400463,306947.0,"Will and his new girlfriend Kira are invited to a dinner with old friends at the house of Will’s ex Eden and her new partner David. Although the evening appears to be relaxed, Will soon gets a creeping suspicion that their charming host David is up to something.",6.427,2724,"['Thriller', 'Horror']",4.0
144172,February (2015),Horror,3286052,334536.0,"Two young women at a prestigious prep school are assailed by an evil, invisible power when they're stranded over winter break.",5.88,729,"['Horror', 'Mystery']",4.0
144976,Bone Tomahawk (2015),Horror|Western,2494362,294963.0,"During a shootout in a saloon, Sheriff Hunt injures a suspicious stranger. The doctor's assistant, wife of the local foreman, tends to him in prison. That night, the town is attacked and they both disappear—only the arrow of a cannibal tribe is found. Hunt and a few of his men go in search of the prisoner and the foreman's wife.",6.872,2385,"['Western', 'Horror', 'Drama']",3.0
146656,Creed (2015),Drama,3076658,312221.0,"The former World Heavyweight Champion Rocky Balboa serves as a trainer and mentor to Adonis Johnson, the son of his late friend and former rival Apollo Creed.",7.408,7697,"['Drama', 'Action']",3.0
148626,"Big Short, The (2015)",Drama,1596363,318846.0,The men who made millions from a global economic meltdown.,7.359,9406,"['Comedy', 'Drama']",3.5
150254,The Devil's Candy (2015),Horror,4935372,354216.0,A struggling painter is possessed by satanic forces after he and his young family move into their dream home in rural Texas.,6.292,674,"['Horror', 'Thriller']",3.0
151587,The Staircase II: The Last Chance (2013),Documentary,2257602,156220.0,"Explosive developments - implicating both the forensics laboratory of the police department of North Carolina, and Duane Deaver, its chief - shed new light on the case of murder suspect Michael Peterson.",7.3,38,['Documentary'],2.5
152077,10 Cloverfield Lane (2016),Thriller,1179933,333371.0,"After a catastrophic car crash, a young woman wakes up in a survivalist's underground bunker, where he claims to have saved her from an apocalyptic attack that has left the outside world uninhabitable.",6.993,8290,"['Thriller', 'Science Fiction', 'Drama', 'Horror']",3.0
155018,Emelie (2015),Horror,4503598,329010.0,"After their regular babysitter cancels, the Thompson family turns to her friend, Anna to supervise their children while the parents go out to celebrate their anniversary. At first Anna seems like a dream come true to the kids, allowing them to eat extra cookies and play with things that are usually off-limits, but as her behaviour becomes increasingly odd, the kids soon find out that her intentions are dark and twisted—and she is not who she seems to be.",5.252,658,"['Horror', 'Thriller']",2.5
155064,The Neon Demon (2016),Drama|Horror|Mystery,1974419,301365.0,"When aspiring model Jesse moves to Los Angeles, her youth and vitality are devoured by a group of beauty-obsessed women who will take any means necessary to get what she has.",6.511,3818,"['Horror', 'Thriller']",3.0
159061,The Wailing (2016),Mystery|Thriller,5215952,293670.0,A stranger arrives in a little village and soon after a mysterious sickness starts spreading. A policeman is drawn into the incident and is forced to solve the mystery in order to save his daughter.,7.4,1890,"['Horror', 'Mystery']",3.5
161582,Hell or High Water (2016),Crime|Drama,2582782,338766.0,A divorced dad and his ex-con brother resort to a desperate scheme in order to save their family's farm in West Texas.,7.303,4643,"['Western', 'Crime', 'Drama']",2.5
161634,Don't Breathe (2016),Thriller,4160708,300669.0,A group of teens break into a blind man's home thinking they'll get away with the perfect crime. They're wrong.,7.014,7707,"['Horror', 'Thriller']",3.5
161830,Body (2015),Drama|Horror|Thriller,3732950,314420.0,A night out turns deadly when three girls break into a seemingly empty mansion.,5.3,69,"['Drama', 'Thriller', 'Crime']",2.5
162082,Train to Busan (2016),Action|Thriller,5700672,396535.0,"When a zombie virus pushes Korea into a state of emergency, those trapped on an express train to Busan must fight for their own survival.",7.752,7976,"['Horror', 'Thriller', 'Action', 'Adventure']",3.5
162414,Moonlight,Drama,4975722,376867.0,"The tender, heartbreaking story of a young man’s struggle to find himself, told across three defining chapters in his life as he experiences the ecstasy, pain, and beauty of falling in love, while grappling with his own sexuality.",7.368,7275,['Drama'],3.5
164179,Arrival (2016),Sci-Fi,2543164,329865.0,"Taking place after alien crafts land around the world, an expert linguist is recruited by the military to determine whether they come in peace or are a threat.",7.62,18572,"['Drama', 'Science Fiction', 'Mystery']",3.5
164367,The Girl with All the Gifts (2016),Drama|Horror|Sci-Fi|Thriller,4547056,375366.0,"In the future, a strange fungus has changed nearly everyone into thoughtless, flesh-eating monsters. When a scientist and a teacher find a girl who seems to be immune to the fungus, they all begin a journey to save humanity.",6.558,2073,"['Action', 'Horror', 'Science Fiction']",2.5
165179,Una (2016),Drama,2315582,301334.0,"When a young woman unexpectedly arrives at an older man's workplace, looking for answers, the secrets of the past threaten to unravel his new life.",6.1,272,"['Drama', 'Thriller']",3.5
165527,Before the Flood (2016),Documentary,5929776,410718.0,"A look at how climate change affects our environment and what society can do to prevent the demise of endangered species, ecosystems, and native communities across the planet.",7.69,799,['Documentary'],3.5
166024,Whiplash (2013),(no genres listed),2654430,367412.0,"A ferocious, bullying music teacher teaches a dedicated student.",7.799,383,"['Drama', 'Music']",4.0
166369,Sour Grapes (2016),Documentary,5728684,396232.0,"Controversy erupts when an unassuming young man floods the American wine market with fake vintages valued in the millions, bamboozling the wine world elite, in this humorous and suspenseful tale of an ingenious con on the eve of the 2008 stock market crash.",7.31,92,['Documentary'],3.5
166946,The Founder (2016),Drama,4276820,310307.0,"The true story of how Ray Kroc, a salesman from Illinois, met Mac and Dick McDonald, who were running a burger operation in 1950s Southern California. Kroc was impressed by the brothers’ speedy system of making the food and saw franchise potential. He maneuvered himself into a position to be able to pull the company from the brothers and create a billion-dollar empire.",7.1,5181,"['Drama', 'History']",3.0
167544,Patriots Day (2016),Drama|Thriller,4572514,388399.0,"In the aftermath of an unspeakable act of terror, Police Sergeant Tommy Saunders joins courageous survivors, first responders and investigators in a race against the clock to hunt down the Boston Marathon bombers before they strike again.",7.058,2730,"['Action', 'Crime', 'Drama', 'History', 'Thriller']",3.0
168250,Get Out (2017),Horror,5052448,419430.0,"Chris and his girlfriend Rose go upstate to visit her parents for the weekend. At first, Chris reads the family's overly accommodating behavior as nervous attempts to deal with their daughter's interracial relationship, but as the weekend progresses, a series of increasingly disturbing discoveries lead him to a truth that he never could have imagined.",7.618,18143,"['Mystery', 'Thriller', 'Horror']",3.5
168426,Beware the Slenderman (2016),Crime|Documentary,5329376,376424.0,In this horrifyingly modern fairytale lurks an online Boogeyman and two 12-year-old girls who would kill for him. The entrance to the internet quickly leads to its darkest basement. How responsible are our children for what they find there?,6.502,258,"['Documentary', 'Crime']",2.0
169670,The Void (2016),Horror,4255304,378018.0,"In the middle of a routine patrol, officer Daniel Carter happens upon a blood-soaked figure limping down a deserted stretch of road. He rushes the young man to a nearby rural hospital staffed by a skeleton crew, only to discover that patients and personnel are transforming into something inhuman. As the horror intensifies, Carter leads the other survivors on a hellish voyage into the subterranean depths of the hospital in a desperate bid to end the nightmare before it's too late.",6.0,1331,"['Mystery', 'Horror', 'Science Fiction']",2.5
