movieId,title,genres,imdbId,tmdbId,overview,tmdb_vote_average,tmdb_vote_count,tmdb_genres,rating
63072,"Road, The (2009)",Adventure|Drama|Thriller,898367,20766.0,"A father and his son walk alone through burned America. Nothing moves in the ravaged landscape save the ash on the wind and water. It is cold enough to crack stones and, when the snow falls, it is gray. Their destination is the warmer south, although they don't know what, if anything, awaits them there.",7.018,4050,"['Adventure', 'Drama']",3.5
64497,"Day the Earth Stood Still, The (2008)",Drama|Sci-Fi|Thriller|IMAX,970416,10200.0,"A representative of an alien race that went through drastic evolution to survive its own climate change, Klaatu comes to Earth to assess whether humanity can prevent the environmental damage they have inflicted on their own planet. When barred from speaking to the United Nations, he decides humankind shall be exterminated so the planet can survive.",5.648,3567,"['Drama', 'Science Fiction', 'Thriller']",2.0
64620,Frost/Nixon (2008),Drama,870111,11499.0,"For three years after being forced from office, Nixon remained silent. But in summer 1977, the steely, cunning former commander-in-chief agreed to sit for one all-inclusive interview to confront the questions of his time in office and the Watergate scandal that ended his presidency. Nixon surprised everyone in selecting Frost as his televised confessor, intending to easily outfox the breezy British showman and secure a place in the hearts and minds of Americans. Likewise, Frost's team harboured doubts about their boss's ability to hold his own. But as the cameras rolled, a charged battle of wits resulted.",7.277,1233,"['Drama', 'History']",3.0
65142,Loft (2008),Crime|Drama|Mystery,926762,17845.0,"Five close friends, all of them married, share a loft to meet their mistresses. One day they find the body of a young woman in the loft. Since there are only five keys to the loft, the five men begin to suspect each other of murder.",6.9,411,"['Drama', 'Mystery', 'Romance']",3.0
65188,Dear Zachary: A Letter to a Son About His Father (2008),Documentary,1152758,15584.0,"In 2001, Andrew Bagby, a medical resident, is murdered not long after breaking up with his girlfriend. Soon after, when she announces she's pregnant, one of Andrew's many close friends, Kurt Kuenne, begins this film, a gift to the child.",8.1,553,"['Documentary', 'Crime']",3.5
65601,My Bloody Valentine 3-D (2009),Horror|Thriller,1179891,14435.0,"Ten years after a Valentine's Day tragedy claimed the lives of five miners, Harry Warden returns for a vengeful massacre among teen sweethearts gearing up for another party.",5.6,1247,"['Horror', 'Thriller']",0.5
68237,Moon (2009),Drama|Mystery|Sci-Fi|Thriller,1182345,17431.0,"With only three weeks left in his three-year contract, Sam Bell is getting anxious to finally return to Earth. He is the only occupant of a Moon-based manufacturing facility along with his computer and assistant, GERTY. When he has an accident however, he awakens to find that he is not alone.",7.565,5966,"['Science Fiction', 'Drama']",3.5
68536,Stanley Kubrick: A Life in Pictures (2001),Documentary,278736,30416.0,"With commentary from Hollywood stars, outtakes from his movies and footage from his youth, this documentary looks at Stanley Kubrick's life and films. Director Jan Harlan, Kubrick's brother-in-law and sometime collaborator, interviews heavyweights like Jack Nicholson, Woody Allen and Sydney Pollack, who explain the influence of Kubrick classics like ""Dr. Strangelove"" and ""2001: A Space Odyssey,"" and how he absorbed visual clues from disposable culture such as television commercials.",7.4,194,['Documentary'],3.5
68552,Crossing Over (2009),Drama,924129,15577.0,"Immigrants from around the world enter Los Angeles every day, with hopeful visions of a better life, but little notion of what that life may cost. Their desperate scenarios test the humanity of immigration enforcement officers. In Crossing Over, writer-director Wayne Kramer explores the allure of the American dream, and the reality that immigrants find – and create -- in 21st century L.A.",6.1,385,"['Crime', 'Drama']",2.0
69134,Antichrist (2009),Drama|Fantasy,870984,17609.0,"A grieving couple retreats to their cabin 'Eden' in the woods, hoping to repair their broken hearts and troubled marriage. But nature takes its course and things go from bad to worse.",6.632,2699,"['Drama', 'Horror', 'Thriller']",3.0
69481,"Hurt Locker, The (2008)",Action|Drama|Thriller|War,887912,12162.0,"During the Iraq War, a Sergeant recently assigned to an army bomb squad is put at odds with his squad mates due to his maverick way of handling his work.",7.257,5859,"['Drama', 'Thriller', 'War']",3.0
71131,"Most Hated Family in America, The (2007)",Documentary,1000764,63581.0,"Louis meets the Phelps family — the people at the heart of the controversial Westboro Baptist Church. The Phelps have rabid anti-homosexual beliefs, and often campaign at the funerals of American soldiers. They believe that every tragedy in the world is God's punishment for homosexuality.",7.3,78,"['Documentary', 'TV Movie']",3.0
72176,Big Fan (2009),Comedy|Crime|Drama,1228953,29150.0,"Paul Aufiero, a 35-year-old parking-garage attendant from Staten Island, is the self-described ""world's biggest New York Giants fan"". One night, Paul and his best friend Sal spot Giants star linebacker Quantrell Bishop at a gas station and decide to follow him. At a strip club Paul cautiously decides to approach him but the chance encounter brings Paul's world crashing down around him.",6.06,134,"['Comedy', 'Drama']",3.0
72479,"Messenger, The (2009)",Drama|Romance|War,790712,28089.0,"Will Montgomery, a U.S. Army Staff Sergeant who has returned home from Iraq, is assigned to the Army’s Casualty Notification service. Montgomery is partnered with Captain Tony Stone, to give notice to the families of fallen soldiers. The Sergeant is drawn to Olivia Pitterson, to whom he has delivered news of her husband’s death.",6.8,453,"['Drama', 'Romance']",3.0
73023,Crazy Heart (2009),Drama|Romance,1263670,25196.0,"When reporter Jean Craddock interviews Bad Blake—an alcoholic, seen-better-days country music legend—they connect, and the hard-living crooner sees a possible saving grace in a life with Jean and her young son.",6.919,1107,"['Drama', 'Music', 'Romance']",3.5
73392,Collapse (2009),Documentary,1503769,28227.0,"From the acclaimed director of American Movie, the documentary follows former Los Angeles police officer turned independent reporter Michael Ruppert. He recounts his career as a radical thinker and spells out his apocalyptic vision of the future, spanning the crises in economics, energy, environment and more.",7.2,100,"['Documentary', 'Drama']",2.0
74228,Triangle (2009),Drama|Horror|Mystery|Thriller,1187064,26466.0,"When Jess sets sail on a yacht with a group of friends, she cannot shake the feeling that there is something wrong.",6.9,2796,['Horror'],2.5
74370,"House of the Devil, The (2009)",Horror|Thriller,1172994,25983.0,"A young college student who’s struggling financially takes a strange babysitting job which coincides with a full lunar eclipse. She slowly realizes her clients harbor a terrifying secret, putting her life in mortal danger.",6.275,799,"['Horror', 'Mystery']",3.0
74416,Fish Tank (2009),Drama,1232776,24469.0,"Fifteen-year-old Mia is in a constant state of war with her family and the world around her. When she meets her party-girl mother’s charming new boyfriend Connor, she is amazed to find he returns her attention, and believes he might help her start to make sense of her life.",6.935,891,['Drama'],3.5
74458,Shutter Island (2010),Drama|Mystery|Thriller,1130884,11324.0,"World War II soldier-turned-U.S. Marshal Teddy Daniels investigates the disappearance of a patient from a hospital for the criminally insane, but his efforts are compromised by troubling visions and a mysterious doctor.",8.201,24909,"['Drama', 'Thriller', 'Mystery']",3.0
75395,Frozen (2010),Drama|Horror|Thriller,1323045,44363.0,"When three skiers find themselves stranded on a chair lift at a New England ski resort that has closed for the next week, they are forced to make life or death choices that prove to be more perilous than staying put and freezing to death.",6.0,1915,['Thriller'],3.0
76079,Chloe (2009),Drama|Thriller,1352824,28211.0,"A doctor hires an escort to seduce her husband, whom she suspects of cheating, though unforeseen events put the family in danger.",6.12,1784,"['Drama', 'Thriller', 'Mystery']",2.5
77307,Dogtooth (Kynodontas) (2009),Drama,1379182,38810.0,"Three teenagers are confined to an isolated country estate that could very well be on another planet. The trio spend their days listening to endless homemade tapes that teach them a whole new vocabulary. Any word that comes from beyond their family abode is instantly assigned a new meaning. Hence 'the sea' refers to a large armchair and 'zombies' are little yellow flowers. Having invented a brother whom they claim to have ostracized for his disobedience, the uber-controlling parents terrorize their offspring into submission.",7.1,2478,['Drama'],3.0
77837,You Don't Know Jack (2010),Drama,1132623,36950.0,Controversy and legal problems follow Dr. Jack Kevorkian as he advocates assisted suicide.,7.039,410,"['Drama', 'TV Movie', 'History']",2.5
78349,Exam (2009),Mystery|Thriller,1258197,29917.0,"Eight talented candidates have reached the final stage of selection to join the ranks of a mysterious and powerful corporation. Entering a windowless room, where an armed guard keeps watch, they are given 80 minutes to answer one simple question.",6.709,2166,"['Thriller', 'Mystery']",3.0
79057,Predators (2010),Action|Sci-Fi|Thriller,1424381,34851.0,A group of cold-blooded killers find themselves trapped on an alien planet to be hunted by extraterrestrial Predators.,6.286,4364,"['Science Fiction', 'Action', 'Thriller']",2.0
79132,Inception (2010),Action|Crime|Drama|Mystery|Sci-Fi|Thriller|IMAX,1375666,27205.0,"Cobb, a skilled thief who commits corporate espionage by infiltrating the subconscious of his targets is offered a chance to regain his old life as payment for a task considered to be impossible: ""inception"", the implantation of another person's idea into a target's subconscious.",8.37,38011,"['Action', 'Science Fiction', 'Adventure']",3.5
80463,"Social Network, The (2010)",Drama,1285016,37799.0,"In 2003, Harvard undergrad and computer programmer Mark Zuckerberg begins work on a new concept that eventually turns into the global social network known as Facebook. Six years later, Mark is one of the youngest billionaires ever, but his unprecedented success leads to both personal and legal complications when he ends up on the receiving end of two lawsuits, one involving his former friend.",7.37,12650,['Drama'],3.0
80489,"Town, The (2010)",Crime|Drama|Thriller,840361,23168.0,"Doug MacRay is a longtime thief, who, smarter than the rest of his crew, is looking for his chance to exit the game. When a bank job leads to the group kidnapping an attractive branch manager, he takes on the role of monitoring her – but their burgeoning relationship threatens to unveil the identities of Doug and his crew to the FBI Agent who is on their case.",7.2,5317,"['Crime', 'Drama', 'Thriller']",3.0
80862,Catfish (2010),Documentary|Mystery,1584016,42296.0,"Nev, a 24-year-old New York-based photographer, has no idea what he's in for when Abby, an eight-year-old girl from rural Michigan, contacts him on Facebook, seeking permission to paint one of his photographs. When he receives her remarkable painting, Nev begins a friendship and correspondence with Abby's family. But things really get interesting when he develops a cyber-romance with Abby's attractive older sister, Megan, a musician and model. Prompted by some startling revelations about Megan, Nev and his buddies embark on a road trip in search of the truth.",6.831,535,['Documentary'],3.0
80906,Inside Job (2010),Documentary,1645089,44639.0,"A film that exposes the shocking truth behind the economic crisis of 2008. The global financial meltdown, at a cost of over $20 trillion, resulted in millions of people losing their homes and jobs. Through extensive research and interviews with major financial insiders, politicians and journalists, Inside Job traces the rise of a rogue industry and unveils the corrosive relationships which have corrupted politics, regulation and academia.",7.697,987,"['Documentary', 'Crime']",3.0
81191,Waiting for 'Superman' (2010),Documentary,1566648,39440.0,"Gripping, heartbreaking, and ultimately hopeful, Waiting for Superman is an impassioned indictment of the American school system from An Inconvenient Truth director Davis Guggenheim.",6.9,139,['Documentary'],3.0
81537,Due Date (2010),Comedy,1231583,41733.0,"Peter Highman must scramble across the US in five days to be present for the birth of his first child. He gets off to a bad start when his wallet and luggage are stolen, and put on the 'no-fly' list. Peter embarks on a terrifying journey when he accepts a ride from an actor.",6.386,5581,"['Comedy', 'Drama']",2.5
81562,127 Hours (2010),Adventure|Drama|Thriller,1542344,44115.0,The true story of mountain climber Aron Ralston's remarkable adventure to save himself after a fallen boulder crashes on his arm and traps him in an isolated canyon in Utah.,7.085,7782,"['Adventure', 'Drama', 'Thriller']",3.0
81932,"Fighter, The (2010)",Drama,964517,45317.0,"Boxer ""Irish"" Micky Ward's unlikely road to the world light welterweight title. His Rocky-like rise was shepherded by half-brother Dicky, a boxer-turned-trainer who rebounded in life after nearly being KO'd by drugs and crime.",7.382,4515,['Drama'],3.5
82022,"Reef, The (2010)",Drama|Horror|Thriller,1320291,49787.0,A great white shark hunts the crew of a capsized sailboat along the Great Barrier Reef.,5.62,581,"['Drama', 'Horror', 'Thriller']",3.5
82041,"Loved Ones, The (2009)",Horror,1316536,46420.0,"When Brent turns down his classmate Lola's invitation to the prom, she concocts a wildly violent plan for revenge.",6.695,791,['Horror'],3.5
82378,All Good Things (2010),Drama|Mystery|Thriller,1175709,46503.0,"Newly-discovered facts, court records and speculation are used to elaborate the true love story and murder mystery of the most notorious unsolved murder case in New York history.",6.047,941,"['Mystery', 'Thriller', 'Romance']",2.5
82667,I Saw the Devil (Akmareul boatda) (2010),Crime|Thriller,1588170,49797.0,"Kyung-chul is a dangerous psychopath who kills for pleasure. Soo-hyeon, a top-secret agent, decides to track down the murderer himself. He promises himself that he will do everything in his power to take vengeance against the killer, even if it means that he must become a monster himself.",7.798,2800,"['Thriller', 'Horror']",3.5
84392,"Lincoln Lawyer, The (2011)",Crime|Drama|Thriller,1189340,50348.0,"Mick Haller is a charismatic defense attorney who does business out of his Lincoln Continental sedan. Mick spends most of his time defending petty crooks and other bottom-feeders, so it comes as quite a surprise when he lands the case of a lifetime: defending a Beverly Hills playboy who is accused of attempted murder. However, what Mick initially thinks is an open-and-shut case with a big monetary reward develops into something more sinister.",7.196,3443,"['Crime', 'Drama', 'Thriller']",3.5
87660,Too Big to Fail (2011),Drama,1742683,65034.0,An intimate look at the epochal financial crisis of 2008 and the powerful men and women who decided the fate of the world's economy in a matter of a few weeks.,6.975,237,"['Drama', 'TV Movie']",3.0
88129,Drive (2011),Crime|Drama|Film-Noir|Thriller,780504,64690.0,"Driver is a skilled Hollywood stuntman who moonlights as a getaway driver for criminals. Though he projects an icy exterior, lately he's been warming up to a pretty neighbor named Irene and her young son, Benicio. When Irene's husband gets out of jail, he enlists Driver's help in a million-dollar heist. The job goes horribly wrong, and Driver must risk his life to protect Irene and Benicio from the vengeful masterminds behind the robbery.",7.583,13099,"['Drama', 'Thriller', 'Crime']",4.0
89028,Don't Be Afraid of the Dark (2010),Horror|Thriller,1270761,46261.0,A young girl sent to live with her father and his new girlfriend discovers creatures in her new home who want to claim her as one of their own.,5.8,1069,"['Fantasy', 'Horror', 'Thriller']",2.5
89039,Another Earth (2011),Drama|Romance|Sci-Fi,1549572,55420.0,Tragedy connects a young woman and a shattered music professor as an exact replica of Earth is discovered.,6.709,1717,"['Drama', 'Science Fiction']",3.5
89343,Red State (2011),Action|Crime|Horror|Thriller,873886,48572.0,"Set in Middle America, a group of teens receive an online invitation for sex, though they soon encounter Christian fundamentalists with a much more sinister agenda.",6.0,984,"['Horror', 'Action', 'Thriller']",2.0
89582,Cold Fish (Tsumetai nettaigyo) (2010),Drama|Thriller,1632547,68341.0,Shamoto runs a small tropical fish shop. When his daughter Mitsuko is caught shoplifting at a grocery store a man named Murata steps in to settle things between the girl and the store manager. Murata also runs a tropical fish shop and he and Shamoto soon become friendly. However Murata hides many dark secrets behind his friendly face.,6.928,367,"['Drama', 'Thriller', 'Crime', 'Horror']",2.5
89804,"Ides of March, The (2011)",Drama,1124035,10316.0,Dirty tricks stand to soil an ambitious young press spokesman's idealism in a cutthroat presidential campaign where 'victory' is relative.,6.676,2583,['Drama'],3.5
89837,Kill List (2011),Horror|Mystery|Thriller,1788391,74725.0,"Nearly a year after a botched job, a hitman takes a new assignment with the promise of a big payoff for three killings. What starts off as an easy task soon unravels, sending the killer into the heart of darkness.",6.207,821,"['Horror', 'Thriller', 'Crime']",4.5
90057,Take Shelter (2011),Drama,1675192,64720.0,"Plagued by a series of apocalyptic visions, a young husband and father questions whether to shelter his family from a coming storm, or from himself.",7.039,1861,"['Thriller', 'Drama', 'Horror']",3.5
90376,We Need to Talk About Kevin (2011),Drama|Thriller,1242460,71859.0,"After her son Kevin commits a horrific act, troubled mother Eva reflects on her complicated relationship with her disturbed son as he grew from a toddler into a teenager.",7.552,2955,"['Drama', 'Thriller']",3.0
90531,Shame (2011),Drama,1723811,76025.0,"Brandon, a thirty-something man living in New York, eludes intimacy with women but feeds his deepest desires with a compulsive addiction to sex. When his younger sister temporarily moves into his apartment, stirring up bitter memories of their shared painful past, Brandon's life, like his fragile mind, gets out of control.",6.932,3272,['Drama'],3.0
91622,Young Adult (2011),Comedy|Drama,1625346,57157.0,"A divorced writer from the Midwest returns to her hometown to reconnect with an old flame, who's now married with a family.",5.814,1295,"['Comedy', 'Drama']",3.0
91658,"Girl with the Dragon Tattoo, The (2011)",Drama|Thriller,1568346,65754.0,"Disgraced journalist Mikael Blomkvist investigates the disappearance of a weary patriarch's niece from 40 years ago. He is aided by the pierced, tattooed, punk computer hacker named Lisbeth Salander. As they work together in the investigation, Blomkvist and Salander uncover immense corruption beyond anything they have ever imagined.",7.378,7292,"['Thriller', 'Crime', 'Mystery']",3.5
92259,Intouchables (2011),Comedy|Drama,1675434,77338.0,A true story of two men who should never have met – a quadriplegic aristocrat who was injured in a paragliding accident and a young man from the projects.,8.271,17865,"['Drama', 'Comedy']",3.0
93498,Game Change (2012),Drama,1848902,91010.0,"During the Republican run of the 2008 Presidential election, candidate John McCain picks a relative unknown, Alaskan governor Sarah Palin, to be his running mate.  As the campaign kicks into high gear, her lack of experience, in both political and media savvy, becomes a drain upon McCain and his strategists.",6.9,331,"['TV Movie', 'Drama', 'Comedy', 'History']",3.0
93838,The Raid: Redemption (2011),Action|Crime,1899353,94329.0,"Deep in the heart of Jakarta's slums lies an impenetrable safe house for the world's most dangerous killers and gangsters. Until now, the run-down apartment block has been considered untouchable to even the bravest of police. Cloaked under the cover of pre-dawn darkness and silence, an elite swat team is tasked with raiding the safe house in order to take down the notorious drug lord that runs it.  But when a chance encounter with a spotter blows their cover and news of their assault reaches the drug lord, the building's lights are cut and all the exits blocked. Stranded on the sixth floor with no way out, the unit must fight their way through the city's worst to survive their mission. Starring Indonesian martial arts sensation Iko Uwais.",7.401,3649,"['Action', 'Thriller', 'Crime']",3.5
93840,"Cabin in the Woods, The (2012)",Comedy|Horror|Sci-Fi|Thriller,1259521,22970.0,A group of teens journey to a remote cabin in the woods where their fate is unknowingly controlled by technicians as part of a worldwide conspiracy where all horror movie clichés are revealed to be part of an elaborate sacrifice ritual.,6.64,8190,"['Horror', 'Mystery', 'Comedy']",2.0
94799,Sound of My Voice (2011),Drama|Mystery|Sci-Fi,1748207,86812.0,A journalist and his girlfriend get pulled in while they investigate a cult whose leader claims to be from the future.,6.301,396,"['Science Fiction', 'Drama', 'Mystery', 'Thriller', 'Horror']",3.0
95441,Ted (2012),Comedy|Fantasy,1637725,72105.0,"John Bennett, a man whose childhood wish of bringing his teddy bear to life came true, now must decide between keeping the relationship with the bear or his girlfriend, Lori.",6.445,12759,"['Comedy', 'Fantasy']",2.5
96610,Looper (2012),Action|Crime|Sci-Fi,1276104,59967.0,"In the year 2044, time travel has not yet been invented but in 30 years it will have been. When the mob wants to get rid of someone, they will send their target into the past where a looper, a hired gun, like Joe is waiting to mop up. Joe is getting rich and life is good until the day the mob decides to close the loop, sending back Joe's future self for assassination.",6.896,10500,"['Action', 'Thriller', 'Science Fiction']",3.0
96811,End of Watch (2012),Crime|Drama|Thriller,1855199,77016.0,Two young officers are marked for death after confiscating a small cache of money and firearms from the members of a notorious cartel during a routine traffic stop.,7.35,3435,"['Crime', 'Drama', 'Thriller']",3.0
96829,"Hunt, The (Jagten) (2012)",Drama,2106476,103663.0,"A teacher lives a lonely life, all the while struggling over his son’s custody. His life slowly gets better as he finds love and receives good news from his son, but his new luck is about to be brutally shattered by an innocent little lie.",8.097,4480,['Drama'],3.5
97306,Seven Psychopaths (2012),Comedy|Crime,1931533,86838.0,A struggling screenwriter inadvertently becomes entangled in the Los Angeles criminal underworld after his oddball friends kidnap a gangster's beloved Shih Tzu.,6.824,4080,"['Comedy', 'Crime']",3.0
97860,Killing Them Softly (2012),Crime|Drama|Thriller,1764234,64689.0,"Jackie Cogan is an enforcer hired to restore order after three dumb guys rob a Mob protected card game, causing the local criminal economy to collapse.",6.027,2287,"['Crime', 'Thriller']",3.5
97866,"Imposter, The (2012)",Documentary,1966604,84287.0,"In 1994 a 13-year-old boy disappeared without a trace from his home in San Antonio, Texas. Three-and-a-half years later he is found alive thousands of miles away in a village in southern Spain with a horrifying story of kidnap and torture. His family is overjoyed to bring him home. But all is not quite as it seems.",7.313,752,"['Documentary', 'Mystery', 'Crime']",3.0
97984,Wake in Fright (1971),Drama|Thriller,67541,26405.0,"A young schoolteacher descends into personal moral degradation after finding himself stranded in a brutal, menacing town in outback Australia.",7.287,317,"['Drama', 'Thriller']",3.5
98154,Lincoln (2012),Drama|War,443272,72976.0,"The revealing story of the 16th US President's tumultuous final months in office. In a nation divided by war and the strong winds of change, Lincoln pursues a course of action designed to end the war, unite the country and abolish slavery. With the moral courage and fierce determination to succeed, his choices during this critical moment will change the fate of generations to come.",6.856,3904,"['History', 'Drama']",3.0
98961,Zero Dark Thirty (2012),Action|Drama|Thriller,1790885,97630.0,"A chronicle of the decade-long hunt for al-Qaeda terrorist leader Osama bin Laden after the September 2001 attacks, and his death at the hands of the Navy S.E.A.L. Team 6 in May, 2011.",6.993,4689,"['Thriller', 'Drama']",3.5
100556,"Act of Killing, The (2012)",Documentary,2375605,123678.0,"In this chilling and groundbreaking documentary, former Indonesian death squad leaders reenact their real-life mass killings in the style of various film genres, from gangster epics to musicals. As they recreate their past atrocities, the line between reality and performance blurs, exposing the lingering impact of Indonesia’s 1965-66 anti-communist purge and the unsettling psychology of its perpetrators.",7.661,715,['Documentary'],2.5
101525,"Place Beyond the Pines, The (2012)",Crime|Drama,1817273,97367.0,"A motorcycle stunt rider considers committing a crime in order to provide for his wife and child, an act that puts him on a collision course with a cop-turned-politician.",6.98,4997,"['Drama', 'Crime']",3.0
