movieId,title,genres,imdbId,tmdbId,overview,tmdb_vote_average,tmdb_vote_count,tmdb_genres,rating
1233,"Boot, Das (Boat, The) (1981)",Action|Drama|War,82096,387.0,"A German submarine hunts allied ships during the Second World War, but it soon becomes the hunted. The crew tries to survive below the surface, while stretching both the boat and themselves to their limits.",8.087,2354,"['Drama', 'History', 'War']",3.0
1240,"Terminator, The (1984)",Action|Sci-Fi|Thriller,88247,218.0,"In the post-apocalyptic future, reigning tyrannical supercomputers teleport a cyborg assassin known as the ""Terminator"" back to 1984 to kill Sarah Connor, whose unborn son is destined to lead insurgents against 21st century mechanical hegemony. Meanwhile, the human-resistance movement dispatches a lone warrior to safeguard Sarah. Can he stop the virtually indestructible killing machine?",7.671,13866,"['Action', 'Thriller', 'Science Fiction']",3.0
1245,Miller's Crossing (1990),Crime|Drama|Film-Noir|Thriller,100150,379.0,"Set in 1929, a political boss and his advisor have a parting of the ways when they both fall for the same woman.",7.457,1743,"['Drama', 'Thriller', 'Crime']",3.0
1247,"Graduate, The (1967)",Comedy|Drama|Romance,61722,37247.0,A disillusioned college graduate finds himself torn between his older lover and her daughter.,7.632,3515,"['Drama', 'Romance', 'Comedy']",5.0
1249,"Femme Nikita, La (Nikita) (1990)",Action|Crime|Romance|Thriller,100263,9322.0,"A beautiful felon, sentenced to life in prison for the murder of a policeman, is given a second chance – as a secret political assassin controlled by the government.",7.094,2044,"['Action', 'Thriller']",3.0
1258,"Shining, The (1980)",Horror,81505,694.0,"Jack Torrance accepts a caretaker job at the Overlook Hotel, where he, along with his wife Wendy and their son Danny, must live isolated from the rest of the world for the winter. But they aren't prepared for the madness that lurks within.",8.209,18210,"['Horror', 'Thriller']",5.0
1259,Stand by Me (1986),Adventure|Drama,92005,235.0,"After learning that a boy their age has been accidentally killed near their rural homes, four Oregon boys decide to go see the body. On the way, Gordie,  Vern, Chris and Teddy encounter a mean junk man and a marsh full of leeches, as they also learn more about one another and their very different home lives. Just a lark at first, the boys' adventure evolves into a defining event in their lives.",7.9,6179,"['Crime', 'Drama']",4.0
1262,"Great Escape, The (1963)",Action|Adventure|Drama|War,57115,5925.0,"The Nazis, exasperated at the number of escapes from their prison camps by a relatively small number of Allied prisoners, relocate them to a high-security 'escape-proof' camp to sit out the remainder of the war. Undaunted, the prisoners plan one of the most ambitious escape attempts of World War II. Based on a true story.",7.9,2683,"['Adventure', 'Drama', 'War']",4.0
1263,"Deer Hunter, The (1978)",Drama|War,77416,11778.0,"A group of working-class friends decide to enlist in the Army during the Vietnam War and finds it to be hellish chaos -- not the noble venture they imagined. Before they left, Steven married his pregnant girlfriend -- and Michael and Nick were in love with the same woman. But all three are different men upon their return.",7.988,4026,"['Drama', 'War']",3.0
1265,Groundhog Day (1993),Comedy|Fantasy|Romance,107048,137.0,"A narcissistic TV weatherman, along with his attractive-but-distant producer, and his mawkish cameraman, is sent to report on Groundhog Day in the small town of Punxsutawney, where he finds himself repeating the same day over and over.",7.616,8426,"['Romance', 'Fantasy', 'Drama', 'Comedy']",4.0
1276,Cool Hand Luke (1967),Drama,61512,903.0,"When petty criminal Luke Jackson is sentenced to two years in a Florida prison farm, he doesn't play by the rules of either the sadistic warden or the yard's resident heavy, Dragline, who ends up admiring the new guy's unbreakable will. Luke's bravado, even in the face of repeated stints in the prison's dreaded solitary confinement cell, ""the box,"" make him a rebel hero to his fellow convicts and a thorn in the side of the prison officers.",7.738,1510,"['Drama', 'Crime']",3.0
1320,Alien³ (a.k.a. Alien 3) (1992),Action|Horror|Sci-Fi|Thriller,103644,8077.0,"After escaping with Newt and Hicks from the alien planet, Ripley crash lands on Fiorina 161, a prison planet and host to a correctional facility. Unfortunately, although Newt and Hicks do not survive the crash, a more unwelcome visitor does. The prison does not allow weapons of any kind, and with aid being a long time away, the prisoners must simply survive in any way they can.",6.375,6049,"['Science Fiction', 'Action', 'Horror']",3.0
1343,Cape Fear (1991),Thriller,101540,1598.0,"Sam Bowden is a small-town corporate attorney. Max Cady is a tattooed, cigar-smoking, Bible-quoting, psychotic rapist. What do they have in common? 14 years ago, Sam was a public defender assigned to Max Cady's rape trial, and he made a serious error: he hid a document from his illiterate client that could have gotten him acquitted. Now, the cagey Cady has been released, and he intends to teach Sam Bowden and his family a thing or two about loss.",7.249,3640,"['Drama', 'Crime', 'Thriller']",5.0
1344,Cape Fear (1962),Crime|Drama|Thriller,55824,11349.0,"Sam Bowden witnesses a rape committed by Max Cady and testifies against him. When released after 8 years in prison, Cady begins stalking Bowden and his family but is always clever enough not to violate the law.",7.5,595,"['Thriller', 'Drama']",4.0
1359,Jingle All the Way (1996),Children|Comedy,116705,9279.0,"Howard Langston, a salesman for a mattress company, is constantly kept busy at his job, disappointing his son. After he misses his son's karate exposition, Howard vows to make it up to him by buying an action figure of his son's favorite television hero for Christmas. Unfortunately for Howard, it is Christmas Eve, and every store is sold out of Turbo Man. Now, Howard must travel all over town and compete with everybody else to find a Turbo Man action figure.",6.05,2783,"['Family', 'Comedy', 'Adventure']",3.0
1361,Paradise Lost: The Child Murders at Robin Hood Hills (1996),Documentary,117293,17204.0,A horrific triple child murder leads to an indictment and trial of three nonconformist boys based on questionable evidence.,7.6,187,"['Documentary', 'Crime']",3.0
1371,Star Trek: The Motion Picture (1979),Adventure|Sci-Fi,79945,152.0,"When an unidentified alien destroys three powerful Klingon cruisers, Captain James T. Kirk returns to the newly transformed U.S.S. Enterprise to take command.",6.473,1817,"['Science Fiction', 'Adventure', 'Mystery']",2.0
1372,Star Trek VI: The Undiscovered Country (1991),Action|Mystery|Sci-Fi,102975,174.0,"After years of war, the Federation and the Klingon empire find themselves on the brink of a peace summit when a Klingon ship is nearly destroyed by an apparent attack from the Enterprise. Both worlds brace for what may be their deadliest encounter.",7.03,1333,"['Science Fiction', 'Action', 'Adventure', 'Thriller']",4.0
1373,Star Trek V: The Final Frontier (1989),Action|Sci-Fi,98382,172.0,A renegade Vulcan with a startling secret hijacks the U.S.S. Enterprise in order to find a mythical planet.,5.726,1234,"['Science Fiction', 'Action', 'Adventure', 'Thriller']",3.0
1374,Star Trek II: The Wrath of Khan (1982),Action|Adventure|Sci-Fi|Thriller,84726,154.0,"The starship Enterprise and its crew is pulled back into action when old nemesis, Khan, steals a top secret device called Project Genesis.",7.446,2017,"['Action', 'Adventure', 'Science Fiction', 'Thriller']",4.0
1376,Star Trek IV: The Voyage Home (1986),Adventure|Comedy|Sci-Fi,92007,168.0,"When a huge alien probe enters the galaxy and begins to vaporize Earth's oceans, Kirk and his crew must travel back in time in order to bring back whales and save the planet.",7.157,1561,"['Science Fiction', 'Adventure']",3.0
1377,Batman Returns (1992),Action|Crime,103776,364.0,"The monstrous Penguin, who dwells in the sewers beneath Gotham, joins up with corrupt mayoral candidate Max Shreck to topple the Batman once and for all. But when Shreck's timid assistant Selina Kyle finds out, and Shreck tries to kill her, she's transformed into the sexy Catwoman. She teams up with the Penguin and Shreck to destroy Batman, but sparks fly unexpectedly when she confronts the caped crusader.",6.943,6805,"['Action', 'Fantasy']",4.0
1385,Under Siege (1992),Action|Drama|Thriller,105690,8845.0,"A disgruntled ex-CIA operative, his assistant and their assembled group of terrorists seize a battleship with nuclear blackmail in mind. They've planned for every contingency but ignore the ship's cook, former Navy SEAL Casey Ryback—an error that could be fatal.",6.298,1619,"['Action', 'Thriller']",4.0
1387,Jaws (1975),Action|Horror,73195,578.0,"When the seaside community of Amity finds itself under attack by a dangerous great white shark, the town's chief of police, a young marine biologist, and a grizzled hunter embark on a desperate quest to destroy the beast before it strikes again.",7.678,11035,"['Horror', 'Thriller', 'Adventure']",3.0
1391,Mars Attacks! (1996),Action|Comedy|Sci-Fi,116996,75.0,"A fleet of Martian spacecraft surrounds the world's major cities and all of humanity waits to see if the extraterrestrial visitors have, as they claim, ""come in peace."" U.S. President James Dale receives assurance from science professor Donald Kessler that the Martians' mission is a friendly one. But when a peaceful exchange ends in the total annihilation of the U.S. Congress, military men call for a full-scale nuclear retaliation.",6.416,5650,"['Comedy', 'Fantasy', 'Science Fiction']",3.0
1393,Jerry Maguire (1996),Drama|Romance,116695,9390.0,"Jerry Maguire used to be a typical sports agent: willing to do just about anything he could to get the biggest possible contracts for his clients, plus a nice commission for himself. Then, one day, he suddenly has second thoughts about what he's really doing. When he voices these doubts, he ends up losing his job and all of his clients, save Rod Tidwell, an egomaniacal football player.",6.971,3490,"['Comedy', 'Drama', 'Romance']",4.0
1422,Murder at 1600 (1997),Crime|Drama|Mystery|Thriller,119731,9415.0,"A secretary is found dead in a White House bathroom during an international crisis, and Detective Harlan Regis is in charge of the investigation. Despite resistance from the Secret Service, Regis partners with agent Nina Chance. As political tensions rise, they learn that the crime could be part of an elaborate cover-up. Framed as traitors, the pair, plus Regis' partner, break into the White House in order to expose the true culprit.",6.072,557,"['Action', 'Drama', 'Mystery', 'Thriller', 'Crime']",3.0
1464,Lost Highway (1997),Crime|Drama|Fantasy|Film-Noir|Mystery|Romance,116922,638.0,"A tormented jazz musician finds himself lost in an enigmatic story involving murder, surveillance, gangsters, doppelgängers, and an impossible transformation inside a prison cell.",7.543,2785,"['Drama', 'Thriller', 'Mystery']",3.0
1466,Donnie Brasco (1997),Crime|Drama,119008,9366.0,An FBI undercover agent infiltrates the mob and identifies more with the mafia life at the expense of his regular one.,7.535,4646,"['Crime', 'Drama', 'Thriller']",4.0
1479,"Saint, The (1997)",Action|Romance|Sci-Fi|Thriller,120053,10003.0,"Simon Templar (The Saint), is a thief for hire, whose latest job to steal the secret process for cold fusion puts him at odds with a traitor bent on toppling the Russian government, as well as the woman who holds its secret.",6.099,1168,"['Thriller', 'Action', 'Romance', 'Science Fiction', 'Adventure']",3.0
1500,Grosse Pointe Blank (1997),Comedy|Crime|Romance,119229,9434.0,"Hitman Martin Blank becomes a moving target after he rebuffs a fellow assassin's invitation to form a union. On the advice of his quirky assistant and neurotic psychiatrist, Martin begrudgingly heads out to Grosse Pointe, Michigan for his ten-year high school reunion, where he soon comes across the woman he jilted on prom night.",6.947,968,"['Action', 'Comedy', 'Thriller', 'Romance']",3.0
1513,Romy and Michele's High School Reunion (1997),Comedy,120032,9611.0,"Two not-too-bright party girls reinvent themselves for their high school reunion. Armed with a borrowed Jaguar, new clothes and the story of their success as the inventors of Post-It notes, Romy and Michele descend on their alma mater, but their façade crumbles quickly.",6.2,556,['Comedy'],3.0
1517,Austin Powers: International Man of Mystery (1997),Action|Adventure|Comedy,118655,816.0,"As a swinging fashion photographer by day and a groovy British superagent by night, Austin Powers is the '60s' most shagadelic spy. But can he stop megalomaniac Dr. Evil after the bald villain freezes himself and unthaws in the '90s? With the help of sexy sidekick Vanessa Kensington, he just might.",6.582,3586,"['Science Fiction', 'Comedy', 'Crime']",3.0
1552,Con Air (1997),Action|Adventure|Thriller,118880,1701.0,"Newly-paroled former US Army ranger Cameron Poe is headed back to his wife, but must fly home aboard a prison transport flight dubbed ""Jailbird"" taking the “worst of the worst” prisoners, a group described as “pure predators”, to a new super-prison. Poe faces impossible odds when the transport plane is skyjacked mid-flight by the most vicious criminals in the country led by the mastermind — genius serial killer Cyrus ""The Virus"" Grissom, and backed by black militant Diamond Dog and psychopath Billy Bedlam.",6.758,4449,"['Action', 'Thriller', 'Crime']",3.0
1562,Batman & Robin (1997),Action|Adventure|Fantasy|Thriller,118688,415.0,"Batman and his sidekick Robin attempt to the foil the sinister schemes of a deranged set of new villains, most notably the melancholy Mr. Freeze, who wants to make Gotham City into an arctic region, and the sultry Poison Ivy, a botanical femme fatale. As the Dynamic Duo contend with these bad guys, a third hero, Batgirl, joins the ranks of the city's crime-fighters.",4.381,5202,"['Action', 'Science Fiction', 'Adventure']",3.0
1569,My Best Friend's Wedding (1997),Comedy|Romance,119738,8874.0,"When she receives word that her longtime platonic pal Michael O'Neal is getting married to debutante Kimberly Wallace, food critic Julianne Potter realizes her true feelings for Michael -- and sets out to sabotage the wedding.",6.589,2765,"['Comedy', 'Romance']",4.0
1573,Face/Off (1997),Action|Crime|Drama|Thriller,119094,754.0,"In order to foil a terrorist plot, an FBI agent undergoes facial transplant surgery and assumes the identity of a criminal mastermind. The plan turns sour when the criminal wakes up prematurely and seeks revenge.",7.047,5610,"['Action', 'Crime', 'Science Fiction']",3.0
1580,Men in Black (a.k.a. MIB) (1997),Action|Comedy|Sci-Fi,119654,607.0,"After a police chase with an otherworldly being, a New York City cop is recruited as an agent in a top-secret organization established to monitor and police alien activity on Earth: the Men in Black. Agent K and new recruit Agent J find themselves in the middle of a deadly plot by an intergalactic terrorist who has arrived on Earth to assassinate two ambassadors from opposing galaxies.",7.213,14300,"['Action', 'Adventure', 'Comedy', 'Science Fiction']",3.0
1584,Contact (1997),Drama|Sci-Fi,118884,686.0,"A radio astronomer receives the first extraterrestrial radio signal ever picked up on Earth. As the world powers scramble to decipher the message and decide upon a course of action, she must make some difficult decisions between her beliefs, the truth, and reality.",7.436,4719,"['Drama', 'Science Fiction', 'Mystery']",3.0
1590,Event Horizon (1997),Horror|Sci-Fi|Thriller,119081,8413.0,"In 2047, a group of astronauts are sent to investigate and salvage the starship Event Horizon which disappeared mysteriously seven years before on its maiden voyage. However, it soon becomes evident that something sinister resides in its corridors.",6.563,3056,"['Horror', 'Science Fiction', 'Mystery']",3.0
1594,In the Company of Men (1997),Comedy|Drama,119361,14585.0,"Two business executives--one an avowed misogynist, the other recently emotionally wounded by his love interest--set out to exact revenge on the female gender by seeking out the most innocent, uncorrupted girl they can find and ruining her life.",6.7,159,"['Comedy', 'Drama']",3.0
1608,Air Force One (1997),Action|Thriller,118571,9772.0,"When Russian neo-nationalists hijack Air Force One, the world's most secure and extraordinary aircraft, the President is faced with a nearly impossible decision to give in to terrorist demands or sacrifice not only the country's dignity, but the lives of his wife and daughter.",6.479,3139,"['Action', 'Thriller']",3.0
1609,187 (One Eight Seven) (1997),Drama|Thriller,118531,6072.0,"After surviving a stabbing by a student, teacher Trevor Garfield moves from New York to Los Angeles. There, he resumes teaching as a substitute teacher. The education system, where violent bullies control the classrooms and the administration is afraid of lawsuits, slowly drives Garfield mad.",6.7,595,"['Drama', 'Thriller']",3.0
1610,"Hunt for Red October, The (1990)",Action|Adventure|Thriller,99810,1669.0,"A new technologically-superior Soviet nuclear sub, the Red October, is heading for the U.S. coast under the command of Captain Marko Ramius. The American government thinks Ramius is planning to attack. Lone CIA analyst Jack Ryan has a different idea: he thinks Ramius is planning to defect, but he has only a few hours to find him and prove it - because the entire Russian naval and air commands are trying to find Ramius, too. The hunt is on!",7.375,3451,"['Action', 'Adventure', 'Thriller']",4.0
1617,L.A. Confidential (1997),Crime|Film-Noir|Mystery|Thriller,119488,2118.0,Three detectives in the corrupt and brutal L.A. police force of the 1950s use differing methods to uncover a conspiracy behind the shotgun slayings of the patrons at an all-night diner.,7.801,5238,"['Crime', 'Mystery', 'Thriller', 'Drama']",4.0
1619,Seven Years in Tibet (1997),Adventure|Drama|War,120102,978.0,"Austrian mountaineer Heinrich Harrer journeys to the Himalayas without his family to head an expedition in 1939. But when World War II breaks out, the arrogant Harrer falls into Allied forces' hands as a prisoner of war. He escapes with a fellow detainee and makes his way to Lhasa, Tibet, where he meets the 14-year-old Dalai Lama, whose friendship ultimately transforms his outlook on life.",7.157,2976,"['Adventure', 'Drama', 'History']",3.0
1620,Kiss the Girls (1997),Crime|Drama|Mystery|Thriller,119468,9437.0,"Forensic psychologist and detective Alex Cross travels to North Carolina and teams with escaped kidnap victim Kate McTiernan to hunt down ""Casanova,"" a serial killer who abducts strong-willed women and forces them to submit to his demands. The trail leads to Los Angeles, where the duo discovers that the psychopath may not be working alone.",6.519,1770,"['Thriller', 'Crime', 'Mystery', 'Drama']",4.0
1625,"Game, The (1997)",Drama|Mystery|Thriller,119174,2649.0,"In honor of his birthday, San Francisco banker Nicholas Van Orton, a financial genius and a cold-hearted loner, receives an unusual present from his younger brother, Conrad: a gift certificate to play a unique kind of game. In nary a nanosecond, Nicholas finds himself consumed by a dangerous set of ever-changing rules, unable to distinguish where the charade ends and reality begins.",7.567,6979,"['Drama', 'Thriller', 'Mystery']",5.0
1639,Chasing Amy (1997),Comedy|Drama|Romance,118842,2255.0,"Holden and Banky are comic book artists. Everything is going good for them until they meet Alyssa, also a comic book artist. Holden falls for her, but his hopes are crushed when he finds out she's a lesbian.",6.8,1458,"['Comedy', 'Drama', 'Romance']",3.0
1680,Sliding Doors (1998),Drama|Romance,120148,10215.0,"London publicist Helen, effortlessly slides between parallel storylines that show what happens when she does or does not catch a train back to her apartment. Love. Romantic entanglements. Deception. Trust. Friendship. Comedy. All come into focus as the two stories shift back and forth, overlap and surprisingly converge.",6.57,1365,"['Comedy', 'Drama', 'Fantasy', 'Romance']",3.0
1682,"Truman Show, The (1998)",Comedy|Drama|Sci-Fi,120382,37165.0,An insurance salesman begins to suspect that his whole life is actually some sort of reality TV show.,8.148,19329,"['Comedy', 'Drama']",3.0
1704,Good Will Hunting (1997),Drama|Romance,119217,489.0,"Headstrong yet aimless, Will Hunting has a genius-level IQ but chooses to work as a janitor at MIT. When he secretly solves highly difficult graduate-level math problems, his talents are discovered by Professor Gerald Lambeau, who decides to help the misguided youth reach his potential. When Will is arrested for attacking a police officer, Professor Lambeau makes a deal to get leniency for him if he gets court-ordered therapy. Eventually, therapist Dr. Sean Maguire helps Will confront the demons that are holding him back.",8.157,13119,['Drama'],5.0
1717,Scream 2 (1997),Comedy|Horror|Mystery|Thriller,120082,4233.0,"Two years after the first series of murders, as Sidney Prescott acclimates to college life, someone donning the Ghostface costume begins a new string of killings.",6.502,4429,"['Horror', 'Mystery']",3.0
1721,Titanic (1997),Drama|Romance,120338,597.0,"101-year-old Rose DeWitt Bukater tells the story of her life aboard the Titanic, 84 years later. A young Rose boards the ship with her mother and fiancé. Meanwhile, Jack Dawson and Fabrizio De Rossi win third-class tickets aboard the ship. Rose tells the whole story from Titanic's departure through to its death—on its first and last voyage—on April 15, 1912.",7.906,26345,"['Drama', 'Romance']",5.0
1722,Tomorrow Never Dies (1997),Action|Adventure|Thriller,120347,714.0,A deranged media mogul is staging international incidents to pit the world's superpowers against each other. Now James Bond must take on this evil mastermind in an adrenaline-charged battle to end his reign of terror and prevent global pandemonium.,6.374,3249,"['Adventure', 'Action', 'Thriller']",3.0
1727,"Horse Whisperer, The (1998)",Drama|Romance,119314,547.0,The mother of a severely traumatized daughter enlists the aid of a unique horse trainer to help the girl's equally injured horse.,6.898,1147,"['Adventure', 'Drama', 'Romance']",3.0
1729,Jackie Brown (1997),Crime|Drama|Thriller,119396,184.0,"Jackie Brown is a flight attendant who gets caught in the middle of smuggling cash into the country for her gunrunner boss. When the cops try to use Jackie to get to her boss, she hatches a plan — with help from a bail bondsman — to keep the money for herself.",7.355,6653,"['Crime', 'Drama', 'Thriller']",3.0
1735,Great Expectations (1998),Drama|Romance,119223,9410.0,"Loosely based on the Charles Dickens' classic novel, ""Great Expectations"" is a sensual tale of a young man's unforgettable passage into manhood, and the three individuals who will undeniably change his life forever. Through the surprising interactions of these vivid characters, ""Great Expectations"" takes a unique and contemporary look at life's great coincidences.",6.611,646,"['Comedy', 'Drama', 'Romance']",4.0
1777,"Wedding Singer, The (1998)",Comedy|Romance,120888,11003.0,"Robbie, a local rock star turned wedding singer, is dumped on the day of his wedding. Meanwhile, waitress Julia finally sets a wedding date with her fiancée Glenn. When Julia and Robbie meet and hit it off, they find that things are more complicated than anybody thought.",6.783,1821,"['Romance', 'Comedy']",3.0
1784,As Good as It Gets (1997),Comedy|Drama|Romance,119822,2898.0,"Melvin Udall, a cranky, bigoted, obsessive-compulsive writer of romantic fiction, is rude to everyone he meets, including his gay neighbor, Simon. After Simon is brutally attacked and hospitalized, Melvin finds his life turned upside down when he has to look after Simon's dog. In addition, Carol, the only waitress at the local diner who will tolerate him, leaves work to care for her chronically ill son, making it impossible for Melvin to eat breakfast.",7.397,3938,"['Drama', 'Comedy', 'Romance']",4.0
1801,"Man in the Iron Mask, The (1998)",Action|Adventure|Drama,120744,9313.0,"Years have passed since the Three Musketeers, Aramis, Athos and Porthos, have fought together with their friend, D'Artagnan. But with the tyrannical King Louis using his power to wreak havoc in the kingdom while his twin brother, Philippe, remains imprisoned, the Musketeers reunite to abduct Louis and replace him with Philippe.",6.641,3967,"['Adventure', 'Action', 'Drama']",3.0
1805,Wild Things (1998),Crime|Drama|Mystery|Thriller,120890,617.0,"When teen-socialite Kelly Van Ryan and troubled bad girl Suzie Toller accuse guidance counselor Sam Lombardo of rape, he's suspended by the school, rejected by the town, and fighting to get his life back. One cop suspects conspiracy, but nothing is what it seems...",6.362,1848,"['Mystery', 'Thriller', 'Drama']",3.0
1884,Fear and Loathing in Las Vegas (1998),Adventure|Comedy|Drama,120669,1878.0,"Raoul Duke and his attorney Dr. Gonzo drive a red convertible across the Mojave desert to Las Vegas with a suitcase full of drugs to cover a motorcycle race. As their consumption of drugs increases at an alarming rate, the stoned duo trash their hotel room and fear legal repercussions. Duke begins to drive back to L.A., but after an odd run-in with a cop, he returns to Sin City and continues his wild drug binge.",7.211,4799,"['Adventure', 'Drama', 'Comedy']",5.0
