movieId,title,genres,imdbId,tmdbId,overview,tmdb_vote_average,tmdb_vote_count,tmdb_genres,rating
848,"Spitfire Grill, The (1996)",Drama,117718,47907.0,"Percy, upon being released from prison, goes to the small town of Gillead, to find a place where she can start over again. She is taken in by Hannah, to help out at her place, the Spitfire Grill. Percy brings change to the small town, stirring resentment and fear in some, and growth in others.",6.5,62,"['Comedy', 'Drama']",3.0
852,Tin Cup (1996),Comedy|Drama|Romance,117918,10478.0,A washed up golf pro working at a driving range tries to qualify for the US Open in order to win the heart of his succesful rival's girlfriend.,6.081,551,"['Drama', 'Romance', 'Comedy']",2.0
877,Girls Town (1996),Comedy|Drama,116418,110513.0,The death of a friend galvanizes three high school young women to reassess their friendship and their lives.,6.1,8,"['Comedy', 'Drama']",4.0
885,Bogus (1996),Children|Drama|Fantasy,115725,3587.0,"Recently orphaned, a young boy is taken in by his godmother who is shocked to realize that she can see the boy's imaginary friend: a flamboyant, French magician named Bogus.",5.767,236,"['Fantasy', 'Comedy', 'Family']",3.0
902,Breakfast at Tiffany's (1961),Drama|Romance,54698,164.0,"Holly Golightly is an eccentric New York City playgirl determined to marry a Brazilian millionaire. But when young writer Paul Varjak moves into her apartment building, her past threatens to get in their way.",7.6,4330,"['Comedy', 'Romance', 'Drama']",2.0
905,It Happened One Night (1934),Comedy|Romance,25316,3078.0,A runaway heiress makes a deal with the rogue reporter trailing her but the mismatched pair end up stuck with each other when their bus leaves them behind.,7.823,1325,"['Comedy', 'Romance']",3.0
910,Some Like It Hot (1959),Comedy|Crime,53291,239.0,Two musicians witness a mob hit and struggle to find a way out of the city. Their only opportunity comes in the form of joining an all-girl band as they prepare to leave on a tour. The two disguise themselves as women and struggle to keep their identities secret as they deal with the problems this brings.,8.1,3677,"['Comedy', 'Romance', 'Crime']",3.0
912,Casablanca (1942),Drama|Romance,34583,289.0,"In Casablanca, Morocco in December 1941, a cynical American expatriate meets a former lover, with unforeseen complications.",8.2,5732,"['Drama', 'Romance']",3.0
914,My Fair Lady (1964),Comedy|Drama|Musical|Romance,58385,11113.0,A snobbish phonetics professor agrees to a wager that he can take a flower girl and make her presentable in high society.,7.5,1370,"['Music', 'Comedy', 'Romance']",3.0
919,"Wizard of Oz, The (1939)",Adventure|Children|Fantasy|Musical,32138,630.0,"Young Dorothy finds herself in a magical world where she makes friends with a lion, a scarecrow and a tin man as they make their way along the yellow brick road to talk with the Wizard and ask for the things they miss most in their lives. The Wicked Witch of the West is the only thing that could stop them.",7.592,5842,"['Adventure', 'Fantasy', 'Family']",4.0
924,2001: A Space Odyssey (1968),Adventure|Drama|Sci-Fi,62622,62.0,"Humanity finds a mysterious object buried beneath the lunar surface and sets off to find its origins with the help of HAL 9000, the world's most advanced super computer.",8.063,12048,"['Science Fiction', 'Mystery', 'Adventure']",5.0
932,"Affair to Remember, An (1957)",Drama|Romance,50105,8356.0,A couple falls in love and agrees to meet in six months at the Empire State Building - but will it happen?,7.356,490,"['Drama', 'Romance']",3.0
952,Around the World in 80 Days (1956),Adventure|Comedy,48960,2897.0,"Based on the famous book by Jules Verne the movie follows Phileas Fogg on his journey around the world. Which has to be completed within 80 days, a very short period for those days.",6.645,539,"['Adventure', 'Comedy', 'Family', 'Fantasy', 'Romance']",3.0
953,It's a Wonderful Life (1946),Children|Drama|Fantasy|Romance,38650,1585.0,"A holiday favourite for generations...  George Bailey has spent his entire life giving to the people of Bedford Falls.  All that prevents rich skinflint Mr. Potter from taking over the entire town is George's modest building and loan company.  But on Christmas Eve the business's $8,000 is lost and George's troubles begin.",8.273,4600,"['Drama', 'Family', 'Fantasy']",4.0
969,"African Queen, The (1951)",Adventure|Comedy|Romance|War,43265,488.0,"At the start of the First World War, in the middle of Africa’s nowhere, a gin soaked riverboat captain is persuaded by a strong-willed missionary to go down river and face-off a German warship.",7.3,1000,"['Romance', 'Adventure', 'Drama']",3.0
993,Infinity (1996),Drama,116635,2033.0,Story of the early life of genius and Nobel Prize-winning physicist Richard Feynman.,6.2,17,"['Drama', 'Romance']",3.0
1015,Homeward Bound: The Incredible Journey (1993),Adventure|Children|Drama,107131,6878.0,"Before the Seavers leave for a family vacation to San Francisco, they drop off their pets -- Chance, an adventurous American bulldog; Shadow, a wise golden retriever; and Sassy, a cautious cat -- at a friend's ranch. But when the animals start to worry that they've been left for good, the three embark together on a treacherous and thrilling journey to find their way back home through the California wilderness.",7.0,1073,"['Adventure', 'Comedy', 'Family']",2.0
1019,"20,000 Leagues Under the Sea (1954)",Adventure|Drama|Sci-Fi,46672,173.0,"A ship sent to investigate a wave of mysterious sinkings encounters the advanced submarine, the Nautilus, commanded by Captain Nemo.",7.045,930,"['Adventure', 'Science Fiction', 'Family']",4.0
1025,"Sword in the Stone, The (1963)",Animation|Children|Fantasy|Musical,57546,9078.0,"Wart is a young boy who aspires to be a knight's squire. On a hunting trip he falls in on Merlin, a powerful but amnesiac wizard who has plans for him beyond mere squiredom. He starts by trying to give him an education, believing that once one has an education, one can go anywhere. Needless to say, it doesn't quite work out that way.",7.228,3966,"['Animation', 'Family', 'Fantasy']",3.0
1027,Robin Hood: Prince of Thieves (1991),Adventure|Drama,102798,8367.0,"Nobleman crusader Robin of Locksley breaks out of a Jerusalem prison with the help of Moorish fellow prisoner Azeem and travels back home to England. But upon arrival he discovers his dead father in the ruins of his family estate, killed by the vicious sheriff of Nottingham, Robin and Azeem join forces with outlaws Little John and Will Scarlett to save the kingdom from the sheriff's villainy.",6.9,3405,"['Action', 'Adventure', 'Drama']",4.0
1028,Mary Poppins (1964),Children|Comedy|Fantasy|Musical,58331,433.0,"Mr Banks is looking for a nanny for his two mischievous children and comes across Mary Poppins, an angelic nanny. She not only brings a change in their lives but also spreads happiness.",7.559,4835,"['Comedy', 'Family', 'Fantasy']",4.0
1029,Dumbo (1941),Animation|Children|Drama|Musical,33563,11360.0,"Dumbo is a baby elephant born with over-sized ears and a supreme lack of confidence. But thanks to his even more diminutive buddy Timothy the Mouse,  the pint-sized pachyderm learns to surmount all obstacles.",6.991,5133,"['Animation', 'Family']",3.0
1032,Alice in Wonderland (1951),Adventure|Animation|Children|Fantasy|Musical,43274,12092.0,"On a golden afternoon, wildly curious young Alice tumbles into the burrow and enters the merry, madcap world of Wonderland full of whimsical escapades.",7.188,6061,"['Animation', 'Family', 'Fantasy', 'Adventure']",2.0
1034,Freeway (1996),Comedy|Crime|Drama|Thriller,116361,11229.0,"Following the arrest of her mother, Ramona, young Vanessa Lutz decides to go in search of her estranged grandmother. On the way, she is given a ride by school counselor Bob Wolverton. During the journey, Lutz begins to realize that Bob is the notorious I-5 Killer and manages to escape by shooting him several times. Wounded but still very much alive, Bob pursues Lutz across the state in this modern retelling of Little Red Riding Hood.",6.5,400,"['Comedy', 'Crime', 'Thriller', 'Drama']",2.0
1042,That Thing You Do! (1996),Comedy|Drama,117887,9591.0,"A Pennsylvania band scores a hit in 1964 and rides the star-making machinery as long as it can, with lots of help from its manager.",6.9,874,"['Comedy', 'Drama', 'Romance', 'Music']",3.0
1043,To Gillian on Her 37th Birthday (1996),Drama|Romance,117924,30500.0,"David loves his wife, Gillian. Unfortunately, she died two years ago. David deals with his grief by continuing his romance with Gillian during walks with her ""ghost"" on the beach at night. While David lives in the past, other family problems crop up in the present in the real world....",5.5,52,"['Drama', 'Romance']",2.0
1057,Everyone Says I Love You (1996),Comedy|Musical|Romance,116242,9716.0,A New York girl sets her father up with a beautiful woman in a shaky marriage while her half sister gets engaged.,6.437,687,"['Comedy', 'Romance']",3.0
1073,Willy Wonka & the Chocolate Factory (1971),Children|Comedy|Fantasy|Musical,67992,252.0,"When eccentric candy man Willy Wonka promises a lifetime supply of sweets and a tour of his chocolate factory to five lucky kids, penniless Charlie Bucket seeks the golden ticket that will make him a winner.",7.478,3768,"['Family', 'Fantasy', 'Comedy']",3.0
1077,Sleeper (1973),Comedy|Sci-Fi,70707,11561.0,"Miles Monroe, a clarinet-playing health food store proprietor, is revived out of cryostasis 200 years into a future world in order to help rebels fight an oppressive government regime.",6.89,806,"['Comedy', 'Science Fiction']",3.0
1078,Bananas (1971),Comedy|War,66808,11302.0,"When a bumbling New Yorker is dumped by his activist girlfriend, he travels to a tiny Latin American nation and becomes involved in its latest rebellion.",6.7,778,['Comedy'],3.0
1079,"Fish Called Wanda, A (1988)",Comedy|Crime,95159,623.0,"While a diamond advocate attempts to steal a collection of diamonds, troubles arise when he realises he’s not the only one after the collection.",7.204,2301,"['Comedy', 'Crime']",3.0
1080,Monty Python's Life of Brian (1979),Comedy,79470,583.0,"Brian Cohen is an average young Jewish man, but through a series of ridiculous events, he gains a reputation as the Messiah. When he's not dodging his followers or being scolded by his shrill mother, the hapless Brian has to contend with the pompous Pontius Pilate and acronym-obsessed members of a separatist movement. Rife with Monty Python's signature absurdity, the tale finds Brian's life paralleling Biblical lore, albeit with many more laughs.",7.759,4662,['Comedy'],4.0
1081,Victor/Victoria (1982),Comedy|Musical|Romance,84865,12614.0,"A struggling female soprano finds work playing a male female impersonator, but it complicates her personal life.",7.285,428,"['Music', 'Comedy', 'Romance']",4.0
1083,"Great Race, The (1965)",Comedy|Musical,59243,11575.0,"Professional daredevil and white-suited hero, The Great Leslie, convinces turn-of-the-century auto makers that a race from New York to Paris (westward across America, the Bering Straight and Russia) will help to promote automobile sales. Leslie's arch-rival, the mustached and black-attired Professor Fate vows to beat Leslie to the finish line in a car of Fate's own invention.",7.092,348,"['Comedy', 'Adventure', 'Action']",3.0
1097,E.T. the Extra-Terrestrial (1982),Children|Drama|Sci-Fi,83866,601.0,"An alien is left behind on Earth and saved by the 10-year-old Elliott who decides to keep him hidden in his home. While a task force hunts for the extra-terrestrial, Elliott, his brother, and his little sister Gertie form an emotional bond with their new friend, and try to help him find his way home.",7.513,11575,"['Science Fiction', 'Adventure', 'Family', 'Fantasy']",3.0
1113,"Associate, The (1996)",Comedy,115580,11112.0,Laurel Ayres is a businesswoman trying to make it but unfortunately she works at a investment firm where she does all the work but all the senior investors like Frank Peterson grab all the credit. She then leaves and starts her own firm. While trying to find clients Laurel pretends that she has a male partner named Robert Cutty. And when she starts to do well all of her clients wants to meet Cutty which is difficult since he doesn't exist.,6.252,220,['Comedy'],2.0
1117,"Eighth Day, The (Huitième jour, Le) (1996)",Drama,116581,36998.0,"Georges has Down syndrome, living at a mental-institution, Harry is a busy businessman, giving lectures for young aspiring salesmen. He is successful in his business life, but his social life is a disaster since his wife left him and took their two children with her. This weekend his children came by train to meet him, but Harry, working as always, forgot to pick them up. Neither his wife or his children want to see him again and he is driving around on the country roads, anguished and angry. He almost runs over Georges, on the run from the institution since everybody else went home with their parents except him, whose mother is dead. Harry tries to get rid of Georges but he won't leave his new friend. Eventually a special friendship forms between the two of them, a friendship which makes Harry a different person.",7.4,294,['Drama'],3.0
1125,"Return of the Pink Panther, The (1975)",Comedy|Crime,72081,11843.0,The famous Pink Panther jewel has once again been stolen and Inspector Clouseau is called in to catch the thief. The Inspector is convinced that 'The Phantom' has returned and utilises all of his resources – himself and his Asian manservant – to reveal the identity of 'The Phantom'.,6.787,634,"['Comedy', 'Crime', 'Mystery']",3.0
1127,"Abyss, The (1989)",Action|Adventure|Sci-Fi|Thriller,96754,2756.0,"A civilian oil rig crew is recruited to conduct a search and rescue effort when a nuclear submarine mysteriously sinks. One diver soon finds himself on a spectacular odyssey 25,000 feet below the ocean's surface where he confronts a mysterious force that has the power to change the world or destroy it.",7.347,3211,"['Adventure', 'Thriller', 'Science Fiction']",3.0
1135,Private Benjamin (1980),Comedy,81375,10765.0,A sheltered young high society woman joins the US Army on a whim and finds herself in a more difficult situation than she ever expected.,5.971,397,['Comedy'],3.0
1136,Monty Python and the Holy Grail (1975),Adventure|Comedy|Fantasy,71853,762.0,"King Arthur, accompanied by his squire, recruits his Knights of the Round Table, including Sir Bedevere the Wise, Sir Lancelot the Brave, Sir Robin the Not-Quite-So-Brave-As-Sir-Lancelot and Sir Galahad the Pure. On the way, Arthur battles the Black Knight who, despite having had all his limbs chopped off, insists he can still fight. They reach Camelot, but Arthur decides not  to enter, as ""it is a silly place"".",7.803,6095,"['Adventure', 'Comedy', 'Fantasy']",4.0
1148,Wallace & Gromit: The Wrong Trousers (1993),Animation|Children|Comedy|Crime,108598,531.0,"Wallace rents out Gromit's former bedroom to a penguin, who takes up an interest in the techno pants created by Wallace. However, Gromit later learns that the penguin is a wanted criminal.  Preserved by the Academy Film Archive.",7.806,1091,"['Animation', 'Comedy', 'Family']",4.0
1151,Lesson Faust (1994),Animation|Comedy|Drama|Fantasy,109781,18919.0,"A very free adaptation of Marlowe's ""Doctor Faustus"", Goethe's ""Faust"" and various other treatments of the old legend of the man who sold his soul to the devil. A nondescript man is lured by a strange map into a sinister puppet theatre, where he finds himself immersed in an indescribably weird version of the play, blending live actors, clay animation and giant puppets.",7.5,71,"['Animation', 'Fantasy']",3.0
1162,"Ruling Class, The (1972)",Comedy|Drama,69198,30892.0,"When the Earl of Gurney dies in a cross-dressing accident, his schizophrenic son, Jack, inherits the Gurney estate. Jack is not the average nobleman; he sings and dances across the estate and thinks he is Jesus reincarnated. Believing that Jack is mentally unfit to own the estate, the Gurney family plots to steal Jack's inheritance. As their outrageous schemes fail, the family strives to cure Jack of his bizarre behavior, with disastrous results.",6.449,89,"['Comedy', 'Drama']",3.0
1163,Mina Tannenbaum (1994),Drama,110521,86369.0,The film tells the story of two girls who are of totally different character. They know each other since their childhood and were friends until they became teenagers. But growing up and becoming adults they go different ways.,6.3,19,"['Drama', 'Comedy']",3.0
1178,Paths of Glory (1957),Drama|War,50825,975.0,A commanding officer defends three scapegoats on trial for a failed offensive that occurred within the French Army in 1916.,8.259,3098,"['War', 'Drama']",2.0
1183,"English Patient, The (1996)",Drama|Romance|War,116209,409.0,"In the 1930s, Count Almásy is a Hungarian map maker employed by the Royal Geographical Society to chart the vast expanses of the Sahara Desert along with several other prominent explorers. As World War II unfolds, Almásy enters into a world of love, betrayal, and politics.",7.16,2288,"['Drama', 'Romance', 'War']",4.0
1186,"Sex, Lies, and Videotape (1989)",Drama,98724,1412.0,"Ann, a frustrated wife, enters into counseling due to a troubled marriage. Unbeknownst to her, her husband John has begun an affair with her sister. When John’s best friend Graham arrives, his penchant for interviewing women about their sex lives forever changes John and Ann’s rocky marriage.",6.948,977,['Drama'],3.0
1187,Passion Fish (1992),Drama,105107,41768.0,"After an accident leaves her a paraplegic, a former soap opera star struggles to recover both emotionally and mentally, until she meets her newest nurse, who has struggles of her own.",6.9,55,['Drama'],3.0
1196,Star Wars: Episode V - The Empire Strikes Back (1980),Action|Adventure|Sci-Fi,80684,1891.0,"The epic saga continues as Luke Skywalker, in hopes of defeating the evil Galactic Empire, learns the ways of the Jedi from aging master Yoda. But Darth Vader is more determined than ever to capture Luke. Meanwhile, rebel leader Princess Leia, cocky Han Solo, Chewbacca, and droids C-3PO and R2-D2 are thrown into various stages of capture, betrayal and despair.",8.395,17707,"['Adventure', 'Action', 'Science Fiction']",3.0
1197,"Princess Bride, The (1987)",Action|Adventure|Comedy|Fantasy|Romance,93779,2493.0,"In this enchantingly cracked fairy tale, the beautiful Princess Buttercup and the dashing Westley must overcome staggering odds to find happiness amid six-fingered swordsmen, murderous princes, Sicilians and rodents of unusual size. But even death can't stop these true lovebirds from triumphing.",7.7,4824,"['Adventure', 'Family', 'Fantasy', 'Comedy', 'Romance']",3.0
1198,Raiders of the Lost Ark (Indiana Jones and the Raiders of the Lost Ark) (1981),Action|Adventure,82971,85.0,"When Dr. Indiana Jones – the tweed-suited professor who just happens to be a celebrated archaeologist – is hired by the government to locate the legendary Ark of the Covenant, he finds himself up against the entire Nazi regime.",7.925,13083,"['Adventure', 'Action']",4.0
1204,Lawrence of Arabia (1962),Adventure|Drama|War,56172,947.0,"The story of British officer T.E. Lawrence's mission to aid the Arab tribes in their revolt against the Ottoman Empire during the First World War. Lawrence becomes a flamboyant, messianic figure in the cause of Arab unity but his psychological instability threatens to undermine his achievements.",8.0,3221,"['Adventure', 'History', 'War']",5.0
1206,"Clockwork Orange, A (1971)",Crime|Drama|Sci-Fi|Thriller,66921,185.0,"In a near-future Britain, young Alexander DeLarge and his pals get their kicks beating and raping anyone they please. When not destroying the lives of others, Alex swoons to the music of Beethoven. The state, eager to crack down on juvenile crime, gives an incarcerated Alex the option to undergo an invasive procedure that'll rob him of all personal agency. In a time when conscience is a commodity, can Alex change his tune?",8.185,13361,"['Science Fiction', 'Crime']",3.0
1210,Star Wars: Episode VI - Return of the Jedi (1983),Action|Adventure|Sci-Fi,86190,1892.0,"Luke Skywalker leads a mission to rescue his friend Han Solo from the clutches of Jabba the Hutt, while the Emperor seeks to destroy the Rebellion once and for all with a second dreaded Death Star.",7.904,16330,"['Adventure', 'Action', 'Science Fiction']",3.0
1220,"Blues Brothers, The (1980)",Action|Comedy|Musical,80455,525.0,"Jake Blues, just released from prison, puts his old band back together to save the Catholic home where he and his brother Elwood were raised.",7.726,4377,"['Music', 'Comedy', 'Action', 'Crime']",2.0
1225,Amadeus (1984),Drama,86879,279.0,Disciplined Italian composer Antonio Salieri becomes consumed by jealousy and resentment towards the hedonistic and remarkably talented young Salzburger composer Wolfgang Amadeus Mozart.,8.027,4499,"['History', 'Music', 'Drama']",4.0
1230,Annie Hall (1977),Comedy|Romance,75686,703.0,New York comedian Alvy Singer falls in love with the ditsy Annie Hall.,7.736,4052,"['Comedy', 'Drama', 'Romance']",3.0
1234,"Sting, The (1973)",Comedy|Crime,70735,9277.0,A novice con man teams up with an acknowledged master to avenge the murder of a mutual friend by pulling off the ultimate big con and swindling a fortune from a big-time mobster.,8.028,2772,"['Comedy', 'Crime', 'Drama']",4.0
1235,Harold and Maude (1971),Comedy|Drama|Romance,67185,343.0,The young Harold lives in his own world of suicide-attempts and funeral visits to avoid the misery of his current family and home environment. Harold meets an 80-year-old woman named Maude who also lives in her own world yet one in which she is having the time of her life. When the two opposites meet they realize that their differences don’t matter and they become best friends and love each other.,7.615,1142,"['Comedy', 'Drama', 'Romance']",5.0
1238,Local Hero (1983),Comedy,85859,11235.0,An American oil company sends a man to Scotland to buy up an entire village where they want to build a refinery. But things don't go as expected.,6.757,373,"['Comedy', 'Drama']",3.0
1242,Glory (1989),Drama|War,97441,9665.0,"Robert Gould Shaw leads the US Civil War's first all-black volunteer company, fighting prejudices of both his own Union army and the Confederates.",7.472,1703,"['Drama', 'History', 'War']",4.0
1244,Manhattan (1979),Comedy|Drama|Romance,79522,696.0,Manhattan explores how the life of a middle-aged television writer dating a teenage girl is further complicated when he falls in love with his best friend's mistress.,7.721,2500,"['Comedy', 'Drama', 'Romance']",3.0
1246,Dead Poets Society (1989),Drama,97165,207.0,"At an elite, old-fashioned boarding school in New England, a passionate English teacher inspires his students to rebel against convention and seize the potential of every day, courting the disdain of the stern headmaster.",8.301,11927,['Drama'],3.0
1247,"Graduate, The (1967)",Comedy|Drama|Romance,61722,37247.0,A disillusioned college graduate finds himself torn between his older lover and her daughter.,7.6,3514,"['Drama', 'Romance', 'Comedy']",3.0
1256,Duck Soup (1933),Comedy|Musical|War,23969,3063.0,Rufus T. Firefly is named president/dictator of bankrupt Freedonia and declares war on neighboring Sylvania over the love of wealthy Mrs. Teasdale.,7.3,816,"['Comedy', 'War']",3.0
1259,Stand by Me (1986),Adventure|Drama,92005,235.0,"After learning that a boy their age has been accidentally killed near their rural homes, four Oregon boys decide to go see the body. On the way, Gordie,  Vern, Chris and Teddy encounter a mean junk man and a marsh full of leeches, as they also learn more about one another and their very different home lives. Just a lark at first, the boys' adventure evolves into a defining event in their lives.",7.853,6177,"['Crime', 'Drama']",3.0
1262,"Great Escape, The (1963)",Action|Adventure|Drama|War,57115,5925.0,"The Nazis, exasperated at the number of escapes from their prison camps by a relatively small number of Allied prisoners, relocate them to a high-security 'escape-proof' camp to sit out the remainder of the war. Undaunted, the prisoners plan one of the most ambitious escape attempts of World War II. Based on a true story.",7.9,2683,"['Adventure', 'Drama', 'War']",4.0
1264,Diva (1981),Action|Drama|Mystery|Romance|Thriller,82269,4485.0,"Jules, a young Parisian postman, secretly records a concert performance given by the opera singer Cynthia Hawkins, whom he idolises. The following day, Jules runs into a woman who is being pursued by armed thugs. Before she is killed, the woman slips an audio cassette into his mail bag...",6.714,252,"['Action', 'Drama', 'Thriller']",4.0
1265,Groundhog Day (1993),Comedy|Fantasy|Romance,107048,137.0,"A narcissistic TV weatherman, along with his attractive-but-distant producer, and his mawkish cameraman, is sent to report on Groundhog Day in the small town of Punxsutawney, where he finds himself repeating the same day over and over.",7.616,8426,"['Romance', 'Fantasy', 'Drama', 'Comedy']",4.0
1269,Arsenic and Old Lace (1944),Comedy|Mystery|Thriller,36613,212.0,"Mortimer Brewster, a newspaper drama critic, playwright, and author known for his diatribes against marriage, suddenly falls in love and gets married;  but when he makes a quick trip home to tell his two maiden aunts, he finds out his aunts' hobby - killing lonely old men and burying them in the cellar!",7.6,986,"['Comedy', 'Crime']",3.0
