movieId,title,genres,imdbId,tmdbId,overview,tmdb_vote_average,tmdb_vote_count,tmdb_genres,rating
3163,Topsy-Turvy (1999),Comedy|Drama|Musical,151568,46435.0,"After their latest production, ""Princess Ida"", meets with less-than-stunning reception, Gilbert and Sullivan's relationship is strained to the breaking point. Their friends and associates attempt to get the two to work together again, which bares the path to ""The Mikado"", one of the duo's greatest successes.",6.62,158,"['Comedy', 'Drama', 'Music', 'History']",2.0
3167,Carnal Knowledge (1971),Comedy|Drama,66892,36492.0,"Two lifelong friends navigate complex sexual encounters and emotional entanglements, wrestling with societal norms and personal desires.",6.6,207,"['Drama', 'Romance', 'Comedy']",4.0
3168,Easy Rider (1969),Adventure|Drama,64276,624.0,"Wyatt and Billy, two Harley-riding hippies, complete a drug deal in Southern California and decide to travel cross-country in search of spiritual truth.",7.063,2060,"['Adventure', 'Drama']",5.0
3189,My Dog Skip (1999),Children|Drama,156812,17908.0,"A shy boy is unable to make friends in Yazoo City, Mississippi in 1942, until his parents give him a terrier puppy for his ninth birthday. The dog, which he names Skip, becomes well known and loved throughout the community and enriches the life of the boy, Willie, as he grows into manhood. Based on the best-selling Mississippi memoir by the late Willie Morris.",6.7,280,"['Comedy', 'Drama', 'Family']",3.0
3196,Stalag 17 (1953),Drama|War,46359,632.0,"It's a dreary Christmas 1944 for the American POWs in Stalag 17 and the men in Barracks 4, all sergeants, have to deal with a grave problem—there seems to be a security leak.",7.695,629,"['Comedy', 'Drama', 'War']",5.0
3201,Five Easy Pieces (1970),Drama,65724,26617.0,"A drop-out from upper-class America picks up work along the way on oil-rigs when his life isn't spent in a squalid succession of bars, motels, and other points of interest.",7.1,551,['Drama'],5.0
3204,"Boys from Brazil, The (1978)",Action|Mystery|Thriller,77269,16241.0,"Nazi hunter Ezra Lieberman discovers a sinister and bizarre plot, masterminded by Dr. Josef Mengele, to rekindle the Third Reich.",6.7,414,"['Drama', 'Mystery', 'Science Fiction']",4.0
3224,Woman in the Dunes (Suna no onna) (1964),Drama,58625,16672.0,A vacationing entomologist suffers extreme physical and psychological trauma after being taken captive by the residents of a poor seaside village and made to live with a woman whose life task is shoveling sand for them.,8.2,490,"['Drama', 'Thriller']",4.0
3230,"Odessa File, The (1974)",Thriller,71935,21489.0,"Following the suicide of an elderly Jewish man, investigative journalist Peter Miller sets out to hunt down an SS Captain and former concentration camp commander. In doing so he discovers that, despite allegations of war crimes, the former commander has become a man of importance in industry in post-war Germany, protected from prosecution by a powerful organisation of former SS members called Odessa.",6.6,190,['Thriller'],5.0
3244,"Goodbye Girl, The (1977)",Comedy|Romance,76095,14741.0,"After being dumped by her live-in boyfriend, an unemployed dancer and her 10-year-old daughter are reluctantly forced to live with a struggling off-Broadway actor.",6.9,177,"['Comedy', 'Drama', 'Romance']",5.0
3251,Agnes of God (1985),Drama|Mystery,88683,24735.0,"When a dead newborn is found, wrapped in bloody sheets, in the bedroom wastebasket of a young novice, psychiatrist Martha Livingston is called in to determine if the seemingly innocent novice, who knows nothing of sex or birth, is competent enough to stand trial for the murder of the baby.",6.231,132,"['Drama', 'Mystery']",3.0
3299,Hanging Up (2000),Comedy|Drama,162983,10385.0,"Three sisters - Georgia, Eve, and Maddy - do what they do best with life, love, and lunacy on the telephone lines that bind - when their curmudgeonly father, Lou, is admitted to a Los Angeles Hospital. After years of wild living, intermittent affection, and constant phoning, he is finally threatening to die.",5.3,181,"['Drama', 'Comedy']",2.0
3317,Wonder Boys (2000),Comedy|Drama,185014,11004.0,Grady is a 50-ish English professor who hasn't had a thing published in years—not since he wrote his award winning 'Great American Novel' 7 years ago. This weekend proves even worse than he could imagine as he finds himself reeling from one misadventure to another in the company of a new wonder boy author.,6.84,620,"['Comedy', 'Drama']",5.0
3334,Key Largo (1948),Crime|Drama|Film-Noir|Thriller,40506,11016.0,"A hurricane swells outside, but it's nothing compared to the storm within the hotel at Key Largo. There, sadistic mobster Johnny Rocco holes up - and holds at gunpoint hotel owner James Temple, his widowed daughter-in-law Nora, and ex-GI Frank McCloud.",7.5,554,"['Crime', 'Thriller']",5.0
3341,Born Yesterday (1950),Comedy,42276,24481.0,"Uncouth, loud-mouth junkyard tycoon Harry Brock descends upon Washington D.C. to buy himself a congressman or two, bringing with him his mistress, ex-showgirl Billie Dawn.",7.246,175,"['Comedy', 'Romance']",5.0
3359,Breaking Away (1979),Comedy|Drama,78902,20283.0,"Dave, nineteen, has just graduated high school, with his three friends: the comical Cyril, the warm hearted but short-tempered Moocher, and the athletic, spiteful but good-hearted Mike. Now, Dave enjoys racing bikes and hopes to race the Italians one day, and even takes up the Italian culture, much to his friends' and parents' annoyance.",7.1,275,"['Drama', 'Comedy']",5.0
3379,On the Beach (1959),Drama,53137,35412.0,"In 1964, atomic war wipes out humanity in the northern hemisphere; one American submarine finds temporary safe haven in Australia, where life-as-usual covers growing despair. In denial about the loss of his wife and children in the holocaust, American Captain Towers meets careworn but gorgeous Moira Davidson, who begins to fall for him. The sub returns after reconnaissance a month (or less) before the end; will Towers and Moira find comfort with each other?",6.621,215,"['Science Fiction', 'Drama', 'Romance']",3.0
3384,"Taking of Pelham One Two Three, The (1974)",Action|Crime,72251,8333.0,"In New York, armed men hijack a subway car and demand a ransom for the passengers. Even if it's paid, how could they get away?",7.476,578,"['Crime', 'Thriller', 'Action']",4.0
3394,Blind Date (1987),Comedy|Romance,92666,918.0,"When bachelor Walter Davis is set up with his sister-in-law's pretty cousin, Nadia Gates, a seemingly average blind date turns into a chaotic night on the town. Walter's brother, Ted, tells him not to let Nadia drink alcohol, but he dismisses the warning and her behaviour gets increasingly wild. Walter and Nadia's numerous incidents are made even worse as her former lover David relentlessly follows them around town.",6.0,509,"['Comedy', 'Romance']",3.0
3396,"Muppet Movie, The (1979)",Adventure|Children|Comedy|Musical,79588,11176.0,"The Muppets gather to watch their newly-finished big-budget rich-and-famous feature film: a talent agent persuades Kermit the Frog to leave the swamp to pursue a career in Hollywood. On his way there, he meets a bear, a pig, a whatever (his future muppet crew), and some special celebrity guest stars, while being chased by the desperate owner of a frog-leg restaurant!",7.23,659,"['Family', 'Comedy', 'Adventure', 'Music']",3.0
3408,Erin Brockovich (2000),Drama,195685,462.0,"A twice-divorced mother of three who sees an injustice, takes on the bad guy and wins -- with a little help from her push-up bra. Erin goes to work for an attorney and comes across medical records describing illnesses clustered in one nearby town. She starts investigating and soon exposes a monumental cover-up.",7.442,3434,['Drama'],4.0
3418,Thelma & Louise (1991),Adventure|Crime|Drama,103074,1541.0,"Taking a break from their dreary lives, close friends Thelma and Louise embark on a short weekend trip that ends in unforeseen incriminating circumstances. As fugitives, both women rediscover the strength of their bond and their newfound resilience.",7.6,3666,"['Drama', 'Thriller', 'Crime', 'Adventure']",2.0
3421,Animal House (1978),Comedy,77975,8469.0,"At a 1962 College, Dean Vernon Wormer is determined to expel the entire Delta Tau Chi Fraternity, but those troublemakers have other plans for him.",7.0,1594,['Comedy'],3.0
3435,Double Indemnity (1944),Crime|Drama|Film-Noir,36775,996.0,A seductive housewife draws an insurance salesman into a plot of adultery and crime to collect on her husband's life insurance.,8.106,1906,"['Crime', 'Thriller']",5.0
3467,Hud (1963),Drama|Western,57163,24748.0,"Hud Bannon is a ruthless young man who tarnishes everything and everyone he touches. Hud represents the perfect embodiment of alienated youth, out for kicks with no regard for the consequences. There is bitter conflict between the callous Hud and his stern and highly principled father, Homer. Hud's nephew Lon admires Hud's cheating ways, though he soon becomes too aware of Hud's reckless amorality to bear him anymore. In the world of the takers and the taken, Hud is a winner. He's a cheat, but, he explains, ""I always say the law was meant to be interpreted in a lenient manner.""",7.264,332,"['Drama', 'Western']",5.0
3471,Close Encounters of the Third Kind (1977),Adventure|Drama|Sci-Fi,75860,840.0,"After an encounter with UFOs, an electricity linesman feels undeniably drawn to an isolated area in the wilderness where something spectacular is about to happen.",7.3,4410,"['Science Fiction', 'Drama']",3.0
3481,High Fidelity (2000),Comedy|Drama|Romance,146882,243.0,"After his long-time girlfriend dumps him, a thirty-year-old record store owner seeks to understand why he is unlucky in love while recounting his ""top five breakups of all time"".",7.122,2082,"['Drama', 'Comedy', 'Romance', 'Music']",5.0
3496,Madame Sousatzka (1988),Drama,95564,118098.0,"In London, eccentric piano instructor Madame Sousatzka takes on a new prize protégé, Manek, a teenage Bengali immigrant who displays incredible talent. Manek forms a close bond with his teacher, but soon discovers that she expects her pupils to become disciplined in all areas of life, and not just behind the piano. As he struggles to meet the challenges, Manek must also deal with his mother, who vies with his teacher for his attention.",6.857,21,"['Drama', 'Music']",3.0
3501,Murphy's Romance (1985),Comedy|Romance,89643,34322.0,"Emma, a divorced single mother seeking to start her life over, moves to a small town in Arizona. She befriends Murphy, the older local pharmacist, but things turn complicated when her ex-husband shows up.",6.157,70,"['Comedy', 'Drama', 'Romance']",4.0
3503,Solaris (Solyaris) (1972),Drama|Mystery|Sci-Fi,69293,593.0,A psychologist is sent to a space station orbiting a planet called Solaris to investigate the death of a doctor and the mental problems of cosmonauts on the station. He soon discovers that the water on the planet is a type of brain which brings out repressed memories and obsessions.,7.798,1710,"['Drama', 'Science Fiction', 'Mystery']",5.0
3504,Network (1976),Comedy|Drama,74958,10774.0,"When veteran anchorman Howard Beale is forced to retire his 25-year post because of his age, he announces to viewers that he will kill himself during his farewell broadcast. Network executives rethink their decision when his fanatical tirade results in a spike in ratings.",7.811,1882,['Drama'],1.0
3507,"Odd Couple, The (1968)",Comedy,63374,11356.0,"In New York, Felix, a neurotic news writer who just broke up with his wife, is urged by his chaotic friend Oscar, a sports journalist, to move in with him, but their lifestyles are as different as night and day are, so Felix's ideas about housekeeping soon begin to irritate Oscar.",7.5,608,['Comedy'],5.0
3509,Black and White (1999),Drama,165643,38809.0,"Rich Bower is an up-and-coming star in the hip-hop world. Everyone wants to be around him, including Raven and her fellow upper-class white high school friends. The growing appeal of black culture among white teens fascinates documentary filmmaker Sam Donager, who sets out to chronicle it with her husband, Terry. But before Bower was a rapper, he was a gangster, and his criminal past comes back to haunt him and all those around him.",4.7,69,['Drama'],4.0
3512,Return to Me (2000),Drama|Romance,122459,2621.0,"It took a lot of cajoling to get Bob, a recently widowed architect, to go on a blind date at a quirky Irish-Italian eatery. Once there, he's smitten instantly not with his date but with the sharp-witted waitress. Everything seems to be going great until an unbelievable truth is revealed, one that could easily break both of their hearts for good.",6.6,452,"['Romance', 'Comedy']",2.0
3516,"Bell, Book and Candle (1958)",Comedy|Fantasy|Romance,51406,2006.0,"A modern-day witch likes her neighbor but despises his fiancée, so she enchants him to love her instead... only to fall in love with him for real.",6.5,234,"['Comedy', 'Fantasy', 'Romance']",4.0
3524,Arthur (1981),Comedy|Romance,82031,13665.0,Arthur is a 30-year-old child who will inherit $750 million if he complies with his family's demands and marries the woman of their choosing.,6.508,447,"['Comedy', 'Drama', 'Romance']",3.0
3528,"Prince of Tides, The (1991)",Drama|Romance,102713,10333.0,A troubled Southern man talks to his suicidal sister's psychiatrist about their family history and falls in love with her (and New York City) in the process.,6.6,291,"['Drama', 'Romance']",2.0
3543,Diner (1982),Comedy|Drama,83833,13776.0,"Set in 1959, Diner shows how five young men resist their adulthood and seek refuge in their beloved Diner. The mundane, childish, and titillating details of their lives are shared. But the golden moments pass, and the men shoulder their responsibilities, leaving the Diner behind.",6.8,290,"['Comedy', 'Drama']",4.0
3545,Cabaret (1972),Drama|Musical,68327,10784.0,"Inside the Kit Kat Club of 1931 Berlin, starry-eyed singer Sally Bowles and an impish emcee sound the clarion call to decadent fun, while outside a certain political party grows into a brutal force.",7.43,924,"['Music', 'Drama', 'Romance']",4.0
3551,Marathon Man (1976),Crime|Drama|Thriller,74860,10518.0,"A graduate student and obsessive runner in New York is drawn into a mysterious plot involving his brother, a member of the secretive Division.",7.176,1148,"['Thriller', 'Crime', 'Drama', 'Action']",5.0
3594,Center Stage (2000),Drama|Musical,210616,10560.0,A group of 12 teenagers from various backgrounds enroll at the American Ballet Academy in New York to make it as ballet dancers and each one deals with the problems and stress of training and getting ahead in the world of dance.,6.9,346,"['Drama', 'Music']",4.0
3654,"Guns of Navarone, The (1961)",Action|Adventure|Drama|War,54953,10911.0,"A team of allied saboteurs are assigned an impossible mission: infiltrate an impregnable Nazi-held island and destroy the two enormous long-range field guns that prevent the rescue of 2,000 trapped British soldiers.",7.307,823,"['War', 'Adventure', 'Thriller', 'Action']",5.0
3671,Blazing Saddles (1974),Comedy|Western,71230,11072.0,"A town—where everyone seems to be named Johnson—stands in the way of the railroad. In order to grab their land, robber baron Hedley Lamarr sends his henchmen to make life in the town unbearable. After the sheriff is killed, the town demands a new sheriff from the Governor, so Hedley convinces him to send the town the first black sheriff in the west.",7.248,1974,"['Western', 'Comedy']",5.0
3678,"Man with the Golden Arm, The (1955)",Drama,48347,541.0,"When illegal card dealer and recovering heroin addict Frankie Machine gets out of prison, he decides to straighten up. Armed with nothing but an old drum set, Frankie tries to get honest work as a drummer. But when his former employer and his old drug dealer re-enter his life, Frankie finds it hard to stay clean and eventually finds himself succumbing to his old habits.",7.158,234,"['Drama', 'Crime']",5.0
3684,"Fabulous Baker Boys, The (1989)",Drama|Romance,97322,10875.0,"The lives of two struggling musicians, who happen to be brothers, inevitably change when they team up with a beautiful, up-and-coming singer.",6.609,349,"['Comedy', 'Drama', 'Music', 'Romance']",5.0
3702,Mad Max (1979),Action|Adventure|Sci-Fi,79501,9659.0,"In the ravaged near-future, a savage motorcycle gang rules the road. Terrorizing innocent civilians while tearing up the streets, the ruthless gang laughs in the face of a police force hell-bent on stopping them.",6.676,4704,"['Adventure', 'Action', 'Thriller', 'Science Fiction']",4.5
3733,"Paper Chase, The (1973)",Drama,70509,14328.0,A first-year law student struggles with balancing his coursework and his relationship with the daughter of a stern professor.,6.8,111,['Drama'],5.0
3742,Battleship Potemkin (1925),Drama|War,15648,643.0,"A dramatized account of a great Russian naval mutiny and a resultant public demonstration, showing support, which brought on a police massacre. The film had an incredible impact on the development of cinema and is a masterful example of montage editing.",7.608,1227,"['Drama', 'History', 'War']",5.0
3749,"Time Regained (Temps retrouvé, Le) (1999)",Drama,189142,47439.0,"In early 1920s France, an author, lying on his deathbed, looks at various photographs and is flooded with memories of the people and events that have shaped his life.",6.3,66,['Drama'],5.0
3751,Chicken Run (2000),Animation|Children|Comedy,120630,7443.0,"The creators of Wallace & Gromit bring you an exciting and original story about a group of chickens determined to fly the coop–even if they can’t fly! It’s hardly poultry in motion when Rocky attempts to teach Ginger and her feathered friends to fly…but, with teamwork, determination and a little bit o’ cluck, the fearless flock plots one last attempt in a spectacular bid for freedom.",6.831,5219,"['Animation', 'Comedy', 'Family']",4.0
3763,F/X (1986),Action|Crime|Thriller,89118,9873.0,"A movies special effects man is hired by a government agency to help stage the assassination of a well known gangster. When the agency double cross him, he uses his special effects to trap the gangster and the corrupt agents.",6.561,469,"['Action', 'Thriller']",4.0
3788,Blow-Up (Blowup) (1966),Drama|Mystery,60176,1052.0,"A successful mod photographer in London whose world is bounded by fashion, pop music, marijuana, and easy sex, feels his life is boring and despairing. But in the course of a single day he unknowingly captures a death on film.",7.322,1309,"['Drama', 'Mystery', 'Thriller']",5.0
3811,Breaker Morant (1980),Drama|War,80310,13783.0,"During the Boer War, three Australian lieutenants are on trial for shooting Boer prisoners. Though they acted under orders, they are being used as scapegoats by the General Staff, who hopes to distance themselves from the irregular practices of the war. The trial does not progress as smoothly as expected by the General Staff, as the defence puts up a strong fight in the courtroom.",7.1,154,"['Drama', 'History', 'War']",5.0
3814,Love and Death (1975),Comedy,73312,11686.0,"In czarist Russia, a neurotic soldier and his distant cousin formulate a plot to assassinate Napoleon.",7.497,929,['Comedy'],5.0
3855,"Affair of Love, An (Liaison pornographique, Une) (1999)",Drama|Romance,204709,46991.0,A man and a woman meet to fulfill her sexual fantasy.,6.3,69,"['Romance', 'Drama']",4.0
3862,About Adam (2000),Comedy,199314,18168.0,"A waitress falls for a handsome customer who seduces her, her two sisters, her brother, and her brother's girlfriend.",5.2,119,"['Comedy', 'Romance']",5.0
3872,"Suddenly, Last Summer (1959)",Drama,53318,14698.0,The only son of wealthy widow Violet Venable dies while on vacation with his cousin Catherine. What the girl saw was so horrible that she went insane; now Mrs. Venable wants Catherine lobotomized to cover up the truth.,7.3,296,"['Thriller', 'Drama', 'Mystery']",5.0
3873,Cat Ballou (1965),Comedy|Western,59017,11694.0,"A woman seeking revenge for her murdered father hires a famous gunman, but he's very different from what she expects.",6.398,266,"['Western', 'Comedy']",4.5
3897,Almost Famous (2000),Drama,181875,786.0,"In 1973, 15-year-old William Miller's unabashed love of music and aspiration to become a rock journalist lands him an assignment from Rolling Stone magazine to interview and tour with the up-and-coming band, Stillwater.",7.503,2931,"['Drama', 'Music']",5.0
3911,Best in Show (2000),Comedy,218839,13785.0,"The tension is palpable, the excitement is mounting and the heady scent of competition is in the air as hundreds of eager contestants from across America prepare to take part in what is undoubtedly one of the greatest events of their lives -- the Mayflower Dog Show. The canine contestants and their owners are as wondrously diverse as the great country that has bred them.",6.862,608,['Comedy'],5.0
3929,"Bank Dick, The (1940)",Comedy,32234,911.0,"Egbert Sousé becomes an unexpected hero when a bank robber falls over a bench he's occupying. Now considered brave, Egbert is given a job as a bank guard. Soon, he is approached by charlatan J. Frothingham Waterbury about buying shares in a mining company. Egbert persuades teller Og Oggilby to lend him bank money, to be returned when the scheme pays off. Unfortunately, bank inspector Snoopington then makes a surprise appearance.",6.5,124,['Comedy'],5.0
3953,Dr. T and the Women (2000),Comedy|Romance,205271,10763.0,"A successful Texas gynecologist finds himself amid a bevy of women and their problems – his wife’s breakdown, his daughter's fake marriage, his other daughter’s conspiracy theories, and his secretary’s crush. Craving time for himself, he finds solace in a kind outsider.",4.876,336,"['Comedy', 'Drama', 'Romance']",3.0
3959,"Time Machine, The (1960)",Action|Adventure|Sci-Fi,54387,2134.0,A Victorian Englishman travels to the far future and finds that humanity has divided into two hostile species.,7.3,863,"['Thriller', 'Adventure', 'Fantasy', 'Science Fiction', 'Romance']",5.0
3967,Billy Elliot (2000),Drama,249462,71.0,"County Durham, England, 1984. The miners' strike has started and the police have started coming up from Bethnal Green, starting a class war with the lower classes suffering. Caught in the middle of the conflict is 11-year old Billy Elliot, who, after leaving his boxing club for the day, stumbles upon a ballet class and finds out that he's naturally talented. He practices with his teacher Mrs. Wilkinson for an upcoming audition in Newcastle-upon Tyne for the royal Ballet school in London.",7.598,3958,"['Drama', 'Comedy', 'Music']",1.0
3983,You Can Count on Me (2000),Drama|Romance,203230,14295.0,"A single mother's life is thrown into turmoil after her struggling, rarely-seen younger brother returns to town.",6.8,327,['Drama'],4.0
3987,Bounce (2000),Drama|Romance,186894,10862.0,"Buddy Amaral, a successful and self-absorbed Los Angeles advertising executive, switches airline tickets with a stranger just before boarding a long-delayed flight so that he might enjoy an overnight fling with a pretty Dallas businesswoman. When the plane goes down, killing all aboard, Buddy's guilt soon turns into an alcohol problem. As part of his 12-step program, Buddy seeks atonement and decides to seek out the woman he thinks he's left a widow.",5.801,396,"['Drama', 'Romance']",4.0
3991,102 Dalmatians (2000),Children|Comedy,211181,10481.0,"Get ready for a howling good time as an all new assortment of irresistible animal heroes are unleashed in this great family tail! In an unlikely alliance, the outrageous Waddlesworth - a parrot who thinks he's a Rottweiler - teams up with Oddball - an un-marked Dalmatian puppy eager to earn her spots! Together they embark on a laugh-packed quest to outwit the ever-scheming Cruella De Vil.",5.507,1414,"['Family', 'Comedy']",3.0
4014,Chocolat (2000),Drama|Romance,241303,392.0,"A mother and daughter move to a small French town where they open a chocolate shop. The town, religious and morally strict, is against them, as they represent free-thinking and indulgence. When a group of gypsies arrive by riverboat, the Mayor's prejudices lead to a crisis.",6.973,3386,"['Comedy', 'Drama', 'Romance']",4.0
4041,"Officer and a Gentleman, An (1982)",Drama|Romance,84434,2623.0,"Zack Mayo is an aloof, taciturn man who aspires to be a navy pilot. Once he arrives at training camp for his 13-week officer's course, Mayo runs afoul of abrasive, no-nonsense drill Sergeant Emil Foley. Mayo is an excellent cadet, but a little cold around the heart, so Foley rides him mercilessly, sensing that the young man would be prime officer material if he weren't so self-involved. Zack's affair with a working girl is likewise compromised by his unwillingness to give of himself.",7.0,1147,"['Drama', 'Romance']",4.0
4062,Mystic Pizza (1988),Comedy|Drama|Romance,95690,11191.0,"Three teenage girls come of age while working at a pizza parlor in Mystic, Connecticut.",6.32,554,"['Romance', 'Drama', 'Comedy']",3.0
4072,Faithless (Trolösa) (2000),Drama|Romance,157122,47595.0,"Scripted by Ingmar Bergman, this very personal film is about a destructive affair which wrecks the marriage of an actress (Marianne) and musician (Markus). Wanting to continue the affair, Marianne moves in with her lover. But she is tormented by Markus' decision not to let her have custody of their daughter. Finally Markus announces he may have a solution to the stalemate, but this leads to deception, lies and ultimately, tragedy.",6.7,49,"['Drama', 'Romance']",5.0
4082,Barfly (1987),Comedy|Drama|Romance,92618,10937.0,"Downtrodden writer Henry and distressed goddess Wanda aren't exactly husband and wife: they're wedded to their bar stools. But, they like each other's company—and Barfly captures their giddy, gin-soaked attempts to make a go of life on the skids.",6.871,362,"['Comedy', 'Drama', 'Romance']",4.0
