movieId,title,genres,imdbId,tmdbId,overview,tmdb_vote_average,tmdb_vote_count,tmdb_genres,rating
30810,"Life Aquatic with Steve Zissou, The (2004)",Adventure|Comedy|Fantasy,362270,421.0,"Renowned oceanographer Steve Zissou has sworn vengeance upon the rare shark that devoured a member of his crew. In addition to his regular team, he is joined on his boat by Ned, a man who believes Zissou to be his father, and Jane, a journalist pregnant by a married man. They travel the sea, all too often running into pirates and, perhaps more traumatically, various figures from Zissou's past, including his estranged wife, Eleanor.",7.078,3023,"['Adventure', 'Comedy', 'Drama']",4.0
30812,"Aviator, The (2004)",Drama,338751,2567.0,"A biopic depicting the life of filmmaker and aviation pioneer Howard Hughes from 1927 to 1947, during which time he became a successful film producer and an aviation magnate, while simultaneously growing more unstable due to severe obsessive-compulsive disorder.",7.22,5565,['Drama'],4.0
30825,Meet the Fockers (2004),Comedy,290002,693.0,"Hard-to-crack ex-CIA man Jack Byrnes and his wife Dina head for the warmer climes of Florida to meet the parents of their son-in-law-to-be, Greg Focker. Unlike their happily matched offspring, the future in-laws find themselves in a situation of opposites that definitely do not attract.",6.252,4942,"['Comedy', 'Romance']",3.0
30846,"Assassination of Richard Nixon, The (2004)",Crime|Drama|Thriller,364961,842.0,"It’s 1974 and Sam Bicke has lost everything. His wife leaves him with his three kids, his boss fires him, his brother turns away from him, and the bank won’t give him any money to start anew. He tries to find someone to blame for his misfortunes and comes up with the President of the United States who he plans to murder.",6.5,289,"['Drama', 'History', 'Thriller', 'Crime']",3.0
31685,Hitch (2005),Comedy|Romance,386588,8488.0,"Dating coach Alex 'Hitch' Hitchens mentors a bumbling client, Albert, who hopes to win the heart of the glamorous Allegra Cole. While Albert makes progress, Hitch faces his own romantic setbacks when proven techniques fail to work on Sara Melas, a tabloid reporter digging for dirt on Allegra Cole's love life. When Sara discovers Hitch's connection to Albert – now Allegra's boyfriend – it threatens to destroy both relationships.",6.57,6002,"['Comedy', 'Drama', 'Romance']",4.0
32587,Sin City (2005),Action|Crime|Film-Noir|Mystery|Thriller,401792,187.0,"Welcome to Sin City. This town beckons to the tough, the corrupt, the brokenhearted. Some call it dark… Hard-boiled. Then there are those who call it home — Crooked cops, sexy dames, desperate vigilantes. Some are seeking revenge, others lust after redemption, and then there are those hoping for a little of both. A universe of unlikely and reluctant heroes still trying to do the right thing in a city that refuses to care.",7.464,8460,"['Crime', 'Thriller']",3.0
32830,44 Minutes: The North Hollywood Shoot-Out (2003),Action|Crime,362389,14842.0,"After a failed bank robbery, two heavily armed men hold the Los Angeles Police Department at bay for 44 minutes.",6.6,104,"['Action', 'TV Movie']",3.0
33166,Crash (2004),Crime|Drama,375679,1640.0,"In post-Sept. 11 Los Angeles, tensions erupt when the lives of a Brentwood housewife, her district attorney husband, a Persian shopkeeper, two cops, a pair of carjackers and a Korean couple converge during a 36-hour period.",7.213,3663,['Drama'],4.0
33660,Cinderella Man (2005),Drama|Romance,352248,921.0,"The true story of boxer Jim Braddock who, following his retirement in the 1930s, makes a surprise comeback in order to lift his family out of poverty.",7.565,2290,"['Romance', 'Drama', 'History']",3.0
33679,Mr. & Mrs. Smith (2005),Action|Adventure|Comedy|Romance,356910,787.0,"A husband and wife struggle to keep their marriage alive until they realize they are both secretly working as assassins. Now, their respective assignments require them to kill each other.",6.687,10807,"['Action', 'Comedy', 'Drama', 'Thriller']",3.0
33794,Batman Begins (2005),Action|Crime|IMAX,372784,272.0,"Driven by tragedy, billionaire Bruce Wayne dedicates his life to uncovering and defeating the corruption that plagues his home, Gotham City.  Unable to work within the system, he instead creates a new identity, a symbol of fear for the criminal underworld - The Batman.",7.717,21820,"['Drama', 'Crime', 'Action']",3.0
34048,War of the Worlds (2005),Action|Adventure|Sci-Fi|Thriller,407304,74.0,"Ray Ferrier is a divorced dockworker and less-than-perfect father. Soon after his ex-wife and her new husband drop off his teenage son and young daughter for a rare weekend visit, a strange and powerful lightning storm touches down.",6.522,8759,"['Adventure', 'Thriller', 'Science Fiction']",3.0
34072,"March of the Penguins (Marche de l'empereur, La) (2005)",Documentary,428803,1667.0,"Every year, thousands of Antarctica's emperor penguins make an astonishing journey to breed their young. They walk, marching day and night in single file 70 miles into the darkest, driest and coldest continent on Earth.  This amazing, true-life tale is touched with humour and alive with thrills. Breathtaking photography captures the transcendent beauty and staggering drama of devoted parent penguins who, in the fierce polar winter, take turns guarding their egg and trekking to the ocean in search of food. Predators hunt them, storms lash them. But the safety of their adorable chicks makes it all worthwhile. So follow the leader... to adventure!!",7.07,1166,"['Documentary', 'Family']",4.0
34150,Fantastic Four (2005),Action|Adventure|Sci-Fi,120667,9738.0,"During a space voyage, four scientists are altered by cosmic rays: Reed Richards gains the ability to stretch his body; Sue Storm can become invisible; Johnny Storm controls fire; and Ben Grimm is turned into a super-strong … thing. Together, these ""Fantastic Four"" must now thwart the evil plans of Dr. Doom and save the world from certain destruction.",5.799,9692,"['Action', 'Fantasy', 'Science Fiction']",3.0
34162,Wedding Crashers (2005),Comedy|Romance,396269,9522.0,"John and his buddy, Jeremy are emotional criminals who know how to use a woman's hopes and dreams for their own carnal gain. Their modus operandi: crashing weddings. Normally, they meet guests who want to toast the romantic day with a random hook-up. But when John meets Claire, he discovers what true love – and heartache – feels like.",6.493,4519,"['Comedy', 'Romance']",4.0
34437,Broken Flowers (2005),Comedy|Drama,412019,308.0,Introverted Don Johnston receives an anonymous letter from an ex-lover informing him that he has a son who may be looking for him. A freelance sleuth neighbor motivates Don to embark on a cross-country search for his past flames seeking answers.,6.92,1405,"['Comedy', 'Drama', 'Mystery', 'Romance']",4.0
35836,"40-Year-Old Virgin, The (2005)",Comedy|Romance,405422,6957.0,"Andy Stitzer has a pleasant life with a nice apartment and a job stamping invoices at an electronics store. But at age 40, there's one thing Andy hasn't done, and it's really bothering his sex-obsessed male co-workers: Andy is still a virgin. Determined to help Andy get laid, the guys make it their mission to de-virginize him. But it all seems hopeless until Andy meets small business owner Trish, a single mom.",6.413,6947,"['Comedy', 'Romance']",4.0
36529,Lord of War (2005),Action|Crime|Drama|Thriller|War,399295,1830.0,"Yuri Orlov is a globetrotting arms dealer and, through some of the deadliest war zones, he struggles to stay one step ahead of a relentless Interpol agent, his business rivals and even some of his customers who include many of the world's most notorious dictators. Finally, he must also face his own conscience.",7.334,5049,"['Crime', 'Drama', 'Thriller']",3.0
37382,Domino (2005),Crime|Drama|Thriller,421054,9923.0,"The story of the life of Domino Harvey, who abandoned her career as a Ford model to become a bounty hunter.",5.918,1240,"['Action', 'Crime', 'Drama', 'Thriller']",2.0
37720,"Exorcism of Emily Rose, The (2005)",Crime|Drama|Horror|Thriller,404032,8643.0,"When a younger girl called Emily Rose dies, everyone puts blame on the exorcism which was performed on her by Father Moore prior to her death. The priest is arrested on suspicion of murder. The trial begins with lawyer Erin Bruner representing Moore, but it is not going to be easy, as no one wants to believe what Father Moore says is true.",6.597,2904,"['Crime', 'Drama', 'Horror', 'Thriller']",3.0
37731,Green Street Hooligans (a.k.a. Hooligans) (2005),Crime|Drama,385002,8923.0,"After being wrongfully expelled from Harvard University, American Matt Buckner flees to his sister's home in England. Once there, he is befriended by her charming and dangerous brother-in-law, Pete Dunham, and introduced to the underworld of British football hooliganism. Matt learns to stand his ground through a friendship that develops against the backdrop of this secret and often violent world. 'Green Street Hooligans' is a story of loyalty, trust and the sometimes brutal consequences of living close to the edge.",7.271,2460,"['Crime', 'Drama']",3.0
37733,"History of Violence, A (2005)",Action|Crime|Drama|Thriller,399146,59.0,An average family is thrust into the spotlight after the father commits a seemingly self-defense murder at his diner.,7.161,3485,"['Drama', 'Thriller', 'Crime']",3.0
38061,Kiss Kiss Bang Bang (2005),Comedy|Crime|Mystery|Thriller,373469,5236.0,A petty thief posing as an actor is brought to Los Angeles for an unlikely audition and finds himself in the middle of a murder investigation along with his high school dream girl and a detective who's been training him for his upcoming role...,7.163,2838,"['Comedy', 'Crime', 'Mystery', 'Thriller']",4.0
39292,"Good Night, and Good Luck. (2005)",Crime|Drama,433383,3291.0,The story of journalist Edward R. Murrow's stand against Senator Joseph McCarthy's anti-communist witch-hunts in the early 1950s.,7.076,1046,"['Drama', 'History']",2.0
39444,"Weather Man, The (2005)",Comedy|Drama,384680,6963.0,"A Chicago weather man, separated from his wife and children, debates whether professional and personal success are mutually exclusive.",6.145,1016,"['Comedy', 'Drama']",3.0
40732,"Descent, The (2005)",Adventure|Drama|Horror|Thriller,435625,9392.0,"After a personal tragedy, Sarah joins her friends on a caving expedition in the Appalachian Mountains. But when a rockfall traps them deep underground, their adventure turns into a nightmare. As they search for a way out, the group discovers they are not alone—lurking in the darkness are savage, cave-dwelling creatures. With rising tension and dwindling trust, the women must fight to survive against both the predators and each other.",6.971,4143,"['Adventure', 'Horror']",3.0
40819,Walk the Line (2005),Drama|Musical|Romance,358273,69.0,"A chronicle of country music legend Johnny Cash's life, from his early days on an Arkansas cotton farm to his rise to fame with Sun Records in Memphis, where he recorded alongside Elvis Presley, Jerry Lee Lewis and Carl Perkins.",7.497,2994,"['Drama', 'Music', 'Romance']",4.0
41285,Match Point (2005),Crime|Drama|Romance,416320,116.0,"Chris, a former tennis pro, takes a job as an instructor and befriends his wealthy young student, Tom. After being introduced to his family, Chris is soon engaged to Tom's sister, Chloe. Despite the professional and financial advantages that this relationship affords him, Chris becomes obsessed with Tom's fiancee, American actress Nola.",7.357,4209,"['Drama', 'Romance', 'Thriller']",5.0
41716,"Matador, The (2005)",Comedy|Drama|Thriller,365485,9515.0,"The life of Danny Wright, a salesman forever on the road, veers into dangerous and surreal territory when he wanders into a Mexican bar and meets a mysterious stranger, Julian, who's very likely a hit man. Their meeting sets off a chain of events that will change their lives forever, as Wright is suddenly thrust into a far-from-mundane existence that he takes to surprisingly well … once he gets acclimated to it.",6.315,490,"['Action', 'Comedy', 'Crime', 'Drama', 'Thriller']",2.0
43936,16 Blocks (2006),Crime|Thriller,450232,2207.0,"An aging cop is assigned the ordinary task of escorting a fast-talking witness from police custody to a courthouse, but they find themselves running the gauntlet as other forces try to prevent them from getting there.",6.446,2003,"['Action', 'Adventure', 'Crime', 'Thriller']",3.0
44191,V for Vendetta (2006),Action|Sci-Fi|Thriller|IMAX,434409,752.0,"In a world in which Great Britain has become a fascist state, a masked vigilante known only as “V” conducts guerrilla warfare against the oppressive British government. When V rescues a young woman from the secret police, he finds in her an ally with whom he can continue his fight to free the people of Britain.",7.9,15023,"['Action', 'Thriller', 'Science Fiction']",3.0
44195,Thank You for Smoking (2006),Comedy|Drama,427944,9388.0,"Nick Naylor is a charismatic spin-doctor for Big Tobacco who'll fight to protect America's right to smoke -- even if it kills him -- while still remaining a role model for his 12-year old son. When he incurs the wrath of a senator bent on snuffing out cigarettes, Nick's powers of ""filtering the truth"" will be put to the test.",7.19,2276,"['Comedy', 'Drama']",1.0
44197,Find Me Guilty (2006),Comedy|Crime|Drama,419749,9950.0,"Based on the true story of Jack DiNorscio, a mobster who defended himself in court for what would be the longest mafia trial in U.S. history.",6.6,512,"['Comedy', 'Crime', 'Drama']",3.0
44199,Inside Man (2006),Crime|Drama|Thriller,454848,388.0,"When an armed, masked gang enter a Manhattan bank, lock the doors and take hostages, the detective assigned to effect their release enters negotiations preoccupied with corruption charges he is facing.",7.399,6065,"['Crime', 'Drama', 'Thriller']",4.0
44555,"Lives of Others, The (Das leben der Anderen) (2006)",Drama|Romance|Thriller,405094,582.0,"In 1984 East Berlin, dedicated Stasi officer Gerd Wiesler begins spying on a famous playwright and his actress-lover Christa-Maria. Wiesler becomes unexpectedly sympathetic to the couple, and faces conflicting loyalties when his superior takes a liking to Christa-Maria.",8.0,3888,"['Drama', 'Thriller']",4.0
44665,Lucky Number Slevin (2006),Crime|Drama|Mystery,425210,186.0,"Slevin is mistakenly put in the middle of a personal war between the city’s biggest criminal bosses. Under constant watch, Slevin must try not to get killed by an infamous assassin and come up with an idea of how to get out of his current dilemma.",7.48,4248,"['Drama', 'Thriller', 'Crime', 'Mystery']",3.0
45431,Over the Hedge (2006),Adventure|Animation|Children|Comedy,327084,7518.0,"A scheming raccoon fools a mismatched family of forest creatures into helping him repay a debt of food, by invading the new suburban sprawl that popped up while they were hibernating – and learns a lesson about family himself.",6.581,4640,"['Family', 'Comedy', 'Animation']",4.0
45499,X-Men: The Last Stand (2006),Action|Sci-Fi|Thriller,376994,36668.0,"When a cure is found to treat mutations, lines are drawn amongst the X-Men—led by Professor Charles Xavier—and the Brotherhood, a band of powerful mutants organised under Xavier's former ally, Magneto.",6.411,10028,"['Adventure', 'Action', 'Science Fiction', 'Thriller']",3.0
45501,"Break-Up, The (2006)",Comedy|Drama|Romance,452594,9767.0,"Pushed to the breaking-up point after their latest 'why can't you do this one little thing for me?' argument, Brooke calls it quits with her boyfriend Gary. What follows is a hilarious series of remedies, war tactics, overtures and undermining tricks – all encouraged by the former couple's friends and confidantes …and the occasional total stranger! When neither ex is willing to move out of their shared apartment, the only solution is to continue living as hostile roommates until one of them reaches breaking point.",5.9,2747,"['Romance', 'Comedy']",4.0
45720,"Devil Wears Prada, The (2006)",Comedy|Drama,458352,350.0,"Andy moves to New York to work in the fashion industry. Her boss is extremely demanding, cruel and won't let her succeed if she doesn't fit into the high class elegant look of their magazine.",7.392,12524,"['Drama', 'Comedy']",3.0
45726,"You, Me and Dupree (2006)",Comedy,463034,1819.0,"After standing in as best man for his longtime friend Carl Petersen, Randy Dupree loses his job, becomes a barfly and attaches himself to the newlywed couple almost permanently -- as their houseguest. But the longer Dupree camps out on their couch, the closer he gets to Carl's bride, Molly, leaving the frustrated groom wondering when his pal will be moving out.",5.6,1381,"['Comedy', 'Romance']",2.0
45728,Clerks II (2006),Comedy,424345,2295.0,"A calamity at Dante and Randall's shops sends them looking for new horizons - but they ultimately settle at Mooby's, a fictional Disney-McDonald's-style fast-food empire.",6.9,1406,['Comedy'],3.0
45928,Who Killed the Electric Car? (2006),Documentary,489037,13508.0,"In 1996, electric cars began to appear on roads all over California. They were quiet and fast, produced no exhaust, and ran without gasoline... Ten years later, these cars were destroyed.",7.3,193,['Documentary'],3.0
46965,Snakes on a Plane (2006),Action|Comedy|Horror|Thriller,417148,326.0,"FBI agent Neville Flynn boards a flight from Honolulu, Hawaii to Los Angeles, escorting a key witness to testify against a mob boss at an upcoming trial. An on-board assassin releases a crate full of hundreds of deadly venomous snakes in an attempt to eliminate the witness. Flynn and a host of frightened passengers and crew must band together to survive the slithery threat.",5.479,1873,"['Action', 'Thriller', 'Adventure', 'Crime', 'Horror']",3.0
46970,Talladega Nights: The Ballad of Ricky Bobby (2006),Action|Comedy,415306,9718.0,"The fastest man on four wheels, Ricky Bobby is one of the greatest drivers in NASCAR history. A big, hairy American winning machine, Ricky has everything a dimwitted daredevil could want, a luxurious mansion, a smokin' hot wife and all the fast food he can eat. But Ricky's turbo-charged lifestyle hits an unexpected speed bump when he's bested by flamboyant Euro-idiot Jean Girard and reduced to a fear-ridden wreck.",6.366,1774,['Comedy'],2.0
46974,World Trade Center (2006),Drama,469641,1852.0,"Two police officers struggle to survive when they become trapped beneath the rubble of the World Trade Center on September 11, 2001.",6.1,1726,"['Drama', 'History', 'Thriller']",3.0
46976,Stranger than Fiction (2006),Comedy|Drama|Fantasy|Romance,420223,1262.0,Harold Crick is a lonely IRS agent whose mundane existence is transformed when he hears a mysterious voice narrating his life.,7.282,2394,"['Comedy', 'Drama', 'Fantasy', 'Romance']",3.0
47044,Miami Vice (2006),Action|Crime|Drama|Thriller,430357,82.0,"A case involving drug lords and murder in South Florida takes a personal turn for undercover detectives Sonny Crockett and Ricardo Tubbs. Unorthodox Crockett gets involved romantically with the Chinese-Cuban wife of a trafficker of arms and drugs, while Tubbs deals with an assault on those he loves.",6.017,1862,"['Action', 'Crime', 'Thriller']",5.0
47610,"Illusionist, The (2006)",Drama|Fantasy|Mystery|Romance,443543,1491.0,"With his eye on a lovely aristocrat, a gifted illusionist named Eisenheim uses his powers to win her away from her betrothed, a crown prince. But Eisenheim's scheme creates tumult within the monarchy and ignites the suspicion of a dogged inspector.",7.295,5087,"['Fantasy', 'Drama', 'Thriller', 'Romance']",3.0
48304,Apocalypto (2006),Adventure|Drama|Thriller,472043,1579.0,"Set in the Mayan civilization, when a man's idyllic presence is brutally disrupted by a violent invading force, he is taken on a perilous journey to a world ruled by fear and oppression where a harrowing end awaits him. Through a twist of fate and spurred by the power of his love for his woman and his family he will make a desperate break to return home and to ultimately save his way of life.",7.594,5890,"['Action', 'Drama', 'History']",5.0
48385,Borat: Cultural Learnings of America for Make Benefit Glorious Nation of Kazakhstan (2006),Comedy,443453,496.0,"Kazakh journalist Borat Sagdiyev travels to America to make a documentary. As he zigzags across the nation, Borat meets real people in real situations with hysterical consequences. His backwards behavior generates strong reactions around him exposing prejudices and hypocrisies in American culture.",6.783,5662,['Comedy'],4.0
48516,"Departed, The (2006)",Crime|Drama|Thriller,407887,1422.0,"To take down South Boston's Irish Mafia, the police send in one of their own to infiltrate the underworld, not realizing the syndicate has done likewise. While an undercover cop curries favor with the mob kingpin, a career criminal rises through the police ranks. But both sides soon discover there's a mole among them.",8.159,15564,"['Drama', 'Thriller', 'Crime']",5.0
48774,Children of Men (2006),Action|Adventure|Drama|Sci-Fi|Thriller,206634,9693.0,"In 2027, in a chaotic world in which humans can no longer procreate, a former activist agrees to help transport a miraculously pregnant woman to a sanctuary at sea, where her child's birth may help scientists save the future of humankind.",7.611,7459,"['Drama', 'Action', 'Thriller', 'Science Fiction']",3.0
48780,"Prestige, The (2006)",Drama|Mystery|Sci-Fi|Thriller,482571,1124.0,"A mysterious story of two magicians whose intense rivalry leads them on a life-long battle for supremacy -- full of obsession, deceit and jealousy with dangerous and deadly consequences.",8.203,16826,"['Drama', 'Mystery', 'Science Fiction']",3.0
49272,Casino Royale (2006),Action|Adventure|Thriller,381061,36557.0,"Le Chiffre, a banker to the world's terrorists, is scheduled to participate in a high-stakes poker game in Montenegro, where he intends to use his winnings to establish his financial grip on the terrorist market. M sends Bond—on his maiden mission as a 00 Agent—to attend this game and prevent Le Chiffre from winning. With the help of Vesper Lynd and Felix Leiter, Bond enters the most important poker game in his already dangerous career.",7.565,11170,"['Adventure', 'Action', 'Thriller']",4.0
49278,Déjà Vu (Deja Vu) (2006),Action|Sci-Fi|Thriller,453467,7551.0,"Called in to recover evidence in the aftermath of a horrific explosion on a New Orleans ferry, Federal agent Doug Carlin gets pulled away from the scene and taken to a top-secret government lab that uses a time-shifting surveillance device to help prevent crime.",6.87,5047,"['Action', 'Thriller', 'Science Fiction']",3.0
49530,Blood Diamond (2006),Action|Adventure|Crime|Drama|Thriller|War,450259,1372.0,"An ex-mercenary turned smuggler. A Mende fisherman. Amid the explosive civil war overtaking 1999 Sierra Leone, these men join for two desperate missions: recovering a rare pink diamond of immense value and rescuing the fisherman's son, conscripted as a child soldier into the brutal rebel forces ripping a swath of torture and bloodshed countrywide.",7.551,7970,"['Drama', 'Thriller', 'Action']",3.0
50442,Alpha Dog (2007),Crime|Drama,426883,7457.0,"Johnny Truelove likes to see himself as tough. He's the son of an underworld figure and a drug dealer. Johnny also likes to get tough when things don't go his way. When Jake Mazursky fails to pay up for Johnny, things get worse for the Mazursky family, as Johnny and his 'gang' kidnap Jake's 15 year old brother and holds him hostage. Problem now is what to do with 'stolen boy?'",6.652,1432,"['Crime', 'Drama', 'Thriller']",5.0
50794,Smokin' Aces (2006),Action|Crime|Drama|Thriller,475394,7516.0,"When a Las Vegas performer-turned-snitch named Buddy Israel decides to turn state's evidence and testify against the mob, it seems that a whole lot of people would like to make sure he's no longer breathing.",6.5,1734,"['Action', 'Comedy', 'Crime', 'Drama']",3.0
50872,Ratatouille (2007),Animation|Children|Drama,382932,2062.0,"Remy, a resident of Paris, appreciates good food and has quite a sophisticated palate. He would love to become a chef so he can create and enjoy culinary masterpieces to his heart's delight. The only problem is, Remy is a rat. When he winds up in the sewer beneath one of Paris' finest restaurants, the rodent gourmet finds himself ideally placed to realize his dream.",7.832,17816,"['Animation', 'Comedy', 'Family', 'Fantasy']",3.0
51091,Black Snake Moan (2006),Drama,462200,7874.0,"A God-fearing bluesman takes to a wild young woman who, as a victim of childhood sexual abuse, is looking everywhere for love, but never quite finding it.",6.849,909,['Drama'],3.0
51255,Hot Fuzz (2007),Action|Comedy|Crime|Mystery,425112,4638.0,"Former London constable Nicholas Angel finds it difficult to adapt to his new assignment in the sleepy British village of Sandford. Not only does he miss the excitement of the big city, but he also has a well-meaning oaf for a partner. However, when a series of grisly accidents rocks Sandford, Angel smells something rotten in the idyllic village.",7.562,7936,"['Crime', 'Action', 'Comedy']",3.0
51540,Zodiac (2007),Crime|Drama|Thriller,443706,1949.0,"The Zodiac murders cause the lives of Paul Avery, David Toschi and Robert Graysmith to intersect.",7.528,11056,"['Crime', 'Mystery', 'Thriller']",4.0
51662,300 (2007),Action|Fantasy|War|IMAX,416449,1271.0,"Based on Frank Miller's graphic novel, ""300"" is very loosely based the 480 B.C. Battle of Thermopylae, where the King of Sparta led his army against the advancing Persians; the battle is said to have inspired all of Greece to band together against the Persians, and helped usher in the world's first democracy.",7.191,14223,"['Action', 'Adventure', 'War']",4.0
