movieId,title,genres,imdbId,tmdbId,overview,tmdb_vote_average,tmdb_vote_count,tmdb_genres,rating
4,Waiting to Exhale (1995),Comedy|Drama|Romance,114885,31357.0,"Cheated on, mistreated and stepped on, the women are holding their breath, waiting for the elusive ""good man"" to break a string of less-than-stellar lovers. Friends and confidants Vannah, Bernie, Glo and Robin talk it all out, determined to find a better way to breathe.",6.3,175,"['Comedy', 'Drama', 'Romance']",3.0
7,Sabrina (1995),Comedy|Romance,114319,11860.0,"Sabrina Fairchild, a chauffeur's daughter, grew up at the Long Island estate of the wealthy Larrabee family enchanted with their sparkling world of privilege and wealth, but she's especially enamored of younger son David, a charming playboy. After the once plain Sabrina returns from a sojourn in Paris transformed into a glamorous young woman, she at long last catches David's eye. In a calculated effort to manipulate David away from her and into a more financially advantageous marriage, formidable older brother Linus devises a plan to keep them apart.",6.213,651,"['Romance', 'Drama', 'Comedy']",3.0
11,"American President, The (1995)",Comedy|Drama|Romance,112346,9087.0,"Widowed U.S. president Andrew Shepherd, one of the world's most powerful men, can have anything he wants -- and what he covets most is Sydney Ellen Wade, a Washington lobbyist. But Shepherd's attempts at courting her spark wild rumors and decimate his approval ratings.",6.534,745,"['Comedy', 'Drama', 'Romance']",3.0
12,Dracula: Dead and Loving It (1995),Comedy|Horror,112896,12110.0,"When a lawyer shows up at the vampire's doorstep, he falls prey to his charms and joins him in his search for fresh blood. Enter Professor Van Helsing, who may be the only one able to vanquish the Count.",6.087,1030,"['Comedy', 'Horror']",3.0
14,Nixon (1995),Drama,113987,10858.0,A look at President Richard M. Nixon—a man carrying the fate of the world on his shoulders while battling the self-destructive demands from within—spanning his troubled boyhood in California to the shocking Watergate scandal that would end his Presidency.,6.9,381,"['Drama', 'History']",3.0
16,Casino (1995),Crime|Drama,112641,524.0,"In early-1970s Las Vegas, Sam ""Ace"" Rothstein gets tapped by his bosses to head the Tangiers Casino. At first, he's a great success in the job, but over the years, problems with his loose-cannon enforcer Nicky Santoro, his ex-hustler wife Ginger, her con-artist ex Lester Diamond and a handful of corrupt politicians put Sam in ever-increasing danger.",7.994,6189,"['Crime', 'Drama']",5.0
17,Sense and Sensibility (1995),Drama|Romance,114388,4584.0,"The Dashwood sisters, sensible Elinor and passionate Marianne, whose chances at marriage seem doomed by their family's sudden loss of fortune.  When Henry Dashwood dies unexpectedly, his estate must pass on by law to his son from his first marriage, John and wife Fanny. But these circumstances leave Mr. Dashwood's current wife, and daughters Elinor, Marianne and Margaret, without a home and with barely enough money to live on. As Elinor and Marianne struggle to find romantic fulfillment in a society obsessed with financial and social status, they must learn to mix sense with sensibility in their dealings with both money and men.",7.418,1758,"['Drama', 'Romance']",5.0
21,Get Shorty (1995),Comedy|Crime|Thriller,113161,8012.0,"Chili Palmer is a Miami mobster who gets sent to L.A. to collect a bad debt from Harry Zimm, a Hollywood producer who specializes in cheesy horror films. When Chili meets Harry's leading lady, the romantic sparks fly. After pitching his own life story as a movie idea, Chili learns that being a mobster and being a Hollywood producer really aren't all that different.",6.511,1124,"['Comedy', 'Thriller', 'Crime']",2.0
22,Copycat (1995),Crime|Drama|Horror|Mystery|Thriller,112722,1710.0,An agoraphobic psychologist and a female detective must work together to take down a serial killer who copies serial killers from the past.,6.469,1151,"['Thriller', 'Crime', 'Mystery', 'Horror', 'Drama']",2.0
24,Powder (1995),Drama|Sci-Fi,114168,12665.0,"Harassed by classmates who won't accept his shocking appearance, a shy young man known as ""Powder"" struggles to fit in. But the cruel taunts stop when Powder displays a mysterious power that allows him to do incredible things. This phenomenon changes the lives of all those around him in ways they never could have imagined.",7.0,689,"['Drama', 'Fantasy']",1.0
25,Leaving Las Vegas (1995),Drama|Romance,113627,451.0,"Ben Sanderson, an alcoholic Hollywood screenwriter who lost everything because of his drinking, arrives in Las Vegas to drink himself to death. There, he meets and forms an uneasy friendship and non-interference pact with prostitute Sera.",7.251,1536,"['Drama', 'Romance']",5.0
30,Shanghai Triad (Yao a yao yao dao waipo qiao) (1995),Crime|Drama,115012,37557.0,"Shanghai, China, 1930. When young Shuisheng arrives from the countryside, his uncle Liushu puts him at the service of Bijou, the mistress of Laoda, supreme boss of the Tang Triad, constantly threatened by his enemies, both those he knows and those lurking in the shadows.",6.753,99,"['Drama', 'Crime']",4.0
31,Dangerous Minds (1995),Drama,112792,9909.0,"Former Marine Louanne Johnson lands a gig teaching in a pilot program for bright but underachieving teens at a notorious inner-city high school. After having a terrible first day, she decides she must throw decorum to the wind. When Johnson returns to the classroom, she does so armed with a no-nonsense attitude informed by her military training and a fearless determination to better the lives of her students -- no matter what the cost.",6.977,1203,['Drama'],3.0
39,Clueless (1995),Comedy|Romance,112697,9603.0,"Shallow, rich and socially successful Cher is at the top of her Beverly Hills high school's pecking scale. Seeing herself as a matchmaker, Cher first coaxes two teachers into dating each other. Emboldened by her success, she decides to give hopelessly klutzy new student Tai a makeover. When Tai becomes more popular than she is, Cher realizes that her disapproving ex-stepbrother was right about how misguided she was -- and falls for him.",7.267,4619,"['Comedy', 'Romance']",4.0
43,Restoration (1995),Drama,114272,35196.0,"An aspiring young physician, Robert Merivel found himself in the service of King Charles II and saves the life of someone close to the King. Merivel joins the King's court and lives the high life provided to someone of his position. Merivel is ordered to marry his King's mistress in order to divert the queens suspicions. He is given one order by the king and that is not to fall in love. The situation worsens when Merivel finds himself in love with his new wife. Eventually, the King finds out and relieves Merivel of his position and wealth. His fall from grace leaves Merivel where he first started. And through his travels and reunions with an old friend, he rediscovers his love for true medicine and what it really means to be a physician.",6.1,124,"['Drama', 'Romance']",2.0
45,To Die For (1995),Comedy|Drama|Thriller,114681,577.0,"Suzanne Stone wants to be a world-famous news anchor and she is willing to do anything to get what she wants. What she lacks in intelligence, she makes up for in cold determination and diabolical wiles. As she pursues her goal with relentless focus, she is forced to destroy anything and anyone that may stand in her way, regardless of the ultimate cost or means necessary.",6.581,830,"['Drama', 'Comedy', 'Crime']",5.0
46,How to Make an American Quilt (1995),Drama|Romance,113347,11861.0,"Soon-to-be-wed graduate student Finn Dodd develops cold feet when she suspects her fiancé is cheating on her. In order to clear her head, Finn visits her grandmother, Hy, and great aunt, Glady Joe Cleary, in Grasse, Calif. There, Finn learns that Hy and Glady Joe are members of a group of passionate quilters, and over the course of her visit she is regaled with tales of love and life by women who have collected rich experiences and much wisdom.",6.4,188,"['Drama', 'Romance']",3.0
48,Pocahontas (1995),Animation|Children|Drama|Musical|Romance,114148,10530.0,"Pocahontas, daughter of a Native American tribe chief, falls in love with an English soldier as colonists invade 17th century Virginia.",6.914,5884,"['Adventure', 'Animation', 'Family', 'Romance']",5.0
55,Georgia (1995),Drama,113158,97406.0,"Sadie looks up to her older sister Georgia, a successful folk singer. Unfortunately it is this very obsession — coupled with her self-destructive tendencies and rampant drug abuse — that keeps her spiraling down the drain.",5.8,44,['Drama'],3.0
58,"Postman, The (Postino, Il) (1994)",Comedy|Drama|Romance,110877,11010.0,Simple Italian postman learns to love poetry while delivering mail to a famous poet; he uses this to woo local beauty Beatrice.,7.93,1174,"['Comedy', 'Drama', 'Romance']",4.0
62,Mr. Holland's Opus (1995),Drama,113862,2054.0,"In 1965, passionate musician Glenn Holland takes a day job as a high school music teacher, convinced it's just a small obstacle on the road to his true calling: writing a historic opus. As the decades roll by with the composition unwritten but generations of students inspired through his teaching, Holland must redefine his life's purpose.",7.0,430,"['Drama', 'Music']",5.0
68,French Twist (Gazon maudit) (1995),Comedy|Romance,113149,4482.0,"After learning of her husband's infidelities, a housewife invites an itinerant lesbian to move in with them. None of their lives will ever be the same again.",6.1,313,"['Comedy', 'Romance']",4.0
73,"Misérables, Les (1995)",Drama|War,113828,48750.0,"In France during World War II, a poor and illiterate man, Henri Fortin, is introduced to Victor Hugo's classic novel Les Misérables and begins to see parallels between the book and his own life.",6.7,81,"['Drama', 'History']",5.0
77,Nico Icon (1995),Documentary,113973,124626.0,"A look into the many lives of Christa Päffgen, otherwise known as Nico; from cutie German mädchen to the first of the supermodels, to glamorous diva of the Velvet Underground, to cult item, junkie and hag. Many faces for the same woman, whom, you realize, just couldn't bring herself to care enough to live.",7.5,10,['Documentary'],5.0
82,Antonia's Line (Antonia) (1995),Comedy|Drama,112379,880.0,"After World War II, Antonia and her daughter, Danielle, go back to their Dutch hometown, where Antonia's late mother has bestowed a small farm upon her. There, Antonia settles down and joins a tightly-knit but unusual community. Those around her include quirky friend Crooked Finger, would-be suitor Bas and, eventually for Antonia, a granddaughter and great-granddaughter who help create a strong family of empowered women.",7.0,131,"['Drama', 'Comedy']",1.0
83,Once Upon a Time... When We Were Colored (1995),Drama|Romance,114039,146599.0,A narrator tells the story of his childhood years in a tightly knit Afro-American community in the deep south under racial segregation.,4.2,4,"['Romance', 'Drama']",5.0
84,Last Summer in the Hamptons (1995),Comedy|Drama,113612,188588.0,"Helena Mora, the head of an eccentric theatrical family, has decided to sell her large estate in the Hamptons because of her recent money troubles. Before she completes the sale, she wants to have one last gathering of family and friends, with dramatic performances. Bringing everyone together, though, creates rivalries and tension, especially for Oona, a temperamental but successful movie actress who seeks the approval of her creative peers.",5.5,4,"['Comedy', 'Drama']",4.0
85,Angels and Insects (1995),Drama|Romance,112365,8447.0,"In Victorian England, wealthy patriarch Sir Harald Alabaster invites an impoverished biologist, William Adamson, into his home. There, William tries to continue his work, but is distracted by Alabaster's seductive daughter, Eugenia. William and Eugenia begin a torrid romance, but as the couple become closer, the young scientist begins to realize that dark, disturbing things are happening behind the closed doors of the Alabaster manor.",6.176,54,"['Drama', 'Romance']",4.0
92,Mary Reilly (1996),Drama|Horror|Thriller,117002,9095.0,"A housemaid falls in love with Dr. Jekyll and his darkly mysterious counterpart, Mr. Hyde.",5.8,329,"['Drama', 'Horror', 'Thriller']",1.0
97,"Hate (Haine, La) (1995)",Crime|Drama,113247,406.0,"After a chaotic night of rioting in a marginal suburb of Paris, three young friends, Vinz, Hubert and Saïd, wander around unoccupied waiting for news about the state of health of a mutual friend who has been seriously injured when confronting the police.",8.086,4298,['Drama'],1.0
102,Mr. Wrong (1996),Comedy,117102,47475.0,"A single and lonely woman finds the seemingly perfect man to date, but soon regrets it when his deranged and possessive other personality emerges and worst still, she cannot convince anyone else of his Jekyll/Hyde true nature.",3.9,60,"['Comedy', 'Romance']",3.0
105,"Bridges of Madison County, The (1995)",Drama|Romance,112579,688.0,Photographer Robert Kincaid wanders into the life of housewife Francesca Johnson for four days in the 1960s.,7.717,2260,"['Drama', 'Romance']",3.0
110,Braveheart (1995),Action|Drama|War,112573,197.0,"Enraged at the slaughter of Murron, his new bride and childhood love, Scottish warrior William Wallace slays a platoon of the local English lord's soldiers. This leads the village to revolt and, eventually, the entire country to rise up against English rule.",7.943,10616,"['Action', 'Drama', 'History', 'War']",4.0
111,Taxi Driver (1976),Crime|Drama|Thriller,75314,103.0,"Suffering from insomnia, disturbed loner Travis Bickle takes a job as a New York City cabbie, haunting the streets nightly, growing increasingly detached from reality as he dreams of cleaning up the filthy city.",8.135,12893,"['Crime', 'Drama']",5.0
114,Margaret's Museum (1995),Drama,113774,71754.0,"In a town where half the men die down the coalpit, Margaret MacNeil is quite happy being single in her small Cape Breton island town. Until she meets Neil Currie, a charming and sincere bagpipe-playing, Gaelic-speaking dishwasher. But no matter what you do, you can't avoid the spectre of the pit forever.",6.6,11,['Drama'],2.0
140,Up Close and Personal (1996),Drama|Romance,118055,9302.0,"Tally Atwater has a dream: to be a prime-time network newscaster. She pursues this dream with nothing but ambition, raw talent and a homemade demo tape. Warren Justice is a brilliant, hard edged, veteran newsman. He sees Tally has talent and becomes her mentor. Tally’s career takes a meteoric rise and she and Warren fall in love. The romance that results is as intense and revealing as television news itself. Yet, each breaking story, every videotaped crisis that brings them together, also threatens to drive them apart...",6.289,228,"['Drama', 'Romance']",2.0
141,"Birdcage, The (1996)",Comedy,115685,11000.0,A gay cabaret owner and his drag queen partner agree to put up a false heterosexual front so that their son can introduce them to his fiancée's conservative parents.,7.049,1241,['Comedy'],4.0
147,"Basketball Diaries, The (1995)",Drama,112461,10474.0,A high school basketball player’s life turns upside down after free-falling into the harrowing world of drug addiction.,7.406,2099,"['Drama', 'Crime']",3.0
150,Apollo 13 (1995),Adventure|Drama|IMAX,112384,568.0,"The true story of technical troubles that scuttle the Apollo 13 lunar mission in 1970, risking the lives of astronaut Jim Lovell and his crew, with the failed journey turning into a thrilling saga of heroism. Drifting more than 200,000 miles from Earth, the astronauts work furiously with the ground crew to avert tragedy.",7.452,5616,"['Drama', 'History']",5.0
154,Beauty of the Day (Belle de jour) (1967),Drama,61395,649.0,"Beautiful young housewife Séverine Serizy cannot reconcile her masochistic fantasies with her everyday life alongside dutiful husband Pierre. When her lovestruck friend Henri mentions a secretive high-class brothel run by Madame Anais, Séverine begins to work there during the day under the name Belle de Jour. But when one of her clients grows possessive, she must try to go back to her normal life.",7.321,963,"['Drama', 'Romance']",5.0
159,Clockers (1995),Crime|Drama|Mystery,112688,20649.0,"Strike is a young city drug pusher under the tutelage of drug lord Rodney Little. When a night manager at a fast-food restaurant is found with four bullets in his body, Strike’s older brother turns himself in as the killer. Detective Rocco Klein doesn’t buy the story, however, setting out to find the truth, and it seems that all the fingers point toward Strike & Rodney.",6.7,333,"['Crime', 'Drama', 'Mystery']",4.0
162,Crumb (1994),Documentary,109508,26564.0,"This movie chronicles the life and times of R. Crumb. Robert Crumb is the cartoonist/artist who drew Keep On Truckin', Fritz the Cat, and played a major pioneering role in the genesis of underground comix. Through interviews with his mother, two brothers, wife, ex-wife and ex-girlfriends, as well as selections from his vast quantity of graphic art, we are treated to a darkly comic ride through one man's subconscious mind.",7.5,265,['Documentary'],5.0
190,Safe (1995),Thriller,114323,32646.0,"Carol White, a Los Angeles housewife in the late 1980s, comes down with a debilitating illness with no clear diagnosis.",7.0,321,['Drama'],4.0
197,"Stars Fell on Henrietta, The (1995)",Drama,114534,139408.0,"The setting is early America during the oil boom. An elderly, down on his luck 'oil man', Mr. Cox finds himself in the town of Henrietta. Using unconventional methods, he convinces himself and local Don Day that there is oil on Day's land. The financially strapped Day puts everything into finding oil...but at what cost?",6.1,17,['Drama'],2.0
199,"Umbrellas of Cherbourg, The (Parapluies de Cherbourg, Les) (1964)",Drama|Musical|Romance,58450,5967.0,"This simple romantic tragedy begins in 1957. Guy Foucher, a 20-year-old French auto mechanic, has fallen in love with 17-year-old Geneviève Emery, an employee in her widowed mother's chic but financially embattled umbrella shop. On the evening before Guy is to leave for a two-year tour of combat in Algeria, he and Geneviève make love. She becomes pregnant and must choose between waiting for Guy's return or accepting an offer of marriage from a wealthy diamond merchant.",7.4,838,"['Drama', 'Romance']",5.0
205,Unstrung Heroes (1995),Comedy|Drama,114798,52856.0,"Steven Lidz, unhappy with his home life since his mother became sick, moves in with his two eccentric uncles. As Steven grows closer to his uncles, he learns how to cope with his emotions and to value his own uniqueness.",5.9,29,"['Comedy', 'Drama', 'Family']",5.0
216,Billy Madison (1995),Comedy,112508,11017.0,"Billy Madison is the 27 year-old son of Bryan Madison, a very rich man who has made his living in the hotel industry. Billy stands to inherit his father's empire, but only if he can make it through all 12 grades, 2 weeks per grade, to prove that he has what it takes to run the family business.",6.183,1711,['Comedy'],2.0
218,Boys on the Side (1995),Comedy|Drama,112571,9382.0,"After breaking up with her girlfriend, a nightclub singer, Jane, answers a personal ad from Robin, a real estate agent with AIDS, seeking a cross-country travel partner. On their journey from New York City to Los Angeles, the two stop by Pittsburgh to pick up Jane's friend Holly, who is trying to escape an abusive relationship. With three distinct personalities, the women must overcome their differences to help one another.",6.4,240,"['Comedy', 'Drama']",4.0
224,Don Juan DeMarco (1995),Comedy|Drama|Romance,112883,1909.0,"John Arnold DeMarco is a man who believes he is Don Juan, the greatest lover in the world. Clad in a cape and mask, DeMarco undergoes psychiatric treatment with Dr. Jack Mickler to cure him of his apparent delusion. But the psychiatric sessions have an unexpected effect on the psychiatric staff and, most profoundly, Dr Mickler, who rekindles the romance in his complacent marriage.",6.738,770,"['Romance', 'Drama', 'Comedy']",4.0
225,Disclosure (1994),Drama|Thriller,109635,8984.0,"A computer specialist is sued for sexual harassment by a former lover turned boss who initiated the act forcefully, which threatens both his career and his personal life.",6.26,1217,"['Thriller', 'Drama', 'Crime']",4.0
229,Death and the Maiden (1994),Drama|Thriller,109579,10531.0,A political activist is convinced that her guest is a man who once tortured her for the government.,7.1,525,"['Drama', 'Thriller']",3.0
230,Dolores Claiborne (1995),Drama|Thriller,109642,11929.0,"Dolores Claiborne was accused of killing her abusive husband twenty years ago, but the court's findings were inconclusive and she was allowed to walk free. Now she has been accused of killing her employer, Vera Donovan, and this time there is a witness who can place her at the scene of the crime. Things look bad for Dolores when her daughter Selena, a successful Manhattan magazine writer, returns to cover the story.",7.3,816,"['Crime', 'Drama', 'Mystery']",4.0
231,Dumb & Dumber (Dumb and Dumber) (1994),Adventure|Comedy,109686,8467.0,"Lloyd and Harry are two men whose stupidity is really indescribable. When Mary, a beautiful woman, loses an important suitcase with money before she leaves for Aspen, the two friends (who have found the suitcase) decide to return it to her. After some ""adventures"" they finally get to Aspen where, using the lost money they live it up and fight for Mary's heart.",6.636,6387,['Comedy'],5.0
234,Exit to Eden (1994),Comedy,109758,18395.0,"Photographer Elliot Slater has inadvertently snapped the only existing photos of elusive jewel thief Omar. When Elliot leaves for a private vacation on an S&M island, he is followed by Omar, Omar's partner, Nina, and undercover police officers Fred and Sheila. Unaware of the number of people chasing him, Elliot enjoys his stay at the resort, and finds himself falling in love with head dominatrix Lisa.",4.1,93,"['Comedy', 'Crime', 'Thriller']",2.0
235,Ed Wood (1994),Comedy|Drama,109707,522.0,"The mostly true story of the legendary ""worst director of all time"", who, with the help of his strange friends, filmed countless B-movies without ever becoming famous or successful.",7.49,2412,"['Comedy', 'Drama', 'History']",5.0
236,French Kiss (1995),Action|Comedy|Romance,113117,397.0,"After her fiancee admits to infidelity while on a business trip in France, a woman attempts to get her lover back and marry him by traveling to Paris despite her crippling fear of flying.  On the way she unwittingly smuggles something of value that has a charming crook chasing her across France as she chases after her future husband.",6.47,758,"['Comedy', 'Romance']",3.0
237,Forget Paris (1995),Comedy|Romance,113097,10525.0,"Mickey Gordon is a basketball referee who travels to France to bury his father. Ellen Andrews is an American living in Paris who works for the airline he flies on. They meet and fall in love, but their relationship goes through many difficult patches.",6.3,159,"['Comedy', 'Drama', 'Romance']",4.0
242,Farinelli: il castrato (1994),Drama|Musical,109771,10954.0,"The life and career of Italian opera singer Farinelli, considered one of the greatest castrato singers of all time.",6.6,176,"['History', 'Drama', 'Music']",2.0
247,Heavenly Creatures (1994),Crime|Drama,110005,1024.0,"Precocious teenager Juliet moves to New Zealand with her family and soon befriends the quiet, brooding Pauline through their shared love of fantasy and literature. This friendship gradually develops into an intense and obsessive bond.",6.975,965,"['Drama', 'Fantasy']",5.0
248,Houseguest (1994),Comedy,110066,17207.0,"In hot water with the mob over an unpaid debt, a con man poses as a family friend in an affluent Pennsylvania suburb.",5.5,75,['Comedy'],4.0
249,Immortal Beloved (1994),Drama|Romance,110116,13701.0,"A chronicle of the life of infamous classical composer Ludwig van Beethoven and his painful struggle with hearing loss. Following Beethoven's death in 1827, his assistant, Schindler, searches for an elusive woman referred to in the composer's love letters as ""immortal beloved."" As Schindler solves the mystery, a series of flashbacks reveal Beethoven's transformation from passionate young man to troubled musical genius.",7.092,351,"['Drama', 'Music', 'Romance']",4.0
252,I.Q. (1994),Comedy|Romance,110099,11777.0,Albert Einstein helps a young man who's in love with Einstein's niece to catch her attention by pretending temporarily to be a great physicist.,6.022,467,"['Comedy', 'Drama', 'Romance']",2.0
253,Interview with the Vampire: The Vampire Chronicles (1994),Drama|Horror,110148,628.0,"A vampire relates his epic life story of love, betrayal, loneliness, and dark hunger to an over-curious reporter.",7.383,6118,"['Horror', 'Drama', 'Fantasy']",2.0
254,Jefferson in Paris (1995),Drama,113463,87729.0,"His wife having recently died, Thomas Jefferson accepts the post of United States ambassador to pre-revolutionary France, though he finds it difficult to adjust to life in a country where the aristocracy subjugates an increasingly restless peasantry. In Paris, he becomes smitten with cultured artist Maria Cosway, but, when his daughter visits from Virginia accompanied by her attractive slave, Sally Hemings, Jefferson's attentions are diverted.",5.1,43,"['Drama', 'Romance', 'History']",4.0
260,Star Wars: Episode IV - A New Hope (1977),Action|Adventure|Sci-Fi,76759,11.0,Princess Leia is captured and held hostage by the evil Imperial forces in their effort to take over the galactic Empire. Venturesome Luke Skywalker and dashing captain Han Solo team together with the loveable robot duo R2-D2 and C-3PO to rescue the beautiful princess and restore peace and justice in the Empire.,8.205,21519,"['Adventure', 'Action', 'Science Fiction']",3.0
