movieId,title,genres,imdbId,tmdbId,overview,tmdb_vote_average,tmdb_vote_count,tmdb_genres,rating
1,Toy Story (1995),Adventure|Animation|Children|Comedy|Fantasy,114709,862.0,"Led by Woody, Andy's toys live happily in his room until Andy's birthday brings Buzz Lightyear onto the scene. Afraid of losing his place in Andy's heart, Woody plots against Buzz. But when circumstances separate Buzz and Woody from their owner, the duo eventually learns to put aside their differences.",7.969,19165,"['Animation', 'Adventure', 'Family', 'Comedy']",3.0
2,Jumanji (1995),Adventure|Children|Fantasy,113497,8844.0,"When siblings Judy and Peter discover an enchanted board game that opens the door to a magical world, they unwittingly invite Alan -- an adult who's been trapped inside the game for 26 years -- into their living room. Alan's only hope for freedom is to finish the game, which proves risky as all three find themselves running from giant rhinoceroses, evil monkeys and other terrifying creatures.",7.24,10907,"['Adventure', 'Fantasy', 'Family']",3.0
4,Waiting to Exhale (1995),Comedy|Drama|Romance,114885,31357.0,"Cheated on, mistreated and stepped on, the women are holding their breath, waiting for the elusive ""good man"" to break a string of less-than-stellar lovers. Friends and confidants Vannah, Bernie, Glo and Robin talk it all out, determined to find a better way to breathe.",6.3,175,"['Comedy', 'Drama', 'Romance']",3.0
11,"American President, The (1995)",Comedy|Drama|Romance,112346,9087.0,"Widowed U.S. president Andrew Shepherd, one of the world's most powerful men, can have anything he wants -- and what he covets most is Sydney Ellen Wade, a Washington lobbyist. But Shepherd's attempts at courting her spark wild rumors and decimate his approval ratings.",6.534,745,"['Comedy', 'Drama', 'Romance']",3.0
17,Sense and Sensibility (1995),Drama|Romance,114388,4584.0,"The Dashwood sisters, sensible Elinor and passionate Marianne, whose chances at marriage seem doomed by their family's sudden loss of fortune.  When Henry Dashwood dies unexpectedly, his estate must pass on by law to his son from his first marriage, John and wife Fanny. But these circumstances leave Mr. Dashwood's current wife, and daughters Elinor, Marianne and Margaret, without a home and with barely enough money to live on. As Elinor and Marianne struggle to find romantic fulfillment in a society obsessed with financial and social status, they must learn to mix sense with sensibility in their dealings with both money and men.",7.418,1758,"['Drama', 'Romance']",4.0
19,Ace Ventura: When Nature Calls (1995),Comedy,112281,9273.0,"Summoned from an ashram in Tibet, Ace finds himself on a perilous journey into the jungles of Africa to find Shikaka, the missing sacred animal of the friendly Wachati tribe. He must accomplish this before the wedding of the Wachati's Princess to the prince of the warrior Wachootoos. If Ace fails, the result will be a vicious tribal war.",6.321,4340,"['Crime', 'Comedy', 'Adventure']",2.0
28,Persuasion (1995),Drama|Romance,114117,17015.0,"Anne Elliot, the daughter of a financially troubled aristocratic family, is persuaded to break her engagement to Frederick Wentworth, a young sea captain of meager means. Years later, money troubles force Anne's father to rent out the family estate to Admiral Croft, and Anne is again thrown into company with Frederick -- who is now rich, successful, and perhaps still in love with Anne.",7.1,134,"['Drama', 'Romance']",4.0
32,Twelve Monkeys (a.k.a. 12 Monkeys) (1995),Mystery|Sci-Fi|Thriller,114746,63.0,"In the year 2035, convict James Cole reluctantly volunteers to be sent back in time to discover the origin of a deadly virus that wiped out nearly all of the earth's population and forced the survivors into underground communities. But when Cole is mistakenly sent to 1990 instead of 1996, he's arrested and locked up in a mental hospital. There he meets psychiatrist Dr. Kathryn Railly and the son of a famous virus expert who may hold the key to the Army of the 12 Monkeys; thought to be responsible for unleashing the killer disease.",7.601,8713,"['Science Fiction', 'Thriller', 'Mystery']",4.0
34,Babe (1995),Children|Drama,112431,9598.0,"Babe is a little pig who doesn't quite know his place in the world. With a bunch of odd friends, like Ferdinand the duck who thinks he is a rooster and Fly the dog he calls mum, Babe realises that he has the makings to become the greatest sheep pig of all time, and Farmer Hoggett knows it. With the help of the sheep dogs, Babe learns that a pig can be anything that he wants to be.",6.248,3003,"['Fantasy', 'Drama', 'Comedy', 'Family']",3.0
35,Carrington (1995),Drama|Romance,112637,47018.0,"Painter Dora Carrington develops an intimate but extremely complex bond with writer Lytton Strachey. Though Lytton is a homosexual, he is enchanted by the mysterious Dora and they begin a lifelong friendship that has strangely romantic undertones. Eventually, Lytton and Dora decide to live together, despite the fact that the latter has fallen in love with military man Ralph Partridge, whom she plans to marry.",6.2,65,"['History', 'Drama', 'Romance']",3.0
43,Restoration (1995),Drama,114272,35196.0,"An aspiring young physician, Robert Merivel found himself in the service of King Charles II and saves the life of someone close to the King. Merivel joins the King's court and lives the high life provided to someone of his position. Merivel is ordered to marry his King's mistress in order to divert the queens suspicions. He is given one order by the king and that is not to fall in love. The situation worsens when Merivel finds himself in love with his new wife. Eventually, the King finds out and relieves Merivel of his position and wealth. His fall from grace leaves Merivel where he first started. And through his travels and reunions with an old friend, he rediscovers his love for true medicine and what it really means to be a physician.",6.1,124,"['Drama', 'Romance']",3.0
48,Pocahontas (1995),Animation|Children|Drama|Musical|Romance,114148,10530.0,"Pocahontas, daughter of a Native American tribe chief, falls in love with an English soldier as colonists invade 17th century Virginia.",6.9,5881,"['Adventure', 'Animation', 'Family', 'Romance']",4.0
52,Mighty Aphrodite (1995),Comedy|Drama|Romance,113819,11448.0,"When Lenny and his wife, Amanda, adopt a baby, Lenny realizes that his son is a genius and becomes obsessed with finding the boy's biological mother in hopes that she will be brilliant too. But when he learns that Max's mother is Linda Ash, a kindhearted prostitute and porn star, Lenny is determined to reform her immoral lifestyle. A Greek chorus chimes in to relate the plot to Greek mythology in this quirky comedy.",6.723,713,"['Comedy', 'Romance']",3.0
58,"Postman, The (Postino, Il) (1994)",Comedy|Drama|Romance,110877,11010.0,Simple Italian postman learns to love poetry while delivering mail to a famous poet; he uses this to woo local beauty Beatrice.,7.93,1174,"['Comedy', 'Drama', 'Romance']",3.0
60,"Indian in the Cupboard, The (1995)",Adventure|Children|Fantasy,113419,11359.0,A nine-year-old boy gets a plastic Indian and a cupboard for his birthday and finds himself involved in adventure when the Indian comes to life and befriends him.,6.5,650,"['Adventure', 'Family', 'Fantasy']",3.0
64,Two if by Sea (1996),Comedy|Romance,118002,19760.0,"Frank O'Brien, a petty thief, and his 7-year-long girlfriend Roz want to put an end to their unsteady lifestyle and just do that last job, which involves stealing a valuable painting. Frank takes Roz to an island on the coast of New England, where he wants to sell the painting and also hopes that their sagging relationship will get a positive push back up. Not everything goes as planned.",5.0,96,"['Comedy', 'Romance']",3.0
72,Kicking and Screaming (1995),Comedy|Drama,113537,28387.0,"After college graduation, Grover's girlfriend Jane tells him she's moving to Prague to study writing. Grover declines to accompany her, deciding instead to move in with several friends, all of whom can't quite work up the inertia to escape their university's pull. Nobody wants to make any big decisions that would radically alter his life, yet none of them wants to end up like Chet, the professional student who tends bar and is in his tenth year of university studies.",6.2,223,"['Comedy', 'Drama', 'Romance']",3.0
73,"Misérables, Les (1995)",Drama|War,113828,48750.0,"In France during World War II, a poor and illiterate man, Henri Fortin, is introduced to Victor Hugo's classic novel Les Misérables and begins to see parallels between the book and his own life.",6.7,81,"['Drama', 'History']",4.0
102,Mr. Wrong (1996),Comedy,117102,47475.0,"A single and lonely woman finds the seemingly perfect man to date, but soon regrets it when his deranged and possessive other personality emerges and worst still, she cannot convince anyone else of his Jekyll/Hyde true nature.",3.9,60,"['Comedy', 'Romance']",2.0
105,"Bridges of Madison County, The (1995)",Drama|Romance,112579,688.0,Photographer Robert Kincaid wanders into the life of housewife Francesca Johnson for four days in the 1960s.,7.717,2260,"['Drama', 'Romance']",3.0
107,Muppet Treasure Island (1996),Adventure|Children|Comedy|Musical,117110,10874.0,"After telling the story of Flint's last journey to young Jim Hawkins, Billy Bones has a heart attack and dies just as Jim and his friends are attacked by pirates. The gang escapes into the town where they hire out a boat and crew to find the hidden treasure, which was revealed by Bones before he died. On their voyage across the seas, they soon find out that not everyone on board can be trusted.",6.7,429,"['Family', 'Comedy', 'Adventure', 'Music']",3.0
110,Braveheart (1995),Action|Drama|War,112573,197.0,"Enraged at the slaughter of Murron, his new bride and childhood love, Scottish warrior William Wallace slays a platoon of the local English lord's soldiers. This leads the village to revolt and, eventually, the entire country to rise up against English rule.",7.943,10614,"['Action', 'Drama', 'History', 'War']",3.0
129,Pie in the Sky (1996),Comedy|Romance,114131,110972.0,A young man obsessed with traffic patterns attempts to reunite with his first love.,6.6,13,"['Comedy', 'Romance']",3.0
135,Down Periscope (1996),Comedy,116130,9101.0,"Maverick Navy Lieutenant Commander Tom Dodge will never be a textbook officer, but he's a brilliant seaman who's always wanted to command a nuclear submarine — he's been given one last chance to clean up his record. Unfortunately, Admiral Graham, his nemesis, would rather sink the fleet than give Dodge his own boat. So, Graham stacks the deck against him and assigns Dodge to the Stingray, a diesel-powered WW2 submarine that can barely keep afloat. To make matters worse, Dodge's crew is a collection of maladjusted, mistake-prone misfits. Then, he's tagged the ""enemy"" in a crucial war game, and ordered to take on the U.S. Navy's best.",6.372,492,['Comedy'],4.0
141,"Birdcage, The (1996)",Comedy,115685,11000.0,A gay cabaret owner and his drag queen partner agree to put up a false heterosexual front so that their son can introduce them to his fiancée's conservative parents.,7.049,1241,['Comedy'],3.0
144,"Brothers McMullen, The (1995)",Comedy,112585,16388.0,"Deals with the lives of the three Irish Catholic McMullen brothers from Long Island, New York, over three months, as they grapple with basic ideas and values — love, sex, marriage, religion and family — in the 1990s.",6.037,94,"['Comedy', 'Drama', 'Romance']",2.0
150,Apollo 13 (1995),Adventure|Drama|IMAX,112384,568.0,"The true story of technical troubles that scuttle the Apollo 13 lunar mission in 1970, risking the lives of astronaut Jim Lovell and his crew, with the failed journey turning into a thrilling saga of heroism. Drifting more than 200,000 miles from Earth, the astronauts work furiously with the ground crew to avert tragedy.",7.452,5616,"['Drama', 'History']",3.0
151,Rob Roy (1995),Action|Drama|Romance|War,114287,11780.0,"In the highlands of Scotland in the 1700s, Rob Roy tries to lead his small town to a better future, by borrowing money from the local nobility to buy cattle to herd to market. When the money is stolen, Rob is forced into a Robin Hood lifestyle to defend his family and honour.",6.721,675,"['Adventure', 'History', 'Drama', 'Action', 'War']",4.0
153,Batman Forever (1995),Action|Adventure|Comedy|Crime,112462,414.0,"Batman faces off against two foes: the schizophrenic, horribly scarred former District Attorney Harvey Dent, aka Two-Face, and the Riddler, a disgruntled ex-Wayne Enterprises inventor seeking revenge against his former employer by unleashing his brain-sucking weapon on Gotham City's residents. As the caped crusader also copes with tortured memories of his parents' murder, he has a new romance, with psychologist Chase Meridian.",5.4,5368,"['Action', 'Crime', 'Fantasy']",3.0
158,Casper (1995),Adventure|Children,112642,8839.0,"Casper is a kind young ghost who peacefully haunts a mansion in Maine. When specialist James Harvey arrives to communicate with Casper and his fellow spirits, he brings along his teenage daughter, Kat. Casper quickly falls in love with Kat, but their budding relationship is complicated not only by his transparent state, but also by his troublemaking apparition uncles and their mischievous antics.",6.331,4730,"['Fantasy', 'Comedy', 'Family']",4.0
168,First Knight (1995),Action|Drama|Romance,113071,6520.0,"The timeless tale of King Arthur and the legend of Camelot are retold in this passionate period drama. Arthur is reluctant to hand the crown to Lancelot, and Guinevere is torn between her loyalty to her husband and her growing love for his rival. But Lancelot must balance his loyalty to the throne with the rewards of true love.",6.1,1273,"['Action', 'Adventure', 'Drama', 'Romance']",2.0
169,Free Willy 2: The Adventure Home (1995),Adventure|Children|Drama,113114,9073.0,Jesse becomes reunited with Willy three years after the whale's jump to freedom as the teenager tries to rescue the killer whale and other orcas from an oil spill.,5.9,599,"['Family', 'Adventure', 'Drama', 'Comedy']",2.0
186,Nine Months (1995),Comedy|Romance,113986,11472.0,"When he finds out his longtime girlfriend is pregnant, a commitment-phobe realizes he might have to change his lifestyle for better or much, much worse.",5.705,671,"['Romance', 'Comedy']",3.0
195,Something to Talk About (1995),Comedy|Drama|Romance,114496,18402.0,"Grace King Bichon, who is managing her father's riding-stable, discovers that her husband Eddie is deceiving her with another woman. After confronting him in the middle of the night on the streets of their small home town, she decides to stay at her sister Emma Rae's house for a while to make up her mind. Breaking out of her everyday life, she starts to question the authority of everyone.",5.7,245,"['Comedy', 'Drama']",3.0
207,"Walk in the Clouds, A (1995)",Drama|Romance,114887,9560.0,World War II vet Paul Sutton falls for a pregnant and unwed woman who persuades him -- during their first encounter -- to pose as her husband so she can face her family.,7.354,1078,"['Drama', 'Romance']",3.0
224,Don Juan DeMarco (1995),Comedy|Drama|Romance,112883,1909.0,"John Arnold DeMarco is a man who believes he is Don Juan, the greatest lover in the world. Clad in a cape and mask, DeMarco undergoes psychiatric treatment with Dr. Jack Mickler to cure him of his apparent delusion. But the psychiatric sessions have an unexpected effect on the psychiatric staff and, most profoundly, Dr Mickler, who rekindles the romance in his complacent marriage.",6.738,770,"['Romance', 'Drama', 'Comedy']",3.0
225,Disclosure (1994),Drama|Thriller,109635,8984.0,"A computer specialist is sued for sexual harassment by a former lover turned boss who initiated the act forcefully, which threatens both his career and his personal life.",6.26,1217,"['Thriller', 'Drama', 'Crime']",2.0
232,Eat Drink Man Woman (Yin shi nan nu) (1994),Comedy|Drama|Romance,111797,10451.0,"Retired and widowed Chinese master chef Chu lives in modern day Taipei, with his three attractive daughters, all of whom are unattached. Soon, each daughter encounters a new man in their lives. When these new relationships blossom, stereotypes are broken and the living situation within the family changes.",7.6,375,"['Comedy', 'Drama', 'Romance']",2.0
236,French Kiss (1995),Action|Comedy|Romance,113117,397.0,"After her fiancee admits to infidelity while on a business trip in France, a woman attempts to get her lover back and marry him by traveling to Paris despite her crippling fear of flying.  On the way she unwittingly smuggles something of value that has a charming crook chasing her across France as she chases after her future husband.",6.47,758,"['Comedy', 'Romance']",3.0
239,"Goofy Movie, A (1995)",Animation|Children|Comedy|Romance,113198,15789.0,"An endearing modern-day story about how the lovable Goof bonds with his teenage son Max on a hilarious cross-country road trip. En route to the ol' fishing hole, they find themselves up to their floppy ears in misadventure!",7.006,1838,"['Adventure', 'Comedy', 'Romance', 'Animation', 'Family']",2.0
252,I.Q. (1994),Comedy|Romance,110099,11777.0,Albert Einstein helps a young man who's in love with Einstein's niece to catch her attention by pretending temporarily to be a great physicist.,6.022,467,"['Comedy', 'Drama', 'Romance']",3.0
254,Jefferson in Paris (1995),Drama,113463,87729.0,"His wife having recently died, Thomas Jefferson accepts the post of United States ambassador to pre-revolutionary France, though he finds it difficult to adjust to life in a country where the aristocracy subjugates an increasingly restless peasantry. In Paris, he becomes smitten with cultured artist Maria Cosway, but, when his daughter visits from Virginia accompanied by her attractive slave, Sally Hemings, Jefferson's attentions are diverted.",5.1,43,"['Drama', 'Romance', 'History']",2.0
260,Star Wars: Episode IV - A New Hope (1977),Action|Adventure|Sci-Fi,76759,11.0,Princess Leia is captured and held hostage by the evil Imperial forces in their effort to take over the galactic Empire. Venturesome Luke Skywalker and dashing captain Han Solo team together with the loveable robot duo R2-D2 and C-3PO to rescue the beautiful princess and restore peace and justice in the Empire.,8.205,21518,"['Adventure', 'Action', 'Science Fiction']",4.0
265,Like Water for Chocolate (Como agua para chocolate) (1992),Drama|Fantasy|Romance,103994,18183.0,"Tita is passionately in love with Pedro, but her controlling mother forbids her from marrying him. When Pedro marries her sister, Tita throws herself into her cooking and discovers she can transfer her emotions through the food she prepares, infecting all who eat it with her intense heartbreak.",7.3,532,"['Drama', 'Romance']",3.0
275,Mixed Nuts (1994),Comedy,110538,24070.0,The events of a crisis hotline business on one crazy night during the Christmas holidays.,5.4,205,"['Comedy', 'Drama', 'Romance']",4.0
282,Nell (1994),Drama,110638,1945.0,"In a remote woodland cabin, a small town doctor discovers Nell — a beautiful young hermit woman with many secrets.",6.6,525,"['Drama', 'Thriller']",3.0
289,Only You (1994),Comedy|Romance,110737,9058.0,"Two childhood paranormal incidents have convinced schoolteacher Faith Corvatch that her true love is a guy named ""Damon Bradley,"" but she has yet to meet him. Preparing to marry podiatrist Dwayne in 10 days, Faith receives a phone call from Dwayne's old classmate named Damon Bradley who is on his way to Venice. Faith tries to catch him at the airport but just misses him so she impulsively decides to fly to Venice hoping to finally encounter the man of her dreams; accompanying her on the trip is her sister-in-law and childhood best friend, Kate, who has just left her husband, Faith's brother Larry.",6.767,539,"['Romance', 'Comedy']",4.0
297,Panther (1995),Drama,114084,41478.0,Panther is a semi-historic film about the origins of The Black Panther Party for Self-Defense. The movie spans about 3 years (1966-68) of the Black Panther's history in Oakland. Panther also uses historical footage (B/W) to emphasize some points.,6.2,40,"['Drama', 'History']",3.0
300,Quiz Show (1994),Drama,110932,11450.0,"Herbert Stempel's transformation into an unexpected television personality unfolds as he secures victory on the cherished American game show, 'Twenty-One.' However, when the show introduces the highly skilled contestant Charles Van Doren to replace Stempel, it compels Stempel to let out his frustrations and call out the show as rigged. Lawyer Richard Goodwin steps in and attempts to uncover the orchestrated deception behind the scenes.",7.3,940,"['History', 'Drama', 'Mystery']",3.0
316,Stargate (1994),Action|Adventure|Sci-Fi,111282,2164.0,"An interstellar teleportation device, found in Egypt, leads to a planet with humans resembling ancient Egyptians who worship the god Ra.",7.0,3595,"['Action', 'Adventure', 'Science Fiction']",4.0
317,"Santa Clause, The (1994)",Comedy|Drama|Fantasy,111070,11395.0,"On Christmas Eve, divorced dad Scott Calvin and his son discover Santa Claus has fallen off their roof. When Scott takes the reins of the magical sleigh, he finds he is now the new Santa, and must convince a world of disbelievers, including himself.",6.497,2156,"['Fantasy', 'Drama', 'Comedy', 'Family']",4.0
318,"Shawshank Redemption, The (1994)",Crime|Drama,111161,278.0,"Imprisoned in the 1940s for the double murder of his wife and her lover, upstanding banker Andy Dufresne begins a new life at the Shawshank prison, where he puts his accounting skills to work for an amoral warden. During his long stretch in prison, Dufresne comes to be admired by the other inmates -- including an older prisoner named Red -- for his integrity and unquenchable sense of hope.",8.713,28938,"['Drama', 'Crime']",3.0
329,Star Trek: Generations (1994),Adventure|Drama|Sci-Fi,111280,193.0,Captain Jean-Luc Picard and the crew of the Enterprise-D find themselves at odds with the renegade scientist Soran who is destroying entire star systems. Only one man can help Picard stop Soran's scheme...and he's been dead for seventy-eight years.,6.5,1400,"['Science Fiction', 'Action', 'Adventure', 'Thriller']",3.0
337,What's Eating Gilbert Grape (1993),Drama,108550,1587.0,"Gilbert Grape is a small-town young man with a lot of responsibility. Chief among his concerns are his mother, who is so overweight that she can't leave the house, and his mentally impaired younger brother, Arnie, who has a knack for finding trouble. Settled into a job at a grocery store and an ongoing affair with local woman Betty Carver, Gilbert finally has his life shaken up by the free-spirited Becky.",7.666,4106,"['Romance', 'Drama']",3.0
339,While You Were Sleeping (1995),Comedy|Romance,114924,2064.0,"A transit worker pulls commuter Peter off railway tracks after he's mugged, but—while he's in a coma—his family mistakenly thinks she's Peter's fiancée, and she doesn't correct them. Things get more complicated when she falls for his brother, who's not quite sure that she's who she claims to be.",7.021,1898,"['Romance', 'Comedy']",3.0
348,Bullets Over Broadway (1994),Comedy,109348,11382.0,"After young playwright, David Shayne obtains funding for his play from gangster Nick Valenti, Nick's girlfriend Olive miraculously lands the role of a psychiatrist—but not only is she a bimbo who could never pass for a psychiatrist—she's a dreadful actress. David puts up with the leading man who is a compulsive eater, the grand dame who wants her part jazzed up, and Olive's interfering hitman/bodyguard—but, eventually he must decide whether art or life is more important.",7.088,640,"['Comedy', 'Crime']",2.0
354,Cobb (1994),Drama,109450,29973.0,"Al Stump is a famous sports-writer chosen by Ty Cobb to co-write his official, authorized 'autobiography' before his death. Cobb, widely feared and despised, feels misunderstood and wants to set the record straight about 'the greatest ball-player ever,' in his words.",6.0,89,['Drama'],2.0
355,"Flintstones, The (1994)",Children|Comedy|Fantasy,109813,888.0,Modern Stone Age family the Flintstones hit the big screen in this live-action version of the classic cartoon. Fred helps Barney adopt a child. Barney sees an opportunity to repay him when Slate Mining tests its employees to find a new executive. But no good deed goes unpunished.,5.356,2530,"['Fantasy', 'Comedy', 'Family']",3.0
356,Forrest Gump (1994),Comedy|Drama|Romance|War,109830,13.0,"A man with a low IQ has accomplished great things in his life and been present during significant historic events—in each case, far exceeding what anyone imagined he could do. But despite all he has achieved, his one true love eludes him.",8.466,28663,"['Comedy', 'Drama', 'Romance']",3.0
357,Four Weddings and a Funeral (1994),Comedy|Romance,109831,712.0,"Over the course of five social occasions, a committed bachelor must consider the notion that he may have discovered love.",6.773,2840,"['Comedy', 'Drama', 'Romance']",4.0
358,Higher Learning (1995),Drama,113305,16295.0,"African-American student Malik is on a track scholarship; academics are not his strong suit, and he goes in thinking that his athletic abilities will earn him a free ride through college. Fudge, a ""professional student"" who has been at Columbus for six years so far, becomes friendly with Malik and challenges his views about race and politics in America.",6.306,227,"['Drama', 'Crime', 'Thriller']",2.0
