movieId,title,genres,imdbId,tmdbId,overview,tmdb_vote_average,tmdb_vote_count,tmdb_genres,rating
1801,"Man in the Iron Mask, The (1998)",Action|Adventure|Drama,120744,9313.0,"Years have passed since the Three Musketeers, Aramis, Athos and Porthos, have fought together with their friend, D'Artagnan. But with the tyrannical King Louis using his power to wreak havoc in the kingdom while his twin brother, Philippe, remains imprisoned, the Musketeers reunite to abduct Louis and replace him with Philippe.",6.641,3967,"['Adventure', 'Action', 'Drama']",4.0
1812,Wide Awake (1998),Children|Comedy|Drama,120510,32911.0,"The tale of a ten-year-old boy in a Catholic school who, following the death of his beloved grandfather, embarks on a quest to discover the meaning of life.",5.4,85,"['Comedy', 'Drama', 'Family']",3.0
1831,Lost in Space (1998),Action|Adventure|Sci-Fi,120738,2157.0,"The prospects for continuing life on Earth in the year 2058 are grim. So the Robinsons are launched into space to colonize Alpha Prime, the only other inhabitable planet in the galaxy. But when a stowaway sabotages the mission, the Robinsons find themselves hurtling through uncharted space.",5.4,1258,"['Science Fiction', 'Adventure']",4.0
1848,"Borrowers, The (1997)",Adventure|Children|Comedy|Fantasy,118755,9449.0,"The four-inch-tall Clock family secretly share a house with the normal-sized Lender family, ""borrowing"" such items as thread, safety pins, batteries and scraps of food. However, their peaceful co-existence is disturbed when evil lawyer Ocious P. Potter steals the will granting title to the house, which he plans to demolish in order to build apartments. The Lenders are forced to move, and the Clocks face the risk of being exposed to the normal-sized world.",6.006,497,"['Adventure', 'Fantasy', 'Action', 'Comedy', 'Family']",3.0
1873,"Misérables, Les (1998)",Crime|Drama|Romance|War,119683,4415.0,"In 19th century France, Jean Valjean, a man imprisoned for stealing bread, must flee a relentless policeman named Javert. The pursuit consumes both men's lives, and soon Valjean finds himself in the midst of the student revolutions in France.",7.225,655,"['Crime', 'Drama', 'History', 'Romance']",4.0
1882,Godzilla (1998),Action|Sci-Fi|Thriller,120685,929.0,"French nuclear tests irradiate an iguana into a giant monster that viciously attacks freighter ships in the Pacific Ocean. A team of experts, including Niko Tatopoulos, conclude that the oversized reptile is the culprit. Before long, the giant lizard is loose in Manhattan as the US military races to destroy the monster before it reproduces and it's spawn takes over the world.",5.637,4051,"['Science Fiction', 'Action', 'Thriller']",3.0
1883,Bulworth (1998),Comedy|Drama|Romance,118798,9452.0,A suicidally disillusioned liberal politician puts a contract out on himself and takes the opportunity to be bluntly honest with his voters by affecting the rhythms and speech of hip-hop music and culture.,6.336,256,"['Comedy', 'Drama', 'Crime', 'Thriller', 'Romance']",4.0
1907,Mulan (1998),Adventure|Animation|Children|Comedy|Drama|Musical|Romance,120762,10674.0,"To save her father from certain death in the army, a young woman secretly enlists in his place and becomes one of China's greatest heroines in the process.",7.9,10105,"['Animation', 'Family', 'Adventure']",5.0
1911,Dr. Dolittle (1998),Comedy,118998,3050.0,"A successful physician and devoted family man, John Dolittle seems to have the world by the tail, until a long suppressed talent he possessed as a child, the ability to communicate with animals is suddenly reawakened with a vengeance! Now every creature within squawking distance wants the good doctor's advice, unleashing an outrageous chain of events that turns his world upside down!",5.709,3158,"['Comedy', 'Family', 'Fantasy']",3.0
1914,Smoke Signals (1998),Comedy|Drama,120321,20862.0,"Young Native American man Thomas is a nerd in his reservation, wearing oversize glasses and telling everyone stories no-one wants to hear. His parents died in a fire in 1976, and Thomas was saved by Arnold. Arnold soon left his family, and Victor hasn't seen his father for 10 years. When Victor hears Arnold has died, Thomas offers him funding for the trip to get Arnold's remains.",6.8,109,"['Drama', 'Comedy']",3.0
1923,There's Something About Mary (1998),Comedy|Romance,129387,544.0,"For Ted, prom night went about as bad as it’s possible for any night to go. Thirteen years later, he finally gets another chance with his old prom date, only to run up against other suitors including the sleazy detective he hired to find her.",6.618,5104,"['Romance', 'Comedy']",3.0
1946,Marty (1955),Drama|Romance,48356,15919.0,"Marty, a butcher who lives in the Bronx with his mother is unmarried at 34. Good-natured but socially awkward he faces constant badgering from family and friends to get married but has reluctantly resigned himself to bachelorhood. Marty meets Clara, an unattractive school teacher, realising their emotional connection, he promises to call but family and friends try to convince him not to.",7.447,416,"['Drama', 'Romance']",3.0
1947,West Side Story (1961),Drama|Musical|Romance,55614,1725.0,"In the slums of the upper West Side of Manhattan, tensions are high as a gang of Polish-Americans compete against a gang of recently immigrated Puerto Ricans, but this doesn't stop two romantics from each gang falling in love.",7.237,1954,"['Crime', 'Drama', 'Romance']",3.0
1948,Tom Jones (1963),Adventure|Comedy|Romance,57590,5769.0,Tom loves Sophie and Sophie loves Tom. But Tom and Sophie are of differering classes. Can they find a way through the mayhem to be true to love?,5.92,226,"['Comedy', 'Adventure', 'History', 'Romance']",3.0
1949,"Man for All Seasons, A (1966)",Drama,60665,874.0,"A depiction of the conflict between King Henry VIII of England and his Lord Chancellor, Sir Thomas More, who refuses to swear the Oath of Supremacy declaring Henry Supreme Head of the Church in England.",7.328,460,"['Drama', 'History']",4.0
1959,Out of Africa (1985),Drama|Romance,89755,606.0,"Tells the life story of Danish author Karen Blixen, who at the beginning of the 20th century moved to Africa to build a new life for herself. The film is based on her 1937 autobiographical novel.",7.171,1459,"['History', 'Romance', 'Drama']",4.0
1960,"Last Emperor, The (1987)",Drama,93389,746.0,"A dramatic history of Pu Yi, the last of the Emperors of China, from his lofty birth and brief reign in the Forbidden City, the object of worship by half a billion people; through his abdication, his decline and dissolute lifestyle; his exploitation by the invading Japanese, and finally to his obscure existence as just another peasant worker in the People's Republic.",7.591,1799,"['Drama', 'History']",3.0
1961,Rain Man (1988),Drama,95953,380.0,"When car dealer Charlie Babbitt learns that his estranged father has died, he returns home to Cincinnati, where he discovers that he has a savant older brother named Raymond and that his father's $3 million fortune is being left to the mental institution in which Raymond lives. Motivated by his father's money, Charlie checks Raymond out of the facility in order to return with him to Los Angeles. The brothers' cross-country trip ends up changing both their lives.",7.751,6704,['Drama'],3.0
1962,Driving Miss Daisy (1989),Drama,97239,403.0,"The story of an old Jewish widow named Daisy Werthan and her relationship with her black chauffeur, Hoke. From an initial mere work relationship grew in 25 years a strong friendship between the two very different characters, in a time when those types of relationships were shunned.",7.2,1667,['Drama'],3.0
1963,Take the Money and Run (1969),Comedy|Crime,65063,11485.0,"Virgil Starkwell is intent on becoming a notorious bank robber. Unfortunately for Virgil and his not-so-budding career, he is completely incompetent.",7.105,760,"['Comedy', 'Crime']",3.0
1965,Repo Man (1984),Comedy|Sci-Fi,87995,13820.0,"A down and out young punk gets a job working with a seasoned repo man, but what awaits him in his new career is a series of outlandish adventures revolving around aliens, the CIA, and a most wanted '64 Chevy.",6.648,640,"['Comedy', 'Science Fiction']",4.0
2005,"Goonies, The (1985)",Action|Adventure|Children|Comedy|Fantasy,89218,9340.0,Young teen Mikey Walsh and his friends set off on a quest to find Pirate One-Eyed Willie's treasure in hopes of saving their homes from demolition.,7.514,5948,"['Adventure', 'Comedy', 'Family']",3.0
2006,"Mask of Zorro, The (1998)",Action|Comedy|Romance,120746,9342.0,"It has been twenty years since Don Diego de la Vega fought Spanish oppression in Alta California as the legendary romantic hero, Zorro. Having escaped from prison he transforms troubled bandit Alejandro into his successor, in order to foil the plans of the tyrannical Don Rafael Montero who robbed him of his freedom, his wife and his precious daughter.",6.576,4154,"['Action', 'Adventure']",4.0
2010,Metropolis (1927),Drama|Sci-Fi,17136,19.0,"In a futuristic city sharply divided between the rich and the poor, the son of the city's mastermind meets a prophet who predicts the coming of a savior to mediate their differences.",8.1,2937,"['Drama', 'Science Fiction']",3.0
2011,Back to the Future Part II (1989),Adventure|Comedy|Sci-Fi,96874,165.0,"Marty and Doc are at it again as the time-traveling duo head to 2015 to nip some McFly family woes in the bud. But things go awry thanks to bully Biff Tannen and a pesky sports almanac. In a last-ditch attempt to set things straight, Marty finds himself bound for 1955 and face to face with his teenage parents -- again.",7.772,13378,"['Adventure', 'Comedy', 'Science Fiction']",3.0
2012,Back to the Future Part III (1990),Adventure|Comedy|Sci-Fi|Western,99088,196.0,"The final installment finds Marty digging the trusty DeLorean out of a mineshaft and looking for Doc in the Wild West of 1885. But when their time machine breaks down, the travelers are stranded in a land of spurs. More problems arise when Doc falls for pretty schoolteacher Clara Clayton, and Marty tangles with Buford Tannen.",7.488,11059,"['Adventure', 'Comedy', 'Science Fiction']",4.0
2018,Bambi (1942),Animation|Children|Drama,34492,3170.0,"Bambi's tale unfolds from season to season as the young prince of the forest learns about life, love, and friends.",7.011,5848,"['Animation', 'Drama', 'Family']",2.0
2020,Dangerous Liaisons (1988),Drama|Romance,94947,859.0,"In 18th century France, Marquise de Merteuil asks her ex-lover Vicomte de Valmont to seduce the future wife of another ex-lover of hers in return for one last night with her. Yet things don’t go as planned.",7.193,1218,"['Drama', 'Romance']",4.0
2021,Dune (1984),Adventure|Sci-Fi,87182,841.0,"In the year 10,191, the most precious substance in the universe is the spice Melange. The spice extends life. The spice expands consciousness. The spice is vital to space travel.  The spice exists on only one planet in the entire universe, the vast desert planet Arrakis, also known as Dune.  Its native inhabitants, the Fremen, have long held a prophecy that a man would come, a messiah who would lead them to true freedom.",6.171,3247,"['Action', 'Science Fiction', 'Adventure']",1.0
2035,Blackbeard's Ghost (1968),Children|Comedy,62737,16249.0,"The eponymous wraith returns to Earth to aid his descendant, elderly Emily Stowecroft. The villains want to kick Emily and her friends out of their group home so that they can build a crooked casino. Good guy Steve Walker gets caught in the middle of the squabble after evoking Blackbeard's ghost.",6.7,149,"['Comedy', 'Fantasy', 'Family']",3.0
2043,Darby O'Gill and the Little People (1959),Adventure|Children|Fantasy,52722,18887.0,A wily old codger matches wits with the King of the Leprechauns and helps play matchmaker for his daughter and the strapping lad who has replaced him as caretaker.,6.7,162,"['Adventure', 'Family', 'Fantasy', 'Romance']",4.0
2046,Flight of the Navigator (1986),Adventure|Children|Sci-Fi,91059,10122.0,"12-year-old David is accidentally knocked out in the forest near his home, but when he awakens eight years have passed. His family is overjoyed to have him back, but is just as perplexed as he is that he hasn't aged. When a NASA scientist discovers a UFO nearby, David gets the chance to unravel the mystery and recover the life he lost.",6.944,888,"['Family', 'Science Fiction', 'Adventure']",3.0
2053,"Honey, I Blew Up the Kid (1992)",Children|Comedy|Sci-Fi,104437,11158.0,"Wayne Szalinski is at it again. But instead of shrinking things, he tries to make a machine that can make things grow. As in the first one, his machine isn't quite accurate. But when he brings Nick & his toddler son Adam to see his invention, the machine unexpectedly starts working. And when Adam comes right up to the machine, he gets zapped along with his stuffed bunny.",5.27,1211,"['Adventure', 'Comedy', 'Family', 'Science Fiction']",3.0
2054,"Honey, I Shrunk the Kids (1989)",Adventure|Children|Comedy|Fantasy|Sci-Fi,97523,9354.0,The scientist father of a teenage girl and boy accidentally shrinks his and two other neighborhood teens to the size of insects. Now the teens must fight diminutive dangers as the father searches for them.,6.303,3176,"['Adventure', 'Comedy', 'Family', 'Science Fiction']",3.0
2062,"Governess, The (1998)",Drama|Romance,120687,96196.0,"When the father of privileged Rosina da Silva violently dies, she decides to pass herself off as a gentile and finds employment with a family in faraway Scotland. Soon she and the family father, Charles, start a passionate secret affair.",5.9,26,"['Drama', 'Romance']",4.0
2065,"Purple Rose of Cairo, The (1985)",Comedy|Drama|Fantasy|Romance,89853,10849.0,"Cecilia is a waitress in New Jersey, living a dreary life during the Great Depression. Her only escape from her mundane reality is the movie theatre. After losing her job, Cecilia goes to see 'The Purple Rose of Cairo' in hopes of raising her spirits, where she watches dashing archaeologist Tom Baxter time and again.",7.399,1084,"['Fantasy', 'Comedy', 'Romance']",3.0
2067,Doctor Zhivago (1965),Drama|Romance|War,59113,907.0,"The life of a Russian physician and poet who, although married to another, falls in love with a political activist's wife and experiences hardship during World War I and then the October Revolution.",7.5,1207,"['Drama', 'Romance', 'War']",4.0
2072,"'burbs, The (1989)",Comedy,96734,11974.0,"When secretive new neighbors move in next door, suburbanite Ray Peterson and his friends let their paranoia get the best of them as they start to suspect the newcomers of evildoings and commence an investigation. But it's hardly how Ray, who much prefers drinking beer, reading his newspaper and watching a ball game on the tube expected to spend his vacation.",6.763,1291,"['Comedy', 'Horror', 'Thriller']",3.0
2078,"Jungle Book, The (1967)",Animation|Children|Comedy|Musical,61852,9325.0,"The boy Mowgli makes his way to the man-village with Bagheera, the wise panther. Along the way he meets jazzy King Louie, the hypnotic snake Kaa and the lovable, happy-go-lucky bear Baloo, who teaches Mowgli ""The Bare Necessities"" of life and the true meaning of friendship.",7.278,6456,"['Family', 'Animation', 'Adventure']",3.0
2080,Lady and the Tramp (1955),Animation|Children|Comedy|Romance,48280,10340.0,"Lady, a golden cocker spaniel, meets up with a mongrel dog who calls himself the Tramp. He is obviously from the wrong side of town, but happenings at Lady's home make her decide to travel with him for a while.",7.122,5462,"['Family', 'Animation', 'Romance']",3.0
2081,"Little Mermaid, The (1989)",Animation|Children|Comedy|Musical|Romance,97757,10144.0,This colorful adventure tells the story of an impetuous mermaid princess named Ariel who falls in love with the very human Prince Eric and puts everything on the line for the chance to be with him. Memorable songs and characters -- including the villainous sea witch Ursula.,7.348,8163,"['Animation', 'Family', 'Fantasy']",3.0
2083,"Muppet Christmas Carol, The (1992)",Children|Comedy|Musical,104940,10437.0,"A retelling of the classic Dickens tale of Ebenezer Scrooge, miser extraordinaire. He is held accountable for his dastardly ways during night-time visitations by the Ghosts of Christmas Past, Present and Future.",7.4,1072,"['Music', 'Comedy', 'Family', 'Fantasy', 'Drama']",4.0
2085,101 Dalmatians (One Hundred and One Dalmatians) (1961),Adventure|Animation|Children,55254,12230.0,"When a litter of dalmatian puppies are abducted by the minions of Cruella De Vil, the parents must find them before she uses them for a diabolical fashion statement.",7.173,6466,"['Adventure', 'Animation', 'Comedy', 'Family']",2.0
2086,One Magic Christmas (1985),Drama|Fantasy,89731,13380.0,"Ginny Grainger, a young mother, rediscovers the joy and beauty of Christmas, thanks to the unshakable faith of her six-year-old daughter Abbie and Gideon, Ginny's very own guardian angel.",5.786,105,"['Family', 'Fantasy']",3.0
2087,Peter Pan (1953),Animation|Children|Fantasy|Musical,46183,10693.0,"Leaving the safety of their nursery behind, Wendy, Michael and John follow Peter Pan to a magical world where childhood lasts forever. But while in Neverland, the kids must face Captain Hook and foil his attempts to get rid of Peter for good.",7.197,5562,"['Animation', 'Family', 'Adventure', 'Fantasy']",3.0
2088,Popeye (1980),Adventure|Comedy|Musical,81353,11335.0,"Popeye is a super-strong, spinach-scarfing sailor man who's searching for his father. During a storm that wrecks his ship, Popeye washes ashore and winds up rooming at the Oyl household, where he meets Olive. Before he can win her heart, he must first contend with Olive's fiancé, Bluto.",5.509,656,"['Action', 'Adventure', 'Comedy', 'Family']",3.0
2089,"Rescuers Down Under, The (1990)",Adventure|Animation|Children,100477,11135.0,"A lawless poacher wants to capture a majestic and rare golden eagle, so he kidnaps the boy who knows where to find the bird. Not to worry -- the Rescue Aid Society's top agents, heroic mice Miss Bianca and Bernard, fly to Australia to save the day. Accompanying the fearless duo are bumbling albatross Wilbur and local field operative Jake the Kangaroo Rat.",6.642,1339,"['Animation', 'Adventure', 'Family', 'Fantasy']",3.0
2093,Return to Oz (1985),Adventure|Children|Fantasy,89908,13155.0,"Dorothy, saved from a psychiatric experiment by a mysterious girl, finds herself back in the land of her dreams, and makes delightful new friends, and dangerous new enemies.",6.7,1041,"['Adventure', 'Family', 'Fantasy']",3.0
2094,"Rocketeer, The (1991)",Action|Adventure|Sci-Fi,102803,10249.0,"A stunt pilot comes across a prototype jetpack that gives him the ability to fly. However, evil forces of the world also want this jetpack at any cost.",6.473,985,"['Action', 'Adventure', 'Science Fiction', 'Family']",4.0
2100,Splash (1984),Comedy|Fantasy|Romance,88161,2619.0,"A successful businessman falls in love with the girl of his dreams. There's one big complication though; he's fallen hook, line and sinker for a mermaid.",6.263,1415,"['Comedy', 'Romance', 'Fantasy']",4.0
2105,Tron (1982),Action|Adventure|Sci-Fi,84827,97.0,"When brilliant video game maker Flynn hacks the mainframe of his ex-employer, he is beamed inside an astonishing digital world...And becomes part of the very game he is designing. In his mission through cyberspace, Flynn matches wits with a maniacal Master Control Program and teams up with Tron, a security measure created to bring balance to the digital environment.",6.6,2456,"['Science Fiction', 'Action', 'Adventure']",3.0
2108,L.A. Story (1991),Comedy|Romance,102250,2107.0,"With the help of a talking freeway billboard, a ""wacky weatherman"" tries to win the heart of an English newspaper reporter, who is struggling to make sense of the strange world of early-90s Los Angeles.",6.5,358,"['Comedy', 'Fantasy', 'Romance']",4.0
2109,"Jerk, The (1979)",Comedy,79367,6471.0,"After discovering he's not really black like the rest of his family, likable dimwit Navin Johnson sets off on a hilarious misadventure that takes him from rags to riches and back again. The slaphappy jerk strikes it rich, but life in the fast lane isn't all it's cracked up to be and, in the end, all that really matters to Johnson is his true love.",6.906,850,['Comedy'],2.0
2110,Dead Men Don't Wear Plaid (1982),Comedy|Crime|Thriller,83798,9442.0,"Juliet Forrest is convinced that the reported death of her father in a mountain car crash was no accident. Her father was a prominent cheese scientist working on a secret recipe. To prove it was murder, she enlists the services of private eye Rigby Reardon. He finds a slip of paper containing a list of people who are 'The Friends and Enemies of Carlotta'.",6.6,410,"['Comedy', 'Mystery', 'Crime']",4.0
2111,"Man with Two Brains, The (1983)",Comedy,85894,11591.0,"A brain surgeon marries a femme fatale, causing his life to turn upside down. Things go more awry when he falls in love with a talking brain.",6.2,451,"['Comedy', 'Science Fiction']",4.0
2112,Grand Canyon (1991),Crime|Drama,101969,13697.0,Grand Canyon revolved around six residents from different backgrounds whose lives intertwine in modern-day Los Angeles. At the center of the film is the unlikely friendship of two men from different races and classes brought together when one finds himself in jeopardy in the other's rough neighborhood.,6.454,207,['Drama'],2.0
2116,"Lord of the Rings, The (1978)",Adventure|Animation|Children|Fantasy,77869,123.0,The Fellowship of the Ring embark on a journey to destroy the One Ring and end Sauron's reign over Middle-earth.,6.593,986,"['Adventure', 'Animation', 'Fantasy']",3.0
2131,Autumn Sonata (Höstsonaten) (1978),Drama,77711,12761.0,"After a seven-year absence, Charlotte Andergast travels to Sweden to reunite with her daughter Eva. The pair have a troubled relationship: Charlotte sacrificed the responsibilities of motherhood for a career as a classical pianist. Over an emotional night, the pair reopen the wounds of the past. Charlotte gets another shock when she finds out that her mentally impaired daughter, Helena, is out of the asylum and living with Eva.",7.975,651,['Drama'],2.0
2134,Weird Science (1985),Comedy|Fantasy|Sci-Fi,90305,11814.0,"Two unpopular teenagers, Gary and Wyatt, fail at all attempts to be accepted by their peers. Their desperation to be liked leads them to ""create"" a woman via their computer. Their living and breathing creation is a gorgeous woman, Lisa, whose purpose is to boost their confidence level by putting them into situations which require Gary and Wyatt to act like men.",6.554,1461,"['Comedy', 'Fantasy', 'Science Fiction', 'Romance']",4.0
2136,"Nutty Professor, The (1963)",Comedy|Sci-Fi,57372,18331.0,"A timid, nearsighted chemistry teacher discovers a magical potion that can transform him into a suave and handsome Romeo. The Jekyll and Hyde game works well enough until the concoction starts to wear off at the most embarrassing times.",6.531,438,"['Comedy', 'Science Fiction', 'Romance']",3.0
2137,Charlotte's Web (1973),Animation|Children,70016,15171.0,"Wilbur the pig is scared of the end of the season, because he knows that come that time, he will end up on the dinner table. He hatches a plan with Charlotte, a spider that lives in his pen, to ensure that this will never happen.",6.838,394,"['Family', 'Music', 'Animation']",2.0
2138,Watership Down (1978),Adventure|Animation|Children|Drama|Fantasy,78480,11837.0,"When the warren belonging to a community of rabbits is threatened, a brave group led by Fiver, Bigwig, Blackberry and Hazel leave their homeland in a search of a safe new haven.",7.191,660,"['Adventure', 'Animation', 'Drama']",4.0
2139,"Secret of NIMH, The (1982)",Adventure|Animation|Children|Drama,84649,11704.0,"A widowed field mouse must move her family -- including an ailing son -- to escape a farmer's plow. Aided by a crow and a pack of superintelligent, escaped lab rats, the brave mother struggles to transplant her home to firmer ground.",7.4,881,"['Family', 'Animation', 'Fantasy', 'Adventure', 'Drama', 'Mystery', 'Science Fiction']",4.0
2140,"Dark Crystal, The (1982)",Adventure|Fantasy,83791,11639.0,"On another planet in the distant past, a Gelfling embarks on a quest to find the missing shard of a magical crystal and restore order to his world, before the grotesque race of Skeksis find and use the crystal for evil.",7.1,1187,"['Adventure', 'Family', 'Fantasy']",2.0
2141,"American Tail, An (1986)",Adventure|Animation|Children|Comedy,90633,4978.0,"A young mouse named Fievel and his family decide to migrate to America, a ""land without cats,"" at the turn of the 20th century. But somehow, Fievel ends up in the New World alone and must fend off not only the felines he never thought he'd have to deal with again but also the loneliness of being away from home.",6.744,1393,"['Animation', 'Comedy', 'Adventure', 'Drama', 'Family']",3.0
2143,Legend (1985),Adventure|Fantasy|Romance,89469,11976.0,"Set in a timeless mythical forest inhabited by fairies, goblins, unicorns and mortals, this fantastic story follows a mystical forest dweller, chosen by fate, to undertake a heroic quest. He must save the beautiful Princess  Lili and defeat the demonic Lord of Darkness, or the world will be plunged into a never-ending ice age.",6.244,1291,"['Adventure', 'Fantasy']",2.0
2151,"Gods Must Be Crazy II, The (1989)",Comedy,97443,11937.0,"Xixo is back again. This time, his children accidentally stow away on a fast-moving poachers' truck, unable to get off, and Xixo sets out to rescue them. Along the way, he encounters a couple of soldiers trying to capture each other and a pilot and passenger of a small plane, who are each having a few problems of their own.",7.1,517,"['Action', 'Comedy']",4.0
