movieId,title,genres,imdbId,tmdbId,overview,tmdb_vote_average,tmdb_vote_count,tmdb_genres,rating
1678,"Joy Luck Club, The (1993)",Drama|Romance,107282,19931.0,"Through a series of flashbacks, four Chinese women born in America and their respective mothers born in feudal China explore their pasts.",7.1,151,['Drama'],5.0
1682,"Truman Show, The (1998)",Comedy|Drama|Sci-Fi,120382,37165.0,An insurance salesman begins to suspect that his whole life is actually some sort of reality TV show.,8.148,19329,"['Comedy', 'Drama']",2.0
1683,"Wings of the Dove, The (1997)",Drama|Romance,120520,45609.0,"Kate is secretly betrothed to a struggling journalist, Merton Densher. But she knows her Aunt Maude will never approve of the match, since Kate's deceased mother has lost all her money in a marriage to a degenerate opium addict. When Kate meets a terminally ill American heiress named Millie traveling through Europe, she comes up with a conniving plan to have both love and wealth.",6.7,118,"['Drama', 'Romance']",4.0
1684,Mrs. Dalloway (1997),Drama|Romance,119723,38904.0,"Clarissa Dalloway looks back on her youth as she readies for a gathering at her house. The wife of a legislator and a doyenne of London's upper-crust party scene, Clarissa finds that the plight of ailing war veteran Septimus Warren Smith reminds her of a past romance with Peter Walsh. In flashbacks, young Clarissa explores her possibilities with Peter.",5.58,69,"['Drama', 'Romance']",5.0
1688,Anastasia (1997),Adventure|Animation|Children|Drama|Musical,118617,9444.0,"Ten years after she was separated from her family, an eighteen-year-old orphan with vague memories of the past sets out to Paris in hopes of reuniting with her grandmother. She is accompanied by two con men, who intend to pass her off as the Grand Duchess Anastasia to the Dowager Empress for a reward.",7.606,5445,"['Animation', 'Family', 'Fantasy', 'Adventure']",2.0
1689,"Man Who Knew Too Little, The (1997)",Comedy|Crime|Thriller,120483,9414.0,"An American gets a ticket for an audience participation game in London, then gets involved in a case of mistaken identity. As an international plot unravels around him, he thinks it's all part of the act.",6.4,535,"['Comedy', 'Crime', 'Action']",3.0
1694,"Apostle, The (1997)",Drama,118632,2895.0,"After his happy life spins out of control, a preacher from Texas changes his name, goes to Louisiana and starts preaching on the radio.",6.3,149,['Drama'],5.0
1695,Artemisia (1997),Drama,123385,39177.0,"The story of Artemisia Gentileschi (1593-1653), one of the first well-known female painters, including her youth, when she was guided and protected by her father, the painter Orazio Gentileschi.",6.0,43,"['Drama', 'History']",3.0
1696,Bent (1997),Drama|War,118698,19601.0,"Max is a handsome young man who, after a fateful tryst with a German soldier, is forced to run for his life. Eventually Max is placed in a concentration camp where he pretends to be Jewish because in the eyes of the Nazis, gays are the lowest form of human being. But it takes a relationship with an openly gay prisoner to teach Max that without the love of another, life is not worth living.",6.9,149,"['Drama', 'History', 'Romance']",3.0
1699,"Butcher Boy, The (1997)",Comedy|Drama,118804,22797.0,"Francie and Joe live the usual playful, fantasy filled childhoods of normal boys. However, with a violent, alcoholic father and a manic depressive, suicidal mother the pressure on Francie to grow up are immense. When Francie's world turns to madness, he tries to counter it with further insanity, with dire consequences.",6.8,119,"['Comedy', 'Drama']",4.0
1701,Deconstructing Harry (1997),Comedy|Drama,118954,2639.0,"Writer Harry Block draws inspiration from people he knows, and from events that happened to him, sometimes causing these people to become alienated from him as a result.",7.251,998,"['Comedy', 'Drama']",5.0
1702,Flubber (1997),Children|Comedy|Fantasy,119137,9574.0,"Professor Phillip Brainard, an absent minded professor, works with his assistant Weebo, trying to create a substance that's a new source of energy and that will save Medfield College where his sweetheart Sara is the president. He has missed his wedding twice, and on the afternoon of his third wedding, Professor Brainard creates flubber, which allows objects to fly through the air.",5.654,2444,"['Comedy', 'Family', 'Science Fiction']",4.0
1703,For Richer or Poorer (1997),Comedy,119142,10371.0,"Brad Sexton and his wife, Caroline, are wealthy New Yorkers with both marital and financial problems. The latter issue becomes a pressing matter when they discover that their accountant has embezzled millions and pinned the blame on them. Forced to go on the lam, Brad and Caroline end up in an Amish area of Pennsylvania and decide to pose as members of the religious group to evade the IRS. As the two adapt to the simple Amish lifestyle, they begin to reconnect.",6.0,239,"['Comedy', 'Romance']",5.0
1704,Good Will Hunting (1997),Drama|Romance,119217,489.0,"Headstrong yet aimless, Will Hunting has a genius-level IQ but chooses to work as a janitor at MIT. When he secretly solves highly difficult graduate-level math problems, his talents are discovered by Professor Gerald Lambeau, who decides to help the misguided youth reach his potential. When Will is arrested for attacking a police officer, Professor Lambeau makes a deal to get leniency for him if he gets court-ordered therapy. Eventually, therapist Dr. Sean Maguire helps Will confront the demons that are holding him back.",8.157,13119,['Drama'],1.0
1711,Midnight in the Garden of Good and Evil (1997),Crime|Drama|Mystery,119668,8197.0,"A visiting city reporter's assignment suddenly revolves around the murder trial of a local millionaire, whom he befriends.",6.363,600,"['Mystery', 'Crime', 'Drama']",4.0
1721,Titanic (1997),Drama|Romance,120338,597.0,"101-year-old Rose DeWitt Bukater tells the story of her life aboard the Titanic, 84 years later. A young Rose boards the ship with her mother and fiancé. Meanwhile, Jack Dawson and Fabrizio De Rossi win third-class tickets aboard the ship. Rose tells the whole story from Titanic's departure through to its death—on its first and last voyage—on April 15, 1912.",7.906,26345,"['Drama', 'Romance']",4.0
1727,"Horse Whisperer, The (1998)",Drama|Romance,119314,547.0,The mother of a severely traumatized daughter enlists the aid of a unique horse trainer to help the girl's equally injured horse.,6.898,1147,"['Adventure', 'Drama', 'Romance']",4.0
1729,Jackie Brown (1997),Crime|Drama|Thriller,119396,184.0,"Jackie Brown is a flight attendant who gets caught in the middle of smuggling cash into the country for her gunrunner boss. When the cops try to use Jackie to get to her boss, she hatches a plan — with help from a bail bondsman — to keep the money for herself.",7.355,6653,"['Crime', 'Drama', 'Thriller']",4.0
1732,"Big Lebowski, The (1998)",Comedy|Crime,118715,115.0,"Jeffrey 'The Dude' Lebowski, a Los Angeles slacker who only wants to bowl and drink White Russians, is mistaken for another Jeffrey Lebowski, a wheelchair-bound millionaire, and finds himself dragged into a strange series of events involving nihilists, adult film producers, ferrets, errant toes, and large sums of money.",7.84,11690,"['Comedy', 'Crime']",4.0
1733,Afterglow (1997),Drama|Romance,118566,26941.0,"Lucky Mann is a builder equally handy at repairs and seduction. The latest housewife to succumb to his charms is Marianne, unhappily married to corporate exec Jeffrey. When Jeffrey becomes enraptured by Lucky’s wife Phyllis, the four get caught in a love quadrangle that reignites their marriages.",6.0,34,"['Drama', 'Romance']",3.0
1734,My Life in Pink (Ma vie en rose) (1997),Comedy|Drama,119590,27103.0,"Ludovic is waiting for a miracle. With six-year-old certainty, she believes she was meant to be a little girl -- and that the mistake will soon be corrected. But where she expects the miraculous, Ludo finds only rejection, isolation and guilt -- as the intense reactions of family, friends, and neighbors strip away every innocent lace and bauble.  As suburban prejudices close around them, family loves and loyalties are tested in the ever-escalating dramatic turns of Alain Berliner's critically acclaimed first feature. Winner of the Golden Globe for Best Foreign Language Film and a favorite at festivals around the world, this unique film experience delivers magic of the rarest sort through a story of difference, rejection, and childlike faith in miracles.",7.0,104,"['Drama', 'Comedy']",5.0
1735,Great Expectations (1998),Drama|Romance,119223,9410.0,"Loosely based on the Charles Dickens' classic novel, ""Great Expectations"" is a sensual tale of a young man's unforgettable passage into manhood, and the three individuals who will undeniably change his life forever. Through the surprising interactions of these vivid characters, ""Great Expectations"" takes a unique and contemporary look at life's great coincidences.",6.611,646,"['Comedy', 'Drama', 'Romance']",4.0
1747,Wag the Dog (1997),Comedy,120885,586.0,"During the final weeks of a presidential race, the President is accused of sexual misconduct. To distract the public until the election, the President's adviser hires a Hollywood producer to help him stage a fake war.",6.943,992,"['Comedy', 'Drama']",5.0
1759,"Four Days in September (O Que É Isso, Companheiro?) (1997)",Drama,119815,21253.0,"Fernando, a journalist, and his friend César join terrorist group MR8 in order to fight Brazilian dictatorial regime during the late sixties. César, however, is wounded and captured during a bank hold up. Fernando then decides to kidnap the American ambassador in Brazil and ask for the release of fifteen political prisoners in exchange for his life.",7.5,125,"['Thriller', 'Drama', 'History']",4.0
1784,As Good as It Gets (1997),Comedy|Drama|Romance,119822,2898.0,"Melvin Udall, a cranky, bigoted, obsessive-compulsive writer of romantic fiction, is rude to everyone he meets, including his gay neighbor, Simon. After Simon is brutally attacked and hospitalized, Melvin finds his life turned upside down when he has to look after Simon's dog. In addition, Carol, the only waitress at the local diner who will tolerate him, leaves work to care for her chronically ill son, making it impossible for Melvin to eat breakfast.",7.397,3938,"['Drama', 'Comedy', 'Romance']",2.0
1798,Hush (1998),Thriller,118744,17941.0,"Jackson and Helen are in love and about to have their first child when they move in with Jackson's mother, Martha, in order to take care of the family estate. But all is not well in this household. Martha is jealous of her son's affection for Helen, and, despite her Southern smile, she's starting to act strangely. As Helen tries to create a happy home life, Martha attempts to divide the family so that Jackson will become hers alone.",5.7,306,"['Drama', 'Thriller']",4.0
1801,"Man in the Iron Mask, The (1998)",Action|Adventure|Drama,120744,9313.0,"Years have passed since the Three Musketeers, Aramis, Athos and Porthos, have fought together with their friend, D'Artagnan. But with the tyrannical King Louis using his power to wreak havoc in the kingdom while his twin brother, Philippe, remains imprisoned, the Musketeers reunite to abduct Louis and replace him with Philippe.",6.641,3967,"['Adventure', 'Action', 'Drama']",2.0
1821,"Object of My Affection, The (1998)",Comedy|Romance,120772,17127.0,"A pregnant New York social worker begins to develop romantic feelings for her gay best friend, and decides she'd rather raise her child with him, much to the dismay of her overbearing boyfriend.",5.8,317,"['Comedy', 'Drama', 'Romance']",2.0
1834,"Spanish Prisoner, The (1997)",Crime|Drama|Mystery|Thriller,120176,29193.0,An inventor of a secret process suddenly finds himself alone as both his friends and the corporation he works for turn against him.,6.806,297,"['Drama', 'Mystery', 'Thriller']",5.0
1836,"Last Days of Disco, The (1998)",Comedy|Drama,120728,16980.0,Two young women and their friends spend spare time at an exclusive nightclub in 1980s New York.,6.2,198,"['Comedy', 'Drama', 'Romance']",3.0
1840,He Got Game (1998),Drama,124718,9469.0,A basketball player's father must try to convince him to go to a college so he can get a shorter prison sentence.,6.748,757,['Drama'],5.0
1875,Clockwatchers (1997),Comedy,118866,55561.0,"Four female temps working for a credit company find their friendship threatened by the arrival of a new hire, who lands a permanent position one of the women was vying for.",6.1,70,['Drama'],4.0
1883,Bulworth (1998),Comedy|Drama|Romance,118798,9452.0,A suicidally disillusioned liberal politician puts a contract out on himself and takes the opportunity to be bluntly honest with his voters by affecting the rhythms and speech of hip-hop music and culture.,6.336,256,"['Comedy', 'Drama', 'Crime', 'Thriller', 'Romance']",5.0
1884,Fear and Loathing in Las Vegas (1998),Adventure|Comedy|Drama,120669,1878.0,"Raoul Duke and his attorney Dr. Gonzo drive a red convertible across the Mojave desert to Las Vegas with a suitcase full of drugs to cover a motorcycle race. As their consumption of drugs increases at an alarming rate, the stoned duo trash their hotel room and fear legal repercussions. Duke begins to drive back to L.A., but after an odd run-in with a cop, he returns to Sin City and continues his wild drug binge.",7.211,4799,"['Adventure', 'Drama', 'Comedy']",2.0
1885,"Opposite of Sex, The (1998)",Comedy|Drama|Romance,120777,9844.0,"A 16-year-old girl visits her gay half-brother and ends up seducing his boyfriend, thus wreaking havoc on all of their lives.",6.2,211,"['Comedy', 'Drama']",4.0
1896,Cousin Bette (1998),Comedy,118894,50043.0,"In 19th century Paris, Bette Fischer, a poor and homely spinster, forms an alliance with the seductive courtesan Valerie Marneffe to orchestrate revenge on her handsome and wealthy relatives.",5.7,44,"['Comedy', 'Drama', 'Romance']",4.0
1907,Mulan (1998),Adventure|Animation|Children|Comedy|Drama|Musical|Romance,120762,10674.0,"To save her father from certain death in the army, a young woman secretly enlists in his place and becomes one of China's greatest heroines in the process.",7.9,10105,"['Animation', 'Family', 'Adventure']",5.0
1911,Dr. Dolittle (1998),Comedy,118998,3050.0,"A successful physician and devoted family man, John Dolittle seems to have the world by the tail, until a long suppressed talent he possessed as a child, the ability to communicate with animals is suddenly reawakened with a vengeance! Now every creature within squawking distance wants the good doctor's advice, unleashing an outrageous chain of events that turns his world upside down!",5.709,3158,"['Comedy', 'Family', 'Fantasy']",4.0
1913,Picnic at Hanging Rock (1975),Drama|Mystery,73540,11020.0,"In the early 1900s, Miranda attends a girls boarding school in Australia. One Valentine's Day, the school's typically strict headmistress treats the girls to a picnic field trip to an unusual but scenic volcanic formation called Hanging Rock. Despite rules against it, Miranda and several other girls venture off. It's not until the end of the day that the faculty realizes the girls and one of the teachers have disappeared mysteriously.",7.226,838,"['Drama', 'Mystery']",5.0
1919,Madeline (1998),Children|Comedy,123987,35680.0,"Horrified at the prospect of her beloved school being sold, a young French girl named Madeline uses her wit and craftiness to attempt to save it, making an unlikely new friend in the process.",6.187,235,"['Family', 'Comedy', 'Drama']",4.0
1923,There's Something About Mary (1998),Comedy|Romance,129387,544.0,"For Ted, prom night went about as bad as it’s possible for any night to go. Thirteen years later, he finally gets another chance with his old prom date, only to run up against other suitors including the sleazy detective he hired to find her.",6.618,5105,"['Romance', 'Comedy']",5.0
1938,"Lost Weekend, The (1945)",Drama,37884,28580.0,"Don Birnam, a long-time alcoholic, has been sober for ten days and appears to be over the worst... but his craving has just become more insidious. Evading a country weekend planned by his brother and girlfriend, he begins a four-day bender that just might be his last - one way or another.",7.624,631,['Drama'],5.0
1939,"Best Years of Our Lives, The (1946)",Drama|War,36868,887.0,"It's the hope that sustains the spirit of every GI: the dream of the day when he will finally return home. For three WWII veterans, the day has arrived. But for each man, the dream is about to become a nightmare.",7.789,699,"['Drama', 'Romance']",5.0
1946,Marty (1955),Drama|Romance,48356,15919.0,"Marty, a butcher who lives in the Bronx with his mother is unmarried at 34. Good-natured but socially awkward he faces constant badgering from family and friends to get married but has reluctantly resigned himself to bachelorhood. Marty meets Clara, an unattractive school teacher, realising their emotional connection, he promises to call but family and friends try to convince him not to.",7.447,416,"['Drama', 'Romance']",5.0
1947,West Side Story (1961),Drama|Musical|Romance,55614,1725.0,"In the slums of the upper West Side of Manhattan, tensions are high as a gang of Polish-Americans compete against a gang of recently immigrated Puerto Ricans, but this doesn't stop two romantics from each gang falling in love.",7.237,1954,"['Crime', 'Drama', 'Romance']",5.0
1948,Tom Jones (1963),Adventure|Comedy|Romance,57590,5769.0,Tom loves Sophie and Sophie loves Tom. But Tom and Sophie are of differering classes. Can they find a way through the mayhem to be true to love?,5.92,226,"['Comedy', 'Adventure', 'History', 'Romance']",3.0
1951,Oliver! (1968),Drama|Musical,63385,17917.0,"Musical adaptation of Charles Dickens' Oliver Twist, a classic tale of an orphan who runs away from the workhouse and joins up with a group of boys headed by the Artful Dodger and trained to be pickpockets by master thief Fagin.",7.033,452,"['Drama', 'Family']",5.0
1952,Midnight Cowboy (1969),Drama,64665,3116.0,"Joe Buck is a wide-eyed hustler from Texas hoping to score big with wealthy New York City women; he finds a companion in Enrico ""Ratso"" Rizzo, an ailing swindler with a bum leg and a quixotic fantasy of escaping to Florida.",7.508,1514,['Drama'],5.0
1953,"French Connection, The (1971)",Action|Crime|Thriller,67116,1051.0,Tough narcotics detective 'Popeye' Doyle is in hot pursuit of a suave French drug dealer who may be the key to a huge heroin-smuggling operation.,7.501,2012,"['Action', 'Crime', 'Thriller']",4.0
1956,Ordinary People (1980),Drama,81283,16619.0,"Beth, Calvin, and their son Conrad are living in the aftermath of the death of the other son. Conrad is overcome by grief and misplaced guilt to the extent of a suicide attempt. He is in therapy. Beth had always preferred his brother and is having difficulty being supportive to Conrad. Calvin is trapped between the two trying to hold the family together.",7.473,659,['Drama'],3.0
1957,Chariots of Fire (1981),Drama,82158,9443.0,"In the class-obsessed and religiously divided UK of the early 1920s, two determined young runners train for the 1924 Paris Olympics. Eric Liddell, a devout Christian born to Scottish missionaries in China, sees running as part of his worship of God's glory and refuses to train or compete on the Sabbath. Harold Abrahams overcomes anti-Semitism and class bias, but neglects his beloved sweetheart in his single-minded quest.",6.789,974,"['Drama', 'History']",5.0
1958,Terms of Endearment (1983),Comedy|Drama,86425,11050.0,"Aurora, a finicky woman, is in search of true love while her daughter faces marital issues. Together, they help each other deal with problems and find reasons to live a joyful life.",7.117,788,"['Drama', 'Comedy']",5.0
1959,Out of Africa (1985),Drama|Romance,89755,606.0,"Tells the life story of Danish author Karen Blixen, who at the beginning of the 20th century moved to Africa to build a new life for herself. The film is based on her 1937 autobiographical novel.",7.171,1459,"['History', 'Romance', 'Drama']",3.0
1960,"Last Emperor, The (1987)",Drama,93389,746.0,"A dramatic history of Pu Yi, the last of the Emperors of China, from his lofty birth and brief reign in the Forbidden City, the object of worship by half a billion people; through his abdication, his decline and dissolute lifestyle; his exploitation by the invading Japanese, and finally to his obscure existence as just another peasant worker in the People's Republic.",7.591,1799,"['Drama', 'History']",4.0
1961,Rain Man (1988),Drama,95953,380.0,"When car dealer Charlie Babbitt learns that his estranged father has died, he returns home to Cincinnati, where he discovers that he has a savant older brother named Raymond and that his father's $3 million fortune is being left to the mental institution in which Raymond lives. Motivated by his father's money, Charlie checks Raymond out of the facility in order to return with him to Los Angeles. The brothers' cross-country trip ends up changing both their lives.",7.75,6705,['Drama'],5.0
1962,Driving Miss Daisy (1989),Drama,97239,403.0,"The story of an old Jewish widow named Daisy Werthan and her relationship with her black chauffeur, Hoke. From an initial mere work relationship grew in 25 years a strong friendship between the two very different characters, in a time when those types of relationships were shunned.",7.2,1667,['Drama'],5.0
1964,Klute (1971),Drama|Mystery,67309,466.0,A high-priced call girl is forced to depend on a reluctant private eye when she is stalked by a psychopath.,6.746,482,"['Thriller', 'Mystery', 'Crime']",5.0
1968,"Breakfast Club, The (1985)",Comedy|Drama,88847,2108.0,"Five high school students from different walks of life endure a Saturday detention under a power-hungry principal. The disparate group includes rebel John, princess Claire, outcast Allison, brainy Brian and Andrew, the jock. Each has a chance to tell his or her story, making the others see them a little differently -- and when the day ends, they question whether school will ever be the same.",7.729,8258,"['Comedy', 'Drama']",4.0
2009,Soylent Green (1973),Drama|Mystery|Sci-Fi|Thriller,70723,12101.0,"In the year 2022, overcrowding, pollution,  and resource depletion have reduced society’s leaders to finding food for the teeming masses. The answer is Soylent Green.",6.938,1341,"['Science Fiction', 'Thriller', 'Crime', 'Mystery']",3.0
2010,Metropolis (1927),Drama|Sci-Fi,17136,19.0,"In a futuristic city sharply divided between the rich and the poor, the son of the city's mastermind meets a prophet who predicts the coming of a savior to mediate their differences.",8.1,2937,"['Drama', 'Science Fiction']",4.0
2014,Freaky Friday (1977),Children|Comedy|Fantasy,76054,16084.0,"School girl Annabel is hassled by her mother, and Mrs. Andrews is annoyed with her daughter, Annabel. They both think that the other has an easy life. On a normal Friday morning, both complain about each other and wish they could have the easy life of their daughter/mother for just one day and their wishes come true as a bit of magic puts Annabel in Mrs. Andrews' body and vice versa. They both have a Freaky Friday.",6.1,286,"['Fantasy', 'Comedy', 'Family']",4.0
2015,"Absent-Minded Professor, The (1961)",Children|Comedy|Fantasy,54594,17984.0,"Bumbling professor Ned Brainard accidentally invents flying rubber, or ""Flubber"", an incredible material that gains energy every time it strikes a hard surface. It allows for the invention of shoes that can allow jumps of amazing heights and enables a modified Model-T to fly. Unfortunately, no one is interested in the material except for Alonzo Hawk, a corrupt businessman who wants to steal the material for himself.",6.487,186,"['Comedy', 'Family', 'Science Fiction']",4.0
2018,Bambi (1942),Animation|Children|Drama,34492,3170.0,"Bambi's tale unfolds from season to season as the young prince of the forest learns about life, love, and friends.",7.011,5848,"['Animation', 'Drama', 'Family']",4.0
2020,Dangerous Liaisons (1988),Drama|Romance,94947,859.0,"In 18th century France, Marquise de Merteuil asks her ex-lover Vicomte de Valmont to seduce the future wife of another ex-lover of hers in return for one last night with her. Yet things don’t go as planned.",7.193,1218,"['Drama', 'Romance']",3.0
2022,"Last Temptation of Christ, The (1988)",Drama,95497,11051.0,"Jesus, a humble Judean carpenter beginning to see that he is the son of God, is drawn into revolutionary action against the Roman occupiers by Judas -- despite his protestations that love, not violence, is the path to salvation. The burden of being the savior of mankind torments Jesus throughout his life, leading him to doubt.",7.2,1128,['Drama'],2.0
2025,Lolita (1997),Drama|Romance,119558,9769.0,"Humbert Humbert is a middle-aged British novelist who is both appalled by and attracted to the vulgarity of American culture. When he comes to stay at the boarding house run by Charlotte Haze, he soon becomes obsessed with Lolita, the woman's teenaged daughter.",7.134,1880,"['Drama', 'Romance']",4.0
2026,Disturbing Behavior (1998),Horror|Thriller,134619,9424.0,"Steve Clark is a newcomer in the town of Cradle Bay, and he quickly realizes that there's something odd about his high school classmates. The clique known as the ""Blue Ribbons"" are the eerie embodiment of academic excellence and clean living. But, like the rest of the town, they're a little too perfect. When Steve's rebellious friend Gavin mysteriously joins their ranks, Steve searches for the truth with fellow misfit Rachel.",5.8,392,"['Mystery', 'Horror', 'Science Fiction']",5.0
