movieId,title,genres,imdbId,tmdbId,overview,tmdb_vote_average,tmdb_vote_count,tmdb_genres,rating
2858,American Beauty (1999),Drama|Romance,169547,14.0,"Lester Burnham, a depressed suburban father in a mid-life crisis, decides to turn his hectic life around after developing an infatuation with his daughter's attractive friend.",8.005,12564,['Drama'],5.0
2871,Deliverance (1972),Adventure|Drama|Thriller,68473,10669.0,"Intent on seeing the Cahulawassee River before it's turned into one huge lake, outdoor fanatic Lewis Medlock takes his friends on a river-rafting trip they'll never forget into the dangerous American back-country.",7.312,1701,"['Drama', 'Adventure', 'Thriller']",3.0
2881,Double Jeopardy (1999),Action|Crime|Drama|Thriller,150377,10398.0,"Libby Parsons, wrongly convicted for her husband Nick's murder, thinks he is still alive and wants to settle the score and find their son. As she has been tried for the crime, she cannot be re-prosecuted if she finds and kills Nick.",6.617,1397,"['Drama', 'Thriller', 'Mystery']",3.0
2890,Three Kings (1999),Action|Adventure|Comedy|Drama|War,120188,6415.0,"A group of American soldiers stationed in Iraq at the end of the Gulf War find a map they believe will take them to a huge cache of stolen Kuwaiti gold hidden near their base, and they embark on a secret mission that's destined to change everything.",6.652,2161,"['Action', 'Comedy', 'War']",3.0
2908,Boys Don't Cry (1999),Drama,171804,226.0,A young transgender man explores his gender identity and searches for love in rural Nebraska.,7.4,1386,"['Crime', 'Drama']",3.0
2916,Total Recall (1990),Action|Adventure|Sci-Fi|Thriller,100802,861.0,"Construction worker Douglas Quaid's obsession with the planet Mars leads him to visit Recall, a company that manufactures memories. When his memory implant goes wrong, Doug can no longer be sure what is and isn't reality.",7.3,6114,"['Action', 'Adventure', 'Science Fiction']",3.0
2947,Goldfinger (1964),Action|Adventure|Thriller,58150,658.0,"Special agent 007 comes face to face with one of the most notorious villains of all time, and now he must outwit and outgun the powerful tycoon to prevent him from cashing in on a devious scheme to raid Fort Knox -- and obliterate the world's economy.",7.355,3749,"['Adventure', 'Action', 'Thriller']",4.0
2953,Home Alone 2: Lost in New York (1992),Children|Comedy,104431,772.0,"Instead of flying to Florida with his folks, Kevin ends up alone in New York, where he gets a hotel room with his dad's credit card—despite problems from a clerk and meddling bellboy. But when Kevin runs into his old nemeses, the Wet Bandits, he's determined to foil their plans to rob a toy store on Christmas Eve.",6.767,10113,"['Comedy', 'Family', 'Adventure']",4.0
2959,Fight Club (1999),Action|Crime|Drama|Thriller,137523,550.0,"A ticking-time-bomb insomniac and a slippery soap salesman channel primal male aggression into a shocking new form of therapy. Their concept catches on, with underground ""fight clubs"" forming in every town, until an eccentric gets in the way and ignites an out-of-control spiral toward oblivion.",8.438,30800,"['Drama', 'Thriller']",5.0
2985,RoboCop (1987),Action|Crime|Drama|Sci-Fi|Thriller,93870,5548.0,"In a violent, near-apocalyptic Detroit, evil corporation Omni Consumer Products wins a contract from the city government to privatize the police force. To test their crime-eradicating cyborgs, the company leads street cop Alex Murphy into an armed confrontation with crime lord Boddicker so they can use his body to support their untested RoboCop prototype. But when RoboCop learns of the company's nefarious plans, he turns on his masters.",7.347,5436,"['Action', 'Thriller', 'Science Fiction']",3.0
2997,Being John Malkovich (1999),Comedy|Drama|Fantasy,120601,492.0,"One day at work, unsuccessful puppeteer Craig finds a portal into the head of actor John Malkovich. The portal soon becomes a passion for anybody who enters its mad and controlling world of overtaking another human body.",7.412,4570,"['Comedy', 'Drama', 'Fantasy']",3.0
3005,"Bone Collector, The (1999)",Thriller,145681,9481.0,"Lincoln Rhyme was the department's top homicide detective and leading expert in criminal forensics until an injury left him paralyzed, depressed, and incapable of working. But when a gruesome murder in Manhattan leaves detectives baffled, they call on Rhyme to help solve the mystery. Amelia Donaghy, a rookie cop whose quick thinking preserved a gruesome murder scene, is enlisted by Rhyme to be his on-the-scene forensics expert. With Amelia reluctantly acting as Rhyme's able-bodied go-between, the pair piece together cryptic clues the killer leaves behind at the scene of the crime, hoping to catch the grisly serial killer.",6.794,3687,"['Drama', 'Mystery', 'Thriller', 'Crime']",4.0
3006,"Insider, The (1999)",Drama|Thriller,140352,9008.0,A research chemist comes under personal and professional attack when he decides to appear in a 60 Minutes exposé on Big Tobacco.,7.5,1925,"['Drama', 'Thriller']",4.0
3020,Falling Down (1993),Action|Drama,106856,37094.0,An ordinary man frustrated with the various flaws he sees in society begins to psychotically and violently lash out against them.,7.385,3864,"['Crime', 'Drama', 'Thriller']",4.0
3052,Dogma (1999),Adventure|Comedy|Fantasy,120655,1832.0,An abortion clinic worker with a special heritage is called upon to save the existence of humanity from being negated by two renegade angels trying to exploit a loophole and reenter Heaven.,6.925,2651,"['Fantasy', 'Comedy', 'Adventure']",3.0
3082,"World Is Not Enough, The (1999)",Action|Adventure|Thriller,143145,36643.0,"Greed, revenge, world dominance and high-tech terrorism – it's all in a day's work for Bond, who's on a mission to protect a beautiful oil heiress from a notorious terrorist. In a race against time that culminates in a dramatic submarine showdown, Bond works to defuse the international power struggle that has the world's oil supply hanging in the balance.",6.286,3086,"['Adventure', 'Action', 'Thriller']",3.0
3101,Fatal Attraction (1987),Drama|Thriller,93010,10998.0,A married man's one-night stand comes back to haunt him when that lover begins to stalk him and his family.,6.844,1602,"['Thriller', 'Drama', 'Romance']",2.0
3107,Backdraft (1991),Action|Drama,101393,2924.0,Firemen brothers Brian and Stephen McCaffrey battle each other over past slights while trying to stop an arsonist with a diabolical agenda from torching Chicago.,6.668,1484,"['Drama', 'Thriller', 'Action', 'Crime']",5.0
3113,End of Days (1999),Action|Fantasy|Horror|Mystery|Thriller,146675,9946.0,"On 28 December 1999, the citizens of New York City are getting ready for the turn of the millennium. However, Satan decides to crash the party by coming to the city  and searching for his chosen bride — a 20-year-old woman named Christine York. The world will end, and the only hope lies within an atheist named Jericho Cane.",6.089,1943,"['Action', 'Horror', 'Fantasy']",3.0
3147,"Green Mile, The (1999)",Crime|Drama,120689,497.0,"A supernatural tale set on death row in a Southern prison, where gentle giant John Coffey possesses the mysterious power to heal people's ailments. When the cell block's head guard, Paul Edgecomb, recognizes Coffey's miraculous gift, he tries desperately to help stave off the condemned man's execution.",8.503,18396,"['Fantasy', 'Drama', 'Crime']",4.0
3148,"Cider House Rules, The (1999)",Drama,124315,1715.0,"Homer is an orphan who was never adopted, becoming the favorite of orphanage director Dr. Larch. Dr. Larch imparts his full medical knowledge on Homer, who becomes a skilled, albeit unlicensed, physician. But Homer yearns for a self-chosen life outside the orphanage. What will Homer learn about life and love in the cider house? What of the destiny that Dr. Larch has planned for him?",7.1,1220,['Drama'],3.0
3160,Magnolia (1999),Drama,175880,334.0,"On one random day in the San Fernando Valley, a dying father, a young wife, a male caretaker, a famous lost son, a police officer in love, a boy genius, an ex-boy genius, a game show host and an estranged daughter will each become part of a dazzling multiplicity of plots, but one story.",7.7,3762,['Drama'],4.0
3168,Easy Rider (1969),Adventure|Drama,64276,624.0,"Wyatt and Billy, two Harley-riding hippies, complete a drug deal in Southern California and decide to travel cross-country in search of spiritual truth.",7.063,2060,"['Adventure', 'Drama']",2.0
3174,Man on the Moon (1999),Comedy|Drama,125664,1850.0,"The story of the life and career of eccentric avant-garde comedian, Andy Kaufman.",7.247,1876,"['Comedy', 'Drama']",2.0
3176,"Talented Mr. Ripley, The (1999)",Drama|Mystery|Thriller,134119,1213.0,"Tom Ripley is a calculating young man who believes it's better to be a fake somebody than a real nobody. Opportunity knocks in the form of a wealthy U.S. shipbuilder who hires Tom to travel to Italy to bring back his playboy son, Dickie. Ripley worms his way into the idyllic lives of Dickie and his girlfriend, plunging into a daring scheme of duplicity, lies and murder.",7.196,3937,"['Thriller', 'Crime', 'Drama']",5.0
3210,Fast Times at Ridgemont High (1982),Comedy|Drama|Romance,83929,13342.0,"Based on the real-life adventures chronicled by Cameron Crowe, Fast Times follows a group of high school students growing up in Southern California. Stacy Hamilton and Mark Ratner are looking for love, and are helped along by their older classmates, Linda Barrett and Mike Damone. Jeff Spicoli, a perpetually stoned surfer faces-off with the resolute teacher, Mr. Hand. Hilarity and heartbreak ensue.",6.8,1302,['Comedy'],4.0
3238,Eye of the Beholder (1999),Thriller,120662,18681.0,"A reclusive surveillance expert is hired to spy on a mysterious blackmailer, who just may be a serial killer.",4.909,160,"['Mystery', 'Thriller']",3.0
3252,Scent of a Woman (1992),Drama,105323,9475.0,"Charlie Simms is a student at a private preparatory school who comes from a poor family. To earn the money for his flight home to Gresham, Oregon for Christmas, Charlie takes a job over Thanksgiving looking after retired U.S. Army officer Lieutenant Colonel Frank Slade, a cantankerous middle-aged man who lives with his niece and her family.",7.781,3676,['Drama'],3.0
3253,Wayne's World (1992),Comedy,105793,8872.0,"The adventures of two amiably aimless metal-head friends, Wayne and Garth. From Wayne's basement, the pair broadcast a talk-show called ""Wayne's World"" on local public access television. The show comes to the attention of a sleazy network executive who wants to produce a big-budget version of ""Wayne's World""—and he also wants Wayne's girlfriend, a rock singer named Cassandra. Wayne and Garth have to battle the executive not only to save their show, but also Cassandra.",6.693,2351,['Comedy'],3.0
3255,"League of Their Own, A (1992)",Comedy|Drama,104694,11287.0,"As America's stock of athletic young men is depleted during World War II, a professional all-female baseball league springs up in the Midwest, funded by publicity-hungry candy maker Walter Harvey. Competitive sisters Dottie Hinson and Kit Keller spar with each other, scout Ernie Capadino and grumpy has-been coach Jimmy Dugan on their way to fame.",7.2,1464,"['Comedy', 'Drama']",3.0
3273,Scream 3 (2000),Comedy|Horror|Mystery|Thriller,134084,4234.0,"While Sidney Prescott and her friends visit the Hollywood set of Stab 3, the third film based on the Woodsboro murders, another Ghostface killer rises to terrorize them.",5.995,3807,"['Horror', 'Mystery']",3.0
3275,"Boondock Saints, The (2000)",Action|Crime|Drama|Thriller,144117,8374.0,"Tired of the crime overrunning the streets of Boston, Irish Catholic twin brothers Conner and Murphy are inspired by their faith to cleanse their hometown of evil with their own brand of zealous vigilante justice. As they hunt down and kill one notorious gangster after another, they become controversial folk heroes in the community. But Paul Smecker, an eccentric FBI agent, is fast closing in on their blood-soaked trail.",7.251,2550,"['Action', 'Thriller', 'Crime']",3.0
3300,Pitch Black (2000),Horror|Sci-Fi|Thriller,134847,2787.0,"When their ship crash-lands on a remote planet, the marooned passengers soon learn that escaped convict Riddick isn't the only thing they have to fear. Deadly creatures lurk in the shadows, waiting to attack in the dark, and the planet is rapidly plunging into the utter blackness of a total eclipse. With the body count rising, the doomed survivors are forced to turn to Riddick with his eerie eyes to guide them through the darkness to safety. With time running out, there's only one rule: Stay in the light.",6.851,4599,"['Thriller', 'Science Fiction', 'Action']",3.0
3301,"Whole Nine Yards, The (2000)",Comedy|Crime,190138,2069.0,"After a mobster agrees to cooperate with an FBI investigation in order to stay out of prison, he's relocated by the authorities to a life of suburban anonymity as part of a witness protection program. It's not long before a couple of his new neighbours figure out his true identity and come knocking to see if he'd be up for one more hit—suburban style.",6.465,1970,"['Comedy', 'Crime']",3.0
3317,Wonder Boys (2000),Comedy|Drama,185014,11004.0,Grady is a 50-ish English professor who hasn't had a thing published in years—not since he wrote his award winning 'Great American Novel' 7 years ago. This weekend proves even worse than he could imagine as he finds himself reeling from one misadventure to another in the company of a new wonder boy author.,6.84,620,"['Comedy', 'Drama']",1.0
3362,Dog Day Afternoon (1975),Crime|Drama,72890,968.0,"Based on the true story of would-be Brooklyn bank robbers John Wojtowicz and Salvatore Naturile. Sonny and Sal attempt a bank heist which quickly turns sour and escalates into a hostage situation and stand-off with the police. As Sonny's motives for the robbery are slowly revealed and things become more complicated, the heist turns into a media circus.",7.8,3148,"['Crime', 'Drama', 'Thriller']",2.0
3408,Erin Brockovich (2000),Drama,195685,462.0,"A twice-divorced mother of three who sees an injustice, takes on the bad guy and wins -- with a little help from her push-up bra. Erin goes to work for an attorney and comes across medical records describing illnesses clustered in one nearby town. She starts investigating and soon exposes a monumental cover-up.",7.442,3434,['Drama'],3.0
3409,Final Destination (2000),Drama|Thriller,195714,9532.0,"After a teenager has a terrifying vision of him and his friends dying in a plane crash, he prevents the accident only to have Death hunt them down, one by one.",6.626,6322,['Horror'],3.0
3424,Do the Right Thing (1989),Drama,97216,925.0,"Salvatore ""Sal"" Fragione is the Italian owner of a pizzeria in Brooklyn. A neighborhood local, Buggin' Out, becomes upset when he sees that the pizzeria's Wall of Fame exhibits only Italian actors. Buggin' Out believes a pizzeria in a black neighborhood should showcase black actors, but Sal disagrees. The wall becomes a symbol of racism and hate to Buggin' Out and to other people in the neighborhood, and tensions rise.",7.77,1889,['Drama'],3.0
3438,Teenage Mutant Ninja Turtles (1990),Action|Children|Comedy|Fantasy|Sci-Fi,100758,1498.0,"A quartet of humanoid turtles, trained by their mentor in ninjitsu, must learn to work together to face the menace of Shredder and the Foot Clan.",6.7,1876,"['Science Fiction', 'Action', 'Adventure', 'Comedy', 'Family']",4.0
3452,Romeo Must Die (2000),Action|Crime|Romance|Thriller,165929,2085.0,"Two warring gang families (one African-American, the other Chinese) maneuver for bragging rights to the Oakland, California, docks. Hang Sing and Trish O'Day uncover a trail of deceit that leaves most of the warring factions dead … or worse!",6.275,1253,"['Action', 'Crime', 'Thriller']",3.0
3499,Misery (1990),Drama|Horror|Thriller,100157,1700.0,"After an accident, acclaimed novelist Paul Sheldon is rescued by a nurse who claims to be his biggest fan.  Her obsession takes a dark turn when she holds him captive in her remote Colorado home and forces him to write back to life the popular literary character he killed off.",7.7,4913,"['Drama', 'Thriller']",3.0
3510,Frequency (2000),Drama|Thriller,186151,10559.0,"When a rare phenomenon gives police officer John Sullivan the chance to speak to his father, 30 years in the past, he takes the opportunity to prevent his dad's tragic death.  After his actions inadvertently give rise to a series of brutal murders he and his father must find a way to fix the consequences of altering time.",7.259,1885,"['Science Fiction', 'Thriller']",3.0
3527,Predator (1987),Action|Sci-Fi|Thriller,93773,106.0,A team of elite commandos on a secret mission in a Central American jungle come to find themselves hunted by an extraterrestrial warrior.,7.54,8555,"['Science Fiction', 'Action', 'Adventure', 'Thriller']",5.0
3535,American Psycho (2000),Crime|Horror|Mystery|Thriller,144084,1359.0,"A wealthy New York investment banking executive hides his alternate psychopathic ego from his co-workers and friends as he escalates deeper into his illogical, gratuitous fantasies.",7.408,11615,"['Thriller', 'Drama', 'Crime']",5.0
3555,U-571 (2000),Action|Thriller|War,141926,3536.0,"In the midst of World War II, the battle under the sea rages and the Nazis have the upper hand as the Allies are unable to crack their war codes. However, after a wrecked U-boat sends out an SOS signal, the Allies realise this is their chance to seize the 'enigma coding machine'.",6.516,1286,"['War', 'Action', 'Adventure']",4.0
3556,"Virgin Suicides, The (1999)",Drama|Romance,159097,1443.0,"A group of male friends become obsessed with five mysterious sisters who are sheltered by their strict, religious parents.",7.12,3443,"['Drama', 'Romance']",3.0
3578,Gladiator (2000),Action|Adventure|Drama,172495,98.0,"After the death of Emperor Marcus Aurelius, his devious son takes power and demotes Maximus, one of Rome's most capable generals who Marcus preferred. Eventually, Maximus is forced to become a gladiator and battle to the death against other men for the amusement of paying audiences.",8.22,20082,"['Action', 'Drama', 'Adventure']",3.0
3617,Road Trip (2000),Comedy,215129,9285.0,"After an Ithaca College student films his one-night stand with a beautiful sorority girl, he discovers one of his friends has accidentally mailed the homemade sex tape to his girlfriend in Austin. In a frenzy, he must borrow a car and hit the road in a desperate bid to intercept the tape.",6.221,2046,"['Comedy', 'Adventure']",3.0
3623,Mission: Impossible II (2000),Action|Adventure|Thriller,120755,955.0,"With computer genius Luther Stickell at his side and a beautiful thief on his mind, agent Ethan Hunt races across Australia and Spain to stop a former IMF agent from unleashing a genetically engineered biological weapon called Chimera. This mission, should Hunt choose to accept it, plunges him into the center of an international crisis of terrifying magnitude.",6.132,7205,"['Adventure', 'Action', 'Thriller']",3.0
3654,"Guns of Navarone, The (1961)",Action|Adventure|Drama|War,54953,10911.0,"A team of allied saboteurs are assigned an impossible mission: infiltrate an impregnable Nazi-held island and destroy the two enormous long-range field guns that prevent the rescue of 2,000 trapped British soldiers.",7.307,823,"['War', 'Adventure', 'Thriller', 'Action']",3.0
3697,Predator 2 (1990),Action|Sci-Fi|Thriller,100403,169.0,A police chief in the war-torn streets of Los Angeles discovers that an extraterrestrial creature is hunting down residents - and that he is the next target.,6.29,3553,"['Science Fiction', 'Action', 'Thriller']",4.0
3698,"Running Man, The (1987)",Action|Sci-Fi,93894,865.0,"By 2017, the global economy has collapsed and U.S. society has become a totalitarian police state, censoring all cultural activity. The government pacifies the populace by broadcasting a number of game shows in which convicted criminals fight for their lives, including the gladiator-style The Running Man, hosted by the ruthless Damon Killian, where “runners” attempt to evade “stalkers” and certain death for a chance to be pardoned and set free.",6.539,2555,"['Action', 'Thriller', 'Science Fiction']",3.0
3730,"Conversation, The (1974)",Drama|Mystery,71360,592.0,"A paranoid, secretive surveillance expert has a crisis of conscience when he suspects that the couple he is spying on will be murdered.",7.5,1902,"['Crime', 'Drama', 'Mystery']",3.0
3752,"Me, Myself & Irene (2000)",Adventure|Comedy,183505,2123.0,"Rhode Island State Trooper Charlie Baileygates has a multiple personality disorder. One personality is crazy and aggressive, while the other is more friendly and laid back. Both of these personalities fall in love with the same woman named Irene after Charlie loses his medication.",6.6,4048,['Comedy'],3.0
3755,"Perfect Storm, The (2000)",Drama|Thriller,177971,2133.0,"In October 1991, a confluence of weather conditions combined to form a killer storm in the North Atlantic. Caught in the storm was the sword-fishing boat Andrea Gail.",6.486,2431,"['Drama', 'Adventure', 'Action']",4.0
3798,What Lies Beneath (2000),Drama|Horror|Mystery,161081,2655.0,"When Claire Spencer starts hearing ghostly voices and seeing spooky images, she wonders if an otherworldly spirit is trying to contact her. All the while, her husband tries to reassure her by telling her it's all in her head. But as Claire investigates, she discovers that the man she loves might know more than he's letting on.",6.441,1919,"['Drama', 'Horror', 'Mystery', 'Thriller']",3.0
3826,Hollow Man (2000),Horror|Sci-Fi|Thriller,164052,9383.0,"Cocky researcher Sebastian Caine is working on a project to make living creatures invisible. Determined to achieve the ultimate breakthrough, Caine pushes his team to move to the next phase — using himself as the subject. The test is a success, but when the process can't be reversed and Caine seems doomed to future without flesh, he starts to turn increasingly dangerous.",6.0,2638,"['Action', 'Science Fiction', 'Thriller']",3.0
3863,"Cell, The (2000)",Drama|Horror|Thriller,209958,8843.0,A psychotherapist journeys inside a comatose serial killer in the hopes of saving his latest victim.,6.278,1606,"['Horror', 'Science Fiction', 'Thriller']",4.0
3868,"Naked Gun: From the Files of Police Squad!, The (1988)",Action|Comedy|Crime|Romance,95705,37136.0,"When the bumbling Lieutenant Frank Drebin investigates events following the shooting of his partner, he stumbles upon an attempt to assassinate Queen Elizabeth II.",7.3,4136,"['Comedy', 'Crime']",4.0
3897,Almost Famous (2000),Drama,181875,786.0,"In 1973, 15-year-old William Miller's unabashed love of music and aspiration to become a rock journalist lands him an assignment from Rolling Stone magazine to interview and tour with the up-and-coming band, Stillwater.",7.503,2931,"['Drama', 'Music']",3.0
3948,Meet the Parents (2000),Comedy,212338,1597.0,"Greg Focker is ready to marry his girlfriend, Pam, but before he pops the question, he must win over her formidable father, humorless former CIA agent Jack Byrnes, at the wedding of Pam's sister. As Greg bends over backward to make a good impression, his visit to the Byrnes home turns into a hilarious series of disasters, and everything that can go wrong does, all under Jack's critical, hawklike gaze.",6.684,6139,"['Comedy', 'Romance']",4.0
3949,Requiem for a Dream (2000),Drama,180093,641.0,The drug-induced utopias of four Coney Island residents are shattered when their addictions run deep.,8.015,10496,"['Crime', 'Drama']",4.0
3969,Pay It Forward (2000),Drama,223897,10647.0,"Like some other kids, 12-year-old Trevor McKinney believed in the goodness of human nature. Like many other kids, he was determined to change the world for the better. Unlike most other kids, he succeeded.",7.36,1895,['Drama'],4.0
3994,Unbreakable (2000),Drama|Sci-Fi,217869,9741.0,"An ordinary man makes an extraordinary discovery when a train accident leaves his fellow passengers dead — and him unscathed. The answer to this mystery could lie with the mysterious Elijah Price, a man who suffers from a disease that renders his bones as fragile as glass.",7.145,9601,"['Thriller', 'Drama', 'Mystery']",3.0
3996,"Crouching Tiger, Hidden Dragon (Wo hu cang long) (2000)",Action|Drama|Romance,190332,146.0,"Two warriors in pursuit of a stolen sword and a notorious fugitive are led to an impetuous, physically-skilled, teenage nobleman's daughter, who is at a crossroads in her life.",7.433,3381,"['Adventure', 'Drama', 'Action', 'Romance']",4.0
3999,Vertical Limit (2000),Action|Adventure,190865,11678.0,"Trapped near the summit of K2, the world's second-highest mountain, Annie Garrett radios to base camp for help. Brother Peter hears Annie's message and assembles a team to save her and her group before they succumb to K2's unforgiving elements. But, as Annie lays injured in an icy cavern, the rescuers face several terrifying events that could end the rescue attempt -- and their lives.",6.01,1074,"['Adventure', 'Action', 'Thriller']",3.0
4007,Wall Street (1987),Drama,94291,10673.0,"A young and impatient stockbroker is willing to do anything to get to the top, including trading on illegal inside information taken through a ruthless and greedy corporate raider, whom takes the youth under his wing.",7.163,2150,"['Crime', 'Drama']",3.0
4011,Snatch (2000),Comedy|Crime|Thriller,208092,107.0,"Unscrupulous boxing promoters, violent bookies, a Russian gangster, incompetent amateur robbers, and supposedly Jewish jewellers fight to track down a priceless stolen diamond.",7.817,9488,"['Crime', 'Comedy']",4.0
