movieId,title,genres,imdbId,tmdbId,overview,tmdb_vote_average,tmdb_vote_count,tmdb_genres,rating
913,"Maltese Falcon, The (1941)",Film-Noir|Mystery,33870,963.0,"A private detective takes on a case that involves him with three eccentric criminals, a beautiful liar, and their quest for a priceless statuette.",7.7,1781,"['Mystery', 'Crime', 'Thriller']",3.0
914,My Fair Lady (1964),Comedy|Drama|Musical|Romance,58385,11113.0,A snobbish phonetics professor agrees to a wager that he can take a flower girl and make her presentable in high society.,7.5,1370,"['Music', 'Comedy', 'Romance']",4.0
915,Sabrina (1954),Comedy|Romance,47437,6620.0,"Linus and David Larrabee are the two sons of a very wealthy family. Linus is all work – busily running the family corporate empire, he has no time for a wife and family. David is all play – technically he is employed by the family business, but never shows up for work, spends all his time entertaining, and has been married and divorced three times. Meanwhile, Sabrina Fairchild is the young, shy, and awkward daughter of the household chauffeur, who goes away to Paris for two years, and returns to capture David's attention, while falling in love with Linus.",7.508,1300,"['Comedy', 'Romance', 'Drama']",5.0
918,Meet Me in St. Louis (1944),Musical,37059,909.0,Young love and childish fears highlight a year in the life of a turn-of-the-century family up to the 1904 St. Louis World's Fair.,7.004,402,"['Comedy', 'Drama', 'Romance', 'Family']",4.0
919,"Wizard of Oz, The (1939)",Adventure|Children|Fantasy|Musical,32138,630.0,"Young Dorothy finds herself in a magical world where she makes friends with a lion, a scarecrow and a tin man as they make their way along the yellow brick road to talk with the Wizard and ask for the things they miss most in their lives. The Wicked Witch of the West is the only thing that could stop them.",7.592,5842,"['Adventure', 'Fantasy', 'Family']",5.0
922,Sunset Blvd. (a.k.a. Sunset Boulevard) (1950),Drama|Film-Noir|Romance,43014,599.0,A hack screenwriter writes a screenplay for a former silent film star who has faded into Hollywood obscurity.,8.292,2753,['Drama'],5.0
923,Citizen Kane (1941),Drama|Mystery,33467,15.0,"Newspaper magnate Charles Foster Kane is taken from his mother as a boy and made the ward of a rich industrialist. As a result, every well-meaning, tyrannical or self-destructive move he makes for the rest of his life appears in some way to be a reaction to that deeply wounding event.",8.001,5764,"['Mystery', 'Drama']",4.0
924,2001: A Space Odyssey (1968),Adventure|Drama|Sci-Fi,62622,62.0,"Humanity finds a mysterious object buried beneath the lunar surface and sets off to find its origins with the help of HAL 9000, the world's most advanced super computer.",8.064,12051,"['Science Fiction', 'Mystery', 'Adventure']",4.0
926,All About Eve (1950),Drama,42192,705.0,"From the moment she glimpses her idol at the stage door, Eve Harrington is determined to take the reins of power away from the great actress Margo Channing. Eve maneuvers her way into Margo's Broadway role, becomes a sensation and even causes turmoil in the lives of Margo's director boyfriend, her playwright and his wife. Only the cynical drama critic sees through Eve, admiring her audacity and perfect pattern of deceit.",8.079,1608,['Drama'],3.0
927,"Women, The (1939)",Comedy,32143,22490.0,A happily married woman lets her catty friends talk her into divorce when her husband strays.,7.1,165,"['Comedy', 'Drama']",5.0
928,Rebecca (1940),Drama|Mystery|Romance|Thriller,32976,223.0,"Story of a young woman who marries a fascinating widower only to find out that she must live in the shadow of his former wife, Rebecca, who died mysteriously several years earlier. The young wife must come to grips with the terrible secret of her handsome, cold husband, Max De Winter. She must also deal with the jealous, obsessed Mrs. Danvers, the housekeeper, who will not accept her as the mistress of the house.",7.897,1873,"['Mystery', 'Romance', 'Thriller']",5.0
930,Notorious (1946),Film-Noir|Romance|Thriller,38787,303.0,"In order to help bring Nazis to justice, U.S. government agent T.R. Devlin recruits Alicia Huberman, the American daughter of a convicted German war criminal, as a spy. As they begin to fall for one another, Alicia is instructed to win the affections of Alexander Sebastian, a Nazi hiding out in Brazil. When Sebastian becomes serious about his relationship with Alicia, the stakes get higher, and Devlin must watch her slip further undercover.",7.743,1667,"['Thriller', 'Romance', 'Mystery']",4.0
938,Gigi (1958),Musical,51658,17281.0,"A home, a motorcar, servants, the latest fashions: the most eligible and most finicky bachelor in Paris offers them all to Gigi. But she, who's gone from girlish gawkishness to cultured glamour before our eyes, yearns for that wonderful something money can't buy.",6.2,328,"['Comedy', 'Romance']",2.0
942,Laura (1944),Crime|Film-Noir|Mystery,37008,1939.0,A police detective falls in love with the woman whose murder he's investigating.,7.63,856,"['Drama', 'Mystery']",3.0
953,It's a Wonderful Life (1946),Children|Drama|Fantasy|Romance,38650,1585.0,"A holiday favourite for generations...  George Bailey has spent his entire life giving to the people of Bedford Falls.  All that prevents rich skinflint Mr. Potter from taking over the entire town is George's modest building and loan company.  But on Christmas Eve the business's $8,000 is lost and George's troubles begin.",8.273,4602,"['Drama', 'Family', 'Fantasy']",3.0
955,Bringing Up Baby (1938),Comedy|Romance,29947,900.0,"David Huxley is waiting to get a bone he needs for his museum collection. Through a series of strange circumstances, he meets Susan Vance, and the duo have a series of misadventures which include a leopard called Baby.",7.5,1022,"['Comedy', 'Romance']",4.0
971,Cat on a Hot Tin Roof (1958),Drama,51459,261.0,"An alcoholic ex-football player drinks his days away, having failed to come to terms with his sexuality and his real feelings for his football buddy who died after an ambiguous accident. His wife is crucified by her desperation to make him desire her: but he resists the affections of his wife. His reunion with his father—who is dying of cancer—jogs a host of memories and revelations for both father and son.",7.654,787,['Drama'],4.0
982,Picnic (1955),Drama,48491,39940.0,"Labor Day in a small Kansas farm town. Hal, a burly and resolute drifter, jumps off a dusty freight train car with the purpose of visiting Alan, a former college classmate and son of the richest man in town.",6.37,104,"['Drama', 'Romance']",5.0
988,Grace of My Heart (1996),Comedy|Drama,116442,58985.0,"Philadelphia teenager Edna Buxton wins a talent contest during the early rock 'n' roll era, changes her name to Denise Waverly and moves to New York City to make it big. Though she flops as a recording artist, fast-talking record producer Joel Millner recognizes her songwriting talent and teams her with struggling songsmith Howard Caszatt.",6.1,59,"['Comedy', 'Drama', 'Music']",3.0
991,Michael Collins (1996),Drama,117039,1770.0,"Michael Collins plays a crucial role in the establishment of the Irish Free State in the 1920s, but becomes vilified by those hoping to create a completely independent Irish republic.",6.885,491,"['War', 'Drama', 'Thriller', 'History']",2.0
994,Big Night (1996),Comedy|Drama,115678,18203.0,"Primo and Secondo, two immigrant brothers, pin their hopes on a banquet honoring Louis Prima to save their struggling restaurant.",7.0,250,"['Drama', 'Romance', 'Comedy']",4.0
998,Set It Off (1996),Action|Crime,117603,9400.0,"Four inner-city Black women, determined to end their constant struggle, decide to live by one rule — get what you want or die trying. So the four women take back their lives and take out some banks in the process.",7.2,375,"['Crime', 'Drama', 'Thriller']",2.0
1009,Escape to Witch Mountain (1975),Adventure|Children|Fantasy,72951,14821.0,"Tia and Tony are two orphaned youngsters with extraordinary powers. Lucas Deranian poses as their uncle in order to get the kids into the clutches of Deranian's megalomaniacal boss, evil millionaire Aristotle Bolt, who wants to exploit them. Jason, a cynical widower, helps Tia and Tony escape to witch mountain, while at the same time Tia and Tony help Jason escape the pain of the loss of his wife.",6.4,220,"['Adventure', 'Fantasy', 'Science Fiction', 'Family']",4.0
1010,"Love Bug, The (1969)",Children|Comedy,64603,14136.0,"Down-on-his-luck race car driver Jim Douglas teams up with a little VW Bug that has a mind of its own, not realizing Herbie's worth until a sneaky rival plots to steal him.",6.6,619,"['Comedy', 'Family', 'Fantasy']",2.0
1012,Old Yeller (1957),Children|Drama,50798,22660.0,"Young Travis Coates is left to take care of the family ranch with his mother and younger brother while his father goes off on a cattle drive in the 1860s. When a yellow mongrel comes for an uninvited stay with the family, Travis reluctantly adopts the dog.",6.909,285,"['Adventure', 'Drama', 'Family', 'Western']",4.0
1013,"Parent Trap, The (1961)",Children|Comedy|Romance,55277,19186.0,"Two identical twin sisters, separated at birth by their parents' divorce, are reunited years later at a summer camp, where they scheme to bring their parents back together. The girls, one of whom has been living with their mother and the other with their father, switch places after camp and go to work on their plan, the first objective being to scare off a gold-digger pursuing their father.",7.038,407,"['Comedy', 'Family', 'Romance']",4.0
1016,"Shaggy Dog, The (1959)",Children|Comedy,53271,15944.0,"Through an ancient spell, a boy changes into a sheepdog and back again. It seems to happen at inopportune times and the spell can only be broken by an act of bravery....",6.1,94,"['Comedy', 'Family', 'Fantasy']",5.0
1018,That Darn Cat! (1965),Children|Comedy|Mystery,59793,20723.0,"A young woman suspects foul play when her cat comes home wearing a wristwatch. Convincing the FBI, though, and catching the bad guys is tougher than she imagined.",6.6,180,"['Family', 'Comedy', 'Crime']",4.0
1028,Mary Poppins (1964),Children|Comedy|Fantasy|Musical,58331,433.0,"Mr Banks is looking for a nanny for his two mischievous children and comes across Mary Poppins, an angelic nanny. She not only brings a change in their lives but also spreads happiness.",7.559,4835,"['Comedy', 'Family', 'Fantasy']",5.0
1031,Bedknobs and Broomsticks (1971),Adventure|Children|Musical,66817,12335.0,Three children evacuated from London during World War II are forced to stay with an eccentric spinster. The children's initial fears disappear when they find out she is in fact a trainee witch.,7.029,994,"['Adventure', 'Fantasy', 'Comedy', 'Family', 'Music', 'Animation']",4.0
1035,"Sound of Music, The (1965)",Musical|Romance,59742,15121.0,"In the years before the Second World War, a tomboyish postulant at an Austrian abbey is hired as a governess in the home of a widowed naval captain with seven children, and brings a new love of life and music into the home.",7.725,3448,"['Drama', 'Family', 'Music', 'Romance']",5.0
1041,Secrets & Lies (1996),Drama,117589,11159.0,"After her adoptive mother dies, Hortense, a successful black optometrist, seeks out her birth mother. She's shocked when her research leads her to Cynthia, a working class white woman.",7.555,687,['Drama'],5.0
1044,Surviving Picasso (1996),Drama,117791,41843.0,"The passionate Merchant-Ivory drama tells the story of Francoise Gilot, the only lover of Pablo Picasso who was strong enough to withstand his ferocious cruelty and move on with her life.",5.8,97,"['Drama', 'Romance']",3.0
1051,Trees Lounge (1996),Drama,117958,27845.0,"Tommy has lost his job, his love and his life. He lives in a small apartment above the Trees Lounge, a bar which he frequents along with a few other regulars without lives. He gets a job driving an ice cream truck and ends up getting involved with the seventeen-year-old niece of his ex-girlfriend. This gets him into serious trouble with her father.",6.9,198,"['Drama', 'Comedy']",3.0
1054,Get on the Bus (1996),Drama,116404,49471.0,"Several Black men take a cross-country bus trip to attend the Million Man March in Washington, DC in 1995. On the bus are an eclectic set of characters including a laid-off aircraft worker, a man whose at-risk son is handcuffed to him, a black Republican, a former gangsta, a Hollywood actor, a cop who is of mixed racial background, and a white bus driver. All make the trek discussing issues surrounding the march, including manhood, religion, politics, and race.",6.4,69,"['Drama', 'Adventure']",5.0
1056,Jude (1996),Drama,116722,25147.0,"In late 19th-century England, Jude aspires to be an academic, but is hobbled by his blue-collar background. Instead, he works as a stonemason and is trapped in an unloving marriage to a farmer's daughter named Arabella. But when his wife leaves him, Jude sees an opportunity to improve himself. He moves to the city and begins an affair with his married cousin, Sue, courting tragedy every step of the way.",6.3,132,"['Drama', 'Romance']",2.0
1057,Everyone Says I Love You (1996),Comedy|Musical|Romance,116242,9716.0,A New York girl sets her father up with a beautiful woman in a shaky marriage while her half sister gets engaged.,6.437,687,"['Comedy', 'Romance']",4.0
1073,Willy Wonka & the Chocolate Factory (1971),Children|Comedy|Fantasy|Musical,67992,252.0,"When eccentric candy man Willy Wonka promises a lifetime supply of sweets and a tour of his chocolate factory to five lucky kids, penniless Charlie Bucket seeks the golden ticket that will make him a winner.",7.5,3768,"['Family', 'Fantasy', 'Comedy']",5.0
1077,Sleeper (1973),Comedy|Sci-Fi,70707,11561.0,"Miles Monroe, a clarinet-playing health food store proprietor, is revived out of cryostasis 200 years into a future world in order to help rebels fight an oppressive government regime.",6.89,806,"['Comedy', 'Science Fiction']",4.0
1078,Bananas (1971),Comedy|War,66808,11302.0,"When a bumbling New Yorker is dumped by his activist girlfriend, he travels to a tiny Latin American nation and becomes involved in its latest rebellion.",6.7,778,['Comedy'],3.0
1079,"Fish Called Wanda, A (1988)",Comedy|Crime,95159,623.0,"While a diamond advocate attempts to steal a collection of diamonds, troubles arise when he realises he’s not the only one after the collection.",7.204,2301,"['Comedy', 'Crime']",3.0
1080,Monty Python's Life of Brian (1979),Comedy,79470,583.0,"Brian Cohen is an average young Jewish man, but through a series of ridiculous events, he gains a reputation as the Messiah. When he's not dodging his followers or being scolded by his shrill mother, the hapless Brian has to contend with the pompous Pontius Pilate and acronym-obsessed members of a separatist movement. Rife with Monty Python's signature absurdity, the tale finds Brian's life paralleling Biblical lore, albeit with many more laughs.",7.759,4662,['Comedy'],3.0
1081,Victor/Victoria (1982),Comedy|Musical|Romance,84865,12614.0,"A struggling female soprano finds work playing a male female impersonator, but it complicates her personal life.",7.285,428,"['Music', 'Comedy', 'Romance']",3.0
1084,Bonnie and Clyde (1967),Crime|Drama,61418,475.0,"In the 1930s, bored waitress Bonnie Parker falls in love with an ex-con named Clyde Barrow and together they start a violent crime spree through the country, stealing cars and robbing banks.",7.486,1705,"['Crime', 'Drama']",5.0
1089,Reservoir Dogs (1992),Crime|Mystery|Thriller,105236,500.0,"A botched robbery indicates a police informant, and the pressure mounts in the aftermath at a warehouse. Crime begets violence as the survivors -- veteran Mr. White, newcomer Mr. Orange, psychopathic parolee Mr. Blonde, bickering weasel Mr. Pink and Nice Guy Eddie -- unravel.",8.118,14861,"['Crime', 'Thriller']",2.0
1090,Platoon (1986),Drama|War,91763,792.0,"As a young and naive recruit in Vietnam, Chris Taylor faces a moral crisis when confronted with the horrors of war and the duality of man.",7.746,4828,"['Drama', 'War', 'Action']",4.0
1093,"Doors, The (1991)",Drama,101761,10537.0,"The story of the famous and influential 1960s rock band and its lead singer and composer, Jim Morrison.",7.117,1513,"['Music', 'Drama', 'History']",5.0
1094,"Crying Game, The (1992)",Drama|Romance|Thriller,104036,11386.0,"Irish Republican Army member Fergus forms an unexpected bond with Jody, a kidnapped British soldier in his custody, despite the warnings of fellow IRA members Jude and Maguire. Jody makes Fergus promise he'll visit his girlfriend, Dil, in London, and when Fergus flees to the city, he seeks her out. Hounded by his former IRA colleagues, he finds himself increasingly drawn to the enigmatic, and surprising, Dil.",6.847,797,"['Crime', 'Drama', 'Thriller']",3.0
1095,Glengarry Glen Ross (1992),Drama,104348,9504.0,"Times are tough at Premiere Properties. Shelley ""the machine"" Levene and Dave Moss are veteran salesmen, but only Ricky Roma is on a hot streak. The new Glengarry sales leads could turn everything around, but the front office is holding them back until these ""losers"" prove themselves. Then someone decides to take matters into his own hands, stealing the Glengarry leads and leaving everyone wondering who did it.",7.3,1492,"['Crime', 'Drama', 'Mystery']",4.0
1096,Sophie's Choice (1982),Drama,84707,15764.0,"Stingo, a young writer, moves to Brooklyn in 1947 to begin work on his first novel. As he becomes friendly with Sophie and her lover Nathan, he learns that she is a Holocaust survivor. Flashbacks reveal her harrowing story, from pre-war prosperity to Auschwitz. In the present, Sophie and Nathan's relationship increasingly unravels as Stingo grows closer to Sophie and Nathan's fragile mental state becomes ever more apparent.",7.339,893,"['Drama', 'Romance', 'War']",5.0
1103,Rebel Without a Cause (1955),Drama,48545,221.0,"After moving to a new town, troublemaking teen Jim Stark is supposed to have a clean slate, although being the new kid in town brings its own problems. While searching for some stability, Stark forms a bond with a disturbed classmate, Plato, and falls for local girl Judy. However, Judy is the girlfriend of neighborhood tough, Buzz. When Buzz violently confronts Jim and challenges him to a drag race, the new kid's real troubles begin.",7.516,1685,['Drama'],5.0
1104,"Streetcar Named Desire, A (1951)",Drama,44081,702.0,"A disturbed, aging Southern belle moves in with her sister for solace — but being face-to-face with her brutish brother-in-law accelerates her downward spiral.",7.616,1413,"['Drama', 'Thriller']",5.0
1113,"Associate, The (1996)",Comedy,115580,11112.0,Laurel Ayres is a businesswoman trying to make it but unfortunately she works at a investment firm where she does all the work but all the senior investors like Frank Peterson grab all the credit. She then leaves and starts her own firm. While trying to find clients Laurel pretends that she has a male partner named Robert Cutty. And when she starts to do well all of her clients wants to meet Cutty which is difficult since he doesn't exist.,6.252,220,['Comedy'],3.0
1120,"People vs. Larry Flynt, The (1996)",Comedy|Drama,117318,1630.0,"Larry Flynt is the hedonistically obnoxious, but indomitable, publisher of Hustler magazine. The film recounts his struggle to make an honest living publishing his girlie magazine and how it changes into a battle to protect the freedom of speech for all people.",6.961,1170,['Drama'],5.0
1124,On Golden Pond (1981),Drama,82846,11816.0,"For Norman and Ethel Thayer, this summer on golden pond is filled with conflict and resolution. When their daughter Chelsea arrives, the family is forced to renew the bonds of love and overcome the generational friction that has existed for years.",7.254,486,"['Drama', 'Romance']",5.0
1125,"Return of the Pink Panther, The (1975)",Comedy|Crime,72081,11843.0,The famous Pink Panther jewel has once again been stolen and Inspector Clouseau is called in to catch the thief. The Inspector is convinced that 'The Phantom' has returned and utilises all of his resources – himself and his Asian manservant – to reveal the identity of 'The Phantom'.,6.8,634,"['Comedy', 'Crime', 'Mystery']",4.0
1131,Jean de Florette (1986),Drama|Mystery,91288,4480.0,"In a rural French village, an old man and his only remaining relative cast their covetous eyes on an adjoining vacant property. They need its spring water for growing their flowers, and are dismayed to hear that the man who has inherited it is moving in. They block up the spring and watch as their new neighbour tries to keep his crops watered from wells far afield through the hot summer. Though they see his desperate efforts are breaking his health and his wife and daughter's hearts, they think only of getting the water.",7.693,589,['Drama'],5.0
1132,Manon of the Spring (Manon des sources) (1986),Drama,91480,4481.0,"In this, the sequel to Jean de Florette, Manon has grown into a beautiful young shepherdess living in the idyllic Provencal countryside. She plots vengeance on the men who greedily conspired to acquire her father's land years earlier.",7.584,539,['Drama'],5.0
1135,Private Benjamin (1980),Comedy,81375,10765.0,A sheltered young high society woman joins the US Army on a whim and finds herself in a more difficult situation than she ever expected.,5.971,397,['Comedy'],4.0
1136,Monty Python and the Holy Grail (1975),Adventure|Comedy|Fantasy,71853,762.0,"King Arthur, accompanied by his squire, recruits his Knights of the Round Table, including Sir Bedevere the Wise, Sir Lancelot the Brave, Sir Robin the Not-Quite-So-Brave-As-Sir-Lancelot and Sir Galahad the Pure. On the way, Arthur battles the Black Knight who, despite having had all his limbs chopped off, insists he can still fight. They reach Camelot, but Arthur decides not  to enter, as ""it is a silly place"".",7.803,6095,"['Adventure', 'Comedy', 'Fantasy']",5.0
1150,"Return of Martin Guerre, The (Retour de Martin Guerre, Le) (1982)",Drama,84589,4483.0,"Village of Artigat, southern France, summer 1542, during the reign of Francis I. Martin Guerre and Bertrande de Rols marry. A few years later, accused of having committed a robbery, Martin suddenly disappears. When, almost a decade later, a man arrives in Artigat claiming to be Martin, the Guerre family recognizes him as such; but doubts soon arise about his true identity.",6.758,213,"['Drama', 'History']",5.0
1161,"Tin Drum, The (Blechtrommel, Die) (1979)",Drama|War,78875,659.0,"Oskar Matzerath is a very unusual boy. Refusing to leave the womb until promised a tin drum by his mother, Agnes, Oskar is reluctant to enter a world he sees as filled with hypocrisy and injustice, and vows on his third birthday to never grow up. Miraculously, he gets his wish. As the Nazis rise to power in Danzig, Oskar wills himself to remain a child, beating his tin drum incessantly and screaming in protest at the chaos surrounding him.",6.946,502,"['Drama', 'History', 'War']",4.0
1171,Bob Roberts (1992),Comedy,103850,10608.0,"Millionaire conservative Bob Roberts launches an insurgent campaign against incumbent senator Brickley Paiste, firing up crowds at his rallies by singing '60s-style acoustic folk songs with lyrics espousing far-right conservative social and economic views.",6.5,166,"['Comedy', 'Drama']",2.0
1172,Cinema Paradiso (Nuovo cinema Paradiso) (1989),Drama,95765,11216.0,"A filmmaker recalls his childhood, when he fell in love with the movies at his village's theater and formed a deep friendship with the theater's projectionist.",8.4,4615,"['Drama', 'Romance']",4.0
1173,"Cook the Thief His Wife & Her Lover, The (1989)",Comedy|Drama,97108,7452.0,The wife of an abusive criminal finds solace in the arms of a kind regular guest in her husband's restaurant.,7.32,665,"['Crime', 'Drama']",3.0
1175,Delicatessen (1991),Comedy|Drama|Romance,101700,892.0,"In a post-apocalyptic world, the residents of an apartment above the butcher shop receive an occasional delicacy of meat, something that is in low supply. A young man new in town falls in love with the butcher's daughter, which causes conflicts in her family, who need the young man for other business-related purposes.",7.294,1544,"['Comedy', 'Science Fiction', 'Fantasy']",3.0
1176,"Double Life of Veronique, The (Double Vie de Véronique, La) (1991)",Drama|Fantasy|Romance,101765,1600.0,"Véronique is a beautiful young French woman who aspires to be a renowned singer; Weronika lives in Poland, has a similar career goal and looks identical to Véronique, though the two are not related. The film follows both women as they contend with the ups and downs of their individual lives, with Véronique embarking on an unusual romance with Alexandre Fabbri, a puppeteer who may be able to help her with her existential issues.",7.49,842,['Drama'],2.0
1177,Enchanted April (1992),Drama|Romance,101811,26561.0,"When married British women Rose Arbuthnot and Lottie Wilkins decide to take a break from their respective spouses, they stay at a castle in Italy for a quiet holiday. Joining the ladies is Caroline Dester, a young socialite, and Mrs. Fisher, an older aristocrat. Liberated from their daily routines, the four women ease into life in rural Italy, and each finds herself transformed by the experience.",6.8,72,"['Romance', 'Drama']",3.0
1179,"Grifters, The (1990)",Crime|Drama|Film-Noir,99703,18129.0,"A small-time conman has his loyalties torn between his estranged mother and his new girlfriend, both of whom are high-stakes grifters with their own angles to play.",6.5,441,"['Crime', 'Drama']",4.0
