movieId,title,genres,imdbId,tmdbId,overview,tmdb_vote_average,tmdb_vote_count,tmdb_genres,rating
2640,Superman (1978),Action|Adventure|Sci-Fi,78346,1924.0,"Mild-mannered Clark Kent works as a reporter at the Daily Planet alongside his crush, Lois Lane. Clark must summon his superhero alter-ego when the nefarious Lex Luthor launches a plan to take over the world.",7.156,4072,"['Science Fiction', 'Action', 'Adventure']",4.0
2641,Superman II (1980),Action|Sci-Fi,81573,8536.0,"Three Kryptonian criminals led by General Zod team up with Lex Luthor to conquer Earth, forcing a depowered Superman to regain his strength and stop them.",6.7,2402,"['Science Fiction', 'Action', 'Adventure']",3.0
2643,Superman IV: The Quest for Peace (1987),Action|Adventure|Sci-Fi,94074,11411.0,"With global superpowers engaged in an increasingly hostile arms race, Superman leads a crusade to rid the world of nuclear weapons. But Lex Luthor, recently sprung from jail, is declaring war on the Man of Steel and his quest to save the planet. Using a strand of Superman's hair, Luthor synthesizes a powerful ally known as Nuclear Man and ignites an epic battle spanning Earth and space.",4.588,1335,"['Action', 'Adventure', 'Science Fiction']",3.0
2671,Notting Hill (1999),Comedy|Romance,125439,509.0,London bookstore owner William Thacker's quiet life turns upside down when a chance encounter with famous actress Anna Scott sparks an unlikely romance challenged by their vastly different worlds.,7.264,6435,"['Romance', 'Comedy']",4.0
2683,Austin Powers: The Spy Who Shagged Me (1999),Action|Adventure|Comedy,145660,817.0,"When diabolical genius Dr. Evil travels back in time to steal superspy Austin Powers's ‘mojo,’ Austin must return to the swingin' '60s himself - with the help of American agent, Felicity Shagwell - to stop the dastardly plan. Once there, Austin faces off against Dr. Evil's army of minions to try to save the world in his own unbelievably groovy way.",6.288,3482,"['Adventure', 'Comedy', 'Crime', 'Science Fiction']",3.0
2687,Tarzan (1999),Adventure|Animation|Children|Drama,120855,37135.0,"Tarzan was a small orphan who was raised by an ape named Kala since he was a child. He believed that this was his family, but on an expedition Jane Porter is rescued by Tarzan. He then finds out that he's human. Now Tarzan must make the decision as to which family he should belong to...",7.4,7054,"['Family', 'Adventure', 'Animation', 'Drama']",5.0
2701,Wild Wild West (1999),Action|Comedy|Sci-Fi|Western,120891,8487.0,Legless Southern inventor Dr. Arliss Loveless plans to rekindle the Civil War by assassinating President Ulysses S. Grant. Only two men can stop him: gunfighter James West and master-of-disguise and inventor Artemus Gordon. The two must team up to thwart Loveless' plans.,5.315,3427,"['Action', 'Adventure', 'Comedy', 'Science Fiction', 'Western']",3.0
2706,American Pie (1999),Comedy|Romance,163651,2105.0,"At a high-school party, four friends find that losing their collective virginity isn't as easy as they had thought. But they still believe that they need to do so before college. To motivate themselves, they enter a pact to all ""score"" by their senior prom.",6.6,7968,"['Comedy', 'Romance']",3.0
2709,Muppets From Space (1999),Children|Comedy,158811,10208.0,"When Gonzo's breakfast cereal tells him that he's the descendant of aliens from another planet, his attempts at extraterrestrial communication get him kidnapped by a secret government agency, prompting the Muppets to spring into action. It's hard to believe Gonzo's story at first, but Kermit and friends soon find themselves on an epic journey into outer space filled with plenty of intergalactic misadventures.",6.1,340,"['Family', 'Comedy', 'Science Fiction']",3.0
2711,My Life So Far (1999),Drama,120899,48958.0,"A memoir of the lives of a family growing up on a post World War I British estate headed up by a strong disciplinarian, her daughter, her inventor husband, their ten year old son and his older sister. Through the household comes a number of suitors hoping to impress the young woman, including an aviator. When the elder woman's son shows up at the estate with his French fiancé, everything gets thrown into turmoil. The young boy takes a sudden interest in her sexual allure and his father is disturbed by his own non-Victorian feelings.",5.7,32,"['Comedy', 'Drama']",3.0
2716,Ghostbusters (a.k.a. Ghost Busters) (1984),Action|Comedy|Sci-Fi,87332,620.0,"After losing their academic posts at a prestigious university, a team of parapsychologists goes into business as proton-pack-toting ""ghostbusters"" who exterminate ghouls, hobgoblins and supernatural pests of all stripes. An ad campaign pays off when a knockout cellist hires the squad to purge her swanky digs of demons that appear to be living in her refrigerator.",7.495,9359,"['Comedy', 'Fantasy']",4.0
2723,Mystery Men (1999),Action|Comedy|Fantasy,132347,9824.0,"When Champion City's hero Captain Amazing is kidnapped by the recently paroled supervillain Casanova Frankenstein, a trio of average, everyday superheroes -- Mr. Furious, the Shoveler and the Blue Raja -- assemble a new super team to save him.",5.82,869,"['Adventure', 'Fantasy', 'Action', 'Comedy', 'Science Fiction']",4.0
2736,Brighton Beach Memoirs (1986),Comedy,90774,32060.0,"Eugene, a young teenage Jewish boy, recalls his memoirs of his time as an adolescent youth. He lives with his parents, his aunt, two cousins, and his brother, Stanley, whom he looks up to and admires. He goes through the hardships of puberty, sexual fantasy, and living the life of a poor boy in a crowded house.",6.5,54,['Comedy'],3.0
2739,"Color Purple, The (1985)",Drama,88939,873.0,"An epic tale spanning forty years in the life of Celie, an African-American woman living in the South who survives incredible abuse and bigotry. After Celie's abusive father marries her off to the equally debasing 'Mister' Albert Johnson, things go from bad to worse, leaving Celie to find companionship anywhere she can. She perseveres, holding on to her dream of one day being reunited with her sister in Africa.",7.748,1882,"['Drama', 'History']",3.0
2746,Little Shop of Horrors (1986),Comedy|Horror|Musical,91419,10776.0,"Seymour Krelborn is a nerdy orphan working at Mushnik's; a flower shop in urban Skid Row. He harbors a crush on fellow co-worker, Audrey Fulquard, and is berated by Mr. Mushnik daily. One day, Seymour finds a very mysterious unidentified plant which he calls Audrey II. The plant seems to have a craving for blood and soon begins to sing for his supper.",7.0,1527,"['Horror', 'Comedy']",3.0
2752,Outrageous Fortune (1987),Comedy|Mystery,93690,20242.0,"Refined actress Lauren Ames finally has a chance to study with the great theatre professor Stanislav Korzenowski. Sandy Brozinsky, a brash, loud actress, decides through happenstance to also study with Korzenowski. The two women end up dating the same man (who turns out to be a double agent) and follow him across the country to force him to choose between them.",6.025,122,['Comedy'],3.0
2761,"Iron Giant, The (1999)",Adventure|Animation|Children|Drama|Sci-Fi,129167,10386.0,"In the small town of Rockwell, Maine in October 1957, a giant metal machine befriends a nine-year-old boy and ultimately finds its humanity by unselfishly saving people from their own fears and prejudices.",7.953,5883,"['Animation', 'Family', 'Science Fiction', 'Adventure']",4.0
2763,"Thomas Crown Affair, The (1999)",Action|Mystery,155267,913.0,"Bored billionaire executive Thomas Crown entertains himself by stealing a Monet from a reputed museum with an elaborate diversion. When Catherine Banning, the insurance company's investigator, takes an interest in Crown, he may have met his match, and a complicated back-and-forth game with seductive undertones begins between them.",6.755,1263,"['Drama', 'Crime', 'Romance']",4.0
2770,Bowfinger (1999),Comedy,131325,11353.0,"On the verge of bankruptcy and desperate for his big break, aspiring filmmaker Bobby Bowfinger concocts a crazy plan to make his ultimate dream movie. Rallying a ragtag team that includes a starry-eyed ingenue, a has-been diva and a film studio gofer, he sets out to shoot a blockbuster featuring the biggest star in Hollywood, Kit Ramsey -- only without letting Ramsey know he's in the picture.",6.17,901,['Comedy'],2.0
2779,Heaven Can Wait (1978),Comedy,77663,12185.0,"Joe Pendleton is a quarterback preparing to lead his team to the superbowl when he is almost killed in an accident. An overanxious angel plucks him to heaven only to discover that he wasn't ready to die, and that his body has been cremated. A new body must be found, and that of a recently-murdered millionaire is chosen. His wife and accountant—the murderers—are confused by this development, as he buys the L.A. Rams in order to once again quarterback them into the Superbowl.",6.601,420,"['Fantasy', 'Comedy', 'Romance']",4.0
2788,Monty Python's And Now for Something Completely Different (1971),Comedy,66765,9267.0,A collection of Monty Python's Flying Circus skits from the first two seasons of their British TV series.,7.223,553,['Comedy'],4.0
2791,Airplane! (1980),Comedy,80339,813.0,An ex-fighter pilot forced to take over the controls of an airliner when the flight crew succumbs to food poisoning.,7.307,4790,['Comedy'],4.0
2795,National Lampoon's Vacation (1983),Comedy,85995,11153.0,"Clark Griswold is on a quest to take his family to the Walley World theme park for a vacation, but things don't go exactly as planned.",7.102,1640,"['Comedy', 'Adventure']",3.0
2797,Big (1988),Comedy|Drama|Fantasy|Romance,94737,2280.0,When a young boy makes a wish at a carnival machine to be big—he wakes up the following morning to find that it has been granted and his body has grown older overnight. But he is still the same 13-year-old boy inside. Now he must learn how to cope with the unfamiliar world of grown-ups including getting a job and having his first romantic encounter with a woman.,7.183,3793,"['Fantasy', 'Drama', 'Comedy', 'Romance', 'Family']",3.0
2804,"Christmas Story, A (1983)",Children|Comedy,85334,850.0,"The comic mishaps and adventures of a young boy named Ralph, trying to convince his parents, teachers, and Santa that a Red Ryder B.B. gun really is the perfect Christmas gift for the 1940s.",7.22,1318,"['Comedy', 'Family']",4.0
2846,"Adventures of Milo and Otis, The (Koneko monogatari) (1986)",Adventure|Children|Comedy|Drama,97050,47951.0,"When Milo the cat and Otis the dog are separated, they each set off on an adventurous and often perilous quest across mountains, plains, and snow-covered lands to reunite with one another.",6.5,209,"['Adventure', 'Drama', 'Family']",2.0
2857,Yellow Submarine (1968),Adventure|Animation|Comedy|Fantasy|Musical,63823,12105.0,"The wicked Blue Meanies take over Pepperland, eliminating all color and music. As the only survivor, the Lord Admiral escapes in the yellow submarine and journeys to Liverpool to enlist the help of the Beatles.",7.1,528,"['Music', 'Animation', 'Adventure', 'Comedy', 'Fantasy']",4.0
2858,American Beauty (1999),Drama|Romance,169547,14.0,"Lester Burnham, a depressed suburban father in a mid-life crisis, decides to turn his hectic life around after developing an infatuation with his daughter's attractive friend.",8.005,12564,['Drama'],3.0
2859,Stop Making Sense (1984),Documentary|Musical,88178,24128.0,"A concert film documenting Talking Heads at the height of their popularity, on tour for their 1983 album ""Speaking in Tongues."" The band takes the stage one by one and is joined by a cadre of guest musicians for a career-spanning and cinematic performance that features creative choreography and visuals.",8.329,325,"['Documentary', 'Music']",4.0
2875,Sommersby (1993),Drama|Mystery|Romance,108185,1049.0,"Set in the South just after the US Civil War, Laurel Sommersby is just managing to work the farm without her husband, believed killed in battle. By all accounts, Jack Sommersby was not a pleasant man, thus when he suddenly returns, Laurel has mixed emotions. It appears that Jack has changed a great deal, leading some people to believe that this is not actually Jack but an imposter. Laurel herself is unsure, but willing to take the man into her home, and perhaps later into her heart.",6.363,404,"['Drama', 'Thriller', 'Mystery', 'Romance']",4.0
2899,Gulliver's Travels (1939),Adventure|Animation|Children,31397,42518.0,"Gulliver washes ashore on Lilliput and attempts to prevent war between that tiny kingdom and its equally-miniscule rival, Blefiscu, as well as smooth the way for the romance between the Princess and Prince of the opposing lands. In this he is alternately aided and hampered by the Lilliputian town crier and general fussbudget, Gabby. A life-threatening situation develops when the bumbling trio of Blefiscu spies, Sneak, Snoop, and Snitch, manage to steal Gulliver's pistol.",6.189,132,"['Animation', 'Family', 'Action', 'Adventure']",3.0
2915,Risky Business (1983),Comedy,86200,9346.0,"Meet Joel Goodson, an industrious, college-bound 17-year-old and a responsible, trustworthy son. However, when his parents go away and leave him home alone in the wealthy Chicago suburbs with the Porsche at his disposal he quickly decides he has been good for too long and it is time to enjoy himself. After an unfortunate incident with the Porsche Joel must raise some cash, in a risky way.",6.617,1384,"['Romance', 'Comedy', 'Drama']",4.0
2918,Ferris Bueller's Day Off (1986),Comedy,91042,9377.0,"After high school slacker Ferris Bueller successfully fakes an illness in order to skip school for the day, he goes on a series of adventures throughout Chicago with his girlfriend Sloane and best friend Cameron, all the while trying to outwit his wily school principal and fed-up sister.",7.6,5138,['Comedy'],4.0
2926,Hairspray (1988),Comedy|Drama,95270,11054.0,"'Pleasantly plump' teenager Tracy Turnblad achieves her dream of becoming a regular on the Corny Collins Dance Show. Now a teen hero, she starts using her fame to speak out for the causes she believes in, most of all integration. In doing so, she earns the wrath of the show's former star, Amber Von Tussle, as well as Amber's manipulative, pro-segregation parents. The rivalry comes to a head as Amber and Tracy vie for the title of Miss Auto Show 1963.",6.8,426,"['Comedy', 'Music', 'Romance']",3.0
2929,Reds (1981),Drama|Romance,82979,18254.0,"An account of the revolutionary years of the legendary American journalist John Reed, who shared his adventurous professional life with his radical commitment to the socialist revolution in Russia, his dream of spreading its principles among the members of the American working class, and his troubled romantic relationship with the writer Louise Bryant.",6.888,349,"['Drama', 'History', 'Romance']",5.0
2946,Help! (1965),Comedy|Musical,59260,14831.0,"An obscure Eastern cult that practices human sacrifice pursues Ringo after he unknowingly puts on a ceremonial ring (that, of course, won't come off). On top of that, a pair of mad scientists, members of Scotland Yard, and a beautiful but dead-eyed assassin all have their own plans for the Fab Four.",6.9,336,"['Comedy', 'Music', 'Adventure']",2.0
2961,"Story of Us, The (1999)",Comedy|Drama,160916,12220.0,Ben and Katie Jordan are a married couple who go through hard times in fifteen years of marriage.,6.1,331,"['Comedy', 'Drama', 'Romance']",3.0
2968,Time Bandits (1981),Adventure|Comedy|Fantasy|Sci-Fi,81633,36819.0,"Young history buff Kevin can scarcely believe it when six dwarfs emerge from his closet one night. Former employees of the Supreme Being, they've purloined a map charting all of the holes in the fabric of time and are using it to steal treasures from different historical eras. Taking Kevin with them, they variously drop in on Napoleon, Robin Hood and King Agamemnon before the Supreme Being catches up with them.",6.609,1078,"['Family', 'Fantasy', 'Science Fiction', 'Adventure', 'Comedy']",5.0
2972,Red Sorghum (Hong gao liang) (1987),Drama|War,93206,42006.0,"An old leper who owned a remote sorghum winery dies. Jiu'er, the wife bought by the leper, and her lover, identified only as ""my Grandpa"" by the narrator, take over the winery and set up an idealized quasi-matriarchal community headed by Jiu'er. When the Japanese invaders subject the area to their rule and cut down the sorghum to make way for a road, the community rises up and resists as the sorghum grows anew.",7.181,224,"['Drama', 'Romance', 'History']",3.0
2973,Crimes and Misdemeanors (1989),Comedy|Crime|Drama,97123,11562.0,A renowned ophthalmologist is desperate to cut off an adulterous relationship…which ends up in murder; and a frustrated documentary filmmaker woos an attractive television producer while making a film about her insufferably self-centered boss.,7.418,912,"['Comedy', 'Drama', 'Crime']",4.0
2987,Who Framed Roger Rabbit? (1988),Adventure|Animation|Children|Comedy|Crime|Fantasy|Mystery,96438,856.0,"'Toon star Roger is worried that his wife Jessica is playing pattycake with someone else, so the studio hires detective Eddie Valiant to snoop on her. But the stakes are quickly raised when Marvin Acme is found dead and Roger is the prime suspect.",7.532,5943,"['Fantasy', 'Animation', 'Comedy', 'Crime']",2.0
2991,Live and Let Die (1973),Action|Adventure|Thriller,70328,253.0,James Bond must investigate a mysterious murder case of a British agent in New Orleans. Soon he finds himself up against a gangster boss named Mr. Big.,6.515,2144,"['Adventure', 'Action', 'Thriller']",3.0
2997,Being John Malkovich (1999),Comedy|Drama|Fantasy,120601,492.0,"One day at work, unsuccessful puppeteer Craig finds a portal into the head of actor John Malkovich. The portal soon becomes a passion for anybody who enters its mad and controlling world of overtaking another human body.",7.412,4569,"['Comedy', 'Drama', 'Fantasy']",4.0
3022,"General, The (1926)",Comedy|War,17925,961.0,"During America’s Civil War, Union spies steal engineer Johnny Gray's beloved locomotive, 'The General'—with Johnnie's lady love aboard an attached boxcar—and he single-handedly must do all in his power to both get The General back and to rescue Annabelle.",7.938,1334,"['Action', 'Adventure', 'Comedy', 'War', 'Romance']",4.0
3028,"Taming of the Shrew, The (1967)",Comedy,61407,25560.0,"Italy, 16th century. Petruchio, a choleric, lying and poor rural landowner from Verona, arrives in Padua in search of fortune and a wife, while Baptista, a wealthy merchant, announces that he will not allow Bianca, his youngest daughter, to marry until the temperamental and unruly Katherina, his eldest daughter, does.",6.9,176,"['Comedy', 'Romance']",3.0
3030,Yojimbo (1961),Action|Adventure,55630,11878.0,"A nameless ronin, or samurai with no master, enters a small village in feudal Japan where two rival businessmen are struggling for control of the local gambling trade. Taking the name Sanjuro Kuwabatake, the ronin convinces both silk merchant Tazaemon and sake merchant Tokuemon to hire him as a personal bodyguard, then artfully sets in motion a full-scale gang war between the two ambitious and unscrupulous men.",8.1,1579,"['Drama', 'Thriller']",3.0
3033,Spaceballs (1987),Comedy|Sci-Fi,94012,957.0,"When the nefarious Dark Helmet hatches a plan to snatch Princess Vespa and steal her planet's air, space-bum-for-hire Lone Starr and his clueless sidekick fly to the rescue. Along the way, they meet Yogurt, who puts Lone Starr wise to the power of ""The Schwartz."" Can he master it in time to save the day?",6.9,3180,"['Comedy', 'Science Fiction']",3.0
3034,Robin Hood (1973),Adventure|Animation|Children|Comedy|Musical,70608,11886.0,"With King Richard off to the Crusades, Prince John and his slithering minion, Sir Hiss, set about taxing Nottingham's citizens with support from the corrupt sheriff - and staunch opposition by the wily Robin Hood and his band of merry men.",7.301,4497,"['Animation', 'Family', 'Adventure']",3.0
3035,Mister Roberts (1955),Comedy|Drama|War,48380,37853.0,Mr. Roberts is a Navy officer who's yearning for battle but is stuck in the backwaters of World War II on a non-commissioned ship run by the bullying Captain Morton.,7.1,163,"['Comedy', 'Drama', 'War']",4.0
3036,"Quest for Fire (Guerre du feu, La) (1981)",Adventure|Drama,82484,62204.0,"In the prehistoric world, a Cro-Magnon tribe depends on an ever-burning source of fire, which eventually extinguishes. Lacking the knowledge to start a new fire, the tribe sends three warriors on a quest for more. With the tribe's future at stake, the warriors make their way across a treacherous landscape full of hostile tribes and monstrous beasts. On their journey, they encounter Ika, a woman who has the knowledge they seek.",7.0,541,"['Adventure', 'Drama']",4.0
3037,Little Big Man (1970),Western,65988,11040.0,"Jack Crabb, looking back from extreme old age, tells of his life being raised by Indians and fighting with General Custer.",7.478,675,"['Western', 'Comedy', 'Adventure']",5.0
3039,Trading Places (1983),Comedy,86465,1621.0,A snobbish investor and a wily street con-artist find their positions reversed as part of a bet by two callous millionaires.,7.2,3451,['Comedy'],3.0
3046,"Incredibly True Adventure of Two Girls in Love, The (1995)",Comedy|Romance,113416,29371.0,An adventurous love story between two young women of different social and economic backgrounds who find themselves going through all the typical struggles of a new romance.,6.3,89,"['Comedy', 'Drama', 'Romance']",4.0
3048,Under the Rainbow (1981),Comedy,83254,47941.0,"In World War II era Los Angeles, the manager of the Culver Hotel leaves his nephew in charge for a weekend. The nephew changes the name to the Hotel Rainbow and overbooks with royalty, assassins, secret agents, Japanese tourists, and munchkins. Secret Service agent Bruce Thorpe and casting director Annie Clark find romance amidst the intrigue and confusion.",5.3,35,['Comedy'],4.0
3052,Dogma (1999),Adventure|Comedy|Fantasy,120655,1832.0,An abortion clinic worker with a special heritage is called upon to save the existence of humanity from being negated by two renegade angels trying to exploit a loophole and reenter Heaven.,6.924,2650,"['Fantasy', 'Comedy', 'Adventure']",4.0
3060,"Commitments, The (1991)",Comedy|Drama|Musical,101605,11663.0,"Jimmy Rabbitte, just a thick-ya out of school, gets a brilliant idea: to put a soul band together in Barrytown, his slum home in north Dublin. First he needs musicians and singers: things slowly start to click when he finds three fine-voiced females virtually in his back yard, a lead singer (Deco) at a wedding, and, responding to his ad, an aging trumpet player, Joey ""The Lips"" Fagan.",7.3,569,"['Comedy', 'Drama', 'Music']",3.0
3072,Moonstruck (1987),Comedy|Romance,93565,2039.0,"37-year-old Italian-American widow Loretta Castorini believes she is unlucky in love, and so accepts a marriage proposal from her boyfriend Johnny, even though she doesn't love him. When she meets his estranged younger brother Ronny, an emotional and passionate man, she finds herself drawn to him. She tries to resist, but Ronny, who blames his brother for the loss of his hand, has no scruples about aggressively pursuing her while Johnny is out of the country. As Loretta falls for Ronny, she learns that she's not the only one in her family with a secret romance.",6.9,1032,"['Comedy', 'Drama', 'Romance']",3.0
3081,Sleepy Hollow (1999),Fantasy|Horror|Mystery|Romance,162661,2668.0,"Skeptical young detective Ichabod Crane gets transferred to the hamlet of Sleepy Hollow, New York, where he is tasked with investigating the decapitations of three people – murders the townsfolk attribute to a legendary specter, The Headless Horseman.",7.187,7062,"['Fantasy', 'Thriller', 'Mystery', 'Horror']",3.0
3087,Scrooged (1988),Comedy|Fantasy|Romance,96061,9647.0,"Frank Cross is a wildly successful television executive whose cold ambition and curmudgeonly nature has driven away the love of his life. But after firing a staff member on Christmas Eve, Frank is visited by a series of ghosts who give him a chance to re-evaluate his actions and right the wrongs of his past.",6.789,1606,"['Fantasy', 'Comedy', 'Drama']",5.0
3088,Harvey (1950),Comedy|Fantasy,42546,11787.0,"The story of Elwood P. Dowd who makes friends with a spirit taking the form of a human-sized rabbit named Harvey that only he sees (and a few privileged others on occasion also.) After his sister tries to commit him to a mental institution, a comedy of errors ensues. Elwood and Harvey become the catalysts for a family mending its wounds and for romance blossoming in unexpected places.",7.676,649,"['Comedy', 'Fantasy']",3.0
3097,"Shop Around the Corner, The (1940)",Comedy|Drama|Romance,33045,20334.0,"Two employees at a gift shop can barely stand one another, without realising that they are falling in love through the post as each other's anonymous pen pal.",8.119,770,"['Comedy', 'Drama', 'Romance']",3.0
3099,Shampoo (1975),Comedy|Drama|Romance,73692,31121.0,A Beverly Hills hairdresser runs around town on the eve of the 1968 presidential election trying to make heads or tails of his financial and romantic entanglements. His attempts to gather the money to open his own salon are continually side-tracked by the distractions presented by his many lovers.,6.007,224,"['Comedy', 'Drama']",3.0
3100,"River Runs Through It, A (1992)",Drama,105265,293.0,"The Maclean brothers, Paul and Norman, live a relatively idyllic life in rural Montana, spending much of their time fly fishing. The sons of a minister, the boys eventually part company when Norman moves east to attend college, leaving his rebellious brother to find trouble back home. When Norman finally returns, the siblings resume their fishing outings, and assess where they've been and where they're going.",7.0,1139,"['Drama', 'Family']",3.0
