movieId,title,genres,imdbId,tmdbId,overview,tmdb_vote_average,tmdb_vote_count,tmdb_genres,rating
2303,Nashville (1975),Drama|Musical,73440,3121.0,"The intersecting stories of twenty-four characters—from country star to wannabe to reporter to waitress—connect to the music business in Nashville, Tennessee.",7.271,433,"['Drama', 'Comedy']",5.0
2306,Holy Man (1998),Comedy,120701,9713.0,"In a world governed by commerce, Ricky and Kate, dedicated employees, find their lives forever changed when they encounter the enigmatic stranger G. As they navigate the realm of commerce, their paths intertwine in a surreal dance of love, loss, and redemption. G's presence, amplified through the pervasive influence of globalized television, casts a spell that reverberates beyond Ricky and Kate, impacting the lives of those who bear witness to their intertwined destinies.",5.264,434,"['Drama', 'Comedy']",3.0
2312,Children of a Lesser God (1986),Drama,90830,1890.0,"Starting his new job as an instructor at a New England school for the deaf, James Leeds meets Sarah Norman, a young deaf woman who works at the school as a member of the custodial staff. In spite of Sarah's withdrawn emotional state, a romance slowly develops between the pair.",6.9,332,"['Drama', 'Romance']",4.0
2313,"Elephant Man, The (1980)",Drama,80678,1955.0,"A Victorian surgeon rescues a heavily disfigured man being mistreated by his ""owner"" as a side-show freak. Behind his monstrous façade, there is revealed a person of great intelligence and sensitivity. Based on the true story of Joseph Merrick (called John Merrick in the film), a severely deformed man in 19th century London.",8.048,3731,"['Drama', 'History']",5.0
2316,Practical Magic (1998),Drama|Fantasy|Mystery|Romance,120791,6435.0,"Sally and Gillian Owens, born into a magical family, have mostly avoided witchcraft themselves. But when Gillian's vicious boyfriend, Jimmy Angelov, dies unexpectedly, the Owens sisters give themselves a crash course in hard magic. With policeman Gary Hallet growing suspicious, the girls struggle to resurrect Angelov -- and unwittingly inject his corpse with an evil spirit that threatens to end their family line.",6.791,1612,"['Romance', 'Comedy', 'Fantasy']",2.0
2320,Apt Pupil (1998),Drama|Thriller,118636,9445.0,"One day in 1984, Todd Bowden, a brilliant high school boy fascinated by the history of Nazism, stumbles across an old man whose appearance resembles that of Kurt Dussander, a wanted Nazi war criminal. A month later, Todd decides to knock on his door.",6.525,676,"['Drama', 'Thriller']",2.0
2321,Pleasantville (1998),Comedy|Drama|Fantasy,120789,2657.0,"Geeky teenager David and his popular twin sister, Jennifer, get sucked into the black-and-white world of a 1950s TV sitcom called ""Pleasantville,"" and find a world where everything is peachy keen all the time. But when Jennifer's modern attitude disrupts Pleasantville's peaceful but boring routine, she literally brings color into its life.",7.261,1771,"['Fantasy', 'Comedy', 'Drama']",4.0
2331,Living Out Loud (1998),Comedy|Drama|Romance,120722,46889.0,"Judith Moore is suddenly single after discovering her husband of fifteen years, a successful doctor, has been having an affair with a younger woman. Judith stews, plans, plots and fantasizes, but she can't decide what to do with her life until she goes out to a night club to see singer Liz Bailey, who is full of advice on life and love. While out on the town, Judith is suddenly kissed by a total stranger, which opens her eyes to new possibilities... which is when she notices Pat, the elevator operator in her building.",5.9,50,"['Comedy', 'Drama', 'Romance']",4.0
2333,Gods and Monsters (1998),Drama,120684,3033.0,"It's 1957, and James Whale's heyday as the director of ""Frankenstein,"" ""Bride of Frankenstein"" and ""The Invisible Man"" is long behind him. Retired and a semi-recluse, he lives his days accompanied only by images from his past. When his dour housekeeper, Hannah, hires a handsome young gardener, the flamboyant director and simple yard man develop an unlikely friendship, which will change them forever.",7.0,373,['Drama'],4.0
2336,Elizabeth (1998),Drama,127536,4518.0,"The story of the ascension to the throne and the early reign of Queen Elizabeth the First, the endless attempts by her council to marry her off, the Catholic hatred of her and her romance with Lord Robert Dudley.",7.2,1441,"['Drama', 'History']",5.0
2341,Dancing at Lughnasa (1998),Drama,120643,5332.0,Five unmarried sisters make the most of their simple existence in rural Ireland in the 1930s.,5.9,50,['Drama'],4.0
2346,"Stepford Wives, The (1975)",Mystery|Sci-Fi|Thriller,73747,12223.0,"Joanna Eberhart has come to the quaint little town of Stepford, Connecticut with her family, but soon discovers there lies a sinister truth in the all too perfect behavior of the female residents.",6.689,337,"['Mystery', 'Thriller', 'Science Fiction', 'Horror']",4.0
2348,Sid and Nancy (1986),Drama,91954,14924.0,"January 1978. After their success in England, the punk rock band Sex Pistols venture out on their tour of the southern United States. Temperamental bassist Sid Vicious is forced by his band mates to travel without his troubled girlfriend, Nancy Spungen, who will meet him in New York. When the band breaks up and Sid begins his solo career in a hostile city, the turbulent couple definitely falls into the depths of drug addiction.",6.7,532,"['Drama', 'Romance']",3.0
2349,Mona Lisa (1986),Comedy|Thriller,91538,10002.0,"George is a small-time crook just out of prison who discovers his tough-guy image is out of date. Reduced to working as a minder/driver for high class call girl Simone, he has to agree when she asks him to find a young colleague from her King's Cross days. That's when George's troubles just start.",6.89,277,"['Crime', 'Drama', 'Romance', 'Thriller']",2.0
2352,"Big Chill, The (1983)",Comedy|Drama,85244,12560.0,Seven old college friends gather for a weekend reunion after the funeral of one of their own.,6.864,621,"['Comedy', 'Drama']",5.0
2355,"Bug's Life, A (1998)",Adventure|Animation|Children|Comedy,120623,9487.0,"On behalf of ""oppressed bugs everywhere,"" an inventive ant named Flik hires a troupe of warrior bugs to defend his bustling colony from a horde of freeloading grasshoppers led by the evil-minded Hopper.",6.972,9465,"['Family', 'Animation', 'Adventure', 'Comedy', 'Drama']",4.0
2361,Pink Flamingos (1972),Comedy,69089,692.0,"Notorious Baltimore criminal and underground figure Divine goes up against Connie & Raymond Marble, a sleazy married couple who make a passionate attempt to humiliate her and seize her tabloid-given title as ""The Filthiest Person Alive"".",6.161,528,"['Comedy', 'Crime']",2.0
2369,Desperately Seeking Susan (1985),Comedy|Drama|Romance,89017,8130.0,A bored New Jersey suburban housewife's fascination with a free-spirited woman she has read about in the personal columns leads to her being mistaken for the woman herself and into a chaotic adventure of amnesia and self-discovery.,6.099,470,"['Drama', 'Comedy', 'Crime']",3.0
2370,"Emerald Forest, The (1985)",Action|Adventure|Drama,89087,11532.0,"For ten years, engineer Bill Markham has searched tirelessly for his son Tommy who disappeared from the edge of the Brazilian rainforest. Miraculously, he finds the boy living among the reclusive Amazon tribe who adopted him. And that's when Bill's adventure truly begins. For his son is now a grown tribesman who moves skillfully through this beautiful-but-dangerous terrain, fearful only of those who would exploit it. And as Bill attempts to ""rescue"" him from the savagery of the untamed jungle, Tommy challenges Bill's idea of true civilization and his notions about who needs rescuing.",6.6,251,"['Action', 'Adventure', 'Drama']",2.0
2371,Fletch (1985),Comedy|Crime|Mystery,89155,9749.0,"When investigative reporter Irwin ""Fletch"" Fletcher goes undercover to write a piece on the drug trade at a local beach, he's approached by wealthy businessman Alan Stanwyk, who offers him $50,000 to murder him. With sarcastic wit and a knack for disguises, Fletch sets out to uncover Stanwyk's story.",6.739,717,"['Comedy', 'Crime', 'Mystery']",3.0
2378,Police Academy (1984),Comedy|Crime,87928,9336.0,"New rules enforced by the Lady Mayoress mean that sex, weight, height and intelligence need no longer be a factor for joining the Police Force. This opens the floodgates for all and sundry to enter the Police Academy, much to the chagrin of the instructors. Not everyone is there through choice, though. Social misfit Mahoney has been forced to sign up as the only alternative to a jail sentence and it doesn't take long before he falls foul of the boorish Lieutenant Harris. But before long, Mahoney realises that he is enjoying being a police cadet and decides he wants to stay... while Harris decides he wants Mahoney out!",6.691,2831,"['Comedy', 'Crime']",3.0
2389,Psycho (1998),Crime|Horror|Thriller,155975,11252.0,"A young female embezzler arrives at the Bates Motel, which has terrible secrets of its own.",5.1,1005,"['Horror', 'Mystery', 'Thriller']",4.0
2390,Little Voice (1998),Comedy,147004,8545.0,"After the death of her father, Little Voice or LV becomes a virtual recluse, never going out and hardly ever saying a word. She just sits in her bedroom listening to her father's collection of old records of Shirley Bassey, Marilyn Monroe and various other famous female singers. But at night time, LV sings, imitating these great singers with surprising accuracy. One night she is overheard by one of her mother's boyfriends, who happens to be a talent agent. He manages to convince her that her talent is special and arranges for her to perform at the local night club, but several problems arise.",6.5,191,"['Comedy', 'Drama', 'Music']",3.0
2394,"Prince of Egypt, The (1998)",Animation|Musical,120794,9837.0,"The strong bond between two brothers is challenged when their chosen responsibilities set them at odds, with extraordinary consequences.",7.295,4141,"['Adventure', 'Animation', 'Drama', 'Family']",4.0
2396,Shakespeare in Love (1998),Comedy|Drama|Romance,138097,1934.0,"Young Shakespeare is forced to stage his latest comedy, ""Romeo and Ethel, the Pirate's Daughter,"" before it's even written. When a lovely noblewoman auditions for a role, they fall into forbidden love -- and his play finds a new life (and title). As their relationship progresses, Shakespeare's comedy soon transforms into tragedy.",6.848,3096,"['Romance', 'History', 'Comedy']",4.0
2398,Miracle on 34th Street (1947),Comedy|Drama,39628,11881.0,"Kris Kringle, seemingly the embodiment of Santa Claus, is asked to portray the jolly old fellow at Macy's following his performance in the Thanksgiving Day parade. His portrayal is so complete that many begin to question if he truly is Santa Claus, while others question his sanity.",7.376,789,"['Comedy', 'Drama', 'Family']",3.0
2406,Romancing the Stone (1984),Action|Adventure|Comedy|Romance,88011,9326.0,"Though she can spin wild tales of passionate romance, novelist Joan Wilder has no life of her own. Then one day adventure comes her way in the form of a mysterious package. It turns out that the parcel is the ransom she'll need to free her abducted sister, so Joan flies to South America to hand it over. But she gets on the wrong bus and winds up hopelessly stranded in the jungle.",6.761,1933,"['Romance', 'Comedy', 'Action', 'Adventure']",3.0
2416,Back to School (1986),Comedy,90685,15596.0,"Self-made millionaire Thornton Melon decides to get a better education and enrolls at his son Jason's college. While Jason tries to fit in with his fellow students, Thornton struggles to gain his son's respect, giving way to hilarious antics.",6.3,462,['Comedy'],3.0
2417,Heartburn (1986),Comedy|Drama,91188,13818.0,"She's a magazine writer who gives up her career for love and family. He's a playboy newspaper columnist who can't quite give up his old tricks. And if that combination doesn't give a relationship heartburn, nothing will.",5.99,202,"['Comedy', 'Drama', 'Romance']",2.0
2419,Extremities (1986),Drama|Thriller,91024,44326.0,"A woman escapes from the man who is about to rape her, but leaves her purse behind. Afraid that her attacker might come after her, she goes to the police, but with no proof of the incident, they can do nothing. In fact, the man does use the information in her bag and comes to her apartment with the intent of rape, but she sprays him in the face with insect repellent, and then holds him captive. She is then faced with deciding whether to go to the police who might not believe her and release him, or to kill him.",6.121,91,"['Thriller', 'Drama']",4.0
2420,"Karate Kid, The (1984)",Drama,87538,1885.0,"New Jersey teen Daniel LaRusso moves to Los Angeles with his mother, and soon strikes up a relationship with Ali. He quickly finds himself the target of bullying by a group of thugs, led by Ali's ex-boyfriend Johnny, who study karate at the Cobra Kai dojo under ruthless sensei John Kreese. Fortunately, Daniel befriends Mr. Miyagi, an unassuming repairman who just happens to be a martial arts master himself. Miyagi takes Daniel under his wing, training him in a more compassionate form of karate for self-defense and, later, preparing him to compete against the brutal Cobra Kai.",7.209,4477,"['Action', 'Adventure', 'Drama', 'Family']",4.0
2424,You've Got Mail (1998),Comedy|Romance,128853,9489.0,"Book superstore magnate, Joe Fox and independent book shop owner, Kathleen Kelly fall in love in the anonymity of the Internet—both blissfully unaware that he's trying to put her out of business.",6.692,3451,"['Comedy', 'Romance']",4.0
2431,Patch Adams (1998),Comedy|Drama,129290,10312.0,"The true story of Dr. Hunter ""Patch"" Adams, who in the 1970s found that humor is the best medicine, and was willing to do just anything to make his patients laugh—even if it meant risking his own career.",7.317,3316,"['Comedy', 'Drama']",3.0
2432,Stepmom (1998),Drama,120686,9441.0,"Jackie is a divorced mother of two. Isabel is the career minded girlfriend of Jackie’s ex-husband Luke, forced into the role of unwelcome stepmother to their children. But when Jackie discovers she is ill, both women realise they must put aside their differences to find a common ground and celebrate life to the fullest, while they have the chance.",7.151,1490,"['Drama', 'Romance', 'Comedy']",3.0
2437,Wilde (1997),Drama,120514,11365.0,"Oscar Wilde is a married playwright who has occasionally indulged his weakness for male suitors. After much toil, Wilde debuts 'The Importance of Being Earnest' in London, and a chat at the theatre with Lord Alfred 'Bosie' Douglas leads to a full-fledged romance. However, this affair leads to a legal dispute with Lord Alfred's oppressive father, the Marquess of Queensberry, and, given the local anti-gay laws, Wilde is jailed. Wilde's vast intellect helps him survive until he regains his freedom.",6.6,278,"['Drama', 'History']",3.0
2455,"Fly, The (1986)",Drama|Horror|Sci-Fi|Thriller,91064,9426.0,"When Seth Brundle makes a huge scientific and technological breakthrough in teleportation, he decides to test it on himself. Unbeknownst to him, a common housefly manages to get inside the device and the two become one.",7.422,4706,"['Horror', 'Science Fiction']",4.0
2463,Ruthless People (1986),Comedy,91877,12151.0,"Sam Stone hates his wife Barbara so much that he wants her dead. He's ecstatic when she's taken by a duo of kidnappers who want $500,000 ransom in exchange for her life. Fully intending to ignore every one of the kidnappers' demands in the hopes that they do him a favor and murder her for him, the two confused kidnappers have to figure out how they're going get their money, and what they're going to do with the overbearing Barbara.",6.619,419,['Comedy'],4.0
2468,Jumpin' Jack Flash (1986),Action|Comedy|Romance|Thriller,91306,10945.0,"Terry works for a bank, and uses computers to communicate with clients all over the world. One day, she gets a strange coded message from an unknown source. After decoding the message, Terry becomes embroiled in an espionage ring. People are killed, and Terry is chased. Throughout, she remains in contact with this mysterious person, who needs Terry's help save his life.",6.103,373,"['Romance', 'Comedy', 'Thriller']",2.0
2473,Soul Man (1986),Comedy,91991,12278.0,"A white prospective grad student's affluent family won't pay his way through law school, so he takes tanning pills to darken his skin in order to qualify for an African-American scholarship at Harvard. He soon gets more than he bargained for, as he begins to learn what life is really like for blacks in America.",5.292,156,['Comedy'],3.0
2488,Peeping Tom (1960),Drama|Horror|Thriller,54167,11167.0,"Loner Mark Lewis works at a film studio during the day and, at night, takes racy photographs of women. Also he's making a documentary on fear, which involves recording the reactions of victims as he murders them. He befriends Helen, the daughter of the family living in the apartment below his, and he tells her vaguely about the movie he is making.",7.451,849,"['Horror', 'Thriller', 'Drama']",4.0
2496,Blast from the Past (1999),Comedy|Romance,124298,11622.0,"Following a bomb scare in the 1960s that locked the Webers into their bomb shelter for 35 years, Adam now ventures forth into Los Angeles to obtain food and supplies for his family, and a non-mutant wife for himself.",6.769,1146,"['Drama', 'Romance', 'Comedy']",4.0
2524,"Towering Inferno, The (1974)",Action|Adventure|Drama|Thriller,72308,5919.0,"At the opening party of a colossal—but poorly constructed—skyscraper, a massive fire breaks out, threatening to destroy the tower and everyone in it.",7.01,978,"['Action', 'Drama', 'Thriller']",3.0
2527,Westworld (1973),Action|Sci-Fi|Thriller|Western,70909,2362.0,"Delos is a futuristic amusement park that features themed worlds populated by human-like androids. After two patrons have a run-in with a menacing gunslinger in West World, the androids at Delos all begin to malfunction, causing havoc throughout the park.",6.8,1367,"['Adventure', 'Science Fiction', 'Western']",2.0
2532,Conquest of the Planet of the Apes (1972),Action|Sci-Fi,68408,1688.0,"In a futuristic world that has embraced ape slavery, a chimpanzee named Caesar resurfaces after almost twenty years of hiding from the authorities, and prepares for a revolt against humanity.",6.158,1025,"['Action', 'Science Fiction']",3.0
2539,Analyze This (1999),Comedy,122933,9535.0,"Countless wiseguy films are spoofed in this film that centers on the neuroses and angst of a powerful Mafia racketeer who suffers from panic attacks. When Paul Vitti needs help dealing with his role in the ""family,"" unlucky shrink Dr. Ben Sobel is given just days to resolve Vitti's emotional crisis and turn him into a happy, well-adjusted gangster.",6.5,1992,"['Comedy', 'Crime']",2.0
2553,Village of the Damned (1960),Horror|Sci-Fi|Thriller,54443,11773.0,"In a small English village everyone suddenly falls unconscious. When they awake every woman of child bearing age is pregnant. The resulting children have the same strange blond hair, eyes and a strong connection to each other.",7.181,467,"['Horror', 'Science Fiction']",4.0
2554,Children of the Damned (1963),Horror|Sci-Fi|Thriller,56931,30202.0,"Six children are found spread through out the world that not only have enormous intelligence, but identical intelligence and have a strange bond to each other.",6.1,105,"['Drama', 'Horror', 'Mystery', 'Science Fiction']",4.0
2565,"King and I, The (1956)",Drama|Musical|Romance,49408,16520.0,"Widowed Welsh mother Anna Loenowens becomes a governess and English tutor to the wives and many children of the stubborn King Mongkut of Siam. Anna and the King have a clash of personalities as she works to teach the royal family about the English language, customs and etiquette, and rushes to prepare a party for a group of European diplomats who must change their opinions about the King.",7.1,389,"['Music', 'Romance', 'History']",4.0
2572,10 Things I Hate About You (1999),Comedy|Romance,147800,4951.0,"On the first day at his new school, Cameron instantly falls for Bianca, the gorgeous girl of his dreams. The only problem is that Bianca is forbidden to date until her ill-tempered, completely un-dateable older sister Kat goes out, too. In an attempt to solve his problem, Cameron singles out the only guy who could possibly be a match for Kat: a mysterious bad boy with a nasty reputation of his own.",7.593,8545,"['Comedy', 'Romance', 'Drama']",3.0
2574,"Out-of-Towners, The (1999)",Comedy,129280,8970.0,"The adventures of married couple Henry and Nancy Clark, vexed by misfortune while in New York City for Henry's job interview.",5.8,241,['Comedy'],4.0
2583,Cookie's Fortune (1999),Comedy|Drama,126250,9465.0,Conflict arises in the small town of Holly Springs when an old woman's death causes a variety of reactions among family and friends.,6.359,185,"['Comedy', 'Drama']",3.0
2597,Lost & Found (1999),Comedy|Romance,120836,39964.0,"In order to impress his beautiful French neighbor, Dylan Ramsey dognaps her pet pooch so he can return him and become a hero.",5.0,93,"['Comedy', 'Romance']",5.0
2612,Mildred Pierce (1945),Drama|Film-Noir,37913,3309.0,A hard-working mother inches towards disaster as she divorces her husband and starts a successful restaurant business to support her spoiled daughter.,7.619,423,"['Crime', 'Drama']",5.0
2617,"Mummy, The (1999)",Action|Adventure|Comedy|Fantasy|Horror|Thriller,120616,564.0,Dashing legionnaire Rick O'Connell stumbles upon the hidden ruins of Hamunaptra while in the midst of a battle to claim the area in 1920s Egypt. It has been over three thousand years since former High Priest Imhotep suffered a fate worse than death as a punishment for a forbidden love—along with a curse that guarantees eternal doom upon the world if he is ever awoken.,6.95,9511,"['Adventure', 'Action', 'Fantasy']",3.0
2636,"Mummy's Ghost, The (1944)",Horror,37099,29243.0,"An Egyptian high priest travels to America to reclaim the bodies of ancient Egyptian princess Ananka and her living guardian mummy Kharis. Learning that Ananka's spirit has been reincarnated into another body, he kidnaps a young woman of Egyptian descent with a mysterious resemblance to the princess. However, the high priest's greedy desires cause him to lose control of the mummy...",5.7,77,"['Horror', 'Fantasy']",4.0
2639,Mommie Dearest (1981),Drama,82766,15660.0,"Renowned film star Joan Crawford's abuse towards Christina, her adopted daughter, intensifies as her professional and romantic relationships turn sour.",6.4,220,['Drama'],5.0
2640,Superman (1978),Action|Adventure|Sci-Fi,78346,1924.0,"Mild-mannered Clark Kent works as a reporter at the Daily Planet alongside his crush, Lois Lane. Clark must summon his superhero alter-ego when the nefarious Lex Luthor launches a plan to take over the world.",7.155,4073,"['Science Fiction', 'Action', 'Adventure']",4.0
2648,Frankenstein (1931),Drama|Horror|Sci-Fi,21884,3035.0,"Tampering with life and death, Henry Frankenstein pieces together salvaged body parts to bring a human monster to life; the mad scientist's dreams are shattered by his creation's violent rage as the monster awakens to a world in which he is unwelcome.",7.5,1681,"['Drama', 'Horror', 'Science Fiction']",4.0
2657,"Rocky Horror Picture Show, The (1975)",Comedy|Horror|Musical|Sci-Fi,73629,36685.0,"After getting a flat tire in the middle of nowhere, newly engaged couple Brad and Janet encounter the eerie mansion of the flamboyant, seductive Dr. Frank-N-Furter and a variety of eccentric characters. Through elaborate dance and rock music, the mad scientist unveils his latest creation: a perfect, muscular man.",7.447,2958,"['Comedy', 'Science Fiction', 'Fantasy', 'Horror']",4.0
2671,Notting Hill (1999),Comedy|Romance,125439,509.0,London bookstore owner William Thacker's quiet life turns upside down when a chance encounter with famous actress Anna Scott sparks an unlikely romance challenged by their vastly different worlds.,7.264,6436,"['Romance', 'Comedy']",3.0
2694,Big Daddy (1999),Comedy,142342,9032.0,"A lazy law school grad adopts a kid to impress his girlfriend, but everything doesn't go as planned and he becomes the unlikely foster father.",6.489,3392,"['Comedy', 'Drama']",5.0
2699,Arachnophobia (1990),Comedy|Horror,99052,6488.0,"A large spider from the jungles of South America is accidentally transported in a crate with a dead body to America where it mates with a local spider. Soon after, the residents of a small California town disappear as the result of spider bites from the deadly spider offspring. It's up to a couple of doctors with the help of an insect exterminator to annihilate these eight legged freaks.",6.4,1444,"['Comedy', 'Horror']",5.0
2702,Summer of Sam (1999),Drama,162677,10279.0,"Spike Lee's take on the ""Son of Sam"" murders in New York City during the summer of 1977 centering on the residents of an Italian-American Northeast Bronx neighborhood who live in fear and distrust of one another.",6.504,496,"['Crime', 'Drama', 'Thriller']",4.0
2706,American Pie (1999),Comedy|Romance,163651,2105.0,"At a high-school party, four friends find that losing their collective virginity isn't as easy as they had thought. But they still believe that they need to do so before college. To motivate themselves, they enter a pact to all ""score"" by their senior prom.",6.6,7970,"['Comedy', 'Romance']",5.0
2707,Arlington Road (1999),Thriller,137363,1073.0,"Bedraggled college professor Michael Faraday has been vexed — and increasingly paranoid — since his wife's accidental death in a botched FBI operation. When a seemingly all-American couple set up house next door, Michael begin to suspect there’s more to them than meets the eye.",7.017,1164,"['Crime', 'Drama', 'Thriller', 'Mystery']",4.0
