movieId,title,genres,imdbId,tmdbId,overview,tmdb_vote_average,tmdb_vote_count,tmdb_genres,rating
5145,Loves of a Blonde (Lásky jedné plavovlásky) (1965),Comedy|Drama|Romance,59415,39387.0,"Andula, an innocent Czech girl from a factory town, is desperately in search of love. She believes she's found it when she beds Milda, a charming young musician visiting from Prague. Milda, however, is only looking for a casual encounter, and leaves town assuming he'll never see Andula again. But when Andula doesn't hear from him, she packs up and heads to Prague, to the surprise of Milda and his parents.",7.0,176,"['Comedy', 'Drama', 'Romance']",5.0
5147,Wild Strawberries (Smultronstället) (1957),Drama,50986,614.0,"Crotchety retired doctor Isak Borg travels from Stockholm to Lund, Sweden, with his pregnant and unhappy daughter-in-law, Marianne, in order to receive an honorary degree from his alma mater. Along the way, they encounter a series of hitchhikers, each of whom causes the elderly doctor to muse upon the pleasures and failures of his own life. These include the vivacious young Sara, a dead ringer for the doctor's own first love.",8.104,1728,['Drama'],5.0
5168,Royal Wedding (1951),Comedy|Musical|Romance,43983,18646.0,A brother and sister dance act encounter challenges and romance when booked in London during the Royal Wedding.,6.5,102,"['Music', 'Comedy', 'Romance']",4.0
5177,"Magnificent Ambersons, The (1942)",Drama|Romance,35015,965.0,The spoiled young heir to the decaying Amberson fortune comes between his widowed mother and the man she has always loved.,7.327,451,"['Drama', 'Romance']",5.0
5187,Hopscotch (1980),Comedy,80889,32030.0,"When CIA operative Miles Kendig deliberately lets KGB agent Yaskov get away, his boss threatens to retire him. Kendig beats him to it, however, destroying his own records and traveling to Austria where he begins work on a memoir that will expose all his former agency's covert practices. The CIA catches wind of the book and sends other agents after him, initiating a frenetic game of cat and mouse that spans the globe.",7.0,168,"['Comedy', 'Adventure']",5.0
5197,Little Darlings (1980),Drama,81060,27458.0,Two 15-year-old girls from different sides of the tracks compete to see who will be first to lose their virginity while at camp.,6.5,94,"['Comedy', 'Drama']",3.0
5225,And Your Mother Too (Y tu mamá también) (2001),Drama|Romance,245574,1391.0,"In Mexico, two teenage boys and an attractive older woman embark on a road trip and learn a thing or two about life, friendship, sex, and each other.",7.417,1638,"['Drama', 'Romance']",5.0
5269,"Piano Teacher, The (La pianiste) (2001)",Drama,254686,1791.0,"Erika Kohut, a sexually repressed piano teacher living with her domineering mother, meets a young man who starts romantically pursuing her.",7.3,1180,"['Drama', 'Romance']",5.0
5279,Impromptu (1991),Comedy|Romance,102103,17990.0,"In 1830s France, pianist/composer Frédéric Chopin is pursued romantically by the determined, individualistic woman who uses the name George Sand.",6.0,61,"['Drama', 'Comedy', 'Music', 'Romance']",4.0
5292,Slap Shot (1977),Comedy,76723,11590.0,"To build up attendance at their games, the management of a struggling minor-league hockey team signs up the Hanson Brothers, three hard-charging players whose job is to demolish the opposition.",6.8,398,"['Comedy', 'Drama']",4.0
5299,My Big Fat Greek Wedding (2002),Comedy|Romance,259446,8346.0,A young Greek woman falls in love with a non-Greek and struggles to get her family to accept him while she comes to terms with her heritage and cultural identity.,6.502,2206,"['Comedy', 'Drama', 'Romance']",4.0
5377,About a Boy (2002),Comedy|Drama|Romance,276751,245.0,"Will Freeman is a good-looking, smooth-talking bachelor whose primary goal in life is avoiding any kind of responsibility. But when he invents an imaginary son in order to meet attractive single moms, Will gets a hilarious lesson about life from a bright, but hopelessly geeky 12-year-old named Marcus. Now, as Will struggles to teach Marcus the art of being cool, Marcus teaches Will that you're never too old to grow up.",6.7,2290,"['Drama', 'Comedy', 'Romance']",4.0
5380,"Importance of Being Earnest, The (2002)",Comedy|Drama|Romance,278500,9026.0,"Two young gentlemen living in 1890s England use the same pseudonym ('Ernest') on the sly, which is fine until they both fall in love with women using that name, which leads to a comedy of mistaken identities.",6.8,495,"['Comedy', 'Drama', 'History', 'Romance']",4.0
5436,"Horse's Mouth, The (1958)",Comedy,51739,43139.0,"Gulley Jimson is a boorish aging artist recently released from prison. A swindler in search of his next art project, he hunkers down in the penthouse of would-be patrons the Beeders while they go on an extended vacation; he paints a mural on their wall, pawns their valuables and, along with the sculptor Abel, inadvertently smashes a large hole in their floor. Jimson's next project is an even larger wall in an abandoned church.",6.8,45,['Comedy'],5.0
5440,She Wore a Yellow Ribbon (1949),Western,41866,13909.0,"On the eve of retirement, Captain Nathan Brittles takes out a last patrol to stop an impending massive Indian attack. Encumbered by women who must be evacuated, Brittles finds his mission imperiled.",6.902,383,"['Drama', 'Western']",5.0
5470,The Importance of Being Earnest (1952),Comedy|Romance,44744,20324.0,"Two young gentlemen living in 1890s England use the same pseudonym ('Ernest') on the sly, which is fine until they both fall in love with women using that name, which leads to a comedy of mistaken identities.",7.173,114,['Comedy'],5.0
5475,Z (1969),Drama|Mystery|Thriller,65234,2721.0,"Amid a tense political climate, the opposition leader is killed in an apparent accident. When a prosecutor smells a cover-up, witnesses get targeted. A thinly veiled dramatization of the assassination of Greek politician Grigoris Lambrakis and its aftermath, “Z” captures the outrage at the US-backed junta that ruled Greece at the time of its release.",7.8,580,"['Thriller', 'Crime', 'Drama']",5.0
5548,Down and Out in Beverly Hills (1986),Comedy,90966,9941.0,Beverly Hills couple Barbara and Dave Whiteman find their lives altered by the arrival of a vagrant who tries to drown himself in their swimming pool.,5.9,267,['Comedy'],4.0
5560,À nous la liberté (Freedom for Us) (1931),Comedy|Musical,22599,31514.0,"In this classic French satire, Louis, a convict, escapes from prison and takes on legitimate work, making his way up in the business world. Eventually becoming the head of a successful factory, Louis opts to modernize his company with mechanical innovations. But when his friend Émile finally leaves jail years later and reunites with Louis, the past catches up with them. The two, worried about being apprehended by police, long to flee the confines of industry.",7.029,105,"['Comedy', 'Music']",5.0
5601,"Yearling, The (1946)",Children|Drama,39111,19049.0,"Jody convinces his parents to allow him to adopt a young deer, but what will happen if the deer misbehaves?",6.6,99,"['Drama', 'Family', 'Western']",5.0
5602,"Ladykillers, The (1955)",Comedy|Crime,48281,5506.0,Five oddball criminals planning a bank robbery rent rooms on a cul-de-sac from an octogenarian widow under the pretext that they are classical musicians.,7.3,505,"['Comedy', 'Crime']",5.0
5603,"Lavender Hill Mob, The (1951)",Comedy|Crime,44829,32961.0,A meek bank clerk who oversees the shipments of bullion joins with an eccentric neighbor to steal gold bars and smuggle them out of the country.,7.209,265,"['Comedy', 'Crime']",5.0
5604,"Man in the White Suit, The (1951)",Comedy|Sci-Fi,44876,32568.0,"The unassuming, nebbishy inventor Sidney Stratton creates a miraculous fabric that will never be dirty or worn out. Clearly he can make a fortune selling clothes made of the material, but may cause a crisis in the process. After all, once someone buys one of his suits they won't ever have to fix them or buy another one, and the clothing industry will collapse overnight. Nevertheless, Sidney is determined to put his invention on the market, forcing the clothing factory bigwigs to resort to more desperate measures...",6.9,194,"['Comedy', 'Science Fiction']",4.5
5695,To the Devil a Daughter (1976),Fantasy|Horror|Mystery,75334,40064.0,"An American occult novelist battles to save the soul of a young girl from a group of Satanists, led by an excommunicated priest, who plan on using her as the representative of the Devil on Earth.",5.459,116,['Horror'],4.0
5707,Absence of Malice (1981),Drama|Romance,81974,19429.0,"Megan Carter is a reporter duped into running an untrue story on Michael Gallagher, a suspected racketeer. He has an alibi for the time his crime was allegedly committed—but it involves an innocent party. When he tells Carter the truth and the newspaper runs it, tragedy follows, forcing Carter to face up to the responsibilities of her job when she is confronted by Gallagher.",6.6,231,"['Drama', 'Romance']",3.5
5712,Blow Out (1981),Mystery|Thriller,82085,11644.0,"While recording sound effects for a slasher flick, Jack Terry stumbles upon a real-life horror: a car careening off a bridge and into a river. Jack jumps into the water and fishes out Sally from the car, but the other passenger is already dead — a governor intending to run for president. As Jack does some investigating of his tapes, and starts a perilous romance with Sally, he enters a tangled web of conspiracy that might leave him dead.",7.375,1564,"['Thriller', 'Mystery', 'Crime', 'Drama']",4.0
5732,Eye of the Needle (1981),Thriller,82351,10863.0,"Great Britain, 1944, during World War II. Relentlessly pursued by several MI5 agents, Henry Faber the Needle, a ruthless German spy in possession of vital information about D-Day, takes refuge on Storm Island, an inhospitable, sparsely inhabited island off the coast of northern Scotland.",6.647,242,"['Drama', 'Thriller']",4.5
5772,My Dinner with André (1981),Drama,82783,25468.0,"Wally, a struggling playwright and actor, reluctantly agrees to catch up with his old friend Andre, a theater director who disappeared several years prior in order to travel the world. Meeting at a posh Manhattan restaurant, the two share life stories, anecdotes and philosophical musings over the course of an evening meal.",7.491,424,['Drama'],4.5
5782,"Professional, The (Le professionnel) (1981)",Action|Drama|Thriller,82949,1672.0,"French secret service agent Josselin Beaumont is dispatched to take down African warlord N'Jala. But when his assignment is canceled, he's shocked to learn that his government is surrendering him to local authorities. He is given a mock trial and sentenced to 20 years of hard labor. But Beaumont escapes from prison and vows not only to avenge himself against his betrayers but also to finish his original assignment.",7.222,556,"['Action', 'Adventure', 'Thriller']",5.0
5791,Frida (2002),Drama|Romance,120679,1360.0,"A biography of artist Frida Kahlo, who channeled the pain of a crippling injury and her tempestuous marriage into her work.",7.405,2087,"['Drama', 'Romance']",5.0
5800,How to Murder Your Wife (1965),Comedy,58212,26685.0,"Stanley Ford leads an idyllic bachelor life. He is a nationally syndicated cartoonist whose Bash Brannigan series provides him with a luxury townhouse and a full-time valet, Charles. When he wakes up the morning after the night before - he had attended a friend's stag party - he finds that he is married to the very beautiful woman who popped out of the cake - and who doesn't speak a word of English. Despite his initial protestations, he comes to like married life and even changes his cartoon character from a super spy to a somewhat harried husband.",6.361,140,['Comedy'],5.0
5801,"Russians Are Coming, the Russians Are Coming, The (1966)",Comedy|War,60921,31918.0,"When a Soviet submarine gets stuck on a sandbar off the coast of a New England island, its commander orders his second-in-command, Lieutenant Rozanov, to get them moving again before there is an international incident. Rozanov seeks assistance from the island locals, including the police chief and a vacationing television writer, while trying to allay their fears of a Communist invasion by claiming he and his crew are Norwegian sailors.",6.4,117,"['Comedy', 'War']",5.0
5816,Harry Potter and the Chamber of Secrets (2002),Adventure|Fantasy,295297,672.0,"Cars fly, trees fight back, and a mysterious house-elf comes to warn Harry Potter at the start of his second year at Hogwarts. Adventure and danger await when bloody writing on a wall announces: The Chamber Of Secrets Has Been Opened. To save Hogwarts will require all of Harry, Ron and Hermione’s magical abilities and courage.",7.705,22853,"['Adventure', 'Fantasy']",5.0
5825,"Life and Death of Colonel Blimp, The (1943)",Drama|Romance|War,36112,25037.0,"General Candy, who's overseeing an English squad in 1943, is a veteran leader who doesn't have the respect of the men he's training and is considered out-of-touch with what's needed to win the war. But it wasn't always this way. Flashing back to his early career in the Boer War and World War I, we see a dashing young officer whose life has been shaped by three different women, and by a lasting friendship with a German soldier.",7.5,258,"['War', 'Drama', 'Romance', 'Comedy']",4.5
5842,Too Beautiful for You (Trop belle pour toi) (1989),Comedy|Drama|Romance,98520,48524.0,"A car dealer, well-to-do and with a beautiful wife, finds himself attracted to his rather plain new temporary secretary. Despite her own commitments she feels the same and the two soon embark on an affair. Though it would seem it has happened before his wife finds this particular entanglement of her husband's very difficult to accept.",6.4,110,"['Drama', 'Romance', 'Comedy']",4.0
5873,The Emperor's Club (2002),Drama,283530,17187.0,"William Hundert is a passionate and principled Classics professor who finds his tightly-controlled world shaken and inexorably altered when a new student, Sedgewick Bell, walks into his classroom. What begins as a fierce battle of wills gives way to a close student-teacher relationship, but results in a life lesson for Hundert that will still haunt him a quarter of a century later.",7.1,392,['Drama'],3.5
5878,Talk to Her (Hable con Ella) (2002),Drama|Romance,287467,64.0,Two men share an odd friendship while they care for two women who are both in deep comas.,7.6,1365,"['Drama', 'Romance']",5.0
5881,Solaris (2002),Drama|Romance|Sci-Fi,307479,2103.0,A troubled psychologist is sent to investigate the crew of an isolated research station orbiting a bizarre planet.,5.9,1364,"['Drama', 'Science Fiction', 'Mystery']",4.0
5893,"Last Seduction, The (1994)",Crime|Drama|Thriller,110308,25284.0,A devious femme fatale steals her husband’s drug money and hides out in a small town where she meets the perfect dupe for her next scheme.,6.8,400,"['Thriller', 'Crime', 'Romance', 'Drama']",5.0
5945,About Schmidt (2002),Comedy|Drama,257360,2755.0,"A recently retired man embarks on a journey to his estranged daughter's wedding, only to discover more about himself and life than he ever expected.",6.8,1300,"['Drama', 'Comedy']",5.0
5991,Chicago (2002),Comedy|Crime|Drama|Musical,299658,1574.0,Murderesses Velma Kelly and Roxie Hart find themselves on death row together and fight for the fame that will keep them from the gallows in 1920s Chicago.,7.121,2754,"['Comedy', 'Crime', 'Drama']",5.0
6020,Alice Adams (1935),Comedy|Drama,26056,43886.0,"In the lower-middle-class Adams family, father and son are happy to work in a drugstore, but mother and daughter Alice try every possible social-climbing stratagem despite snubs and embarrassment. When Alice finally meets her dream man Arthur, mother nags father into a risky business venture and plans to impress Alice's beau with an ""upscale"" family dinner. Will the excruciating results drive Arthur away?",6.716,58,"['Romance', 'Drama']",4.0
6100,"Midsummer Night's Sex Comedy, A (1982)",Comedy|Romance,84329,8288.0,"A nutty inventor, his frustrated wife, a philosopher cousin, his much younger fiancée, a randy doctor, and a free-thinking nurse spend a summer weekend in and around a stunning - and possibly magical - country house.",6.5,444,"['Comedy', 'Romance']",4.0
6108,"That Night in Varennes (Nuit de Varennes, La) (1982)",Drama,84423,42131.0,"During the French Revolution, a surprising company shares a coach, trying to catch up something - the time itself, perhaps.",6.908,65,"['History', 'Comedy', 'Drama']",4.5
6109,One from the Heart (1982),Drama|Romance,84445,41291.0,"The five-year romance of a window dresser and her boyfriend breaks up, as each of them finds a more interesting partner.",5.966,194,"['Drama', 'Romance']",4.0
6218,Bend It Like Beckham (2002),Comedy|Drama|Romance,286499,455.0,"Jess Bhamra, the daughter of a strict Indian couple in London, is not permitted to play organized soccer, even though she is 18. When Jess is playing for fun one day, her impressive skills are seen by Jules Paxton, who then convinces Jess to play for her semi-pro team. Jess uses elaborate excuses to hide her matches from her family while also dealing with her romantic feelings for her coach, Joe.",6.327,1954,"['Comedy', 'Drama', 'Romance']",4.5
6238,Green Card (1990),Comedy|Drama|Romance,99699,12157.0,"Urban horticulturalist Brontë Mitchell has her eye on a gorgeous apartment, but the building's board will rent it only to a married couple. Georges Fauré, a waiter from France whose visa is expiring, needs to marry an American woman to stay in the country. Their marriage of convenience turns into a burden when they must live together to allay the suspicions of the immigration service, as the polar opposites grate on each other's nerves.",6.115,509,"['Comedy', 'Romance', 'Drama']",4.0
6241,Pauline at the Beach (Pauline à la Plage) (1983),Comedy|Drama|Romance,86087,10293.0,"Marion is about to divorce from her husband and takes her 15-year-old niece, Pauline, on a vacation to Granville. There, she meets an old love...",6.994,236,"['Drama', 'Romance', 'Comedy']",4.0
6254,"Awful Truth, The (1937)",Comedy|Romance,28597,14675.0,"Unfounded suspicions lead a married couple to begin divorce proceedings, whereupon they start undermining each other's attempts to find new romance.",7.199,332,"['Comedy', 'Romance']",5.0
6271,Day for Night (La Nuit Américaine) (1973),Comedy|Drama|Romance,70460,1675.0,"A committed film director struggles to complete his movie while coping with a myriad of crises, personal and professional, among the cast and crew.",7.771,625,"['Comedy', 'Drama']",4.5
6296,"Mighty Wind, A (2003)",Comedy|Musical,310281,13370.0,"Three eclectic, never-quite-famous folk bands come together for the first time in decades following the death of their manager to put on an reunion concert in his honor, at the request of his son.",6.7,252,"['Comedy', 'Music']",4.0
6318,"Marrying Man, The (Too Hot to Handle) (1991)",Comedy|Romance,102411,31633.0,"Charley Pearl, wealthy heir and gadabout, is slated to marry Adele, the daughter of a Hollywood tycoon. But, during a wild bachelor party in Las Vegas, Charley strikes up a flirtation with nightclub crooner Vicki Anderson that soon leads to her bedroom. When the couple are discovered by Vicki's beau, infamous gangster Bugsy Siegel, he makes a surprising pronouncement -- they'd better marry, or Charley is a dead man.",5.6,118,"['Action', 'Comedy', 'Romance', 'Thriller', 'Drama']",4.0
6356,Gunfight at the O.K. Corral (1957),Western,50468,22201.0,Lawman Wyatt Earp and outlaw Doc Holliday form an unlikely alliance which culminates in their participation in the legendary Gunfight at the O.K. Corral.,7.0,361,"['Western', 'Drama']",5.0
6367,Down with Love (2003),Comedy|Romance,309530,10720.0,"In 1962 New York City, love blossoms between a playboy journalist and a feminist advice author.",6.1,753,"['Comedy', 'Romance']",3.0
6413,"Electric Horseman, The (1979)",Comedy|Western,79100,11145.0,"A former champion rodeo rider is reduced to using his saddle skills to promote a breakfast cereal in a gaudy Las Vegas show. When he's asked to perform with a $12 million horse, he discovers it is being doped to remain docile. He flees into the desert astride the beast in an act of defiance. A story-hungry female reporter gives chase.",6.1,159,"['Drama', 'Romance', 'Comedy', 'Western']",4.0
6448,"Flight of the Phoenix, The (1965)",Action|Adventure|Drama,59183,10243.0,A cargo aircraft crashes in a sandstorm in the Sahara with less than a dozen men on board. One of the passengers is an airplane designer who comes up with the idea of ripping off the undamaged wing and using it as the basis for a replacement aircraft they need to build before their food and water run out.,7.184,341,"['Adventure', 'Drama']",5.0
6459,"Desert Fox, The (1951)",Drama|War,43461,26205.0,The life and career of Erwin Rommel and his involvement in the plot to assassinate Hitler.,6.7,111,"['Action', 'Drama', 'History', 'War']",5.0
6498,Murphy's War (1971),War,67458,35068.0,"Murphy is the sole survivor of his crew, that has been massacred by a German U-Boat in the closing days of World War II. He is rescued, and ends up at a forgotten mission station near the mouth of the Orinoco, and begins to plot his vengeance. He wishes to sink the U-Boat by means of any method imaginable to him, and sets about to make the courageous attempt, assisted by Louis, the administrator of the local oil company.",6.1,83,"['Drama', 'War']",4.5
6513,Made for Each Other (1939),Comedy|Drama|Romance,31602,18569.0,A couple struggle to find happiness after a whirlwind courtship.,6.1,48,"['Comedy', 'Drama', 'Romance']",4.0
6516,Anastasia (1956),Drama,48947,38171.0,"Russian exiles in Paris plot to collect ten million pounds from the Bank of England by grooming a destitute, suicidal girl to pose as heir to the Russian throne. While Bounin is coaching her, he comes to believe that she is really Anastasia. In the end, the Empress must decide her claim.",6.811,180,"['Drama', 'Romance']",4.5
6561,"Mouse That Roared, The (1959)",Comedy|War,53084,12649.0,"The Duchy of Grand Fenwick decides that the only way to get out of their economic woes is to declare war on the United States, lose and accept foreign aid. They send an invasion force (in chain mail, armed with bows and arrows) to New York and they arrive during a nuclear drill that has cleared the streets.",6.301,123,['Comedy'],5.0
6565,Seabiscuit (2003),Drama,329575,4464.0,True story of the undersized Depression-era racehorse whose victories lifted not only the spirits of the team behind it but also those of their nation.,7.053,871,"['Drama', 'History']",4.5
6579,"One, Two, Three (1961)",Comedy,55256,430.0,"C.R. MacNamara is a managing director for Coca Cola in West Berlin during the Cold War, just before the Wall is put up. When Scarlett, the rebellious daughter of his boss, comes to West Berlin, MacNamara has to look after her, but this turns out to be a difficult task when she reveals to be married to a communist.",7.509,399,['Comedy'],4.0
6581,"Private Life of Sherlock Holmes, The (1970)",Comedy|Drama|Mystery,66249,5185.0,"Holmes and Dr. Watson take on the case of a beautiful woman whose husband has vanished. The investigation proves strange indeed, involving six missing midgets, villainous monks, a Scottish castle, the Loch Ness monster, and covert naval experiments.",6.844,305,"['Mystery', 'Comedy', 'Crime', 'Adventure', 'History']",4.0
6636,"Sure Thing, The (1985)",Comedy|Romance,90103,8992.0,"Gib, a beer-guzzling slob, and Alison, an uptight Ivy-Leaguer, are an unlikely duo stuck together on a cross-country trip during Christmas break. At first they get on each other's nerves but, as time passes, they find their divergent natures complement each other. Now they need to realize what they've already found before it's too late.",6.5,300,"['Comedy', 'Romance']",5.0
6650,Kind Hearts and Coronets (1949),Comedy|Drama,41546,11898.0,"When his mother eloped with an Italian opera singer, Louis Mazzini was cut off from her aristocratic family. After the family refuses to let her be buried in the family mausoleum, Louis avenges his mother's death by attempting to murder every family member who stands between himself and the family fortune. But when he finds himself torn between his longtime love and the widow of one of his victims, his plans go awry.",7.652,574,"['Comedy', 'Crime']",4.5
6658,10 (1979),Comedy|Romance,78721,9051.0,A Hollywood songwriter goes through a mid-life crisis and becomes infatuated with a sexy blonde newlywed.,5.741,278,"['Comedy', 'Romance']",4.5
6660,"Red Shoes, The (1948)",Drama|Fantasy|Musical|Romance,40725,19542.0,"In this classic drama, Vicky Page is an aspiring ballerina torn between her dedication to dance and her desire to love. While her imperious instructor, Boris Lermontov, urges to her to forget anything but ballet, Vicky begins to fall for the charming young composer Julian Craster. Eventually Vicky, under great emotional stress, must choose to pursue either her art or her romance, a decision that carries serious consequences.",7.979,705,"['Drama', 'Romance']",5.0
6666,"Discreet Charm of the Bourgeoisie, The (Charme discret de la bourgeoisie, Le) (1972)",Comedy|Drama|Fantasy,68361,4593.0,"In Luis Buñuel’s deliciously satiric masterpiece, an upper-class sextet sits down to dinner but never eats, their attempts continually thwarted by a vaudevillian mixture of events both actual and imagined.",7.473,857,['Comedy'],5.0
6684,Death in Venice (Morte a Venezia) (1971),Drama|Romance,67445,6619.0,"Composer Gustav von Aschenbach travels to Venice for health reasons. There, he becomes obsessed with the stunning beauty of an adolescent Polish boy named Tadzio who is staying with his family at the same Grand Hôtel des Bains on the Lido as Aschenbach.",7.278,510,['Drama'],4.5
