movieId,title,genres,imdbId,tmdbId,overview,tmdb_vote_average,tmdb_vote_count,tmdb_genres,rating
1,Toy Story (1995),Adventure|Animation|Children|Comedy|Fantasy,114709,862.0,"Led by Woody, Andy's toys live happily in his room until Andy's birthday brings Buzz Lightyear onto the scene. Afraid of losing his place in Andy's heart, Woody plots against Buzz. But when circumstances separate Buzz and Woody from their owner, the duo eventually learns to put aside their differences.",7.969,19166,"['Family', 'Comedy', 'Animation']",3.0
2,Jumanji (1995),Adventure|Children|Fantasy,113497,8844.0,"When siblings Judy and Peter discover an enchanted board game that opens the door to a magical world, they unwittingly invite Alan -- an adult who's been trapped inside the game for 26 years -- into their living room. Alan's only hope for freedom is to finish the game, which proves risky as all three find themselves running from giant rhinoceroses, evil monkeys and other terrifying creatures.",7.24,10907,"['Adventure', 'Fantasy', 'Family']",3.0
3,Grumpier Old Men (1995),Comedy|Romance,113228,15602.0,"A family wedding reignites the ancient feud between next-door neighbors and fishing buddies John and Max. Meanwhile, a sultry Italian divorcée opens a restaurant at the local bait shop, alarming the locals who worry she'll scare the fish away. But she's less interested in seafood than she is in cooking up a hot time with Max.",6.474,407,"['Romance', 'Comedy']",3.0
6,Heat (1995),Action|Crime|Thriller,113277,949.0,Obsessive master thief Neil McCauley leads a top-notch crew on various daring heists throughout Los Angeles while determined detective Vincent Hanna pursues him without rest. Each man recognizes and respects the ability and the dedication of the other even though they are aware their cat-and-mouse game may end in violence.,7.922,7814,"['Crime', 'Drama', 'Action']",5.0
10,GoldenEye (1995),Action|Adventure|Thriller,113189,710.0,"When a powerful satellite system falls into the hands of Alec Trevelyan, AKA Agent 006, a former ally-turned-enemy, only James Bond can save the world from a dangerous space weapon that -- in one short pulse -- could destroy the earth! As Bond squares off against his former compatriot, he also battles Xenia Onatopp, an assassin who uses pleasure as her ultimate weapon.",6.897,4105,"['Adventure', 'Action', 'Thriller']",4.0
16,Casino (1995),Crime|Drama,112641,524.0,"In early-1970s Las Vegas, Sam ""Ace"" Rothstein gets tapped by his bosses to head the Tangiers Casino. At first, he's a great success in the job, but over the years, problems with his loose-cannon enforcer Nicky Santoro, his ex-hustler wife Ginger, her con-artist ex Lester Diamond and a handful of corrupt politicians put Sam in ever-increasing danger.",7.994,6189,"['Crime', 'Drama']",5.0
19,Ace Ventura: When Nature Calls (1995),Comedy,112281,9273.0,"Summoned from an ashram in Tibet, Ace finds himself on a perilous journey into the jungles of Africa to find Shikaka, the missing sacred animal of the friendly Wachati tribe. He must accomplish this before the wedding of the Wachati's Princess to the prince of the warrior Wachootoos. If Ace fails, the result will be a vicious tribal war.",6.3,4340,"['Crime', 'Comedy', 'Adventure']",2.0
22,Copycat (1995),Crime|Drama|Horror|Mystery|Thriller,112722,1710.0,An agoraphobic psychologist and a female detective must work together to take down a serial killer who copies serial killers from the past.,6.469,1151,"['Thriller', 'Crime', 'Mystery', 'Horror', 'Drama']",4.0
25,Leaving Las Vegas (1995),Drama|Romance,113627,451.0,"Ben Sanderson, an alcoholic Hollywood screenwriter who lost everything because of his drinking, arrives in Las Vegas to drink himself to death. There, he meets and forms an uneasy friendship and non-interference pact with prostitute Sera.",7.251,1536,"['Drama', 'Romance']",3.0
31,Dangerous Minds (1995),Drama,112792,9909.0,"Former Marine Louanne Johnson lands a gig teaching in a pilot program for bright but underachieving teens at a notorious inner-city high school. After having a terrible first day, she decides she must throw decorum to the wind. When Johnson returns to the classroom, she does so armed with a no-nonsense attitude informed by her military training and a fearless determination to better the lives of her students -- no matter what the cost.",6.977,1203,['Drama'],3.0
32,Twelve Monkeys (a.k.a. 12 Monkeys) (1995),Mystery|Sci-Fi|Thriller,114746,63.0,"In the year 2035, convict James Cole reluctantly volunteers to be sent back in time to discover the origin of a deadly virus that wiped out nearly all of the earth's population and forced the survivors into underground communities. But when Cole is mistakenly sent to 1990 instead of 1996, he's arrested and locked up in a mental hospital. There he meets psychiatrist Dr. Kathryn Railly and the son of a famous virus expert who may hold the key to the Army of the 12 Monkeys; thought to be responsible for unleashing the killer disease.",7.601,8713,"['Science Fiction', 'Thriller', 'Mystery']",4.0
34,Babe (1995),Children|Drama,112431,9598.0,"Babe is a little pig who doesn't quite know his place in the world. With a bunch of odd friends, like Ferdinand the duck who thinks he is a rooster and Fly the dog he calls mum, Babe realises that he has the makings to become the greatest sheep pig of all time, and Farmer Hoggett knows it. With the help of the sheep dogs, Babe learns that a pig can be anything that he wants to be.",6.248,3003,"['Fantasy', 'Drama', 'Comedy', 'Family']",3.0
39,Clueless (1995),Comedy|Romance,112697,9603.0,"Shallow, rich and socially successful Cher is at the top of her Beverly Hills high school's pecking scale. Seeing herself as a matchmaker, Cher first coaxes two teachers into dating each other. Emboldened by her success, she decides to give hopelessly klutzy new student Tai a makeover. When Tai becomes more popular than she is, Cher realizes that her disapproving ex-stepbrother was right about how misguided she was -- and falls for him.",7.267,4619,"['Comedy', 'Romance']",1.0
44,Mortal Kombat (1995),Action|Adventure|Fantasy,113855,9312.0,"For nine generations an evil sorcerer has been victorious in hand-to-hand battle against his mortal enemies. If he wins a tenth Mortal Kombat tournament, desolation and evil will reign over the multiverse forever. To save Earth, three warriors must overcome seemingly insurmountable odds, their own inner demons, and superhuman foes in this action/adventure movie based on one of the most popular video games of all time.",5.867,2385,"['Action', 'Fantasy']",2.0
47,Seven (a.k.a. Se7en) (1995),Mystery|Thriller,114369,807.0,"Two homicide detectives are on a desperate hunt for a serial killer whose crimes are based on the ""seven deadly sins"" in this dark and haunting film that takes viewers from the tortured remains of one victim to the next. The seasoned Det. Somerset researches each sin in an effort to get inside the killer's mind, while his novice partner, Mills, scoffs at his efforts to unravel the case.",8.376,22135,"['Crime', 'Mystery', 'Thriller']",5.0
50,"Usual Suspects, The (1995)",Crime|Mystery|Thriller,114814,629.0,"Held in an L.A. interrogation room, Verbal Kint attempts to convince the feds that a mythic crime lord, Keyser Soze, not only exists, but was also responsible for drawing him and his four partners into a multi-million dollar heist that ended with an explosion in San Pedro harbor – leaving few survivors. Verbal lures his interrogators with an incredible story of the crime lord's almost supernatural prowess.",8.172,10880,"['Drama', 'Crime', 'Thriller']",5.0
79,"Juror, The (1996)",Drama|Thriller,116731,9623.0,"With his gangster boss on trial for murder, a mob thug known as ""the Teacher"" tells Annie Laird she must talk her fellow jurors into a not-guilty verdict, implying that he'll kill her son Oliver if she fails. She manages to do this, but, when it becomes clear that the mobsters might want to silence her for good, she sends Oliver abroad and tries to gather evidence of the plot against her, setting up a final showdown.",5.648,412,"['Thriller', 'Crime', 'Drama']",3.0
95,Broken Arrow (1996),Action|Adventure|Thriller,115759,9208.0,"When rogue stealth-fighter pilot Vic Deakins deliberately drops off the radar while on maneuvers, the Air Force ends up with two stolen nuclear warheads -- and Deakins's co-pilot, Riley Hale, is the military's only hope for getting them back. Traversing the deserted canyons of Utah, Hale teams with park ranger Terry Carmichael to put Deakins back in his box.",6.062,1589,"['Action', 'Thriller']",3.0
104,Happy Gilmore (1996),Comedy,116483,9614.0,"Failed hockey player-turned-golf whiz Happy Gilmore — whose unconventional approach and antics on the green courts the ire of rival Shooter McGavin — is determined to win a PGA tournament so he can save his granny's house with the prize money. Meanwhile, an attractive tour publicist tries to soften Happy's image.",6.67,3099,['Comedy'],3.0
110,Braveheart (1995),Action|Drama|War,112573,197.0,"Enraged at the slaughter of Murron, his new bride and childhood love, Scottish warrior William Wallace slays a platoon of the local English lord's soldiers. This leads the village to revolt and, eventually, the entire country to rise up against English rule.",7.943,10616,"['Action', 'Drama', 'History', 'War']",5.0
111,Taxi Driver (1976),Crime|Drama|Thriller,75314,103.0,"Suffering from insomnia, disturbed loner Travis Bickle takes a job as a New York City cabbie, haunting the streets nightly, growing increasingly detached from reality as he dreams of cleaning up the filthy city.",8.135,12893,"['Crime', 'Drama']",5.0
150,Apollo 13 (1995),Adventure|Drama|IMAX,112384,568.0,"The true story of technical troubles that scuttle the Apollo 13 lunar mission in 1970, risking the lives of astronaut Jim Lovell and his crew, with the failed journey turning into a thrilling saga of heroism. Drifting more than 200,000 miles from Earth, the astronauts work furiously with the ground crew to avert tragedy.",7.452,5616,"['Drama', 'History']",3.0
151,Rob Roy (1995),Action|Drama|Romance|War,114287,11780.0,"In the highlands of Scotland in the 1700s, Rob Roy tries to lead his small town to a better future, by borrowing money from the local nobility to buy cattle to herd to market. When the money is stolen, Rob is forced into a Robin Hood lifestyle to defend his family and honour.",6.721,675,"['Adventure', 'History', 'Drama', 'Action', 'War']",3.0
153,Batman Forever (1995),Action|Adventure|Comedy|Crime,112462,414.0,"Batman faces off against two foes: the schizophrenic, horribly scarred former District Attorney Harvey Dent, aka Two-Face, and the Riddler, a disgruntled ex-Wayne Enterprises inventor seeking revenge against his former employer by unleashing his brain-sucking weapon on Gotham City's residents. As the caped crusader also copes with tortured memories of his parents' murder, he has a new romance, with psychologist Chase Meridian.",5.444,5369,"['Action', 'Crime', 'Fantasy']",3.0
158,Casper (1995),Adventure|Children,112642,8839.0,"Casper is a kind young ghost who peacefully haunts a mansion in Maine. When specialist James Harvey arrives to communicate with Casper and his fellow spirits, he brings along his teenage daughter, Kat. Casper quickly falls in love with Kat, but their budding relationship is complicated not only by his transparent state, but also by his troublemaking apparition uncles and their mischievous antics.",6.331,4730,"['Fantasy', 'Comedy', 'Family']",3.0
161,Crimson Tide (1995),Drama|Thriller|War,112740,8963.0,"After the Cold War, a breakaway Russian republic with nuclear warheads becomes a possible worldwide threat. U.S. submarine Capt. Frank Ramsey signs on a relatively green but highly recommended Lt. Cmdr. Ron Hunter to the USS Alabama, which may be the only ship able to stop a possible Armageddon. When Ramsey insists that the Alabama must act aggressively, Hunter, fearing they will start rather than stop a disaster, leads a potential mutiny to stop him.",7.18,1873,"['Thriller', 'Action', 'Drama', 'War']",3.0
165,Die Hard: With a Vengeance (1995),Action|Crime|Thriller,112864,1572.0,"New York detective John McClane is back and kicking bad-guy butt in the third installment of this action-packed series, which finds him teaming with civilian Zeus Carver to prevent the loss of innocent lives. McClane thought he'd seen it all, until a genius named Simon engages McClane, his new ""partner"" -- and his beloved city -- in a deadly game that demands their concentration.",7.272,6379,"['Action', 'Thriller']",4.0
185,"Net, The (1995)",Action|Crime|Thriller,113957,1642.0,"Angela Bennett is a freelance computer systems analyst who tracks down software viruses. At night she hooks up to the internet and chats to others 'surfing the net'. While de-bugging a new high-tech game for a cyber friend, she comes across a top secret program and becomes the target of a mysterious organization who will stop at nothing to erase her identity and her existence, in order to protect the project.",6.036,1435,"['Crime', 'Drama', 'Mystery', 'Thriller', 'Action']",3.0
196,Species (1995),Horror|Sci-Fi,114508,9348.0,"In 1993, the Search for Extra Terrestrial Intelligence Project receives a transmission detailing an alien DNA structure, along with instructions on how to splice it with human DNA. The result is Sil, a sensual but deadly creature who can change from a beautiful woman to an armour-plated killing machine in the blink of an eye.",5.974,1736,"['Science Fiction', 'Horror', 'Action']",3.0
204,Under Siege 2: Dark Territory (1995),Action,114781,3512.0,"A passenger train has been hijacked by an electronics expert and turned into an untraceable command center for a weapons satellite. He has planned to blow up Washington DC and only one man can stop him, former Navy SEAL Casey Ryback.",5.849,959,"['Action', 'Thriller']",3.0
208,Waterworld (1995),Action|Adventure|Sci-Fi,114898,9804.0,"In a futuristic world where the polar ice caps have melted and made Earth a liquid planet, a beautiful barmaid rescues a mutant seafarer from a floating island prison. They escape, along with her young charge, Enola, and sail off aboard his ship. But the trio soon becomes the target of a menacing pirate who covets the map to 'Dryland'—which is tattooed on Enola's back.",6.231,3863,"['Adventure', 'Action', 'Science Fiction']",2.0
215,Before Sunrise (1995),Drama|Romance,112471,76.0,"An unexpected meeting on a train leads two travelers to spend an evening wandering through Vienna. As the night unfolds, they share stories and conversations about life and love, exploring new ideas while a quiet intimacy grows between them, knowing it may be their only night together.",7.964,4424,"['Drama', 'Romance']",5.0
223,Clerks (1994),Comedy,109445,2292.0,"Convenience and video store clerks Dante and Randal are sharp-witted, potty-mouthed and bored out of their minds. So in between needling customers, the counter jockeys play hockey on the roof, visit a funeral home and deal with their love lives.",7.4,2614,['Comedy'],4.0
224,Don Juan DeMarco (1995),Comedy|Drama|Romance,112883,1909.0,"John Arnold DeMarco is a man who believes he is Don Juan, the greatest lover in the world. Clad in a cape and mask, DeMarco undergoes psychiatric treatment with Dr. Jack Mickler to cure him of his apparent delusion. But the psychiatric sessions have an unexpected effect on the psychiatric staff and, most profoundly, Dr Mickler, who rekindles the romance in his complacent marriage.",6.738,770,"['Romance', 'Drama', 'Comedy']",3.0
225,Disclosure (1994),Drama|Thriller,109635,8984.0,"A computer specialist is sued for sexual harassment by a former lover turned boss who initiated the act forcefully, which threatens both his career and his personal life.",6.26,1217,"['Thriller', 'Drama', 'Crime']",3.0
230,Dolores Claiborne (1995),Drama|Thriller,109642,11929.0,"Dolores Claiborne was accused of killing her abusive husband twenty years ago, but the court's findings were inconclusive and she was allowed to walk free. Now she has been accused of killing her employer, Vera Donovan, and this time there is a witness who can place her at the scene of the crime. Things look bad for Dolores when her daughter Selena, a successful Manhattan magazine writer, returns to cover the story.",7.3,816,"['Crime', 'Drama', 'Mystery']",3.0
231,Dumb & Dumber (Dumb and Dumber) (1994),Adventure|Comedy,109686,8467.0,"Lloyd and Harry are two men whose stupidity is really indescribable. When Mary, a beautiful woman, loses an important suitcase with money before she leaves for Aspen, the two friends (who have found the suitcase) decide to return it to her. After some ""adventures"" they finally get to Aspen where, using the lost money they live it up and fight for Mary's heart.",6.636,6387,['Comedy'],3.0
260,Star Wars: Episode IV - A New Hope (1977),Action|Adventure|Sci-Fi,76759,11.0,Princess Leia is captured and held hostage by the evil Imperial forces in their effort to take over the galactic Empire. Venturesome Luke Skywalker and dashing captain Han Solo team together with the loveable robot duo R2-D2 and C-3PO to rescue the beautiful princess and restore peace and justice in the Empire.,8.205,21519,"['Adventure', 'Action', 'Science Fiction']",3.0
288,Natural Born Killers (1994),Action|Crime|Thriller,110632,241.0,Two victims of traumatized childhoods become lovers and serial murderers irresponsibly glorified by the mass media.,7.052,3596,"['Crime', 'Thriller', 'Drama']",3.0
292,Outbreak (1995),Action|Drama|Sci-Fi|Thriller,114069,6950.0,"A deadly airborne virus finds its way into the USA and starts killing off people at an epidemic rate. Col. Sam Daniels' job is to stop the virus spreading from a small town, which must be quarantined, and to prevent an over reaction by the White House.",6.568,2365,"['Action', 'Drama', 'Science Fiction', 'Thriller']",4.0
293,Léon: The Professional (a.k.a. The Professional) (Léon) (1994),Action|Crime|Drama|Thriller,110413,101.0,"Léon, the top hit man in New York, has earned a rep as an effective ""cleaner"". But when his next-door neighbors are wiped out by a loose-cannon DEA agent, he becomes the unwilling custodian of 12-year-old Mathilda. Before long, Mathilda's thoughts turn to revenge, and she considers following in Léon's footsteps.",8.3,15470,"['Crime', 'Drama', 'Action']",5.0
296,Pulp Fiction (1994),Comedy|Crime|Drama|Thriller,110912,680.0,"A burger-loving hit man, his philosophical partner, a drug-addled gangster's moll and a washed-up boxer converge in this sprawling, comedic crime caper. Their adventures unfurl in three stories that ingeniously trip back and forth in time.",8.487,29116,"['Thriller', 'Crime', 'Comedy', 'Drama']",5.0
300,Quiz Show (1994),Drama,110932,11450.0,"Herbert Stempel's transformation into an unexpected television personality unfolds as he secures victory on the cherished American game show, 'Twenty-One.' However, when the show introduces the highly skilled contestant Charles Van Doren to replace Stempel, it compels Stempel to let out his frustrations and call out the show as rigged. Lawyer Richard Goodwin steps in and attempts to uncover the orchestrated deception behind the scenes.",7.3,940,"['History', 'Drama', 'Mystery']",1.0
315,"Specialist, The (1994)",Action|Drama|Thriller,111255,2636.0,"May Munro is a woman obsessed with getting revenge on the people who murdered her parents when she was still a girl. She hires Ray Quick, a retired explosives expert, to kill her parents' killers. When Ned Trent, embittered ex-partner of Quick's, is assigned to protect one of Quick's potential victims, a deadly game of cat and mouse ensues.",5.933,1359,"['Action', 'Thriller']",3.0
318,"Shawshank Redemption, The (1994)",Crime|Drama,111161,278.0,"Imprisoned in the 1940s for the double murder of his wife and her lover, upstanding banker Andy Dufresne begins a new life at the Shawshank prison, where he puts his accounting skills to work for an amoral warden. During his long stretch in prison, Dufresne comes to be admired by the other inmates -- including an older prisoner named Red -- for his integrity and unquenchable sense of hope.",8.713,28941,"['Drama', 'Crime']",4.0
319,Shallow Grave (1994),Comedy|Drama|Thriller,111149,9905.0,"When David, Juliet, and Alex find their new roommate dead with a large sum of money, they agree to hide the body and keep the cash. However, this newfound fortune gradually corrodes their friendship.",7.001,1073,"['Crime', 'Thriller']",3.0
339,While You Were Sleeping (1995),Comedy|Romance,114924,2064.0,"A transit worker pulls commuter Peter off railway tracks after he's mugged, but—while he's in a coma—his family mistakenly thinks she's Peter's fiancée, and she doesn't correct them. Things get more complicated when she falls for his brother, who's not quite sure that she's who she claims to be.",7.021,1898,"['Romance', 'Comedy']",4.0
344,Ace Ventura: Pet Detective (1994),Comedy,109040,3049.0,"He's Ace Ventura: Pet Detective. Jim Carrey is on the case to find the Miami Dolphins' missing mascot and quarterback Dan Marino. He goes eyeball to eyeball with a man-eating shark, stakes out the Miami Dolphins and woos and wows the ladies. Whether he's undercover, under fire or underwater, he always gets his man… or beast!",6.568,6081,"['Comedy', 'Mystery', 'Crime']",3.0
349,Clear and Present Danger (1994),Action|Crime|Drama|Thriller,109444,9331.0,"Agent Jack Ryan becomes acting Deputy Director of Intelligence for the CIA when Admiral Greer is diagnosed with cancer. When an American businessman, and friend of the president, is murdered on his yacht, Ryan starts discovering links between the man and drug dealers. As former CIA agent John Clark is sent to Colombia to kill drug cartel kingpins in retaliation, Ryan must fight through multiple cover-ups to figure out what happened and who's responsible.",6.7,1584,"['Action', 'Drama', 'Thriller']",3.0
356,Forrest Gump (1994),Comedy|Drama|Romance|War,109830,13.0,"A man with a low IQ has accomplished great things in his life and been present during significant historic events—in each case, far exceeding what anyone imagined he could do. But despite all he has achieved, his one true love eludes him.",8.466,28666,"['Comedy', 'Drama', 'Romance']",5.0
367,"Mask, The (1994)",Action|Comedy|Crime|Fantasy,110475,854.0,"When timid bank clerk Stanley Ipkiss discovers a magical mask containing the spirit of the Norse god Loki, his entire life changes. While wearing the mask, Ipkiss becomes a supernatural playboy exuding charm and confidence which allows him to catch the eye of local nightclub singer Tina Carlyle. Unfortunately, under the mask's influence, Ipkiss also robs a bank, which angers junior crime lord Dorian Tyrell, whose goons get blamed for the heist.",6.969,10751,"['Romance', 'Comedy', 'Crime', 'Fantasy']",5.0
377,Speed (1994),Action|Romance|Thriller,111257,1637.0,"Jack Traven, an LAPD cop on SWAT detail, and veteran SWAT officer Harry Temple thwart an extortionist-bomber's scheme for a $3 million ransom. As they corner the bomber, he flees and detonates a bomb vest, seemingly killing himself. Weeks later, Jack witnesses a mass transit city bus explode and nearby a pay phone rings. On the phone is that same bomber looking for vengeance and the money he's owed. He gives a personal challenge to Jack: a bomb is rigged on another city bus - if it slows down below 50 mph, it will explode - bad enough any day, but a nightmare in LA traffic. And that's just the beginning...",7.144,6499,"['Action', 'Thriller']",4.0
380,True Lies (1994),Action|Adventure|Comedy|Romance|Thriller,111503,36955.0,"A fearless, globe-trotting, terrorist-battling secret agent has his life turned upside down when he discovers his wife might be having an affair with a used car salesman while terrorists smuggle nuclear war heads into the United States.",7.085,4326,"['Action', 'Thriller']",5.0
393,Street Fighter (1994),Action|Adventure|Fantasy,111301,11667.0,Colonel Guile and various other martial arts heroes fight against the tyranny of dictator M. Bison and his cohorts.,4.7,1543,"['Action', 'Adventure', 'Comedy', 'Thriller']",2.0
431,Carlito's Way (1993),Crime|Drama,106519,6075.0,"Free after years in prison, Carlito Brigante intends to give up his criminal ways, but it's not long before the ex-con is sucked back into the New York City underworld. Reconnecting with his dancer girlfriend, Carlito gets entangled in the shady dealings of his friend Dave Kleinfeld, who also serves as his lawyer. An encounter with shifty gangster Benny Blanco sets the duo on a dangerous path.",7.83,3313,"['Crime', 'Drama', 'Thriller']",4.0
454,"Firm, The (1993)",Drama|Thriller,106918,37233.0,"Mitch McDeere is a young man with a promising future in Law. About to sit his Bar exam, he is approached by 'The Firm' and made an offer he doesn't refuse. Seduced by the money and gifts showered on him, he is totally oblivious to the more sinister side of his company. Then, two Associates are murdered. The FBI contact him, asking him for information and suddenly his life is ruined. He has a choice - work with the FBI, or stay with the Firm. Either way he will lose his life as he knows it. Mitch figures the only way out is to follow his own plan...",6.729,2164,"['Drama', 'Mystery', 'Thriller']",3.0
455,Free Willy (1993),Adventure|Children|Drama,106965,1634.0,"When maladjusted orphan Jesse vandalizes a theme park, he is placed with foster parents and must work at the park to make amends. There he meets Willy, a young Orca whale who has been separated from his family. Sensing kinship, they form a bond and, with the help of kindly whale trainer Rae Lindley, develop a routine of tricks. However, greedy park owner Dial soon catches wind of the duo and makes plans to profit from them.",6.2,1874,"['Family', 'Adventure', 'Drama']",3.0
