movieId,title,genres,imdbId,tmdbId,overview,tmdb_vote_average,tmdb_vote_count,tmdb_genres,rating
1,Toy Story (1995),Adventure|Animation|Children|Comedy|Fantasy,114709,862.0,"Led by Woody, Andy's toys live happily in his room until Andy's birthday brings Buzz Lightyear onto the scene. Afraid of losing his place in Andy's heart, Woody plots against Buzz. But when circumstances separate Buzz and Woody from their owner, the duo eventually learns to put aside their differences.",7.969,19166,"['Family', 'Comedy', 'Animation']",4.0
3,Grumpier Old Men (1995),Comedy|Romance,113228,15602.0,"A family wedding reignites the ancient feud between next-door neighbors and fishing buddies John and Max. Meanwhile, a sultry Italian divorcée opens a restaurant at the local bait shop, alarming the locals who worry she'll scare the fish away. But she's less interested in seafood than she is in cooking up a hot time with Max.",6.474,407,"['Romance', 'Comedy']",3.0
17,Sense and Sensibility (1995),Drama|Romance,114388,4584.0,"The Dashwood sisters, sensible Elinor and passionate Marianne, whose chances at marriage seem doomed by their family's sudden loss of fortune.  When Henry Dashwood dies unexpectedly, his estate must pass on by law to his son from his first marriage, John and wife Fanny. But these circumstances leave Mr. Dashwood's current wife, and daughters Elinor, Marianne and Margaret, without a home and with barely enough money to live on. As Elinor and Marianne struggle to find romantic fulfillment in a society obsessed with financial and social status, they must learn to mix sense with sensibility in their dealings with both money and men.",7.418,1758,"['Drama', 'Romance']",4.0
26,Othello (1995),Drama,114057,16420.0,The evil Iago pretends to be friend of Othello in order to manipulate him to serve his own end in the film version of this Shakespeare classic.,6.4,147,['Drama'],4.0
28,Persuasion (1995),Drama|Romance,114117,17015.0,"Anne Elliot, the daughter of a financially troubled aristocratic family, is persuaded to break her engagement to Frederick Wentworth, a young sea captain of meager means. Years later, money troubles force Anne's father to rent out the family estate to Admiral Croft, and Anne is again thrown into company with Frederick -- who is now rich, successful, and perhaps still in love with Anne.",7.1,134,"['Drama', 'Romance']",5.0
39,Clueless (1995),Comedy|Romance,112697,9603.0,"Shallow, rich and socially successful Cher is at the top of her Beverly Hills high school's pecking scale. Seeing herself as a matchmaker, Cher first coaxes two teachers into dating each other. Emboldened by her success, she decides to give hopelessly klutzy new student Tai a makeover. When Tai becomes more popular than she is, Cher realizes that her disapproving ex-stepbrother was right about how misguided she was -- and falls for him.",7.267,4619,"['Comedy', 'Romance']",4.0
46,How to Make an American Quilt (1995),Drama|Romance,113347,11861.0,"Soon-to-be-wed graduate student Finn Dodd develops cold feet when she suspects her fiancé is cheating on her. In order to clear her head, Finn visits her grandmother, Hy, and great aunt, Glady Joe Cleary, in Grasse, Calif. There, Finn learns that Hy and Glady Joe are members of a group of passionate quilters, and over the course of her visit she is regaled with tales of love and life by women who have collected rich experiences and much wisdom.",6.4,188,"['Drama', 'Romance']",2.0
52,Mighty Aphrodite (1995),Comedy|Drama|Romance,113819,11448.0,"When Lenny and his wife, Amanda, adopt a baby, Lenny realizes that his son is a genius and becomes obsessed with finding the boy's biological mother in hopes that she will be brilliant too. But when he learns that Max's mother is Linda Ash, a kindhearted prostitute and porn star, Lenny is determined to reform her immoral lifestyle. A Greek chorus chimes in to relate the plot to Greek mythology in this quirky comedy.",6.723,713,"['Comedy', 'Romance']",4.0
68,French Twist (Gazon maudit) (1995),Comedy|Romance,113149,4482.0,"After learning of her husband's infidelities, a housewife invites an itinerant lesbian to move in with them. None of their lives will ever be the same again.",6.1,313,"['Comedy', 'Romance']",4.0
74,Bed of Roses (1996),Drama|Romance,115644,20927.0,"The seeds of love are planted when Lisa, a high-powered investment banker, receives flowers from a secret admirer. But when his fairy-tale fantasies clash with her workaholic ways, they soon find out that sometimes, it's harder than it seems for love to conquer all.",5.9,118,"['Drama', 'Romance']",4.0
111,Taxi Driver (1976),Crime|Drama|Thriller,75314,103.0,"Suffering from insomnia, disturbed loner Travis Bickle takes a job as a New York City cabbie, haunting the streets nightly, growing increasingly detached from reality as he dreams of cleaning up the filthy city.",8.135,12893,"['Crime', 'Drama']",4.0
123,Chungking Express (Chung Hing sam lam) (1994),Drama|Mystery|Romance,109424,11104.0,"Two melancholic Hong Kong policemen fall in love: one with a mysterious underworld figure, the other with a beautiful and ethereal server at a late-night restaurant.",7.971,2015,"['Drama', 'Comedy', 'Romance']",5.0
154,Beauty of the Day (Belle de jour) (1967),Drama,61395,649.0,"Beautiful young housewife Séverine Serizy cannot reconcile her masochistic fantasies with her everyday life alongside dutiful husband Pierre. When her lovestruck friend Henri mentions a secretive high-class brothel run by Madame Anais, Séverine begins to work there during the day under the name Belle de Jour. But when one of her clients grows possessive, she must try to go back to her normal life.",7.321,963,"['Drama', 'Romance']",5.0
162,Crumb (1994),Documentary,109508,26564.0,"This movie chronicles the life and times of R. Crumb. Robert Crumb is the cartoonist/artist who drew Keep On Truckin', Fritz the Cat, and played a major pioneering role in the genesis of underground comix. Through interviews with his mother, two brothers, wife, ex-wife and ex-girlfriends, as well as selections from his vast quantity of graphic art, we are treated to a darkly comic ride through one man's subconscious mind.",7.5,265,['Documentary'],5.0
176,Living in Oblivion (1995),Comedy,113677,9071.0,"Low-budget independent filmmaker Nick Reve tries to keep everything together as his production is plagued with an insecure actress, a megalomaniac star, a pretentious beret-wearing director of photography, and lousy catering.",7.2,300,"['Comedy', 'Drama']",5.0
186,Nine Months (1995),Comedy|Romance,113986,11472.0,"When he finds out his longtime girlfriend is pregnant, a commitment-phobe realizes he might have to change his lifestyle for better or much, much worse.",5.705,671,"['Romance', 'Comedy']",3.0
195,Something to Talk About (1995),Comedy|Drama|Romance,114496,18402.0,"Grace King Bichon, who is managing her father's riding-stable, discovers that her husband Eddie is deceiving her with another woman. After confronting him in the middle of the night on the streets of their small home town, she decides to stay at her sister Emma Rae's house for a while to make up her mind. Breaking out of her everyday life, she starts to question the authority of everyone.",5.7,245,"['Comedy', 'Drama']",2.0
199,"Umbrellas of Cherbourg, The (Parapluies de Cherbourg, Les) (1964)",Drama|Musical|Romance,58450,5967.0,"This simple romantic tragedy begins in 1957. Guy Foucher, a 20-year-old French auto mechanic, has fallen in love with 17-year-old Geneviève Emery, an employee in her widowed mother's chic but financially embattled umbrella shop. On the evening before Guy is to leave for a two-year tour of combat in Algeria, he and Geneviève make love. She becomes pregnant and must choose between waiting for Guy's return or accepting an offer of marriage from a wealthy diamond merchant.",7.4,838,"['Drama', 'Romance']",4.0
203,"To Wong Foo, Thanks for Everything! Julie Newmar (1995)",Comedy,114682,9090.0,"Manhattan drag queens Vida Boheme and Noxeema Jackson impress regional judges in competition, securing berths in the Nationals in Los Angeles. When the two meet pathetic drag novice Chi-Chi Rodriguez — one of the losers that evening — the charmed Vida and Noxeema agree to take the hopeless youngster under their joined wing. Soon the three set off on a madcap road trip across America and struggle to make it to Los Angeles in time.",7.377,709,"['Comedy', 'Drama']",3.0
206,Unzipped (1995),Documentary,114805,77350.0,"Isaac Mizrahi, one of the most successful designers in high fashion, plans his fall 1994 collection.",5.5,17,['Documentary'],5.0
211,"Browning Version, The (1994)",Drama,109340,49805.0,"Andrew Crocker-Harris is an embittered and disliked teacher of Greek and Latin at a British prep school. After nearly 20 years of service, he is being forced to retire for 'health reasons', and perhaps may not even be given a pension. The boys regard him as a Hitler, with some justification. His unfaithful wife Laura tries to hurt him in any way she can. Andrew must come to terms with his failed life and at least regain his own self-esteem.",6.6,54,['Drama'],4.0
224,Don Juan DeMarco (1995),Comedy|Drama|Romance,112883,1909.0,"John Arnold DeMarco is a man who believes he is Don Juan, the greatest lover in the world. Clad in a cape and mask, DeMarco undergoes psychiatric treatment with Dr. Jack Mickler to cure him of his apparent delusion. But the psychiatric sessions have an unexpected effect on the psychiatric staff and, most profoundly, Dr Mickler, who rekindles the romance in his complacent marriage.",6.738,770,"['Romance', 'Drama', 'Comedy']",3.5
235,Ed Wood (1994),Comedy|Drama,109707,522.0,"The mostly true story of the legendary ""worst director of all time"", who, with the help of his strange friends, filmed countless B-movies without ever becoming famous or successful.",7.49,2412,"['Comedy', 'Drama', 'History']",3.0
236,French Kiss (1995),Action|Comedy|Romance,113117,397.0,"After her fiancee admits to infidelity while on a business trip in France, a woman attempts to get her lover back and marry him by traveling to Paris despite her crippling fear of flying.  On the way she unwittingly smuggles something of value that has a charming crook chasing her across France as she chases after her future husband.",6.47,758,"['Comedy', 'Romance']",3.0
237,Forget Paris (1995),Comedy|Romance,113097,10525.0,"Mickey Gordon is a basketball referee who travels to France to bury his father. Ellen Andrews is an American living in Paris who works for the airline he flies on. They meet and fall in love, but their relationship goes through many difficult patches.",6.3,159,"['Comedy', 'Drama', 'Romance']",2.0
242,Farinelli: il castrato (1994),Drama|Musical,109771,10954.0,"The life and career of Italian opera singer Farinelli, considered one of the greatest castrato singers of all time.",6.6,176,"['History', 'Drama', 'Music']",4.0
252,I.Q. (1994),Comedy|Romance,110099,11777.0,Albert Einstein helps a young man who's in love with Einstein's niece to catch her attention by pretending temporarily to be a great physicist.,6.022,467,"['Comedy', 'Drama', 'Romance']",3.0
254,Jefferson in Paris (1995),Drama,113463,87729.0,"His wife having recently died, Thomas Jefferson accepts the post of United States ambassador to pre-revolutionary France, though he finds it difficult to adjust to life in a country where the aristocracy subjugates an increasingly restless peasantry. In Paris, he becomes smitten with cultured artist Maria Cosway, but, when his daughter visits from Virginia accompanied by her attractive slave, Sally Hemings, Jefferson's attentions are diverted.",5.1,43,"['Drama', 'Romance', 'History']",3.0
261,Little Women (1994),Drama,110367,9587.0,"With their father away as a chaplain in the Civil War, Jo, Meg, Beth and Amy grow up with their mother in somewhat reduced circumstances. They are a close family who inevitably have their squabbles and tragedies. But the bond holds even when, later, male friends start to become a part of the household.",7.283,1276,"['Drama', 'Romance']",4.0
265,Like Water for Chocolate (Como agua para chocolate) (1992),Drama|Fantasy|Romance,103994,18183.0,"Tita is passionately in love with Pedro, but her controlling mother forbids her from marrying him. When Pedro marries her sister, Tita throws herself into her cooking and discovers she can transfer her emotions through the food she prepares, infecting all who eat it with her intense heartbreak.",7.3,532,"['Drama', 'Romance']",4.0
293,Léon: The Professional (a.k.a. The Professional) (Léon) (1994),Action|Crime|Drama|Thriller,110413,101.0,"Léon, the top hit man in New York, has earned a rep as an effective ""cleaner"". But when his next-door neighbors are wiped out by a loose-cannon DEA agent, he becomes the unwilling custodian of 12-year-old Mathilda. Before long, Mathilda's thoughts turn to revenge, and she considers following in Léon's footsteps.",8.3,15470,"['Crime', 'Drama', 'Action']",5.0
304,Roommates (1995),Comedy|Drama,114296,161495.0,"An elderly, yet young-at-heart man, moves in with his grandson, and both their lives turn upside-down.",5.9,28,"['Drama', 'Comedy']",4.0
305,Ready to Wear (Pret-A-Porter) (1994),Comedy,110907,3586.0,"During Paris Fashion Week, models, designers and industry hot shots gather to work, mingle, argue and try to seduce one another.",5.193,220,['Comedy'],1.0
306,Three Colors: Red (Trois couleurs: Rouge) (1994),Drama,111495,110.0,"Part-time model Valentine unexpectedly befriends a retired judge after she runs over his dog. At first, the grumpy man shows no concern about the dog, and Valentine decides to keep it. But the two form a bond when she returns to his house and catches him listening to his neighbors’ phone calls.",7.916,1473,"['Drama', 'Mystery', 'Romance']",5.0
307,Three Colors: Blue (Trois couleurs: Bleu) (1993),Drama,108394,108.0,"The wife of a famous composer survives a car accident that kills her husband and daughter. Now alone, she shakes off her old identity and explores her newfound freedom but finds that she is unbreakably bound to other humans, including her husband’s mistress, whose existence she never suspected.",7.652,1783,['Drama'],5.0
308,Three Colors: White (Trzy kolory: Bialy) (1994),Comedy|Drama,111507,109.0,"Polish immigrant Karol Karol finds himself out of a marriage, a job and a country when his French wife, Dominique, divorces him after six months due to his impotence. Forced to leave France after losing the business they jointly owned, Karol enlists fellow Polish expatriate Mikołaj to smuggle him back to their homeland.",7.5,1257,"['Comedy', 'Drama', 'Mystery']",5.0
314,"Secret of Roan Inish, The (1994)",Children|Drama|Fantasy|Mystery,111112,14334.0,"Ten-year-old Fiona is sent to live with her grandparents in a small fishing village in Donegal, Ireland. She soon learns the local legend that an ancestor of hers married a Selkie – a seal who can turn into a human. Years earlier, her baby brother was washed out to sea and never seen again, so when Fiona spies a naked little boy on the abandoned Isle of Roan Inish, she is compelled to investigate.",6.7,92,"['Adventure', 'Fantasy', 'Family', 'Drama']",4.0
351,"Corrina, Corrina (1994)",Comedy|Drama|Romance,109484,10464.0,"When Manny Singer's wife dies, his young daughter Molly becomes mute and withdrawn. To help cope with looking after Molly, he hires sassy housekeeper Corrina Washington, who coaxes Molly out of her shell and shows father and daughter a whole new way of life. Manny and Corrina's friendship delights Molly and enrages the other townspeople.",6.7,433,"['Comedy', 'Family', 'Romance']",4.0
357,Four Weddings and a Funeral (1994),Comedy|Romance,109831,712.0,"Over the course of five social occasions, a committed bachelor must consider the notion that he may have discovered love.",6.773,2840,"['Comedy', 'Drama', 'Romance']",4.5
363,"Wonderful, Horrible Life of Leni Riefenstahl, The (Macht der Bilder: Leni Riefenstahl, Die) (1993)",Documentary,107472,41647.0,"This documentary recounts the life and work of one of most famous, and yet reviled, German film directors in history, Leni Riefenstahl. The film recounts the rise of her career from a dancer, to a movie actor to the most important film director in Nazi Germany who directed such famous propaganda films as Triumph of the Will and Olympiad. The film also explores her later activities after Nazi Germany's defeat in 1945 and her disgrace for being so associated with it which includes her amazingly active life over the age of 90.",7.3,28,['Documentary'],4.0
378,Speechless (1994),Comedy|Romance,111256,15128.0,"In the midst of election season in New Mexico, political speechwriters Julia Mann and Kevin Vallick begin a romance, unaware they are working for candidates on opposite sides.",5.9,101,"['Romance', 'Comedy']",3.0
455,Free Willy (1993),Adventure|Children|Drama,106965,1634.0,"When maladjusted orphan Jesse vandalizes a theme park, he is placed with foster parents and must work at the park to make amends. There he meets Willy, a young Orca whale who has been separated from his family. Sensing kinship, they form a bond and, with the help of kindly whale trainer Rae Lindley, develop a routine of tricks. However, greedy park owner Dial soon catches wind of the duo and makes plans to profit from them.",6.2,1874,"['Family', 'Adventure', 'Drama']",3.0
468,"Englishman Who Went Up a Hill But Came Down a Mountain, The (1995)",Comedy|Romance,112966,10612.0,"When an English cartographer arrives in Wales to tell the residents of the Welsh village of Ffynnon Garw  that their 'mountain' is only a hill, the offended community sets out to remedy the situation.",6.32,308,"['Drama', 'Comedy', 'Romance']",3.0
498,Mr. Jones (1993),Drama|Romance,107611,2625.0,"The story about the relationship between a manic depressive man, Mr. Jones, and the female doctor who takes more than a professional interest in his treatment.",5.761,161,"['Drama', 'Romance']",2.0
500,Mrs. Doubtfire (1993),Comedy|Drama,107614,788.0,"Loving but irresponsible dad Daniel Hillard, estranged from his exasperated spouse, is crushed by a court order allowing only weekly visits with his kids. When Daniel learns his ex needs a housekeeper, he gets the job -- disguised as a British nanny. Soon he becomes not only his children's best pal but the kind of parent he should have been from the start.",7.195,6357,"['Comedy', 'Drama', 'Family']",2.0
531,"Secret Garden, The (1993)",Children|Drama,108071,11236.0,"A young British girl born and reared in India loses her neglectful parents in an earthquake. She is returned to England to live at her uncle's castle. Her uncle is very distant due to the loss of his wife ten years before. Neglected once again, she begins exploring the estate and discovers a garden that has been locked and forgotten. Aided by one of the servants' boys, she begins restoring the garden, and eventually discovers some other secrets of the manor.",7.422,940,"['Drama', 'Family', 'Fantasy']",4.5
537,Sirens (1994),Drama,111201,12519.0,"In 1930s Australia, Anglican clergyman Anthony Campion and his prim wife, Estella, are asked to visit noted painter Norman Lindsay, whose planned contribution to an international art exhibit is considered blasphemous. While Campion and Lindsay debate, Estella finds herself drawn to the three beautiful models sitting for the painter's current work, freethinking Sheela, sensual Pru and virginal Giddy.",5.589,158,"['Comedy', 'Drama']",4.0
539,Sleepless in Seattle (1993),Comedy|Drama|Romance,108160,858.0,"After the death of his mother, a young boy calls a radio station in an attempt to set his father up on a date. Talking about his father’s loneliness soon leads to a meeting with a young female journalist, who has flown to Seattle to write a story about the boy and his father.",6.738,2463,"['Comedy', 'Drama', 'Romance']",4.5
549,Thirty-Two Short Films About Glenn Gould (1993),Drama|Musical,108328,20967.0,"A collection of vignettes highlighting different aspects of the life, work, and character of the acclaimed Canadian classical pianist.",7.0,45,"['Drama', 'Music']",4.0
584,I Don't Want to Talk About It (De eso no se habla) (1993),Drama|Romance,106678,124304.0,"In an Argentine village in the 1930s, the willful Leonor discovers that her beloved daughter, Charlotte, has dwarfism. Attempting to let her have as normal a childhood as possible, Leonor never discusses Charlotte's lack of stature, nor lets anyone else in the village ever mention it. As Charlotte grows up into a smart and self-possessed young woman, local eccentric Ludovico, who collects miniatures, becomes smitten with her.",6.0,8,"['Romance', 'Drama']",4.0
586,Home Alone (1990),Children|Comedy,99785,771.0,"Eight-year-old Kevin McCallister makes the most of the situation after his family unwittingly leaves him behind when they go on Christmas vacation. When thieves try to break into his home, he puts up a fight like no other.",7.446,11877,"['Comedy', 'Family']",3.0
592,Batman (1989),Action|Crime|Thriller,96895,268.0,"Having witnessed his parents' brutal murder as a child, millionaire philanthropist Bruce Wayne fights crime in Gotham City disguised as Batman, a costumed hero who strikes fear into the hearts of villains. But when a deformed madman known as 'The Joker' seizes control of Gotham's criminal underworld, Batman must face his most ruthless nemesis ever while protecting both his identity and his love interest, reporter Vicki Vale.",7.234,8213,"['Fantasy', 'Action', 'Crime']",4.0
594,Snow White and the Seven Dwarfs (1937),Animation|Children|Drama|Fantasy|Musical,29583,408.0,"A beautiful girl, Snow White, takes refuge in the forest in the house of seven dwarfs to hide from her stepmother, the wicked Queen. The Queen is jealous because she wants to be known as ""the fairest in the land,"" and Snow White's beauty surpasses her own.",7.123,7743,"['Fantasy', 'Animation', 'Family']",5.0
596,Pinocchio (1940),Animation|Children|Fantasy|Musical,32910,10895.0,A little wooden puppet yearns to become a real boy.,7.1,6067,"['Animation', 'Family', 'Fantasy']",5.0
597,Pretty Woman (1990),Comedy|Romance,100405,114.0,"While on a business trip in Los Angeles, Edward Lewis, a millionaire entrepreneur who makes a living buying and breaking up companies, picks up a prostitute, Vivian, while asking for directions; after, Edward hires Vivian to stay with him for the weekend to accompany him to a few social events, and the two get closer only to discover there are significant hurdles to overcome as they try to bridge the gap between their very different worlds.",7.461,8626,"['Romance', 'Comedy']",4.0
618,Two Much (1995),Comedy|Romance,118001,46029.0,"Art Dodge is a painter-turned-gallerist drowning in debt. He gets in over his head when a con job leads to an engagement with a rich divorcee. He gets in deeper when he falls for her sister, and invents a twin brother to be her beau; and deeper still when his fiancée's ex-husband comes looking for revenge.",5.4,158,"['Comedy', 'Romance']",3.5
674,Barbarella (1968),Adventure|Comedy|Sci-Fi,62711,8069.0,"In the far future, a highly sexual woman is tasked with finding and stopping the evil Durand-Durand. Along the way she encounters various unusual people.",5.978,776,"['Science Fiction', 'Adventure', 'Comedy', 'Fantasy', 'Action']",4.0
702,Faces (1968),Drama,62952,753.0,"Middle-aged suburban husband Richard abruptly tells his wife, Maria, that he wants a divorce. As Richard takes up with a younger woman, Maria enjoys a night on the town with her friends and meets a younger man. As the couple and those around them confront a seemingly futile search for what they've lost -- love, excitement, passion -- this classic American independent film explores themes of aging and alienation.",7.1,208,['Drama'],4.5
708,"Truth About Cats & Dogs, The (1996)",Comedy|Romance,117979,8866.0,A successful veterinarian and radio show host with low self-esteem asks her model friend to impersonate her when a handsome man wants to see her.,6.1,329,"['Comedy', 'Romance']",3.0
722,"Haunted World of Edward D. Wood Jr., The (1996)",Documentary,113270,73183.0,"Often called the worst director in the history of cinema, Ed Wood is nevertheless a beloved figure among cult-film aficionados for his oddball productions. This documentary takes a look back at Wood's unique career at the margins of 1950s Hollywood, speaking to those who loved him and hated him. Bela Lugosi Jr. discusses his father's work in the abysmal ""Plan 9 From Outer Space,"" while a Baptist reverend recalls how he was tricked into financing the film.",7.6,11,['Documentary'],5.0
750,Dr. Strangelove or: How I Learned to Stop Worrying and Love the Bomb (1964),Comedy|War,57012,935.0,"After the insane General Jack D. Ripper initiates a nuclear strike on the Soviet Union, a war room full of politicians, generals and a Russian diplomat all frantically try to stop it.",8.123,5894,"['Comedy', 'War']",5.0
751,Careful (1992),Comedy|Horror,103926,55613.0,The mountain-village passions of a German widow and her sons unfold in the style of a 1920s expressionist movie.,6.0,27,"['Comedy', 'Drama', 'Fantasy']",5.0
771,"Life Is Rosy (a.k.a. Life Is Beautiful) (Vie est belle, La) (1987)",Comedy|Drama,94265,202425.0,A young man with dreams of pursuing a career in music moves form his small village to  the capital. Along the way he falls head over heels for a woman - the same woman his boss is also pursuing for his own reasons.,6.1,12,"['Music', 'Romance']",4.5
