movieId,title,genres,imdbId,tmdbId,overview,tmdb_vote_average,tmdb_vote_count,tmdb_genres,rating
3299,Hanging Up (2000),Comedy|Drama,162983,10385.0,"Three sisters - Georgia, Eve, and Maddy - do what they do best with life, love, and lunacy on the telephone lines that bind - when their curmudgeonly father, Lou, is admitted to a Los Angeles Hospital. After years of wild living, intermittent affection, and constant phoning, he is finally threatening to die.",5.3,181,"['Drama', 'Comedy']",3.0
3301,"Whole Nine Yards, The (2000)",Comedy|Crime,190138,2069.0,"After a mobster agrees to cooperate with an FBI investigation in order to stay out of prison, he's relocated by the authorities to a life of suburban anonymity as part of a witness protection program. It's not long before a couple of his new neighbours figure out his true identity and come knocking to see if he'd be up for one more hit—suburban style.",6.465,1970,"['Comedy', 'Crime']",4.0
3308,"Flamingo Kid, The (1984)",Comedy|Drama,87265,25010.0,"Brooklyn teenager Jeffrey Willis, thoroughly unhappy with his modest homestead, embraces the other-world aspects of his summer job at the posh Flamingo Club. He spurns his father in favor of the patronage of smooth-talking Phil Brody and is seduced by the ample bikini charms of club member Carla Samson. But thanks to a couple of late-summer hard lessons, the teen eventually realizes that family should always come first.",6.0,86,"['Comedy', 'Drama', 'Romance']",3.0
3324,Drowning Mona (2000),Comedy,186045,25166.0,"The recently deceased Mona Dearly was many things: an abusive wife, a domineering mother, a loud-mouthed neighbor and a violent malcontent. So when her car and corpse are discovered in the Hudson River, police Chief Wyatt Rash immediately suspects murder rather than an accident. But, since the whole community of Verplanck, N.Y., shares a deep hatred for this unceasingly spiteful woman, Rash finds his murder investigation overwhelmed with potential suspects.",5.469,176,"['Comedy', 'Crime', 'Mystery']",4.0
3358,Defending Your Life (1991),Comedy|Drama|Fantasy|Romance,101698,12186.0,"Is there love after death? After he dies suddenly, the hapless advertising executive Daniel Miller finds himself in Judgment City, a gleaming way station where the newly deceased must prove they lived a life of sufficient courage to advance in their journey through the universe. As the self-doubting Daniel struggles to make his case, a budding relationship with the uninhibited Julia offers him a chance to finally feel alive.",6.907,290,"['Comedy', 'Fantasy', 'Romance', 'Drama']",4.0
3361,Bull Durham (1988),Comedy|Drama|Romance,94812,287.0,"Veteran catcher Crash Davis is brought to the minor league Durham Bulls to help their up and coming pitching prospect, ""Nuke"" Laloosh. Their relationship gets off to a rocky start and is further complicated when baseball groupie Annie Savoy sets her sights on the two men.",6.633,619,"['Comedy', 'Romance']",4.0
3362,Dog Day Afternoon (1975),Crime|Drama,72890,968.0,"Based on the true story of would-be Brooklyn bank robbers John Wojtowicz and Salvatore Naturile. Sonny and Sal attempt a bank heist which quickly turns sour and escalates into a hostage situation and stand-off with the police. As Sonny's motives for the robbery are slowly revealed and things become more complicated, the heist turns into a media circus.",7.8,3148,"['Crime', 'Drama', 'Thriller']",4.0
3363,American Graffiti (1973),Comedy|Drama,69704,838.0,A couple of high school graduates spend one final night cruising the strip with their buddies before they go off to college.,7.04,1510,"['Comedy', 'Drama']",3.0
3385,Volunteers (1985),Comedy,90274,19259.0,"After his rich father refuses to pay his debt, compulsive gambler Lawrence Bourne III joins the Peace Corps to evade angry creditors. In Thailand, he is assigned to build a bridge for the local villagers with the help of American-As-Apple-Pie WSU Grad Tom Tuttle and the beautiful and down-to earth Beth Wexler.  What they don't realize is that the bridge is coveted by the U.S. Army, a local Communist force, and a powerful drug lord. Together with the help of At Toon, the only English speaking native, they must fight off the three opposing forces and find out what is right for the villagers, as well as themselves.",5.5,168,['Comedy'],2.0
3387,Who's Harry Crumb? (1989),Comedy|Mystery,98645,11718.0,Harry Crumb is a bumbling and inept private investigator who is hired to solve the kidnapping of a young heiress which he's not expected to solve because his employer is the mastermind behind the kidnapping.,6.0,335,"['Comedy', 'Crime', 'Mystery']",2.0
3388,Harry and the Hendersons (1987),Children|Comedy,93148,8989.0,"Returning from a hunting trip in the forest, the Henderson family's car hits an animal in the road. At first they fear it was a man, but when they examine the ""body"" they find it's a ""bigfoot"". They think it's dead so they decide to take it home (there could be some money in this). As you guessed, it isn't dead. Far from being the ferocious monster they fear ""Harry"" to be, he's a friendly giant.",6.116,697,"['Comedy', 'Family', 'Fantasy', 'Drama']",4.0
3391,Who's That Girl? (1987),Comedy,94321,26827.0,"An uptight New York tax lawyer gets his life turned upside down, all in a single day, when he's asked to escort a feisty and free-spirited female ex-convict whom asks him to help prove her innocence of her crime.",5.5,236,"['Comedy', 'Romance']",1.0
3392,She-Devil (1989),Comedy,98309,11157.0,A cunning and resourceful housewife vows revenge on her husband when he begins an affair with a wealthy romance novelist.,5.939,409,['Comedy'],3.0
3394,Blind Date (1987),Comedy|Romance,92666,918.0,"When bachelor Walter Davis is set up with his sister-in-law's pretty cousin, Nadia Gates, a seemingly average blind date turns into a chaotic night on the town. Walter's brother, Ted, tells him not to let Nadia drink alcohol, but he dismisses the warning and her behaviour gets increasingly wild. Walter and Nadia's numerous incidents are made even worse as her former lover David relentlessly follows them around town.",6.0,509,"['Comedy', 'Romance']",2.0
3395,Nadine (1987),Comedy,93596,61178.0,"Hairdresser Nadine Hightower wants to retrieve the risqué photos she once posed for, but when she visits the photographer at his office, he's murdered by an intruder. Nadine talks her estranged husband, Vernon, into going along when she returns to the office, where they stumble across plans for a less than legal construction project. But when Vernon tries to turn the documents into a cash windfall, he and Nadine are pursued by goons with guns.",5.4,86,"['Romance', 'Comedy', 'Crime', 'Action']",2.0
3398,"Muppets Take Manhattan, The (1984)",Children|Comedy|Musical,87755,11899.0,"When the Muppets graduate from Danhurst College, they take their song-filled senior revue to New York City, only to learn that it isn't easy to find a producer who's willing to back a show starring a frog and a pig. Of course, Kermit the Frog and Miss Piggy won't take no for an answer, launching a search for someone to take them to Broadway.",6.6,397,"['Romance', 'Comedy', 'Family']",3.0
3421,Animal House (1978),Comedy,77975,8469.0,"At a 1962 College, Dean Vernon Wormer is determined to expel the entire Delta Tau Chi Fraternity, but those troublemakers have other plans for him.",7.0,1594,['Comedy'],4.0
3424,Do the Right Thing (1989),Drama,97216,925.0,"Salvatore ""Sal"" Fragione is the Italian owner of a pizzeria in Brooklyn. A neighborhood local, Buggin' Out, becomes upset when he sees that the pizzeria's Wall of Fame exhibits only Italian actors. Buggin' Out believes a pizzeria in a black neighborhood should showcase black actors, but Sal disagrees. The wall becomes a symbol of racism and hate to Buggin' Out and to other people in the neighborhood, and tensions rise.",7.768,1887,['Drama'],3.0
3448,"Good Morning, Vietnam (1987)",Comedy|Drama|War,93105,801.0,"A disk jockey goes to Vietnam to work for the Armed Forces Radio Service. While he becomes popular among the troops, his superiors disapprove of his humor.",7.308,2865,"['Comedy', 'Drama', 'War']",2.0
3450,Grumpy Old Men (1993),Comedy,107050,11520.0,"For decades, next-door neighbors and former friends John and Max have feuded, trading insults and wicked pranks. When an attractive widow moves in nearby, their bad blood erupts into a high-stakes rivalry full of naughty jokes and adolescent hijinks.",6.7,706,"['Comedy', 'Romance']",4.0
3451,Guess Who's Coming to Dinner (1967),Drama,61735,1879.0,A couple's attitudes are challenged when their daughter brings home a fiancé who is black.,7.6,876,"['Drama', 'Romance']",5.0
3477,Empire Records (1995),Comedy|Drama,112950,13531.0,The employees of an independent music store learn about each other as they try to stop the store from being absorbed by a large chain.,6.6,749,"['Music', 'Comedy', 'Drama', 'Romance']",2.0
3497,Max Dugan Returns (1983),Comedy,85919,1793.0,An English teacher and struggling single mother has her life disrupted when the father who abandoned her as a child comes back into her life.,6.5,55,"['Comedy', 'Drama', 'Family']",4.0
3501,Murphy's Romance (1985),Comedy|Romance,89643,34322.0,"Emma, a divorced single mother seeking to start her life over, moves to a small town in Arizona. She befriends Murphy, the older local pharmacist, but things turn complicated when her ex-husband shows up.",6.157,70,"['Comedy', 'Drama', 'Romance']",3.0
3504,Network (1976),Comedy|Drama,74958,10774.0,"When veteran anchorman Howard Beale is forced to retire his 25-year post because of his age, he announces to viewers that he will kill himself during his farewell broadcast. Network executives rethink their decision when his fanatical tirade results in a spike in ratings.",7.811,1882,['Drama'],5.0
3506,North Dallas Forty (1979),Comedy|Drama,79640,29786.0,A semi-fictional account of life as a professional football player. Loosely based on the Dallas Cowboys team of the early 1970s.,6.7,68,"['Comedy', 'Drama']",5.0
3507,"Odd Couple, The (1968)",Comedy,63374,11356.0,"In New York, Felix, a neurotic news writer who just broke up with his wife, is urged by his chaotic friend Oscar, a sports journalist, to move in with him, but their lifestyles are as different as night and day are, so Felix's ideas about housekeeping soon begin to irritate Oscar.",7.5,608,['Comedy'],4.0
3516,"Bell, Book and Candle (1958)",Comedy|Fantasy|Romance,51406,2006.0,"A modern-day witch likes her neighbor but despises his fiancée, so she enchants him to love her instead... only to fall in love with him for real.",6.5,234,"['Comedy', 'Fantasy', 'Romance']",4.0
3524,Arthur (1981),Comedy|Romance,82031,13665.0,Arthur is a 30-year-old child who will inherit $750 million if he complies with his family's demands and marries the woman of their choosing.,6.508,447,"['Comedy', 'Drama', 'Romance']",3.0
3526,Parenthood (1989),Comedy|Drama,98067,1552.0,"The story of the Buckman family and friends, attempting to bring up their children. They suffer/enjoy all the events that occur: estranged relatives, the 'black sheep' of the family, the eccentrics, the skeletons in the closet, and the rebellious teenagers.",6.683,674,"['Comedy', 'Drama', 'Romance', 'Family']",3.0
3545,Cabaret (1972),Drama|Musical,68327,10784.0,"Inside the Kit Kat Club of 1931 Berlin, starry-eyed singer Sally Bowles and an impish emcee sound the clarion call to decadent fun, while outside a certain political party grows into a brutal force.",7.43,924,"['Music', 'Drama', 'Romance']",4.0
3549,Guys and Dolls (1955),Comedy|Musical|Romance,48140,4825.0,"Gambler Nathan Detroit has few options for the location of his big craps game. Needing $1,000 to pay a garage owner to host the game, Nathan bets Sky Masterson that Sky cannot get virtuous Sarah Brown out on a date. Despite some resistance, Sky negotiates a date with her in exchange for bringing people into her mission. Meanwhile, Nathan's longtime fiancée, Adelaide, wants him to go legit and marry her.",6.568,243,"['Comedy', 'Crime', 'Romance']",4.0
3552,Caddyshack (1980),Comedy,80487,11977.0,"At an exclusive country club, an ambitious young caddy, Danny Noonan, eagerly pursues a caddy scholarship in hopes of attending college and, in turn, avoiding a job at the lumber yard. In order to succeed, he must first win the favour of the elitist Judge Smails, and then the caddy golf tournament which Smails sponsors.",6.617,1225,['Comedy'],5.0
3564,"Flintstones in Viva Rock Vegas, The (2000)",Children|Comedy,158622,889.0,"The Flintstones are at it again. The Flintstones and the Rubbles head for Rock Vegas with Fred hoping to court the lovely Wilma. Nothing will stand in the way of love, except for the conniving Chip Rockefeller who is the playboy born in Baysville but who has made it in the cutthroat town of Rock Vegas. Will Fred win Wilma's love?",4.8,780,"['Comedy', 'Family', 'Romance']",4.0
3584,Breathless (1983),Action|Drama|Romance|Thriller,85276,1058.0,"Jesse, a small-time criminal, high-tails it to Los Angeles to rendezvous with a French exchange student. Stealing a car and accidentally killing a highway patrolman, he becomes the most wanted fugitive in L.A.",5.9,251,"['Romance', 'Drama', 'Action']",3.0
3590,"Lords of Flatbush, The (1974)",Comedy|Drama,71772,38925.0,"Set in 1958, the coming of age story follows four lower middle-class Brooklyn teenagers known as The Lords of Flatbush. The Lords chase girls, steal cars, shoot pool, get into street fights, and hang out at a local malt shop.",5.7,89,"['Drama', 'Comedy', 'Romance']",2.0
3591,Mr. Mom (1983),Comedy|Drama,85970,13105.0,"Jack and Caroline are a couple making a decent living when Jack suddenly loses his job. They agree that he should stay at home and look after the house while Caroline works. It's just that he's never done it before, and really doesn't have a clue...",6.6,330,"['Comedy', 'Drama']",5.0
3599,Anchors Aweigh (1945),Comedy|Musical,37514,17889.0,Two sailors on shore leave head out for four days of partying – only to become involved in the affairs of an aspiring singer and her precocious nephew.,6.806,162,"['Music', 'Comedy', 'Romance']",3.0
3604,Gypsy (1962),Musical,56048,39391.0,"Gypsy's mother Rose dreams of a life in show business for her daughters, but Louise becomes a huge burlesque star. Stage musical loosely based on the memoirs of Gypsy Rose Lee.",6.4,73,"['Comedy', 'Drama', 'Music']",5.0
3606,On the Town (1949),Comedy|Musical|Romance,41716,31516.0,Three sailors wreak havoc as they search for love during a whirlwind 24-hour leave in New York City.,7.017,264,"['Music', 'Comedy', 'Romance']",5.0
3612,The Slipper and the Rose: The Story of Cinderella (1976),Adventure|Children|Fantasy|Musical|Romance,75232,16176.0,"Prince Edward wants to marry for love, but the King and court of the kingdom of Euphrania are anxious for the prince to wed no matter what. When the prince meets Cinderella at a ball, he's sure she's the one, and when she loses her slipper upon exiting the dance, the prince is determined to find and marry her.",6.958,48,"['Adventure', 'Fantasy', 'Romance']",2.0
3619,"Hollywood Knights, The (1980)",Comedy,80881,21879.0,"Led by their comedic and pranking leader, Newbomb Turk, the Hollywood Knights car gang raise hell throughout Beverly Hills on Halloween Night, 1965. Everything from drag racing to Vietnam to high school love.",5.7,61,['Comedy'],3.0
3671,Blazing Saddles (1974),Comedy|Western,71230,11072.0,"A town—where everyone seems to be named Johnson—stands in the way of the railroad. In order to grab their land, robber baron Hedley Lamarr sends his henchmen to make life in the town unbearable. After the sheriff is killed, the town demands a new sheriff from the Governor, so Hedley convinces him to send the town the first black sheriff in the west.",7.248,1973,"['Western', 'Comedy']",5.0
3675,White Christmas (1954),Comedy|Musical|Romance,47673,13368.0,Two talented song-and-dance men team up after the war to become one of the hottest acts in show business. In time they befriend and become romantically involved with the beautiful Haynes sisters who comprise a sister act.,7.183,541,"['Comedy', 'Music', 'Romance']",5.0
3688,Porky's (1982),Comedy,84522,10246.0,"In 1954 Florida, a group of high school boys head to a strip club in the Everglades in an attempt to lose their collective virginity. When the club's owner and his sheriff brother swindle them out of their money and embarrass them, the boys plan revenge.",6.422,917,['Comedy'],2.0
3689,Porky's II: The Next Day (1983),Comedy,86129,19698.0,"When the students of Angel Beach High decide to stage ""An Evening With Shakespeare,"" their efforts are threatened by Miss Balbricker, who views the works of Shakespeare as obscene. She enlists the help of Reverend Bubba Flavel, a religious fanatic who brings along his flock of followers to pressure the school into shutting down the production.",5.7,333,['Comedy'],1.0
3690,Porky's Revenge (1985),Comedy,89826,23919.0,"As graduation nears for the class of 1955 at Angel Beach High, the gang once again faces off against their old enemy, Porky, who wants them to throw the school's championship basketball game since he has bet on the opposing team.",5.5,252,['Comedy'],2.0
3712,Soapdish (1991),Comedy,102951,25562.0,"Celeste Talbert is the star of the long-running soap opera ""The Sun Also Sets."" With the show's ratings down, Celeste's ruthlessly ambitious co-star, Montana Moorehead, and the show's arrogant producer, David Seton Barnes, plot to aggravate her into leaving the show by bringing back her old flame, Jeffrey Anderson, and hiring her beautiful young niece, Lori Craven.",6.3,261,['Comedy'],1.0
3740,Big Trouble in Little China (1986),Action|Adventure|Comedy|Fantasy,90728,6978.0,"Truck driver Jack Burton gets embroiled in a supernatural battle when his best friend Wang Chi's green-eyed fiancée is kidnapped by henchmen of the sorcerer Lo Pan, who must marry a girl with green eyes in order to return to the human realm.",7.212,3167,"['Action', 'Comedy', 'Fantasy', 'Adventure']",2.0
3752,"Me, Myself & Irene (2000)",Adventure|Comedy,183505,2123.0,"Rhode Island State Trooper Charlie Baileygates has a multiple personality disorder. One personality is crazy and aggressive, while the other is more friendly and laid back. Both of these personalities fall in love with the same woman named Irene after Charlie loses his medication.",6.6,4048,['Comedy'],2.0
3809,What About Bob? (1991),Comedy,103241,10276.0,"Before going on vacation, self-involved psychiatrist Dr. Leo Marvin has the misfortune of taking on a new patient: Bob Wiley. An exemplar of neediness and a compendium of phobias, Bob follows Marvin to his family's country house. Dr. Marvin tries to get him to leave; the trouble is, everyone loves Bob. As his oblivious patient makes himself at home, Dr. Marvin loses his professional composure and, before long, may be ready for the loony bin himself.",6.86,860,['Comedy'],5.0
3821,Nutty Professor II: The Klumps (2000),Comedy,144528,12107.0,"The hilarity begins when professor Sherman Klump finds romance with fellow DNA specialist, Denise Gaines, and discovers a brilliant formula that reverses aging. But Sherman's thin and obnoxious alter ego, Buddy Love, wants out...and a big piece of the action. And when Buddy gets loose, things get seriously nutty.",5.0,1351,"['Fantasy', 'Comedy', 'Romance', 'Science Fiction']",3.0
3841,Air America (1990),Action|Comedy,99005,11856.0,"Air America was the CIA's private airline operating in Laos during the Vietnam War, running anything and everything from soldiers to foodstuffs for local villagers. After losing his pilot's license, Billy Covington is recruited, and ends up in the middle of a bunch of lunatic pilots, gun-running by his friend Gene Ryack, and opium smuggling by his own superiors.",5.831,619,"['Action', 'Adventure', 'Comedy', 'Drama']",2.0
3868,"Naked Gun: From the Files of Police Squad!, The (1988)",Action|Comedy|Crime|Romance,95705,37136.0,"When the bumbling Lieutenant Frank Drebin investigates events following the shooting of his partner, he stumbles upon an attempt to assassinate Queen Elizabeth II.",7.265,4132,"['Comedy', 'Crime']",3.0
3893,Nurse Betty (2000),Comedy|Crime|Drama|Romance|Thriller,171580,10480.0,"What happens when a person decides that life is merely a state of mind? If you're Betty, a small-town waitress and soap opera fan from Fair Oaks, Kansas, you refuse to believe that you can't be with the love of your life just because he doesn't really exist. After all, life is no excuse for not living. Traumatized by a savage event, Betty enters into a fugue state that allows -- even encourages -- her to keep functioning... in a kind of alternate reality.",6.064,414,"['Comedy', 'Crime', 'Thriller', 'Drama', 'Romance']",3.0
3921,Beach Party (1963),Comedy,56860,26484.0,"Anthropology Professor Robert Orwell Sutwell and his secretary Marianne are studying the sex habits of teenagers. The surfing teens led by Frankie and Dee Dee don't have much sex but they sing, battle the motorcycle rats and mice led by Eric Von Zipper and dance to Dick Dale and the Del Tones.",6.0,37,"['Comedy', 'Music']",3.0
3928,Abbott and Costello Meet Frankenstein (1948),Comedy|Horror,40068,3073.0,"Baggage handlers Bud and Lou accidentally stumble upon Frankenstein's Monster, Dracula and the Wolf Man.",7.093,332,"['Horror', 'Comedy']",5.0
3948,Meet the Parents (2000),Comedy,212338,1597.0,"Greg Focker is ready to marry his girlfriend, Pam, but before he pops the question, he must win over her formidable father, humorless former CIA agent Jack Byrnes, at the wedding of Pam's sister. As Greg bends over backward to make a good impression, his visit to the Byrnes home turns into a hilarious series of disasters, and everything that can go wrong does, all under Jack's critical, hawklike gaze.",6.684,6138,"['Comedy', 'Romance']",3.0
3968,Bedazzled (2000),Comedy,230030,1636.0,"Elliot Richards, a socially awkward IT worker, is given seven wishes to get the girl of his dreams when he meets a very seductive Satan. The catch: his soul. Some of his wishes include being a 7 foot basketball star, a wealthy, powerful man, and a sensitive caring guy. But, as could be expected, the Devil puts her own little twist on each of his fantasies.",6.068,1982,"['Fantasy', 'Comedy', 'Romance']",4.0
4002,"Planes, Trains & Automobiles (1987)",Comedy,93748,2609.0,"An irritable marketing executive, Neal Page, is heading home to Chicago for Thanksgiving when a number of delays force him to travel with a well meaning but overbearing shower curtain ring salesman, Del Griffith.",7.244,2055,['Comedy'],4.0
4003,She's Having a Baby (1988),Comedy,96094,12714.0,"Jake and Kristy Briggs are newlyweds. Being young, they are perhaps a bit unprepared for the full reality of marriage and all that it (and their parents) expect from them. Do they want babies? Their parents certainly want them to. Is married life all that there is? Things certainly aren't helped by Jake's friend Davis, who always seems to turn up just in time to put a spanner in the works.",5.917,210,"['Comedy', 'Drama', 'Romance']",2.0
4010,Brewster's Millions (1985),Comedy,88850,11064.0,"Monty Brewster, an aging minor-league baseball player, stands to inherit $300 million if he can successfully spend $30 million in 30 days without anything to show for it, and without telling anyone what he's up to... A task that's a lot harder than it sounds!",6.6,624,['Comedy'],4.0
4014,Chocolat (2000),Drama|Romance,241303,392.0,"A mother and daughter move to a small French town where they open a chocolate shop. The town, religious and morally strict, is against them, as they represent free-thinking and indulgence. When a group of gypsies arrive by riverboat, the Mayor's prejudices lead to a crisis.",6.973,3386,"['Comedy', 'Drama', 'Romance']",4.0
4023,"Family Man, The (2000)",Comedy|Drama|Romance,218967,5994.0,"Jack's lavish, fast-paced lifestyle changes one Christmas night when he stumbles into a grocery store holdup and disarms the gunman. The next morning he wakes up in bed lying next to Kate, his college sweetheart he left in order to pursue his career, and to the horrifying discovery that his former life no longer exists. As he stumbles through this alternate suburban universe, Jack finds himself at a crossroad where he must choose between his high-power career and the woman he loves.",6.804,2062,"['Comedy', 'Drama', 'Romance', 'Fantasy']",3.0
4025,Miss Congeniality (2000),Comedy|Crime,212346,1493.0,"When the local FBI office receives a letter from a terrorist known only as 'The Citizen', it's quickly determined that he's planning his next act at the Miss America beauty pageant. Because tough-as-nails Gracie Hart is the only female Agent at the office, she's chosen to go undercover as the contestant from New Jersey.",6.54,4064,"['Comedy', 'Crime', 'Action']",4.0
4027,"O Brother, Where Art Thou? (2000)",Adventure|Comedy|Crime,190590,134.0,"In the deep south during the 1930s, three escaped convicts search for hidden treasure while a relentless lawman pursues them.",7.317,4364,"['Adventure', 'Comedy', 'Crime']",4.0
4039,Annie (1982),Children|Musical,83564,15739.0,"An orphan in a facility run by the mean Miss Hannigan, Annie believes that her parents left her there by mistake. When a rich man named Oliver ""Daddy"" Warbucks decides to let an orphan live at his home to promote his image, Annie is selected. While Annie gets accustomed to living in Warbucks' mansion, she still longs to meet her parents. So Warbucks announces a search for them and a reward, which brings out many frauds.",6.554,738,"['Comedy', 'Drama', 'Family']",4.0
