movieId,title,genres,imdbId,tmdbId,overview,tmdb_vote_average,tmdb_vote_count,tmdb_genres,rating
1282,Fantasia (1940),Animation|Children|Fantasy|Musical,32455,756.0,"Walt Disney's timeless masterpiece is an extravaganza of sight and sound! See the music come to life, hear the pictures burst into song and experience the excitement that is Fantasia over and over again.",7.3,3188,"['Animation', 'Family', 'Fantasy']",3.0
1285,Heathers (1989),Comedy,97493,2640.0,"A girl who halfheartedly tries to be part of the ""in crowd"" of her school meets a rebel who teaches her a more devious way to play social politics: by killing the popular kids.",7.277,1797,"['Comedy', 'Crime']",3.0
1292,Being There (1979),Comedy|Drama,78841,10322.0,"A simple-minded gardener named Chance has spent all his life in the Washington D.C. house of an old man. When the man dies, Chance is put out on the street with no knowledge of the world except what he has learned from television.",7.614,1049,"['Comedy', 'Drama']",4.0
1297,Real Genius (1985),Comedy,89886,14370.0,"When teenage geniuses Mitch Taylor and Chris Knight, working on an advanced laser project, learn that the military wants to use it as a weapon, they decide to thwart the plan.",6.672,468,"['Comedy', 'Romance', 'Science Fiction']",2.0
1307,When Harry Met Sally... (1989),Comedy|Romance,98635,639.0,"Sex always gets in the way of friendships between men and women. At least, that's what Harry Burns believes. So when Harry meets Sally Albright and a deep friendship blossoms between them, Harry's determined not to let his attraction to Sally destroy it. But when a night of weakness ends in a morning of panic, can the pair avoid succumbing to Harry's fears by remaining friends and admitting they just might be the perfect match for each other?",7.406,4310,"['Comedy', 'Romance', 'Drama']",4.0
1359,Jingle All the Way (1996),Children|Comedy,116705,9279.0,"Howard Langston, a salesman for a mattress company, is constantly kept busy at his job, disappointing his son. After he misses his son's karate exposition, Howard vows to make it up to him by buying an action figure of his son's favorite television hero for Christmas. Unfortunately for Howard, it is Christmas Eve, and every store is sold out of Turbo Man. Now, Howard must travel all over town and compete with everybody else to find a Turbo Man action figure.",6.05,2783,"['Family', 'Comedy', 'Adventure']",3.0
1367,101 Dalmatians (1996),Adventure|Children|Comedy,115433,11674.0,"An evil, high-fashion designer plots to steal Dalmatian puppies in order to make an extravagant fur coat, but instead creates an extravagant mess.",5.937,3498,"['Family', 'Comedy']",4.0
1377,Batman Returns (1992),Action|Crime,103776,364.0,"The monstrous Penguin, who dwells in the sewers beneath Gotham, joins up with corrupt mayoral candidate Max Shreck to topple the Batman once and for all. But when Shreck's timid assistant Selina Kyle finds out, and Shreck tries to kill her, she's transformed into the sexy Catwoman. She teams up with the Penguin and Shreck to destroy Batman, but sparks fly unexpectedly when she confronts the caped crusader.",6.9,6804,"['Action', 'Fantasy']",4.0
1380,Grease (1978),Comedy|Musical|Romance,77631,621.0,"Australian good girl Sandy and greaser Danny fell in love over the summer. But when they unexpectedly discover they're now in the same high school, will they be able to rekindle their romance despite their eccentric friends?",7.374,7473,"['Romance', 'Comedy']",3.0
1381,Grease 2 (1982),Comedy|Musical|Romance,84021,9037.0,"It's 1961, two years after the original Grease gang graduated, and there's a new crop of seniors and new members of the coolest cliques on campus, the Pink Ladies and T-Birds. Michael Carrington is the new kid in school - but he's been branded a brainiac. Can he fix up an old motorcycle, don a leather jacket, avoid a rumble with the leader of the T-Birds, and win the heart of Pink Lady Stephanie?",5.2,704,"['Comedy', 'Music', 'Romance']",2.0
1391,Mars Attacks! (1996),Action|Comedy|Sci-Fi,116996,75.0,"A fleet of Martian spacecraft surrounds the world's major cities and all of humanity waits to see if the extraterrestrial visitors have, as they claim, ""come in peace."" U.S. President James Dale receives assurance from science professor Donald Kessler that the Martians' mission is a friendly one. But when a peaceful exchange ends in the total annihilation of the U.S. Congress, military men call for a full-scale nuclear retaliation.",6.416,5650,"['Comedy', 'Fantasy', 'Science Fiction']",3.0
1394,Raising Arizona (1987),Comedy,93822,378.0,"When a childless couple--an ex-con and an ex-cop--decide to help themselves to one of another family's quintuplets, their lives become more complicated than they anticipated.",7.06,2210,"['Comedy', 'Crime']",3.0
1395,Tin Men (1987),Comedy|Drama,94155,10896.0,A minor car accident drives two rival aluminum-siding salesmen to the ridiculous extremes of man versus man in 1963 Baltimore.,6.354,130,"['Comedy', 'Drama']",3.0
1431,Beverly Hills Ninja (1997),Action|Comedy,118708,9622.0,"Haru, an orphaned American who washes ashore in Japan and is mistaken for the great White Ninja of legend. Raised among the finest Ninjas, Haru grows strong and big - very big. With the grace of all Three Stooges rolled into one body, Haru is an embarrassment to his clan. But when a beautiful blonde pleads for his help, Haru is given one dangerous, disastrously funny chance to prove himself.",5.662,799,"['Comedy', 'Action']",3.0
1445,McHale's Navy (1997),Comedy|War,119640,14908.0,"Retired Lieutenant Commander Quinton McHale spends his days puttering around the Caribbean in the old PT-73 selling homebrew, ice cream, and swimsuit calendars. He's brought out of retirement when his old nemesis turned the second best terrorist in the world, Major Vladikov, takes over the island of San Moreno and starts building a nuclear launch silo on it. With help from his old crew and hindrances from Captain Wallace B. Binghampton, who sank a cruise liner a while back, McHale tries to put Vladikov out of business.",4.4,74,['Comedy'],2.0
1457,Fools Rush In (1997),Comedy|Drama|Romance,119141,1968.0,"After a one night stand with Alex, Isabel realizes that she is pregnant and they decide to get married. However, along with the marriage comes compromise of one's own cultural traditions.",6.479,575,"['Comedy', 'Drama', 'Romance']",2.0
1461,Vegas Vacation (National Lampoon's Las Vegas Vacation) (1997),Comedy,120434,11419.0,"The Griswold family hits the road again for a typically ill-fated vacation, this time to the glitzy mecca of slots and showgirls—Las Vegas.",6.0,680,['Comedy'],2.0
1474,Jungle2Jungle (a.k.a. Jungle 2 Jungle) (1997),Children|Comedy,119432,9446.0,"Uptight New York City executive, Michael Cromwell, pursues his soon-to-be ex-wife to South America and returns home with the son he never knew he had—a boy raised in a tribal village in Brazil. Armed with only his blowgun, the 13-year-old Mimi-Siku discovers that the world outside his jungle home is indeed a strange place.",5.32,483,"['Comedy', 'Family']",3.0
1485,Liar Liar (1997),Comedy,119528,1624.0,"Forced by his son's birthday wish, fast-talking attorney and habitual liar Fletcher Reede must tell the truth for the next 24 hours.",6.703,5967,['Comedy'],5.0
1500,Grosse Pointe Blank (1997),Comedy|Crime|Romance,119229,9434.0,"Hitman Martin Blank becomes a moving target after he rebuffs a fellow assassin's invitation to form a union. On the advice of his quirky assistant and neurotic psychiatrist, Martin begrudgingly heads out to Grosse Pointe, Michigan for his ten-year high school reunion, where he soon comes across the woman he jilted on prom night.",6.947,968,"['Action', 'Comedy', 'Thriller', 'Romance']",4.0
1513,Romy and Michele's High School Reunion (1997),Comedy,120032,9611.0,"Two not-too-bright party girls reinvent themselves for their high school reunion. Armed with a borrowed Jaguar, new clothes and the story of their success as the inventors of Post-It notes, Romy and Michele descend on their alma mater, but their façade crumbles quickly.",6.2,556,['Comedy'],2.0
1517,Austin Powers: International Man of Mystery (1997),Action|Adventure|Comedy,118655,816.0,"As a swinging fashion photographer by day and a groovy British superagent by night, Austin Powers is the '60s' most shagadelic spy. But can he stop megalomaniac Dr. Evil after the bald villain freezes himself and unthaws in the '90s? With the help of sexy sidekick Vanessa Kensington, he just might.",6.582,3586,"['Science Fiction', 'Comedy', 'Crime']",4.0
1541,Addicted to Love (1997),Comedy|Romance,118556,2058.0,"Good-natured astronomer Sam is devastated when the love of his life leaves him for a suave Frenchman. He therefore does what every other normal dumpee would do — go to New York and set up home in the abandoned building opposite his ex-girlfriend's apartment, wait until she decides to leave her current lover, and then win her back.",6.2,427,"['Comedy', 'Romance']",4.0
1566,Hercules (1997),Adventure|Animation|Children|Comedy|Musical,119282,11970.0,"Bestowed with superhuman strength, a young mortal named Hercules sets out to prove himself a hero in the eyes of his father, the great god Zeus. Along with his friends Pegasus, a flying horse, and Phil, a personal trainer, Hercules is tricked by the hilarious, hotheaded villain Hades, who's plotting to take over Mount Olympus!",7.498,7697,"['Animation', 'Family', 'Fantasy', 'Adventure', 'Comedy', 'Romance']",4.0
1569,My Best Friend's Wedding (1997),Comedy|Romance,119738,8874.0,"When she receives word that her longtime platonic pal Michael O'Neal is getting married to debutante Kimberly Wallace, food critic Julianne Potter realizes her true feelings for Michael -- and sets out to sabotage the wedding.",6.588,2764,"['Comedy', 'Romance']",3.0
1580,Men in Black (a.k.a. MIB) (1997),Action|Comedy|Sci-Fi,119654,607.0,"After a police chase with an otherworldly being, a New York City cop is recruited as an agent in a top-secret organization established to monitor and police alien activity on Earth: the Men in Black. Agent K and new recruit Agent J find themselves in the middle of a deadly plot by an intergalactic terrorist who has arrived on Earth to assassinate two ambassadors from opposing galaxies.",7.213,14299,"['Action', 'Adventure', 'Comedy', 'Science Fiction']",4.0
1581,Out to Sea (1997),Comedy,119848,18080.0,"Care-free Charlie cons his widower brother-in-law Herb into an expenses-paid luxury cruise in search of rich, lonely ladies. The catch is that they are required to be dance hosts! With a tyrannical cruise director, and the luscious Liz and lovely Vivian, our heroes have lots of mis-adventures before they finally return to port.",5.738,105,"['Comedy', 'Romance']",2.0
1593,Picture Perfect (1997),Comedy|Romance,119896,9413.0,"A young advertising executive's life becomes increasingly complicated when, in order to impress her boss, she pretends to be engaged to a man she has just met.",5.852,438,"['Romance', 'Comedy', 'Drama']",2.0
1614,In & Out (1997),Comedy,119360,10806.0,A midwestern teacher questions his sexuality after a former student makes a comment about him at the Academy Awards.,6.472,710,['Comedy'],4.0
1663,Stripes (1981),Comedy|War,83131,10890.0,"Hard-luck cabbie John Winger, directionless after being fired from his job and dumped by his girlfriend, enlists in the U.S. Army with his close pal, Russell Ziskey. After his barely satisfactory performance in basic training, the irreverent Winger emerges as the figurehead for a ragtag band of misfits. However, his hijinks threaten to cause an international scandal when he inadvertently commandeers a military assault vehicle behind enemy lines.",6.569,955,"['Action', 'Comedy']",4.0
1703,For Richer or Poorer (1997),Comedy,119142,10371.0,"Brad Sexton and his wife, Caroline, are wealthy New Yorkers with both marital and financial problems. The latter issue becomes a pressing matter when they discover that their accountant has embezzled millions and pinned the blame on them. Forced to go on the lam, Brad and Caroline end up in an Amish area of Pennsylvania and decide to pose as members of the religious group to evade the IRS. As the two adapt to the simple Amish lifestyle, they begin to reconnect.",6.0,239,"['Comedy', 'Romance']",2.0
1707,Home Alone 3 (1997),Children|Comedy,119303,9714.0,"9-year-old Alex Pruitt is home alone with the chicken pox. Turns out, due to a mix-up among nefarious spies, Alex was given a toy car concealing a top-secret microchip. Now Alex must fend off the spies as they try to break into his house to get it back.",5.3,3139,"['Comedy', 'Family']",2.0
1777,"Wedding Singer, The (1998)",Comedy|Romance,120888,11003.0,"Robbie, a local rock star turned wedding singer, is dumped on the day of his wedding. Meanwhile, waitress Julia finally sets a wedding date with her fiancée Glenn. When Julia and Robbie meet and hit it off, they find that things are more complicated than anybody thought.",6.783,1821,"['Romance', 'Comedy']",4.0
1784,As Good as It Gets (1997),Comedy|Drama|Romance,119822,2898.0,"Melvin Udall, a cranky, bigoted, obsessive-compulsive writer of romantic fiction, is rude to everyone he meets, including his gay neighbor, Simon. After Simon is brutally attacked and hospitalized, Melvin finds his life turned upside down when he has to look after Simon's dog. In addition, Carol, the only waitress at the local diner who will tolerate him, leaves work to care for her chronically ill son, making it impossible for Melvin to eat breakfast.",7.397,3937,"['Drama', 'Comedy', 'Romance']",4.0
1855,Krippendorf's Tribe (1998),Comedy,120725,31220.0,"After squandering his grant money, despondent and recently widowed anthropologist James Krippendorf must produce hard evidence of the existence of a heretofore undiscovered New Guinea tribe. Grass skirts, makeup, and staged rituals transform his three troubled children into the Shelmikedmu, a primitive culture whose habits enthrall scholars. But when a spiteful rival threatens to blow the whistle on Krippendorf's ruse, he gets into the act as well.",4.5,85,"['Comedy', 'Family']",2.0
1911,Dr. Dolittle (1998),Comedy,118998,3050.0,"A successful physician and devoted family man, John Dolittle seems to have the world by the tail, until a long suppressed talent he possessed as a child, the ability to communicate with animals is suddenly reawakened with a vengeance! Now every creature within squawking distance wants the good doctor's advice, unleashing an outrageous chain of events that turns his world upside down!",5.709,3158,"['Comedy', 'Family', 'Fantasy']",2.0
1918,Lethal Weapon 4 (1998),Action|Comedy|Crime|Thriller,122151,944.0,"With personal crises and age weighing in on them, Riggs and Murtaugh must contend with deadly Chinese triads trying to free their former leaders from prison and onto American soil.",6.597,2785,"['Action', 'Adventure', 'Comedy', 'Crime', 'Thriller']",3.0
1926,"Broadway Melody, The (1929)",Musical,19729,65203.0,"The vaudeville act of Harriet and Queenie Mahoney comes to Broadway, where their friend Eddie Kerns needs them for his number in one of Francis Zanfield's shows. When Eddie meets Queenie, he soon falls in love with  her—but she is already being courted by Jock Warriner, a member of New York high society. Queenie eventually recognizes that, to Jock, she is nothing more than a toy, and that Eddie is in love with her.",5.206,155,"['Music', 'Romance', 'Drama']",4.0
1932,"Great Ziegfeld, The (1936)",Drama|Musical,27698,43277.0,"At the 1893 Chicago World's Fair, sideshow barker Florenz Ziegfeld turns the tables on his more-successful neighbor Billings, and also steals his girlfriend. This pattern repeats throughout their lives, as Ziegfeld makes and loses many fortunes putting on ever-bigger, more spectacular shows",6.265,134,"['Music', 'Drama', 'Romance']",5.0
1947,West Side Story (1961),Drama|Musical|Romance,55614,1725.0,"In the slums of the upper West Side of Manhattan, tensions are high as a gang of Polish-Americans compete against a gang of recently immigrated Puerto Ricans, but this doesn't stop two romantics from each gang falling in love.",7.237,1954,"['Crime', 'Drama', 'Romance']",5.0
1948,Tom Jones (1963),Adventure|Comedy|Romance,57590,5769.0,Tom loves Sophie and Sophie loves Tom. But Tom and Sophie are of differering classes. Can they find a way through the mayhem to be true to love?,5.92,226,"['Comedy', 'Adventure', 'History', 'Romance']",3.0
1951,Oliver! (1968),Drama|Musical,63385,17917.0,"Musical adaptation of Charles Dickens' Oliver Twist, a classic tale of an orphan who runs away from the workhouse and joins up with a group of boys headed by the Artful Dodger and trained to be pickpockets by master thief Fagin.",7.033,452,"['Drama', 'Family']",4.0
1958,Terms of Endearment (1983),Comedy|Drama,86425,11050.0,"Aurora, a finicky woman, is in search of true love while her daughter faces marital issues. Together, they help each other deal with problems and find reasons to live a joyful life.",7.117,788,"['Drama', 'Comedy']",4.0
2000,Lethal Weapon (1987),Action|Comedy|Crime|Drama,93409,941.0,A veteran cop and an unstable detective become partners who must put their differences aside in order to bring down a heroin-smuggling ring run by ex-Special Forces.,7.285,4782,"['Adventure', 'Action', 'Comedy', 'Thriller', 'Crime']",4.0
2001,Lethal Weapon 2 (1989),Action|Comedy|Crime|Drama,97733,942.0,Riggs and Murtaugh are on the trail of South African diplomats using their immunity to engage in criminal activities.,7.022,3563,"['Action', 'Adventure', 'Comedy', 'Crime', 'Thriller']",4.0
2002,Lethal Weapon 3 (1992),Action|Comedy|Crime|Drama,104714,943.0,Riggs and Murtaugh pursue a former officer who uses his knowledge of police procedure and policies to steal and sell confiscated guns and ammunition to local street gangs.,6.703,3061,"['Action', 'Comedy', 'Thriller', 'Crime']",3.0
2003,Gremlins (1984),Comedy|Horror,87363,927.0,"After receiving an exotic small animal as a Christmas gift, a young man inadvertently breaks three important rules concerning his new pet, which unleashes a horde of malevolently mischievous creatures on a small town.",7.137,6668,"['Fantasy', 'Horror', 'Comedy']",3.0
2011,Back to the Future Part II (1989),Adventure|Comedy|Sci-Fi,96874,165.0,"Marty and Doc are at it again as the time-traveling duo head to 2015 to nip some McFly family woes in the bud. But things go awry thanks to bully Biff Tannen and a pesky sports almanac. In a last-ditch attempt to set things straight, Marty finds himself bound for 1955 and face to face with his teenage parents -- again.",7.772,13378,"['Adventure', 'Comedy', 'Science Fiction']",3.0
2014,Freaky Friday (1977),Children|Comedy|Fantasy,76054,16084.0,"School girl Annabel is hassled by her mother, and Mrs. Andrews is annoyed with her daughter, Annabel. They both think that the other has an easy life. On a normal Friday morning, both complain about each other and wish they could have the easy life of their daughter/mother for just one day and their wishes come true as a bit of magic puts Annabel in Mrs. Andrews' body and vice versa. They both have a Freaky Friday.",6.1,286,"['Fantasy', 'Comedy', 'Family']",3.0
2015,"Absent-Minded Professor, The (1961)",Children|Comedy|Fantasy,54594,17984.0,"Bumbling professor Ned Brainard accidentally invents flying rubber, or ""Flubber"", an incredible material that gains energy every time it strikes a hard surface. It allows for the invention of shoes that can allow jumps of amazing heights and enables a modified Model-T to fly. Unfortunately, no one is interested in the material except for Alonzo Hawk, a corrupt businessman who wants to steal the material for himself.",6.487,186,"['Comedy', 'Family', 'Science Fiction']",3.0
2027,Jane Austen's Mafia! (1998),Comedy|Crime,120741,9835.0,"After growing up poor in Salmonella, Vincenzo Cortino installs himself as the preeminent, if bumbling, Mafia don of the New World. But now he must pass on power to one of his two sons: either level-headed veteran Anthony or vituperative loose cannon Joey.",5.468,202,"['Comedy', 'Crime']",1.0
2035,Blackbeard's Ghost (1968),Children|Comedy,62737,16249.0,"The eponymous wraith returns to Earth to aid his descendant, elderly Emily Stowecroft. The villains want to kick Emily and her friends out of their group home so that they can build a crooked casino. Good guy Steve Walker gets caught in the middle of the squabble after evoking Blackbeard's ghost.",6.7,149,"['Comedy', 'Fantasy', 'Family']",2.0
2038,"Cat from Outer Space, The (1978)",Children|Comedy|Sci-Fi,77305,19378.0,"A UFO is stranded on earth and impounded by the US government. Its pilot, a cat with a collar that gives it special powers, including the ability to communicate with humans, has eluded the authorities and seeks the help of a scientist in order to reclaim and repair his ship and get back home.",5.9,142,"['Comedy', 'Family', 'Science Fiction']",3.0
2040,"Computer Wore Tennis Shoes, The (1969)",Children|Comedy,65566,29228.0,"Some college students manage to persuade the town's big businessman, A. J. Arno, to donate a computer to their college. When the problem- student, Dexter Riley, tries to fix the computer, he gets an electric shock and his brain turns to a computer; now he remembers everything he reads. Unfortunately, he also remembers information which was in the computer's memory, like Arno's illegal businesses..",6.0,152,"['Comedy', 'Family', 'Drama']",4.0
2042,D2: The Mighty Ducks (1994),Children|Comedy,109520,11164.0,"After Gordon Bombay's hockey comeback is cut short he is named coach of Team USA Hockey for the Junior Goodwill Games. Bombay reunites the Mighty Ducks and introduces a few new players, however, he finds himself distracted by his newfound fame and must regather if the Ducks are to defeat tournament favourites Iceland.",6.2,622,"['Comedy', 'Action', 'Family', 'Drama']",3.0
2050,Herbie Goes Bananas (1980),Adventure|Children|Comedy,80861,12129.0,The adorable little VW helps its owners break up a counterfeiting ring in Mexico.,5.334,238,"['Fantasy', 'Comedy', 'Family', 'Adventure']",2.0
2051,Herbie Goes to Monte Carlo (1977),Adventure|Children|Comedy,76137,14140.0,"Herbie, the Volkswagen Beetle with a mind of its own, is racing in the Monte Carlo Rally. But thieves have hidden a cache of stolen diamonds in Herbie's gas tank, and are now trying to get them back.",5.934,334,"['Romance', 'Comedy', 'Family', 'Action', 'Adventure']",3.0
2052,Hocus Pocus (1993),Children|Comedy|Fantasy|Horror,107120,10439.0,"After 300 years of slumber, three sister witches are accidentally resurrected in Salem on Halloween night, and it is up to three kids and their newfound feline friend to put an end to the witches' reign of terror once and for all.",7.039,3140,"['Fantasy', 'Comedy', 'Family']",2.0
2053,"Honey, I Blew Up the Kid (1992)",Children|Comedy|Sci-Fi,104437,11158.0,"Wayne Szalinski is at it again. But instead of shrinking things, he tries to make a machine that can make things grow. As in the first one, his machine isn't quite accurate. But when he brings Nick & his toddler son Adam to see his invention, the machine unexpectedly starts working. And when Adam comes right up to the machine, he gets zapped along with his stuffed bunny.",5.27,1211,"['Adventure', 'Comedy', 'Family', 'Science Fiction']",2.0
2054,"Honey, I Shrunk the Kids (1989)",Adventure|Children|Comedy|Fantasy|Sci-Fi,97523,9354.0,The scientist father of a teenage girl and boy accidentally shrinks his and two other neighborhood teens to the size of insects. Now the teens must fight diminutive dangers as the father searches for them.,6.303,3176,"['Adventure', 'Comedy', 'Family', 'Science Fiction']",5.0
2065,"Purple Rose of Cairo, The (1985)",Comedy|Drama|Fantasy|Romance,89853,10849.0,"Cecilia is a waitress in New Jersey, living a dreary life during the Great Depression. Her only escape from her mundane reality is the movie theatre. After losing her job, Cecilia goes to see 'The Purple Rose of Cairo' in hopes of raising her spirits, where she watches dashing archaeologist Tom Baxter time and again.",7.399,1084,"['Fantasy', 'Comedy', 'Romance']",4.0
2072,"'burbs, The (1989)",Comedy,96734,11974.0,"When secretive new neighbors move in next door, suburbanite Ray Peterson and his friends let their paranoia get the best of them as they start to suspect the newcomers of evildoings and commence an investigation. But it's hardly how Ray, who much prefers drinking beer, reading his newspaper and watching a ball game on the tube expected to spend his vacation.",6.763,1291,"['Comedy', 'Horror', 'Thriller']",2.0
2073,Fandango (1985),Comedy,89126,20348.0,"In 1971, five college buddies from the University of Texas embark on a final road trip odyssey across the Mexican border before facing up to uncertain futures, in Vietnam and otherwise.",6.7,185,"['Comedy', 'Drama']",2.0
2078,"Jungle Book, The (1967)",Animation|Children|Comedy|Musical,61852,9325.0,"The boy Mowgli makes his way to the man-village with Bagheera, the wise panther. Along the way he meets jazzy King Louie, the hypnotic snake Kaa and the lovable, happy-go-lucky bear Baloo, who teaches Mowgli ""The Bare Necessities"" of life and the true meaning of friendship.",7.278,6456,"['Family', 'Animation', 'Adventure']",4.0
2080,Lady and the Tramp (1955),Animation|Children|Comedy|Romance,48280,10340.0,"Lady, a golden cocker spaniel, meets up with a mongrel dog who calls himself the Tramp. He is obviously from the wrong side of town, but happenings at Lady's home make her decide to travel with him for a while.",7.122,5462,"['Family', 'Animation', 'Romance']",5.0
