movieId,title,genres,imdbId,tmdbId,overview,tmdb_vote_average,tmdb_vote_count,tmdb_genres,rating
37380,Doom (2005),Action|Horror|Sci-Fi,419706,8814.0,"A team of space marines known as the Rapid Response Tactical Squad, led by Sarge, is sent to a science facility on Mars after somebody reports a security breach. There, they learn that the alert came after a test subject, a mass murderer purposefully injected with alien DNA, broke free and began killing people. Dr. Grimm, who is related to team member Reaper, informs them all that the chromosome can mutate humans into monsters -- and is highly infectious.",5.18,2326,"['Action', 'Horror', 'Science Fiction']",3.0
37477,"Man, The (2005)",Action|Comedy|Crime,399327,9074.0,A case of mistaken identity forces a Federal agent and a dental supply salesman to team up as they speed through the streets of Detroit to pull off a sting operation and solve the murder of the agent's former partner.,5.801,584,"['Action', 'Comedy', 'Crime']",1.0
37727,Flightplan (2005),Action|Drama|Thriller,408790,9315.0,"Flying at 40,000 feet in a state-of-the art aircraft that she helped design, Kyle Pratt's 6-year-old daughter Julia vanishes without a trace. Or did she? No one on the plane believes Julia was ever onboard. And now Kyle, desperate and alone, can only count on her own wits to unravel the mystery and save her daughter.",6.458,2793,"['Thriller', 'Drama', 'Mystery']",0.5
38992,Two for the Money (2005),Drama,417217,9910.0,A former college athlete joins forces with a sports consultant to handicap football games for high-rolling gamblers.,6.0,683,"['Comedy', 'Crime', 'Drama', 'Thriller']",4.0
39444,"Weather Man, The (2005)",Comedy|Drama,384680,6963.0,"A Chicago weather man, separated from his wife and children, debates whether professional and personal success are mutually exclusive.",6.145,1016,"['Comedy', 'Drama']",4.0
39446,Saw II (2005),Horror|Thriller,432348,215.0,"The chilling and relentless Jigsaw killer returns to terrorize the city once again. When a gruesome murder victim emerges with unmistakable traces of Jigsaw's sinister methods, Detective Eric Matthews is thrust into a high-stakes investigation. To his surprise, apprehending Jigsaw seems almost too easy, but what he doesn't realize is that being caught is merely another piece of Jigsaw's intricate puzzle.",6.606,5627,['Horror'],2.0
42725,Grandma's Boy (2006),Comedy,456554,9900.0,"Even though he's 35, Alex acts more like he's 13, spending his days as the world's oldest video game tester and his evenings developing the next big Xbox game. But when he gets kicked out of his apartment, he's forced to move in with his grandmother.",6.53,701,['Comedy'],3.5
43919,Date Movie (2006),Comedy|Romance,466342,10073.0,"Spoof of romantic comedies which focuses on a man, his crush, his parents, and her father.",4.277,1015,"['Comedy', 'Romance']",0.5
43936,16 Blocks (2006),Crime|Thriller,450232,2207.0,"An aging cop is assigned the ordinary task of escorting a fast-talking witness from police custody to a courthouse, but they find themselves running the gauntlet as other forces try to prevent them from getting there.",6.446,2003,"['Action', 'Adventure', 'Crime', 'Thriller']",4.5
44199,Inside Man (2006),Crime|Drama|Thriller,454848,388.0,"When an armed, masked gang enter a Manhattan bank, lock the doors and take hostages, the detective assigned to effect their release enters negotiations preoccupied with corruption charges he is facing.",7.399,6064,"['Crime', 'Drama', 'Thriller']",4.5
44665,Lucky Number Slevin (2006),Crime|Drama|Mystery,425210,186.0,"Slevin is mistakenly put in the middle of a personal war between the city’s biggest criminal bosses. Under constant watch, Slevin must try not to get killed by an infamous assassin and come up with an idea of how to get out of his current dilemma.",7.48,4248,"['Drama', 'Thriller', 'Crime', 'Mystery']",4.0
44840,"Benchwarmers, The (2006)",Comedy,437863,9957.0,A trio of guys try and make up for missed opportunities in childhood by forming a three-player baseball team to compete against standard little league squads.,5.845,904,['Comedy'],1.0
44972,Scary Movie 4 (2006),Comedy|Horror,362120,4257.0,"Cindy finds out the house she lives in is haunted by a little boy and goes on a quest to find out who killed him and why. Also, Alien ""Tr-iPods"" are invading the world and she has to uncover the secret in order to stop them.",5.489,3399,['Comedy'],2.5
45062,"Sentinel, The (2006)",Crime|Drama|Thriller,443632,5820.0,"Veteran Secret Service agent Pete Garrison investigates a colleague's murder and is subsequently framed as a mole in an assassination attempt on the President due to the machinations of a blackmailer who knows the secret he is hiding. Disgraced, dismissed, and now a fugitive with two relentless federal investigators hot on his heels, Garrison must both clear his name and save the president from assassination.",6.054,845,"['Action', 'Thriller', 'Crime']",3.0
45672,Click (2006),Adventure|Comedy|Drama|Fantasy|Romance,389860,9339.0,"A married workaholic, Michael Newman doesn't have time for his wife and children, not if he's to impress his ungrateful boss and earn a well-deserved promotion. So when he meets Morty, a loopy sales clerk, he gets the answer to his prayers: a magical remote that allows him to bypass life's little distractions with increasingly hysterical results.",6.301,7268,"['Comedy', 'Drama', 'Fantasy']",3.5
45726,"You, Me and Dupree (2006)",Comedy,463034,1819.0,"After standing in as best man for his longtime friend Carl Petersen, Randy Dupree loses his job, becomes a barfly and attaches himself to the newlywed couple almost permanently -- as their houseguest. But the longer Dupree camps out on their couch, the closer he gets to Carl's bride, Molly, leaving the frustrated groom wondering when his pal will be moving out.",5.6,1381,"['Comedy', 'Romance']",2.5
45728,Clerks II (2006),Comedy,424345,2295.0,"A calamity at Dante and Randall's shops sends them looking for new horizons - but they ultimately settle at Mooby's, a fictional Disney-McDonald's-style fast-food empire.",6.9,1406,['Comedy'],3.5
46915,End Game (2006),Crime|Drama|Mystery,415778,9727.0,"Alex Thomas was the man in charge of protecting the president but, when the time came to fulfill his duties, everything just went wrong. His conscience haunted by a bullet, and his devotion to his country stronger than ever, Alex teams with a seasoned reporter to navigate a treacherous web of lies, unlocking a dangerous conspiracy, and enter a deadly world in which skilled assassins and highly-trained ex-special ops lurk in every shadow.",5.344,93,"['Action', 'Thriller', 'Crime', 'Drama']",2.0
46948,Monster House (2006),Animation|Children|Fantasy|Mystery,385880,9297.0,"Monsters under the bed are scary enough, but what happens when an entire house is out to get you? Three teens aim to find out when they go up against a decrepit neighboring home and unlock its frightening secrets.",6.689,4151,"['Animation', 'Comedy', 'Family', 'Fantasy']",3.0
46965,Snakes on a Plane (2006),Action|Comedy|Horror|Thriller,417148,326.0,"FBI agent Neville Flynn boards a flight from Honolulu, Hawaii to Los Angeles, escorting a key witness to testify against a mob boss at an upcoming trial. An on-board assassin releases a crate full of hundreds of deadly venomous snakes in an attempt to eliminate the witness. Flynn and a host of frightened passengers and crew must band together to survive the slithery threat.",5.479,1873,"['Action', 'Thriller', 'Adventure', 'Crime', 'Horror']",4.0
46970,Talladega Nights: The Ballad of Ricky Bobby (2006),Action|Comedy,415306,9718.0,"The fastest man on four wheels, Ricky Bobby is one of the greatest drivers in NASCAR history. A big, hairy American winning machine, Ricky has everything a dimwitted daredevil could want, a luxurious mansion, a smokin' hot wife and all the fast food he can eat. But Ricky's turbo-charged lifestyle hits an unexpected speed bump when he's bested by flamboyant Euro-idiot Jean Girard and reduced to a fear-ridden wreck.",6.366,1774,['Comedy'],1.0
46974,World Trade Center (2006),Drama,469641,1852.0,"Two police officers struggle to survive when they become trapped beneath the rubble of the World Trade Center on September 11, 2001.",6.1,1726,"['Drama', 'History', 'Thriller']",1.0
46976,Stranger than Fiction (2006),Comedy|Drama|Fantasy|Romance,420223,1262.0,Harold Crick is a lonely IRS agent whose mundane existence is transformed when he hears a mysterious voice narrating his life.,7.282,2393,"['Comedy', 'Drama', 'Fantasy', 'Romance']",5.0
47200,Crank (2006),Action|Thriller,479884,1948.0,"Chev Chelios, a hit man wanting to go straight, lets his latest target slip away. Then he awakes the next morning to a phone call that informs him he has been poisoned and has only an hour to live unless he keeps adrenaline coursing through his body while he searches for an antidote.",6.651,3986,"['Action', 'Thriller', 'Crime']",3.5
48161,Gridiron Gang (2006),Drama,421206,9766.0,"Under the leadership of their counselor, teenagers at a juvenile detention center gain self-esteem by playing football together. Based on a true story.",7.048,1041,"['Crime', 'Drama']",4.0
48322,Jackass Number Two (2006),Comedy|Documentary,493430,12094.0,"Jackass Number Two is a compilation of various stunts, pranks and skits, and essentially has no plot. Chris Pontius, Johnny Knoxville, Steve-O, Bam Margera, and the whole crew return to the screen to raise the stakes higher than ever before.",6.576,1194,"['Action', 'Comedy', 'Documentary']",4.0
48416,School for Scoundrels (2006),Comedy|Crime,462519,9842.0,"In the hope of winning the woman of his dreams, Amanda, lovelorn meter-reader Roger Wadell enrolls in a secret confidence-building class. The course's title takes on much more meaning when he discovers that his egomaniacal professor Dr. P also wants the same woman. They begin a fierce rivalry that quickly spirals out of control, their pranks and insults get uglier as they try to prove who is the ultimate guy's guy.",5.468,371,"['Comedy', 'Romance']",3.0
48520,Employee of the Month (2006),Comedy,424993,9794.0,"When he hears that the new female employee digs ambitious men who are the store employee of the month, a slacker gets his act together but finds himself in competition with his rival, an ambitious co-worker.",5.606,668,"['Comedy', 'Romance']",2.5
48596,"Marine, The (2006)",Action|Drama|Thriller,419946,8975.0,A group of diamond thieves on the run kidnap the wife of a recently discharged marine who goes on a chase through the South Carolinian wilderness to retrieve her.,5.974,789,['Action'],4.0
48877,Saw III (2006),Crime|Horror|Thriller,489270,214.0,"Jigsaw has disappeared. Along with his new apprentice Amanda, the puppet-master behind the cruel, intricate games that have terrified a community and baffled police has once again eluded capture and vanished. While city detective scrambles to locate him, Doctor Lynn Denlon and Jeff Reinhart are unaware that they are about to become the latest pawns on his vicious chessboard.",6.4,4735,"['Horror', 'Thriller', 'Crime']",3.5
49526,National Lampoon's Van Wilder: The Rise of Taj (2006),Comedy,480271,10032.0,"Taj Mahal Badalandabad leaves Coolidge College behind for the halls of Camford University in England, where he looks to continue his education, and teach an uptight student how to make the most out of her academic career.",5.079,409,"['Comedy', 'Romance']",0.5
49651,Rocky Balboa (2006),Action|Drama,479143,1246.0,"When he loses a highly publicized virtual boxing match to ex-champ Rocky Balboa, reigning heavyweight titleholder Mason Dixon retaliates by challenging the Italian Stallion to a 10-round exhibition bout. To the surprise of his son and friends, Rocky agrees to come out of retirement and face an opponent who's faster, stronger and thirty years his junior. Rocky takes on Dixon in what will become the greatest fight in boxing history!",6.874,3643,['Drama'],3.0
49822,"Good Shepherd, The (2006)",Drama|Thriller,343737,1247.0,"Edward Wilson, the only witness to his father's suicide and member of the Skull and Bones Society while a student at Yale, is a morally upright young man who values honor and discretion, qualities that help him to be recruited for a career in the newly founded OSS. His dedication to his work does not come without a price though, leading him to sacrifice his ideals and eventually his family.",6.353,1214,"['Drama', 'Thriller', 'History']",0.5
50798,Epic Movie (2007),Adventure|Comedy,799949,9760.0,"When the Pevensie siblings each follow their own path, they find themselves at Willy's Chocolate Factory. Walking through a wardrobe, they discover the world of Gnarnia, ruled by the White Bitch. Meeting up with characters such as Harry Potter and Captain Jack Swallows, the newly reunited family must team up with Aslo, a wise-but-horny lion to stop the White Bitch's army.",3.875,1593,"['Comedy', 'Adventure', 'Fantasy']",0.5
51080,Breach (2007),Drama|Thriller,401997,4169.0,"Eric O'Neill, a low-level surveillance expert with the FBI, believes he is accomplishing his dream of becoming a full-fledged agent, with his unexpected promotion and assignment to clerk for Robert Hanssen, a renowned senior agent with 25 years in the FBI. However, he soon learns the reason for his promotion is to gain Hanssen's trust and find proof that he is a traitor to the country. Determined to draw the suspected double-agent out of deep cover, O'Neill finds himself in a lethal game of spy vs. spy, where nothing is as it seems.",6.613,624,"['Drama', 'Thriller', 'Crime', 'History']",3.0
51255,Hot Fuzz (2007),Action|Comedy|Crime|Mystery,425112,4638.0,"Former London constable Nicholas Angel finds it difficult to adapt to his new assignment in the sleepy British village of Sandford. Not only does he miss the excitement of the big city, but he also has a well-meaning oaf for a partner. However, when a series of grisly accidents rocks Sandford, Angel smells something rotten in the idyllic village.",7.562,7936,"['Crime', 'Action', 'Comedy']",4.0
51412,Next (2007),Action|Sci-Fi|Thriller,435705,1738.0,"Las Vegas showroom magician Cris Johnson has a secret which torments him: he can see a few minutes into the future. Sick of the examinations he underwent as a child and the interest of the government and medical establishment in his power, he lies low under an assumed name in Vegas, performing cheap tricks and living off small-time gambling ""winnings."" But when a terrorist group threatens to detonate a nuclear device in Los Angeles, government agent Callie Ferris must use all her wiles to capture Cris and convince him to help her stop the cataclysm.",6.11,3097,"['Action', 'Science Fiction', 'Thriller']",4.0
51931,Reign Over Me (2007),Drama,490204,2355.0,A man who lost his family in the September 11 attack on New York City runs into his old college roommate. Rekindling the friendship is the one thing that appears able to help the man recover from his grief.,7.2,1126,['Drama'],3.5
51935,Shooter (2007),Action|Drama|Thriller,822854,7485.0,"A top Marine sniper, Bob Lee Swagger, leaves the military after a mission goes horribly awry and disappears, living in seclusion. He is coaxed back into service after a high-profile government official convinces him to help thwart a plot to kill the President of the United States. Ultimately double-crossed and framed for the attempt, Swagger becomes the target of a nationwide manhunt. He goes on the run to track the real killer and find out who exactly set him up, and why, eventually seeking revenge against some of the most powerful and corrupt leaders in the free world.",7.121,5168,"['Drama', 'Action', 'Thriller']",4.0
52241,"Lookout, The (2007)",Crime|Drama|Thriller,427470,8270.0,"Chris is a once promising high school athlete whose life is turned upside down following a tragic accident. As he tries to maintain a normal life, he takes a job as a janitor at a bank, where he ultimately finds himself caught up in a planned heist.",6.666,665,"['Crime', 'Drama', 'Thriller']",3.5
52245,Blades of Glory (2007),Comedy|Romance,445934,9955.0,"When a much-publicized ice-skating scandal strips them of their gold medals, two world-class athletes skirt their way back onto the ice via a loophole that allows them to compete together as a pairs team.",6.1,1817,['Comedy'],3.5
52604,Fracture (2007),Crime|Drama|Mystery|Thriller,488120,6145.0,"A husband is on trial for the attempted murder of his wife, in what is seemingly an open/shut case for the ambitious district attorney trying to put him away. However, there are surprises for both around every corner, and, as a suspenseful game of cat-and-mouse is played out, each must manipulate and outwit the other.",7.3,4096,['Thriller'],1.5
52717,"Condemned, The (2007)",Action|Adventure|Crime|Thriller,443473,14636.0,"Jack Conrad is awaiting the death penalty in a corrupt Central American prison. He is ""purchased"" by a wealthy television producer and taken to a desolate island where he must fight to the death against nine other condemned killers from all corners of the world, with freedom going to the sole survivor.",6.1,825,"['Action', 'Thriller']",2.0
52722,Spider-Man 3 (2007),Action|Adventure|Sci-Fi|Thriller|IMAX,413300,559.0,"The seemingly invincible Spider-Man goes up against an all-new crop of villains—including the shape-shifting Sandman. While Spider-Man’s superpowers are altered by an alien organism, his alter ego, Peter Parker, deals with nemesis Eddie Brock and also gets caught up in a love triangle.",6.445,14696,"['Action', 'Adventure', 'Science Fiction']",0.5
52724,Lucky You (2007),Comedy|Drama,338216,1950.0,A professional poker player whose astounding luck at the table fails to translate into his lonesome love life attempts to win the World Series of Poker while simultaneously earning the affections of a beautiful Las Vegas singer.,5.6,275,"['Drama', 'Romance']",0.5
52867,"Ex, The (2007)",Comedy|Romance,458364,13171.0,"When his lawyer wife, Sofia, becomes pregnant, chronic underachiever Tom Reilly must take a job at his father-in-law's advertising firm. Tom has to adjust to the demands of a very high-powered job, and he finds himself in an increasingly hostile office rivalry with Chip, Sofia's paraplegic former lover.",5.264,246,"['Comedy', 'Romance']",3.0
52973,Knocked Up (2007),Comedy|Drama|Romance,478311,4964.0,"A slacker and a career-driven woman accidentally conceive a child after a one-night stand. As they try to make the relationship work, they must navigate the challenges of parenthood and their differences in lifestyle and maturity.",6.298,4098,"['Comedy', 'Romance', 'Drama']",3.5
53322,Ocean's Thirteen (2007),Crime|Thriller,496806,298.0,"Danny Ocean's team of criminals are back and composing a plan more personal than ever. When ruthless casino owner Willy Bank doublecrosses Reuben Tishkoff, causing a heart attack, Danny Ocean vows that he and his team will do anything to bring down Willy Bank along with everything he's got. Even if it means asking for help from an enemy.",6.722,6587,"['Crime', 'Thriller']",4.5
53894,Sicko (2007),Documentary|Drama,386032,2359.0,"A documentary about the corrupt health care system in The United States who's main goal is to make profit even if it means losing people’s lives. ""The more people you deny health insurance the more money we make"" is the business model for health care providers in America.",7.4,732,"['Documentary', 'Comedy', 'Drama']",0.5
53972,Live Free or Die Hard (2007),Action|Adventure|Crime|Thriller,337978,1571.0,"John McClane is back and badder than ever, and this time he calls on the services of a young hacker in his bid to stop a ring of Internet terrorists intent on taking control of America's computer infrastructure.",6.631,6085,"['Action', 'Thriller']",3.5
54004,I Now Pronounce You Chuck and Larry (2007),Comedy|Romance,762107,3563.0,"Firefighters Chuck Ford and Larry Valentine are guy's guys, loyal to the core—which is why when widower Larry asks Chuck to pose as his lover so that he can get domestic partner benefits for his kids, his buddy agrees. However, things get dicey when a bureaucrat comes calling, and the boys are forced to present a picture of domestic bliss.",6.088,2429,"['Comedy', 'Romance']",3.0
54256,Hot Rod (2007),Comedy,787475,10074.0,"For Rod Kimble, performing stunts is a way of life, even though he is rather accident-prone. Poor Rod cannot even get any respect from his stepfather, Frank, who beats him up in weekly sparring matches. When Frank falls ill, Rod devises his most outrageous stunt yet to raise money for Frank's operation -- and then Rod will kick Frank's butt.",6.398,1034,"['Comedy', 'Action']",4.0
54286,"Bourne Ultimatum, The (2007)",Action|Crime|Thriller,440963,2503.0,"Bourne is brought out of hiding once again by reporter Simon Ross who is trying to unveil Operation Blackbriar, an upgrade to Project Treadstone, in a series of newspaper columns. Information from the reporter stirs a new set of memories, and Bourne must finally uncover his dark past while dodging The Company's best efforts to eradicate him.",7.432,7996,"['Action', 'Drama', 'Mystery', 'Thriller']",5.0
54503,Superbad (2007),Comedy,829482,8363.0,Two co-dependent high school seniors are forced to deal with separation anxiety after their plan to stage a booze-soaked party goes awry.,7.258,7683,['Comedy'],4.0
54736,"Kingdom, The (2007)",Action|Drama|Thriller,431197,4349.0,A team of U.S. government agents is sent to investigate the bombing of an American facility in the Middle East.,6.718,1727,"['Thriller', 'Action', 'Drama']",3.0
54787,Death Sentence (2007),Drama|Thriller,804461,11835.0,"Nick Hume is a mild-mannered executive with a perfect life, until one gruesome night he witnesses something that changes him forever. Transformed by grief, Hume eventually comes to the disturbing conclusion that no length is too great when protecting his family.",6.8,1187,"['Action', 'Crime', 'Drama', 'Thriller']",4.0
54999,Shoot 'Em Up (2007),Action|Comedy|Crime,465602,4141.0,"A man named Mr. Smith delivers a woman's baby during a shootout, and is then called upon to protect the newborn from the army of gunmen.",6.487,1954,"['Action', 'Thriller', 'Comedy', 'Crime']",3.5
55241,Mr. Woodcock (2007),Comedy,419984,13257.0,"Taken aback by his mother's wedding announcement, a young man returns home in an effort to stop her from marrying his old high school gym teacher, a man who made high school hell for generations of students.",5.1,464,"['Comedy', 'Romance']",1.5
55245,Good Luck Chuck (2007),Comedy|Romance,452625,10030.0,"Cursed since childhood, dentist Charlie Logan cannot find the right woman. Even worse, he learns that each of his ex-girlfriends finds true love with the man she meets after her relationship with him ends. Hearing of Charlie's reputation as a good-luck charm, women from all over line up for a quick tryst. But when Charlie meets the woman of his dreams, he must find a way to break the curse or risk losing her to the next man she meets.",5.9,1573,"['Comedy', 'Romance']",0.5
55267,Dan in Real Life (2007),Comedy|Drama|Romance,480242,7211.0,"Advice columnist Dan Burns is an expert on relationships, but somehow struggles to succeed as a brother, a son and a single parent to three precocious daughters. Things get even more complicated when Dan finds out that the woman he falls in love with is actually his brother's new girlfriend.",6.569,1282,"['Comedy', 'Romance', 'Drama']",0.5
55276,Michael Clayton (2007),Drama|Thriller,465538,4566.0,"A law firm brings in its ""fixer"" to remedy the situation after a lawyer has a breakdown while representing a chemical company that he knows is guilty in a multi-billion dollar class action suit.",6.787,1843,"['Drama', 'Thriller', 'Crime']",1.5
55284,Rendition (2007),Drama|Thriller,804522,5125.0,"When an Egyptian terrorism suspect ""disappears"" on a flight from Africa to Washington DC, his American wife and a CIA analyst find themselves caught up in a struggle to secure his release from a secret detention facility somewhere outside the US.",6.415,697,"['Drama', 'Thriller']",1.0
55577,Saw IV (2007),Crime|Horror|Thriller,890870,663.0,"Despite Jigsaw's death, and in order to save the lives of two of his colleagues, Lieutenant Rigg is forced to take part in a new game, which promises to test him to the limit.",6.172,3948,"['Horror', 'Thriller', 'Crime']",0.5
55732,Martian Child (2007),Comedy|Drama,415965,5126.0,A recently-widowed science fiction writer considers whether to adopt a hyper-imaginative 6-year-old abandoned and socially-rejected boy who says he's really from Mars.,6.7,312,"['Comedy', 'Drama']",0.5
55768,Bee Movie (2007),Animation|Comedy,389790,5559.0,"Barry B. Benson, a recent college graduate who wants more out of his life than making honey, decides to sue the human race after learning about the exploitation of bees at the hands of mankind. What will happen next?",6.0,5060,"['Family', 'Animation', 'Adventure', 'Comedy']",0.5
55820,No Country for Old Men (2007),Crime|Drama,477348,6977.0,"Llewelyn Moss stumbles upon dead bodies, $2 million and a hoard of heroin in a Texas desert, but methodical killer Anton Chigurh comes looking for it, with local sheriff Ed Tom Bell hot on his trail. The roles of prey and predator blur as the violent pursuit of money and justice collide.",7.946,12689,"['Crime', 'Thriller', 'Western']",0.5
55830,Be Kind Rewind (2008),Comedy,799934,4953.0,"A man whose brain becomes magnetized unintentionally destroys every tape in his friend's video store. In order to satisfy the store's most loyal renter, an aging woman with signs of dementia, the two men set out to remake the lost films.",6.312,1406,"['Drama', 'Comedy']",1.0
