movieId,title,genres,imdbId,tmdbId,overview,tmdb_vote_average,tmdb_vote_count,tmdb_genres,rating
2694,Big Daddy (1999),Comedy,142342,9032.0,"A lazy law school grad adopts a kid to impress his girlfriend, but everything doesn't go as planned and he becomes the unlikely foster father.",6.489,3392,"['Comedy', 'Drama']",3.5
2706,American Pie (1999),Comedy|Romance,163651,2105.0,"At a high-school party, four friends find that losing their collective virginity isn't as easy as they had thought. But they still believe that they need to do so before college. To motivate themselves, they enter a pact to all ""score"" by their senior prom.",6.6,7970,"['Comedy', 'Romance']",4.0
2716,Ghostbusters (a.k.a. Ghost Busters) (1984),Action|Comedy|Sci-Fi,87332,620.0,"After losing their academic posts at a prestigious university, a team of parapsychologists goes into business as proton-pack-toting ""ghostbusters"" who exterminate ghouls, hobgoblins and supernatural pests of all stripes. An ad campaign pays off when a knockout cellist hires the squad to purge her swanky digs of demons that appear to be living in her refrigerator.",7.495,9359,"['Comedy', 'Fantasy']",5.0
2720,Inspector Gadget (1999),Action|Adventure|Children|Comedy,141369,332.0,"John Brown is a bumbling but well-intentioned security guard who is badly injured in an explosion planned by an evil mastermind. He is taken to a laboratory, where Brenda, a leading robotics surgeon, replaces his damaged limbs with state-of-the-art gadgets and tools. Named ""Inspector Gadget"" by the press, John -- along with his niece, Penny, and her trusty dog, Brain -- uses his new powers to discover who was behind the explosion.",4.507,1263,"['Action', 'Adventure', 'Comedy', 'Family']",0.5
2724,Runaway Bride (1999),Comedy|Romance,163187,4806.0,"Having already left three grooms at the altar, Maggie Carpenter is branded ""the runaway bride"" by jaded New York journalist Ike Graham. But, after his facts are called into question, Ike races to Maggie's hometown to save his reputation and report on her upcoming fourth trip down the aisle – during which he's convinced she'll run again. Though he's there on a muckraking mission, Ike can't help but fall for this breathtaking heartbreaker.",6.122,2089,"['Comedy', 'Romance']",3.0
2762,"Sixth Sense, The (1999)",Drama|Horror|Mystery,167404,745.0,"Following an unexpected tragedy, child psychologist Malcolm Crowe meets a nine year old boy named Cole Sear, who is hiding a dark secret.",7.949,12275,"['Mystery', 'Thriller', 'Drama']",4.0
2763,"Thomas Crown Affair, The (1999)",Action|Mystery,155267,913.0,"Bored billionaire executive Thomas Crown entertains himself by stealing a Monet from a reputed museum with an elaborate diversion. When Catherine Banning, the insurance company's investigator, takes an interest in Crown, he may have met his match, and a complicated back-and-forth game with seductive undertones begins between them.",6.755,1263,"['Drama', 'Crime', 'Romance']",3.5
2770,Bowfinger (1999),Comedy,131325,11353.0,"On the verge of bankruptcy and desperate for his big break, aspiring filmmaker Bobby Bowfinger concocts a crazy plan to make his ultimate dream movie. Rallying a ragtag team that includes a starry-eyed ingenue, a has-been diva and a film studio gofer, he sets out to shoot a blockbuster featuring the biggest star in Hollywood, Kit Ramsey -- only without letting Ramsey know he's in the picture.",6.17,901,['Comedy'],0.5
2798,Problem Child (1990),Children|Comedy,100419,11077.0,"Ben Healy and his social climbing wife Flo adopt fun-loving seven year old Junior. But they soon discover he's a little monster as he turns a camping trip, a birthday party and even a baseball game into comic nightmares.",6.152,874,"['Comedy', 'Family']",5.0
2819,Three Days of the Condor (3 Days of the Condor) (1975),Drama|Mystery|Romance|Thriller,73802,11963.0,"When bookish CIA researcher Joe Turner finds all his co-workers dead, he, together with a woman he has kidnapped, must work together to outwit those responsible until he determines who he can really trust.",7.283,1253,"['Thriller', 'Mystery']",3.0
2858,American Beauty (1999),Drama|Romance,169547,14.0,"Lester Burnham, a depressed suburban father in a mid-life crisis, decides to turn his hectic life around after developing an infatuation with his daughter's attractive friend.",8.005,12564,['Drama'],4.0
2890,Three Kings (1999),Action|Adventure|Comedy|Drama|War,120188,6415.0,"A group of American soldiers stationed in Iraq at the end of the Gulf War find a map they believe will take them to a huge cache of stolen Kuwaiti gold hidden near their base, and they embark on a secret mission that's destined to change everything.",6.652,2161,"['Action', 'Comedy', 'War']",4.0
2918,Ferris Bueller's Day Off (1986),Comedy,91042,9377.0,"After high school slacker Ferris Bueller successfully fakes an illness in order to skip school for the day, he goes on a series of adventures throughout Chicago with his girlfriend Sloane and best friend Cameron, all the while trying to outwit his wily school principal and fed-up sister.",7.571,5138,['Comedy'],4.5
2953,Home Alone 2: Lost in New York (1992),Children|Comedy,104431,772.0,"Instead of flying to Florida with his folks, Kevin ends up alone in New York, where he gets a hotel room with his dad's credit card—despite problems from a clerk and meddling bellboy. But when Kevin runs into his old nemeses, the Wet Bandits, he's determined to foil their plans to rob a toy store on Christmas Eve.",6.767,10113,"['Comedy', 'Family', 'Adventure']",5.0
2962,Fever Pitch (1997),Comedy|Romance,119114,1610.0,"A romantic comedy about a man, a woman and a football team. Based on Nick Hornby's best selling autobiographical novel, Fever Pitch. English teacher Paul Ashworth believes his long standing obsession with Arsenal serves him well. But then he meets Sarah. Their relationship develops in tandem with Arsenal's roller coaster fortunes in the football league, both leading to a nail biting climax.",6.5,248,"['Comedy', 'Romance']",4.0
3020,Falling Down (1993),Action|Drama,106856,37094.0,An ordinary man frustrated with the various flaws he sees in society begins to psychotically and violently lash out against them.,7.385,3863,"['Crime', 'Drama', 'Thriller']",5.0
3146,Deuce Bigalow: Male Gigolo (1999),Comedy,205000,10402.0,"Deuce Bigalow is a less than attractive, down on his luck aquarium cleaner. One day he wrecks the house of a gigolo and needs quick money to repair it. The only way he can make it is to become a gigolo himself, taking on an unusual mix of female clients. He encounters a couple of problems, though. He falls in love with one of his unusual clients, and a sleazy police officer is hot on his trail.",5.985,1469,"['Comedy', 'Romance']",3.5
3147,"Green Mile, The (1999)",Crime|Drama,120689,497.0,"A supernatural tale set on death row in a Southern prison, where gentle giant John Coffey possesses the mysterious power to heal people's ailments. When the cell block's head guard, Paul Edgecomb, recognizes Coffey's miraculous gift, he tries desperately to help stave off the condemned man's execution.",8.503,18396,"['Fantasy', 'Drama', 'Crime']",4.0
3252,Scent of a Woman (1992),Drama,105323,9475.0,"Charlie Simms is a student at a private preparatory school who comes from a poor family. To earn the money for his flight home to Gresham, Oregon for Christmas, Charlie takes a job over Thanksgiving looking after retired U.S. Army officer Lieutenant Colonel Frank Slade, a cantankerous middle-aged man who lives with his niece and her family.",7.781,3676,['Drama'],5.0
3253,Wayne's World (1992),Comedy,105793,8872.0,"The adventures of two amiably aimless metal-head friends, Wayne and Garth. From Wayne's basement, the pair broadcast a talk-show called ""Wayne's World"" on local public access television. The show comes to the attention of a sleazy network executive who wants to produce a big-budget version of ""Wayne's World""—and he also wants Wayne's girlfriend, a rock singer named Cassandra. Wayne and Garth have to battle the executive not only to save their show, but also Cassandra.",6.693,2351,['Comedy'],4.5
3255,"League of Their Own, A (1992)",Comedy|Drama,104694,11287.0,"As America's stock of athletic young men is depleted during World War II, a professional all-female baseball league springs up in the Midwest, funded by publicity-hungry candy maker Walter Harvey. Competitive sisters Dottie Hinson and Kit Keller spar with each other, scout Ernie Capadino and grumpy has-been coach Jimmy Dugan on their way to fame.",7.2,1464,"['Comedy', 'Drama']",4.5
3263,White Men Can't Jump (1992),Comedy|Drama,105812,10158.0,"Two street basketball hustlers try to con each other, then team up for a bigger score.",6.642,1425,"['Comedy', 'Drama']",4.0
3275,"Boondock Saints, The (2000)",Action|Crime|Drama|Thriller,144117,8374.0,"Tired of the crime overrunning the streets of Boston, Irish Catholic twin brothers Conner and Murphy are inspired by their faith to cleanse their hometown of evil with their own brand of zealous vigilante justice. As they hunt down and kill one notorious gangster after another, they become controversial folk heroes in the community. But Paul Smecker, an eccentric FBI agent, is fast closing in on their blood-soaked trail.",7.251,2550,"['Action', 'Thriller', 'Crime']",5.0
3301,"Whole Nine Yards, The (2000)",Comedy|Crime,190138,2069.0,"After a mobster agrees to cooperate with an FBI investigation in order to stay out of prison, he's relocated by the authorities to a life of suburban anonymity as part of a witness protection program. It's not long before a couple of his new neighbours figure out his true identity and come knocking to see if he'd be up for one more hit—suburban style.",6.465,1970,"['Comedy', 'Crime']",2.0
3430,Death Wish (1974),Action|Crime|Drama,71402,13939.0,"After his wife is murdered by street punks, a pacifistic New York City architect becomes a one-man vigilante squad, prowling the streets for would-be muggers after dark.",6.895,894,"['Crime', 'Drama', 'Action']",4.5
3444,Bloodsport (1988),Action,92675,11690.0,An American Army Major goes AWOL to Hong Kong for an outlawed martial arts contest called the Kumite.,7.03,1997,"['Action', 'Thriller', 'Drama']",5.0
3450,Grumpy Old Men (1993),Comedy,107050,11520.0,"For decades, next-door neighbors and former friends John and Max have feuded, trading insults and wicked pranks. When an attractive widow moves in nearby, their bad blood erupts into a high-stakes rivalry full of naughty jokes and adolescent hijinks.",6.7,706,"['Comedy', 'Romance']",3.5
3526,Parenthood (1989),Comedy|Drama,98067,1552.0,"The story of the Buckman family and friends, attempting to bring up their children. They suffer/enjoy all the events that occur: estranged relatives, the 'black sheep' of the family, the eccentrics, the skeletons in the closet, and the rebellious teenagers.",6.683,674,"['Comedy', 'Drama', 'Romance', 'Family']",5.0
3614,Honeymoon in Vegas (1992),Comedy|Romance,104438,12518.0,"On her deathbed, a mother makes her son promise never to get married, which scars him with psychological blocks to a commitment with his girlfriend. They finally decide to tie the knot in Vegas, but a wealthy gambler arranges for the man to lose $65K in a poker game and offers to clear the debt for a weekend with his fiancée.",5.7,299,"['Comedy', 'Romance']",4.5
3623,Mission: Impossible II (2000),Action|Adventure|Thriller,120755,955.0,"With computer genius Luther Stickell at his side and a beautiful thief on his mind, agent Ethan Hunt races across Australia and Spain to stop a former IMF agent from unleashing a genetically engineered biological weapon called Chimera. This mission, should Hunt choose to accept it, plunges him into the center of an international crisis of terrifying magnitude.",6.132,7205,"['Adventure', 'Action', 'Thriller']",3.0
3717,Gone in 60 Seconds (2000),Action|Crime,187078,9679.0,"Upon learning that he has to come out of retirement to steal 50 cars in one night to save his brother Kip's life, former car thief Randall ""Memphis"" Raines enlists help from a few ""boost happy"" pals to accomplish a seemingly impossible feat. From countless car chases to relentless cops, the high-octane excitement builds as Randall swerves around more than a few roadblocks to keep Kip alive.",6.4,4648,"['Action', 'Crime', 'Thriller']",4.5
3785,Scary Movie (2000),Comedy|Horror,175142,4247.0,"A familiar-looking group of teenagers find themselves being stalked by a more-than-vaguely recognizable masked killer! As the victims begin to pile up and the laughs pile on, none of your favorite scary movies escape the razor-sharp satire of this outrageously funny parody!",6.376,7310,['Comedy'],4.0
3948,Meet the Parents (2000),Comedy,212338,1597.0,"Greg Focker is ready to marry his girlfriend, Pam, but before he pops the question, he must win over her formidable father, humorless former CIA agent Jack Byrnes, at the wedding of Pam's sister. As Greg bends over backward to make a good impression, his visit to the Byrnes home turns into a hilarious series of disasters, and everything that can go wrong does, all under Jack's critical, hawklike gaze.",6.684,6138,"['Comedy', 'Romance']",4.0
3979,Little Nicky (2000),Comedy,185431,9678.0,"After the lord of darkness decides he will not cede his throne to any of his three sons, the two most powerful of them escape to Earth to create a kingdom for themselves. This action closes the portal filtering sinful souls to Hell and causes Satan to wither away. He must send his most weak but beloved son, Little Nicky, to Earth to return his brothers to Hell.",5.9,1893,"['Comedy', 'Fantasy']",1.0
4002,"Planes, Trains & Automobiles (1987)",Comedy,93748,2609.0,"An irritable marketing executive, Neal Page, is heading home to Chicago for Thanksgiving when a number of delays force him to travel with a well meaning but overbearing shower curtain ring salesman, Del Griffith.",7.2,2056,['Comedy'],5.0
4015,"Dude, Where's My Car? (2000)",Comedy|Sci-Fi,242423,8859.0,Two stoners wake up after a night of partying and cannot remember where they parked their car.,5.542,1965,"['Comedy', 'Romance', 'Science Fiction', 'Mystery']",0.5
4018,What Women Want (2000),Comedy|Romance,207201,3981.0,"Advertising executive Nick Marshall is as cocky as they come, but what happens to a chauvinistic guy when he can suddenly hear what women are thinking? Nick gets passed over for a promotion, but after an accident enables him to hear women's thoughts, he puts his newfound talent to work against Darcy, his new boss, who seems to be infatuated with him.",6.443,4125,"['Comedy', 'Romance']",3.0
4022,Cast Away (2000),Drama,162222,8358.0,"Chuck Noland, a top international manager for FedEx, and Kelly, a Ph.D. student, are in love and heading towards marriage. Then Chuck's plane to Malaysia crashes at sea during a terrible storm. He's the only survivor, and finds himself marooned on a desolate island. With no way to escape, Chuck must find ways to survive in his new home.",7.66,11831,"['Adventure', 'Drama']",2.0
4023,"Family Man, The (2000)",Comedy|Drama|Romance,218967,5994.0,"Jack's lavish, fast-paced lifestyle changes one Christmas night when he stumbles into a grocery store holdup and disarms the gunman. The next morning he wakes up in bed lying next to Kate, his college sweetheart he left in order to pursue his career, and to the horrifying discovery that his former life no longer exists. As he stumbles through this alternate suburban universe, Jack finds himself at a crossroad where he must choose between his high-power career and the woman he loves.",6.804,2062,"['Comedy', 'Drama', 'Romance', 'Fantasy']",5.0
4069,"Wedding Planner, The (2001)",Comedy|Romance,209475,2018.0,"San Francisco's premiere wedding planner, Mary Fiore is rescued from an accident by the man of her dreams, pediatrician Steve Edison, only to find he is the fiancé of her latest client. As Mary continues making their wedding arrangements, she and Steve are put into a string of uncomfortable situations that force them to face their mutual attraction.",5.9,1752,"['Comedy', 'Romance']",1.0
4238,Along Came a Spider (2001),Action|Crime|Mystery|Thriller,164334,2043.0,"After the harrowing death of his partner, forensic psychologist and best-selling author Alex Cross cannot forgive himself and has retreated to the peace of retirement. But when a brilliant criminal kidnaps a senator's young daughter, he is lured back into action as the kidnapper wants to deal with Alex personally. Teamed with Jezzie Flanigan, the Secret Service agent assigned to protect the missing girl, Alex follows a serpentine trail of clues that leads him to a stunning discovery - the kidnapper wants more than just ransom.",6.3,1943,"['Crime', 'Mystery', 'Thriller', 'Action']",2.0
4254,Crocodile Dundee in Los Angeles (2001),Comedy|Drama,231402,9290.0,"After settling in the tiny Australian town of Walkabout Creek with his significant other and his young son, Mick ""Crocodile"" Dundee is thrown for a loop when a prestigious Los Angeles newspaper offers his honey a job. The family migrates back to the United States, and Croc and son soon find themselves learning some lessons about American life -- many of them inadvertent",5.2,634,"['Adventure', 'Comedy']",4.0
4388,Scary Movie 2 (2001),Comedy,257106,4248.0,"While the original parodied slasher flicks like Scream, Keenen Ivory Wayans's sequel to Scary Movie takes comedic aim at haunted house movies. A group of students visit a mansion called ""Hell House,"" and murderous high jinks ensue.",5.809,4866,['Comedy'],2.0
4623,Major League (1989),Comedy,97815,9942.0,"When Rachel Phelps inherits the Cleveland Indians from her deceased husband, she's determined to move the team to a warmer climate—but only a losing season will make that possible, which should be easy given the misfits she's hired. Rachel is sure her dream will come true, but she underestimates their will to succeed.",6.879,832,['Comedy'],4.0
4683,"Wizard, The (1989)",Adventure|Children|Comedy|Drama,98663,183.0,"A boy and his brother run away from home and hitch cross-country, with help from a girl they meet, to compete in the ultimate video-game championship.",6.0,325,"['Adventure', 'Comedy', 'Drama', 'Family']",4.0
4718,American Pie 2 (2001),Comedy,252866,2770.0,"After a year apart - attending different schools, meeting different people - the guys rent a beach house and vow to make this the best summer ever. As it turns out, whether that will happen or not has a lot to do with the girls. Between the wild parties, outrageous revelations and yes, a trip to band camp, they discover that times change and people change, but in the end, it's all about sticking together.",6.248,5088,"['Comedy', 'Romance']",1.5
4776,Training Day (2001),Crime|Drama|Thriller,139654,2034.0,"On his first day on the job as a narcotics officer, a rookie cop works with a rogue detective who isn't what he appears.",7.507,6252,"['Action', 'Crime', 'Drama']",4.0
4896,Harry Potter and the Sorcerer's Stone (a.k.a. Harry Potter and the Philosopher's Stone) (2001),Adventure|Children|Fantasy,241527,671.0,"Harry Potter has lived under the stairs at his aunt and uncle's house his whole life. But on his 11th birthday, he learns he's a powerful wizard—with a place waiting for him at the Hogwarts School of Witchcraft and Wizardry. As he learns to harness his newfound powers with the help of the school's kindly headmaster, Harry uncovers the truth about his parents' deaths—and about the villain who's to blame.",7.9,28645,"['Adventure', 'Fantasy']",3.0
4901,Spy Game (2001),Action|Crime|Drama|Thriller,266987,1535.0,"On the day of his retirement, a veteran CIA agent learns that his former protégé has been arrested in China, is sentenced to die the next morning in Beijing, and that the CIA is considering letting that happen to avoid an international scandal.",6.908,2209,"['Action', 'Crime', 'Thriller']",5.0
4958,Behind Enemy Lines (2001),Action|Drama|War,159273,8007.0,"While flying a routine reconnaissance mission over Bosnia, fighter pilot Lt. Chris Burnett photographs something he wasn't supposed to see and gets shot down behind enemy lines, where he must outrun an army led by a ruthless Serbian general. With time running out and a deadly tracker on his trail, Burnett's commanding officer, Admiral Reigart, decides to risk his career and launch a renegade rescue mission to save his life.",6.4,1566,"['Action', 'Drama', 'Thriller', 'War']",3.5
4963,Ocean's Eleven (2001),Crime|Thriller,240772,161.0,"Less than 24 hours into his parole, charismatic thief Danny Ocean is already rolling out his next plan: In one night, Danny's hand-picked crew of specialists will attempt to steal more than $150 million from three Las Vegas casinos. But to score the cash, Danny risks his chances of reconciling with ex-wife, Tess.",7.451,12062,"['Thriller', 'Crime']",5.0
5107,Hart's War (2002),Drama|War,251114,10592.0,"When Col. William McNamara is stripped of his freedom in a German POW camp, he's determined to keep on fighting even from behind enemy lines. Enlisting the help of a young lieutenant in a brilliant plot against his captors, McNamara risks everything on a mission to free his men and change the outcome of the war.",6.393,988,"['Drama', 'War']",1.5
5266,Panic Room (2002),Thriller,258000,4547.0,"Trapped in their New York brownstone's panic room, a hidden chamber built as a sanctuary in the event of break-ins, newly divorced Meg Altman and her young daughter Sarah play a deadly game of cat-and-mouse with three intruders - Burnham, Raoul and Junior - during a brutal home invasion. But the room itself is the focal point because what the intruders really want is inside it.",6.79,5179,"['Crime', 'Drama', 'Thriller']",5.0
5282,High Crimes (2002),Thriller,257756,11560.0,"A female attorney learns that her husband is really a marine officer awol for fifteen years and accused of murdering fifteen civilians in El Salvador. Believing her husband when he tells her that he's being framed as part of a U.S. Military cover-up, the attorney defends him in a military court.",6.359,826,"['Drama', 'Mystery', 'Thriller', 'Crime']",2.0
5283,National Lampoon's Van Wilder (2002),Comedy,283111,11452.0,"Van Wilder has been attending college for far too many years and is scared to graduate, but Van’s father eventually realizes what is going on. When he stops paying his son's tuition fees, Van must come up with the money if he wants to stay in college, so he and his friends come up with a great fund-raising idea – throwing parties. However, when the college magazine finds out and reporter Gwen is sent to do a story on Van Wilder, things get a little complicated.",6.031,1866,"['Comedy', 'Romance']",3.0
5349,Spider-Man (2002),Action|Adventure|Sci-Fi|Thriller,145487,557.0,"After being bitten by a genetically altered spider at Oscorp, nerdy but endearing high school student Peter Parker is endowed with amazing powers to become the superhero known as Spider-Man.",7.316,19920,"['Action', 'Science Fiction']",3.5
5377,About a Boy (2002),Comedy|Drama|Romance,276751,245.0,"Will Freeman is a good-looking, smooth-talking bachelor whose primary goal in life is avoiding any kind of responsibility. But when he invents an imaginary son in order to meet attractive single moms, Will gets a hilarious lesson about life from a bright, but hopelessly geeky 12-year-old named Marcus. Now, as Will struggles to teach Marcus the art of being cool, Marcus teaches Will that you're never too old to grow up.",6.7,2290,"['Drama', 'Comedy', 'Romance']",3.0
5418,"Bourne Identity, The (2002)",Action|Mystery|Thriller,258463,2501.0,"Wounded to the brink of death and suffering from amnesia, Jason Bourne is rescued at sea by a fisherman. With nothing to go on but a Swiss bank account number, he starts to reconstruct his life, but finds that many people he encounters want him dead. However, Bourne realizes that he has the combat and mental skills of a world-class spy—but who does he work for?",7.469,9662,"['Action', 'Drama', 'Mystery', 'Thriller']",5.0
5449,Mr. Deeds (2002),Comedy|Romance,280590,2022.0,"When Longfellow Deeds, a small-town pizzeria owner and poet, inherits $40 billion from his deceased uncle, he quickly begins rolling in a different kind of dough. Moving to the big city, Deeds finds himself besieged by opportunists all gunning for their piece of the pie. Babe, a television tabloid reporter, poses as an innocent small-town girl to do an exposé on Deeds.",5.913,2398,"['Comedy', 'Romance']",1.0
5502,Signs (2002),Horror|Sci-Fi|Thriller,286106,2675.0,A family living on a farm finds mysterious crop circles in their fields which suggests something more frightening to come.,6.701,5917,"['Drama', 'Thriller', 'Science Fiction', 'Mystery']",4.5
5541,Hot Shots! (1991),Action|Comedy|Romance|War,102059,9595.0,"Recruited to join a top-secret mission for the Air Force, a renegade pilot finds himself coping with an incompetent admiral and a carefully selected squadron of flyers who are either inept or half-blind.",6.595,2296,"['Action', 'Comedy', 'War']",5.0
5785,Jackass: The Movie (2002),Action|Comedy|Documentary,322802,9012.0,"Johnny Knoxville and his band of maniacs perform a variety of stunts and gross-out gags on the big screen for the first time. They wander around Japan in panda outfits, wreak havoc on a once civilized golf course, they even do stunts involving LIVE alligators, and so on.",6.323,1646,"['Action', 'Comedy', 'Documentary']",4.0
