movieId,title,genres,imdbId,tmdbId,overview,tmdb_vote_average,tmdb_vote_count,tmdb_genres,rating
57910,Teeth (2007),Comedy|Horror,780622,13121.0,"Dawn is an active member of her high-school chastity club but, when she meets Tobey, nature takes its course, and the pair answer the call. They suddenly learn she is a living example of the vagina dentata myth, when the encounter takes a grisly turn.",5.369,769,"['Comedy', 'Horror']",3.0
58301,Funny Games U.S. (2007),Drama|Thriller,808279,8461.0,"When Ann, husband George, and son Georgie arrive at their holiday home they are visited by a pair of polite and seemingly pleasant young men. Armed with deceptively sweet smiles and some golf clubs, they proceed to terrorize and torture the tight-knit clan, giving them until the next day to survive.",6.6,2142,"['Thriller', 'Horror']",3.5
58332,Diary of the Dead (2007),Horror|Sci-Fi,848557,13025.0,A group of young filmmakers encounter real zombies while filming a horror movie of their own.,5.6,826,"['Horror', 'Fantasy', 'Science Fiction', 'Thriller']",2.0
59315,Iron Man (2008),Action|Adventure|Sci-Fi,371746,1726.0,"After being held captive in an Afghan cave, billionaire engineer Tony Stark creates a unique weaponized suit of armor to fight evil.",7.654,27339,"['Action', 'Science Fiction', 'Adventure']",4.0
59369,Taken (2008),Action|Crime|Drama|Thriller,936501,8681.0,"Bryan Mills, a former government operative, is trying to reconnect with his teenage daughter Kim. After reluctantly agreeing with his ex-wife to let Kim go to Paris on vacation with a friend, his worst nightmare comes true. While on the phone with his daughter shortly after she arrives in Paris, she and her friend are abducted by a gang of human traffickers. Working against the clock, Bryan relies on his extensive training and skills to track down the ruthless gang that abducted her and launch a one-man war to rescue his daughter.",7.398,11663,"['Action', 'Thriller']",2.5
59727,"Strangers, The (2008)",Horror|Thriller,482606,10665.0,"After a 4 a.m. knock at the door and haunting voices, Kristen McKay and James Hoyt’s remote getaway becomes a psychological night of terror as three masked strangers invade. Now they must go far beyond what they thought themselves capable of if they hope to survive.",6.1,2524,"['Horror', 'Thriller']",3.0
61262,Mirrors (2008),Horror|Mystery|Thriller,790686,13515.0,An ex-cop and his family are the target of an evil force that is using mirrors as a gateway into their home.,6.29,1932,"['Horror', 'Mystery']",2.0
64614,Gran Torino (2008),Crime|Drama,1205489,13223.0,"Disgruntled Korean War veteran Walt Kowalski sets out to reform his neighbor, Thao Lor, a Hmong teenager who tried to steal Kowalski's prized possession: a 1972 Gran Torino.",7.99,11117,['Drama'],2.5
67197,Knowing (2009),Action|Drama|Mystery|Sci-Fi|Thriller,448011,13811.0,A teacher opens a time capsule that has been dug up at his son's elementary school; in it are some chilling predictions -- some that have already occurred and others that are about to -- that lead him to believe his family plays a role in the events that are about to unfold.,6.231,5549,"['Action', 'Mystery', 'Science Fiction', 'Thriller']",2.5
68157,Inglourious Basterds (2009),Action|Drama|War,361748,16869.0,"In Nazi-occupied France during World War II, a group of Jewish-American soldiers known as ""The Basterds"" are chosen specifically to spread fear throughout the Third Reich by scalping and brutally killing Nazis. The Basterds, lead by Lt. Aldo Raine soon cross paths with a French-Jewish teenage girl who runs a movie theater in Paris which is targeted by the soldiers.",8.215,23251,"['Drama', 'Thriller', 'War']",3.0
68358,Star Trek (2009),Action|Adventure|Sci-Fi|IMAX,796366,13475.0,"The fate of the galaxy rests in the hands of bitter rivals. One, James Kirk, is a delinquent, thrill-seeking Iowa farm boy. The other, Spock, a Vulcan, was raised in a logic-based society that rejects all emotion. As fiery instinct clashes with calm reason, their unlikely but powerful partnership is the only thing capable of leading their crew through unimaginable danger, boldly going where no one has gone before. The human adventure has begun again.",7.426,10156,"['Science Fiction', 'Action', 'Adventure']",3.5
68791,Terminator Salvation (2009),Action|Adventure|Sci-Fi|Thriller,438488,534.0,"All grown up in post-apocalyptic 2018, John Connor must lead the resistance of humans against the increasingly dominating militaristic robots. But when Marcus Wright appears, his existence confuses the mission as Connor tries to determine whether Wright has come from the future or the past -- and whether he's friend or foe.",6.068,6735,"['Action', 'Science Fiction', 'Thriller']",2.5
68941,"Last House on the Left, The (2009)",Drama|Horror|Thriller,844708,18405.0,"When athletic teen Mari Collingwood opts to hang out with her friend Paige in town rather than spend an evening in with her parents vacationing at the family's remote lake house, it marks the beginning of a night no one is going to forget.",6.5,1850,"['Crime', 'Thriller', 'Horror', 'Drama']",4.0
68952,Drag Me to Hell (2009),Comedy|Horror,1127180,16871.0,"After denying a woman the extension she needs to keep her home, loan officer Christine Brown sees her once-promising life take a startling turn for the worse. Christine is convinced she's been cursed by a Gypsy, but her boyfriend is skeptical. Her only hope seems to lie in a psychic who claims he can help her lift the curse and keep her soul from being dragged straight to hell.",6.455,3875,"['Horror', 'Thriller']",3.5
68954,Up (2009),Adventure|Animation|Children|Drama,1049413,14160.0,"Carl Fredricksen spent his entire life dreaming of exploring the globe and experiencing life to its fullest. But at age 78, life seems to have passed him by, until a twist of fate (and a persistent 8-year old Wilderness Explorer named Russell) gives him a new lease on life.",7.959,20983,"['Animation', 'Comedy', 'Family', 'Adventure']",4.0
69134,Antichrist (2009),Drama|Fantasy,870984,17609.0,"A grieving couple retreats to their cabin 'Eden' in the woods, hoping to repair their broken hearts and troubled marriage. But nature takes its course and things go from bad to worse.",6.6,2698,"['Drama', 'Horror', 'Thriller']",4.0
70159,Orphan (2009),Drama|Horror|Mystery|Thriller,1148204,21208.0,"After losing their baby, a married couple adopt 9-year old Esther, who may not be as innocent as she seems.",6.997,5440,"['Horror', 'Thriller']",3.5
71135,Pandorum (2009),Horror|Sci-Fi|Thriller,1188729,19898.0,"Two crew members wake up on an abandoned spacecraft with no idea who they are, how long they've been asleep, or what their mission is. The two soon discover they're actually not alone – and the reality of their situation is more horrifying than they could have imagined.",6.564,2506,"['Action', 'Horror', 'Mystery', 'Science Fiction', 'Thriller']",3.0
71252,"Final Destination, The (Final Destination 4) (Final Destination in 3-D, The) (2009)",Horror|Thriller,1144884,19912.0,A horrifying premonition saves a young man and his friends from death during a racetrack accident but terrible fates await them nonetheless.,5.622,3697,"['Horror', 'Mystery']",3.0
71500,Trick 'r Treat (2007),Comedy|Horror|Thriller,862856,23202.0,"Four interwoven stories that occur on Halloween: an everyday high school principal has a secret life as a serial killer; a college virgin might have just met the one guy for her; a group of teenagers pull a mean prank, and a bitter old recluse receives an uninvited guest.",6.991,1963,"['Horror', 'Comedy']",2.5
71530,Surrogates (2009),Action|Sci-Fi|Thriller,986263,19959.0,"Set in a futuristic world where humans live in isolation and interact through surrogate robots, a cop is forced to leave his home for the first time in years in order to investigate the murders of others' surrogates.",6.137,3286,"['Science Fiction', 'Action', 'Thriller']",3.5
71535,Zombieland (2009),Action|Comedy|Horror,1156398,19908.0,"Columbus has made a habit of running from what scares him. Tallahassee doesn't have fears. If he did, he'd kick their ever-living ass. In a world overrun by zombies, these two are perfectly evolved survivors. But now, they're about to stare down the most terrifying prospect of all: each other.",7.258,12695,"['Comedy', 'Horror']",3.0
72998,Avatar (2009),Action|Adventure|Sci-Fi|IMAX,499549,19995.0,"In the 22nd century, a paraplegic Marine is dispatched to the moon Pandora on a unique mission, but becomes torn between following orders and protecting an alien civilization.",7.6,32646,"['Action', 'Adventure', 'Fantasy', 'Science Fiction']",3.0
74370,"House of the Devil, The (2009)",Horror|Thriller,1172994,25983.0,"A young college student who’s struggling financially takes a strange babysitting job which coincides with a full lunar eclipse. She slowly realizes her clients harbor a terrifying secret, putting her life in mortal danger.",6.275,799,"['Horror', 'Mystery']",3.5
74458,Shutter Island (2010),Drama|Mystery|Thriller,1130884,11324.0,"World War II soldier-turned-U.S. Marshal Teddy Daniels investigates the disappearance of a patient from a hospital for the criminally insane, but his efforts are compromised by troubling visions and a mysterious doctor.",8.201,24905,"['Drama', 'Thriller', 'Mystery']",3.0
77427,"Human Centipede, The (First Sequence) (2009)",Horror,1467304,37169.0,"During a stopover in Germany in the middle of a carefree road trip through Europe, two American girls find themselves alone at night when their car breaks down in the woods. Searching for help at a nearby villa, they are wooed into the clutches of a deranged retired surgeon, who has a very disturbed vision.",5.21,2269,['Horror'],4.0
78266,Splice (2009),Horror|Sci-Fi|Thriller,1017460,37707.0,"Elsa and Clive, two young rebellious scientists, defy legal and ethical boundaries and forge ahead with a dangerous experiment: splicing together human and animal DNA to create a new organism. Named ""Dren"", the creature rapidly develops from a deformed female infant into a beautiful but dangerous winged human-chimera, who forges a bond with both of her creators - only to have that bond turn deadly.",5.867,2341,"['Horror', 'Science Fiction']",2.5
81516,Black Death (2010),Adventure|Drama|Horror|Mystery,1181791,41215.0,"As the plague decimates medieval Europe, rumours circulate of a village immune from the plague. There is talk of a necromancer who leads the village and is able to raise the dead. A fearsome knight joined by a cohort of soldiers and a young monk are charged by the church to investigate. Their journey is filled with danger, but it's upon entering the village that their true horror begins.",6.048,908,"['Drama', 'History', 'Horror']",3.0
81591,Black Swan (2010),Drama|Thriller,947798,44214.0,"The story of Nina, a ballerina in a New York City ballet company whose life, like all those in her profession, is completely consumed with dance. She lives with her retired ballerina mother Erica who zealously supports her daughter's professional ambition. When artistic director Thomas Leroy decides to replace prima ballerina Beth MacIntyre for the opening production of their new season, Swan Lake, Nina is his first choice.",7.688,15033,"['Drama', 'Thriller', 'Horror']",4.0
83134,Tucker & Dale vs Evil (2010),Comedy|Horror,1465522,46838.0,"Two hillbillies are suspected of being killers by a group of paranoid college kids camping near the duo's West Virginian cabin. As the body count climbs, so does the fear and confusion as the college kids try to seek revenge against the pair.",7.389,2949,"['Comedy', 'Horror']",2.5
85397,Red Riding Hood (2011),Fantasy|Horror|Mystery|Thriller,1486185,49730.0,"Valerie is in love with a brooding outsider, Peter, but her parents have arranged for her to marry another man. Unwilling to lose each other, Valerie and Peter plan to run away together when Valerie's older sister is killed by a werewolf that prowls the dark forest surrounding their village. Panic grips the town as Valerie discovers that she has a unique connection to the beast--one that inexorably draws them together, making her both suspect ... and bait.",5.986,3225,"['Thriller', 'Drama', 'Fantasy', 'Mystery', 'Horror', 'Romance']",1.5
85788,Insidious (2010),Fantasy|Horror|Thriller,1591095,49018.0,"A family discovers that dark spirits have invaded their home after their son inexplicably falls into an endless sleep. When they reach out to a professional for help, they learn things are a lot more personal than they thought.",6.942,7059,"['Horror', 'Thriller']",2.0
87232,X-Men: First Class (2011),Action|Adventure|Sci-Fi|Thriller|War,1270798,49538.0,"Before Charles Xavier and Erik Lensherr took the names Professor X and Magneto, they were two young men discovering their powers for the first time. Before they were arch-enemies, they were closest of friends, working together with other mutants (some familiar, some new), to stop the greatest threat the world has ever known.",7.298,13137,"['Action', 'Science Fiction', 'Adventure']",3.5
89072,Stake Land (2010),Horror,1464580,52015.0,"Martin was a normal teenage boy before the country collapsed in an empty pit of economic and political disaster. A vampire epidemic has swept across what is left of the nation's abandoned towns and cities, and it's up to Mister, a death dealing, rogue vampire hunter, to get Martin safely north to Canada, the continent's New Eden.",6.2,828,"['Drama', 'Horror', 'Science Fiction']",2.5
90057,Take Shelter (2011),Drama,1675192,64720.0,"Plagued by a series of apocalyptic visions, a young husband and father questions whether to shelter his family from a coming storm, or from himself.",7.039,1861,"['Thriller', 'Drama', 'Horror']",2.0
90345,"Thing, The (2011)",Horror|Mystery|Sci-Fi|Thriller,905372,60935.0,"When paleontologist Kate Lloyd travels to an isolated outpost in Antarctica for the expedition of a lifetime, she joins an international team that unearths a remarkable discovery. Their elation quickly turns to fear as they realize that their experiment has freed a mysterious being from its frozen prison. Paranoia spreads like an epidemic as a creature that can mimic anything it touches will pit human against human as it tries to survive and flourish in this spine-tingling thriller.",6.232,3050,"['Horror', 'Science Fiction', 'Mystery']",3.0
90405,In Time (2011),Crime|Sci-Fi|Thriller,1637688,49530.0,"In the not-too-distant future, the aging gene has been switched off. To avoid overpopulation, time has become the currency and the way people pay for luxuries and necessities. The rich can live forever, while the rest struggle to negotiate for their immortality. A poor young man who suddenly comes into a fortune of time finds himself on the run from a corrupt police force known as the ""time keepers"".",6.971,11777,"['Action', 'Thriller', 'Science Fiction']",3.0
91500,The Hunger Games (2012),Action|Adventure|Drama|Sci-Fi|Thriller,1392170,70160.0,"In a dystopian society where the Capitol forces each district to send two young tributes to fight to the death in a televised spectacle, a girl volunteers to take her sister’s place, setting the stage for a struggle of survival and defiance.",7.219,22651,"['Science Fiction', 'Adventure', 'Action', 'Thriller']",4.0
91974,Underworld: Awakening (2012),Action|Fantasy|Horror|IMAX,1496025,52520.0,"Having escaped years of imprisonment, vampire warrioress Selene finds herself in a changed world where humans have discovered the existence of both Vampire and Lycan clans and are conducting an all-out war to eradicate both immortal species. Now Selene must battle the humans and a frightening new breed of super Lycans to ensure the death dealers' survival.",6.329,4196,"['Fantasy', 'Action', 'Horror']",2.0
92058,"Human Centipede II (Full Sequence), The (2011)",Horror,1530509,74997.0,"Inspired by the fictional Dr. Heiter, disturbed loner Martin dreams of creating a 12-person centipede and sets out to realize his sick fantasy.",4.778,1365,"['Drama', 'Horror', 'Crime']",2.5
92192,Apollo 18 (2011),Horror|Sci-Fi|Thriller,1772240,50357.0,"Officially, Apollo 17 was the last manned mission to the moon. But a year later in 1973, three American astronauts were sent on a secret mission to the moon funded by the US Department of Defense. What you are about to see is the actual footage which the astronauts captured on that mission. While NASA denies its authenticity, others say it's the real reason we've never gone back to the moon.",5.31,1040,"['Horror', 'Thriller', 'Science Fiction']",3.0
92309,"Innkeepers, The (2011)",Horror|Thriller,1594562,58428.0,"During the final days at the Yankee Pedlar Inn, two employees determined to reveal the hotel's haunted past begin to experience disturbing events as old guests check in for a stay.",5.403,675,"['Horror', 'Thriller']",3.0
93475,"Awakening, The (2011)",Horror|Thriller,1687901,77949.0,"In post–War England, a writer and sometime-ghost hunter investigates a reported haunting at a boys boarding school.",6.384,1437,"['Horror', 'Thriller', 'Mystery']",2.5
93840,"Cabin in the Woods, The (2012)",Comedy|Horror|Sci-Fi|Thriller,1259521,22970.0,A group of teens journey to a remote cabin in the woods where their fate is unknowingly controlled by technicians as part of a worldwide conspiracy where all horror movie clichés are revealed to be part of an elaborate sacrifice ritual.,6.64,8188,"['Horror', 'Mystery', 'Comedy']",4.5
97188,Sinister (2012),Horror|Thriller,1922777,82507.0,"True-crime writer Ellison Oswald is in a slump; he hasn't had a best seller in more than 10 years and is becoming increasingly desperate for a hit. So, when he discovers the existence of a snuff film showing the deaths of a family, he vows to solve the mystery. He moves his own family into the victims' home and gets to work. However, when old film footage and other clues hint at the presence of a supernatural force, Ellison learns that living in the house may be fatal.",6.867,5774,"['Horror', 'Thriller', 'Mystery']",3.0
99007,Warm Bodies (2013),Comedy|Horror|Romance,1588173,82654.0,"After a zombie becomes involved with the girlfriend of one of his victims, their romance sets in motion a sequence of events that might transform the entire lifeless world.",6.468,6212,"['Horror', 'Comedy', 'Romance']",4.0
99912,Mama (2013),Horror,2023587,132232.0,"Guillermo del Toro presents Mama, a supernatural thriller that tells the haunting tale of two little girls who disappeared into the woods the day that their parents were killed. When they are rescued years later and begin a new life, they find that someone or something still wants to come tuck them in at night.",6.284,4274,['Horror'],2.5
101739,Evil Dead (2013),Horror,1288558,109428.0,"Mia, a drug addict, is determined to kick the habit. To that end, she asks her brother, David, his girlfriend, Natalie and their friends Olivia and Eric to accompany her to their family's remote forest cabin to help her through withdrawal. Eric finds a mysterious Book of the Dead at the cabin and reads aloud from it, awakening an ancient demon. All hell breaks loose when the malevolent entity possesses Mia.",6.578,4813,['Horror'],3.5
101864,Oblivion (2013),Action|Adventure|Sci-Fi|IMAX,1483013,75612.0,"Jack Harper is one of the last few drone repairmen stationed on Earth. Part of a massive operation to extract vital resources after decades of war with a terrifying threat known as the Scavs, Jack’s mission is nearly complete. His existence is brought crashing down when he rescues a beautiful  stranger from a downed spacecraft. Her arrival triggers a chain of events that  forces him to question everything he knows and puts the fate of humanity in his hands.",6.661,11086,"['Action', 'Science Fiction', 'Adventure', 'Mystery']",4.0
103249,World War Z (2013),Action|Drama|Horror|IMAX,816711,72190.0,"Life for former United Nations investigator Gerry Lane and his family seems content. Suddenly, the world is plagued by a mysterious infection turning whole human populations into rampaging mindless zombies. After barely escaping the chaos, Lane is persuaded to go on a mission to investigate this disease. What follows is a perilous trek around the world where Lane must brave horrific dangers and long odds to find answers before human civilization falls.",6.824,15959,"['Action', 'Horror', 'Science Fiction', 'Thriller']",3.5
103688,"Conjuring, The (2013)",Horror|Thriller,1457767,138843.0,"Paranormal investigators Ed and Lorraine Warren work to help a family terrorized by a dark presence in their farmhouse. Forced to confront a powerful entity, the Warrens find themselves caught in the most terrifying case of their lives.",7.54,12211,"['Horror', 'Thriller']",5.0
104841,Gravity (2013),Action|Sci-Fi|IMAX,1454468,49047.0,"Dr. Ryan Stone, a brilliant medical engineer, is on her first Shuttle mission, with veteran astronaut Matt Kowalsky in command of his last flight before retiring. But on a seemingly routine spacewalk, disaster strikes. The Shuttle is destroyed, leaving Stone and Kowalsky completely alone-tethered to nothing but each other and spiraling out into the blackness of space. The deafening silence tells them they have lost any link to Earth and any chance for rescue. As fear turns to panic, every gulp of air eats away at what little oxygen is left. But the only way home may be to go further out into the terrifying expanse of space.",7.162,15817,"['Science Fiction', 'Thriller', 'Drama']",5.0
109487,Interstellar (2014),Sci-Fi|IMAX,816692,157336.0,The adventures of a group of explorers who make use of a newly discovered wormhole to surpass the limitations on human space travel and conquer the vast distances involved in an interstellar voyage.,8.461,37930,"['Adventure', 'Drama', 'Science Fiction']",5.0
110730,Transcendence (2014),Drama|Sci-Fi|IMAX,2209764,157353.0,"Two leading computer scientists work toward their goal of Technological Singularity,  as a radical anti-technology organization fights to prevent them from creating a world where computers can transcend the abilities of the human brain.",6.057,5582,"['Thriller', 'Science Fiction', 'Drama', 'Mystery']",2.5
111360,Lucy (2014),Action|Sci-Fi,2872732,240832.0,"A woman, accidentally caught in a dark deal, turns the tables on her captors and transforms into a merciless warrior evolved beyond human logic.",6.469,16572,"['Action', 'Science Fiction']",4.0
111759,Edge of Tomorrow (2014),Action|Sci-Fi|IMAX,1631867,137113.0,"Major Bill Cage is an officer who has never seen a day of combat when he is unceremoniously demoted and dropped into combat. Cage is killed within minutes, managing to take an alpha alien down with him. He awakens back at the beginning of the same day and is forced to fight and die again... and again - as physical contact with the alien has thrown him into a time loop.",7.6,14445,"['Action', 'Science Fiction']",3.0
112623,Dawn of the Planet of the Apes (2014),Sci-Fi,2103281,119450.0,"A group of scientists in San Francisco struggle to stay alive in the aftermath of a plague that is wiping out humanity, while Caesar tries to maintain dominance over his community of intelligent apes.",7.334,11835,"['Science Fiction', 'Action', 'Drama', 'Thriller']",3.5
112852,Guardians of the Galaxy (2014),Action|Adventure|Sci-Fi,2015381,118340.0,"Light years from Earth, 26 years after being abducted, Peter Quill finds himself the prime target of a manhunt after discovering an orb wanted by Ronan the Accuser.",7.905,28900,"['Action', 'Science Fiction', 'Adventure']",3.5
114935,Predestination (2014),Action|Mystery|Sci-Fi|Thriller,2397535,206487.0,"Predestination chronicles the life of a Temporal Agent sent on an intricate series of time-travel journeys designed to prevent future killers from committing their crimes. Now, on his final assignment, the Agent must stop the one criminal that has eluded him throughout time and prevent a devastating attack in which thousands of lives will be lost.",7.424,6764,"['Science Fiction', 'Thriller']",2.5
115569,Nightcrawler (2014),Crime|Drama|Thriller,2872718,242582.0,"When Lou Bloom, desperate for work, muscles into the world of L.A. crime journalism, he blurs the line between observer and participant to become the star of his own story. Aiding him in his effort is Nina, a TV-news veteran.",7.705,11244,"['Crime', 'Drama', 'Thriller']",4.5
115713,Ex Machina (2015),Drama|Sci-Fi|Thriller,470752,264660.0,"Caleb, a coder at the world's largest internet company, wins a competition to spend a week at a private mountain retreat belonging to Nathan, the reclusive CEO of the company. But when Caleb arrives at the remote location he finds that he will have to participate in a strange and fascinating experiment in which he must interact with the world's first true artificial intelligence, housed in the body of a beautiful robot girl.",7.573,13722,"['Drama', 'Science Fiction']",4.0
117529,Jurassic World (2015),Action|Adventure|Drama|Sci-Fi|Thriller,369610,135397.0,"Twenty-two years after the events of Jurassic Park, Isla Nublar now features a fully functioning dinosaur theme park, Jurassic World, as originally envisioned by John Hammond.",6.699,21017,"['Action', 'Adventure', 'Science Fiction', 'Thriller']",2.5
120466,Chappie (2015),Action|Thriller,1823672,198184.0,"Every child comes into the world full of promise, and none more so than Chappie: he is gifted, special, a prodigy. Like any child, Chappie will come under the influence of his surroundings—some good, some bad—and he will rely on his heart and soul to find his way in the world and become his own man. But there's one thing that makes Chappie different from any one else: he is a robot.",6.784,8187,"['Crime', 'Action', 'Science Fiction']",2.5
