movieId,title,genres,imdbId,tmdbId,overview,tmdb_vote_average,tmdb_vote_count,tmdb_genres,rating
1,Toy Story (1995),Adventure|Animation|Children|Comedy|Fantasy,114709,862.0,"Led by Woody, Andy's toys live happily in his room until Andy's birthday brings Buzz Lightyear onto the scene. Afraid of losing his place in Andy's heart, Woody plots against Buzz. But when circumstances separate Buzz and Woody from their owner, the duo eventually learns to put aside their differences.",7.969,19166,"['Family', 'Comedy', 'Animation']",1.5
6,Heat (1995),Action|Crime|Thriller,113277,949.0,Obsessive master thief Neil McCauley leads a top-notch crew on various daring heists throughout Los Angeles while determined detective Vincent Hanna pursues him without rest. Each man recognizes and respects the ability and the dedication of the other even though they are aware their cat-and-mouse game may end in violence.,7.922,7814,"['Crime', 'Drama', 'Action']",1.0
11,"American President, The (1995)",Comedy|Drama|Romance,112346,9087.0,"Widowed U.S. president Andrew Shepherd, one of the world's most powerful men, can have anything he wants -- and what he covets most is Sydney Ellen Wade, a Washington lobbyist. But Shepherd's attempts at courting her spark wild rumors and decimate his approval ratings.",6.534,745,"['Comedy', 'Drama', 'Romance']",3.5
14,Nixon (1995),Drama,113987,10858.0,A look at President Richard M. Nixon—a man carrying the fate of the world on his shoulders while battling the self-destructive demands from within—spanning his troubled boyhood in California to the shocking Watergate scandal that would end his Presidency.,6.9,381,"['Drama', 'History']",3.0
25,Leaving Las Vegas (1995),Drama|Romance,113627,451.0,"Ben Sanderson, an alcoholic Hollywood screenwriter who lost everything because of his drinking, arrives in Las Vegas to drink himself to death. There, he meets and forms an uneasy friendship and non-interference pact with prostitute Sera.",7.251,1536,"['Drama', 'Romance']",3.0
29,"City of Lost Children, The (Cité des enfants perdus, La) (1995)",Adventure|Drama|Fantasy|Mystery|Sci-Fi,112682,902.0,"A scientist in a surrealist society kidnaps children to steal their dreams, hoping that they slow his aging process.",7.2,1153,"['Fantasy', 'Science Fiction', 'Adventure']",0.5
32,Twelve Monkeys (a.k.a. 12 Monkeys) (1995),Mystery|Sci-Fi|Thriller,114746,63.0,"In the year 2035, convict James Cole reluctantly volunteers to be sent back in time to discover the origin of a deadly virus that wiped out nearly all of the earth's population and forced the survivors into underground communities. But when Cole is mistakenly sent to 1990 instead of 1996, he's arrested and locked up in a mental hospital. There he meets psychiatrist Dr. Kathryn Railly and the son of a famous virus expert who may hold the key to the Army of the 12 Monkeys; thought to be responsible for unleashing the killer disease.",7.601,8713,"['Science Fiction', 'Thriller', 'Mystery']",0.5
34,Babe (1995),Children|Drama,112431,9598.0,"Babe is a little pig who doesn't quite know his place in the world. With a bunch of odd friends, like Ferdinand the duck who thinks he is a rooster and Fly the dog he calls mum, Babe realises that he has the makings to become the greatest sheep pig of all time, and Farmer Hoggett knows it. With the help of the sheep dogs, Babe learns that a pig can be anything that he wants to be.",6.248,3003,"['Fantasy', 'Drama', 'Comedy', 'Family']",5.0
36,Dead Man Walking (1995),Crime|Drama,112818,687.0,A death row inmate turns for spiritual guidance to a local nun in the days leading up to his scheduled execution for the murders of a young couple.,7.328,1418,['Drama'],5.0
39,Clueless (1995),Comedy|Romance,112697,9603.0,"Shallow, rich and socially successful Cher is at the top of her Beverly Hills high school's pecking scale. Seeing herself as a matchmaker, Cher first coaxes two teachers into dating each other. Emboldened by her success, she decides to give hopelessly klutzy new student Tai a makeover. When Tai becomes more popular than she is, Cher realizes that her disapproving ex-stepbrother was right about how misguided she was -- and falls for him.",7.267,4619,"['Comedy', 'Romance']",5.0
47,Seven (a.k.a. Se7en) (1995),Mystery|Thriller,114369,807.0,"Two homicide detectives are on a desperate hunt for a serial killer whose crimes are based on the ""seven deadly sins"" in this dark and haunting film that takes viewers from the tortured remains of one victim to the next. The seasoned Det. Somerset researches each sin in an effort to get inside the killer's mind, while his novice partner, Mills, scoffs at his efforts to unravel the case.",8.376,22135,"['Crime', 'Mystery', 'Thriller']",2.5
50,"Usual Suspects, The (1995)",Crime|Mystery|Thriller,114814,629.0,"Held in an L.A. interrogation room, Verbal Kint attempts to convince the feds that a mythic crime lord, Keyser Soze, not only exists, but was also responsible for drawing him and his four partners into a multi-million dollar heist that ended with an explosion in San Pedro harbor – leaving few survivors. Verbal lures his interrogators with an incredible story of the crime lord's almost supernatural prowess.",8.172,10880,"['Drama', 'Crime', 'Thriller']",4.5
85,Angels and Insects (1995),Drama|Romance,112365,8447.0,"In Victorian England, wealthy patriarch Sir Harald Alabaster invites an impoverished biologist, William Adamson, into his home. There, William tries to continue his work, but is distracted by Alabaster's seductive daughter, Eugenia. William and Eugenia begin a torrid romance, but as the couple become closer, the young scientist begins to realize that dark, disturbing things are happening behind the closed doors of the Alabaster manor.",6.176,54,"['Drama', 'Romance']",2.5
101,Bottle Rocket (1996),Adventure|Comedy|Crime|Romance,115734,13685.0,"Upon his release from a mental hospital following a nervous breakdown, the directionless Anthony joins his friend Dignan, who seems far less sane than the former. Dignan has hatched a harebrained scheme for an as-yet-unspecified crime spree that somehow involves his former boss, the (supposedly) legendary Mr. Henry.",6.691,1118,"['Comedy', 'Crime', 'Drama']",3.0
110,Braveheart (1995),Action|Drama|War,112573,197.0,"Enraged at the slaughter of Murron, his new bride and childhood love, Scottish warrior William Wallace slays a platoon of the local English lord's soldiers. This leads the village to revolt and, eventually, the entire country to rise up against English rule.",7.943,10616,"['Action', 'Drama', 'History', 'War']",0.5
111,Taxi Driver (1976),Crime|Drama|Thriller,75314,103.0,"Suffering from insomnia, disturbed loner Travis Bickle takes a job as a New York City cabbie, haunting the streets nightly, growing increasingly detached from reality as he dreams of cleaning up the filthy city.",8.135,12893,"['Crime', 'Drama']",4.0
125,Flirting With Disaster (1996),Comedy,116324,2074.0,"Adopted as a child, new father Mel Colpin decides he cannot name his son until he knows his birth parents, and determines to make a cross-country quest to find them. Accompanied by his wife, Nancy, and an inept yet gorgeous adoption agent, Tina, he departs on an epic road trip that quickly devolves into a farce of mistaken identities, wrong turns, and overzealous and love-struck ATF agents.",6.2,256,['Comedy'],5.0
147,"Basketball Diaries, The (1995)",Drama,112461,10474.0,A high school basketball player’s life turns upside down after free-falling into the harrowing world of drug addiction.,7.406,2099,"['Drama', 'Crime']",1.0
150,Apollo 13 (1995),Adventure|Drama|IMAX,112384,568.0,"The true story of technical troubles that scuttle the Apollo 13 lunar mission in 1970, risking the lives of astronaut Jim Lovell and his crew, with the failed journey turning into a thrilling saga of heroism. Drifting more than 200,000 miles from Earth, the astronauts work furiously with the ground crew to avert tragedy.",7.452,5616,"['Drama', 'History']",2.0
162,Crumb (1994),Documentary,109508,26564.0,"This movie chronicles the life and times of R. Crumb. Robert Crumb is the cartoonist/artist who drew Keep On Truckin', Fritz the Cat, and played a major pioneering role in the genesis of underground comix. Through interviews with his mother, two brothers, wife, ex-wife and ex-girlfriends, as well as selections from his vast quantity of graphic art, we are treated to a darkly comic ride through one man's subconscious mind.",7.5,265,['Documentary'],3.0
194,Smoke (1995),Comedy|Drama,114478,10149.0,"Writer Paul Benjamin is nearly hit by a bus when he leaves Auggie Wren's smoke shop. Stranger Rashid Cole  saves his life, and soon middle-aged Paul tells homeless Rashid that he wouldn't mind a short-term housemate. Still grieving over his wife's murder, Paul is moved by both Rashid's quest to reconnect with his father and Auggie's discovery that a woman who might be his daughter is about to give birth.",7.2,505,"['Comedy', 'Drama']",5.0
215,Before Sunrise (1995),Drama|Romance,112471,76.0,"An unexpected meeting on a train leads two travelers to spend an evening wandering through Vienna. As the night unfolds, they share stories and conversations about life and love, exploring new ideas while a quiet intimacy grows between them, knowing it may be their only night together.",7.964,4423,"['Drama', 'Romance']",4.0
231,Dumb & Dumber (Dumb and Dumber) (1994),Adventure|Comedy,109686,8467.0,"Lloyd and Harry are two men whose stupidity is really indescribable. When Mary, a beautiful woman, loses an important suitcase with money before she leaves for Aspen, the two friends (who have found the suitcase) decide to return it to her. After some ""adventures"" they finally get to Aspen where, using the lost money they live it up and fight for Mary's heart.",6.636,6387,['Comedy'],1.0
236,French Kiss (1995),Action|Comedy|Romance,113117,397.0,"After her fiancee admits to infidelity while on a business trip in France, a woman attempts to get her lover back and marry him by traveling to Paris despite her crippling fear of flying.  On the way she unwittingly smuggles something of value that has a charming crook chasing her across France as she chases after her future husband.",6.47,758,"['Comedy', 'Romance']",2.0
246,Hoop Dreams (1994),Documentary,110057,14275.0,"Every school day, African-American teenagers William Gates and Arthur Agee travel 90 minutes each way from inner-city Chicago to St. Joseph High School in Westchester, Illinois, a predominately white suburban school well-known for the excellence of its basketball program. Gates and Agee dream of NBA stardom, and with the support of their close-knit families, they battle the social and physical obstacles that stand in their way. This acclaimed documentary was shot over the course of five years.",7.6,315,['Documentary'],5.0
260,Star Wars: Episode IV - A New Hope (1977),Action|Adventure|Sci-Fi,76759,11.0,Princess Leia is captured and held hostage by the evil Imperial forces in their effort to take over the galactic Empire. Venturesome Luke Skywalker and dashing captain Han Solo team together with the loveable robot duo R2-D2 and C-3PO to rescue the beautiful princess and restore peace and justice in the Empire.,8.205,21519,"['Adventure', 'Action', 'Science Fiction']",2.0
288,Natural Born Killers (1994),Action|Crime|Thriller,110632,241.0,Two victims of traumatized childhoods become lovers and serial murderers irresponsibly glorified by the mass media.,7.052,3596,"['Crime', 'Thriller', 'Drama']",1.5
292,Outbreak (1995),Action|Drama|Sci-Fi|Thriller,114069,6950.0,"A deadly airborne virus finds its way into the USA and starts killing off people at an epidemic rate. Col. Sam Daniels' job is to stop the virus spreading from a small town, which must be quarantined, and to prevent an over reaction by the White House.",6.568,2365,"['Action', 'Drama', 'Science Fiction', 'Thriller']",2.0
296,Pulp Fiction (1994),Comedy|Crime|Drama|Thriller,110912,680.0,"A burger-loving hit man, his philosophical partner, a drug-addled gangster's moll and a washed-up boxer converge in this sprawling, comedic crime caper. Their adventures unfurl in three stories that ingeniously trip back and forth in time.",8.487,29116,"['Thriller', 'Crime', 'Comedy', 'Drama']",4.0
300,Quiz Show (1994),Drama,110932,11450.0,"Herbert Stempel's transformation into an unexpected television personality unfolds as he secures victory on the cherished American game show, 'Twenty-One.' However, when the show introduces the highly skilled contestant Charles Van Doren to replace Stempel, it compels Stempel to let out his frustrations and call out the show as rigged. Lawyer Richard Goodwin steps in and attempts to uncover the orchestrated deception behind the scenes.",7.3,940,"['History', 'Drama', 'Mystery']",2.0
306,Three Colors: Red (Trois couleurs: Rouge) (1994),Drama,111495,110.0,"Part-time model Valentine unexpectedly befriends a retired judge after she runs over his dog. At first, the grumpy man shows no concern about the dog, and Valentine decides to keep it. But the two form a bond when she returns to his house and catches him listening to his neighbors’ phone calls.",7.916,1473,"['Drama', 'Mystery', 'Romance']",3.5
307,Three Colors: Blue (Trois couleurs: Bleu) (1993),Drama,108394,108.0,"The wife of a famous composer survives a car accident that kills her husband and daughter. Now alone, she shakes off her old identity and explores her newfound freedom but finds that she is unbreakably bound to other humans, including her husband’s mistress, whose existence she never suspected.",7.652,1783,['Drama'],2.0
308,Three Colors: White (Trzy kolory: Bialy) (1994),Comedy|Drama,111507,109.0,"Polish immigrant Karol Karol finds himself out of a marriage, a job and a country when his French wife, Dominique, divorces him after six months due to his impotence. Forced to leave France after losing the business they jointly owned, Karol enlists fellow Polish expatriate Mikołaj to smuggle him back to their homeland.",7.451,1257,"['Comedy', 'Drama', 'Mystery']",3.0
318,"Shawshank Redemption, The (1994)",Crime|Drama,111161,278.0,"Imprisoned in the 1940s for the double murder of his wife and her lover, upstanding banker Andy Dufresne begins a new life at the Shawshank prison, where he puts his accounting skills to work for an amoral warden. During his long stretch in prison, Dufresne comes to be admired by the other inmates -- including an older prisoner named Red -- for his integrity and unquenchable sense of hope.",8.713,28941,"['Drama', 'Crime']",4.5
322,Swimming with Sharks (1995),Comedy|Drama,114594,20306.0,"Guy is a young film executive who's willing to do whatever it takes to make it in Hollywood. He begins working for famed producer Buddy Ackerman, a domineering, manipulative, coldhearted boss. When Guy also finds out that his cynical girlfriend, Dawn, has been using sex as a career move, he reaches his limit. Guy decides to exact revenge on Buddy by kidnapping him and subjecting him to cruel and unusual punishment.",6.6,325,"['Crime', 'Comedy']",2.0
326,To Live (Huozhe) (1994),Drama,110081,31439.0,Married couple Fugui and Jiazhen endure tumultuous events in mid-20th century mainland China as their personal fortunes move from wealthy landownership to peasantry.,8.07,341,"['Drama', 'Romance', 'War']",3.5
337,What's Eating Gilbert Grape (1993),Drama,108550,1587.0,"Gilbert Grape is a small-town young man with a lot of responsibility. Chief among his concerns are his mother, who is so overweight that she can't leave the house, and his mentally impaired younger brother, Arnie, who has a knack for finding trouble. Settled into a job at a grocery store and an ongoing affair with local woman Betty Carver, Gilbert finally has his life shaken up by the free-spirited Becky.",7.666,4106,"['Romance', 'Drama']",3.0
339,While You Were Sleeping (1995),Comedy|Romance,114924,2064.0,"A transit worker pulls commuter Peter off railway tracks after he's mugged, but—while he's in a coma—his family mistakenly thinks she's Peter's fiancée, and she doesn't correct them. Things get more complicated when she falls for his brother, who's not quite sure that she's who she claims to be.",7.021,1898,"['Romance', 'Comedy']",1.5
342,Muriel's Wedding (1994),Comedy,110598,236.0,"A young social outcast in Australia steals money from her parents to finance a vacation where she hopes to find happiness, and perhaps love.",6.8,473,"['Comedy', 'Drama', 'Romance']",2.5
344,Ace Ventura: Pet Detective (1994),Comedy,109040,3049.0,"He's Ace Ventura: Pet Detective. Jim Carrey is on the case to find the Miami Dolphins' missing mascot and quarterback Dan Marino. He goes eyeball to eyeball with a man-eating shark, stakes out the Miami Dolphins and woos and wows the ladies. Whether he's undercover, under fire or underwater, he always gets his man… or beast!",6.568,6081,"['Comedy', 'Mystery', 'Crime']",2.5
356,Forrest Gump (1994),Comedy|Drama|Romance|War,109830,13.0,"A man with a low IQ has accomplished great things in his life and been present during significant historic events—in each case, far exceeding what anyone imagined he could do. But despite all he has achieved, his one true love eludes him.",8.466,28666,"['Comedy', 'Drama', 'Romance']",3.5
357,Four Weddings and a Funeral (1994),Comedy|Romance,109831,712.0,"Over the course of five social occasions, a committed bachelor must consider the notion that he may have discovered love.",6.773,2840,"['Comedy', 'Drama', 'Romance']",4.5
364,"Lion King, The (1994)",Adventure|Animation|Children|Drama|Musical|IMAX,110357,8587.0,"Young lion prince Simba, eager to one day become king of the Pride Lands, grows up under the watchful eye of his father Mufasa; all the while his villainous uncle Scar conspires to take the throne for himself. Amid betrayal and tragedy, Simba must confront his past and find his rightful place in the Circle of Life.",8.3,19041,"['Family', 'Animation', 'Drama', 'Fantasy', 'Adventure']",3.0
368,Maverick (1994),Adventure|Comedy|Western,110478,9359.0,"Bret Maverick is a gambler who would rather con someone than fight them, and needs an additional $3k in order to enter a winner-takes-all poker game beginning in a few days. He joins forces with a woman with a marvelous Southern accent, and the two try and enter the game.",6.889,1665,"['Action', 'Adventure', 'Comedy', 'Drama', 'Western']",0.5
370,Naked Gun 33 1/3: The Final Insult (1994),Action|Comedy,110622,36593.0,"Frank Drebin is persuaded out of retirement to go undercover in a state prison. There he has to find out what top terrorist, Rocco, has planned for when he escapes. Adding to his problems, Frank's wife, Jane, is desperate for a baby.",6.5,2312,"['Comedy', 'Crime']",3.0
377,Speed (1994),Action|Romance|Thriller,111257,1637.0,"Jack Traven, an LAPD cop on SWAT detail, and veteran SWAT officer Harry Temple thwart an extortionist-bomber's scheme for a $3 million ransom. As they corner the bomber, he flees and detonates a bomb vest, seemingly killing himself. Weeks later, Jack witnesses a mass transit city bus explode and nearby a pay phone rings. On the phone is that same bomber looking for vengeance and the money he's owed. He gives a personal challenge to Jack: a bomb is rigged on another city bus - if it slows down below 50 mph, it will explode - bad enough any day, but a nightmare in LA traffic. And that's just the beginning...",7.144,6499,"['Action', 'Thriller']",2.5
440,Dave (1993),Comedy|Romance,106673,11566.0,A sweet-natured Temp Agency operator and amateur Presidential look-alike is recruited by the Secret Service to become a temporary stand-in for the President of the United States.,6.7,787,['Comedy'],5.0
441,Dazed and Confused (1993),Comedy,106677,9571.0,"The adventures of a group of Texas teens on their last day of school in 1976, centering on student Randall Floyd, who moves easily among stoners, jocks and geeks. Floyd is a star athlete, but he also likes smoking weed, which presents a conundrum when his football coach demands he sign a ""no drugs"" pledge.",7.319,2146,"['Comedy', 'Drama']",3.5
454,"Firm, The (1993)",Drama|Thriller,106918,37233.0,"Mitch McDeere is a young man with a promising future in Law. About to sit his Bar exam, he is approached by 'The Firm' and made an offer he doesn't refuse. Seduced by the money and gifts showered on him, he is totally oblivious to the more sinister side of his company. Then, two Associates are murdered. The FBI contact him, asking him for information and suddenly his life is ruined. He has a choice - work with the FBI, or stay with the Firm. Either way he will lose his life as he knows it. Mitch figures the only way out is to follow his own plan...",6.729,2163,"['Drama', 'Mystery', 'Thriller']",3.5
456,Fresh (1994),Crime|Drama|Thriller,109842,13815.0,"Death and violence anger twelve year old drug courier Fresh, who sets his rival employers against each other.",7.2,221,"['Crime', 'Drama', 'Thriller']",3.5
457,"Fugitive, The (1993)",Thriller,106977,5503.0,"Wrongfully convicted of murdering his wife and sentenced to death, Richard Kimble escapes from the law in an attempt to find the real killer and clear his name.",7.466,4529,"['Action', 'Thriller', 'Drama']",3.5
466,Hot Shots! Part Deux (1993),Action|Comedy|War,107144,9255.0,"Topper Harley is found to be working as an odd-job-man in a monastery. The CIA want him to lead a rescue mission into Iraq, to rescue the last rescue team, who went in to rescue the last rescue team—who went in to rescue hostages left behind after Desert Storm.",6.548,1942,"['Action', 'Comedy', 'War']",3.5
468,"Englishman Who Went Up a Hill But Came Down a Mountain, The (1995)",Comedy|Romance,112966,10612.0,"When an English cartographer arrives in Wales to tell the residents of the Welsh village of Ffynnon Garw  that their 'mountain' is only a hill, the offended community sets out to remedy the situation.",6.32,308,"['Drama', 'Comedy', 'Romance']",2.0
471,"Hudsucker Proxy, The (1994)",Comedy,110074,11934.0,A naive business graduate is installed as president of a manufacturing company as part of a stock scam.,7.076,1114,"['Comedy', 'Drama', 'Fantasy']",4.5
475,In the Name of the Father (1993),Drama,107207,7984.0,"A small-time Belfast thief, Gerry Conlon, is wrongly convicted of an IRA bombing in London, along with his father and friends, and spends 15 years in prison fighting to prove his innocence.",7.896,1848,['Drama'],3.5
480,Jurassic Park (1993),Action|Adventure|Sci-Fi|Thriller,107290,329.0,"A wealthy entrepreneur secretly creates a theme park featuring living dinosaurs drawn from prehistoric DNA. Before opening day, he invites a team of experts and his two eager grandchildren to experience the park and help calm anxious investors. However, the park is anything but amusing as the security systems go off-line and the dinosaurs escape.",7.961,17140,"['Adventure', 'Science Fiction']",1.0
491,"Man Without a Face, The (1993)",Drama,107501,10502.0,"Justin McLeod is a former teacher who lives as a recluse on the edge of town after his face is disfigured from an automobile accident ten years earlier, in which a boy was incinerated--and for which he was convicted of involuntary manslaughter. Also suspected of being a paedophile, he is befriended by Chuck, causing the town's suspicions and hostility to be ignited.",6.532,531,['Drama'],1.0
500,Mrs. Doubtfire (1993),Comedy|Drama,107614,788.0,"Loving but irresponsible dad Daniel Hillard, estranged from his exasperated spouse, is crushed by a court order allowing only weekly visits with his kids. When Daniel learns his ex needs a housekeeper, he gets the job -- disguised as a British nanny. Soon he becomes not only his children's best pal but the kind of parent he should have been from the start.",7.195,6357,"['Comedy', 'Drama', 'Family']",3.5
520,Robin Hood: Men in Tights (1993),Comedy,107977,8005.0,"Robin Hood comes home after fighting in the Crusades to learn that the noble King Richard is in exile and that the despotic King John now rules England, with the help of the Sheriff of Rottingham. Robin Hood assembles a band of fellow patriots to do battle with King John and the Sheriff.",6.598,2161,['Comedy'],0.5
527,Schindler's List (1993),Drama|War,108052,424.0,The true story of how businessman Oskar Schindler saved over a thousand Jewish lives from the Nazis while they worked as slaves in his factory during World War II.,8.566,16731,"['Drama', 'History', 'War']",4.5
531,"Secret Garden, The (1993)",Children|Drama,108071,11236.0,"A young British girl born and reared in India loses her neglectful parents in an earthquake. She is returned to England to live at her uncle's castle. Her uncle is very distant due to the loss of his wife ten years before. Neglected once again, she begins exploring the estate and discovers a garden that has been locked and forgotten. Aided by one of the servants' boys, she begins restoring the garden, and eventually discovers some other secrets of the manor.",7.422,940,"['Drama', 'Family', 'Fantasy']",2.5
539,Sleepless in Seattle (1993),Comedy|Drama|Romance,108160,858.0,"After the death of his mother, a young boy calls a radio station in an attempt to set his father up on a date. Talking about his father’s loneliness soon leads to a meeting with a young female journalist, who has flown to Seattle to write a story about the boy and his father.",6.738,2463,"['Comedy', 'Drama', 'Romance']",2.5
541,Blade Runner (1982),Action|Sci-Fi|Thriller,83658,78.0,"In the smog-choked dystopian Los Angeles of 2019, blade runner Rick Deckard is called out of retirement to terminate a quartet of replicants who have escaped to Earth seeking their creator for a way to extend their short life spans.",7.941,14393,"['Science Fiction', 'Drama', 'Thriller']",1.0
