movieId,title,genres,imdbId,tmdbId,overview,tmdb_vote_average,tmdb_vote_count,tmdb_genres,rating
1,Toy Story (1995),Adventure|Animation|Children|Comedy|Fantasy,114709,862.0,"Led by Woody, Andy's toys live happily in his room until Andy's birthday brings Buzz Lightyear onto the scene. Afraid of losing his place in Andy's heart, Woody plots against Buzz. But when circumstances separate Buzz and Woody from their owner, the duo eventually learns to put aside their differences.",7.969,19165,"['Animation', 'Adventure', 'Family', 'Comedy']",4.5
2,Jumanji (1995),Adventure|Children|Fantasy,113497,8844.0,"When siblings Judy and Peter discover an enchanted board game that opens the door to a magical world, they unwittingly invite Alan -- an adult who's been trapped inside the game for 26 years -- into their living room. Alan's only hope for freedom is to finish the game, which proves risky as all three find themselves running from giant rhinoceroses, evil monkeys and other terrifying creatures.",7.24,10907,"['Adventure', 'Fantasy', 'Family']",5.0
5,Father of the Bride Part II (1995),Comedy,113041,11862.0,"Just when George Banks has recovered from his daughter's wedding, he receives the news that she's pregnant ... and that George's wife is expecting too. He was planning on selling their home, but that's a plan that—like George—will have to change with the arrival of both a grandchild and a kid of his own.",6.26,768,"['Comedy', 'Family']",4.5
19,Ace Ventura: When Nature Calls (1995),Comedy,112281,9273.0,"Summoned from an ashram in Tibet, Ace finds himself on a perilous journey into the jungles of Africa to find Shikaka, the missing sacred animal of the friendly Wachati tribe. He must accomplish this before the wedding of the Wachati's Princess to the prince of the warrior Wachootoos. If Ace fails, the result will be a vicious tribal war.",6.321,4340,"['Crime', 'Comedy', 'Adventure']",5.0
38,It Takes Two (1995),Children|Comedy,113442,33689.0,"Identical 9-year-olds from very different backgrounds: orphaned Amanda and wealthy Alyssa meet at summer camp and decide to switch places -- and play matchmaker between Alyssa's dad, Roger, and the kind social worker who cares for Amanda.",6.514,927,"['Comedy', 'Family', 'Romance']",5.0
104,Happy Gilmore (1996),Comedy,116483,9614.0,"Failed hockey player-turned-golf whiz Happy Gilmore — whose unconventional approach and antics on the green courts the ire of rival Shooter McGavin — is determined to win a PGA tournament so he can save his granny's house with the prize money. Meanwhile, an attractive tour publicist tries to soften Happy's image.",6.67,3099,['Comedy'],5.0
107,Muppet Treasure Island (1996),Adventure|Children|Comedy|Musical,117110,10874.0,"After telling the story of Flint's last journey to young Jim Hawkins, Billy Bones has a heart attack and dies just as Jim and his friends are attacked by pirates. The gang escapes into the town where they hire out a boat and crew to find the hidden treasure, which was revealed by Bones before he died. On their voyage across the seas, they soon find out that not everyone on board can be trusted.",6.7,429,"['Family', 'Comedy', 'Adventure', 'Music']",5.0
110,Braveheart (1995),Action|Drama|War,112573,197.0,"Enraged at the slaughter of Murron, his new bride and childhood love, Scottish warrior William Wallace slays a platoon of the local English lord's soldiers. This leads the village to revolt and, eventually, the entire country to rise up against English rule.",7.943,10614,"['Action', 'Drama', 'History', 'War']",5.0
150,Apollo 13 (1995),Adventure|Drama|IMAX,112384,568.0,"The true story of technical troubles that scuttle the Apollo 13 lunar mission in 1970, risking the lives of astronaut Jim Lovell and his crew, with the failed journey turning into a thrilling saga of heroism. Drifting more than 200,000 miles from Earth, the astronauts work furiously with the ground crew to avert tragedy.",7.452,5616,"['Drama', 'History']",5.0
186,Nine Months (1995),Comedy|Romance,113986,11472.0,"When he finds out his longtime girlfriend is pregnant, a commitment-phobe realizes he might have to change his lifestyle for better or much, much worse.",5.705,671,"['Romance', 'Comedy']",5.0
216,Billy Madison (1995),Comedy,112508,11017.0,"Billy Madison is the 27 year-old son of Bryan Madison, a very rich man who has made his living in the hotel industry. Billy stands to inherit his father's empire, but only if he can make it through all 12 grades, 2 weeks per grade, to prove that he has what it takes to run the family business.",6.183,1711,['Comedy'],5.0
231,Dumb & Dumber (Dumb and Dumber) (1994),Adventure|Comedy,109686,8467.0,"Lloyd and Harry are two men whose stupidity is really indescribable. When Mary, a beautiful woman, loses an important suitcase with money before she leaves for Aspen, the two friends (who have found the suitcase) decide to return it to her. After some ""adventures"" they finally get to Aspen where, using the lost money they live it up and fight for Mary's heart.",6.636,6385,['Comedy'],4.5
260,Star Wars: Episode IV - A New Hope (1977),Action|Adventure|Sci-Fi,76759,11.0,Princess Leia is captured and held hostage by the evil Imperial forces in their effort to take over the galactic Empire. Venturesome Luke Skywalker and dashing captain Han Solo team together with the loveable robot duo R2-D2 and C-3PO to rescue the beautiful princess and restore peace and justice in the Empire.,8.205,21518,"['Adventure', 'Action', 'Science Fiction']",5.0
289,Only You (1994),Comedy|Romance,110737,9058.0,"Two childhood paranormal incidents have convinced schoolteacher Faith Corvatch that her true love is a guy named ""Damon Bradley,"" but she has yet to meet him. Preparing to marry podiatrist Dwayne in 10 days, Faith receives a phone call from Dwayne's old classmate named Damon Bradley who is on his way to Venice. Faith tries to catch him at the airport but just misses him so she impulsively decides to fly to Venice hoping to finally encounter the man of her dreams; accompanying her on the trip is her sister-in-law and childhood best friend, Kate, who has just left her husband, Faith's brother Larry.",6.767,539,"['Romance', 'Comedy']",5.0
317,"Santa Clause, The (1994)",Comedy|Drama|Fantasy,111070,11395.0,"On Christmas Eve, divorced dad Scott Calvin and his son discover Santa Claus has fallen off their roof. When Scott takes the reins of the magical sleigh, he finds he is now the new Santa, and must convince a world of disbelievers, including himself.",6.497,2156,"['Fantasy', 'Drama', 'Comedy', 'Family']",4.5
337,What's Eating Gilbert Grape (1993),Drama,108550,1587.0,"Gilbert Grape is a small-town young man with a lot of responsibility. Chief among his concerns are his mother, who is so overweight that she can't leave the house, and his mentally impaired younger brother, Arnie, who has a knack for finding trouble. Settled into a job at a grocery store and an ongoing affair with local woman Betty Carver, Gilbert finally has his life shaken up by the free-spirited Becky.",7.666,4106,"['Romance', 'Drama']",5.0
344,Ace Ventura: Pet Detective (1994),Comedy,109040,3049.0,"He's Ace Ventura: Pet Detective. Jim Carrey is on the case to find the Miami Dolphins' missing mascot and quarterback Dan Marino. He goes eyeball to eyeball with a man-eating shark, stakes out the Miami Dolphins and woos and wows the ladies. Whether he's undercover, under fire or underwater, he always gets his man… or beast!",6.6,6080,"['Comedy', 'Mystery', 'Crime']",5.0
355,"Flintstones, The (1994)",Children|Comedy|Fantasy,109813,888.0,Modern Stone Age family the Flintstones hit the big screen in this live-action version of the classic cartoon. Fred helps Barney adopt a child. Barney sees an opportunity to repay him when Slate Mining tests its employees to find a new executive. But no good deed goes unpunished.,5.356,2530,"['Fantasy', 'Comedy', 'Family']",4.5
356,Forrest Gump (1994),Comedy|Drama|Romance|War,109830,13.0,"A man with a low IQ has accomplished great things in his life and been present during significant historic events—in each case, far exceeding what anyone imagined he could do. But despite all he has achieved, his one true love eludes him.",8.466,28663,"['Comedy', 'Drama', 'Romance']",5.0
357,Four Weddings and a Funeral (1994),Comedy|Romance,109831,712.0,"Over the course of five social occasions, a committed bachelor must consider the notion that he may have discovered love.",6.773,2840,"['Comedy', 'Drama', 'Romance']",5.0
364,"Lion King, The (1994)",Adventure|Animation|Children|Drama|Musical|IMAX,110357,8587.0,"Young lion prince Simba, eager to one day become king of the Pride Lands, grows up under the watchful eye of his father Mufasa; all the while his villainous uncle Scar conspires to take the throne for himself. Amid betrayal and tragedy, Simba must confront his past and find his rightful place in the Circle of Life.",8.256,19041,"['Family', 'Animation', 'Drama', 'Fantasy', 'Adventure']",5.0
374,Richie Rich (1994),Children|Comedy,110989,11011.0,"Billionaire heir Richie Rich has it all, including Reggie Jackson as a batting coach and Claudia Schiffer as a personal trainer -- but no playmates. What's more, scoundrel Laurence Van Dough is scheming to take over the family empire. Uh-oh! Enter faithful butler Cadbury to save the day.",5.942,2340,"['Comedy', 'Family']",5.0
410,Addams Family Values (1993),Children|Comedy|Fantasy,106220,2758.0,"Siblings Wednesday and Pugsley Addams will stop at nothing to get rid of Pubert, the new baby boy adored by parents Gomez and Morticia. Things go from bad to worse when the new ""black widow"" nanny, Debbie Jellinsky, launches her plan to add Fester to her collection of dead husbands.",6.968,3168,"['Comedy', 'Family', 'Fantasy']",5.0
460,Getting Even with Dad (1994),Comedy,109891,41579.0,"Con man Ray is going after one last heist – a stash of rare coins – when his estranged son Timmy unexpectedly shows up. Ray is too preoccupied with his robbery to spend time with his son, so Timmy blackmails him into acting like a father, hiding the coins and promises to return them only after Ray takes him to amusement parks and baseball games.",5.299,206,"['Comedy', 'Crime', 'Family']",5.0
489,Made in America (1993),Comedy,107478,12121.0,"A young black woman discovers that her father was a sperm donor, and if that wasn't bad enough, he's white.",5.517,376,['Comedy'],5.0
500,Mrs. Doubtfire (1993),Comedy|Drama,107614,788.0,"Loving but irresponsible dad Daniel Hillard, estranged from his exasperated spouse, is crushed by a court order allowing only weekly visits with his kids. When Daniel learns his ex needs a housekeeper, he gets the job -- disguised as a British nanny. Soon he becomes not only his children's best pal but the kind of parent he should have been from the start.",7.195,6357,"['Comedy', 'Drama', 'Family']",5.0
534,Shadowlands (1993),Drama|Romance,108101,10445.0,"C.S. Lewis, a world-renowned writer and professor, leads a passionless life until he meets spirited poet Joy Gresham.",6.9,287,"['Drama', 'Romance']",5.0
539,Sleepless in Seattle (1993),Comedy|Drama|Romance,108160,858.0,"After the death of his mother, a young boy calls a radio station in an attempt to set his father up on a date. Talking about his father’s loneliness soon leads to a meeting with a young female journalist, who has flown to Seattle to write a story about the boy and his father.",6.738,2463,"['Comedy', 'Drama', 'Romance']",4.5
575,"Little Rascals, The (1994)",Children|Comedy,110366,10897.0,"When nine-year-old Alfalfa falls for Darla, his ""He-Man-Woman-Hating"" friends attempt to sabotage their relationship.",6.789,1263,"['Romance', 'Comedy', 'Family']",5.0
585,"Brady Bunch Movie, The (1995)",Comedy,112572,9066.0,"The original '70s TV family is now placed in the 1990s, where they're even more square and out of place than ever.",6.1,299,"['Family', 'Comedy', 'Romance']",4.5
586,Home Alone (1990),Children|Comedy,99785,771.0,"Eight-year-old Kevin McCallister makes the most of the situation after his family unwittingly leaves him behind when they go on Christmas vacation. When thieves try to break into his home, he puts up a fight like no other.",7.447,11876,"['Comedy', 'Family']",5.0
594,Snow White and the Seven Dwarfs (1937),Animation|Children|Drama|Fantasy|Musical,29583,408.0,"A beautiful girl, Snow White, takes refuge in the forest in the house of seven dwarfs to hide from her stepmother, the wicked Queen. The Queen is jealous because she wants to be known as ""the fairest in the land,"" and Snow White's beauty surpasses her own.",7.123,7743,"['Fantasy', 'Animation', 'Family']",5.0
595,Beauty and the Beast (1991),Animation|Children|Fantasy|Musical|Romance|IMAX,101414,10020.0,"Follow the adventures of Belle, a bright young woman who finds herself in the castle of a prince who's been turned into a mysterious beast. With the help of the castle's enchanted staff, Belle soon learns the most important lesson of all -- that true beauty comes from within.",7.73,10315,"['Romance', 'Family', 'Animation', 'Fantasy']",5.0
597,Pretty Woman (1990),Comedy|Romance,100405,114.0,"While on a business trip in Los Angeles, Edward Lewis, a millionaire entrepreneur who makes a living buying and breaking up companies, picks up a prostitute, Vivian, while asking for directions; after, Edward hires Vivian to stay with him for the weekend to accompany him to a few social events, and the two get closer only to discover there are significant hurdles to overcome as they try to bridge the gap between their very different worlds.",7.461,8626,"['Romance', 'Comedy']",4.5
605,One Fine Day (1996),Drama|Romance,117247,7300.0,"Melanie Parker, an architect and mother of Sammy, and Jack Taylor, a newspaper columnist and father of Maggie, are both divorced. They meet one morning when overwhelmed Jack is left unexpectedly with Maggie and forgets that Melanie was to take her to school. As a result, both children miss their school field trip and are stuck with the parents. The two adults project their negative stereotypes of ex-spouses on each other, but end up needing to rely on each other to watch the children as each must save his job. Humor is added by Sammy's propensity for lodging objects in his nose and Maggie's tendency to wander.",6.444,693,"['Romance', 'Comedy']",5.0
616,"Aristocats, The (1970)",Animation|Children,65421,10112.0,"When Madame Adelaide Bonfamille leaves her fortune to Duchess and her children—Bonfamille’s beloved family of cats—the butler plots to steal the money and kidnaps the legatees, leaving them out on a country road. All seems lost until the wily Thomas O’Malley Cat and his jazz-playing alley cats come to the aristocats’ rescue.",7.294,5226,"['Animation', 'Comedy', 'Family', 'Adventure']",5.0
618,Two Much (1995),Comedy|Romance,118001,46029.0,"Art Dodge is a painter-turned-gallerist drowning in debt. He gets in over his head when a con job leads to an engagement with a rich divorcee. He gets in deeper when he falls for her sister, and invents a twin brother to be her beau; and deeper still when his fiancée's ex-husband comes looking for revenge.",5.4,158,"['Comedy', 'Romance']",5.0
673,Space Jam (1996),Adventure|Animation|Children|Comedy|Fantasy|Sci-Fi,117705,2300.0,"With their freedom on the line, the Looney Tunes seek the help of NBA superstar Michael Jordan to win a basketball game against a team of moronic aliens.",6.8,6205,"['Family', 'Comedy', 'Animation', 'Science Fiction']",5.0
736,Twister (1996),Action|Adventure|Romance|Thriller,117998,664.0,"An unprecedented series of violent tornadoes is sweeping across Oklahoma. Tornado chasers, headed by Dr. Jo Harding, attempt to release a groundbreaking device that will allow them to track them and create a more advanced warning system. They are joined by Jo's soon to be ex-husband Bill, a former tornado chaser himself, and his girlfriend Melissa.",6.546,3647,"['Action', 'Adventure', 'Drama']",5.0
743,Spy Hard (1996),Comedy,117723,10535.0,"The evil Gen. Rancor has his sights set on world domination, and only one man can stop him: Dick Steele, also known as Agent WD-40. Rancor needs to obtain a computer circuit for the missile that he is planning to fire, so Steele teams up with Veronique Ukrinsky, a KGB agent whose father designed the chip. Together they try to locate the evil mastermind's headquarters, where Veronique's father and several other hostages are being held.",5.405,708,"['Comedy', 'Action']",5.0
780,Independence Day (a.k.a. ID4) (1996),Action|Adventure|Sci-Fi|Thriller,116629,602.0,"Strange phenomena surface around the globe. The skies ignite. Terror races through the world's major cities. As these extraordinary events unfold, it becomes increasingly clear that a force of incredible magnitude has arrived. Its mission: total annihilation over the Fourth of July weekend. The last hope to stop the destruction is an unlikely group of people united by fate and unimaginable circumstances.",6.895,9980,"['Action', 'Adventure', 'Science Fiction']",5.0
788,"Nutty Professor, The (1996)",Comedy|Fantasy|Romance|Sci-Fi,117218,9327.0,"When beautiful Carla Purty joins the university faculty, genetic professor Dr. Sherman Klump grows desperate to whittle his 400-pound frame down to size and win her heart. So, with one swig of his experimental fat-reducing serum, Sherman becomes 'Buddy Love', a fast-talking, pumped-up, plumped down Don Juan.",5.647,2997,"['Fantasy', 'Comedy', 'Romance', 'Science Fiction']",4.5
830,"First Wives Club, The (1996)",Comedy,116313,2925.0,"After years of helping their hubbies climb the ladder of success, three mid-life Manhattanites have been dumped for a newer, curvier model. But the trio is determined to turn their pain into gain. They come up with a cleverly devious plan to hit their exes where it really hurts - in the wallet!",6.706,781,['Comedy'],5.0
837,Matilda (1996),Children|Comedy|Fantasy,117008,10830.0,"Matilda Wormwood is an exquisite and intelligent little girl. Unfortunately, her parents, Harry and Zinnia misunderstand her because they think she is so different. As time passes, she finally starts school and has a kind teacher, loyal friends, and a sadistic headmistress. As she gets fed up with the constant cruelty, she begins to realize that she has a gift of telekinetic powers. After some days of practice, she suddenly turns the tables to stand up to Harry and Zinnia and outwit the headmistress.",7.165,4623,"['Comedy', 'Family', 'Fantasy']",5.0
840,House Arrest (1996),Children|Comedy,116571,18862.0,"High-schooler Grover Beindorf and his younger sister Stacy decide that their parents, Janet and Ned, are acting childishly when they decide to divorce after 18 years of marriage, so they lock them up in the basement until they'll sort out their problems.",5.3,132,"['Comedy', 'Family']",5.0
899,Singin' in the Rain (1952),Comedy|Musical|Romance,45152,872.0,"In 1927 Hollywood, a silent film star falls for a chorus girl just as he and his paranoid screen partner struggle to make the difficult transition to talking pictures.",8.146,3317,"['Comedy', 'Romance']",5.0
910,Some Like It Hot (1959),Comedy|Crime,53291,239.0,Two musicians witness a mob hit and struggle to find a way out of the city. Their only opportunity comes in the form of joining an all-girl band as they prepare to leave on a tour. The two disguise themselves as women and struggle to keep their identities secret as they deal with the problems this brings.,8.1,3677,"['Comedy', 'Romance', 'Crime']",5.0
914,My Fair Lady (1964),Comedy|Drama|Musical|Romance,58385,11113.0,A snobbish phonetics professor agrees to a wager that he can take a flower girl and make her presentable in high society.,7.5,1370,"['Music', 'Comedy', 'Romance']",5.0
919,"Wizard of Oz, The (1939)",Adventure|Children|Fantasy|Musical,32138,630.0,"Young Dorothy finds herself in a magical world where she makes friends with a lion, a scarecrow and a tin man as they make their way along the yellow brick road to talk with the Wizard and ask for the things they miss most in their lives. The Wicked Witch of the West is the only thing that could stop them.",7.592,5842,"['Adventure', 'Fantasy', 'Family']",5.0
953,It's a Wonderful Life (1946),Children|Drama|Fantasy|Romance,38650,1585.0,"A holiday favourite for generations...  George Bailey has spent his entire life giving to the people of Bedford Falls.  All that prevents rich skinflint Mr. Potter from taking over the entire town is George's modest building and loan company.  But on Christmas Eve the business's $8,000 is lost and George's troubles begin.",8.273,4600,"['Drama', 'Family', 'Fantasy']",5.0
986,Fly Away Home (1996),Adventure|Children,116329,11076.0,"Amy is only 13 years old when her mother is killed. She goes to Canada to live with her father, an eccentric inventor whom she barely knows. Amy is miserable in her new life... until she discovers a nest of goose eggs that were abandoned when a local forest was torn down. The eggs hatch and Amy becomes ""Mama Goose"". When Winter comes, Amy, and her dad must find a way to lead the birds South.",6.9,482,"['Adventure', 'Drama', 'Family']",5.0
1005,D3: The Mighty Ducks (1996),Children|Comedy,116000,10680.0,The Ducks are offered scholarships at Eden Hall Academy but struggle with their new coach's methods and come under pressure from the board to retain their scholarships before their big game against the Varsity team.,5.9,464,"['Comedy', 'Action', 'Family', 'Drama']",5.0
1015,Homeward Bound: The Incredible Journey (1993),Adventure|Children|Drama,107131,6878.0,"Before the Seavers leave for a family vacation to San Francisco, they drop off their pets -- Chance, an adventurous American bulldog; Shadow, a wise golden retriever; and Sassy, a cautious cat -- at a friend's ranch. But when the animals start to worry that they've been left for good, the three embark together on a treacherous and thrilling journey to find their way back home through the California wilderness.",7.0,1073,"['Adventure', 'Comedy', 'Family']",5.0
1020,Cool Runnings (1993),Comedy,106611,864.0,"When a Jamaican sprinter is disqualified from the Olympic Games, he enlists the help of a dishonored coach to start the first Jamaican bobsled team.",7.002,2143,"['Comedy', 'Adventure', 'Drama']",5.0
1022,Cinderella (1950),Animation|Children|Fantasy|Musical|Romance,42332,11224.0,"Cinderella has faith her dreams of a better life will come true. With help from her loyal mice friends and a wave of her Fairy Godmother's wand, Cinderella's rags are magically turned into a glorious gown and off she goes to the Royal Ball. But when the clock strikes midnight, the spell is broken, leaving a single glass slipper... the only key to the ultimate fairy-tale ending!",7.045,6932,"['Family', 'Fantasy', 'Animation', 'Romance']",5.0
1023,Winnie the Pooh and the Blustery Day (1968),Animation|Children|Musical,63819,81310.0,"Winnie the Pooh and his friends experience high winds, heavy rains, and a flood in Hundred Acre Wood.",7.3,106,"['Family', 'Animation', 'Music']",5.0
1028,Mary Poppins (1964),Children|Comedy|Fantasy|Musical,58331,433.0,"Mr Banks is looking for a nanny for his two mischievous children and comes across Mary Poppins, an angelic nanny. She not only brings a change in their lives but also spreads happiness.",7.559,4835,"['Comedy', 'Family', 'Fantasy']",5.0
1031,Bedknobs and Broomsticks (1971),Adventure|Children|Musical,66817,12335.0,Three children evacuated from London during World War II are forced to stay with an eccentric spinster. The children's initial fears disappear when they find out she is in fact a trainee witch.,7.029,994,"['Adventure', 'Fantasy', 'Comedy', 'Family', 'Music', 'Animation']",5.0
1035,"Sound of Music, The (1965)",Musical|Romance,59742,15121.0,"In the years before the Second World War, a tomboyish postulant at an Austrian abbey is hired as a governess in the home of a widowed naval captain with seven children, and brings a new love of life and music into the home.",7.7,3447,"['Drama', 'Family', 'Music', 'Romance']",5.0
1073,Willy Wonka & the Chocolate Factory (1971),Children|Comedy|Fantasy|Musical,67992,252.0,"When eccentric candy man Willy Wonka promises a lifetime supply of sweets and a tour of his chocolate factory to five lucky kids, penniless Charlie Bucket seeks the golden ticket that will make him a winner.",7.478,3768,"['Family', 'Fantasy', 'Comedy']",5.0
1088,Dirty Dancing (1987),Drama|Musical|Romance,92890,88.0,"Expecting the usual tedium that accompanies a summer in the Catskills with her family, 17-year-old Frances 'Baby' Houseman is surprised to find herself stepping into the shoes of a professional hoofer—and unexpectedly falling in love.",7.329,6327,"['Drama', 'Music', 'Romance']",5.0
1101,Top Gun (1986),Action|Romance,92099,744.0,"For Lieutenant Pete 'Maverick' Mitchell and his friend and co-pilot Nick 'Goose' Bradshaw, being accepted into an elite training school for fighter pilots is a dream come true. But a tragedy, as well as personal demons, will threaten Pete's dreams of becoming an ace pilot.",7.062,9108,"['Action', 'Drama']",5.0
1220,"Blues Brothers, The (1980)",Action|Comedy|Musical,80455,525.0,"Jake Blues, just released from prison, puts his old band back together to save the Catholic home where he and his brother Elwood were raised.",7.726,4377,"['Music', 'Comedy', 'Action', 'Crime']",5.0
1265,Groundhog Day (1993),Comedy|Fantasy|Romance,107048,137.0,"A narcissistic TV weatherman, along with his attractive-but-distant producer, and his mawkish cameraman, is sent to report on Groundhog Day in the small town of Punxsutawney, where he finds himself repeating the same day over and over.",7.616,8426,"['Romance', 'Fantasy', 'Drama', 'Comedy']",5.0
