movieId,title,genres,imdbId,tmdbId,overview,tmdb_vote_average,tmdb_vote_count,tmdb_genres,rating
12,Dracula: Dead and Loving It (1995),Comedy|Horror,112896,12110.0,"When a lawyer shows up at the vampire's doorstep, he falls prey to his charms and joins him in his search for fresh blood. Enter Professor Van Helsing, who may be the only one able to vanquish the Count.",6.087,1030,"['Comedy', 'Horror']",4.0
32,Twelve Monkeys (a.k.a. 12 Monkeys) (1995),Mystery|Sci-Fi|Thriller,114746,63.0,"In the year 2035, convict James Cole reluctantly volunteers to be sent back in time to discover the origin of a deadly virus that wiped out nearly all of the earth's population and forced the survivors into underground communities. But when Cole is mistakenly sent to 1990 instead of 1996, he's arrested and locked up in a mental hospital. There he meets psychiatrist Dr. Kathryn Railly and the son of a famous virus expert who may hold the key to the Army of the 12 Monkeys; thought to be responsible for unleashing the killer disease.",7.601,8713,"['Science Fiction', 'Thriller', 'Mystery']",3.5
47,Seven (a.k.a. Se7en) (1995),Mystery|Thriller,114369,807.0,"Two homicide detectives are on a desperate hunt for a serial killer whose crimes are based on the ""seven deadly sins"" in this dark and haunting film that takes viewers from the tortured remains of one victim to the next. The seasoned Det. Somerset researches each sin in an effort to get inside the killer's mind, while his novice partner, Mills, scoffs at his efforts to unravel the case.",8.376,22133,"['Crime', 'Mystery', 'Thriller']",3.0
70,From Dusk Till Dawn (1996),Action|Comedy|Horror|Thriller,116367,755.0,"After kidnapping a father and his two kids, the Gecko brothers head south to a seedy Mexican bar to hide out in safety, unaware of its notorious vampire clientele.",7.029,6193,"['Horror', 'Action', 'Thriller', 'Crime']",4.0
76,Screamers (1995),Action|Sci-Fi|Thriller,114367,9102.0,"SIRIUS 6B, Year 2078. On a distant mining planet ravaged by a decade of war, scientists have created the perfect weapon: a blade-wielding, self-replicating race of killing devices known as Screamers designed for one purpose only -- to hunt down and destroy all enemy life forms.",6.209,561,"['Horror', 'Science Fiction', 'War']",2.5
111,Taxi Driver (1976),Crime|Drama|Thriller,75314,103.0,"Suffering from insomnia, disturbed loner Travis Bickle takes a job as a New York City cabbie, haunting the streets nightly, growing increasingly detached from reality as he dreams of cleaning up the filthy city.",8.135,12893,"['Crime', 'Drama']",3.0
150,Apollo 13 (1995),Adventure|Drama|IMAX,112384,568.0,"The true story of technical troubles that scuttle the Apollo 13 lunar mission in 1970, risking the lives of astronaut Jim Lovell and his crew, with the failed journey turning into a thrilling saga of heroism. Drifting more than 200,000 miles from Earth, the astronauts work furiously with the ground crew to avert tragedy.",7.452,5616,"['Drama', 'History']",3.5
208,Waterworld (1995),Action|Adventure|Sci-Fi,114898,9804.0,"In a futuristic world where the polar ice caps have melted and made Earth a liquid planet, a beautiful barmaid rescues a mutant seafarer from a floating island prison. They escape, along with her young charge, Enola, and sail off aboard his ship. But the trio soon becomes the target of a menacing pirate who covets the map to 'Dryland'—which is tattooed on Enola's back.",6.23,3861,"['Adventure', 'Action', 'Science Fiction']",3.0
220,Castle Freak (1995),Horror,112643,18256.0,"John Reilly discovers that his family's newly inherited castle in Italy is haunted by a relentless, bloodthirsty creature.",6.1,222,"['Thriller', 'Drama', 'Horror', 'Mystery']",2.5
253,Interview with the Vampire: The Vampire Chronicles (1994),Drama|Horror,110148,628.0,"A vampire relates his epic life story of love, betrayal, loneliness, and dark hunger to an over-curious reporter.",7.383,6117,"['Horror', 'Drama', 'Fantasy']",4.5
260,Star Wars: Episode IV - A New Hope (1977),Action|Adventure|Sci-Fi,76759,11.0,Princess Leia is captured and held hostage by the evil Imperial forces in their effort to take over the galactic Empire. Venturesome Luke Skywalker and dashing captain Han Solo team together with the loveable robot duo R2-D2 and C-3PO to rescue the beautiful princess and restore peace and justice in the Empire.,8.205,21518,"['Adventure', 'Action', 'Science Fiction']",4.0
273,Mary Shelley's Frankenstein (Frankenstein) (1994),Drama|Horror|Sci-Fi,109836,3036.0,"Victor Frankenstein is a promising young doctor who, devastated by the death of his mother during childbirth, becomes obsessed with bringing the dead back to life. His experiments lead to the creation of a monster, which Frankenstein has put together with the remains of corpses. It's not long before Frankenstein regrets his actions.",6.4,1280,"['Drama', 'Horror', 'Science Fiction', 'Romance']",3.0
296,Pulp Fiction (1994),Comedy|Crime|Drama|Thriller,110912,680.0,"A burger-loving hit man, his philosophical partner, a drug-addled gangster's moll and a washed-up boxer converge in this sprawling, comedic crime caper. Their adventures unfurl in three stories that ingeniously trip back and forth in time.",8.487,29112,"['Thriller', 'Crime', 'Comedy', 'Drama']",3.5
316,Stargate (1994),Action|Adventure|Sci-Fi,111282,2164.0,"An interstellar teleportation device, found in Egypt, leads to a planet with humans resembling ancient Egyptians who worship the god Ra.",7.0,3595,"['Action', 'Adventure', 'Science Fiction']",3.0
318,"Shawshank Redemption, The (1994)",Crime|Drama,111161,278.0,"Imprisoned in the 1940s for the double murder of his wife and her lover, upstanding banker Andy Dufresne begins a new life at the Shawshank prison, where he puts his accounting skills to work for an amoral warden. During his long stretch in prison, Dufresne comes to be admired by the other inmates -- including an older prisoner named Red -- for his integrity and unquenchable sense of hope.",8.713,28938,"['Drama', 'Crime']",3.5
356,Forrest Gump (1994),Comedy|Drama|Romance|War,109830,13.0,"A man with a low IQ has accomplished great things in his life and been present during significant historic events—in each case, far exceeding what anyone imagined he could do. But despite all he has achieved, his one true love eludes him.",8.466,28663,"['Comedy', 'Drama', 'Romance']",3.0
377,Speed (1994),Action|Romance|Thriller,111257,1637.0,"Jack Traven, an LAPD cop on SWAT detail, and veteran SWAT officer Harry Temple thwart an extortionist-bomber's scheme for a $3 million ransom. As they corner the bomber, he flees and detonates a bomb vest, seemingly killing himself. Weeks later, Jack witnesses a mass transit city bus explode and nearby a pay phone rings. On the phone is that same bomber looking for vengeance and the money he's owed. He gives a personal challenge to Jack: a bomb is rigged on another city bus - if it slows down below 50 mph, it will explode - bad enough any day, but a nightmare in LA traffic. And that's just the beginning...",7.1,6498,"['Action', 'Thriller']",4.0
382,Wolf (1994),Drama|Horror|Romance|Thriller,111742,10395.0,"An aging publisher becomes a demon wolf and, with this newfound youthful vigor, fights to keep his job.",6.1,956,"['Horror', 'Drama', 'Romance']",2.5
480,Jurassic Park (1993),Action|Adventure|Sci-Fi|Thriller,107290,329.0,"A wealthy entrepreneur secretly creates a theme park featuring living dinosaurs drawn from prehistoric DNA. Before opening day, he invites a team of experts and his two eager grandchildren to experience the park and help calm anxious investors. However, the park is anything but amusing as the security systems go off-line and the dinosaurs escape.",7.96,17136,"['Adventure', 'Science Fiction']",4.0
587,Ghost (1990),Comedy|Drama|Fantasy|Romance|Thriller,99653,251.0,"After a young man is murdered, his spirit stays behind to warn his lover of impending danger, with the help of a reluctant psychic.",7.227,5783,"['Fantasy', 'Drama', 'Thriller', 'Mystery', 'Romance']",2.5
593,"Silence of the Lambs, The (1991)",Crime|Horror|Thriller,102926,274.0,"Clarice Starling is a top student at the FBI's training academy.  Jack Crawford wants Clarice to interview Dr. Hannibal Lecter, a brilliant psychiatrist who is also a violent psychopath, serving life behind bars for various acts of murder and cannibalism.  Crawford believes that Lecter may have insight into a case and that Starling, as an attractive young woman, may be just the bait to draw him out.",8.347,17131,"['Crime', 'Thriller', 'Drama']",4.0
742,Thinner (1996),Horror|Thriller,117894,10280.0,"An obese lawyer finds himself growing ""Thinner"" when an old Romani man places a hex on him. Now the lawyer must call upon his friends in organized crime to help him persuade the old man to lift the curse. Time is running out for the desperate lawyer as he draws closer to his own death, and grows ever thinner.",5.892,640,"['Fantasy', 'Horror']",2.5
780,Independence Day (a.k.a. ID4) (1996),Action|Adventure|Sci-Fi|Thriller,116629,602.0,"Strange phenomena surface around the globe. The skies ignite. Terror races through the world's major cities. As these extraordinary events unfold, it becomes increasingly clear that a force of incredible magnitude has arrived. Its mission: total annihilation over the Fourth of July weekend. The last hope to stop the destruction is an unlikely group of people united by fate and unimaginable circumstances.",6.895,9980,"['Action', 'Adventure', 'Science Fiction']",4.5
799,"Frighteners, The (1996)",Comedy|Horror|Thriller,116365,10779.0,"Once an architect, Frank Bannister now passes himself off as an exorcist of evil spirits. To bolster his facade, he claims his ""special"" gift is the result of a car accident that killed his wife. But what he does not count on is more people dying in the small town where he lives. As he tries to piece together the supernatural mystery of these killings, he falls in love with the wife of one of the victims and deals with a crazy FBI agent.",6.916,1620,"['Horror', 'Comedy']",3.0
1036,Die Hard (1988),Action|Crime|Thriller,95016,562.0,"NYPD cop John McClane's plan to reconcile with his estranged wife is thrown for a serious loop when, minutes after he arrives at her offices Christmas Party, the entire building is overtaken by a group of terrorists. With little help from the LAPD, wisecracking McClane sets out to single-handedly rescue the hostages and bring the bad guys down.",7.801,11692,"['Action', 'Thriller']",3.5
1037,"Lawnmower Man, The (1992)",Action|Horror|Sci-Fi|Thriller,104692,10163.0,A simple man is turned into a genius through the application of computer science.,5.633,787,"['Science Fiction', 'Horror']",1.0
1079,"Fish Called Wanda, A (1988)",Comedy|Crime,95159,623.0,"While a diamond advocate attempts to steal a collection of diamonds, troubles arise when he realises he’s not the only one after the collection.",7.204,2301,"['Comedy', 'Crime']",3.5
1089,Reservoir Dogs (1992),Crime|Mystery|Thriller,105236,500.0,"A botched robbery indicates a police informant, and the pressure mounts in the aftermath at a warehouse. Crime begets violence as the survivors -- veteran Mr. White, newcomer Mr. Orange, psychopathic parolee Mr. Blonde, bickering weasel Mr. Pink and Nice Guy Eddie -- unravel.",8.118,14859,"['Crime', 'Thriller']",3.0
1090,Platoon (1986),Drama|War,91763,792.0,"As a young and naive recruit in Vietnam, Chris Taylor faces a moral crisis when confronted with the horrors of war and the duality of man.",7.7,4827,"['Drama', 'War', 'Action']",3.0
1092,Basic Instinct (1992),Crime|Mystery|Thriller,103772,402.0,"Catherine, a novelist with an insatiable sexual appetite, becomes a prime suspect when her boyfriend is brutally murdered -- a crime she had described in her latest story.",6.928,4135,"['Thriller', 'Mystery']",3.5
1097,E.T. the Extra-Terrestrial (1982),Children|Drama|Sci-Fi,83866,601.0,"An alien is left behind on Earth and saved by the 10-year-old Elliott who decides to keep him hidden in his home. While a task force hunts for the extra-terrestrial, Elliott, his brother, and his little sister Gertie form an emotional bond with their new friend, and try to help him find his way home.",7.513,11575,"['Science Fiction', 'Adventure', 'Family', 'Fantasy']",3.0
1128,"Fog, The (1980)",Horror,80749,790.0,"Strange things begin to occur as a tiny California coastal town prepares to commemorate its centenary. Inanimate objects spring eerily to life; Rev. Malone stumbles upon a dark secret about the town's founding; radio announcer Stevie witnesses a mystical fire; and hitchhiker Elizabeth discovers the mutilated corpse of a fisherman. Then a mysterious iridescent fog descends upon the village, and more people start to die.",6.726,1644,['Horror'],4.0
1193,One Flew Over the Cuckoo's Nest (1975),Drama,73486,510.0,"A petty criminal fakes insanity to serve his sentence in a mental ward rather than prison. He soon finds himself as a leader to the other patients—and an enemy to the cruel, domineering nurse who runs the ward.",8.413,10966,['Drama'],5.0
1196,Star Wars: Episode V - The Empire Strikes Back (1980),Action|Adventure|Sci-Fi,80684,1891.0,"The epic saga continues as Luke Skywalker, in hopes of defeating the evil Galactic Empire, learns the ways of the Jedi from aging master Yoda. But Darth Vader is more determined than ever to capture Luke. Meanwhile, rebel leader Princess Leia, cocky Han Solo, Chewbacca, and droids C-3PO and R2-D2 are thrown into various stages of capture, betrayal and despair.",8.395,17707,"['Adventure', 'Action', 'Science Fiction']",5.0
1198,Raiders of the Lost Ark (Indiana Jones and the Raiders of the Lost Ark) (1981),Action|Adventure,82971,85.0,"When Dr. Indiana Jones – the tweed-suited professor who just happens to be a celebrated archaeologist – is hired by the government to locate the legendary Ark of the Covenant, he finds himself up against the entire Nazi regime.",7.925,13083,"['Adventure', 'Action']",3.5
1200,Aliens (1986),Action|Adventure|Horror|Sci-Fi,90605,679.0,"Ripley, the sole survivor of the Nostromo's deadly encounter with the monstrous Alien, returns to Earth after drifting through space in hypersleep for 57 years. Although her story is initially met with skepticism, she agrees to accompany a team of Colonial Marines back to LV-426.",7.952,10334,"['Action', 'Thriller', 'Science Fiction']",4.5
1206,"Clockwork Orange, A (1971)",Crime|Drama|Sci-Fi|Thriller,66921,185.0,"In a near-future Britain, young Alexander DeLarge and his pals get their kicks beating and raping anyone they please. When not destroying the lives of others, Alex swoons to the music of Beethoven. The state, eager to crack down on juvenile crime, gives an incarcerated Alex the option to undergo an invasive procedure that'll rob him of all personal agency. In a time when conscience is a commodity, can Alex change his tune?",8.185,13361,"['Science Fiction', 'Crime']",3.0
1210,Star Wars: Episode VI - Return of the Jedi (1983),Action|Adventure|Sci-Fi,86190,1892.0,"Luke Skywalker leads a mission to rescue his friend Han Solo from the clutches of Jabba the Hutt, while the Emperor seeks to destroy the Rebellion once and for all with a second dreaded Death Star.",7.904,16330,"['Adventure', 'Action', 'Science Fiction']",4.0
1214,Alien (1979),Horror|Sci-Fi,78748,348.0,"During its return to the earth, commercial spaceship Nostromo intercepts a distress signal from a distant planet. When a three-member team of the crew discovers a chamber containing thousands of eggs on the planet, a creature inside one of the eggs attacks an explorer. The entire crew is unaware of the impending nightmare set to descend upon them when the alien parasite planted inside its unfortunate host is birthed.",8.165,15622,"['Horror', 'Science Fiction']",5.0
1215,Army of Darkness (1993),Action|Adventure|Comedy|Fantasy|Horror,106308,766.0,"Ash, a handsome, shotgun-toting, chainsaw-armed department store clerk, is time warped backwards into England's Dark Ages, where he romances a beauty and faces legions of the undead.",7.255,3340,"['Fantasy', 'Horror', 'Comedy']",4.5
1225,Amadeus (1984),Drama,86879,279.0,Disciplined Italian composer Antonio Salieri becomes consumed by jealousy and resentment towards the hedonistic and remarkably talented young Salzburger composer Wolfgang Amadeus Mozart.,8.027,4499,"['History', 'Music', 'Drama']",3.0
1241,Dead Alive (Braindead) (1992),Comedy|Fantasy|Horror,103873,763.0,"When a Sumatran rat-monkey bites Lionel Cosgrove's mother, she's transformed into a zombie and begins killing (and transforming) the entire town while Lionel races to keep things under control.",7.387,1748,"['Horror', 'Comedy']",4.0
1255,Bad Taste (1987),Comedy|Horror|Sci-Fi,92610,9964.0,"A team from the intergalactic fast food chain Crumb's Crunchy Delights descends on Earth, planning to make human flesh the newest taste sensation. After they wipe out the New Zealand town Kaihoro, the country’s Astro-Investigation and Defense Service (AIaDS) is called in to deal with the problem. Things are complicated due to Giles, an aid worker who comes to Kaihoro the same day to collect change from the residents. He is captured by the aliens, and AIaDS stages a rescue mission that quickly becomes an all-out assault on the aliens’ headquarters.",6.319,870,"['Action', 'Comedy', 'Horror', 'Science Fiction']",3.5
1258,"Shining, The (1980)",Horror,81505,694.0,"Jack Torrance accepts a caretaker job at the Overlook Hotel, where he, along with his wife Wendy and their son Danny, must live isolated from the rest of the world for the winter. But they aren't prepared for the madness that lurks within.",8.209,18209,"['Horror', 'Thriller']",5.0
1259,Stand by Me (1986),Adventure|Drama,92005,235.0,"After learning that a boy their age has been accidentally killed near their rural homes, four Oregon boys decide to go see the body. On the way, Gordie,  Vern, Chris and Teddy encounter a mean junk man and a marsh full of leeches, as they also learn more about one another and their very different home lives. Just a lark at first, the boys' adventure evolves into a defining event in their lives.",7.853,6177,"['Crime', 'Drama']",2.5
1261,Evil Dead II (Dead by Dawn) (1987),Action|Comedy|Fantasy|Horror,92991,765.0,"Ash Williams and his girlfriend Linda find a log cabin in the woods with a voice recording from an archeologist who had recorded himself reciting ancient chants from ""The Book of the Dead."" As they play the recording an evil power is unleashed taking over Linda's body.",7.548,3299,"['Horror', 'Comedy', 'Fantasy']",5.0
1263,"Deer Hunter, The (1978)",Drama|War,77416,11778.0,"A group of working-class friends decide to enlist in the Army during the Vietnam War and finds it to be hellish chaos -- not the noble venture they imagined. Before they left, Steven married his pregnant girlfriend -- and Michael and Nick were in love with the same woman. But all three are different men upon their return.",7.988,4026,"['Drama', 'War']",4.5
1270,Back to the Future (1985),Adventure|Comedy|Sci-Fi,88763,105.0,"Eighties teenager Marty McFly is accidentally sent back in time to 1955, inadvertently disrupting his parents' first meeting and attracting his mother's romantic interest. Marty must repair the damage to history by rekindling his parents' romance and - with the help of his eccentric inventor friend Doc Brown - return to 1985.",8.321,20898,"['Adventure', 'Comedy', 'Science Fiction']",4.0
1320,Alien³ (a.k.a. Alien 3) (1992),Action|Horror|Sci-Fi|Thriller,103644,8077.0,"After escaping with Newt and Hicks from the alien planet, Ripley crash lands on Fiorina 161, a prison planet and host to a correctional facility. Unfortunately, although Newt and Hicks do not survive the crash, a more unwelcome visitor does. The prison does not allow weapons of any kind, and with aid being a long time away, the prisoners must simply survive in any way they can.",6.376,6048,"['Science Fiction', 'Action', 'Horror']",4.0
1321,"American Werewolf in London, An (1981)",Comedy|Horror|Thriller,82010,814.0,"American tourists David and Jack are savaged by an unidentified vicious animal whilst hiking on the Yorkshire Moors. Retiring to the home of a beautiful nurse to recuperate, David soon experiences disturbing changes to his mind and body.",7.4,2551,"['Comedy', 'Horror']",4.0
1326,Amityville II: The Possession (1982),Horror,83550,16235.0,"Anthony and Dolores Montelli, along with their four children, move into their dream house in Amityville and are immediately plagued by a string of paranormal experiences. When the abusive Anthony wrongly places the blame on their children, Dolores recruits a local Catholic priest to exorcise the house.",5.7,376,['Horror'],4.0
1327,"Amityville Horror, The (1979)",Drama|Horror|Mystery|Thriller,78767,11449.0,"George Lutz, his wife Kathy, and their three children have just moved into a beautiful, and improbably cheap, Victorian mansion nestled in the sleepy coastal town of Amityville, Long Island. However, their dream home is concealing a horrific past and soon each member of the Lutz family is plagued with increasingly strange and violent visions and impulses.",6.3,971,['Horror'],3.0
1330,April Fool's Day (1986),Horror,90655,24913.0,"As soon as Muffy St. John and her college friends arrive on her parents' secluded island, someone starts trimming the guest list... one murder at a time.",6.1,364,"['Horror', 'Mystery']",2.5
1331,Audrey Rose (1977),Horror,75704,49126.0,"A man is convinced that a young girl is the reincarnation of his own daughter Audrey Rose, who died in a fiery car accident, along with his wife, two minutes before the girl was born.",5.619,140,"['Drama', 'Horror', 'Thriller']",2.5
1339,Dracula (Bram Stoker's Dracula) (1992),Fantasy|Horror|Romance|Thriller,103874,6114.0,"In 19th century England, Count Dracula travels to London and meets Mina Harker, a young woman who appears as the reincarnation of his lost love.",7.445,5452,"['Romance', 'Horror']",4.0
1342,Candyman (1992),Horror|Thriller,103919,9529.0,"The Candyman, a murderous soul with a hook for a hand, is accidentally summoned to reality by a skeptic grad student researching the monster's myth.",6.634,1688,"['Drama', 'Horror', 'Thriller']",4.5
1345,Carrie (1976),Drama|Fantasy|Horror|Thriller,74285,7340.0,"Withdrawn and sensitive teen Carrie White faces taunting from classmates at school and abuse from her fanatically pious mother. When strange occurrences start happening around Carrie, she begins to suspect that she has supernatural powers.",7.321,4064,"['Horror', 'Thriller']",4.5
1346,Cat People (1982),Drama|Fantasy|Horror,83722,6217.0,"After years of separation, Irena Gallier and her minister brother, Paul, reunite in New Orleans. When zoologists capture a wild panther, Irena is drawn to the cat – and zoo curator Oliver to her. Soon, Paul will have to reveal the family secret: that when sexually aroused, they revert into predatory jungle cats.",6.039,536,"['Thriller', 'Horror']",3.0
1347,"Nightmare on Elm Street, A (1984)",Horror|Thriller,87800,377.0,"Teenagers in a small town are dropping like flies, apparently in the grip of mass hysteria causing their suicides. A cop's daughter, Nancy Thompson, traces the cause to child molester Fred Krueger, who was burned alive by angry parents many years before. Krueger has now come back in the dreams of his killers' children, claiming their lives as his revenge. Nancy and her boyfriend, Glen, must devise a plan to lure the monster out of the realm of nightmares and into the real world...",7.341,5437,['Horror'],4.5
1350,"Omen, The (1976)",Horror|Mystery|Thriller,75005,794.0,"Immediately after their miscarriage, the US diplomat Robert Thorn adopts the newborn Damien without the knowledge of his wife. Yet what he doesn’t know is that their new son is the son of the devil.",7.405,2256,"['Horror', 'Thriller']",4.0
1387,Jaws (1975),Action|Horror,73195,578.0,"When the seaside community of Amity finds itself under attack by a dangerous great white shark, the town's chief of police, a young marine biologist, and a grizzled hunter embark on a desperate quest to destroy the beast before it strikes again.",7.678,11033,"['Horror', 'Thriller', 'Adventure']",3.5
1407,Scream (1996),Comedy|Horror|Mystery|Thriller,117571,4232.0,"A year after the murder of her mother, a teenage girl is terrorized by a masked killer who targets her and her friends by using scary movies as part of a deadly game.",7.4,7455,"['Crime', 'Horror', 'Mystery']",4.0
1499,Anaconda (1997),Action|Adventure|Thriller,118615,9360.0,"A 'National Geographic' film crew is taken hostage by an insane hunter, who takes them along on his quest to capture the world's largest — and deadliest — snake.",5.245,2603,"['Adventure', 'Horror', 'Thriller']",1.5
1580,Men in Black (a.k.a. MIB) (1997),Action|Comedy|Sci-Fi,119654,607.0,"After a police chase with an otherworldly being, a New York City cop is recruited as an agent in a top-secret organization established to monitor and police alien activity on Earth: the Men in Black. Agent K and new recruit Agent J find themselves in the middle of a deadly plot by an intergalactic terrorist who has arrived on Earth to assassinate two ambassadors from opposing galaxies.",7.213,14299,"['Action', 'Adventure', 'Comedy', 'Science Fiction']",3.0
1645,The Devil's Advocate (1997),Drama|Mystery|Thriller,118971,1813.0,"Aspiring Florida defense lawyer Kevin Lomax accepts a job at a New York law firm. With the stakes getting higher every case, Kevin quickly learns that his boss has something far more evil planned.",7.469,6403,"['Drama', 'Mystery', 'Horror']",3.0
