movieId,title,genres,imdbId,tmdbId,overview,tmdb_vote_average,tmdb_vote_count,tmdb_genres,rating
2709,Muppets From Space (1999),Children|Comedy,158811,10208.0,"When Gonzo's breakfast cereal tells him that he's the descendant of aliens from another planet, his attempts at extraterrestrial communication get him kidnapped by a secret government agency, prompting the Muppets to spring into action. It's hard to believe Gonzo's story at first, but Kermit and friends soon find themselves on an epic journey into outer space filled with plenty of intergalactic misadventures.",6.1,340,"['Family', 'Comedy', 'Science Fiction']",4.0
2716,Ghostbusters (a.k.a. Ghost Busters) (1984),Action|Comedy|Sci-Fi,87332,620.0,"After losing their academic posts at a prestigious university, a team of parapsychologists goes into business as proton-pack-toting ""ghostbusters"" who exterminate ghouls, hobgoblins and supernatural pests of all stripes. An ad campaign pays off when a knockout cellist hires the squad to purge her swanky digs of demons that appear to be living in her refrigerator.",7.495,9359,"['Comedy', 'Fantasy']",5.0
2717,Ghostbusters II (1989),Comedy|Fantasy|Sci-Fi,97428,2978.0,The discovery of a massive river of ectoplasm and a resurgence of spectral activity allows the staff of Ghostbusters to revive the business.,6.593,4639,"['Comedy', 'Fantasy']",3.0
2718,Drop Dead Gorgeous (1999),Comedy,157503,10490.0,"In a small Minnesota town, the annual beauty pageant is being covered by a TV crew. Former winner Gladys Leeman wants to make sure her daughter follows in her footsteps; explosions, falling lights, and trailer fires prove that. As the Leemans are the richest family in town, the police are pretty relaxed about it all. Despite everything, main rival (but sweet) Amber Atkins won't give up without a fight.",6.4,401,['Comedy'],4.0
2720,Inspector Gadget (1999),Action|Adventure|Children|Comedy,141369,332.0,"John Brown is a bumbling but well-intentioned security guard who is badly injured in an explosion planned by an evil mastermind. He is taken to a laboratory, where Brenda, a leading robotics surgeon, replaces his damaged limbs with state-of-the-art gadgets and tools. Named ""Inspector Gadget"" by the press, John -- along with his niece, Penny, and her trusty dog, Brain -- uses his new powers to discover who was behind the explosion.",4.507,1263,"['Action', 'Adventure', 'Comedy', 'Family']",3.0
2735,"Golden Child, The (1986)",Action|Adventure|Comedy|Fantasy|Mystery,91129,10136.0,"After a Tibetan boy, the mystical Golden Child, is kidnapped by the evil Sardo Numspa, humankind's fate hangs in the balance. On the other side of the world in Los Angeles, the priestess Kee Nang seeks the Chosen One, who will save the boy from death. When Nang sees social worker Chandler Jarrell on television discussing his ability to find missing children, she solicits his expertise, despite his skepticism over being ""chosen.""",5.929,1123,"['Action', 'Adventure', 'Comedy']",2.0
2746,Little Shop of Horrors (1986),Comedy|Horror|Musical,91419,10776.0,"Seymour Krelborn is a nerdy orphan working at Mushnik's; a flower shop in urban Skid Row. He harbors a crush on fellow co-worker, Audrey Fulquard, and is berated by Mr. Mushnik daily. One day, Seymour finds a very mysterious unidentified plant which he calls Audrey II. The plant seems to have a craving for blood and soon begins to sing for his supper.",7.0,1527,"['Horror', 'Comedy']",4.0
2747,"Little Shop of Horrors, The (1960)",Comedy|Horror,54033,24452.0,"Seymour works in a skid row florist shop and is in love with his beautiful co-worker, Audrey. He creates a new plant that not only talks but cannot survive without human flesh and blood.",6.269,429,"['Horror', 'Comedy', 'Fantasy']",5.0
2750,Radio Days (1987),Comedy|Drama,93818,30890.0,"The Narrator tells us how the radio influenced his childhood in the days before TV. In the New York City of the late 1930s to the New Year's Eve 1944, this coming-of-age tale mixes the narrator's experiences with contemporary anecdotes and urban legends of the radio stars.",7.047,603,"['Comedy', 'Drama']",4.0
2752,Outrageous Fortune (1987),Comedy|Mystery,93690,20242.0,"Refined actress Lauren Ames finally has a chance to study with the great theatre professor Stanislav Korzenowski. Sandy Brozinsky, a brash, loud actress, decides through happenstance to also study with Korzenowski. The two women end up dating the same man (who turns out to be a double agent) and follow him across the country to force him to choose between them.",6.025,122,['Comedy'],4.0
2779,Heaven Can Wait (1978),Comedy,77663,12185.0,"Joe Pendleton is a quarterback preparing to lead his team to the superbowl when he is almost killed in an accident. An overanxious angel plucks him to heaven only to discover that he wasn't ready to die, and that his body has been cremated. A new body must be found, and that of a recently-murdered millionaire is chosen. His wife and accountant—the murderers—are confused by this development, as he buys the L.A. Rams in order to once again quarterback them into the Superbowl.",6.601,420,"['Fantasy', 'Comedy', 'Romance']",4.0
2791,Airplane! (1980),Comedy,80339,813.0,An ex-fighter pilot forced to take over the controls of an airliner when the flight crew succumbs to food poisoning.,7.307,4790,['Comedy'],3.0
2792,Airplane II: The Sequel (1982),Comedy,83530,2665.0,"A faulty computer causes a passenger space shuttle to head straight for the sun, and man-with-a-past Ted Striker must save the day and get the shuttle back on track – again – all the while trying to patch up his relationship with Elaine.",6.096,1185,['Comedy'],3.0
2794,European Vacation (aka National Lampoon's European Vacation) (1985),Adventure|Comedy|Romance,89670,11418.0,"The Griswolds win a vacation to Europe on a game show, and so pack their bags for the continent. They do their best to catch the flavor of Europe, but they just don't know how to be be good tourists. Besides, they have trouble taking holidays in countries where they CAN speak the language.",6.183,927,"['Adventure', 'Comedy', 'Romance']",3.0
2795,National Lampoon's Vacation (1983),Comedy,85995,11153.0,"Clark Griswold is on a quest to take his family to the Walley World theme park for a vacation, but things don't go exactly as planned.",7.102,1640,"['Comedy', 'Adventure']",5.0
2797,Big (1988),Comedy|Drama|Fantasy|Romance,94737,2280.0,When a young boy makes a wish at a carnival machine to be big—he wakes up the following morning to find that it has been granted and his body has grown older overnight. But he is still the same 13-year-old boy inside. Now he must learn how to cope with the unfamiliar world of grown-ups including getting a job and having his first romantic encounter with a woman.,7.183,3793,"['Fantasy', 'Drama', 'Comedy', 'Romance', 'Family']",3.0
2798,Problem Child (1990),Children|Comedy,100419,11077.0,"Ben Healy and his social climbing wife Flo adopt fun-loving seven year old Junior. But they soon discover he's a little monster as he turns a camping trip, a birthday party and even a baseball game into comic nightmares.",6.152,874,"['Comedy', 'Family']",2.0
2799,Problem Child 2 (1991),Comedy,102719,28597.0,"Junior and his father, Ben, move from Cold River to Mortville. Junior becomes threatened by Ben's desire to date again and find a new mother for Junior, and sabotages each of his dates.",5.885,635,"['Comedy', 'Family']",1.0
2805,Mickey Blue Eyes (1999),Comedy|Romance,130121,10154.0,"An English auctioneer proposes to the daughter of a mafia kingpin, only to realize that certain ""favors"" would be asked of him.",5.681,571,"['Comedy', 'Crime', 'Romance']",2.0
2858,American Beauty (1999),Drama|Romance,169547,14.0,"Lester Burnham, a depressed suburban father in a mid-life crisis, decides to turn his hectic life around after developing an infatuation with his daughter's attractive friend.",8.005,12564,['Drama'],4.0
2863,"Hard Day's Night, A (1964)",Adventure|Comedy|Musical,58182,704.0,"Capturing John Lennon, Paul McCartney, George Harrison and Ringo Starr in their electrifying element, 'A Hard Day's Night' is a wildly irreverent journey through this pastiche of a day in the life of The Beatles during 1964. The band have to use all their guile and wit to avoid the pursuing fans and press to reach their scheduled television performance, in spite of Paul's troublemaking grandfather and Ringo's arrest.",7.3,709,"['Comedy', 'Music']",3.0
2867,Fright Night (1985),Comedy|Horror|Thriller,89175,11797.0,"Charley Brewster, a high school student, accidentally discovers the true and creepy nature of Jerry Dandrige, his dashing and enigmatic new neighbor; but no one seems willing to believe him.",7.0,1453,"['Comedy', 'Horror']",3.0
2870,Barefoot in the Park (1967),Comedy,61385,17887.0,"In this film based on a Neil Simon play, newlyweds Corie, a free spirit, and Paul Bratter, an uptight lawyer, share a sixth-floor apartment in Greenwich Village. Soon after their marriage, Corie tries to find a companion for mother, Ethel, who is now alone, and sets up Ethel with neighbor Victor. Inappropriate behavior on a double date causes conflict, and the young couple considers divorce.",7.1,588,"['Comedy', 'Romance']",5.0
2874,"Pajama Game, The (1957)",Comedy|Musical|Romance,50814,40867.0,An Iowa pajama factory worker falls in love with an affable superintendent who had been hired by the factory's boss to help oppose the workers' demand for a pay raise.,6.3,62,"['Music', 'Comedy', 'Romance']",4.0
2877,Tommy (1975),Musical,73812,11326.0,"After a series of traumatic childhood events, a psychosomatically deaf, dumb and blind boy becomes a master pinball player and the object of a religious cult.",6.5,344,"['Drama', 'Music']",4.0
2889,"Mystery, Alaska (1999)",Comedy|Drama,134618,15198.0,"In Mystery, Alaska, life revolves around the legendary Saturday hockey game at the local pond. But everything changes when the hometown team unexpectedly gets booked in an exhibition match against the New York Rangers. When quirky small-towners, slick promoters and millionaire athletes come together.",6.3,267,"['Drama', 'Comedy']",4.0
2915,Risky Business (1983),Comedy,86200,9346.0,"Meet Joel Goodson, an industrious, college-bound 17-year-old and a responsible, trustworthy son. However, when his parents go away and leave him home alone in the wealthy Chicago suburbs with the Porsche at his disposal he quickly decides he has been good for too long and it is time to enjoy himself. After an unfortunate incident with the Porsche Joel must raise some cash, in a risky way.",6.617,1384,"['Romance', 'Comedy', 'Drama']",4.0
2918,Ferris Bueller's Day Off (1986),Comedy,91042,9377.0,"After high school slacker Ferris Bueller successfully fakes an illness in order to skip school for the day, he goes on a series of adventures throughout Chicago with his girlfriend Sloane and best friend Cameron, all the while trying to outwit his wily school principal and fed-up sister.",7.6,5138,['Comedy'],4.0
2926,Hairspray (1988),Comedy|Drama,95270,11054.0,"'Pleasantly plump' teenager Tracy Turnblad achieves her dream of becoming a regular on the Corny Collins Dance Show. Now a teen hero, she starts using her fame to speak out for the causes she believes in, most of all integration. In doing so, she earns the wrath of the show's former star, Amber Von Tussle, as well as Amber's manipulative, pro-segregation parents. The rivalry comes to a head as Amber and Tracy vie for the title of Miss Auto Show 1963.",6.8,426,"['Comedy', 'Music', 'Romance']",4.0
2935,"Lady Eve, The (1941)",Comedy|Romance,33804,3086.0,"It's no accident when wealthy Charles falls for Jean. Jean is a con artist with her sights set on Charles' fortune. Matters complicate when Jean starts falling for her mark. When Charles suspects Jean is a gold digger, he dumps her. Jean, fixated on revenge and still pining for the millionaire, devises a plan to get back in Charles' life. With love and payback on her mind, she re-introduces herself to Charles, this time as an aristocrat named Lady Eve Sidwich.",7.237,368,"['Comedy', 'Romance']",5.0
2936,Sullivan's Travels (1941),Adventure|Comedy|Romance,34240,16305.0,"Successful movie director John L. Sullivan, convinced he won't be able to film his ambitious masterpiece until he has suffered, dons a hobo disguise and sets off on a journey, aiming to ""know trouble"" first-hand. When all he finds is a train ride back to Hollywood and a beautiful blonde companion, he redoubles his efforts, managing to land himself in more trouble than he bargained for when he loses his memory and ends up a prisoner on a chain gang.",7.436,484,"['Comedy', 'Romance', 'Adventure']",4.0
2941,South Pacific (1958),Musical|Romance|War,52225,17352.0,"Can a girl from Little Rock find happiness with a mature French planter she got to know one enchanted evening away from the military hospital where she is a nurse? Or should she just wash that man out of her hair? Bloody Mary is the philosopher of the island and it's hard to believe she could be the mother of Liat who has captured the heart of Lt. Joseph Cable USMC. While waiting for action in the war in the South Pacific, sailors and nurses put on a musical comedy show. The war gets closer and the saga of Nellie Forbush and Emile de Becque becomes serious drama.",6.1,112,"['Music', 'Romance', 'War']",5.0
2953,Home Alone 2: Lost in New York (1992),Children|Comedy,104431,772.0,"Instead of flying to Florida with his folks, Kevin ends up alone in New York, where he gets a hotel room with his dad's credit card—despite problems from a clerk and meddling bellboy. But when Kevin runs into his old nemeses, the Wet Bandits, he's determined to foil their plans to rob a toy store on Christmas Eve.",6.767,10112,"['Comedy', 'Family', 'Adventure']",3.0
2971,All That Jazz (1979),Drama|Fantasy|Musical,78754,16858.0,"Joe Gideon is at the top of the heap, one of the most successful directors and choreographers in musical theater. But he can feel his world slowly collapsing around him - his obsession with work has almost destroyed his personal life, and only his bottles of pills keep him going.",7.508,546,['Drama'],4.0
2997,Being John Malkovich (1999),Comedy|Drama|Fantasy,120601,492.0,"One day at work, unsuccessful puppeteer Craig finds a portal into the head of actor John Malkovich. The portal soon becomes a passion for anybody who enters its mad and controlling world of overtaking another human body.",7.412,4569,"['Comedy', 'Drama', 'Fantasy']",4.0
3004,"Bachelor, The (1999)",Comedy|Romance,120596,2020.0,"Jimmie is seeing his single friends get married one by one. He isn't too worried until his girlfriend Anne catches the bouquet at his friend Marco's wedding. Suddenly, his wild mustang days are numbered. He finally decides to propose to her, but he sticks his foot in his mouth and botches the proposal. Being insulted by the defeatist proposal, Anne leaves town on an assignment. After she's gone, he finds out that his recently-deceased grandfather's will stipulates that he gets nothing of a multi-million dollar fortune unless he's married by 6:05pm on his 30th birthday: tomorrow! Not being able to find Anne, Jimmie begins backtracking through his past girlfriends to find a wife.",5.2,313,"['Comedy', 'Romance']",2.0
3028,"Taming of the Shrew, The (1967)",Comedy,61407,25560.0,"Italy, 16th century. Petruchio, a choleric, lying and poor rural landowner from Verona, arrives in Padua in search of fortune and a wife, while Baptista, a wealthy merchant, announces that he will not allow Bianca, his youngest daughter, to marry until the temperamental and unruly Katherina, his eldest daughter, does.",6.9,176,"['Comedy', 'Romance']",4.0
3033,Spaceballs (1987),Comedy|Sci-Fi,94012,957.0,"When the nefarious Dark Helmet hatches a plan to snatch Princess Vespa and steal her planet's air, space-bum-for-hire Lone Starr and his clueless sidekick fly to the rescue. Along the way, they meet Yogurt, who puts Lone Starr wise to the power of ""The Schwartz."" Can he master it in time to save the day?",6.9,3180,"['Comedy', 'Science Fiction']",3.0
3035,Mister Roberts (1955),Comedy|Drama|War,48380,37853.0,Mr. Roberts is a Navy officer who's yearning for battle but is stuck in the backwaters of World War II on a non-commissioned ship run by the bullying Captain Morton.,7.1,163,"['Comedy', 'Drama', 'War']",5.0
3040,Meatballs (1979),Comedy,79540,14035.0,"Tripper is the head counselor at a budget summer camp called Camp Northstar. In truth, he's young at heart and only marginally more mature than the campers themselves. Tripper befriends Rudy, a loner camper who has trouble fitting in. As Tripper inspires his young charges to defeat rival Camp Mohawk in the annual Olympiad competition, Rudy plays matchmaker between Tripper and Roxanne, a female counselor at Northstar.",5.9,338,['Comedy'],3.0
3041,Meatballs Part II (1984),Comedy,87700,40771.0,"Camp Sasquatch will be bought out and closed unless owner Coach Giddy wins the boxing competition scheduled for the end of the summer. Tough city punk Flash, who's performing his community service time at the camp, is the coach's best hope. Flash reluctantly offers to help and so must use his raw sparring talents to get a motley group of adolescent misfits into fighting shape, while also trying to win the heart of pretty Cheryl.",3.967,61,['Comedy'],2.0
3048,Under the Rainbow (1981),Comedy,83254,47941.0,"In World War II era Los Angeles, the manager of the Culver Hotel leaves his nephew in charge for a weekend. The nephew changes the name to the Hotel Rainbow and overbooks with royalty, assassins, secret agents, Japanese tourists, and munchkins. Secret Service agent Bruce Thorpe and casting director Annie Clark find romance amidst the intrigue and confusion.",5.3,35,['Comedy'],3.0
3052,Dogma (1999),Adventure|Comedy|Fantasy,120655,1832.0,An abortion clinic worker with a special heritage is called upon to save the existence of humanity from being negated by two renegade angels trying to exploit a loophole and reenter Heaven.,6.924,2650,"['Fantasy', 'Comedy', 'Adventure']",4.0
3061,Holiday Inn (1942),Comedy|Musical,34862,13485.0,"Lovely Linda Mason has crooner Jim Hardy head over heels, but suave stepper Ted Hanover wants her for his new dance partner after fickle Lila Dixon gives him the brush. Jim's supper club, Holiday Inn, is the setting for the chase by Hanover and his manager.",7.033,211,"['Comedy', 'Drama', 'Romance']",3.0
3087,Scrooged (1988),Comedy|Fantasy|Romance,96061,9647.0,"Frank Cross is a wildly successful television executive whose cold ambition and curmudgeonly nature has driven away the love of his life. But after firing a staff member on Christmas Eve, Frank is visited by a series of ghosts who give him a chance to re-evaluate his actions and right the wrongs of his past.",6.789,1606,"['Fantasy', 'Comedy', 'Drama']",4.0
3088,Harvey (1950),Comedy|Fantasy,42546,11787.0,"The story of Elwood P. Dowd who makes friends with a spirit taking the form of a human-sized rabbit named Harvey that only he sees (and a few privileged others on occasion also.) After his sister tries to commit him to a mental institution, a comedy of errors ensues. Elwood and Harvey become the catalysts for a family mending its wounds and for romance blossoming in unexpected places.",7.676,649,"['Comedy', 'Fantasy']",5.0
3099,Shampoo (1975),Comedy|Drama|Romance,73692,31121.0,A Beverly Hills hairdresser runs around town on the eve of the 1968 presidential election trying to make heads or tails of his financial and romantic entanglements. His attempts to gather the money to open his own salon are continually side-tracked by the distractions presented by his many lovers.,6.007,224,"['Comedy', 'Drama']",3.0
3104,Midnight Run (1988),Action|Comedy|Crime|Thriller,95631,9013.0,"A bounty hunter pursues a former Mafia accountant who embezzled $15 million of mob money. He is also being chased by a rival bounty hunter, the F.B.I., and his old mob boss after jumping bail.",7.198,1176,"['Action', 'Comedy', 'Crime', 'Thriller']",4.0
3108,"Fisher King, The (1991)",Comedy|Drama|Fantasy|Romance,101889,177.0,Two troubled men face their terrible destinies and events of their past as they join together on a mission to find the Holy Grail and thus to save themselves.,7.3,1394,"['Comedy', 'Drama']",4.0
3114,Toy Story 2 (1999),Adventure|Animation|Children|Comedy|Fantasy,120363,863.0,"Andy heads off to Cowboy Camp, leaving his toys to their own devices. Things shift into high gear when an obsessive toy collector named Al McWhiggen, owner of Al's Toy Barn kidnaps Woody. Andy's toys mount a daring rescue mission, Buzz Lightyear meets his match and Woody has to decide where he and his heart truly belong.",7.602,14382,"['Animation', 'Comedy', 'Family']",4.0
3144,"Glass Bottom Boat, The (1966)",Comedy|Romance,60463,33666.0,"Bruce, the owner of an aerospace company, is infatuated with Jennifer and hires her to be his biographer so that he can be near her and win her affections. Is she actually a Russian spy trying to obtain aerospace secrets?",6.2,63,"['Comedy', 'Romance']",5.0
3146,Deuce Bigalow: Male Gigolo (1999),Comedy,205000,10402.0,"Deuce Bigalow is a less than attractive, down on his luck aquarium cleaner. One day he wrecks the house of a gigolo and needs quick money to repair it. The only way he can make it is to become a gigolo himself, taking on an unusual mix of female clients. He encounters a couple of problems, though. He falls in love with one of his unusual clients, and a sleazy police officer is hot on his trail.",5.985,1468,"['Comedy', 'Romance']",2.0
3159,Fantasia 2000 (1999),Animation|Children|Musical|IMAX,120910,49948.0,"Blending lively music and brilliant animation, this sequel to the original 'Fantasia' restores 'The Sorcerer's Apprentice' and adds seven new shorts.",7.0,1324,"['Animation', 'Family', 'Music']",4.0
3201,Five Easy Pieces (1970),Drama,65724,26617.0,"A drop-out from upper-class America picks up work along the way on oil-rigs when his life isn't spent in a squalid succession of bars, motels, and other points of interest.",7.1,551,['Drama'],4.0
3243,Encino Man (1992),Comedy,104187,10406.0,"High school misfits Stoney and Dave discover a long-frozen primeval man buried in their backyard. But the thawed-out Link—as the boys have named him—quickly becomes a wild card in the teens' already zany Southern California lives. After a shave and some new clothes, Link's presence at school makes the daily drudgery a lot more interesting.",5.81,675,['Comedy'],3.0
3244,"Goodbye Girl, The (1977)",Comedy|Romance,76095,14741.0,"After being dumped by her live-in boyfriend, an unemployed dancer and her 10-year-old daughter are reluctantly forced to live with a struggling off-Broadway actor.",6.9,177,"['Comedy', 'Drama', 'Romance']",4.0
3247,Sister Act (1992),Comedy|Crime,105417,2005.0,"A Reno singer witnesses a mob murder and the cops stash her in a nunnery to protect her from the mob's hitmen. The mother superior does not trust her, and takes steps to limit her influence on the other nuns. Eventually the singer rescues the failing choir and begins helping with community projects, which gets her an interview on TV—and identification by the mob.",6.8,3304,"['Music', 'Comedy']",3.0
3253,Wayne's World (1992),Comedy,105793,8872.0,"The adventures of two amiably aimless metal-head friends, Wayne and Garth. From Wayne's basement, the pair broadcast a talk-show called ""Wayne's World"" on local public access television. The show comes to the attention of a sleazy network executive who wants to produce a big-budget version of ""Wayne's World""—and he also wants Wayne's girlfriend, a rock singer named Cassandra. Wayne and Garth have to battle the executive not only to save their show, but also Cassandra.",6.696,2350,['Comedy'],3.0
3254,Wayne's World 2 (1993),Comedy,108525,8873.0,"A message from Jim Morrison in a dream prompts cable access TV stars Wayne and Garth to put on a rock concert, ""Waynestock,"" with Aerosmith as headliners. But amid the preparations, Wayne frets that a record producer is putting the moves on his girlfriend, Cassandra, while Garth handles the advances of mega-babe Honey Hornée.",6.09,1099,['Comedy'],3.0
3255,"League of Their Own, A (1992)",Comedy|Drama,104694,11287.0,"As America's stock of athletic young men is depleted during World War II, a professional all-female baseball league springs up in the Midwest, funded by publicity-hungry candy maker Walter Harvey. Competitive sisters Dottie Hinson and Kit Keller spar with each other, scout Ernie Capadino and grumpy has-been coach Jimmy Dugan on their way to fame.",7.2,1464,"['Comedy', 'Drama']",4.0
3258,Death Becomes Her (1992),Comedy|Fantasy,104070,9374.0,"Madeline is married to Ernest, who was once her arch-rival Helen's fiancé. After recovering from a mental breakdown, Helen vows to kill Madeline and steal back Ernest. Unfortunately for everyone, the introduction of a magic potion causes things to be a great deal more complicated than a mere murder plot.",6.779,2800,"['Comedy', 'Fantasy', 'Horror']",2.0
3275,"Boondock Saints, The (2000)",Action|Crime|Drama|Thriller,144117,8374.0,"Tired of the crime overrunning the streets of Boston, Irish Catholic twin brothers Conner and Murphy are inspired by their faith to cleanse their hometown of evil with their own brand of zealous vigilante justice. As they hunt down and kill one notorious gangster after another, they become controversial folk heroes in the community. But Paul Smecker, an eccentric FBI agent, is fast closing in on their blood-soaked trail.",7.251,2550,"['Action', 'Thriller', 'Crime']",4.0
