movieId,title,genres,imdbId,tmdbId,overview,tmdb_vote_average,tmdb_vote_count,tmdb_genres,rating
2763,"Thomas Crown Affair, The (1999)",Action|Mystery,155267,913.0,"Bored billionaire executive Thomas Crown entertains himself by stealing a Monet from a reputed museum with an elaborate diversion. When Catherine Banning, the insurance company's investigator, takes an interest in Crown, he may have met his match, and a complicated back-and-forth game with seductive undertones begins between them.",6.755,1263,"['Drama', 'Crime', 'Romance']",5.0
2797,Big (1988),Comedy|Drama|Fantasy|Romance,94737,2280.0,When a young boy makes a wish at a carnival machine to be big—he wakes up the following morning to find that it has been granted and his body has grown older overnight. But he is still the same 13-year-old boy inside. Now he must learn how to cope with the unfamiliar world of grown-ups including getting a job and having his first romantic encounter with a woman.,7.183,3793,"['Fantasy', 'Drama', 'Comedy', 'Romance', 'Family']",5.0
2798,Problem Child (1990),Children|Comedy,100419,11077.0,"Ben Healy and his social climbing wife Flo adopt fun-loving seven year old Junior. But they soon discover he's a little monster as he turns a camping trip, a birthday party and even a baseball game into comic nightmares.",6.152,874,"['Comedy', 'Family']",5.0
2799,Problem Child 2 (1991),Comedy,102719,28597.0,"Junior and his father, Ben, move from Cold River to Mortville. Junior becomes threatened by Ben's desire to date again and find a new mother for Junior, and sabotages each of his dates.",5.885,635,"['Comedy', 'Family']",5.0
2809,Love Stinks (1999),Comedy,188863,15122.0,"A movie about a relationship...that's worse than yours. Seth (Stewart), a sitcom writer-producer, meets Chelsea (Wilson), an interior decorator, at his best friend's (Bellamy) wedding. He's immediately sexually attracted to her while she's instantly attracted to his single-ness. They both ditch their wedding dates and start their own date that same night. The two become a couple, appearing very happy until after a couple of years of postponing a marriage proposal. When Chelsea realizes that Seth wants to remain single and together, she becomes quite bitter. In the next hour of the movie, the two engage in behavior that makes the War of the Roses look like child's play.",6.3,61,"['Comedy', 'Romance']",5.0
2942,Flashdance (1983),Drama|Romance,85549,535.0,"Alex Owens, a young woman juggling between two odd jobs, aspires to become a successful ballet dancer. Nick, who is her boss and lover, supports and encourages her to fulfil her dream.",6.496,1539,"['Drama', 'Romance']",5.0
2947,Goldfinger (1964),Action|Adventure|Thriller,58150,658.0,"Special agent 007 comes face to face with one of the most notorious villains of all time, and now he must outwit and outgun the powerful tycoon to prevent him from cashing in on a devious scheme to raid Fort Knox -- and obliterate the world's economy.",7.355,3748,"['Adventure', 'Action', 'Thriller']",5.0
3004,"Bachelor, The (1999)",Comedy|Romance,120596,2020.0,"Jimmie is seeing his single friends get married one by one. He isn't too worried until his girlfriend Anne catches the bouquet at his friend Marco's wedding. Suddenly, his wild mustang days are numbered. He finally decides to propose to her, but he sticks his foot in his mouth and botches the proposal. Being insulted by the defeatist proposal, Anne leaves town on an assignment. After she's gone, he finds out that his recently-deceased grandfather's will stipulates that he gets nothing of a multi-million dollar fortune unless he's married by 6:05pm on his 30th birthday: tomorrow! Not being able to find Anne, Jimmie begins backtracking through his past girlfriends to find a wife.",5.2,313,"['Comedy', 'Romance']",5.0
3034,Robin Hood (1973),Adventure|Animation|Children|Comedy|Musical,70608,11886.0,"With King Richard off to the Crusades, Prince John and his slithering minion, Sir Hiss, set about taxing Nottingham's citizens with support from the corrupt sheriff - and staunch opposition by the wily Robin Hood and his band of merry men.",7.301,4497,"['Animation', 'Family', 'Adventure']",5.0
3082,"World Is Not Enough, The (1999)",Action|Adventure|Thriller,143145,36643.0,"Greed, revenge, world dominance and high-tech terrorism – it's all in a day's work for Bond, who's on a mission to protect a beautiful oil heiress from a notorious terrorist. In a race against time that culminates in a dramatic submarine showdown, Bond works to defuse the international power struggle that has the world's oil supply hanging in the balance.",6.286,3086,"['Adventure', 'Action', 'Thriller']",5.0
3114,Toy Story 2 (1999),Adventure|Animation|Children|Comedy|Fantasy,120363,863.0,"Andy heads off to Cowboy Camp, leaving his toys to their own devices. Things shift into high gear when an obsessive toy collector named Al McWhiggen, owner of Al's Toy Barn kidnaps Woody. Andy's toys mount a daring rescue mission, Buzz Lightyear meets his match and Woody has to decide where he and his heart truly belong.",7.602,14382,"['Animation', 'Comedy', 'Family']",5.0
3157,Stuart Little (1999),Children|Comedy|Fantasy,164912,10137.0,"When the Littles adopt Stuart, the mouse, George is initially unwelcoming to his new brother, and the family cat, Snowbell, is even less enthusiastic. Stuart resolves to face these difficulties with as much pluck and courage as he can muster.",6.065,4496,"['Family', 'Fantasy', 'Comedy', 'Adventure']",5.0
3175,Galaxy Quest (1999),Adventure|Comedy|Sci-Fi,177789,926.0,"For four years, the courageous crew of the NSEA Protector —  Commander Peter Quincy Taggart, Lieutenant Tawny Madison, and Doctor Lazarus — set off on a thrilling and often dangerous mission in space ... until their series was cancelled! Now, twenty years later, aliens under attack have mistaken the Galaxy Quest television transmissions for ""historical documents"" and beam up the crew of has-been actors to save the universe. With no script, no director, and no clue, the actors must turn in the performances of their lives.",7.1,2385,"['Comedy', 'Science Fiction', 'Adventure']",4.5
3176,"Talented Mr. Ripley, The (1999)",Drama|Mystery|Thriller,134119,1213.0,"Tom Ripley is a calculating young man who believes it's better to be a fake somebody than a real nobody. Opportunity knocks in the form of a wealthy U.S. shipbuilder who hires Tom to travel to Italy to bring back his playboy son, Dickie. Ripley worms his way into the idyllic lives of Dickie and his girlfriend, plunging into a daring scheme of duplicity, lies and murder.",7.196,3937,"['Thriller', 'Crime', 'Drama']",5.0
3243,Encino Man (1992),Comedy,104187,10406.0,"High school misfits Stoney and Dave discover a long-frozen primeval man buried in their backyard. But the thawed-out Link—as the boys have named him—quickly becomes a wild card in the teens' already zany Southern California lives. After a shave and some new clothes, Link's presence at school makes the daily drudgery a lot more interesting.",5.81,675,['Comedy'],5.0
3247,Sister Act (1992),Comedy|Crime,105417,2005.0,"A Reno singer witnesses a mob murder and the cops stash her in a nunnery to protect her from the mob's hitmen. The mother superior does not trust her, and takes steps to limit her influence on the other nuns. Eventually the singer rescues the failing choir and begins helping with community projects, which gets her an interview on TV—and identification by the mob.",6.8,3304,"['Music', 'Comedy']",5.0
3257,"Bodyguard, The (1992)",Drama|Romance|Thriller,103855,619.0,"A former Secret Service agent grudgingly takes an assignment to protect a pop idol who's threatened by a crazed fan. At first, the safety-obsessed bodyguard and the self-indulgent diva totally clash. But before long, all that tension sparks fireworks of another sort, and the love-averse tough guy is torn between duty and romance.",6.697,3086,"['Action', 'Drama', 'Romance']",5.0
3258,Death Becomes Her (1992),Comedy|Fantasy,104070,9374.0,"Madeline is married to Ernest, who was once her arch-rival Helen's fiancé. After recovering from a mental breakdown, Helen vows to kill Madeline and steal back Ernest. Unfortunately for everyone, the introduction of a magic potion causes things to be a great deal more complicated than a mere murder plot.",6.779,2800,"['Comedy', 'Fantasy', 'Horror']",4.5
3268,Stop! Or My Mom Will Shoot (1992),Action|Comedy,105477,9876.0,"A tough police sergeant's mother comes to visit him, and promptly starts trying to fix up his life, much to his embarrassment. For his birthday she buys him a machine gun out of the back of a van, and begins to further interfere with his job and love life, eventually helping him with a case he's on.",5.319,1051,"['Action', 'Comedy']",5.0
3287,"Tigger Movie, The (2000)",Animation|Children,220099,15655.0,"Winnie the Pooh, Piglet, Owl, Kanga, Roo, and Rabbit are preparing a suitable winter home for Eeyore, the perennially dejected donkey, but Tigger's continual bouncing interrupts their efforts. Rabbit suggests that Tigger go find others of his kind to bounce with, but Tigger thinks ""the most wonderful thing about tiggers is"" he's ""the only one!"" Just in case though, the joyously jouncy feline sets out to see if he can find relatives.",6.6,590,"['Animation', 'Family', 'Comedy']",5.0
3408,Erin Brockovich (2000),Drama,195685,462.0,"A twice-divorced mother of three who sees an injustice, takes on the bad guy and wins -- with a little help from her push-up bra. Erin goes to work for an attorney and comes across medical records describing illnesses clustered in one nearby town. She starts investigating and soon exposes a monumental cover-up.",7.442,3434,['Drama'],5.0
3526,Parenthood (1989),Comedy|Drama,98067,1552.0,"The story of the Buckman family and friends, attempting to bring up their children. They suffer/enjoy all the events that occur: estranged relatives, the 'black sheep' of the family, the eccentrics, the skeletons in the closet, and the rebellious teenagers.",6.683,674,"['Comedy', 'Drama', 'Romance', 'Family']",5.0
3536,Keeping the Faith (2000),Comedy|Drama|Romance,171433,4967.0,"Best friends since they were kids, Rabbi Jacob Schram and Father Brian Finn are dynamic and popular young men living and working on New York's Upper West Side. When Anna Reilly, once their childhood friend and now grown into a beautiful corporate executive, suddenly returns to the city, she reenters Jake and Brian's lives and hearts with a vengeance. Sparks fly and an unusual and complicated love triangle ensues.",6.1,631,"['Comedy', 'Romance']",5.0
3564,"Flintstones in Viva Rock Vegas, The (2000)",Children|Comedy,158622,889.0,"The Flintstones are at it again. The Flintstones and the Rubbles head for Rock Vegas with Fred hoping to court the lovely Wilma. Nothing will stand in the way of love, except for the conniving Chip Rockefeller who is the playboy born in Baysville but who has made it in the cutthroat town of Rock Vegas. Will Fred win Wilma's love?",4.8,780,"['Comedy', 'Family', 'Romance']",5.0
3616,Loser (2000),Comedy|Romance,217630,10642.0,"On a university scholarship, a good natured student from the midwest gets a crash course in city life while dealing with three evil roommates. He befriends a virtually homeless college student whom he falls for, but she's dating a nasty professor.",5.38,450,"['Comedy', 'Romance']",5.0
3633,On Her Majesty's Secret Service (1969),Action|Adventure|Romance|Thriller,64757,668.0,"James Bond tracks his archnemesis, Ernst Blofeld, to a mountaintop retreat in the Swiss alps where he is training an army of beautiful, lethal women. Along the way, Bond falls for Italian contessa Tracy Draco, and marries her in order to get closer to Blofeld.",6.6,2007,"['Adventure', 'Action', 'Thriller']",5.0
3635,"Spy Who Loved Me, The (1977)",Action|Adventure|Thriller,76752,691.0,Russian and British submarines with nuclear missiles on board both vanish from sight without a trace. England and Russia both blame each other as James Bond tries to solve the riddle of the disappearing ships. But the KGB also has an agent on the case.,6.824,2096,"['Adventure', 'Action', 'Thriller']",5.0
3639,"Man with the Golden Gun, The (1974)",Action|Adventure|Thriller,71807,682.0,"Cool government operative James Bond searches for a stolen invention that can turn the sun's heat into a destructive weapon. He soon crosses paths with the menacing Francisco Scaramanga, a hitman so skilled he has a seven-figure working fee. Bond then joins forces with the swimsuit-clad Mary Goodnight, and together they track Scaramanga to a Thai tropical isle hideout where the killer-for-hire lures the slick spy into a deadly maze for a final duel.",6.454,2148,"['Adventure', 'Action', 'Thriller']",5.0
3751,Chicken Run (2000),Animation|Children|Comedy,120630,7443.0,"The creators of Wallace & Gromit bring you an exciting and original story about a group of chickens determined to fly the coop–even if they can’t fly! It’s hardly poultry in motion when Rocky attempts to teach Ginger and her feathered friends to fly…but, with teamwork, determination and a little bit o’ cluck, the fearless flock plots one last attempt in a spectacular bid for freedom.",6.831,5219,"['Animation', 'Comedy', 'Family']",4.5
3752,"Me, Myself & Irene (2000)",Adventure|Comedy,183505,2123.0,"Rhode Island State Trooper Charlie Baileygates has a multiple personality disorder. One personality is crazy and aggressive, while the other is more friendly and laid back. Both of these personalities fall in love with the same woman named Irene after Charlie loses his medication.",6.6,4048,['Comedy'],5.0
3809,What About Bob? (1991),Comedy,103241,10276.0,"Before going on vacation, self-involved psychiatrist Dr. Leo Marvin has the misfortune of taking on a new patient: Bob Wiley. An exemplar of neediness and a compendium of phobias, Bob follows Marvin to his family's country house. Dr. Marvin tries to get him to leave; the trouble is, everyone loves Bob. As his oblivious patient makes himself at home, Dr. Marvin loses his professional composure and, before long, may be ready for the loony bin himself.",6.86,860,['Comedy'],5.0
3821,Nutty Professor II: The Klumps (2000),Comedy,144528,12107.0,"The hilarity begins when professor Sherman Klump finds romance with fellow DNA specialist, Denise Gaines, and discovers a brilliant formula that reverses aging. But Sherman's thin and obnoxious alter ego, Buddy Love, wants out...and a big piece of the action. And when Buddy gets loose, things get seriously nutty.",5.0,1351,"['Fantasy', 'Comedy', 'Romance', 'Science Fiction']",5.0
3825,Coyote Ugly (2000),Comedy|Drama|Romance,200550,6282.0,"Graced with a velvet voice, 21-year-old Violet Sanford heads to New York to pursue her dream of becoming a songwriter only to find her aspirations sidelined by the accolades and notoriety she receives at her ""day"" job as a barmaid at Coyote Ugly. The ""Coyotes"" as they are affectionately called tantalize customers and the media alike with their outrageous antics, making Coyote Ugly the watering hole for guys on the prowl.",6.272,2165,"['Comedy', 'Drama', 'Music', 'Romance']",5.0
3844,Steel Magnolias (1989),Drama,98384,10860.0,"A young beautician, newly arrived in a small Louisiana town, finds work at the local salon, where a small group of women share a close bond of friendship and welcome her into the fold.",7.197,688,"['Comedy', 'Drama', 'Romance']",5.0
3869,"Naked Gun 2 1/2: The Smell of Fear, The (1991)",Comedy,102510,37137.0,"Bumbling lieutenant Frank Drebin is out to foil the big boys in the energy industry, who intend to suppress technology that will put them out of business.",6.804,2511,"['Comedy', 'Crime']",4.5
3967,Billy Elliot (2000),Drama,249462,71.0,"County Durham, England, 1984. The miners' strike has started and the police have started coming up from Bethnal Green, starting a class war with the lower classes suffering. Caught in the middle of the conflict is 11-year old Billy Elliot, who, after leaving his boxing club for the day, stumbles upon a ballet class and finds out that he's naturally talented. He practices with his teacher Mrs. Wilkinson for an upcoming audition in Newcastle-upon Tyne for the royal Ballet school in London.",7.598,3958,"['Drama', 'Comedy', 'Music']",5.0
3968,Bedazzled (2000),Comedy,230030,1636.0,"Elliot Richards, a socially awkward IT worker, is given seven wishes to get the girl of his dreams when he meets a very seductive Satan. The catch: his soul. Some of his wishes include being a 7 foot basketball star, a wealthy, powerful man, and a sensitive caring guy. But, as could be expected, the Devil puts her own little twist on each of his fantasies.",6.068,1982,"['Fantasy', 'Comedy', 'Romance']",5.0
3977,Charlie's Angels (2000),Action|Comedy,160127,4327.0,"The captivating crime-fighting trio who are masters of disguise, espionage and martial arts are back! When a devious mastermind embroils them in a plot to destroy individual privacy, the Angels, aided by their loyal sidekick Bosley, set out to bring down the bad guys. But when a terrible secret is revealed, it makes the Angels targets for assassination.",5.847,4324,"['Action', 'Adventure', 'Comedy', 'Crime', 'Thriller']",5.0
3978,"Legend of Bagger Vance, The (2000)",Drama|Romance,146984,4958.0,"World War I has left golfer Rannulph Junuh a poker-playing alcoholic, his perfect swing gone. Now, however, he needs to get it back to play in a tournament to save the financially ravaged golf course of a long-ago sweetheart. Help arrives in the form of mysterious caddy Bagger Vance.",6.594,945,"['Drama', 'Romance', 'Fantasy']",5.0
3988,How the Grinch Stole Christmas (a.k.a. The Grinch) (2000),Children|Comedy|Fantasy,170016,8871.0,The Grinch decides to rob Whoville of Christmas - but a dash of kindness from little Cindy Lou Who and her family may be enough to melt his heart...,6.773,7883,"['Family', 'Comedy']",4.5
3991,102 Dalmatians (2000),Children|Comedy,211181,10481.0,"Get ready for a howling good time as an all new assortment of irresistible animal heroes are unleashed in this great family tail! In an unlikely alliance, the outrageous Waddlesworth - a parrot who thinks he's a Rottweiler - teams up with Oddball - an un-marked Dalmatian puppy eager to earn her spots! Together they embark on a laugh-packed quest to outwit the ever-scheming Cruella De Vil.",5.507,1414,"['Family', 'Comedy']",4.5
4018,What Women Want (2000),Comedy|Romance,207201,3981.0,"Advertising executive Nick Marshall is as cocky as they come, but what happens to a chauvinistic guy when he can suddenly hear what women are thinking? Nick gets passed over for a promotion, but after an accident enables him to hear women's thoughts, he puts his newfound talent to work against Darcy, his new boss, who seems to be infatuated with him.",6.443,4125,"['Comedy', 'Romance']",5.0
4022,Cast Away (2000),Drama,162222,8358.0,"Chuck Noland, a top international manager for FedEx, and Kelly, a Ph.D. student, are in love and heading towards marriage. Then Chuck's plane to Malaysia crashes at sea during a terrible storm. He's the only survivor, and finds himself marooned on a desolate island. With no way to escape, Chuck must find ways to survive in his new home.",7.66,11831,"['Adventure', 'Drama']",5.0
4023,"Family Man, The (2000)",Comedy|Drama|Romance,218967,5994.0,"Jack's lavish, fast-paced lifestyle changes one Christmas night when he stumbles into a grocery store holdup and disarms the gunman. The next morning he wakes up in bed lying next to Kate, his college sweetheart he left in order to pursue his career, and to the horrifying discovery that his former life no longer exists. As he stumbles through this alternate suburban universe, Jack finds himself at a crossroad where he must choose between his high-power career and the woman he loves.",6.804,2062,"['Comedy', 'Drama', 'Romance', 'Fantasy']",5.0
4027,"O Brother, Where Art Thou? (2000)",Adventure|Comedy|Crime,190590,134.0,"In the deep south during the 1930s, three escaped convicts search for hidden treasure while a relentless lawman pursues them.",7.317,4364,"['Adventure', 'Comedy', 'Crime']",5.0
4041,"Officer and a Gentleman, An (1982)",Drama|Romance,84434,2623.0,"Zack Mayo is an aloof, taciturn man who aspires to be a navy pilot. Once he arrives at training camp for his 13-week officer's course, Mayo runs afoul of abrasive, no-nonsense drill Sergeant Emil Foley. Mayo is an excellent cadet, but a little cold around the heart, so Foley rides him mercilessly, sensing that the young man would be prime officer material if he weren't so self-involved. Zack's affair with a working girl is likewise compromised by his unwillingness to give of himself.",7.0,1147,"['Drama', 'Romance']",5.0
4228,Heartbreakers (2001),Comedy|Crime|Romance,125022,10833.0,"Max and Page are a brilliant mother/daughter con team who have their grift down to a fine science. Max targets wealthy, willing men and marries them. Page then seduces them, and Max catches her husband in the act. Then it's off to palimony city and the next easy mark.",6.1,942,"['Comedy', 'Romance', 'Crime']",5.0
4232,Spy Kids (2001),Action|Adventure|Children|Comedy,227538,10054.0,"Carmen and Juni think their parents are boring. Little do they know that in their day, Gregorio and Ingrid Cortez were the top secret agents from their respective countries. They gave up that life to raise their children. Now, the disappearances of several of their old colleagues forces the Cortez' return from retirement. What they didn't count on was Carmen and Juni joining the ""family business.""",5.8,3571,"['Family', 'Action', 'Comedy', 'Adventure', 'Science Fiction']",5.0
4246,Bridget Jones's Diary (2001),Comedy|Drama|Romance,243155,634.0,"Bridget Jones is an average woman struggling against her age, her weight, her job, her lack of a man, and her various imperfections. As a New Year's resolution, Bridget decides to take control of her life, starting by keeping a diary in which she will always tell the complete truth. The fireworks begin when her charming though disreputable boss takes an interest in the quirky Miss Jones. Thrown into the mix are Bridget's band of slightly eccentric friends and a rather disagreeable acquaintance into whom Bridget cannot seem to stop running or help finding quietly attractive.",6.745,5294,"['Comedy', 'Romance', 'Drama']",5.0
4299,"Knight's Tale, A (2001)",Action|Comedy|Romance,183790,9476.0,"William Thatcher, a knight's peasant apprentice, gets a chance at glory when the knight dies suddenly mid-tournament. Posing as a knight himself, William won't stop until he's crowned tournament champion—assuming matters of the heart don't get in the way.",6.87,3214,"['Adventure', 'Drama', 'Romance', 'Action']",5.0
4306,Shrek (2001),Adventure|Animation|Children|Comedy|Fantasy|Romance,126029,808.0,"It ain't easy bein' green -- especially if you're a likable (albeit smelly) ogre named Shrek. On a mission to retrieve a gorgeous princess from the clutches of a fire-breathing dragon, Shrek teams up with an unlikely compatriot -- a wisecracking donkey.",7.752,17986,"['Animation', 'Comedy', 'Fantasy', 'Adventure', 'Family']",5.0
4308,Moulin Rouge (2001),Drama|Musical|Romance,203009,824.0,"A celebration of love and creative inspiration takes place in the infamous, gaudy and glamorous Parisian nightclub, at the cusp of the 20th century. A young poet, who is plunged into the heady world of Moulin Rouge, begins a passionate affair with the club's most notorious and beautiful star.",7.545,4672,"['Drama', 'Romance', 'Music']",5.0
4310,Pearl Harbor (2001),Action|Drama|Romance|War,213149,676.0,"The lifelong friendship between Rafe McCawley and Danny Walker is put to the ultimate test when the two ace fighter pilots become entangled in a love triangle with beautiful Naval nurse Evelyn Johnson. But the rivalry between the friends-turned-foes is immediately put on hold when they find themselves at the center of Japan's devastating attack on Pearl Harbor on Dec. 7, 1941.",6.941,6750,"['War', 'Romance', 'History', 'Action']",5.0
4366,Atlantis: The Lost Empire (2001),Adventure|Animation|Children|Fantasy,230011,10865.0,A young linguist named Milo Thatch joins an intrepid group of explorers to find the mysterious lost continent of Atlantis.,7.029,4947,"['Animation', 'Family', 'Adventure', 'Science Fiction']",5.0
4378,Sexy Beast (2000),Crime|Drama,203119,11826.0,"Ex-safecracker Gal Dove has served his time behind bars and is blissfully retired to a Spanish villa paradise with a wife he adores. The idyll is shattered by the arrival of his nemesis Don Logan, intent on persuading Gal to return to London for one last big job.",7.005,833,"['Crime', 'Thriller', 'Drama']",5.0
4386,Cats & Dogs (2001),Children|Comedy,239395,10992.0,"When a professor develops a vaccine that eliminates human allergies to dogs, he unwittingly upsets the fragile balance of power between cats and dogs and touches off an epic battle for pet supremacy. The fur flies as the feline faction, led by Mr. Tinkles, squares off against wide-eyed puppy Lou and his canine cohorts.",5.387,1682,"['Family', 'Comedy', 'Action', 'Adventure', 'Fantasy']",5.0
4447,Legally Blonde (2001),Comedy|Romance,250494,8835.0,"Fashionable sorority queen Elle Woods has it all, but, she wants nothing more than to be Mrs. Warner Huntington III. But he dumps her before heading to Harvard Law School. Elle rallies all of her resources and gets into Harvard, determined to win him back. While there, she figures out that there is more to herself than just good looks.",6.806,4286,"['Comedy', 'Romance']",5.0
4474,Beaches (1988),Comedy|Drama|Musical,94715,15592.0,"A privileged rich debutante and a cynical struggling entertainer share a turbulent, but strong childhood friendship over the years.",6.7,267,"['Comedy', 'Drama']",5.0
