movieId,title,genres,imdbId,tmdbId,overview,tmdb_vote_average,tmdb_vote_count,tmdb_genres,rating
1655,Phantoms (1998),Drama|Horror|Thriller,119891,9827.0,"In the peaceful Colorado town of Snowfield, something evil has wiped out the community. And now, it's up to a group of people to stop it, or at least get out of Snowfield alive.",5.4,368,"['Horror', 'Science Fiction', 'Thriller']",3.0
1682,"Truman Show, The (1998)",Comedy|Drama|Sci-Fi,120382,37165.0,An insurance salesman begins to suspect that his whole life is actually some sort of reality TV show.,8.1,19327,"['Comedy', 'Drama']",3.0
1717,Scream 2 (1997),Comedy|Horror|Mystery|Thriller,120082,4233.0,"Two years after the first series of murders, as Sidney Prescott acclimates to college life, someone donning the Ghostface costume begins a new string of killings.",6.502,4429,"['Horror', 'Mystery']",2.5
1732,"Big Lebowski, The (1998)",Comedy|Crime,118715,115.0,"Jeffrey 'The Dude' Lebowski, a Los Angeles slacker who only wants to bowl and drink White Russians, is mistaken for another Jeffrey Lebowski, a wheelchair-bound millionaire, and finds himself dragged into a strange series of events involving nihilists, adult film producers, ferrets, errant toes, and large sums of money.",7.84,11690,"['Comedy', 'Crime']",3.0
1968,"Breakfast Club, The (1985)",Comedy|Drama,88847,2108.0,"Five high school students from different walks of life endure a Saturday detention under a power-hungry principal. The disparate group includes rebel John, princess Claire, outcast Allison, brainy Brian and Andrew, the jock. Each has a chance to tell his or her story, making the others see them a little differently -- and when the day ends, they question whether school will ever be the same.",7.728,8256,"['Comedy', 'Drama']",3.0
1969,"Nightmare on Elm Street 2: Freddy's Revenge, A (1985)",Horror,89686,10014.0,"Jesse Walsh moves with his family into the home of the lone survivor from a series of attacks by dream-stalking monster, Freddy Krueger. There, he is bedeviled by nightmares and inexplicably violent impulses.",5.785,1981,['Horror'],3.5
1970,"Nightmare on Elm Street 3: Dream Warriors, A (1987)",Horror|Thriller,93629,10072.0,"During a hallucinatory incident, Kristen Parker has her wrists slashed by dream-stalking monster, Freddy Krueger. Her mother, mistaking the wounds for a suicide attempt, sends her to a psychiatric ward, where she joins a group of similarly troubled teens.",6.698,1898,"['Horror', 'Thriller', 'Fantasy']",3.5
1971,"Nightmare on Elm Street 4: The Dream Master, A (1988)",Horror|Thriller,95742,10131.0,"Freddy Krueger is resurrected from his apparent demise, and rapidly tracks down and kills the remainder of the Elm Street kids. However, Kristen, who can draw others into her dreams, wills her special ability to her new friend, Alice.",5.868,1516,"['Horror', 'Thriller']",3.0
1974,Friday the 13th (1980),Horror|Mystery|Thriller,80761,4488.0,Camp counselors are stalked and murdered by an unknown assailant while trying to reopen a summer camp that was the site of a child's drowning.,6.414,3139,['Horror'],3.0
1975,Friday the 13th Part 2 (1981),Horror,82418,9725.0,"Five years after the horrible bloodbath at Camp Crystal Lake, new counselors roam the area, not sensing the ominous lurking presence that proves that the grisly legend is real.",6.203,1800,"['Horror', 'Thriller']",2.0
1982,Halloween (1978),Horror,77651,948.0,"Fifteen years after murdering his sister on Halloween Night 1963, Michael Myers escapes from a mental hospital and returns to the small town of Haddonfield, Illinois to kill again.",7.562,5892,"['Horror', 'Thriller']",4.5
1983,Halloween II (1981),Horror,82495,11281.0,"After failing to kill stubborn survivor Laurie and taking a bullet or six from former psychiatrist Dr. Sam Loomis, Michael Myers has followed Laurie to the Haddonfield Memorial Hospital, where she's been admitted for Myers' attempt on her life. The institution proves to be particularly suited to serial killers, however, as Myers cuts, stabs and slashes his way through hospital staff to reach his favorite victim.",6.58,2142,"['Horror', 'Thriller']",5.0
1984,Halloween III: Season of the Witch (1982),Horror,85636,10676.0,"A terrified toy salesman is mysteriously attacked, and at the hospital, babbles and clutches the year's most popular Halloween costume, an eerie pumpkin mask. Suddenly, Doctor Daniel Challis finds himself thrust into a terrifying nightmare.",5.227,1452,"['Horror', 'Science Fiction']",2.5
1985,Halloween 4: The Return of Michael Myers (1988),Horror,95271,11357.0,Michael returns to Haddonfield for Jamie Lloyd – the orphaned daughter of Laurie Strode – and her babysitter Rachel. Can Dr. Loomis stop him before the unholy slaughter reaches his innocent young niece?,6.174,1983,"['Horror', 'Thriller']",2.0
1991,Child's Play (1988),Horror|Thriller,94862,10585.0,An innocent-looking doll is inhabited by the soul of a serial killer who refuses to die.,6.725,3153,['Horror'],3.0
1992,Child's Play 2 (1990),Horror|Thriller,99253,11186.0,"Chucky is reconstructed by a toy factory to dispel the negative publicity surrounding the doll, and tracks young Andy Barclay to a foster home where the chase begins again.",6.335,1926,"['Horror', 'Thriller']",2.5
1994,Poltergeist (1982),Horror|Thriller,84516,609.0,"Upon realizing that something truly evil haunts his home, Steve Freeling calls in a team of parapsychologists to help before it's too late.",7.152,3158,['Horror'],4.0
1995,Poltergeist II: The Other Side (1986),Horror|Thriller,91778,11133.0,"The Freeling family move in with Diane's mother in an effort to escape the trauma and aftermath of Carol Anne's abduction by the Beast. But the Beast is not to be put off so easily and appears in a ghostly apparition as the Reverend Kane, a religious zealot responsible for the deaths of his many followers. His goal is simple - he wants the angelic Carol Anne.",5.985,725,"['Horror', 'Thriller']",3.0
1996,Poltergeist III (1988),Horror|Thriller,95889,10306.0,"Carol Anne has been sent to live with her Aunt and Uncle in an effort to hide her from the clutches of the ghostly Reverend Kane, but he tracks her down and terrorises her in her relatives' appartment in a tall glass building. Will he finally achieve his target and capture Carol Anne again, or will Tangina be able, yet again, to thwart him?",5.231,522,"['Horror', 'Thriller']",2.0
1997,"Exorcist, The (1973)",Horror|Mystery,70047,9552.0,"When a charming 12-year-old girl takes on the characteristics and voices of others, doctors say there is nothing they can do. As people begin to die, the girl's mother realizes her daughter has been possessed by the Devil. Her daughter's only possible hope lies with two priests and the ancient rite of demonic exorcism.",7.737,8296,['Horror'],5.0
1999,"Exorcist III, The (1990)",Horror,99528,11587.0,"On the fifteenth anniversary of the exorcism that claimed Father Damien Karras' life, Police Lieutenant Kinderman's world is once again shattered when a boy is found decapitated and savagely crucified.",6.257,812,['Horror'],3.5
2003,Gremlins (1984),Comedy|Horror,87363,927.0,"After receiving an exotic small animal as a Christmas gift, a young man inadvertently breaks three important rules concerning his new pet, which unleashes a horde of malevolently mischievous creatures on a small town.",7.137,6668,"['Fantasy', 'Horror', 'Comedy']",4.5
2004,Gremlins 2: The New Batch (1990),Comedy|Horror,99700,928.0,"Young sweethearts Billy and Kate move to the Big Apple, land jobs in a high-tech office park and soon reunite with the friendly and lovable Gizmo. But a series of accidents creates a whole new generation of Gremlins. The situation worsens when the devilish green creatures invade a top-secret laboratory and develop genetically altered powers, making them even harder to destroy!",6.519,2739,"['Comedy', 'Horror', 'Fantasy']",2.5
2011,Back to the Future Part II (1989),Adventure|Comedy|Sci-Fi,96874,165.0,"Marty and Doc are at it again as the time-traveling duo head to 2015 to nip some McFly family woes in the bud. But things go awry thanks to bully Biff Tannen and a pesky sports almanac. In a last-ditch attempt to set things straight, Marty finds himself bound for 1955 and face to face with his teenage parents -- again.",7.772,13378,"['Adventure', 'Comedy', 'Science Fiction']",2.5
2076,Blue Velvet (1986),Drama|Mystery|Thriller,90756,793.0,"The discovery of a severed human ear found in a field leads a young man on an investigation related to a beautiful, mysterious nightclub singer and a group of psychopathic criminals who have kidnapped her child.",7.609,3594,"['Mystery', 'Thriller', 'Crime', 'Drama']",3.5
2107,Halloween H20: 20 Years Later (Halloween 7: The Revenge of Laurie Strode) (1998),Horror|Thriller,120694,11675.0,"Two decades after surviving a massacre on October 31, 1978, former baby sitter Laurie Strode finds herself hunted by persistent knife-wielder Michael Myers. Laurie now lives in Northern California under an assumed name, where she works as the headmistress of a private school. But it's not far enough to escape Myers, who soon discovers her whereabouts. As Halloween descends upon Laurie's peaceful community, a feeling of dread weighs upon her -- with good reason.",6.048,1719,"['Horror', 'Thriller']",2.5
2115,Indiana Jones and the Temple of Doom (1984),Action|Adventure|Fantasy,87469,87.0,"After arriving in India, Indiana Jones is asked by a desperate village to find a mystical stone. He agrees – and stumbles upon a secret cult plotting a terrible plan in the catacombs of an ancient palace.",7.302,9713,"['Adventure', 'Action']",2.5
2118,"Dead Zone, The (1983)",Thriller,85407,11336.0,"Johnny Smith is a schoolteacher with his whole life ahead of him but, after leaving his fiancee's home one night, is involved in a car crash which leaves him in a coma for 5 years. When he wakes, he discovers he has an ability to see into the past, present and future life of anyone with whom he comes into physical contact.",7.0,1721,"['Thriller', 'Horror', 'Science Fiction']",4.0
2120,Needful Things (1993),Drama|Horror,107665,10657.0,"A mysterious new shop opens in a small town which always seems to stock the deepest desires of each shopper, with a price far heavier than expected.",6.239,569,"['Drama', 'Horror']",2.5
2121,Cujo (1983),Horror|Thriller,85382,10489.0,"A friendly St. Bernard named ""Cujo"" contracts rabies and conducts a reign of terror on a small American town.",6.153,1060,"['Horror', 'Thriller']",3.0
2122,Children of the Corn (1984),Horror|Thriller,87050,10823.0,A traveling couple end up in an abandoned Nebraska town inhabited by a cult of murderous children who worship a demon that lives in the local cornfields.,5.726,1059,"['Horror', 'Thriller']",2.0
2148,House (1986),Comedy|Fantasy|Horror,91223,11415.0,"Roger Cobb, a divorced horror novelist coming to terms with the disappearance of his young son, inherits an old mansion home to malevolent supernatural residents.",6.189,591,"['Comedy', 'Horror', 'Fantasy']",3.0
2149,House II: The Second Story (1987),Comedy|Fantasy|Horror,93220,37530.0,"Jesse moves into an old family property where his parents were mysterious murdered years before. He soon finds himself with unexpected guests in the form of his mummified great-great grandfather, a mystical crystal skull, and a zombie cowboy.",5.549,263,"['Fantasy', 'Horror', 'Comedy']",2.0
2159,Henry: Portrait of a Serial Killer (1986),Crime|Horror|Thriller,99763,10692.0,"Arriving in Chicago, Henry moves in with ex-con acquaintance Otis and starts schooling him in the ways of the serial killer.",6.7,739,"['Crime', 'Horror', 'Thriller', 'Drama']",2.5
2167,Blade (1998),Action|Horror|Thriller,120611,36647.0,"The Daywalker known as ""Blade"" - a half-vampire, half-mortal man - becomes the protector of humanity against an underground army of vampires.",6.8,6369,"['Horror', 'Action']",3.0
2288,"Thing, The (1982)",Action|Horror|Sci-Fi|Thriller,84787,1091.0,"A twelve-man team at a remote Antarctic research station discovers an alien buried in the snow for over 100,000 years. Soon unfrozen, the form-changing creature wreaks havoc, creates terror...And becomes one of them.",8.069,7462,"['Horror', 'Mystery', 'Science Fiction']",5.0
2291,Edward Scissorhands (1990),Drama|Fantasy|Romance,99487,162.0,A small suburban town receives a visit from a castaway unfinished science experiment named Edward.,7.719,13334,"['Fantasy', 'Drama', 'Romance']",2.5
2328,Vampires (1998),Horror|Western,120877,9945.0,The church enlists a team of vampire-hunters to hunt down and destroy a group of vampires searching for an ancient relic that will allow them to exist in sunlight.,6.328,1293,"['Action', 'Fantasy', 'Horror']",3.5
2377,Lifeforce (1985),Horror|Sci-Fi,89489,11954.0,A space shuttle mission investigating Halley's Comet brings back a malevolent race of space vampires who transform most of London's population into zombies. The only survivor of the expedition and British authorities attempt to capture a mysterious but beautiful alien woman who appears responsible.,6.235,656,"['Horror', 'Science Fiction', 'Action', 'Mystery']",3.5
2403,First Blood (Rambo: First Blood) (1982),Action|Adventure|Drama|Thriller,83944,1368.0,"When former Green Beret John Rambo is harassed by local law enforcement and arrested for vagrancy, he is forced to flee into the mountains and wage an escalating one-man war against his pursuers.",7.495,6579,"['Action', 'Adventure', 'Thriller', 'War']",3.5
2428,"Faculty, The (1998)",Horror|Sci-Fi,133751,9276.0,"When some very creepy things start happening around school, the kids at Herrington High make the chilling discovery that confirms their worst suspicions: their teachers really are from another planet!",6.6,2108,"['Horror', 'Science Fiction']",2.5
2455,"Fly, The (1986)",Drama|Horror|Sci-Fi|Thriller,91064,9426.0,"When Seth Brundle makes a huge scientific and technological breakthrough in teleportation, he decides to test it on himself. Unbeknownst to him, a common housefly manages to get inside the device and the two become one.",7.422,4703,"['Horror', 'Science Fiction']",5.0
2456,"Fly II, The (1989)",Horror|Sci-Fi,97368,10344.0,"Martin Brundle, born of the human/fly, is adopted by his father's place of employment (Bartok Inc.) while the employees simply wait for his mutant chromosomes to come out of their dormant state.",5.7,692,"['Horror', 'Science Fiction']",3.0
2459,"Texas Chainsaw Massacre, The (1974)",Horror,72271,30497.0,"Five friends head out to rural Texas to visit the grave of a grandfather. On the way they stumble across what appears to be a deserted house, only to discover something sinister within. Something armed with a chainsaw.",7.3,3575,['Horror'],2.5
2460,"Texas Chainsaw Massacre 2, The (1986)",Horror,92076,16337.0,A radio host is victimized by the cannibal family as a former Texas marshal hunts them.,5.642,949,"['Horror', 'Comedy']",2.5
2462,Texas Chainsaw Massacre: The Next Generation (a.k.a. The Return of the Texas Chainsaw Massacre) (1994),Horror,110978,16780.0,"After a group of Texas teenagers leave prom night early and get into a car crash in the woods, they employ the aid of a nearby insurance agent, who calls in her tow truck-driving boyfriend, Vilmer Slaughter. Unfortunately for them, Vilmer is a sadistic killer with a mechanical leg who introduces them to his brother, Leatherface, and the rest of their twisted family.",4.6,713,"['Horror', 'Comedy']",2.5
2464,Trick or Treat (1986),Horror,92112,25438.0,"Eddie Weinbauer, a metalhead teen who is bullied at school, looks to his heavy metal superstar idol, Sammi Curr, for guidance. When Curr is killed in a hotel fire, Eddie becomes the recipient of the only copy of Curr's unreleased album, which, when played backwards, brings Sammi back to life. As Halloween approaches, Eddie begins to realize that this isn't only rock 'n roll...it's life and death.",6.1,181,"['Horror', 'Comedy', 'Music']",2.5
2513,Pet Sematary (1989),Horror,98084,8913.0,"After the Creed family's cat is accidentally killed, a friendly neighbor advises its burial in a mysterious nearby cemetery.",6.633,2269,['Horror'],3.0
2517,Christine (1983),Horror,85333,8769.0,"Nerdy high schooler Arnie Cunningham falls for Christine, a rusty 1958 Plymouth Fury, and becomes obsessed with restoring the classic automobile to her former glory. As the car changes, so does Arnie, whose newfound confidence turns to arrogance behind the wheel of his exotic beauty. Arnie's girlfriend Leigh and best friend Dennis reach out to him, only to be met by a Fury like no other.",6.9,2097,['Horror'],4.5
2551,Dead Ringers (1988),Drama|Horror|Thriller,94964,9540.0,"Elliot, a successful gynecologist, works at the same practice as his identical twin, Beverly. Elliot is attracted to many of his patients and has affairs with them. When he inevitably loses interest, he will give the woman over to Beverly, the meeker of the two, without the woman knowing the difference. Beverly falls hard for one of the patients, Claire, but when she inadvertently deceives him, he slips into a state of madness.",7.124,941,"['Thriller', 'Horror']",2.5
2571,"Matrix, The (1999)",Action|Sci-Fi|Thriller,133093,603.0,"Set in the 22nd century, The Matrix tells the story of a computer hacker who joins a group of underground insurgents fighting the vast and powerful computers who now rule the earth.",8.232,26831,"['Action', 'Science Fiction']",5.0
2600,eXistenZ (1999),Action|Sci-Fi|Thriller,120907,1946.0,A game designer on the run from assassins must play her latest virtual reality creation with a marketing trainee to determine if the game has been damaged.,6.8,2048,"['Action', 'Thriller', 'Science Fiction']",4.0
2617,"Mummy, The (1999)",Action|Adventure|Comedy|Fantasy|Horror|Thriller,120616,564.0,Dashing legionnaire Rick O'Connell stumbles upon the hidden ruins of Hamunaptra while in the midst of a battle to claim the area in 1920s Egypt. It has been over three thousand years since former High Priest Imhotep suffered a fate worse than death as a punishment for a forbidden love—along with a curse that guarantees eternal doom upon the world if he is ever awoken.,6.95,9510,"['Adventure', 'Action', 'Fantasy']",3.0
2628,Star Wars: Episode I - The Phantom Menace (1999),Action|Adventure|Sci-Fi,120915,1893.0,"Anakin Skywalker, a young slave strong with the Force, is discovered on Tatooine. Meanwhile, the evil Sith have returned, enacting their plot for revenge against the Jedi.",6.565,15247,"['Adventure', 'Action', 'Science Fiction']",3.0
2710,"Blair Witch Project, The (1999)",Drama|Horror|Thriller,185937,2667.0,"In October of 1994 three student filmmakers disappeared in the woods near Burkittsville, Maryland, while shooting a documentary. A year later their footage was found.",6.361,5139,"['Horror', 'Mystery']",2.5
2716,Ghostbusters (a.k.a. Ghost Busters) (1984),Action|Comedy|Sci-Fi,87332,620.0,"After losing their academic posts at a prestigious university, a team of parapsychologists goes into business as proton-pack-toting ""ghostbusters"" who exterminate ghouls, hobgoblins and supernatural pests of all stripes. An ad campaign pays off when a knockout cellist hires the squad to purge her swanky digs of demons that appear to be living in her refrigerator.",7.495,9359,"['Comedy', 'Fantasy']",3.5
2719,"Haunting, The (1999)",Horror|Thriller,171363,11618.0,Dr. David Marrow invites three distinct individuals to the eerie and isolated Hill House to be subjects for a sleep disorder study. The unfortunate guests discover that Marrow is far more interested in the sinister mansion itself — and they soon see the true nature of its horror.,5.474,1423,"['Horror', 'Thriller', 'Fantasy', 'Mystery']",1.0
2722,Deep Blue Sea (1999),Action|Horror|Sci-Fi|Thriller,149261,8914.0,"Researchers on the undersea lab Aquatica have genetically altered the brains of captive sharks to develop a cure for Alzheimer's disease. But there's an unexpected side effect: the sharks got smarter, faster, and more dangerous. After a big storm damages their remote research facility, they must fight for their lives.",5.992,2535,"['Action', 'Horror', 'Science Fiction']",3.0
2787,Cat's Eye (1985),Horror,88889,10552.0,"Three short stories linked by a stray cat that roams from one tale to the next, in this creepy triptych that begins as Dick tries to quit smoking by any means necessary. Next, we meet Johnny, an adulterous man who's forced by his lover's husband onto a building's hazardous ledge. Finally, Amanda is threatened by an evil gnome who throws suspicion on the family cat.",6.7,689,"['Horror', 'Thriller']",3.0
2789,Damien: Omen II (1978),Horror,77394,10766.0,"Since the sudden and suspicious deaths of his parents, young Damien has been in the charge of his wealthy aunt and uncle and enrolled in a military school. Widely feared to be the Antichrist, he relentlessly plots to seize control of his uncle's business empire — and the world.",6.422,774,"['Horror', 'Thriller']",3.0
2858,American Beauty (1999),Drama|Romance,169547,14.0,"Lester Burnham, a depressed suburban father in a mid-life crisis, decides to turn his hectic life around after developing an infatuation with his daughter's attractive friend.",8.005,12564,['Drama'],4.5
2867,Fright Night (1985),Comedy|Horror|Thriller,89175,11797.0,"Charley Brewster, a high school student, accidentally discovers the true and creepy nature of Jerry Dandrige, his dashing and enigmatic new neighbor; but no one seems willing to believe him.",7.0,1453,"['Comedy', 'Horror']",4.0
2898,"Dark Half, The (1993)",Horror|Mystery,106664,10349.0,"Following the public's realization that Thad Beaumont and George Stark are one and the same, the former stages a mock funeral, only for a series of gruesome murders to begin occurring as in his books.",6.0,437,"['Mystery', 'Horror']",3.0
2902,Psycho II (1983),Horror|Mystery|Thriller,86154,10576.0,"Norman Bates is declared sane and released from the facility in which he was being held, despite the complaints of Lila Loomis, sister of his most famous victim. Is he really cured, or will he kill again?",6.49,676,"['Horror', 'Mystery', 'Thriller']",3.0
2903,Psycho III (1986),Horror|Thriller,91799,12662.0,"When Maureen Coyle, a suicidal nun who resembles Norman's former victim, Marion Crane, arrives at the motel, all bets are off and ""Mother"" is less than happy.",5.7,403,"['Horror', 'Mystery', 'Thriller']",3.5
2916,Total Recall (1990),Action|Adventure|Sci-Fi|Thriller,100802,861.0,"Construction worker Douglas Quaid's obsession with the planet Mars leads him to visit Recall, a company that manufactures memories. When his memory implant goes wrong, Doug can no longer be sure what is and isn't reality.",7.309,6112,"['Action', 'Adventure', 'Science Fiction']",3.5
2985,RoboCop (1987),Action|Crime|Drama|Sci-Fi|Thriller,93870,5548.0,"In a violent, near-apocalyptic Detroit, evil corporation Omni Consumer Products wins a contract from the city government to privatize the police force. To test their crime-eradicating cyborgs, the company leads street cop Alex Murphy into an armed confrontation with crime lord Boddicker so they can use his body to support their untested RoboCop prototype. But when RoboCop learns of the company's nefarious plans, he turns on his masters.",7.347,5436,"['Action', 'Thriller', 'Science Fiction']",4.0
3013,Bride of Re-Animator (1990),Comedy|Horror,99180,18111.0,"Unperturbed by the disastrous outcome of his previous meddling with the dead, Dr. West continues his research into the phenomenon of re-animation; only this time, he plans to create life – starting with the heart of his young protégé Dan's dearly deceased Meg Halsey.",6.478,470,"['Horror', 'Comedy', 'Science Fiction']",3.5
3016,Creepshow (1982),Horror,83767,16281.0,"Five grisly tales from a 1950s-style comic, including a murdered father rising from beyond, a bizarre meteor, a vengeful husband, a mysterious crate's occupant, and a plague of cockroaches.",6.911,1091,"['Horror', 'Comedy']",2.5
3017,Creepshow 2 (1987),Horror,92796,16288.0,"Three macabre tales from the latest issue of a boy's favorite comic book, dealing with a vengeful wooden Native American, a monstrous blob in a lake, and an undying hitchhiker.",6.265,615,"['Horror', 'Comedy']",2.0
3018,Re-Animator (1985),Comedy|Horror|Sci-Fi,89885,1694.0,"Conducting clandestine experiments within the morgue at Miskatonic University, scientist Herbert West reveals to a fellow graduate student his groundbreaking work concerning the re-animation of fresh corpses.",7.048,1579,"['Science Fiction', 'Comedy', 'Horror']",4.5
3081,Sleepy Hollow (1999),Fantasy|Horror|Mystery|Romance,162661,2668.0,"Skeptical young detective Ichabod Crane gets transferred to the hamlet of Sleepy Hollow, New York, where he is tasked with investigating the decapitations of three people – murders the townsfolk attribute to a legendary specter, The Headless Horseman.",7.187,7062,"['Fantasy', 'Thriller', 'Mystery', 'Horror']",4.0
3147,"Green Mile, The (1999)",Crime|Drama,120689,497.0,"A supernatural tale set on death row in a Southern prison, where gentle giant John Coffey possesses the mysterious power to heal people's ailments. When the cell block's head guard, Paul Edgecomb, recognizes Coffey's miraculous gift, he tries desperately to help stave off the condemned man's execution.",8.503,18392,"['Fantasy', 'Drama', 'Crime']",4.0
3203,Dead Calm (1989),Thriller,97162,10493.0,"An Australian couple takes a sailing trip in the Pacific to get over the recent loss of their son. While on the open sea, they come across a sinking ship with one survivor who is not at all what he seems.",6.6,783,"['Thriller', 'Horror']",4.0
