movieId,title,genres,imdbId,tmdbId,overview,tmdb_vote_average,tmdb_vote_count,tmdb_genres,rating
1,Toy Story (1995),Adventure|Animation|Children|Comedy|Fantasy,114709,862.0,"Led by Woody, Andy's toys live happily in his room until Andy's birthday brings Buzz Lightyear onto the scene. Afraid of losing his place in Andy's heart, Woody plots against Buzz. But when circumstances separate Buzz and Woody from their owner, the duo eventually learns to put aside their differences.",7.969,19166,"['Family', 'Comedy', 'Animation']",4.5
2,Jumanji (1995),Adventure|Children|Fantasy,113497,8844.0,"When siblings Judy and Peter discover an enchanted board game that opens the door to a magical world, they unwittingly invite Alan -- an adult who's been trapped inside the game for 26 years -- into their living room. Alan's only hope for freedom is to finish the game, which proves risky as all three find themselves running from giant rhinoceroses, evil monkeys and other terrifying creatures.",7.24,10907,"['Adventure', 'Fantasy', 'Family']",2.5
22,Copycat (1995),Crime|Drama|Horror|Mystery|Thriller,112722,1710.0,An agoraphobic psychologist and a female detective must work together to take down a serial killer who copies serial killers from the past.,6.469,1151,"['Thriller', 'Crime', 'Mystery', 'Horror', 'Drama']",3.0
47,Seven (a.k.a. Se7en) (1995),Mystery|Thriller,114369,807.0,"Two homicide detectives are on a desperate hunt for a serial killer whose crimes are based on the ""seven deadly sins"" in this dark and haunting film that takes viewers from the tortured remains of one victim to the next. The seasoned Det. Somerset researches each sin in an effort to get inside the killer's mind, while his novice partner, Mills, scoffs at his efforts to unravel the case.",8.376,22134,"['Crime', 'Mystery', 'Thriller']",4.0
50,"Usual Suspects, The (1995)",Crime|Mystery|Thriller,114814,629.0,"Held in an L.A. interrogation room, Verbal Kint attempts to convince the feds that a mythic crime lord, Keyser Soze, not only exists, but was also responsible for drawing him and his four partners into a multi-million dollar heist that ended with an explosion in San Pedro harbor – leaving few survivors. Verbal lures his interrogators with an incredible story of the crime lord's almost supernatural prowess.",8.172,10880,"['Drama', 'Crime', 'Thriller']",5.0
69,Friday (1995),Comedy,113118,10634.0,"Craig and Smokey are two guys in Los Angeles hanging out on their porch on a Friday afternoon, smoking and drinking, looking for something to do.",7.126,1910,"['Comedy', 'Drama']",3.5
70,From Dusk Till Dawn (1996),Action|Comedy|Horror|Thriller,116367,755.0,"After kidnapping a father and his two kids, the Gecko brothers head south to a seedy Mexican bar to hide out in safety, unaware of its notorious vampire clientele.",7.029,6195,"['Horror', 'Action', 'Thriller', 'Crime']",4.5
79,"Juror, The (1996)",Drama|Thriller,116731,9623.0,"With his gangster boss on trial for murder, a mob thug known as ""the Teacher"" tells Annie Laird she must talk her fellow jurors into a not-guilty verdict, implying that he'll kill her son Oliver if she fails. She manages to do this, but, when it becomes clear that the mobsters might want to silence her for good, she sends Oliver abroad and tries to gather evidence of the plot against her, setting up a final showdown.",5.648,412,"['Thriller', 'Crime', 'Drama']",2.5
104,Happy Gilmore (1996),Comedy,116483,9614.0,"Failed hockey player-turned-golf whiz Happy Gilmore — whose unconventional approach and antics on the green courts the ire of rival Shooter McGavin — is determined to win a PGA tournament so he can save his granny's house with the prize money. Meanwhile, an attractive tour publicist tries to soften Happy's image.",6.67,3099,['Comedy'],5.0
110,Braveheart (1995),Action|Drama|War,112573,197.0,"Enraged at the slaughter of Murron, his new bride and childhood love, Scottish warrior William Wallace slays a platoon of the local English lord's soldiers. This leads the village to revolt and, eventually, the entire country to rise up against English rule.",7.943,10616,"['Action', 'Drama', 'History', 'War']",5.0
147,"Basketball Diaries, The (1995)",Drama,112461,10474.0,A high school basketball player’s life turns upside down after free-falling into the harrowing world of drug addiction.,7.406,2099,"['Drama', 'Crime']",4.0
150,Apollo 13 (1995),Adventure|Drama|IMAX,112384,568.0,"The true story of technical troubles that scuttle the Apollo 13 lunar mission in 1970, risking the lives of astronaut Jim Lovell and his crew, with the failed journey turning into a thrilling saga of heroism. Drifting more than 200,000 miles from Earth, the astronauts work furiously with the ground crew to avert tragedy.",7.452,5616,"['Drama', 'History']",4.5
165,Die Hard: With a Vengeance (1995),Action|Crime|Thriller,112864,1572.0,"New York detective John McClane is back and kicking bad-guy butt in the third installment of this action-packed series, which finds him teaming with civilian Zeus Carver to prevent the loss of innocent lives. McClane thought he'd seen it all, until a genius named Simon engages McClane, his new ""partner"" -- and his beloved city -- in a deadly game that demands their concentration.",7.272,6379,"['Action', 'Thriller']",4.0
175,Kids (1995),Drama,113540,9344.0,"A day in the life of a group of teens as they travel around New York City skating, drinking, smoking and deflowering virgins.",6.899,1207,"['Drama', 'Crime']",4.0
180,Mallrats (1995),Comedy|Romance,113749,2293.0,"Both dumped by their girlfriends, two best friends seek refuge in the local mall. Eventually, they decide to try and win back their significant others and take care of their respective nemeses.",6.8,1300,"['Romance', 'Comedy']",4.0
204,Under Siege 2: Dark Territory (1995),Action,114781,3512.0,"A passenger train has been hijacked by an electronics expert and turned into an untraceable command center for a weapons satellite. He has planned to blow up Washington DC and only one man can stop him, former Navy SEAL Casey Ryback.",5.849,959,"['Action', 'Thriller']",1.0
216,Billy Madison (1995),Comedy,112508,11017.0,"Billy Madison is the 27 year-old son of Bryan Madison, a very rich man who has made his living in the hotel industry. Billy stands to inherit his father's empire, but only if he can make it through all 12 grades, 2 weeks per grade, to prove that he has what it takes to run the family business.",6.183,1711,['Comedy'],3.5
223,Clerks (1994),Comedy,109445,2292.0,"Convenience and video store clerks Dante and Randal are sharp-witted, potty-mouthed and bored out of their minds. So in between needling customers, the counter jockeys play hockey on the roof, visit a funeral home and deal with their love lives.",7.4,2614,['Comedy'],4.0
231,Dumb & Dumber (Dumb and Dumber) (1994),Adventure|Comedy,109686,8467.0,"Lloyd and Harry are two men whose stupidity is really indescribable. When Mary, a beautiful woman, loses an important suitcase with money before she leaves for Aspen, the two friends (who have found the suitcase) decide to return it to her. After some ""adventures"" they finally get to Aspen where, using the lost money they live it up and fight for Mary's heart.",6.636,6387,['Comedy'],4.0
257,Just Cause (1995),Mystery|Thriller,113501,9061.0,A Harvard professor is lured back into the courtroom after twenty-five years to take the case of a young black man condemned to death for the horrific murder of a child.,6.239,589,"['Action', 'Drama', 'Mystery', 'Thriller']",2.0
259,Kiss of Death (1995),Crime|Drama|Thriller,113552,6071.0,"Jimmy Kilmartin's an ex-con who's trying to go straight. But he can't say no to a quick driving job because his so-called friend's life is threatened. The job is for Little Junior Brown, a violent and powerful villain. When things go wrong, Jimmy is left to do the time, and his whole life is turned upside-down, but if that wasn't enough, the cops won't leave Jimmy alone when he gets out... They want Little Junior Brown.",5.7,337,"['Crime', 'Thriller', 'Drama']",2.5
260,Star Wars: Episode IV - A New Hope (1977),Action|Adventure|Sci-Fi,76759,11.0,Princess Leia is captured and held hostage by the evil Imperial forces in their effort to take over the galactic Empire. Venturesome Luke Skywalker and dashing captain Han Solo team together with the loveable robot duo R2-D2 and C-3PO to rescue the beautiful princess and restore peace and justice in the Empire.,8.205,21519,"['Adventure', 'Action', 'Science Fiction']",3.5
280,Murder in the First (1995),Drama|Thriller,113870,8438.0,"A young, inexperienced public defender is assigned to defend an inmate accused of committing murder while behind bars.",7.2,585,"['Crime', 'Drama']",3.5
296,Pulp Fiction (1994),Comedy|Crime|Drama|Thriller,110912,680.0,"A burger-loving hit man, his philosophical partner, a drug-addled gangster's moll and a washed-up boxer converge in this sprawling, comedic crime caper. Their adventures unfurl in three stories that ingeniously trip back and forth in time.",8.487,29115,"['Thriller', 'Crime', 'Comedy', 'Drama']",4.0
318,"Shawshank Redemption, The (1994)",Crime|Drama,111161,278.0,"Imprisoned in the 1940s for the double murder of his wife and her lover, upstanding banker Andy Dufresne begins a new life at the Shawshank prison, where he puts his accounting skills to work for an amoral warden. During his long stretch in prison, Dufresne comes to be admired by the other inmates -- including an older prisoner named Red -- for his integrity and unquenchable sense of hope.",8.713,28941,"['Drama', 'Crime']",5.0
333,Tommy Boy (1995),Comedy,114694,11381.0,"To save the family business, two ne’er-do-well traveling salesmen hit the road with disastrously funny consequences.",6.795,1001,['Comedy'],4.0
344,Ace Ventura: Pet Detective (1994),Comedy,109040,3049.0,"He's Ace Ventura: Pet Detective. Jim Carrey is on the case to find the Miami Dolphins' missing mascot and quarterback Dan Marino. He goes eyeball to eyeball with a man-eating shark, stakes out the Miami Dolphins and woos and wows the ladies. Whether he's undercover, under fire or underwater, he always gets his man… or beast!",6.568,6081,"['Comedy', 'Mystery', 'Crime']",4.0
350,"Client, The (1994)",Drama|Mystery|Thriller,109446,10731.0,"A street-wise kid, Mark Sway, sees the suicide of Jerome Clifford, a prominent Louisiana lawyer, whose current client is Barry 'The Blade' Muldano, a Mafia hit-man. Before Jerome shoots himself, he tells Mark where the body of a Senator is buried. Clifford shoots himself and Mark is found at the scene, and both the FBI and the Mafia quickly realize that Mark probably knows more than he says.",6.7,1244,"['Drama', 'Thriller', 'Crime', 'Mystery']",3.0
356,Forrest Gump (1994),Comedy|Drama|Romance|War,109830,13.0,"A man with a low IQ has accomplished great things in his life and been present during significant historic events—in each case, far exceeding what anyone imagined he could do. But despite all he has achieved, his one true love eludes him.",8.466,28666,"['Comedy', 'Drama', 'Romance']",4.0
361,It Could Happen to You (1994),Comedy|Drama|Romance,110167,10660.0,"Charlie Lang is a simple, kindhearted New York City cop. When he realizes he has no money to tip waitress Yvonne Biasi, Lang offers her half the winnings of his lottery ticket. Amazingly, the ticket happens to be a winner, in the sum of $4 million. True to his word, Lang proceeds to share the prize money with Biasi, which infuriates his greedy wife, Muriel. Not content with the arrangement, Muriel begins scheming to take all the money.",6.7,848,"['Comedy', 'Drama', 'Romance']",3.5
370,Naked Gun 33 1/3: The Final Insult (1994),Action|Comedy,110622,36593.0,"Frank Drebin is persuaded out of retirement to go undercover in a state prison. There he has to find out what top terrorist, Rocco, has planned for when he escapes. Adding to his problems, Frank's wife, Jane, is desperate for a baby.",6.5,2312,"['Comedy', 'Crime']",4.0
377,Speed (1994),Action|Romance|Thriller,111257,1637.0,"Jack Traven, an LAPD cop on SWAT detail, and veteran SWAT officer Harry Temple thwart an extortionist-bomber's scheme for a $3 million ransom. As they corner the bomber, he flees and detonates a bomb vest, seemingly killing himself. Weeks later, Jack witnesses a mass transit city bus explode and nearby a pay phone rings. On the phone is that same bomber looking for vengeance and the money he's owed. He gives a personal challenge to Jack: a bomb is rigged on another city bus - if it slows down below 50 mph, it will explode - bad enough any day, but a nightmare in LA traffic. And that's just the beginning...",7.144,6499,"['Action', 'Thriller']",4.0
380,True Lies (1994),Action|Adventure|Comedy|Romance|Thriller,111503,36955.0,"A fearless, globe-trotting, terrorist-battling secret agent has his life turned upside down when he discovers his wife might be having an affair with a used car salesman while terrorists smuggle nuclear war heads into the United States.",7.085,4326,"['Action', 'Thriller']",4.0
454,"Firm, The (1993)",Drama|Thriller,106918,37233.0,"Mitch McDeere is a young man with a promising future in Law. About to sit his Bar exam, he is approached by 'The Firm' and made an offer he doesn't refuse. Seduced by the money and gifts showered on him, he is totally oblivious to the more sinister side of his company. Then, two Associates are murdered. The FBI contact him, asking him for information and suddenly his life is ruined. He has a choice - work with the FBI, or stay with the Firm. Either way he will lose his life as he knows it. Mitch figures the only way out is to follow his own plan...",6.729,2163,"['Drama', 'Mystery', 'Thriller']",5.0
466,Hot Shots! Part Deux (1993),Action|Comedy|War,107144,9255.0,"Topper Harley is found to be working as an odd-job-man in a monastery. The CIA want him to lead a rescue mission into Iraq, to rescue the last rescue team, who went in to rescue the last rescue team—who went in to rescue hostages left behind after Desert Storm.",6.548,1942,"['Action', 'Comedy', 'War']",4.0
480,Jurassic Park (1993),Action|Adventure|Sci-Fi|Thriller,107290,329.0,"A wealthy entrepreneur secretly creates a theme park featuring living dinosaurs drawn from prehistoric DNA. Before opening day, he invites a team of experts and his two eager grandchildren to experience the park and help calm anxious investors. However, the park is anything but amusing as the security systems go off-line and the dinosaurs escape.",7.961,17140,"['Adventure', 'Science Fiction']",2.0
500,Mrs. Doubtfire (1993),Comedy|Drama,107614,788.0,"Loving but irresponsible dad Daniel Hillard, estranged from his exasperated spouse, is crushed by a court order allowing only weekly visits with his kids. When Daniel learns his ex needs a housekeeper, he gets the job -- disguised as a British nanny. Soon he becomes not only his children's best pal but the kind of parent he should have been from the start.",7.195,6357,"['Comedy', 'Drama', 'Family']",4.0
507,"Perfect World, A (1993)",Crime|Drama|Thriller,107808,9559.0,"A kidnapped boy strikes up a friendship with his captor: an escaped convict on the run from the law, headed by an honorable U.S. Marshal.",7.479,1745,"['Drama', 'Crime', 'Thriller']",4.0
508,Philadelphia (1993),Drama,107818,9800.0,Two competing lawyers join forces to sue a prestigious law firm for AIDS discrimination. As their unlikely friendship develops their courage overcomes the prejudice and corruption of their powerful adversaries.,7.718,4425,['Drama'],5.0
543,So I Married an Axe Murderer (1993),Comedy|Romance|Thriller,108174,10442.0,"Just after a bad breakup, Charlie MacKenzie falls for lovely butcher Harriet Michaels and introduces her to his parents. But, as voracious consumers of sensational tabloids, his parents soon come to suspect that Harriet is actually a notorious serial killer -- ""Mrs. X"" -- wanted in connection with a string of bizarre honeymoon killings. Thinking his parents foolish, Charlie proposes to Harriet. But while on his honeymoon with her, he begins to fear they were right.",6.09,446,"['Comedy', 'Crime', 'Romance']",4.5
586,Home Alone (1990),Children|Comedy,99785,771.0,"Eight-year-old Kevin McCallister makes the most of the situation after his family unwittingly leaves him behind when they go on Christmas vacation. When thieves try to break into his home, he puts up a fight like no other.",7.446,11877,"['Comedy', 'Family']",5.0
593,"Silence of the Lambs, The (1991)",Crime|Horror|Thriller,102926,274.0,"Clarice Starling is a top student at the FBI's training academy.  Jack Crawford wants Clarice to interview Dr. Hannibal Lecter, a brilliant psychiatrist who is also a violent psychopath, serving life behind bars for various acts of murder and cannibalism.  Crawford believes that Lecter may have insight into a case and that Starling, as an attractive young woman, may be just the bait to draw him out.",8.347,17133,"['Crime', 'Thriller', 'Drama']",5.0
597,Pretty Woman (1990),Comedy|Romance,100405,114.0,"While on a business trip in Los Angeles, Edward Lewis, a millionaire entrepreneur who makes a living buying and breaking up companies, picks up a prostitute, Vivian, while asking for directions; after, Edward hires Vivian to stay with him for the weekend to accompany him to a few social events, and the two get closer only to discover there are significant hurdles to overcome as they try to bridge the gap between their very different worlds.",7.461,8626,"['Romance', 'Comedy']",4.0
608,Fargo (1996),Comedy|Crime|Drama|Thriller,116282,275.0,"Jerry, a small-town Minnesota car salesman is bursting at the seams with debt... but he's got a plan. He's going to hire two thugs to kidnap his wife in a scheme to collect a hefty ransom from his wealthy father-in-law. It's going to be a snap and nobody's going to get hurt... until people start dying. Enter Police Chief Marge, a coffee-drinking, parka-wearing - and extremely pregnant - investigator who'll stop at nothing to get her man. And if you think her small-time investigative skills will give the crooks a run for their ransom... you betcha!",7.851,8587,"['Crime', 'Drama', 'Thriller']",4.5
628,Primal Fear (1996),Crime|Drama|Mystery|Thriller,117381,1592.0,"An arrogant, high-powered attorney takes on the case of a poor altar boy found running away from the scene of the grisly murder of the bishop who has taken him in. The case gets a lot more complex when the accused reveals that there may or may not have been a third person in the room.",7.654,3638,"['Crime', 'Drama', 'Mystery', 'Thriller']",4.5
647,Courage Under Fire (1996),Action|Crime|Drama|War,115956,10684.0,"A US Army officer, who made a ""friendly fire"" mistake that was covered up, has been reassigned to a desk job. He is tasked to investigate a female chopper commander's worthiness to be awarded the Medal of Honor. At first all seems in order. But then he begins to notice inconsistencies between the testimonies of the witnesses...",6.523,986,"['Drama', 'Thriller', 'Mystery', 'War']",4.0
648,Mission: Impossible (1996),Action|Adventure|Mystery|Thriller,117060,954.0,"When Ethan Hunt, the leader of a crack espionage team whose perilous operation has gone awry with no explanation, discovers that a mole has penetrated the CIA, he's surprised to learn that he's the prime suspect. To clear his name, Hunt now must ferret out the real double agent and, in the process, even the score.",7.011,9548,"['Adventure', 'Action', 'Thriller']",3.5
733,"Rock, The (1996)",Action|Adventure|Thriller,117500,9802.0,"When vengeful General Francis X. Hummel seizes control of Alcatraz Island and threatens to launch missiles loaded with deadly chemical weapons into San Francisco, only a young FBI chemical weapons expert and notorious Federal prisoner have the skills to penetrate the impregnable island fortress and take him down.",7.1,4935,"['Action', 'Adventure', 'Thriller']",5.0
743,Spy Hard (1996),Comedy,117723,10535.0,"The evil Gen. Rancor has his sights set on world domination, and only one man can stop him: Dick Steele, also known as Agent WD-40. Rancor needs to obtain a computer circuit for the missile that he is planning to fire, so Steele teams up with Veronique Ukrinsky, a KGB agent whose father designed the chip. Together they try to locate the evil mastermind's headquarters, where Veronique's father and several other hostages are being held.",5.405,708,"['Comedy', 'Action']",4.0
778,Trainspotting (1996),Comedy|Crime|Drama,117951,627.0,"Heroin addict Mark Renton stumbles through bad ideas and sobriety attempts with his unreliable friends --Sick Boy, Begbie, Spud and Tommy. He also has an underage girlfriend, Diane, along for the ride. After cleaning up and moving from Edinburgh to London, Mark finds he can't escape the life he left behind as Begbie and Sick Boy come knocking.",7.96,10025,"['Drama', 'Crime']",5.0
780,Independence Day (a.k.a. ID4) (1996),Action|Adventure|Sci-Fi|Thriller,116629,602.0,"Strange phenomena surface around the globe. The skies ignite. Terror races through the world's major cities. As these extraordinary events unfold, it becomes increasingly clear that a force of incredible magnitude has arrived. Its mission: total annihilation over the Fourth of July weekend. The last hope to stop the destruction is an unlikely group of people united by fate and unimaginable circumstances.",6.895,9981,"['Action', 'Adventure', 'Science Fiction']",3.5
805,"Time to Kill, A (1996)",Drama|Thriller,117913,1645.0,"A young lawyer defends a black man accused of murdering two white men who raped his 10-year-old daughter, sparking a rebirth of the KKK.",7.382,2700,"['Crime', 'Drama', 'Thriller']",4.0
832,Ransom (1996),Crime|Thriller,117438,3595.0,"When a rich man's son is kidnapped, he cooperates with the police at first but then tries a unique tactic against the criminals.",6.675,1953,"['Action', 'Thriller']",4.5
858,"Godfather, The (1972)",Crime|Drama,68646,238.0,"Spanning the years 1945 to 1955, a chronicle of the fictional Italian-American Corleone crime family. When organized crime family patriarch, Vito Corleone barely survives an attempt on his life, his youngest son, Michael steps in to take care of the would-be killers, launching a campaign of bloody revenge.",8.686,21874,"['Drama', 'Crime']",2.5
1006,"Chamber, The (1996)",Drama,115862,6346.0,"Idealistic young attorney Adam Hall takes on the death row clemency case of his racist grandfather, Sam Cayhall, a former Ku Klux Klan member he has never met.",6.0,260,"['Crime', 'Drama']",3.5
1015,Homeward Bound: The Incredible Journey (1993),Adventure|Children|Drama,107131,6878.0,"Before the Seavers leave for a family vacation to San Francisco, they drop off their pets -- Chance, an adventurous American bulldog; Shadow, a wise golden retriever; and Sassy, a cautious cat -- at a friend's ranch. But when the animals start to worry that they've been left for good, the three embark together on a treacherous and thrilling journey to find their way back home through the California wilderness.",7.0,1073,"['Adventure', 'Comedy', 'Family']",5.0
1027,Robin Hood: Prince of Thieves (1991),Adventure|Drama,102798,8367.0,"Nobleman crusader Robin of Locksley breaks out of a Jerusalem prison with the help of Moorish fellow prisoner Azeem and travels back home to England. But upon arrival he discovers his dead father in the ruins of his family estate, killed by the vicious sheriff of Nottingham, Robin and Azeem join forces with outlaws Little John and Will Scarlett to save the kingdom from the sheriff's villainy.",6.862,3406,"['Action', 'Adventure', 'Drama']",4.5
1036,Die Hard (1988),Action|Crime|Thriller,95016,562.0,"NYPD cop John McClane's plan to reconcile with his estranged wife is thrown for a serious loop when, minutes after he arrives at her offices Christmas Party, the entire building is overtaken by a group of terrorists. With little help from the LAPD, wisecracking McClane sets out to single-handedly rescue the hostages and bring the bad guys down.",7.801,11695,"['Action', 'Thriller']",4.5
1060,Swingers (1996),Comedy|Drama,117802,10218.0,"After 6 years together, Mike's girlfriend leaves him, so he travels to LA to be a star. Six months on, he's still not doing very well— so a few of his friends try to reconnect him to the social scene and hopefully help him forget his failed relationship.",6.868,767,"['Comedy', 'Drama']",4.0
1088,Dirty Dancing (1987),Drama|Musical|Romance,92890,88.0,"Expecting the usual tedium that accompanies a summer in the Catskills with her family, 17-year-old Frances 'Baby' Houseman is surprised to find herself stepping into the shoes of a professional hoofer—and unexpectedly falling in love.",7.329,6327,"['Drama', 'Music', 'Romance']",5.0
1089,Reservoir Dogs (1992),Crime|Mystery|Thriller,105236,500.0,"A botched robbery indicates a police informant, and the pressure mounts in the aftermath at a warehouse. Crime begets violence as the survivors -- veteran Mr. White, newcomer Mr. Orange, psychopathic parolee Mr. Blonde, bickering weasel Mr. Pink and Nice Guy Eddie -- unravel.",8.118,14860,"['Crime', 'Thriller']",5.0
1091,Weekend at Bernie's (1989),Comedy,98627,8491.0,"Two young insurance corporation employees try to pretend that their murdered employer is alive by puppeteering his dead body, leading a hitman to attempt to track him down to finish him off.",6.391,1074,"['Comedy', 'Crime']",4.0
1120,"People vs. Larry Flynt, The (1996)",Comedy|Drama,117318,1630.0,"Larry Flynt is the hedonistically obnoxious, but indomitable, publisher of Hustler magazine. The film recounts his struggle to make an honest living publishing his girlie magazine and how it changes into a battle to protect the freedom of speech for all people.",6.961,1170,['Drama'],4.0
