movieId,title,genres,imdbId,tmdbId,overview,tmdb_vote_average,tmdb_vote_count,tmdb_genres,rating
32031,Robots (2005),Adventure|Animation|Children|Comedy|Fantasy|Sci-Fi|IMAX,358082,9928.0,"Rodney Copperbottom is a young robot inventor who dreams of making the world a better place, until the evil Ratchet takes over Bigweld Industries. Now, Rodney's dreams – and those of his friends – are in danger of becoming obsolete.",6.5,4752,"['Animation', 'Comedy', 'Family', 'Science Fiction']",5.0
32289,Ice Princess (2005),Children|Comedy|Drama,396652,13374.0,"With the help of her coach, her mom, and the boy who drives the Zamboni, nothing can stop Casey Carlyle from realizing her dream to be a champion figure skater.",6.4,917,"['Family', 'Drama', 'Comedy']",5.0
33495,Kicking & Screaming (2005),Comedy,384642,9981.0,"Phil Weston has been unathletic his entire life. In college he failed at every sport that he tried out for. It looks like his 10-year old son, Sam, is following in his footsteps. But when Phil's hyper-competitive dad benches Sam, Phil decides to transfer his son to a new team which needs a coach. Phil steps in to be the temporary coach and immediately begins to butt heads with his dad over this new competition in their lives.",5.81,651,"['Family', 'Comedy']",5.0
33499,Monster-in-Law (2005),Comedy|Romance,369735,4379.0,"Office temp Charlotte Cantilini thinks she's found Mr. Right when she starts dating gorgeous surgeon Dr. Kevin Fields. But there's a problem standing in the way of everlasting bliss: Kevin's overbearing and controlling mother, Viola. Fearing she'll lose her son's affections forever, Viola decides to break up the happy couple by becoming the world's worst mother-in-law.",6.226,1703,"['Romance', 'Comedy']",5.0
33615,Madagascar (2005),Adventure|Animation|Children|Comedy,351283,953.0,Four animal friends get a taste of the wild life when they break out of captivity at the Central Park Zoo and wash ashore on the island of Madagascar.,6.916,11298,"['Family', 'Animation', 'Adventure', 'Comedy']",5.0
33646,"Longest Yard, The (2005)",Comedy|Drama,398165,9291.0,"Disgraced pro football quarterback Paul Crewe lands in a Texas federal penitentiary, where manipulative Warden Hazen recruits him to advise the institution's football team of prison guards. Crewe suggests a tune-up game which lands him quarterbacking a crew of inmates in a game against the guards. Aided by incarcerated ex-NFL coach and player Nate Scarborough, Crewe and his team must overcome not only the bloodthirstiness of the opposition, but also the corrupt warden trying to fix the game against them.",6.667,3529,"['Drama', 'Comedy', 'Crime']",4.5
33815,"Perfect Man, The (2005)",Comedy|Drama|Romance,380623,15648.0,"Holly is tired of moving every time her mom Jean breaks up with yet another second-rate guy. To distract her mother from her latest bad choice, Holly conceives the perfect plan for the perfect man, an imaginary secret admirer who will romance Jean and boost her self-esteem.",6.135,797,"['Comedy', 'Drama', 'Family', 'Romance']",5.0
34129,Rebound (2005),Comedy,376108,7233.0,An acclaimed college hoops coach is demoted to a junior varsity team after a public meltdown.,5.603,339,"['Comedy', 'Family']",5.0
34150,Fantastic Four (2005),Action|Adventure|Sci-Fi,120667,9738.0,"During a space voyage, four scientists are altered by cosmic rays: Reed Richards gains the ability to stretch his body; Sue Storm can become invisible; Johnny Storm controls fire; and Ben Grimm is turned into a super-strong … thing. Together, these ""Fantastic Four"" must now thwart the evil plans of Dr. Doom and save the world from certain destruction.",5.799,9690,"['Action', 'Fantasy', 'Science Fiction']",5.0
34332,Sky High (2005),Action|Adventure|Children|Comedy,405325,11459.0,"Set in a world where superheroes are commonly known and accepted, young Will Stronghold, the son of the Commander and Jetstream, tries to find a balance between being a normal teenager and an extraordinary being.",6.249,2379,"['Adventure', 'Comedy', 'Family']",5.0
36397,Valiant (2005),Adventure|Animation|Children|Comedy|Fantasy|War,361089,14175.0,"Set in 1944, Valiant is a woodland pigeon who wants to become a great hero someday. When he hears they are hiring recruits for the Royal Homing Pigeon Service, he immediately sets out for London. On the way, he meets a smelly but friendly pigeon named Bugsy, who joins him, mainly to get away from clients he cheated in a game of find-the pebble, and helps him sign up for the war.",5.541,926,"['Family', 'Animation', 'Adventure', 'Comedy', 'War']",5.0
36525,Just Like Heaven (2005),Comedy|Fantasy|Romance,425123,9007.0,"Shortly after David Abbott moves into his new San Francisco digs, he has an unwelcome visitor on his hands: winsome Elizabeth Masterson, who asserts that the apartment is hers -- and promptly vanishes. When she starts appearing and disappearing at will, David thinks she's a ghost, while Elizabeth is convinced she's alive.",6.955,2473,"['Drama', 'Comedy', 'Romance', 'Fantasy']",5.0
38038,Wallace & Gromit in The Curse of the Were-Rabbit (2005),Adventure|Animation|Children|Comedy,312004,533.0,"Cheese-loving eccentric Wallace and his cunning canine pal, Gromit, investigate a mystery in Nick Park's animated adventure, in which the lovable inventor and his intrepid pup run a business ridding the town of garden pests. Using only humane methods that turn their home into a halfway house for evicted vermin, the pair stumble upon a mystery involving a voracious vegetarian monster that threatens to ruin the annual veggie-growing contest.",7.113,2939,"['Adventure', 'Animation', 'Comedy', 'Family']",4.5
38388,Goal! The Dream Begins (Goal!) (2005),Drama,380389,9763.0,"Like millions of kids around the world, Santiago harbors the dream of being a professional footballer... However, living in the Barrios section of Los Angeles, he thinks it is only that—a dream. Until one day an extraordinary turn of events has him trying out for Premiership club Newcastle United.",6.763,1163,['Drama'],5.0
40629,Pride & Prejudice (2005),Drama|Romance,414387,4348.0,"A story of love and life among the landed English gentry during the Georgian era. Mr. Bennet is a gentleman living in Hertfordshire with his overbearing wife and five daughters, but if he dies their house will be inherited by a distant cousin whom they have never met, so the family's future happiness and security is dependent on the daughters making good marriages.",8.06,8428,"['Drama', 'Romance']",5.0
40819,Walk the Line (2005),Drama|Musical|Romance,358273,69.0,"A chronicle of country music legend Johnny Cash's life, from his early days on an Arkansas cotton farm to his rise to fame with Sun Records in Memphis, where he recorded alongside Elvis Presley, Jerry Lee Lewis and Carl Perkins.",7.497,2994,"['Drama', 'Music', 'Romance']",5.0
41566,"Chronicles of Narnia: The Lion, the Witch and the Wardrobe, The (2005)",Adventure|Children|Fantasy,363771,411.0,"Siblings Lucy, Edmund, Susan and Peter step through a magical wardrobe and find the land of Narnia. There, they discover a charming, once peaceful kingdom that has been plunged into eternal winter by the evil White Witch, Jadis. Aided by the wise and magnificent lion, Aslan, the children lead Narnia into a spectacular, climactic battle to be free of the Witch's glacial powers forever.",7.133,11084,"['Adventure', 'Family', 'Fantasy']",5.0
42007,Rumor Has It... (2005),Comedy|Drama|Romance,398375,2800.0,"Sarah Huttinger's return home with her fiance convinces her that the sedate, proper, country-club lifestyle of her family isn't for her – and that maybe the Huttinger family isn't even hers – as she uncovers secrets that suggest the Huttingers are neither sedate nor proper.",5.664,1196,"['Comedy', 'Romance']",4.5
42009,Cheaper by the Dozen 2 (2005),Adventure|Comedy,452598,9641.0,"Steve Martin and Bonnie Hunt return as heads of the Baker family who, while on vacation, find themselves in competition with a rival family of eight children.",6.162,2032,"['Comedy', 'Family', 'Adventure']",5.0
43560,Nanny McPhee (2005),Children|Comedy|Fantasy,396752,11283.0,"Widower Cedric Brown hires Nanny McPhee to care for his seven rambunctious children, who have chased away all previous nannies. Taunted by Simon and his siblings, Nanny McPhee uses mystical powers to instill discipline. And when the children's great-aunt and benefactor, Lady Adelaide Stitch, threatens to separate the kids, the family pulls together under the guidance of Nanny McPhee.",6.682,3126,"['Fantasy', 'Comedy', 'Family']",5.0
43930,Just My Luck (2006),Comedy|Romance,397078,10025.0,"Manhattanite Ashley is known to many as the luckiest woman around. After a chance encounter with a down-and-out young man, however, she realizes that she's swapped her fortune for his.",6.165,1959,"['Comedy', 'Drama', 'Family', 'Fantasy', 'Romance']",5.0
44004,Failure to Launch (2006),Comedy|Romance,427229,6877.0,"At 35, Tripp has an interesting job, a hip car, a passion for sailing, an active dating life, and a great house - trouble is, he still lives with his parents, Al and Sue, who are not happy about it. Al and Sue are fascinated when friends whose adult son has recently moved away from home reveal they hired an expert to help. In desperation to push Tripp out of the nest once and for all, Al and Sue hatch a plan to hire Paula, an ""interventionist,"" who has a formula in these cases.",5.8,1709,"['Romance', 'Comedy']",5.0
44022,Ice Age 2: The Meltdown (2006),Adventure|Animation|Children|Comedy,438097,950.0,"Diego, Manny and Sid return in this sequel to the hit animated movie Ice Age. This time around, the deep freeze is over, and the ice-covered earth is starting to melt, which will destroy the trio's cherished valley. The impending disaster prompts them to reunite and warn all the other beasts about the desperate situation.",6.7,10053,"['Animation', 'Family', 'Comedy', 'Adventure']",5.0
44225,Aquamarine (2006),Children|Comedy|Fantasy,429591,14191.0,"Two teenage girls discover that mermaids really do exist after a violent storm washes one ashore. The mermaid, a sassy creature named Aquamarine, is determined to prove to her father that real love exists, and enlists the girls' help in winning the heart of a handsome lifeguard.",6.5,1536,"['Fantasy', 'Romance', 'Family', 'Comedy']",5.0
45074,"Wild, The (2006)",Adventure|Animation|Children|Comedy|Fantasy,405469,9904.0,"An adolescent lion is accidentally shipped from the New York Zoo to Africa. Now running free, his zoo pals must put aside their differences to help bring him back.",5.537,1091,"['Family', 'Animation']",5.0
45431,Over the Hedge (2006),Adventure|Animation|Children|Comedy,327084,7518.0,"A scheming raccoon fools a mismatched family of forest creatures into helping him repay a debt of food, by invading the new suburban sprawl that popped up while they were hibernating – and learns a lesson about family himself.",6.581,4640,"['Family', 'Comedy', 'Animation']",5.0
45672,Click (2006),Adventure|Comedy|Drama|Fantasy|Romance,389860,9339.0,"A married workaholic, Michael Newman doesn't have time for his wife and children, not if he's to impress his ungrateful boss and earn a well-deserved promotion. So when he meets Morty, a loopy sales clerk, he gets the answer to his prayers: a magical remote that allows him to bypass life's little distractions with increasingly hysterical results.",6.301,7267,"['Comedy', 'Drama', 'Fantasy']",5.0
45720,"Devil Wears Prada, The (2006)",Comedy|Drama,458352,350.0,"Andy moves to New York to work in the fashion industry. Her boss is extremely demanding, cruel and won't let her succeed if she doesn't fit into the high class elegant look of their magazine.",7.392,12522,"['Drama', 'Comedy']",5.0
45722,Pirates of the Caribbean: Dead Man's Chest (2006),Action|Adventure|Fantasy,383574,58.0,"Captain Jack Sparrow races to recover the heart of Davy Jones to avoid enslaving his soul to Jones' service, as other friends and foes seek the heart for their own agenda as well.",7.371,16607,"['Adventure', 'Fantasy', 'Action']",5.0
45732,My Super Ex-Girlfriend (2006),Comedy|Fantasy|Romance,465624,4474.0,"When New York architect Matt Saunders dumps his new girlfriend Jenny Johnson—a smart, sexy, and reluctant superhero known as G-Girl—she uses her powers to make his life a living hell.",5.139,1483,"['Comedy', 'Science Fiction', 'Romance']",5.0
46062,High School Musical (2006),Children|Comedy|Drama|Musical|Romance,475293,10947.0,A popular high school athlete and an academically gifted girl get roles in the school musical and develop a friendship that threatens East High's social order.,6.548,4678,"['Comedy', 'Drama', 'Family', 'Music', 'Romance', 'TV Movie']",5.0
46335,"Fast and the Furious: Tokyo Drift, The (Fast and the Furious 3, The) (2006)",Action|Crime|Drama|Thriller,463985,9615.0,"In order to avoid a jail sentence, Sean Boswell heads to Tokyo to live with his military father. In a low-rent section of the city, Shaun gets caught up in the underground world of drift racing",6.531,7262,"['Action', 'Crime', 'Drama', 'Thriller']",5.0
46578,Little Miss Sunshine (2006),Adventure|Comedy|Drama,449059,773.0,"A family loaded with quirky, colorful characters piles into an old van and road trips to California for little Olive to compete in a beauty pageant.",7.692,7479,"['Comedy', 'Drama']",5.0
46948,Monster House (2006),Animation|Children|Fantasy|Mystery,385880,9297.0,"Monsters under the bed are scary enough, but what happens when an entire house is out to get you? Three teens aim to find out when they go up against a decrepit neighboring home and unlock its frightening secrets.",6.689,4151,"['Animation', 'Comedy', 'Family', 'Fantasy']",5.0
46970,Talladega Nights: The Ballad of Ricky Bobby (2006),Action|Comedy,415306,9718.0,"The fastest man on four wheels, Ricky Bobby is one of the greatest drivers in NASCAR history. A big, hairy American winning machine, Ricky has everything a dimwitted daredevil could want, a luxurious mansion, a smokin' hot wife and all the fast food he can eat. But Ricky's turbo-charged lifestyle hits an unexpected speed bump when he's bested by flamboyant Euro-idiot Jean Girard and reduced to a fear-ridden wreck.",6.366,1774,['Comedy'],5.0
46972,Night at the Museum (2006),Action|Comedy|Fantasy|IMAX,477347,1593.0,"Chaos reigns at the natural history museum when night watchman Larry Daley accidentally stirs up an ancient curse, awakening Attila the Hun, an army of gladiators, a Tyrannosaurus rex and other exhibits.",6.593,10576,"['Action', 'Adventure', 'Comedy', 'Family', 'Fantasy']",5.0
47099,"Pursuit of Happyness, The (2006)",Drama,454921,1402.0,A struggling salesman takes custody of his son as he's poised to begin a life-changing professional career.,7.891,10219,['Drama'],5.0
47382,Step Up (2006),Drama|Romance,462590,9762.0,"Tyler Gage receives the opportunity of a lifetime after vandalizing a performing arts school, gaining him the chance to earn a scholarship and dance with an up and coming dancer, Nora.",6.9,3786,"['Music', 'Drama', 'Romance', 'Crime']",5.0
47629,The Queen (2006),Drama,436697,1165.0,"The Queen is an intimate behind the scenes glimpse at the interaction between HM Elizabeth II and Prime Minister Tony Blair during their struggle, following the death of Diana, to reach a compromise between what was a private tragedy for the Royal family and the public's demand for an overt display of mourning.",6.953,1364,"['Drama', 'History']",5.0
48414,Open Season (2006),Adventure|Animation|Children|Comedy|IMAX,400717,7484.0,"Boog, a domesticated 900lb. Grizzly bear finds himself stranded in the woods 3 days before Open Season. Forced to rely on Elliot, a fast-talking mule deer, the two form an unlikely friendship and must quickly rally other forest animals if they are to form a rag-tag army against the hunters.",6.166,2871,"['Animation', 'Family', 'Adventure', 'Comedy']",5.0
48516,"Departed, The (2006)",Crime|Drama|Thriller,407887,1422.0,"To take down South Boston's Irish Mafia, the police send in one of their own to infiltrate the underworld, not realizing the syndicate has done likewise. While an undercover cop curries favor with the mob kingpin, a career criminal rises through the police ranks. But both sides soon discover there's a mole among them.",8.159,15563,"['Drama', 'Thriller', 'Crime']",5.0
48780,"Prestige, The (2006)",Drama|Mystery|Sci-Fi|Thriller,482571,1124.0,"A mysterious story of two magicians whose intense rivalry leads them on a life-long battle for supremacy -- full of obsession, deceit and jealousy with dangerous and deadly consequences.",8.203,16825,"['Drama', 'Mystery', 'Science Fiction']",5.0
48982,Flushed Away (2006),Animation|Comedy,424095,11619.0,"London high-society mouse, Roddy is flushed down the toilet by Sid, a common sewer rat. Hang on for a madcap adventure deep in the sewer bowels of Ratropolis, where Roddy meets the resourceful Rita, the rodent-hating Toad and his faithful thugs, Spike and Whitey.",6.309,3960,"['Adventure', 'Animation', 'Comedy', 'Family']",5.0
49272,Casino Royale (2006),Action|Adventure|Thriller,381061,36557.0,"Le Chiffre, a banker to the world's terrorists, is scheduled to participate in a high-stakes poker game in Montenegro, where he intends to use his winnings to establish his financial grip on the terrorist market. M sends Bond—on his maiden mission as a 00 Agent—to attend this game and prevent Le Chiffre from winning. With the help of Vesper Lynd and Felix Leiter, Bond enters the most important poker game in his already dangerous career.",7.6,11167,"['Adventure', 'Action', 'Thriller']",5.0
49286,"Holiday, The (2006)",Comedy|Romance,457939,1581.0,"Two women, one American and one British, swap homes at Christmastime following bad breakups. Each woman finds romance with a local man but realizes that the imminent return home may end the relationship.",7.091,5350,"['Comedy', 'Romance']",5.0
49647,Charlotte's Web (2006),Children|Comedy|Drama|Fantasy,413895,9986.0,"Wilbur the pig is scared of the end of the season, because he knows that come that time, he will end up on the dinner table. He hatches a plan with Charlotte, a spider that lives in his pen, to ensure that this will never happen.",6.2,1414,"['Comedy', 'Family', 'Fantasy']",5.0
49649,Eragon (2006),Action|Adventure|Fantasy,449010,2486.0,"In his homeland of Alagaesia, a farm boy happens upon a dragon's egg -- a discovery that leads him on a predestined journey where he realized he's the one person who can defend his home against an evil king.",5.123,3348,"['Fantasy', 'Action', 'Adventure', 'Family']",5.0
49824,Dreamgirls (2006),Drama|Musical,443489,1125.0,"A trio of female soul singers cross over to the pop charts in the early 1960s, facing their own personal struggles along the way.",6.721,1045,"['Drama', 'Music']",5.0
50872,Ratatouille (2007),Animation|Children|Drama,382932,2062.0,"Remy, a resident of Paris, appreciates good food and has quite a sophisticated palate. He would love to become a chef so he can create and enjoy culinary masterpieces to his heart's delight. The only problem is, Remy is a rat. When he winds up in the sewer beneath one of Paris' finest restaurants, the rodent gourmet finds himself ideally placed to realize his dream.",7.832,17814,"['Animation', 'Comedy', 'Family', 'Fantasy']",5.0
51077,Ghost Rider (2007),Action|Fantasy|Thriller,259324,1250.0,"In order to save his dying father, young stunt cyclist Johnny Blaze sells his soul to Mephistopheles and sadly parts from the pure-hearted Roxanne Simpson, the love of his life. Years later, Johnny's path crosses again with Roxanne, now a go-getting reporter, and also with Mephistopheles, who offers to release Johnny's soul if Johnny becomes the fabled, fiery 'Ghost Rider'.",5.58,6191,"['Thriller', 'Action', 'Fantasy']",5.0
51084,Music and Lyrics (2007),Comedy|Romance,758766,11172.0,"A washed-up '80s pop star gets a chance at a comeback when reigning pop diva Cora Corman invites him to write & record a duet with her, but there's a problem--Alex hasn't written a song in years; he's never written lyrics and he has to come up with a hit in a matter of days.",6.4,1726,"['Comedy', 'Music', 'Romance']",5.0
51255,Hot Fuzz (2007),Action|Comedy|Crime|Mystery,425112,4638.0,"Former London constable Nicholas Angel finds it difficult to adapt to his new assignment in the sleepy British village of Sandford. Not only does he miss the excitement of the big city, but he also has a well-meaning oaf for a partner. However, when a series of grisly accidents rocks Sandford, Angel smells something rotten in the idyllic village.",7.562,7935,"['Crime', 'Action', 'Comedy']",5.0
52287,Meet the Robinsons (2007),Action|Adventure|Animation|Children|Comedy|Sci-Fi,396555,1267.0,"Lewis, a brilliant young inventor, is keen on creating a time machine to find his mother, who abandoned him in an orphanage. Things take a turn when he meets Wilbur Robinson and his family.",6.927,3004,"['Animation', 'Comedy', 'Family']",5.0
52722,Spider-Man 3 (2007),Action|Adventure|Sci-Fi|Thriller|IMAX,413300,559.0,"The seemingly invincible Spider-Man goes up against an all-new crop of villains—including the shape-shifting Sandman. While Spider-Man’s superpowers are altered by an alien organism, his alter ego, Peter Parker, deals with nemesis Eddie Brock and also gets caught up in a love triangle.",6.446,14695,"['Action', 'Adventure', 'Science Fiction']",5.0
52975,Hairspray (2007),Comedy|Drama|Musical,427327,2976.0,"Pleasantly plump teenager Tracy Turnblad auditions to be on Baltimore's most popular dance show - The Corny Collins Show - and lands a prime spot. Through her newfound fame, she becomes determined to help her friends and end the racial segregation that has been a staple of the show.",6.666,2547,"['Comedy', 'Romance', 'Drama']",5.0
53121,Shrek the Third (2007),Adventure|Animation|Children|Comedy|Fantasy,413267,810.0,"The King of Far Far Away has died and Shrek and Fiona are to become King & Queen. However, Shrek wants to return to his cozy swamp and live in peace and quiet, so when he finds out there is another heir to the throne, they set off to bring him back to rule the kingdom.",6.298,9412,"['Fantasy', 'Adventure', 'Animation', 'Comedy', 'Family']",5.0
53123,Once (2006),Drama|Musical|Romance,907657,5723.0,"A vacuum repairman moonlights as a street musician and hopes for his big break. One day a Czech immigrant, who earns a living selling flowers, approaches him with the news that she is also an aspiring singer-songwriter. The pair decide to collaborate, and the songs that they compose reflect the story of their blossoming love.",7.401,1383,"['Drama', 'Music', 'Romance']",5.0
53993,Evan Almighty (2007),Comedy|Fantasy,413099,2698.0,God contacts Junior Congressman Evan Baxter and tells him to build an ark in preparation for a great flood.,5.585,4419,"['Fantasy', 'Comedy', 'Family']",5.0
53996,Transformers (2007),Action|Sci-Fi|Thriller|IMAX,418279,1858.0,Young teenager Sam Witwicky becomes involved in the ancient struggle between two extraterrestrial factions of transforming robots – the heroic Autobots and the evil Decepticons. Sam holds the clue to unimaginable power and the Decepticons will stop at nothing to retrieve it.,6.817,11754,"['Adventure', 'Science Fiction', 'Action']",5.0
54259,Stardust (2007),Adventure|Comedy|Fantasy|Romance,486655,2270.0,"In a countryside town bordering on a magical land, a young man makes a promise to his beloved that he'll retrieve a fallen star by venturing into the magical realm. His journey takes him into a world beyond his wildest dreams and reveals his true identity.",7.284,4232,"['Adventure', 'Fantasy', 'Romance', 'Family']",5.0
54272,"Simpsons Movie, The (2007)",Animation|Comedy,462538,35.0,"After Homer accidentally pollutes the town's water supply, Springfield is encased in a gigantic dome by the EPA and the Simpsons are declared fugitives.",7.016,8284,"['Animation', 'Comedy', 'Family']",5.0
54278,Underdog (2007),Action|Adventure|Children|Comedy|Fantasy|Sci-Fi,467110,6589.0,A lab accident gives a beagle named Shoeshine some serious superpowers -- a secret that the dog eventually shares with the young boy who becomes his owner and friend.,5.6,733,"['Family', 'Action', 'Adventure', 'Comedy', 'Fantasy', 'Science Fiction']",5.0
54290,Bratz: The Movie (2007),Comedy,804452,14123.0,"The popular Bratz dolls come to life in their first live-action feature film. Finding themselves being pulled further and further apart, the fashionable four band together to fight peer pressure, learn what it means to stand up for your friends, be true to oneself and live out your dreams.",5.762,451,"['Comedy', 'Music', 'Family']",5.0
54648,Rush Hour 3 (2007),Action|Comedy|Crime|Thriller,293564,5174.0,"After a botched assassination attempt, the mismatched duo finds themselves in Paris, struggling to retrieve a precious list of names, as the murderous crime syndicate's henchmen try their best to stop them. Once more, Lee and Carter must fight their way through dangerous gangsters; however, this time, the past has come back to haunt Lee. Will the boys get the job done once and for all?",6.485,3498,"['Action', 'Comedy', 'Crime']",5.0
54732,Balls of Fury (2007),Comedy,424823,9750.0,Randy Daytona was a child ping pong prodigy who lost his chance at Olympic gold when his father is murdered by the mysterious Feng over a gambling debt. 15yrs later he's down on his luck and scraping a living doing seedy back room shows in Vegas; when the FBI turn up and ask for his help to take down Feng... who just happens to love Ping Pong.,5.3,562,"['Comedy', 'Crime']",5.0
