movieId,title,genres,imdbId,tmdbId,overview,tmdb_vote_average,tmdb_vote_count,tmdb_genres,rating
4034,Traffic (2000),Crime|Drama|Thriller,181865,1900.0,"An exploration of the United States of America's war on drugs from multiple perspectives. For the new head of the Office of National Drug Control Policy, the war becomes personal when he discovers his well-educated daughter is abusing cocaine within their comfortable suburban home. In Mexico, a flawed, but noble policeman agrees to testify against a powerful general in league with a cartel, and in San Diego, a drug kingpin's sheltered trophy wife must learn her husband's ruthless business after he is arrested, endangering her luxurious lifestyle.",7.081,2266,"['Thriller', 'Drama', 'Crime']",3.5
4061,The Man in the Moon (1991),Drama|Romance,102388,17474.0,"Maureen Trant and her younger sibling Dani share a strong connection, but local boy Court Foster threatens to throw their bond off balance. Dani and Court meet first and have a flirtatious rapport -- but when he meets Maureen, he falls hard and they begin a passionate affair. The new couple try to keep their love hidden from Dani, but she soon learns the truth, disavowing her sister. But a heartbreaking accident later reunites the girls.",7.362,332,"['Drama', 'Family', 'Romance']",1.5
4132,Mannequin (1987),Comedy|Romance,93493,10019.0,"Jonathan Switcher, an unemployed artist, finds a job as an assistant window dresser for a department store. When Jonathan happens upon a beautiful mannequin he previously designed, she springs to life and introduces herself as Emmy, an Egyptian under an ancient spell. Despite interference from the store's devious manager, Jonathan and his mannequin fall in love while creating eye-catching window displays to keep the struggling store in business.",6.864,787,"['Comedy', 'Romance', 'Fantasy']",2.0
4214,Revenge of the Nerds (1984),Comedy,88000,14052.0,"At Adams College, the jocks rule the school from their house on high, the Alpha Beta fraternity. So when a group of socially-challenged misfits try to go Greek, they're instantly rejected by every house on campus. Deciding to start their own fraternity to protect their outcast brothers, the campus nerds soon find themselves in a battle royale as the Alpha Betas try to crush their new rivals.",6.5,765,['Comedy'],4.0
4226,Memento (2000),Mystery|Thriller,209144,77.0,"Leonard Shelby is tracking down the man who raped and murdered his wife. The difficulty of locating his wife's killer, however, is compounded by the fact that he suffers from a rare, untreatable form of short-term memory loss. Although he can recall details of life before his accident, Leonard cannot remember what happened fifteen minutes ago, where he's going, or why.",8.178,15567,"['Mystery', 'Thriller']",4.5
4235,Amores Perros (Love's a Bitch) (2000),Drama|Thriller,245712,55.0,"A fatalistic car crash in Mexico city sets off a chain of events in the lives of three people: a supermodel, a young man wanting to run off with his sister-in-law, and a homeless man. Their lives are catapulted into unforeseen situations instigated by the seemingly inconsequential destiny of a dog.",7.6,2750,"['Drama', 'Thriller']",5.0
4262,Scarface (1983),Action|Crime|Drama,86250,111.0,"After getting a green card in exchange for assassinating a Cuban government official, Tony Montana stakes a claim on the drug trade in Miami. Viciously murdering anyone who stands in his way, Tony eventually becomes the biggest drug lord in the state, controlling nearly all the cocaine that comes through Miami. But increased pressure from the police, wars with Colombian drug cartels and his own drug-fueled paranoia serve to fuel the flames of his eventual downfall.",8.16,12469,"['Action', 'Crime', 'Drama']",1.0
4306,Shrek (2001),Adventure|Animation|Children|Comedy|Fantasy|Romance,126029,808.0,"It ain't easy bein' green -- especially if you're a likable (albeit smelly) ogre named Shrek. On a mission to retrieve a gorgeous princess from the clutches of a fire-breathing dragon, Shrek teams up with an unlikely compatriot -- a wisecracking donkey.",7.752,17987,"['Animation', 'Comedy', 'Fantasy', 'Adventure', 'Family']",1.5
4310,Pearl Harbor (2001),Action|Drama|Romance|War,213149,676.0,"The lifelong friendship between Rafe McCawley and Danny Walker is put to the ultimate test when the two ace fighter pilots become entangled in a love triangle with beautiful Naval nurse Evelyn Johnson. But the rivalry between the friends-turned-foes is immediately put on hold when they find themselves at the center of Japan's devastating attack on Pearl Harbor on Dec. 7, 1941.",6.941,6751,"['War', 'Romance', 'History', 'Action']",1.0
4322,Eight Men Out (1988),Drama,95082,13554.0,"Buck Weaver and Hap Felsch are young idealistic players on the Chicago White Sox, a pennant-winning team owned by Charles Comiskey -  a penny-pinching, hands-on manager who underpays his players and treats them with disdain. And when gamblers and hustlers discover that Comiskey's demoralized players are ripe for a money-making scheme, one by one the team members agree to throw the World Series. But when the White Sox are defeated, a couple of sports writers smell a fix and a national scandal explodes, ripping the cover off America's favorite pastime.",6.906,254,"['Drama', 'History']",3.0
4326,Mississippi Burning (1988),Crime|Drama|Thriller,95647,1632.0,"Two FBI agents investigating the murder of civil rights workers during the 60s seek to breach the conspiracy of silence in a small Southern town where segregation divides black and white. The younger agent trained in FBI school runs up against the small town ways of his partner, a former sheriff.",7.679,1818,"['Drama', 'Crime', 'Mystery', 'Thriller']",3.5
4464,"Accidental Tourist, The (1988)",Comedy|Drama|Romance,94606,31052.0,"After the death of his son, travel writer Macon Leary seems to be sleep walking through life. Macon's wife is having similar problems. They separate, and Macon meets a strange, outgoing woman who brings him 'back down to earth', but his wife soon thinks their marriage is still worth another try.",6.242,238,"['Comedy', 'Drama', 'Romance']",3.5
4465,"Accused, The (1988)",Drama,94608,10868.0,"Out drinking one night after a fight with her boyfriend, three men brutally rape Sarah Tobias in a bar while people watch and cheer. District Attorney Kathryn Murphy takes the case; however, she allows the rapists to receive a mild sentence. A distraught Sarah decides to seek punishment for the men who witnessed and encouraged the rape. To get justice, Sarah must take the stand and revisit the night of her attack.",7.068,643,"['Crime', 'Drama']",2.5
4489,Coming to America (1988),Comedy|Romance,94898,9602.0,"An African prince decides it’s time for him to find a princess... and his mission leads him and his most loyal friend to Queens, New York. In disguise as an impoverished immigrant, the pampered prince quickly finds himself a new job, new friends, new digs, new enemies and lots of trouble.",6.878,4547,"['Comedy', 'Romance']",2.0
4499,Dirty Rotten Scoundrels (1988),Comedy,95031,10141.0,"Con artist Lawrence Jamieson is a longtime resident of a luxurious coastal resort, where he enjoys the lavish fruits of his deceptions -- that is, until a competitor, Freddy Benson, shows up. When the new guy's lowbrow tactics impinge on his own sophisticated work and believing him to be the infamous conman 'The Jackal', Lawrence resolves to get rid of him. Confident of his own duplicitous talents, he challenges Freddy to a winner-takes-all competition: whoever swindles their latest mark, American heiress Janet Colgate, out of $50,000 first can stay, while the other must leave town.",7.092,936,"['Comedy', 'Crime']",3.0
4558,Twins (1988),Comedy,96320,9493.0,Julius and Vincent Benedict are the results of an experiment that would allow for the perfect child. Julius was planned and grows to athletic proportions. Vincent is an accident and is somewhat smaller in stature. Vincent is placed in an orphanage while Julius is taken to a south seas island and raised by philosophers. Vincent becomes the ultimate low life and is about to be killed by loan sharks.,6.0,2372,['Comedy'],1.0
4586,"Dry White Season, A (1989)",Drama|Thriller,97243,32075.0,"During the 1976 Soweto uprising, a white school teacher's life and values are threatened when he asks questions about the death of a young black boy who died in police custody.",6.665,109,"['Drama', 'Mystery']",4.0
4621,Look Who's Talking (1989),Comedy|Romance,97778,9494.0,"Mollie is a single working mother who's out to find the perfect father for her child. Her baby, Mikey, prefers James, a cab driver turned babysitter who has what it takes to make them both happy. But Mollie won't even consider James. It's going to take all the tricks a baby can think of to bring them together before it's too late.",6.28,2355,"['Comedy', 'Romance']",1.0
4641,Ghost World (2001),Comedy|Drama,162346,1548.0,"Two quirky, cynical teenaged girls try to figure out what to do with their lives after high school graduation. After they play a prank on an eccentric, middle aged record collector, one of them befriends him, which causes a rift in the girls’ friendship.",7.078,1495,"['Comedy', 'Drama']",5.0
4686,Weekend at Bernie's II (1993),Adventure|Comedy,108539,8494.0,"Everybody's favorite stiff is back! Working fools Larry Wilson and Richard Parker have uncovered a dirty, little secret: Their former boss, Bernie Lomax, embezzled $2 million and placed it in a safe deposit box in the Caribbean. Now, the boys are ready to go after the loot, but they can't do it alone -- they need poor Bernie's help. Can the buddies give their ex-boss new life?",5.0,311,"['Comedy', 'Crime', 'Adventure']",0.5
4776,Training Day (2001),Crime|Drama|Thriller,139654,2034.0,"On his first day on the job as a narcotics officer, a rookie cop works with a rogue detective who isn't what he appears.",7.507,6254,"['Action', 'Crime', 'Drama']",2.5
4779,Go Tigers! (2001),Documentary,270971,101860.0,"""Go Tigers!"" is a rare behind-the-scenes chronicling of a remarkable season for the Massillon Tigers high school football team, played out in a small rustbelt town that draws its identity from football. During the course of the season, THREE YOUNG STARS emerge who are forced to carry the burden of the town and their teammates as they confront their uncertain future.",5.6,5,['Documentary'],2.5
4816,Zoolander (2001),Comedy,196229,9398.0,"Clear the runway for Derek Zoolander, VH1's three-time male model of the year. His face falls when hippie-chic Hansel scooters in to steal this year's award. The evil fashion guru Mugatu seizes the opportunity to turn Derek into a killing machine. It's a well-designed conspiracy and only with the help of Hansel and a few well-chosen accessories like Matilda can Derek make the world safe for male models everywhere.",6.207,4666,['Comedy'],2.5
4848,Mulholland Drive (2001),Crime|Drama|Film-Noir|Mystery|Thriller,166924,1018.0,"Blonde Betty Elms has only just arrived in Hollywood to become a movie star when she meets an enigmatic brunette with amnesia. Meanwhile, as the two set off to solve the second woman's identity, filmmaker Adam Kesher runs into ominous trouble while casting his latest project.",7.806,6666,"['Thriller', 'Drama', 'Mystery']",3.5
4878,Donnie Darko (2001),Drama|Mystery|Sci-Fi|Thriller,246578,141.0,"After narrowly escaping a bizarre accident, a troubled teenager is plagued by visions of a large bunny rabbit that manipulates him to commit a series of crimes.",7.766,12922,"['Fantasy', 'Drama', 'Mystery']",1.0
4903,In the Bedroom (2001),Drama,247425,1999.0,"Summertime on the coast of Maine, ""In the Bedroom"" centers on the inner dynamics of a family in transition. Matt Fowler is a doctor practicing in his native Maine and is married to New York born Ruth Fowler, a music teacher. His son is involved in a love affair with a local single mother. As the beauty of Maine's brief and fleeting summer comes to an end, these characters find themselves in the midst of unimaginable tragedy.",6.9,380,"['Drama', 'Thriller']",3.5
4951,Lord of the Flies (1990),Adventure|Drama|Thriller,100054,10847.0,"When their plane crashes, 25 schoolboys find themselves trapped on a tropical island, miles from civilization.",6.358,586,"['Adventure', 'Drama', 'Thriller']",2.0
4973,"Amelie (Fabuleux destin d'Amélie Poulain, Le) (2001)",Comedy|Romance,211915,194.0,"At a tiny Parisian café, the adorable yet painfully shy Amélie accidentally discovers a gift for helping others. Soon Amelie is spending her days as a matchmaker, guardian angel, and all-around do-gooder. But when she bumps into a handsome stranger, will she find the courage to become the star of her very own love story?",7.913,11946,"['Comedy', 'Romance']",4.0
4979,"Royal Tenenbaums, The (2001)",Comedy|Drama,265666,9428.0,"Royal Tenenbaum and his wife Etheline had three children and then they separated. All three children are extraordinary --- all geniuses. Virtually all memory of the brilliance of the young Tenenbaums was subsequently erased by two decades of betrayal, failure, and disaster. Most of this was generally considered to be their father's fault. ""The Royal Tenenbaums"" is the story of the family's sudden, unexpected reunion one recent winter.",7.466,4756,"['Comedy', 'Drama']",5.0
4995,"Beautiful Mind, A (2001)",Drama|Romance,268978,453.0,"From the heights of notoriety to the depths of depravity, John Forbes Nash Jr. experiences it all. As a brilliant but socially awkward mathematician, he made a groundbreaking discovery early in his career and stands on the brink of international acclaim. But as the handsome and arrogant Nash accepts secret work in cryptography, he becomes entangled in a mysterious conspiracy. His life takes a nightmarish turn and he soon finds himself on a painful and harrowing journey of self-discovery.",7.856,10639,"['Drama', 'Romance']",2.0
5004,"Party, The (1968)",Comedy,63415,10794.0,"Hrundi V. Bakshi, an accident-prone actor from India, is accidentally put on the guest list for an upcoming party at the home of a Hollywood film producer. Unfortunately, from the moment he arrives, one thing after another goes wrong with compounding effect.",7.3,804,['Comedy'],3.5
5013,Gosford Park (2001),Comedy|Drama|Mystery,280707,5279.0,"In 1930s England, a group of pretentious rich and famous gather together for a weekend of relaxation at a hunting resort. But when a murder occurs, each one of these interesting characters becomes a suspect.",6.8,1161,"['Drama', 'Mystery', 'Thriller']",4.5
5014,I Am Sam (2001),Drama,277027,10950.0,"Sam, a neurodivergent man, has a daughter with a homeless woman who abandons them when they leave the hospital, leaving Sam to raise Lucy on his own. But as Lucy grows up, Sam's limitations as a parent start to become a problem and the authorities take her away. Sam convinces high-priced lawyer Rita to take his case pro bono and in turn teaches her the value of love and family.",7.559,2371,['Drama'],1.5
5018,Motorama (1991),Adventure|Comedy|Crime|Drama|Fantasy|Mystery|Sci-Fi|Thriller,104922,49410.0,"A ten year old boy gets tired of life with abusive parents and cashes in his piggy bank and steals a Mustang. He rides off into a surreal America playing ""Motorama,"" a game sponsored by Chimera Gas Company. He has various encounters with different people, and eventually reaches the Chimera Gas Company where he finds they are not playing by the rules of the game.",6.5,58,"['Comedy', 'Adventure']",3.5
5060,M*A*S*H (a.k.a. MASH) (1970),Comedy|Drama|War,66026,651.0,The staff of a Korean War field hospital use humor and hijinks to keep their sanity in the face of the horror of war.,7.0,1090,"['Comedy', 'Drama', 'War']",4.0
5225,And Your Mother Too (Y tu mamá también) (2001),Drama|Romance,245574,1391.0,"In Mexico, two teenage boys and an attractive older woman embark on a road trip and learn a thing or two about life, friendship, sex, and each other.",7.417,1638,"['Drama', 'Romance']",2.0
5258,George Washington (2000),Drama,262432,18292.0,"Set in the landscape of a rural southern town, ""George Washington"" is a stunning portrait of how a group of young kids come to grips with a hard world of choices and consequences. During an innocent game in an abandoned amusement park, a member of the group dies. Narrated by one of the children, the film follows the kids as they struggle to balance their own ambitions and relationships against a tragic lie.",6.7,118,['Drama'],4.5
5341,Lenny (1974),Drama,71746,27094.0,"The story of acerbic 1960s comic Lenny Bruce, whose groundbreaking, no-holds-barred style and social commentary was often deemed by the establishment as too obscene for the public.",7.298,282,['Drama'],3.5
5377,About a Boy (2002),Comedy|Drama|Romance,276751,245.0,"Will Freeman is a good-looking, smooth-talking bachelor whose primary goal in life is avoiding any kind of responsibility. But when he invents an imaginary son in order to meet attractive single moms, Will gets a hilarious lesson about life from a bright, but hopelessly geeky 12-year-old named Marcus. Now, as Will struggles to teach Marcus the art of being cool, Marcus teaches Will that you're never too old to grow up.",6.7,2290,"['Drama', 'Comedy', 'Romance']",5.0
5379,"Believer, The (2001)",Drama,247199,4012.0,"A hardcore US racist skinhead who, because of his intelligence, leads a gang dedicated to fighting the enemy: the supposed American-Jewish conspiracy for domination. However, he's hiding a secret: he's Jewish-born, a brilliant scholar whose questioning of the tenets of his faith has left him angry and confused, turning against those who he thinks have a tragic history of their own making.",6.877,636,['Drama'],2.5
5391,Thirteen Conversations About One Thing (a.k.a. 13 Conversations) (2001),Drama,268690,17734.0,"In New York City, the lives of a lawyer, an actuary, a house-cleaner, a professor, and the people around them intersect as they ponder order and happiness in the face of life's cold unpredictability.",6.3,98,['Drama'],3.5
5418,"Bourne Identity, The (2002)",Action|Mystery|Thriller,258463,2501.0,"Wounded to the brink of death and suffering from amnesia, Jason Bourne is rescued at sea by a fisherman. With nothing to go on but a Swiss bank account number, he starts to reconstruct his life, but finds that many people he encounters want him dead. However, Bourne realizes that he has the combat and mental skills of a world-class spy—but who does he work for?",7.469,9662,"['Action', 'Drama', 'Mystery', 'Thriller']",3.5
5446,Rabbit-Proof Fence (2002),Adventure|Drama,252444,9555.0,"In 1931, three Aboriginal girls escape after being plucked from their homes to be trained as domestic staff, and set off on a trek across the Outback.",7.0,371,"['Adventure', 'Drama', 'History']",4.0
5464,Road to Perdition (2002),Crime|Drama,257044,4147.0,"Mike Sullivan works as a hit man for crime boss John Rooney. Sullivan views Rooney as a father figure, however after his son is witness to a killing, Mike Sullivan finds himself on the run in attempt to save the life of his son and at the same time looking for revenge on those who wronged him.",7.4,3805,"['Crime', 'Drama', 'Thriller']",4.5
5502,Signs (2002),Horror|Sci-Fi|Thriller,286106,2675.0,A family living on a farm finds mysterious crop circles in their fields which suggests something more frightening to come.,6.701,5917,"['Drama', 'Thriller', 'Science Fiction', 'Mystery']",2.0
5508,24 Hour Party People (2002),Comedy|Drama|Musical,274309,2750.0,"Manchester, 1976. Tony Wilson is an ambitious but frustrated local TV news reporter looking for a way to make his mark. After witnessing a life-changing concert by a band known as the Sex Pistols, he persuades his station to televise one of their performances, and soon Manchester's punk groups are clamoring for him to manage them. Riding the wave of a musical revolution, Wilson and his friends create the legendary Factory Records label and The Hacienda club.",6.946,480,"['Comedy', 'Drama', 'Music']",5.0
5617,Secretary (2002),Comedy|Drama|Romance,274812,11013.0,"A young woman, recently released from a mental hospital, gets a job as a secretary to a demanding lawyer, where their employer-employee relationship turns into a sexual, sadomasochistic one.",6.8,1750,"['Romance', 'Drama', 'Comedy']",5.0
5669,Bowling for Columbine (2002),Documentary,310793,1430.0,"This is not a film about gun control. It is a film about the fearful heart and soul of the United States, and the 280 million Americans lucky enough to have the right to a constitutionally protected Uzi. From a look at the Columbine High School security camera tapes to the home of Oscar-winning NRA President Charlton Heston, from a young man who makes homemade napalm with The Anarchist's Cookbook to the murder of a six-year-old girl by another six-year-old. Bowling for Columbine is a journey through the US, through our past, hoping to discover why our pursuit of happiness is so riddled with violence.",7.519,1616,"['Documentary', 'Drama', 'Crime']",4.5
5670,Comedian (2002),Comedy|Documentary,328962,19973.0,"A look at the work of two stand-up comics, Jerry Seinfeld and a lesser-known newcomer, detailing the effort and frustration behind putting together a successful act and career while living a life on the road.",6.6,85,"['Comedy', 'Documentary']",2.5
5772,My Dinner with André (1981),Drama,82783,25468.0,"Wally, a struggling playwright and actor, reluctantly agrees to catch up with his old friend Andre, a theater director who disappeared several years prior in order to travel the world. Meeting at a posh Manhattan restaurant, the two share life stories, anecdotes and philosophical musings over the course of an evening meal.",7.491,424,['Drama'],2.0
5782,"Professional, The (Le professionnel) (1981)",Action|Drama|Thriller,82949,1672.0,"French secret service agent Josselin Beaumont is dispatched to take down African warlord N'Jala. But when his assignment is canceled, he's shocked to learn that his government is surrendering him to local authorities. He is given a mock trial and sentenced to 20 years of hard labor. But Beaumont escapes from prison and vows not only to avenge himself against his betrayers but also to finish his original assignment.",7.222,556,"['Action', 'Adventure', 'Thriller']",1.5
5791,Frida (2002),Drama|Romance,120679,1360.0,"A biography of artist Frida Kahlo, who channeled the pain of a crippling injury and her tempestuous marriage into her work.",7.405,2087,"['Drama', 'Romance']",4.0
5792,Roger Dodger (2002),Comedy|Drama,299117,13441.0,"A smooth-talking ad executive attributes his remarkable success with women to his ability to manipulate their emotions from the moment he first meets them. When his teenage nephew drops in for a visit, he soon learns that his approach isn't as foolproof as he thought when he attempts to teach the boy how to pick up women.",6.1,196,"['Comedy', 'Drama']",2.0
5878,Talk to Her (Hable con Ella) (2002),Drama|Romance,287467,64.0,Two men share an odd friendship while they care for two women who are both in deep comas.,7.6,1365,"['Drama', 'Romance']",3.5
5902,Adaptation (2002),Comedy|Drama|Romance,268126,2757.0,"Charlie Kaufman is a confused L.A. screenwriter overwhelmed by feelings of inadequacy, sexual frustration, self-loathing, and by the screenwriting ambitions of his freeloading twin brother Donald. While struggling to adapt ""The Orchid Thief,"" by Susan Orlean, Kaufman's life spins from pathetic to bizarre. The lives of Kaufman, Orlean's book, become strangely intertwined as each one's search for passion collides with the others'.",7.354,2619,"['Comedy', 'Crime', 'Drama']",5.0
5956,Gangs of New York (2002),Crime|Drama,217505,3131.0,"In early 1860s New York, Irish immigrant Amsterdam Vallon is released from prison and returns to the Five Points, seeking revenge against his father's killer, William Cutting, a powerful anti-immigrant gang leader. He knows that revenge can only be attained by infiltrating Cutting's inner circle. Vallon's journey becomes a fight for personal survival and to find a place for the Irish people.",7.316,6879,"['Drama', 'History', 'Crime']",2.0
5971,My Neighbor Totoro (Tonari no Totoro) (1988),Animation|Children|Drama|Fantasy,96283,8392.0,"Two sisters move to the country with their father in order to be closer to their hospitalized mother, and discover the surrounding trees are inhabited by Totoros, magical spirits of the forest. When the youngest runs away from home, the older sister seeks help from the spirits to find her.",8.069,8409,"['Fantasy', 'Animation', 'Family']",3.5
5991,Chicago (2002),Comedy|Crime|Drama|Musical,299658,1574.0,Murderesses Velma Kelly and Roxie Hart find themselves on death row together and fight for the fame that will keep them from the gallows in 1920s Chicago.,7.121,2754,"['Comedy', 'Crime', 'Drama']",1.0
5995,"Pianist, The (2002)",Drama|War,253474,423.0,"The true story of pianist Władysław Szpilman's experiences in Warsaw during the Nazi occupation. When the Jews of the city find themselves forced into a ghetto, Szpilman finds work playing in a café; and when his family is deported in 1942, he stays behind, works for a while as a laborer, and eventually goes into hiding in the ruins of the war-torn city.",8.381,9695,"['Drama', 'War']",3.0
6016,City of God (Cidade de Deus) (2002),Action|Adventure|Crime|Drama|Thriller,317248,598.0,"In the poverty-stricken favelas of Rio de Janeiro in the 1970s, two young men choose different paths. Rocket is a budding photographer who documents the increasing drug-related violence of his neighborhood, while José “Zé” Pequeno is an ambitious drug dealer diving into a dangerous life of crime.",8.429,7807,"['Drama', 'Crime']",5.0
