movieId,title,genres,imdbId,tmdbId,overview,tmdb_vote_average,tmdb_vote_count,tmdb_genres,rating
1,Toy Story (1995),Adventure|Animation|Children|Comedy|Fantasy,114709,862.0,"Led by Woody, Andy's toys live happily in his room until Andy's birthday brings Buzz Lightyear onto the scene. Afraid of losing his place in Andy's heart, Woody plots against Buzz. But when circumstances separate Buzz and Woody from their owner, the duo eventually learns to put aside their differences.",7.969,19165,"['Animation', 'Adventure', 'Family', 'Comedy']",4.0
3,Grumpier Old Men (1995),Comedy|Romance,113228,15602.0,"A family wedding reignites the ancient feud between next-door neighbors and fishing buddies John and Max. Meanwhile, a sultry Italian divorcée opens a restaurant at the local bait shop, alarming the locals who worry she'll scare the fish away. But she's less interested in seafood than she is in cooking up a hot time with Max.",6.474,407,"['Romance', 'Comedy']",4.0
4,Waiting to Exhale (1995),Comedy|Drama|Romance,114885,31357.0,"Cheated on, mistreated and stepped on, the women are holding their breath, waiting for the elusive ""good man"" to break a string of less-than-stellar lovers. Friends and confidants Vannah, Bernie, Glo and Robin talk it all out, determined to find a better way to breathe.",6.3,175,"['Comedy', 'Drama', 'Romance']",3.0
7,Sabrina (1995),Comedy|Romance,114319,11860.0,"Sabrina Fairchild, a chauffeur's daughter, grew up at the Long Island estate of the wealthy Larrabee family enchanted with their sparkling world of privilege and wealth, but she's especially enamored of younger son David, a charming playboy. After the once plain Sabrina returns from a sojourn in Paris transformed into a glamorous young woman, she at long last catches David's eye. In a calculated effort to manipulate David away from her and into a more financially advantageous marriage, formidable older brother Linus devises a plan to keep them apart.",6.213,651,"['Romance', 'Drama', 'Comedy']",4.0
11,"American President, The (1995)",Comedy|Drama|Romance,112346,9087.0,"Widowed U.S. president Andrew Shepherd, one of the world's most powerful men, can have anything he wants -- and what he covets most is Sydney Ellen Wade, a Washington lobbyist. But Shepherd's attempts at courting her spark wild rumors and decimate his approval ratings.",6.534,745,"['Comedy', 'Drama', 'Romance']",4.0
12,Dracula: Dead and Loving It (1995),Comedy|Horror,112896,12110.0,"When a lawyer shows up at the vampire's doorstep, he falls prey to his charms and joins him in his search for fresh blood. Enter Professor Van Helsing, who may be the only one able to vanquish the Count.",6.087,1030,"['Comedy', 'Horror']",2.0
19,Ace Ventura: When Nature Calls (1995),Comedy,112281,9273.0,"Summoned from an ashram in Tibet, Ace finds himself on a perilous journey into the jungles of Africa to find Shikaka, the missing sacred animal of the friendly Wachati tribe. He must accomplish this before the wedding of the Wachati's Princess to the prince of the warrior Wachootoos. If Ace fails, the result will be a vicious tribal war.",6.321,4340,"['Crime', 'Comedy', 'Adventure']",3.0
21,Get Shorty (1995),Comedy|Crime|Thriller,113161,8012.0,"Chili Palmer is a Miami mobster who gets sent to L.A. to collect a bad debt from Harry Zimm, a Hollywood producer who specializes in cheesy horror films. When Chili meets Harry's leading lady, the romantic sparks fly. After pitching his own life story as a movie idea, Chili learns that being a mobster and being a Hollywood producer really aren't all that different.",6.511,1124,"['Comedy', 'Thriller', 'Crime']",4.0
65,Bio-Dome (1996),Comedy,115683,9536.0,"Moronic best friends get themselves locked inside the Bio-Dome, a science experiment, along with a group of environmental scientists for one year.",4.5,383,['Comedy'],1.0
70,From Dusk Till Dawn (1996),Action|Comedy|Horror|Thriller,116367,755.0,"After kidnapping a father and his two kids, the Gecko brothers head south to a seedy Mexican bar to hide out in safety, unaware of its notorious vampire clientele.",7.029,6193,"['Horror', 'Action', 'Thriller', 'Crime']",3.0
102,Mr. Wrong (1996),Comedy,117102,47475.0,"A single and lonely woman finds the seemingly perfect man to date, but soon regrets it when his deranged and possessive other personality emerges and worst still, she cannot convince anyone else of his Jekyll/Hyde true nature.",3.9,60,"['Comedy', 'Romance']",2.0
104,Happy Gilmore (1996),Comedy,116483,9614.0,"Failed hockey player-turned-golf whiz Happy Gilmore — whose unconventional approach and antics on the green courts the ire of rival Shooter McGavin — is determined to win a PGA tournament so he can save his granny's house with the prize money. Meanwhile, an attractive tour publicist tries to soften Happy's image.",6.67,3099,['Comedy'],3.0
141,"Birdcage, The (1996)",Comedy,115685,11000.0,A gay cabaret owner and his drag queen partner agree to put up a false heterosexual front so that their son can introduce them to his fiancée's conservative parents.,7.049,1241,['Comedy'],4.0
153,Batman Forever (1995),Action|Adventure|Comedy|Crime,112462,414.0,"Batman faces off against two foes: the schizophrenic, horribly scarred former District Attorney Harvey Dent, aka Two-Face, and the Riddler, a disgruntled ex-Wayne Enterprises inventor seeking revenge against his former employer by unleashing his brain-sucking weapon on Gotham City's residents. As the caped crusader also copes with tortured memories of his parents' murder, he has a new romance, with psychologist Chase Meridian.",5.4,5368,"['Action', 'Crime', 'Fantasy']",3.0
174,Jury Duty (1995),Comedy,113500,19326.0,"When jobless Tommy Collins discovers that sequestered jurors earn free room and board as well as $5-a-day, he gets himself assigned to a jury in a murder trial. Once there, he does everything he can to prolong the trial and deliberations and make the sequestration more comfortable for himself.",4.4,123,"['Comedy', 'Drama']",2.0
203,"To Wong Foo, Thanks for Everything! Julie Newmar (1995)",Comedy,114682,9090.0,"Manhattan drag queens Vida Boheme and Noxeema Jackson impress regional judges in competition, securing berths in the Nationals in Los Angeles. When the two meet pathetic drag novice Chi-Chi Rodriguez — one of the losers that evening — the charmed Vida and Noxeema agree to take the hopeless youngster under their joined wing. Soon the three set off on a madcap road trip across America and struggle to make it to Los Angeles in time.",7.377,709,"['Comedy', 'Drama']",4.0
216,Billy Madison (1995),Comedy,112508,11017.0,"Billy Madison is the 27 year-old son of Bryan Madison, a very rich man who has made his living in the hotel industry. Billy stands to inherit his father's empire, but only if he can make it through all 12 grades, 2 weeks per grade, to prove that he has what it takes to run the family business.",6.183,1711,['Comedy'],2.0
224,Don Juan DeMarco (1995),Comedy|Drama|Romance,112883,1909.0,"John Arnold DeMarco is a man who believes he is Don Juan, the greatest lover in the world. Clad in a cape and mask, DeMarco undergoes psychiatric treatment with Dr. Jack Mickler to cure him of his apparent delusion. But the psychiatric sessions have an unexpected effect on the psychiatric staff and, most profoundly, Dr Mickler, who rekindles the romance in his complacent marriage.",6.738,770,"['Romance', 'Drama', 'Comedy']",3.0
234,Exit to Eden (1994),Comedy,109758,18395.0,"Photographer Elliot Slater has inadvertently snapped the only existing photos of elusive jewel thief Omar. When Elliot leaves for a private vacation on an S&M island, he is followed by Omar, Omar's partner, Nina, and undercover police officers Fred and Sheila. Unaware of the number of people chasing him, Elliot enjoys his stay at the resort, and finds himself falling in love with head dominatrix Lisa.",4.1,93,"['Comedy', 'Crime', 'Thriller']",4.0
235,Ed Wood (1994),Comedy|Drama,109707,522.0,"The mostly true story of the legendary ""worst director of all time"", who, with the help of his strange friends, filmed countless B-movies without ever becoming famous or successful.",7.49,2412,"['Comedy', 'Drama', 'History']",3.0
237,Forget Paris (1995),Comedy|Romance,113097,10525.0,"Mickey Gordon is a basketball referee who travels to France to bury his father. Ellen Andrews is an American living in Paris who works for the airline he flies on. They meet and fall in love, but their relationship goes through many difficult patches.",6.3,159,"['Comedy', 'Drama', 'Romance']",4.0
267,Major Payne (1995),Comedy,110443,11008.0,"Major Benson Winifred Payne is being discharged from the Marines. Payne is a killin' machine, but the wars of the world are no longer fought on the battlefield. A career Marine, he has no idea what to do as a civilian, so his commander finds him a job - commanding officer of a local school's JROTC program, a bunch of ragtag losers with no hope.",6.448,839,"['Adventure', 'Comedy', 'Family']",3.0
274,Man of the House (1995),Comedy,113755,40490.0,"Ben Archer is not happy. His mother, Sandy, has just met a man, and it looks like things are pretty serious. Driven by a fear of abandonment, Ben tries anything and everything to ruin the ""love bubble"" which surrounds his mom. However, after Ben and Jack's experiences in the Indian Guides, the two become much closer.",5.3,177,"['Comedy', 'Family']",3.0
276,Milk Money (1994),Comedy|Romance,110516,8986.0,"Three young boys pool their money and pay V, a kindhearted prostitute, to strip for them. Afterward, she drives them home to the suburbs -- but then her car breaks down. It's just as well, though, because a mobster named Waltzer is after her, and V realizes the suburbs are the perfect place to hide. But things get a lot more complicated when V falls in love with Tom, a single father who is unaware of her real profession.",6.369,290,"['Comedy', 'Romance', 'Drama']",4.0
342,Muriel's Wedding (1994),Comedy,110598,236.0,"A young social outcast in Australia steals money from her parents to finance a vacation where she hopes to find happiness, and perhaps love.",6.839,473,"['Comedy', 'Drama', 'Romance']",3.0
344,Ace Ventura: Pet Detective (1994),Comedy,109040,3049.0,"He's Ace Ventura: Pet Detective. Jim Carrey is on the case to find the Miami Dolphins' missing mascot and quarterback Dan Marino. He goes eyeball to eyeball with a man-eating shark, stakes out the Miami Dolphins and woos and wows the ladies. Whether he's undercover, under fire or underwater, he always gets his man… or beast!",6.6,6080,"['Comedy', 'Mystery', 'Crime']",4.0
355,"Flintstones, The (1994)",Children|Comedy|Fantasy,109813,888.0,Modern Stone Age family the Flintstones hit the big screen in this live-action version of the classic cartoon. Fred helps Barney adopt a child. Barney sees an opportunity to repay him when Slate Mining tests its employees to find a new executive. But no good deed goes unpunished.,5.356,2530,"['Fantasy', 'Comedy', 'Family']",3.0
357,Four Weddings and a Funeral (1994),Comedy|Romance,109831,712.0,"Over the course of five social occasions, a committed bachelor must consider the notion that he may have discovered love.",6.773,2840,"['Comedy', 'Drama', 'Romance']",4.0
364,"Lion King, The (1994)",Adventure|Animation|Children|Drama|Musical|IMAX,110357,8587.0,"Young lion prince Simba, eager to one day become king of the Pride Lands, grows up under the watchful eye of his father Mufasa; all the while his villainous uncle Scar conspires to take the throne for himself. Amid betrayal and tragedy, Simba must confront his past and find his rightful place in the Circle of Life.",8.256,19041,"['Family', 'Animation', 'Drama', 'Fantasy', 'Adventure']",5.0
367,"Mask, The (1994)",Action|Comedy|Crime|Fantasy,110475,854.0,"When timid bank clerk Stanley Ipkiss discovers a magical mask containing the spirit of the Norse god Loki, his entire life changes. While wearing the mask, Ipkiss becomes a supernatural playboy exuding charm and confidence which allows him to catch the eye of local nightclub singer Tina Carlyle. Unfortunately, under the mask's influence, Ipkiss also robs a bank, which angers junior crime lord Dorian Tyrell, whose goons get blamed for the heist.",6.969,10750,"['Romance', 'Comedy', 'Crime', 'Fantasy']",4.0
368,Maverick (1994),Adventure|Comedy|Western,110478,9359.0,"Bret Maverick is a gambler who would rather con someone than fight them, and needs an additional $3k in order to enter a winner-takes-all poker game beginning in a few days. He joins forces with a woman with a marvelous Southern accent, and the two try and enter the game.",6.889,1665,"['Action', 'Adventure', 'Comedy', 'Drama', 'Western']",4.0
371,"Paper, The (1994)",Comedy|Drama,110771,12280.0,"Henry Hackett is the workaholic editor of a New York City tabloid. He loves his job, but the long hours and low pay are leading to discontent. Also, publisher Bernie White faces financial straits, and has hatchet-man Alicia Clark—Henry's nemesis—impose unpopular cutbacks.",6.56,218,"['Comedy', 'Drama']",3.0
380,True Lies (1994),Action|Adventure|Comedy|Romance|Thriller,111503,36955.0,"A fearless, globe-trotting, terrorist-battling secret agent has his life turned upside down when he discovers his wife might be having an affair with a used car salesman while terrorists smuggle nuclear war heads into the United States.",7.085,4326,"['Action', 'Thriller']",4.0
415,Another Stakeout (1993),Comedy|Thriller,106292,9409.0,A pair of immature detectives are joined by a pesky assistant district attorney in staking out a lakeside home where an important Mafia trial witness is believed to be heading.,5.453,233,"['Comedy', 'Crime', 'Action']",3.0
420,Beverly Hills Cop III (1994),Action|Comedy|Crime|Thriller,109254,306.0,"When his boss is killed, Detroit cop Axel Foley finds evidence that the murderer had ties to a California amusement park called Wonder World. Returning to sunny Beverly Hills once more, Foley reunites with Detective Billy Rosewood to solve the case. Along with Billy's new partner, Detective Jon Flint, they discover that Wonder World is being used as a front for a massive counterfeiting ring.",5.88,2006,"['Action', 'Comedy', 'Crime']",2.0
432,City Slickers II: The Legend of Curly's Gold (1994),Adventure|Comedy|Western,109439,11310.0,"Mitch Robbins' 40th birthday begins quite well until he returns home and finds his brother Glen, the black sheep of the family, in his sofa. Nevertheless he is about to have a wonderful birthday-night with his wife when he discovers a treasure map of Curly by chance. Together with Phil and unfortunately Glen he tries to find the hidden gold of Curly's father in the desert of Arizona.",5.3,326,"['Action', 'Comedy', 'Drama', 'Western']",4.0
435,Coneheads (1993),Comedy|Sci-Fi,106598,9612.0,"A pair of aliens arrive on Earth to prepare for invasion, but crash instead. With enormous cone-shaped heads, robotlike walks and an appetite for toilet paper, aliens Beldar and Prymatt don't exactly blend in with the population of Paramus, N.J. But for some reason, everyone believes them when they say they're from France.",5.452,968,"['Comedy', 'Science Fiction']",2.0
438,"Cowboy Way, The (1994)",Action|Comedy|Drama,109493,19176.0,"Two championship rodeo partners travel to New York to find their missing friend, Nacho Salazar who went missing there.",5.677,158,"['Action', 'Comedy', 'Crime', 'Drama', 'Thriller', 'Western']",2.0
441,Dazed and Confused (1993),Comedy,106677,9571.0,"The adventures of a group of Texas teens on their last day of school in 1976, centering on student Randall Floyd, who moves easily among stoners, jocks and geeks. Floyd is a star athlete, but he also likes smoking weed, which presents a conundrum when his football coach demands he sign a ""no drugs"" pledge.",7.319,2146,"['Comedy', 'Drama']",3.0
450,With Honors (1994),Comedy|Drama,111732,16297.0,"Convinced he'll graduate with honors because of his thesis paper, a stuffy Harvard student finds his paper being held hostage by a homeless man, who might be the guy to school the young man in life.",6.7,215,"['Comedy', 'Drama']",3.0
468,"Englishman Who Went Up a Hill But Came Down a Mountain, The (1995)",Comedy|Romance,112966,10612.0,"When an English cartographer arrives in Wales to tell the residents of the Welsh village of Ffynnon Garw  that their 'mountain' is only a hill, the offended community sets out to remedy the situation.",6.32,308,"['Drama', 'Comedy', 'Romance']",3.0
489,Made in America (1993),Comedy,107478,12121.0,"A young black woman discovers that her father was a sperm donor, and if that wasn't bad enough, he's white.",5.517,376,['Comedy'],3.0
497,Much Ado About Nothing (1993),Comedy|Romance,107616,11971.0,"In this Shakespearean farce, Hero and her groom-to-be, Claudio, team up with Claudio's commanding officer, Don Pedro, the week before their wedding to hatch a matchmaking scheme. Their targets are sharp-witted duo Benedick and Beatrice -- a tough task indeed, considering their corresponding distaste for love and each other. Meanwhile, meddling Don John plots to ruin the wedding.",6.935,765,"['Drama', 'Comedy', 'Romance']",3.0
500,Mrs. Doubtfire (1993),Comedy|Drama,107614,788.0,"Loving but irresponsible dad Daniel Hillard, estranged from his exasperated spouse, is crushed by a court order allowing only weekly visits with his kids. When Daniel learns his ex needs a housekeeper, he gets the job -- disguised as a British nanny. Soon he becomes not only his children's best pal but the kind of parent he should have been from the start.",7.195,6357,"['Comedy', 'Drama', 'Family']",5.0
505,North (1994),Comedy,110687,31586.0,"Eleven-year-old North has had it with his parents. They are always busy with their careers and don't give North the attention he needs, so he files a lawsuit against them. The judge rules that North should either find new parents or return to his own parents within two months. Thus North starts off on a journey around the world to find parents that really care about him.",5.0,266,"['Comedy', 'Family', 'Fantasy', 'Adventure', 'Drama']",4.0
514,"Ref, The (1994)",Comedy,110955,10872.0,"A cat burglar is forced to take a bickering, dysfunctional family hostage on Christmas Eve.",6.533,352,"['Comedy', 'Crime', 'Drama']",3.0
516,Renaissance Man (1994),Comedy|Drama,110971,11858.0,"An advertising man is slowly sliding downhill. When he is fired from his job in Detroit, he signs up for unemployment. One day they find him a job: teaching thinking skills to Army recruits. He arrives on base to find that there is no structure set up for the class.",6.1,303,"['Comedy', 'Drama']",4.0
532,Serial Mom (1994),Comedy|Crime|Horror,111127,11592.0,"Beverly is the perfect happy homemaker, along with her doting husband and two children, but this nuclear family just might explode when her fascination with serial killers collides with her ever-so-proper code of ethics.",6.753,729,"['Comedy', 'Crime']",3.0
551,"Nightmare Before Christmas, The (1993)",Animation|Children|Fantasy|Musical,107688,9479.0,"Tired of scaring humans every October 31 with the same old bag of tricks, Jack Skellington, the spindly king of Halloween Town, kidnaps Santa Claus and plans to deliver shrunken heads and other ghoulish gifts to children on Christmas morning. But as Christmas approaches, Jack's rag-doll girlfriend, Sally, tries to foil his misguided plans.",7.835,9914,"['Fantasy', 'Animation', 'Family']",5.0
569,Little Big League (1994),Comedy|Drama,110363,31504.0,"When the owner of the Minnesota Twins passes away, he bequeaths the team to his preteen grandson. The newly minted head honcho quickly appoints himself manager, causing unrest in an organization that struggles to take orders from a 12-year-old.",5.8,102,"['Comedy', 'Family']",4.0
585,"Brady Bunch Movie, The (1995)",Comedy,112572,9066.0,"The original '70s TV family is now placed in the 1990s, where they're even more square and out of place than ever.",6.1,299,"['Family', 'Comedy', 'Romance']",4.0
586,Home Alone (1990),Children|Comedy,99785,771.0,"Eight-year-old Kevin McCallister makes the most of the situation after his family unwittingly leaves him behind when they go on Christmas vacation. When thieves try to break into his home, he puts up a fight like no other.",7.447,11876,"['Comedy', 'Family']",4.0
588,Aladdin (1992),Adventure|Animation|Children|Comedy|Musical,103639,812.0,"In the boorish city of Agrabah, kind-hearted street urchin Aladdin and Princess Jasmine fall in love, although she can only marry a prince. He and power-hungry Grand Vizier Jafar vie for a magic lamp that can fulfill their wishes.",7.7,11624,"['Animation', 'Family', 'Adventure', 'Fantasy', 'Romance']",5.0
594,Snow White and the Seven Dwarfs (1937),Animation|Children|Drama|Fantasy|Musical,29583,408.0,"A beautiful girl, Snow White, takes refuge in the forest in the house of seven dwarfs to hide from her stepmother, the wicked Queen. The Queen is jealous because she wants to be known as ""the fairest in the land,"" and Snow White's beauty surpasses her own.",7.123,7743,"['Fantasy', 'Animation', 'Family']",4.0
595,Beauty and the Beast (1991),Animation|Children|Fantasy|Musical|Romance|IMAX,101414,10020.0,"Follow the adventures of Belle, a bright young woman who finds herself in the castle of a prince who's been turned into a mysterious beast. With the help of the castle's enchanted staff, Belle soon learns the most important lesson of all -- that true beauty comes from within.",7.73,10315,"['Romance', 'Family', 'Animation', 'Fantasy']",5.0
597,Pretty Woman (1990),Comedy|Romance,100405,114.0,"While on a business trip in Los Angeles, Edward Lewis, a millionaire entrepreneur who makes a living buying and breaking up companies, picks up a prostitute, Vivian, while asking for directions; after, Edward hires Vivian to stay with him for the weekend to accompany him to a few social events, and the two get closer only to discover there are significant hurdles to overcome as they try to bridge the gap between their very different worlds.",7.461,8626,"['Romance', 'Comedy']",4.0
656,Eddie (1996),Comedy,116168,11107.0,"Eddie is a New York limo driver and a fanatical follower of the New York Knicks professional basketball team. The team is struggling with a mediocre record when, in mid-season, ""Wild Bill"" Burgess, the new owner, as a public relations gimmick, stages an 'honorary coach' contest, which Eddie wins. The fans love it, so ""Wild Bill"" fires the coach and hires her. She takes the bunch of overpaid prima",5.5,167,"['Action', 'Comedy']",2.0
743,Spy Hard (1996),Comedy,117723,10535.0,"The evil Gen. Rancor has his sights set on world domination, and only one man can stop him: Dick Steele, also known as Agent WD-40. Rancor needs to obtain a computer circuit for the missile that he is planning to fire, so Steele teams up with Veronique Ukrinsky, a KGB agent whose father designed the chip. Together they try to locate the evil mastermind's headquarters, where Veronique's father and several other hostages are being held.",5.405,708,"['Comedy', 'Action']",3.0
747,"Stupids, The (1996)",Comedy,117768,16299.0,"An incredibly dull-witted family unknowingly stumble upon an illegal weapons deal while on the trail of their ""stolen"" garbage.",4.7,78,"['Comedy', 'Family']",2.0
762,Striptease (1996),Comedy|Crime,117765,9879.0,"Bounced from her job, Erin Grant needs money if she's to have any chance of winning back custody of her child. But, eventually, she must confront the naked truth: to take on the system, she'll have to take it all off. Erin strips to conquer, but she faces unintended circumstances when a hound dog of a Congressman zeroes in on her and sharpens the shady tools at his fingertips, including blackmail and murder.",5.558,1120,"['Comedy', 'Crime', 'Drama']",1.0
783,"Hunchback of Notre Dame, The (1996)",Animation|Children|Drama|Musical|Romance,116583,10545.0,"Isolated bell-ringer Quasimodo wishes to leave Notre Dame tower against the wishes of Judge Claude Frollo, his stern guardian and Paris' strait-laced Minister of Justice. His first venture to the outside world finds him Esmeralda, a kind-hearted and fearless Romani woman who openly stands up to Frollo's tyranny.",7.1,5190,"['Drama', 'Animation', 'Family']",4.0
784,"Cable Guy, The (1996)",Comedy|Thriller,115798,9894.0,"When recently single Steven moves into his new apartment, cable guy Chip comes to hook him up—and doesn't let go. Initially, Chip is just overzealous in his desire to be Steven's pal, but when Steven tries to end the 'friendship', Chip shows his dark side. He begins stalking Steven, who's left to fend for himself because no one else can believe Chip's capable of such behaviour.",5.992,2536,"['Comedy', 'Drama', 'Thriller']",4.0
785,Kingpin (1996),Comedy,116778,11543.0,"After bowler Roy Munson swindles the wrong crowd and is left with a hook for a hand, he settles into impoverished obscurity. That is, until he uncovers the next big thing: an Amish kid named Ishmael. So, the corrupt and the hopelessly naive hit the circuit intent on settling an old score with Big Ern.",6.5,917,['Comedy'],3.0
799,"Frighteners, The (1996)",Comedy|Horror|Thriller,116365,10779.0,"Once an architect, Frank Bannister now passes himself off as an exorcist of evil spirits. To bolster his facade, he claims his ""special"" gift is the result of a car accident that killed his wife. But what he does not count on is more people dying in the small town where he lives. As he tries to piece together the supernatural mystery of these killings, he falls in love with the wife of one of the victims and deals with a crazy FBI agent.",6.916,1620,"['Horror', 'Comedy']",3.0
