movieId,title,genres,imdbId,tmdbId,overview,tmdb_vote_average,tmdb_vote_count,tmdb_genres,rating
3262,Twin Peaks: Fire Walk with Me (1992),Crime|Drama|Mystery|Thriller,105665,1923.0,"In the questionable town of Deer Meadow, Washington, FBI Agent Desmond inexplicably disappears while hunting for the man who murdered a teen girl. The killer is never apprehended, and, after experiencing dark visions and supernatural encounters, Agent Dale Cooper chillingly predicts that the culprit will claim another life. Meanwhile, in the more cozy town of Twin Peaks, hedonistic beauty Laura Palmer hangs with lowlifes and seems destined for a grisly fate.",7.4,2090,"['Drama', 'Mystery', 'Horror']",3.5
3264,Buffy the Vampire Slayer (1992),Action|Comedy|Horror,103893,10206.0,"Blonde, bouncy Buffy is your typical high school cheerleader. But all that changes when a strange man informs her she's been chosen by fate to kill vampires.",5.618,859,"['Action', 'Comedy', 'Horror']",2.0
3275,"Boondock Saints, The (2000)",Action|Crime|Drama|Thriller,144117,8374.0,"Tired of the crime overrunning the streets of Boston, Irish Catholic twin brothers Conner and Murphy are inspired by their faith to cleanse their hometown of evil with their own brand of zealous vigilante justice. As they hunt down and kill one notorious gangster after another, they become controversial folk heroes in the community. But Paul Smecker, an eccentric FBI agent, is fast closing in on their blood-soaked trail.",7.251,2550,"['Action', 'Thriller', 'Crime']",3.0
3300,Pitch Black (2000),Horror|Sci-Fi|Thriller,134847,2787.0,"When their ship crash-lands on a remote planet, the marooned passengers soon learn that escaped convict Riddick isn't the only thing they have to fear. Deadly creatures lurk in the shadows, waiting to attack in the dark, and the planet is rapidly plunging into the utter blackness of a total eclipse. With the body count rising, the doomed survivors are forced to turn to Riddick with his eerie eyes to guide them through the darkness to safety. With time running out, there's only one rule: Stay in the light.",6.852,4597,"['Thriller', 'Science Fiction', 'Action']",3.5
3409,Final Destination (2000),Drama|Thriller,195714,9532.0,"After a teenager has a terrifying vision of him and his friends dying in a plane crash, he prevents the accident only to have Death hunt them down, one by one.",6.625,6320,['Horror'],3.0
3476,Jacob's Ladder (1990),Horror|Mystery,99871,2291.0,"After returning home from the Vietnam War, veteran Jacob Singer struggles to maintain his sanity. Plagued by hallucinations and flashbacks, Singer rapidly falls apart as the world and people around him morph and twist into disturbing images. His girlfriend, Jezzie, and ex-wife, Sarah, try to help, but to little avail. Even Singer's chiropractor friend, Louis, fails to reach him as he descends into madness.",7.35,1758,"['Drama', 'Mystery', 'Horror']",3.0
3676,Eraserhead (1977),Drama|Horror,74486,985.0,"First-time father Henry Spencer tries to survive his industrial environment, his angry girlfriend, and the unbearable screams of his newly born mutant child.",7.3,2617,"['Science Fiction', 'Horror']",2.5
3686,Flatliners (1990),Horror|Sci-Fi|Thriller,99582,1551.0,"Five medical students want to find out if there is life after death. They plan to stop one of their hearts for a few seconds, thus simulating death, and then bring the person back to life.",6.499,1623,"['Drama', 'Science Fiction', 'Horror']",4.5
3708,Firestarter (1984),Horror|Thriller,87262,11495.0,"Charlene ""Charlie"" McGee has the amazing ability to start fires with just a glance. Can her psychic power and the love of her father save her from the threatening government agency which wants to destroy her?",6.262,726,"['Horror', 'Thriller', 'Science Fiction']",3.0
3709,Sleepwalkers (1992),Horror,105428,11428.0,"Charles Brady and his mother, Mary, are the last of a dying breed whose needs are not of this world.  They are Sleepwalkers - able to stay alive only by feeding on the life-force of the innocent, but destined to roam the earth, avoiding discovery while searching for their next victim.  That search takes them to the sleepy little town of Travis, Indiana, where beautiful teenager Tanya Robertson is about to become an unwilling pawn in their nightmarish fight for survival.",6.036,577,"['Horror', 'Fantasy', 'Thriller']",3.5
3727,Near Dark (1987),Horror|Western,93605,11879.0,A farm boy reluctantly becomes a member of the undead when a girl he meets turns out to be part of a band of vampires who roam the highways in stolen cars.,6.858,805,['Horror'],3.5
3770,Dreamscape (1984),Horror|Sci-Fi|Thriller,87175,24099.0,"In order to diagnose the psychic traumas suffered by his patients, Dr. Paul Novotny gets young Alex Gardner to enter their dreams.",6.103,302,"['Drama', 'Science Fiction', 'Thriller']",3.0
3863,"Cell, The (2000)",Drama|Horror|Thriller,209958,8843.0,A psychotherapist journeys inside a comatose serial killer in the hopes of saving his latest victim.,6.3,1606,"['Horror', 'Science Fiction', 'Thriller']",4.5
3917,Hellraiser (1987),Horror,93177,9003.0,"Hedonist Frank Cotton finds a mysterious puzzle box that summons the Cenobites, who open the doors to a dominion where pain and pleasure are indivisible.",6.875,2712,"['Horror', 'Thriller', 'Fantasy']",5.0
3918,Hellbound: Hellraiser II (1988),Horror,95294,9064.0,"Confined to a mental hospital, young Kirsty Cotton insists her supposedly dead father is stuck in hell, controlled by sadomasochistic demons after being betrayed by his evil, occult-obsessed wife, Julia. Few believe Kirsty, except the thrill-seeking Dr. Channard, who is intrigued by the young woman's lurid stories. So when Kirsty and fellow patient Tiffany head to hell for a rescue, Channard and Julia are close behind.",6.41,1180,"['Horror', 'Thriller', 'Fantasy']",4.5
3919,Hellraiser III: Hell on Earth (1992),Horror,104409,11569.0,Pinhead is set loose on the sinful streets of New York City to create chaos with a fresh cadre of Cenobitic kin.,5.668,794,"['Horror', 'Thriller']",3.0
3949,Requiem for a Dream (2000),Drama,180093,641.0,The drug-induced utopias of four Coney Island residents are shattered when their addictions run deep.,8.015,10495,"['Crime', 'Drama']",3.0
4020,"Gift, The (2000)",Thriller,219699,2046.0,"Annie Wilson, young widow and mother of three, makes her living foretelling others' futures⁠—though her own has become cloudier than even she can see. Threatened by a client's violent husband and plagued by visions of a missing local woman, Annie finds herself pulled into a thicket of lies and deception in which her extraordinary gift may ultimately get her killed.",6.5,1293,"['Horror', 'Drama', 'Thriller', 'Mystery']",3.0
4022,Cast Away (2000),Drama,162222,8358.0,"Chuck Noland, a top international manager for FedEx, and Kelly, a Ph.D. student, are in love and heading towards marriage. Then Chuck's plane to Malaysia crashes at sea during a terrible storm. He's the only survivor, and finds himself marooned on a desolate island. With no way to escape, Chuck must find ways to survive in his new home.",7.661,11830,"['Adventure', 'Drama']",3.0
4105,"Evil Dead, The (1981)",Fantasy|Horror|Thriller,83907,764.0,"In 1979, a group of college students find a Sumerian Book of the Dead in an old wilderness cabin they've rented for a weekend getaway.",7.276,4233,['Horror'],5.0
4128,"Lost Boys, The (1987)",Comedy|Horror|Thriller,93437,1547.0,"When an unsuspecting town newcomer is drawn to local blood fiends, the Frog brothers and other unlikely heroes gear up to rescue him.",7.085,2170,"['Horror', 'Comedy', 'Thriller', 'Drama', 'Romance']",4.0
4222,C.H.U.D. (1984),Horror,87015,23730.0,"A rash of bizarre murders in New York City seems to point to a group of grotesquely deformed vagrants living in the sewers. A courageous policeman, a photojournalist and his girlfriend, and a nutty bum, who seems to know a lot about the creatures, band together to try and determine what the creatures are and how to stop them.",5.65,294,"['Horror', 'Science Fiction']",2.5
4310,Pearl Harbor (2001),Action|Drama|Romance|War,213149,676.0,"The lifelong friendship between Rafe McCawley and Danny Walker is put to the ultimate test when the two ace fighter pilots become entangled in a love triangle with beautiful Naval nurse Evelyn Johnson. But the rivalry between the friends-turned-foes is immediately put on hold when they find themselves at the center of Japan's devastating attack on Pearl Harbor on Dec. 7, 1941.",6.941,6750,"['War', 'Romance', 'History', 'Action']",3.0
4437,Suspiria (1977),Horror,76786,11906.0,An American newcomer to a prestigious German ballet academy comes to realize that the school is a front for something sinister amid a series of grisly murders.,7.5,3049,['Horror'],3.5
4446,Final Fantasy: The Spirits Within (2001),Adventure|Animation|Fantasy|Sci-Fi,173840,2114.0,"Led by a strange dream, scientist Aki Ross struggles to collect the eight spirits in the hope of creating a force powerful enough to protect the planet. With the aid of the Deep Eyes Squadron and her mentor, Dr. Sid, Aki must save the Earth from its darkest hate and unleash the spirits within.",6.196,1525,"['Adventure', 'Action', 'Fantasy', 'Science Fiction', 'Thriller', 'Romance', 'Animation']",3.0
4480,"Blob, The (1988)",Horror|Sci-Fi,94761,9599.0,"In Arborville, California, three high school students try to protect their hometown from a gelatinous alien life form that engulfs everything it touches.",6.8,966,"['Horror', 'Science Fiction']",3.0
4492,Critters (1986),Comedy|Sci-Fi,90887,3980.0,"Carnivorous aliens arrive unannounced at a Kansas family farm; two intergalactic bounty hunters soon follow, determined to blow them off the planet.",6.464,1029,"['Comedy', 'Horror', 'Science Fiction']",3.0
4532,Return of the Living Dead Part II (1988),Comedy|Horror,95990,24929.0,"A group of kids discover one of the drums containing a rotting corpse and release the 2-4-5 Trioxin gas into the air, causing the dead to once again rise from the grave and seek out brains.",6.36,663,"['Horror', 'Comedy']",2.5
4541,"Serpent and the Rainbow, The (1988)",Horror,96071,11503.0,"A Harvard anthropologist is sent to Haiti to retrieve a strange powder that is said to have the power to bring human beings back from the dead. In his quest to find the miracle drug, the cynical scientist enters the rarely seen netherworld of walking zombies, blood rites and ancient curses. Based on the true life experiences of Wade Davis and filmed on location in Haiti, it's a frightening excursion into black magic and the supernatural.",6.4,526,"['Horror', 'Thriller']",2.5
4670,"Stepfather, The (1987)",Horror|Thriller,94035,25155.0,"Seemingly mild-mannered Henry Morrison has just murdered his entire family. After adopting a new identity and skipping town, he begins building a new relationship with a widow and her teenage daughter. However, he soon begins struggling to hide his true identity and maintain a grip on reality.",6.5,348,"['Horror', 'Thriller']",2.0
4697,Basket Case (1982),Comedy|Horror,83624,27813.0,"A young man carrying a big basket that contains his extremely deformed, formerly conjoined twin brother seeks vengeance on the doctors who separated them against their will.",6.266,440,"['Horror', 'Comedy']",3.0
4720,"Others, The (2001)",Drama|Horror|Mystery|Thriller,230600,1933.0,"Grace is a religious woman who lives in an old house kept dark because her two children, Anne and Nicholas, have a rare sensitivity to light. When the family begins to suspect the house is haunted, Grace fights to protect her children at any cost in the face of strange events and disturbing visions.",7.616,6837,"['Horror', 'Mystery', 'Thriller']",4.0
4744,Jeepers Creepers (2001),Horror,263488,8922.0,"On a desolate country highway, two homeward-bound teens are nearly run off the road by a maniac in a beat-up truck, and later spot him shoving what appears to be a body down a sewer pipe.",6.474,3133,['Horror'],4.0
4754,"Wicker Man, The (1973)",Drama|Horror|Mystery|Thriller,70917,16307.0,"Police sergeant Neil Howie is called to an island village in search of a missing girl whom the locals claim never existed. Stranger still, however, are the rituals that take place there.",7.3,1517,['Horror'],4.5
4833,"Changeling, The (1980)",Horror|Mystery|Thriller,80516,13550.0,"After a tragic event happens, composer John Russell moves to Seattle to try to overcome it and build a new and peaceful life in a lonely big house that has been uninhabited for many years. But, soon after, the obscure history of such an old mansion and his own past begin to haunt him.",6.987,678,['Horror'],4.0
4848,Mulholland Drive (2001),Crime|Drama|Film-Noir|Mystery|Thriller,166924,1018.0,"Blonde Betty Elms has only just arrived in Hollywood to become a movie star when she meets an enigmatic brunette with amnesia. Meanwhile, as the two set off to solve the second woman's identity, filmmaker Adam Kesher runs into ominous trouble while casting his latest project.",7.806,6666,"['Thriller', 'Drama', 'Mystery']",2.5
4878,Donnie Darko (2001),Drama|Mystery|Sci-Fi|Thriller,246578,141.0,"After narrowly escaping a bizarre accident, a troubled teenager is plagued by visions of a large bunny rabbit that manipulates him to commit a series of crimes.",7.766,12921,"['Fantasy', 'Drama', 'Mystery']",2.5
4902,"Devil's Backbone, The (Espinazo del diablo, El) (2001)",Drama|Fantasy|Horror|Thriller|War,256009,1433.0,"Spain, 1939. In the last days of the Spanish Civil War, the young Carlos arrives at the Santa Lucía orphanage, where he will make friends and enemies as he follows the quiet footsteps of a mysterious presence eager for revenge.",7.3,1276,"['Fantasy', 'Drama', 'Horror', 'Thriller']",3.0
4993,"Lord of the Rings: The Fellowship of the Ring, The (2001)",Adventure|Fantasy,120737,120.0,"Young hobbit Frodo Baggins, after inheriting a mysterious ring from his uncle Bilbo, must leave his home in order to keep it from falling into the hands of its evil creator. Along the way, a fellowship is formed to protect the ringbearer and make sure that the ring arrives at its final destination: Mt. Doom, the only place where it can be destroyed.",8.424,26410,"['Adventure', 'Fantasy', 'Action']",5.0
5105,Don't Look Now (1973),Drama|Horror|Thriller,69995,931.0,"While grieving a terrible loss, a married couple meet two mysterious sisters, one of whom gives them a message sent from the afterlife.",6.939,1126,"['Thriller', 'Drama', 'Horror']",2.0
5219,Resident Evil (2002),Action|Horror|Sci-Fi|Thriller,120804,1576.0,"When a virus leaks from a top-secret facility, turning all resident researchers into ravenous zombies and their lab animals into mutated hounds from hell, the government sends in an elite military task force to contain the outbreak.",6.65,6648,"['Horror', 'Action', 'Science Fiction']",3.5
5254,Blade II (2002),Action|Horror|Thriller,187738,36586.0,"Blade forms an uneasy alliance with the vampire council in order to combat the Reapers, who are feeding on vampires.",6.6,4957,"['Fantasy', 'Horror', 'Action', 'Thriller']",3.5
5349,Spider-Man (2002),Action|Adventure|Sci-Fi|Thriller,145487,557.0,"After being bitten by a genetically altered spider at Oscorp, nerdy but endearing high school student Peter Parker is endowed with amazing powers to become the superhero known as Spider-Man.",7.316,19918,"['Action', 'Science Fiction']",3.0
5433,Silver Bullet (Stephen King's Silver Bullet) (1985),Adventure|Drama|Horror|Mystery|Thriller,90021,17898.0,"The small city of Tarker's Mills is startled by a series of sadistic murders. The population fears the work of a manic, but sightings of a mysterious, hairy creature soon spread. People lock themselves up at night, but there's one boy who's still outside…",6.581,646,['Horror'],2.5
5463,Reign of Fire (2002),Action|Adventure|Fantasy,253556,6278.0,"In post-apocalyptic England, an American volunteer and a British survivor team up to fight off a brood of fire-breathing dragons seeking to return to global dominance after centuries of rest underground. The Brit -- leading a clan of survivors to hunt down the King of the Dragons -- has much at stake: His mother was killed by a dragon, but his love is still alive.",6.195,2336,"['Adventure', 'Action', 'Fantasy']",3.5
5478,Eight Legged Freaks (2002),Action|Comedy|Horror|Sci-Fi,271367,8869.0,"The residents of a rural mining town discover that an unfortunate chemical spill has caused hundreds of little spiders to mutate overnight to the size of SUVs. It's then up to mining engineer Chris McCormack and Sheriff Sam Parker to mobilize an eclectic group of townspeople, including the Sheriff's young son, Mike, her daughter, Ashley, and paranoid radio announcer Harlan, into battle against the bloodthirsty eight-legged beasts.",5.807,1292,"['Action', 'Comedy', 'Horror', 'Thriller']",2.5
5569,"Last House on the Left, The (1972)",Crime|Horror|Thriller,68833,15516.0,"On the eve of her 17th birthday, Mari and friend Phyllis set off from her family home to attend a rock concert in the city. Attempting to score some drugs on the way, the pair run afoul of a group of vicious crooks, headed up by the sadistic Krug.",6.008,733,"['Horror', 'Thriller', 'Crime', 'Drama']",2.0
5588,"Hills Have Eyes, The (1977)",Horror,77681,12262.0,"Taking an ill-advised detour en-route to California, the Carter family soon run into trouble when their RV breaks down in the middle of the desert. Stranded, they find themselves at the mercy of monstrous cannibals lurking in the surrounding hills.",6.153,950,"['Horror', 'Thriller']",3.0
5606,Society (1989),Horror|Mystery,98354,22244.0,Bill Whitney is worried that he is different to his sister and parents. They mix with other upper-class people while Bill is more down to earth. Even his girlfriend seems a bit odd. All is revealed when Bill returns home to find a party in full swing.,6.7,583,"['Comedy', 'Horror', 'Mystery']",3.0
5663,Below (2002),Horror,276816,12590.0,"In the dark silence of the sea during World War II, the submarine USS Tiger Shark prowls on what should be a routine rescue mission. But for the shell-shocked crew, trapped together in the sub's narrow corridors and constricted spaces, this is about to become a journey into the sensory delusions, mental deceptions and runaway fears that lurk just below the surface of the ocean.",6.0,476,"['Thriller', 'Horror', 'Mystery']",2.5
5679,"Ring, The (2002)",Horror|Mystery|Thriller,298130,565.0,Rachel Keller is a journalist investigating a videotape that may have killed four teenagers. There is an urban legend about this tape: the viewer will die seven days after watching it. Rachel tracks down the video... and watches it. Now she has just seven days to unravel the mystery of the Ring so she can save herself and her son.,6.686,6388,"['Horror', 'Mystery']",4.0
5715,"Burning, The (1981)",Horror,82118,24124.0,"A caretaker at a summer camp is burned when a prank goes tragically wrong. After several years of intensive treatment at hospital, he is released back into society, albeit missing some social skills. What follows is a bloody killing spree with the caretaker making his way back to his old stomping ground to confront one of the youths that accidentally burned him.",6.2,427,['Horror'],3.0
5731,"Entity, The (1981)",Horror,82334,24740.0,"Carla Moran begins experiencing violent attacks by an unseen force. Her psychiatrist, Dr. Phil Sneiderman, believes the events stem from psychological trauma, while Carla becomes increasingly convinced something supernatural is at play.",6.7,516,"['Horror', 'Mystery', 'Thriller']",3.0
5797,"Company of Wolves, The (1984)",Fantasy|Horror,87075,11905.0,"An adaptation of Angela Carter's fairy tales. Young Rosaleen dreams of a village in the dark woods, where Granny tells her cautionary tales in which innocent maidens are tempted by wolves who are hairy on the inside. As Rosaleen grows into womanhood, will the wolves come for her too?",6.335,360,"['Horror', 'Fantasy']",2.0
5833,Dog Soldiers (2002),Action|Horror,280609,11880.0,"A band of soldiers is dispatched to war games deep in the woods. When they stumble across a rival team slaughtered in camp, they realize they're not alone.",6.72,930,"['Horror', 'Action', 'Thriller']",3.5
5853,Scanners (1981),Horror|Sci-Fi|Thriller,81455,9538.0,"After a man with extraordinary, and frighteningly destructive, telepathic abilities is nabbed by agents from a mysterious rogue corporation, he discovers he is far from the only possessor of such strange powers. Some of the other “scanners” have their minds set on world domination, while others are trying to stop them.",6.718,1277,"['Science Fiction', 'Horror']",4.5
6250,Dreamcatcher (2003),Drama|Horror|Sci-Fi|Thriller,285531,6171.0,"Four boyhood pals perform a heroic act and are changed by the powers they gain in return. Years later, on a hunting trip in the Maine woods, they're overtaken by a vicious blizzard that harbors an ominous presence. Challenged to stop an alien force, the friends must first prevent the slaughter of innocent civilians by a military vigilante ... and then overcome a threat to the bond that unites the four of them.",5.631,1805,"['Drama', 'Horror', 'Science Fiction', 'Thriller']",4.0
6333,X2: X-Men United (2003),Action|Adventure|Sci-Fi|Thriller,290334,36658.0,"Professor Charles Xavier and his team of genetically gifted superheroes face a rising tide of anti-mutant sentiment led by Col. William Stryker. Storm, Wolverine and Jean Grey must join their usual nemeses—Magneto and Mystique—to unhinge Stryker's scheme to exterminate all mutants.",7.031,10525,"['Adventure', 'Action', 'Science Fiction']",3.5
6365,"Matrix Reloaded, The (2003)",Action|Adventure|Sci-Fi|Thriller|IMAX,234215,604.0,"The Resistance builds in numbers as humans are freed from the Matrix and brought to the city of Zion. Neo discovers his superpowers, including the ability to see the code inside the Matrix. With machine sentinels digging to Zion in 72 hours, Neo, Morpheus and Trinity must find the Keymaker to ultimately reach the Source.",7.066,11456,"['Adventure', 'Action', 'Thriller', 'Science Fiction']",4.5
6379,Wrong Turn (2003),Horror|Thriller,295700,9902.0,"Chris crashes into a carload of other young people, and the group of stranded motorists is soon lost in the woods of West Virginia, where they're hunted by three cannibalistic mountain men who are grossly disfigured by generations of inbreeding.",6.376,2843,"['Horror', 'Thriller']",2.5
6502,28 Days Later (2002),Action|Horror|Sci-Fi,289043,170.0,"Twenty-eight days after a killer virus was accidentally unleashed from a British research facility, a small group of London survivors are caught in a desperate struggle to protect themselves from the infected. Carried by animals and humans, the virus turns those it infects into homicidal maniacs -- and it's absolutely impossible to contain.",7.235,7845,"['Horror', 'Thriller', 'Science Fiction']",4.0
6537,Terminator 3: Rise of the Machines (2003),Action|Adventure|Sci-Fi,181852,296.0,"It's been 10 years since John Connor saved Earth from Judgment Day, and he's now living under the radar, steering clear of using anything Skynet can trace. That is, until he encounters T-X, a robotic assassin ordered to finish what T-1000 started. Good thing Connor's former nemesis, the Terminator, is back to aid the now-adult Connor … just like he promised.",6.179,6938,"['Action', 'Thriller', 'Science Fiction']",3.0
6602,Brain Damage (1988),Comedy|Horror,94793,27814.0,Brian comes under the addictive spell of a parasite with the ability to induce euphoric hallucinations in its hosts.,6.7,286,"['Horror', 'Comedy']",3.0
6653,"Keep, The (1983)",Horror|Thriller,85780,26198.0,"Set during World War II, a German army garrison is sent to guard a mountain pass in a village in Romania's Carpathian mountains and sets up barracks in an ancient stone fortress. Two of the soldiers unwittingly release a mysterious entity that kills or corrupts those within its influence, drawing the attention of a Gestapo commander, a Jewish scholar, and a mysterious traveller.",5.583,284,"['Horror', 'Fantasy']",4.0
6659,Tremors (1990),Comedy|Horror|Sci-Fi,100814,9362.0,"Val McKee and Earl Bassett are in a fight for their lives when they discover that their desolate town has been infested with gigantic, man-eating creatures that live below the ground.",6.9,3399,"['Horror', 'Action', 'Science Fiction', 'Comedy']",4.5
6707,Cabin Fever (2002),Horror|Thriller,303816,11547.0,"A group of five college graduates rent a cabin in the woods and begin to fall victim to a horrifying flesh-eating virus, which attracts the unwanted attention of the homicidal locals.",5.699,1361,['Horror'],2.0
6711,Lost in Translation (2003),Comedy|Drama|Romance,335266,153.0,"Two lost souls visiting Tokyo -- the young, neglected wife of a photographer and a washed-up movie star shooting a TV commercial -- find an odd solace and pensive freedom to be real in each other's company, away from their lives in America.",7.387,7692,"['Drama', 'Romance', 'Comedy']",2.0
6731,Day of the Dead (1985),Horror|Sci-Fi|Thriller,88993,8408.0,"As the world is overrun by zombies, scientists and military personnel in an underground Florida bunker must decide on how they should deal with the undead.",7.04,1310,"['Horror', 'Drama', 'Mystery']",3.0
6748,"Brood, The (1979)",Horror,78908,28942.0,"A man tries to uncover an unconventional psychologist's therapy techniques on his institutionalized wife, while a series of brutal attacks committed by a brood of mutant children coincides with the husband's investigation.",6.714,754,"['Horror', 'Science Fiction']",3.0
