movieId,title,genres,imdbId,tmdbId,overview,tmdb_vote_average,tmdb_vote_count,tmdb_genres,rating
91500,The Hunger Games (2012),Action|Adventure|Drama|Sci-Fi|Thriller,1392170,70160.0,"In a dystopian society where the Capitol forces each district to send two young tributes to fight to the death in a televised spectacle, a girl volunteers to take her sister’s place, setting the stage for a struggle of survival and defiance.",7.219,22651,"['Science Fiction', 'Adventure', 'Action', 'Thriller']",5.0
91653,We Bought a Zoo (2011),Comedy|Drama,1389137,74465.0,"Benjamin has lost his wife and, in a bid to start his life over, purchases a large house that has a zoo – welcome news for his daughter, but his son is not happy about it. The zoo is in need of renovation and Benjamin sets about the work with the head keeper and the rest of the staff, but, the zoo soon runs into financial trouble.",6.816,2820,"['Drama', 'Comedy', 'Family']",5.0
92264,One for the Money (2012),Action|Comedy|Crime,1598828,54054.0,"An unemployed lingerie buyer convinces her bail bondsman cousin to give her a shot as a bounty hunter. Her first assignment is to track down a former cop on the run for murder – the same man who broke her heart years before. With the help of some friends and the best bounty hunter in the business, she slowly learns what it takes to be a true bounty hunter.",5.555,981,"['Action', 'Comedy', 'Crime']",5.0
93272,Dr. Seuss' The Lorax (2012),Animation|Fantasy|Musical|IMAX,1482459,73723.0,"A 12-year-old boy searches for the one thing that will enable him to win the affection of the girl of his dreams. To find it he must discover the story of the Lorax, the grumpy yet charming creature who fights to protect his world.",6.511,3733,"['Animation', 'Family']",5.0
93510,21 Jump Street (2012),Action|Comedy|Crime,1232829,64688.0,"When cops Schmidt and Jenko join the secret Jump Street unit, they use their youthful appearances to go undercover as high school students. They trade in their guns and badges for backpacks, and set out to shut down a dangerous drug ring. But, as time goes on, Schmidt and Jenko discover that high school is nothing like it was just a few years earlier -- and, what's more, they must again confront the teenage terror and anxiety they thought they had left behind.",6.883,10621,"['Action', 'Comedy', 'Crime']",5.0
93980,"Three Stooges, The (2012)",Comedy,383010,76489.0,"Left on the doorstep of an orphanage run by nuns, three newborn knuckleheads grow up to be finger-poking, nyuk-nyuking janitors named Larry, Curly and Moe. When they learn that financial problems will soon force the only home they've ever known to close, the trio sets out to raise $830,000 in one month. Out in the world for the very first time, the three innocent bumblers become embroiled in a murder plot and find stardom on a TV reality show.",5.813,614,['Comedy'],5.0
94325,"Lucky One, The (2012)",Drama,1327194,77877.0,A Marine travels to Louisiana after serving three tours in Iraq and searches for the unknown woman he believes was his good luck charm during the war.,7.2,3743,"['Drama', 'Romance']",5.0
95167,Brave (2012),Action|Adventure|Animation|Children,1217209,62177.0,"In the mystical Scottish Highlands, Merida is the princess of a kingdom ruled by King Fergus and Queen Elinor. An unruly daughter and an accomplished archer, Merida one day defies a sacred custom of the land and inadvertently brings turmoil to the kingdom. In an attempt to set things right, Merida seeks out an eccentric old Wise Woman and is granted an ill-fated wish. Also figuring into Merida's quest — and serving as comic relief — are the kingdom's three lords: the enormous Lord MacGuffin, the surly Lord Macintosh, and the disagreeable Lord Dingwall.",7.022,13771,"['Animation', 'Adventure', 'Comedy', 'Family', 'Action', 'Fantasy']",5.0
96079,Skyfall (2012),Action|Adventure|Thriller|IMAX,1074638,37724.0,"When Bond's latest assignment goes gravely wrong, agents around the world are exposed and MI6 headquarters is attacked. While M faces challenges to her authority and position from Gareth Mallory, the new Chairman of the Intelligence and Security Committee, it's up to Bond, aided only by field agent Eve, to locate the mastermind behind the attack.",7.254,15625,"['Action', 'Adventure', 'Thriller']",5.0
96281,ParaNorman (2012),Adventure|Animation|Comedy,1623288,77174.0,"In the town of Blithe Hollow, Norman Babcock can speak to the dead, but no one other than his eccentric new friend believes his ability is real. One day, Norman's eccentric uncle tells him of a ritual he must perform to protect the town from a curse cast by a witch centuries ago.",7.006,2636,"['Family', 'Animation', 'Adventure', 'Comedy']",5.0
96588,Pitch Perfect (2012),Comedy|Musical,1981677,114150.0,"College student Beca knows she does not want to be part of a clique, but that's exactly where she finds herself after arriving at her new school. Thrust in among mean gals, nice gals and just plain weird gals, Beca finds that the only thing they have in common is how well they sing together. She takes the women of the group out of their comfort zone of traditional arrangements and into a world of amazing harmonic combinations in a fight to the top of college music competitions.",7.28,6699,"['Comedy', 'Music', 'Romance']",5.0
96849,Sparkle (2012),Drama|Musical,1876451,88036.0,"Musical prodigy, Sparkle struggles to become a star while overcoming issues that are tearing her family apart. From an affluent Detroit area and daughter to a single mother, she tries to balance a new romance with music manager Stix while dealing with the unexpected challenges her new life will bring as she and her two sisters strive to become a dynamic singing group during the Motown-era.",6.2,119,"['Music', 'Drama', 'Romance']",5.0
97172,Frankenweenie (2012),Animation|Comedy|Horror|IMAX,1142977,62214.0,"When a car hits young Victor's pet dog Sparky, Victor decides to bring him back to life the only way he knows how. But when the bolt-necked ""monster"" wreaks havoc and terror in the hearts of Victor's neighbors, he has to convince them that Sparky's still the good, loyal friend he was.",7.002,3469,"['Animation', 'Comedy', 'Family']",5.0
98243,Rise of the Guardians (2012),Adventure|Animation|Children|Fantasy|IMAX,1446192,81188.0,"When an evil spirit known as Pitch lays down the gauntlet to take over the world, the immortal Guardians must join forces for the first time to protect the hopes, beliefs and imagination of children all over the world.",7.371,6932,"['Animation', 'Family', 'Fantasy']",5.0
99415,Parental Guidance (2012),Comedy,1047540,88042.0,Artie and Diane agree to look after their three grandkids when their type-A helicopter parents need to leave town for work. Problems arise when the kids' 21st-century behavior collides with Artie and Diane's old-school methods.,6.0,468,['Comedy'],5.0
100390,Identity Thief (2013),Comedy|Crime,2024432,109431.0,"When a mild-mannered businessman learns his identity has been stolen, he hits the road in an attempt to foil the thief -- a trip that puts him in the path of a deceptively harmless-looking woman.",5.854,3397,"['Comedy', 'Crime']",5.0
101142,"Croods, The (2013)",Adventure|Animation|Comedy,481499,49519.0,"The prehistoric Croods family live in a particularly dangerous moment in time. Patriarch Grug, his mate Ugga, teenage daughter Eep, son Thunk, and feisty Gran gather food by day and huddle together in a cave at night. When a more evolved caveman named Guy arrives on the scene, Grug is distrustful, but it soon becomes apparent that Guy is correct about the impending destruction of their world.",6.926,7302,"['Animation', 'Adventure', 'Family', 'Fantasy', 'Comedy', 'Action']",5.0
101258,Radio Rebel (2010),Drama,2008633,89185.0,"High school senior Tara is so painfully shy that she dreads speaking to anyone in the hallways or getting called on in class. But in the privacy of her bedroom with her iPod in hand, she rocks out -- doing mock broadcasts for Miami's hottest FM radio station, which happens to be owned by her stepfather. When a slot opens up at The SLAM, Tara surprises herself by blossoming behind the mike into confident, ""Radio Rebel"" -- and to everyone's shock, she's a hit!",6.17,828,"['Comedy', 'Drama', 'Family', 'TV Movie', 'Music']",5.0
101260,StarStruck (2010),Comedy|Musical,1579247,35558.0,"Pop star Christopher Wilde has fame, fortune and a big-budget Hollywood movie awaiting him. But after meeting Jessica Olson, a down-to-earth girl from the Midwest, he is faced with following his heart or doing what's best for his career.",7.032,1210,"['Romance', 'Comedy', 'TV Movie', 'Music']",5.0
103141,Monsters University (2013),Adventure|Animation|Comedy,1453405,62211.0,A look at the relationship between Mike and Sulley during their days at Monsters University — when they weren't necessarily the best of friends.,7.042,10981,"['Animation', 'Family']",5.0
103335,Despicable Me 2 (2013),Animation|Children|Comedy|IMAX,1690953,93456.0,Gru is recruited by the Anti-Villain League to help deal with a powerful new super criminal.,6.935,11649,"['Animation', 'Comedy', 'Family']",5.0
103755,Turbo (2013),Adventure|Animation|Children|Comedy|Fantasy,1860353,77950.0,The tale of an ordinary garden snail who dreams of winning the Indy 500.,6.266,3551,"['Animation', 'Family']",5.0
104074,Percy Jackson: Sea of Monsters (2013),Adventure|Children|Fantasy,1854564,76285.0,"In their quest to confront the ultimate evil, Percy and his friends battle swarms of mythical creatures to find the mythical Golden Fleece and to stop an ancient evil from rising.",6.023,5237,"['Adventure', 'Family', 'Fantasy']",5.0
104211,We're the Millers (2013),Comedy|Crime,1723121,138832.0,A veteran pot dealer creates a fake family as part of his plan to move a huge shipment of weed into the U.S. from Mexico.,6.837,9163,"['Comedy', 'Crime']",5.0
104218,Grown Ups 2 (2013),Comedy,2191701,109418.0,"Lenny has relocated his family back to the small town where he and his friends grew up. This time around, the grown ups are the ones learning lessons from their kids on a day notoriously full of surprises—the last day of school.",6.147,4505,['Comedy'],5.0
104374,About Time (2013),Drama|Fantasy|Romance,2194499,122906.0,"The night after another unsatisfactory New Year's party, Tim's father tells his son that the men in his family have always had the ability to travel through time. They can't change history, but they can change what happens and has happened in their own lives. Thus begins the start of a lesson in learning to appreciate life itself as it is, as it comes, and most importantly, the people living alongside us.",7.9,8889,"['Drama', 'Romance', 'Fantasy']",5.0
106540,Delivery Man (2013),Comedy,2387559,146239.0,An affable underachiever finds out he's fathered 533 children through anonymous donations to a fertility clinic 20 years ago. Now he must decide whether or not to come forward when 142 of them file a lawsuit to reveal his identity.,6.2,1525,['Comedy'],5.0
106696,Frozen (2013),Adventure|Animation|Comedy|Fantasy|Musical|Romance,2294629,109445.0,"Young princess Anna of Arendelle dreams about finding true love at her sister Elsa’s coronation. Fate takes her on a dangerous journey in an attempt to end the eternal winter that has fallen over the kingdom. She's accompanied by ice delivery man Kristoff, his reindeer Sven, and snowman Olaf. On an adventure where she will find out what friendship, courage, family, and true love really means.",7.248,17084,"['Animation', 'Family', 'Adventure', 'Fantasy']",5.0
107348,Anchorman 2: The Legend Continues (2013),Comedy,1229340,109443.0,"With the 70s behind him, San Diego's top rated newsman, Ron Burgundy, returns to take New York's first 24-hour news channel by storm.",6.133,2684,['Comedy'],5.0
108932,The Lego Movie (2014),Action|Adventure|Animation|Children|Comedy|Fantasy,1490017,137106.0,"An ordinary Lego mini-figure, mistakenly thought to be the extraordinary MasterBuilder, is recruited to join a quest to stop an evil Lego tyrant from conquering the universe.",7.421,8145,"['Animation', 'Family', 'Adventure', 'Comedy', 'Fantasy']",5.0
110102,Captain America: The Winter Soldier (2014),Action|Adventure|Sci-Fi|IMAX,1843866,100402.0,"After the cataclysmic events in New York with The Avengers, Steve Rogers, aka Captain America is living quietly in Washington, D.C. and trying to adjust to the modern world. But when a S.H.I.E.L.D. colleague comes under attack, Steve becomes embroiled in a web of intrigue that threatens to put the world at risk. Joining forces with the Black Widow, Captain America struggles to expose the ever-widening conspiracy while fighting off professional assassins sent to silence him at every turn. When the full scope of the villainous plot is revealed, Captain America and the Black Widow enlist the help of a new ally, the Falcon. However, they soon find themselves up against an unexpected and formidable enemy—the Winter Soldier.",7.654,19424,"['Action', 'Adventure', 'Science Fiction']",5.0
110130,"Nut Job, The (2014)",Adventure|Animation|Children|Comedy,1821658,227783.0,"Surly, a curmudgeon, independent squirrel is banished from his park and forced to survive in the city. Lucky for him, he stumbles on the one thing that may be able to save his life, and the rest of park community, as they gear up for winter - Maury's Nut Store.",5.854,1004,"['Animation', 'Comedy', 'Family', 'Adventure']",5.0
110297,Muppets Most Wanted (2014),Adventure|Comedy|Crime,2281587,145220.0,"While on a grand world tour, The Muppets find themselves wrapped into an European jewel-heist caper headed by a Kermit the Frog look-alike and his dastardly sidekick.",6.3,867,"['Comedy', 'Adventure', 'Crime', 'Family']",5.0
110771,"Other Woman, The (2014)",Comedy|Romance,2203939,193610.0,"After discovering her boyfriend is married, Carly soon meets the wife he's been cheating on. And when yet another affair is discovered, all three women team up to plot mutual revenge on the three-timing SOB.",6.432,3633,"['Comedy', 'Romance']",5.0
111617,Blended (2014),Comedy,1086772,232672.0,"Recently divorced mom Lauren and widowed dad Jim let their friends push them into a blind date, which goes disastrously wrong. Unsurprisingly, neither wants to see the other ever again. However, fate intervenes when both Jim and Lauren, unbeknownst to each other, purchase one-half of the same vacation package at a South African resort for families, during spring break. They and their children are forced to share the same romantic suite and participate in a slew of family activities together.",6.893,3673,"['Comedy', 'Romance']",5.0
111622,Begin Again (2013),Comedy|Romance,1980929,198277.0,"Gretta, a budding songwriter, finds herself alone after her boyfriend Dave ditches her. Her life gains purpose when Dan, a record label executive, notices her talent.",7.2,3873,"['Comedy', 'Music', 'Romance', 'Drama']",4.5
111921,The Fault in Our Stars (2014),Drama|Romance,2582846,222935.0,"Despite the tumor-shrinking medical miracle that has bought her a few years, Hazel has never been anything but terminal, her final chapter inscribed upon diagnosis. But when a patient named Augustus Waters suddenly appears at Cancer Kid Support Group, Hazel's story is about to be completely rewritten.",7.6,11361,"['Romance', 'Drama']",5.0
112138,22 Jump Street (2014),Action|Comedy|Crime,2294449,187017.0,"After making their way through high school (twice), big changes are in store for officers Schmidt and Jenko when they go deep undercover at a local college. But when Jenko meets a kindred spirit on the football team, and Schmidt infiltrates the bohemian art major scene, they begin to question their partnership. Now they don't have to just crack the case - they have to figure out if they can have a mature relationship. If these two overgrown adolescents can grow from freshmen into real men, college might be the best thing that ever happened to them.",6.8,8203,"['Crime', 'Comedy', 'Action']",5.0
112175,How to Train Your Dragon 2 (2014),Action|Adventure|Animation,1646971,82702.0,"Five years have passed since Hiccup and Toothless united the dragons and Vikings of Berk. Now, they spend their time charting unmapped territories. During one of their adventures, the pair discover a secret cave that houses hundreds of wild dragons -- and a mysterious dragon rider. Hiccup and Toothless find themselves at the center of a battle to protect Berk from a power-hungry warrior.",7.675,10057,"['Fantasy', 'Action', 'Adventure', 'Animation', 'Comedy', 'Family']",5.0
112552,Whiplash (2014),Drama,2582802,244786.0,"Under the direction of a ruthless instructor, a talented young drummer begins to pursue perfection at any cost, even his humanity.",8.376,15932,"['Drama', 'Music']",5.0
113275,The Hundred-Foot Journey (2014),Comedy|Drama,2980648,228194.0,A story centered around an Indian family who moves to France and opens a restaurant across the street from a Michelin-starred French restaurant.,7.3,1478,"['Drama', 'Comedy']",5.0
114329,What We Did on Our Holiday (2014),Comedy,2725962,276843.0,"Doug and Abi  and their three children travel to the Scottish Highlands for Doug's father Gordie's birthday party. It's soon clear that when it comes to keeping a secret under wraps from the rest of the family, their children are their biggest liability...",6.718,543,['Comedy'],5.0
115147,The Best of Me (2014),Drama|Romance,1972779,239571.0,A pair of former high school sweethearts reunite after many years when they return to visit their small hometown.,7.468,2631,"['Drama', 'Romance']",5.0
115231,St. Vincent (2014),Comedy,2170593,239563.0,"A young boy whose parents just divorced finds an unlikely friend and mentor in the misanthropic, bawdy, hedonistic, war veteran who lives next door.",7.117,1971,['Comedy'],5.0
115381,"Alexander and the Terrible, Horrible, No Good, Very Bad Day (2014)",Comedy,1698641,218778.0,"Alexander's day begins with gum stuck in his hair, followed by more calamities. Though he finds little sympathy from his family and begins to wonder if bad things only happen to him, his mom, dad, brother, and sister all find themselves living through their own terrible, horrible, no good, very bad day.",6.2,1378,"['Family', 'Comedy']",5.0
115617,Big Hero 6 (2014),Action|Animation|Comedy,2245084,177572.0,"A special bond develops between plus-sized inflatable robot Baymax, and prodigy Hiro Hamada, who team up with a group of friends to form a band of high-tech heroes.",7.727,16104,"['Adventure', 'Family', 'Animation', 'Action', 'Comedy']",5.0
115664,The Book of Life (2014),Adventure|Animation|Romance,2262227,228326.0,"The journey of Manolo, a young man who is torn between fulfilling the expectations of his family and following his heart. Before choosing which path to follow, he embarks on an incredible adventure that spans three fantastical worlds where he must face his greatest fears.",7.5,2816,"['Animation', 'Adventure', 'Comedy', 'Family', 'Fantasy']",5.0
115667,"Love, Rosie (2014)",Comedy|Romance,1638002,200727.0,"Since the moment they met at age 5, Rosie and Alex have been best friends, facing the highs and lows of growing up side by side. A fleeting shared moment, one missed opportunity, and the decisions that follow send their lives in completely different directions. As each navigates the complexities of life, love, and everything in between, they always find their way back to each other - but is it just friendship, or something more?",7.8,6364,"['Romance', 'Drama', 'Comedy']",5.0
117136,One Chance (2013),Comedy|Drama,1196956,209361.0,"This film follows the remarkable and inspirational true story of Paul Potts, a shy, bullied shop assistant by day and an amateur opera singer by night.",6.7,304,"['Drama', 'Comedy', 'Music']",5.0
118097,Nativity 2: Danger in the Manger! (2012),Children|Comedy,2089750,139380.0,"This sequel to the popular British comedy sees a new teacher (David Tennant) take over. When he enters his school in the National 'Song for Christmas' Competition, he and his pregnant wife, and the schoolchildren, embark on an epic road trip that ends up with a birth and a donkey, where he must embrace his fears and become a hero.",5.4,106,"['Comedy', 'Family']",5.0
118997,Into the Woods (2014),Children|Comedy|Fantasy|Musical,2180411,224141.0,"In a woods filled with magic and fairy tale characters, a baker and his wife set out to end the curse put on them by their neighbor, a spiteful witch.",5.757,4324,"['Fantasy', 'Comedy']",5.0
119190,Walking on Sunshine (2014),Musical|Romance,2107861,267863.0,"Set to the music of popular hit songs from the 1980s. A beautiful coastal village, present day Italy. After a whirlwind romance, Maddie is preparing to marry gorgeous Italian Raf, and has invited her sister Taylor to the wedding. Unbeknownst to Maddie, however, Raf is Taylor's ex-holiday flame, and the love of her life...",6.243,257,"['Comedy', 'Romance']",5.0
120132,Annie (2014),Children|Comedy|Drama|Musical,1823664,196867.0,"Annie is a young, happy foster kid who's also tough enough to make her way on the streets of New York in 2014. Originally left by her parents as a baby with the promise that they'd be back for her someday, it's been a hard knock life ever since with her mean foster mom Miss Hannigan. But everything's about to change when the hard-nosed tycoon and New York mayoral candidate Will Stacks—advised by his brilliant VP and his shrewd and scheming campaign advisor—makes a thinly-veiled campaign move and takes her in. Stacks believes he's her guardian angel, but Annie's self-assured nature and bright, sun-will-come-out-tomorrow outlook on life just might mean it's the other way around.",6.2,1322,"['Comedy', 'Drama', 'Family']",5.0
122892,Avengers: Age of Ultron (2015),Action|Adventure|Sci-Fi,2395427,99861.0,"When Tony Stark tries to jumpstart a dormant peacekeeping program, things go awry and Earth’s Mightiest Heroes are put to the ultimate test as the fate of the planet hangs in the balance. As the villainous Ultron emerges, it is up to The Avengers to stop him from enacting his terrible plans, and soon uneasy alliances and unexpected action pave the way for an epic and unique global adventure.",7.271,23738,"['Action', 'Adventure', 'Science Fiction']",5.0
122906,Black Panther (2017),Action|Adventure|Sci-Fi,1825683,284054.0,"King T'Challa returns home to the reclusive, technologically advanced African nation of Wakanda to serve as his country's new leader. However, T'Challa soon finds that he is challenged for the throne by factions within his own country as well as without. Using powers reserved to Wakandan kings, T'Challa assumes the Black Panther mantle to join with ex-girlfriend Nakia, the queen-mother, his princess-kid sister, members of the Dora Milaje (the Wakandan 'special forces') and an American secret agent, to prevent Wakanda from being dragged into a world war.",7.369,22830,"['Action', 'Adventure', 'Science Fiction']",5.0
122912,Avengers: Infinity War - Part I (2018),Action|Adventure|Sci-Fi,4154756,299536.0,"As the Avengers and their allies have continued to protect the world from threats too large for any one hero to handle, a new danger has emerged from the cosmic shadows: Thanos. A despot of intergalactic infamy, his goal is to collect all six Infinity Stones, artifacts of unimaginable power, and use them to inflict his twisted will on all of reality. Everything the Avengers have fought for has led up to this moment - the fate of Earth and existence itself has never been more uncertain.",8.236,30975,"['Adventure', 'Action', 'Science Fiction']",5.0
122914,Avengers: Infinity War - Part II (2019),Action|Adventure|Sci-Fi,4154796,299534.0,"After the devastating events of Avengers: Infinity War, the universe is in ruins due to the efforts of the Mad Titan, Thanos. With the help of remaining allies, the Avengers must assemble once more in order to undo Thanos' actions and restore order to the universe once and for all, no matter what consequences may be in store.",8.238,26763,"['Adventure', 'Science Fiction', 'Action']",5.0
122920,Captain America: Civil War (2016),Action|Sci-Fi|Thriller,3498820,271110.0,"Following the events of Age of Ultron, the collective governments of the world pass an act designed to regulate all superhuman activity. This polarizes opinion amongst the Avengers, causing two factions to side with Iron Man or Captain America, which causes an epic battle between former allies.",7.447,23423,"['Adventure', 'Action', 'Science Fiction']",5.0
128169,Beethoven's 3rd (2000),Children|Comedy,206588,24476.0,"Everyone's favorite St. Bernard returns in this family film about man's best friend. Richard Newton, his wife Beth and kids Brennan and Sara shove off in their camper for a road trip. Along the way, they gain a new passenger: slobbery Beethoven. The Newtons plan to return Beethoven to his owner -- but not before he turns hero when a pair of thieves enter the picture.",5.2,364,"['Family', 'Comedy']",5.0
130073,Cinderella (2015),Children|Drama|Fantasy|Romance,1661199,150689.0,"When her father unexpectedly passes away, young Ella finds herself at the mercy of her cruel stepmother and her daughters. Never one to give up hope, Ella's fortunes begin to change after meeting a dashing stranger in the woods.",6.825,7226,"['Romance', 'Fantasy', 'Family', 'Drama']",5.0
