movieId,title,genres,imdbId,tmdbId,overview,tmdb_vote_average,tmdb_vote_count,tmdb_genres,rating
55955,Fred Claus (2007),Children|Comedy|Fantasy,486583,5375.0,"Fred Claus and Santa Claus have been estranged brothers for many years. Now Fred must reconcile his differences with his brother whom he believes overshadows him. When an efficiency expert assesses the workings at the North Pole and threatens to shut Santa down, Fred must help his brother to save Christmas.",5.839,874,"['Action', 'Comedy', 'Drama']",0.5
56156,Hitman (2007),Action|Crime|Thriller,465494,1620.0,"A genetically engineered assassin with deadly aim, known only as ""Agent 47"" eliminates strategic targets for a top-secret organization. But when he's double-crossed, the hunter becomes the prey as 47 finds himself in a life-or-death game of international intrigue.",6.143,3491,"['Action', 'Thriller', 'Drama']",4.0
56775,National Treasure: Book of Secrets (2007),Action|Adventure,465234,6637.0,"Benjamin Franklin Gates and Abigail Chase re-team with Riley Poole and, now armed with a stack of long-lost pages from John Wilkes Booth's diary, Ben must follow a clue left there to prove his ancestor's innocence in the assassination of Abraham Lincoln.",6.367,5332,"['Action', 'Adventure', 'Mystery', 'Thriller']",4.5
56805,Walk Hard: The Dewey Cox Story (2007),Comedy|Musical,841046,6575.0,"Following a childhood tragedy, Dewey Cox follows a long and winding road to music stardom. Dewey perseveres through changing musical styles, an addiction to nearly every drug known and bouts of uncontrollable rage.",6.596,706,"['Comedy', 'Music']",4.0
57526,Untraceable (2008),Crime|Thriller,880578,8090.0,"Special Agent Jennifer Marsh works in an elite division of the FBI dedicated to fighting cybercrime. She thinks she has seen it all, until a particularly sadistic criminal arises on the Internet. This tech-savvy killer posts live feeds of his crimes on his website; the more hits the site gets, the faster the victim dies. Marsh and her team must find the elusive killer before time runs out.",6.203,934,"['Thriller', 'Crime', 'Mystery', 'Drama', 'Horror']",2.5
57528,Rambo (Rambo 4) (2008),Action|Drama|Thriller|War,462499,7555.0,"In Thailand, ex-Green Beret John James Rambo joins a group of mercenaries to venture into war-torn neighboring Myanmar to rescue a group of Christian aid workers who have been kidnapped by a ruthless local infantry unit.",6.687,4087,"['Action', 'Thriller', 'War']",4.0
57865,Wedding Daze (2006),Comedy|Romance,484877,7839.0,"After losing the woman of his dreams, Anderson is convinced he'll never fall in love again. But at the urging of his best friend, he spontaneously proposes to a dissatisfied waitress named Katie and an innocent dare evolves into the kind of love that both have been looking for all along.",5.553,385,"['Comedy', 'Romance']",0.5
58047,"Definitely, Maybe (2008)",Comedy|Drama|Romance,832266,8390.0,"When Will decides to tell his daughter the story of how he met her mother, he discovers that a second look at the past might also give him a second chance at the future.",6.947,2526,"['Comedy', 'Romance']",4.0
58105,"Spiderwick Chronicles, The (2008)",Adventure|Children|Drama|Fantasy|IMAX,416236,8204.0,"Upon moving into the run-down Spiderwick Estate with their mother, twin brothers Jared and Simon Grace, along with their sister Mallory, find themselves pulled into an alternate world full of faeries and other creatures.",6.666,2740,"['Family', 'Adventure', 'Fantasy', 'Drama']",3.0
58156,Semi-Pro (2008),Comedy,839980,13260.0,"Jackie Moon is the owner, promoter, coach, and star player of the Flint Michigan Tropics of the American Basketball Association (ABA), the worst team in the league. In 1976 before the ABA collapses, the NBA plans to merge with the best teams of the ABA at the end of the season. Only the top four teams will make the move and the worst teams will fold. If the Tropics want to make it to the NBA, Jackie Moon must rally his team and start winning.",5.637,832,['Comedy'],2.5
58627,Never Back Down (2008),Action,1023111,8456.0,"Jake, full of anger after his father's death, is just starting to find a place for himself at his new Orlando high school - until Ryan, head of an underground MMA fight club, picks Jake out as a prime opponent. After being trounced by Ryan in front of the entire school, Jake begins training under the firm, moral guidance of a MMA master, where he learns how to fight... and how to avoid a fight. But it becomes obvious that a rematch will be inevitable if Jake wants to stop Ryan and his bullying, once and for all.",6.779,2388,"['Drama', 'Action']",0.5
58803,21 (2008),Crime|Drama|Romance|Thriller,478087,8065.0,"Ben Campbell is a young, highly intelligent student at M.I.T. who strives to succeed. Wanting a scholarship to transfer to Harvard School of Medicine to become a doctor, Ben learns that he cannot afford the $300,000 tuition as he comes from a poor, working-class background. But one evening, Ben is introduced by his unorthodox math professor to a small but secretive club of five students, Jill, Choi, Kianna, and Fisher, who are being trained by Professor Rosa to count cards at blackjack.",6.692,4842,"['Drama', 'Crime']",3.5
58998,Forgetting Sarah Marshall (2008),Comedy|Romance,800039,9870.0,"When actress Sarah Marshall dumps aspiring musician Peter Bretter for rock star Aldous Snow, Peter's world comes crashing down. His best friend Brian suggests that Peter should get away from everything and to fly off to Hawaii to escape all his problems. After arriving in Hawaii and meeting the beautiful receptionist Rachel Jansen, Peter is shocked to see not only Aldous in Hawaii, but also Sarah.",6.502,3532,"['Comedy', 'Romance', 'Drama']",1.5
59014,Superhero Movie (2008),Action|Comedy|Sci-Fi,426592,11918.0,"Rick Riker is a nerdy teen imbued with superpowers by a radioactive dragonfly. And because every hero needs a nemesis, enter Lou Landers, aka the villainously goofy Hourglass.",5.283,1919,"['Comedy', 'Action', 'Science Fiction']",3.0
59022,Harold & Kumar Escape from Guantanamo Bay (2008),Adventure|Comedy,481536,13335.0,"Having satisfied their urge for White Castle, Harold and Kumar jump on a plane to catch up with Harold's love interest, who's headed for the Netherlands. But the pair must change their plans when Kumar is accused of being a terrorist. Rob Corddry also stars in this wild comedy sequel that follows the hapless stoners' misadventures as they try to avoid being captured by the Department of Homeland Security.",6.303,1538,"['Comedy', 'Adventure']",2.0
59141,Son of Rambow (2007),Children|Comedy|Drama,845046,13258.0,"Will is looking for an escape from his family when he encounters Lee, the school bully. Armed with a video camera and a copy of Rambo, Lee plans to make his own action-packed video epic.",6.714,467,['Comedy'],3.0
59369,Taken (2008),Action|Crime|Drama|Thriller,936501,8681.0,"Bryan Mills, a former government operative, is trying to reconnect with his teenage daughter Kim. After reluctantly agreeing with his ex-wife to let Kim go to Paris on vacation with a friend, his worst nightmare comes true. While on the phone with his daughter shortly after she arrives in Paris, she and her friend are abducted by a gang of human traffickers. Working against the clock, Bryan relies on his extensive training and skills to track down the ruthless gang that abducted her and launch a one-man war to rescue his daughter.",7.398,11665,"['Action', 'Thriller']",4.0
59421,What Happens in Vegas... (2008),Comedy|Romance,1033643,9029.0,"During a wild vacation in Las Vegas, career woman Joy McNally and playboy Jack Fuller come to the sober realization that they have married each other after a night of drunken abandon. They are then compelled, for legal reasons, to live life as a couple for a limited period of time. At stake is a large amount of money.",6.112,3156,"['Comedy', 'Romance']",3.5
59784,Kung Fu Panda (2008),Action|Animation|Children|Comedy|IMAX,441773,9502.0,"When the Valley of Peace is threatened, lazy Po the panda discovers his destiny as the ""chosen one"" and trains to become a kung fu hero, but transforming the unsleek slacker into a brave warrior won't be easy. It's up to Master Shifu and the Furious Five -- Tigress, Crane, Mantis, Viper and Monkey -- to give it a try.",7.306,12125,"['Animation', 'Family', 'Comedy', 'Action', 'Adventure']",1.0
59908,"Promotion, The (2008)",Comedy,803057,13172.0,Two assistant managers of a corporate grocery store vie for a coveted promotion.,5.3,255,['Comedy'],0.5
60037,"Happening, The (2008)",Drama|Sci-Fi|Thriller,949731,8645.0,"When a deadly airborne virus threatens to wipe out the northeastern United States, teacher Elliot Moore and his wife Alma flee from contaminated cities into the countryside in a fight to discover the truth. Is it terrorism, the accidental release of some toxic military bio weapon -- or something even more sinister?",5.395,3776,"['Thriller', 'Science Fiction']",0.5
60040,"Incredible Hulk, The (2008)",Action|Sci-Fi,800080,1724.0,"Scientist Bruce Banner scours the planet for an antidote to the unbridled force of rage within him: the Hulk. But when the military masterminds who dream of exploiting his powers force him back to civilization, he finds himself coming face to face with a new, deadly foe.",6.225,12259,"['Science Fiction', 'Action', 'Adventure']",3.5
60069,WALL·E (2008),Adventure|Animation|Children|Romance|Sci-Fi,910970,10681.0,"What if mankind had to leave Earth and somebody forgot to turn the last robot off? After hundreds of years doing what he was built for, WALL•E discovers a new purpose in life when he meets a sleek search robot named EVE. EVE comes to realize that WALL•E has inadvertently stumbled upon the key to the planet's future, and races back to space to report to the humans. Meanwhile, WALL•E chases EVE across the galaxy and sets into motion one of the most imaginative adventures ever brought to the big screen.",8.103,19534,"['Animation', 'Family', 'Science Fiction']",1.0
60072,Wanted (2008),Action|Thriller,493464,8909.0,"Doormat Wesley Gibson is an office worker whose life is going nowhere. He meets an attractive woman named Fox and discovers that his recently murdered father - whom Wesley never knew - belonged to the Fraternity, a secret society of assassins which takes its orders from Fate itself. Fox and Sloan, the Fraternity's leader, teach Wesley, through intense training, to tap into dormant powers and hone his innate killing skills. Though he enjoys his newfound abilities, he begins to suspect that there is more to the Fraternity than meets the eye.",6.524,7307,"['Action', 'Thriller', 'Crime']",2.0
60074,Hancock (2008),Action|Adventure|Comedy|Crime|Fantasy,448157,8960.0,"Hancock is a down-and-out superhero who's forced to employ a PR expert to help repair his image when the public grows weary of all the damage he's inflicted during his lifesaving heroics. The agent's idea of imprisoning the antihero to make the world miss him proves successful, but will Hancock stick to his new sense of purpose or slip back into old habits?",6.349,9909,"['Fantasy', 'Action']",2.0
60126,Get Smart (2008),Action|Comedy,425061,11665.0,"When members of the nefarious crime syndicate KAOS attack the U.S. spy agency Control and the identities of secret agents are compromised, the Chief has to promote hapless but eager analyst Maxwell Smart to field agent. He is partnered with veteran and capable Agent 99, the only spy whose cover remains intact. Can they work together to thwart the evil world-domination plans of KAOS and its crafty operative?",6.202,3705,"['Action', 'Comedy', 'Thriller']",2.0
60756,Step Brothers (2008),Comedy,838283,12133.0,"Brennan Huff and Dale Doback might be grown men. But that doesn't stop them from living at home and turning into jealous, competitive stepbrothers when their single parents marry. Brennan's constant competition with Dale strains his mom's marriage to Dale's dad, leaving everyone to wonder whether they'll ever see eye to eye.",6.556,3240,['Comedy'],3.5
60760,"X-Files: I Want to Believe, The (2008)",Drama|Mystery|Sci-Fi|Thriller,443701,8836.0,Mulder and Scully are called back to duty by the FBI when a former priest claims to be receiving psychic visions pertaining to a kidnapped agent.,5.836,1558,"['Mystery', 'Science Fiction', 'Thriller']",1.0
61024,Pineapple Express (2008),Action|Comedy|Crime,910936,10189.0,A stoner and his dealer are forced to go on the run from the police after the pothead witnesses a cop commit a murder.,6.641,3992,"['Action', 'Comedy', 'Crime']",1.0
61132,Tropic Thunder (2008),Action|Adventure|Comedy|War,942385,7446.0,"A group of self-absorbed actors set out to make the most expensive war film ever. After ballooning costs force the studio to cancel the movie, the frustrated director refuses to stop shooting, leading his cast into the jungles of Southeast Asia, where they encounter real bad guys.",6.696,6586,"['Action', 'Comedy', 'Adventure', 'War']",4.0
61465,Bangkok Dangerous (2008),Action|Crime|Thriller,814022,13184.0,"When carrying out a hit, assassin Joe always makes use of the knowledge of the local population. On arriving in Bangkok, Joe meets street kid Kong and he becomes his primary aide. But when Kong is nearly killed, he asks Joe to train him up in the deadly arts and unwittingly becomes a target of a band of killers.",5.2,1045,"['Action', 'Crime', 'Thriller']",3.5
61705,Lakeview Terrace (2008),Drama|Thriller,947802,13279.0,"A young interracial couple has just moved into their California dream home when they become the target of their next-door neighbor, who disapproves of their relationship. A tightly wound LAPD officer has appointed himself the watchdog of the neighborhood. His nightly foot patrols and overly watchful eyes bring comfort to some, but he becomes increasingly aggressive to the newlyweds. These persistent intrusions into their lives cause the couple to fight back.",5.974,1101,"['Drama', 'Crime', 'Thriller']",3.0
61729,Ghost Town (2008),Comedy|Fantasy|Romance,995039,12797.0,"Bertram Pincus, a cranky, people-hating Manhattan dentist, develops the unwelcome ability to see dead people. Really annoying dead people. Even worse, they all want something from him, particularly Frank Herlihy, a smooth-talking ghost, who pesters him into a romantic scheme involving his widow Gwen. They are soon entangled in a hilarious predicament between the now and the hereafter!",6.532,1014,"['Drama', 'Comedy', 'Fantasy']",4.0
62081,Eagle Eye (2008),Action|Crime|Thriller|IMAX,1059786,13027.0,"Jerry Shaw and Rachel Holloman are two strangers whose lives are suddenly thrown into turmoil by a mysterious woman they have never met. Threatening their lives and family, the unseen caller uses everyday technology to control their actions and push them into increasing danger. As events escalate, Jerry and Rachel become the country's most-wanted fugitives and must figure out what is happening to them.",6.477,2966,"['Mystery', 'Thriller', 'Action']",2.5
62374,Body of Lies (2008),Action|Drama|Thriller,758774,12113.0,"The CIA’s hunt is on for the mastermind of a wave of terrorist attacks. Roger Ferris is the agency’s man on the ground, moving from place to place, scrambling to stay ahead of ever-shifting events. An eye in the sky – a satellite link – watches Ferris.  At the other end of that real-time link is the CIA’s Ed Hoffman, strategizing events from thousands of miles away. And as Ferris nears the target, he discovers trust can be just as dangerous as it is necessary for survival.",6.63,3162,"['Action', 'Drama', 'Thriller']",2.5
63131,Role Models (2008),Comedy,430922,15373.0,"Two salesmen trash a company truck on an energy drink-fueled bender. Upon their arrest, the court gives them a choice: do hard time or spend 150 service hours with a mentorship program. After one day with the kids, however, jail doesn't look half bad.",6.486,2003,['Comedy'],3.5
63479,Sex Drive (2008),Comedy,1135985,13523.0,A high school senior drives cross-country with his best friends to hook up with a babe he met online.,6.394,1414,"['Comedy', 'Adventure', 'Romance']",4.0
63540,Beverly Hills Chihuahua (2008),Adventure|Children|Comedy,1014775,14405.0,"A pampered Beverly Hills chihuahua named Chloe who, while on vacation in Mexico with her owner Viv's niece, Rachel, gets lost and must rely on her friends to help her get back home before she is caught by a dognapper who wants to ransom her.",5.384,1082,"['Comedy', 'Family', 'Adventure', 'Romance']",0.5
64032,Four Christmases (2008),Comedy,369436,12193.0,"Brad and Kate have made something of an art form out of avoiding their families during the holidays, but this year their foolproof plan is about go bust -- big time. Stuck at the city airport after all departing flights are canceled, the couple is embarrassed to see their ruse exposed to the world by an overzealous television reporter. Now, Brad and Kate are left with precious little choice other than to swallow their pride and suffer the rounds.",5.817,1185,"['Comedy', 'Romance', 'Drama']",3.0
64614,Gran Torino (2008),Crime|Drama,1205489,13223.0,"Disgruntled Korean War veteran Walt Kowalski sets out to reform his neighbor, Thao Lor, a Hmong teenager who tried to steal Kowalski's prized possession: a 1972 Gran Torino.",7.99,11121,['Drama'],4.5
64716,Seven Pounds (2008),Drama,814314,11321.0,An IRS agent with a fateful secret embarks on an extraordinary journey of redemption by forever changing the lives of seven strangers.,7.605,6985,['Drama'],1.0
64839,"Wrestler, The (2008)",Drama,1125849,12163.0,"Aging wrestler Randy ""The Ram"" Robinson is long past his prime but still ready and rarin' to go on the pro-wrestling circuit. After a particularly brutal beating, however, Randy hangs up his tights, pursues a serious relationship with a long-in-the-tooth stripper, and tries to reconnect with his estranged daughter. But he can't resist the lure of the ring and readies himself for a comeback.",7.533,3818,"['Drama', 'Romance']",3.0
64957,"Curious Case of Benjamin Button, The (2008)",Drama|Fantasy|Mystery|Romance,421715,4922.0,"Born under unusual circumstances, Benjamin Button springs into being as an elderly man in a New Orleans nursing home and ages in reverse. Twelve years after his birth, he meets Daisy, a child who flits in and out of his life as she grows up to be a dancer. Though he has all sorts of unusual adventures over the course of his life, it is his relationship with Daisy, and the hope that they will come together at the right time, that drives Benjamin forward.",7.595,13268,"['Drama', 'Fantasy', 'Romance']",0.5
64969,Yes Man (2008),Comedy,1068680,10201.0,"Carl Allen, a guy whose life is going nowhere, signs up for a self-help program based on one simple covenant: say yes to everything…and anything.",6.685,7088,"['Comedy', 'Romance']",3.5
66198,"International, The (2009)",Drama|Thriller,963178,4959.0,"An interpol agent and an attorney are determined to bring one of the world's most powerful banks to justice. Uncovering money laundering, arms trading, and conspiracy to destabilize world governments, their investigation takes them from Berlin, Milan, New York and Istanbul. Finding themselves in a chase across the globe, their relentless tenacity puts their own lives at risk.",6.3,1330,"['Action', 'Thriller', 'Drama', 'Crime', 'Adventure', 'Mystery']",1.0
66509,Funny People (2009),Comedy|Drama,1201167,20829.0,"Famous and wealthy funnyman George Simmons doesn't give much thought to how he treats people until a doctor delivers stunning health news, forcing George to reevaluate his priorities with a little help from aspiring stand-up comic Ira.",5.9,1349,"['Comedy', 'Drama']",0.5
67087,"I Love You, Man (2009)",Comedy,1155056,16538.0,"Peter Klaven is a successful real estate agent who, upon getting engaged to the woman of his dreams, Zooey, discovers, to his dismay and chagrin, that he has no male friend close enough to serve as his Best Man. Peter immediately sets out to rectify the situation, embarking on a series of bizarre and awkward ""man-dates.""",6.578,1816,"['Comedy', 'Romance']",4.0
67534,Big Stan (2007),Comedy,490086,13161.0,A weak con man panics when he learns he's going to prison for fraud. He hires a mysterious martial arts guru who helps transform him into a martial arts expert who can fight off inmates who want to hurt or love him.,6.591,966,"['Comedy', 'Crime']",2.5
67695,Observe and Report (2009),Action|Comedy,1197628,16991.0,"Mall security guard Ronnie Barnhardt is called into action to stop a flasher from turning shopper's paradise into his personal peep show. But when Barnhardt can't bring the culprit to justice, a surly police detective is recruited to close the case.",5.4,706,"['Comedy', 'Crime', 'Drama']",0.5
67788,Confessions of a Shopaholic (2009),Comedy|Romance,1093908,20048.0,"In the glamorous world of New York City, Rebecca Bloomwood is a fun-loving girl who is really good at shopping – a little too good, perhaps. She dreams of working for her favorite fashion magazine, but can't quite get her foot in the door – until ironically, she snags a job as an advice columnist for a financial magazine published by the same company.",6.486,2671,"['Comedy', 'Romance']",3.5
68157,Inglourious Basterds (2009),Action|Drama|War,361748,16869.0,"In Nazi-occupied France during World War II, a group of Jewish-American soldiers known as ""The Basterds"" are chosen specifically to spread fear throughout the Third Reich by scalping and brutally killing Nazis. The Basterds, lead by Lt. Aldo Raine soon cross paths with a French-Jewish teenage girl who runs a movie theater in Paris which is targeted by the soldiers.",8.215,23254,"['Drama', 'Thriller', 'War']",2.0
68205,Crank: High Voltage (2009),Action|Comedy|Crime,1121931,15092.0,Chelios faces a Chinese mobster who has stolen his nearly indestructible heart and replaced it with a battery-powered ticker that requires regular jolts of electricity to keep working.,6.083,2992,"['Action', 'Thriller', 'Crime']",4.5
68793,Night at the Museum: Battle of the Smithsonian (2009),Action|Comedy|IMAX,1078912,18360.0,"Hapless museum night watchman Larry Daley must help his living, breathing exhibit friends out of a pickle now that they've been transferred to the archives at the Smithsonian Institution. Larry's (mis)adventures this time include close encounters with Amelia Earhart, Abe Lincoln and Ivan the Terrible.",6.145,7054,"['Adventure', 'Fantasy', 'Action', 'Comedy', 'Family']",2.0
69122,"Hangover, The (2009)",Comedy|Crime,1119646,18785.0,"When three friends finally come to after a raucous night of bachelor-party revelry, they find a baby in the closet and a tiger in the bathroom. But they can't seem to locate their best friend, Doug – who's supposed to be tying the knot. Launching a frantic search for Doug, the trio perseveres through a nasty hangover to try to make it to the church on time.",7.328,17510,['Comedy'],4.0
69306,"Taking of Pelham 1 2 3, The (2009)",Crime|Drama|Thriller,1111422,18487.0,"Armed men hijack a New York City subway train, holding the passengers hostage in return for a ransom, and turning an ordinary day's work for dispatcher Walter Garber into a face-off with the mastermind behind the crime.",6.352,3243,"['Crime', 'Thriller', 'Action']",3.5
70159,Orphan (2009),Drama|Horror|Mystery|Thriller,1148204,21208.0,"After losing their baby, a married couple adopt 9-year old Esther, who may not be as innocent as she seems.",6.997,5440,"['Horror', 'Thriller']",3.0
70282,Aliens in the Attic (2009),Adventure|Children|Fantasy|Sci-Fi,775552,20856.0,A group of kids must protect their vacation home from invading aliens.,5.7,1023,"['Adventure', 'Comedy', 'Family', 'Fantasy', 'Science Fiction']",2.0
70286,District 9 (2009),Mystery|Sci-Fi|Thriller,1136608,17654.0,"Thirty years ago, aliens arrive on Earth. Not to conquer or give aid, but to find refuge from their dying planet. Separated from humans in a South African area called District 9, the aliens are managed by Multi-National United, which is unconcerned with the aliens' welfare but will do anything to master their advanced technology. When a company field agent contracts a mysterious virus that begins to alter his DNA, there is only one place he can hide: District 9.",7.455,9915,['Science Fiction'],3.0
70565,"Goods: Live Hard, Sell Hard, The (2009)",Comedy,1092633,19905.0,"Don Ready is many things, but he is best-known as an extraordinary salesman. When a car dealership in Temecula teeters on the brink of bankruptcy, he and his ragtag team dive in to save the day. But what Ready doesn't count on is falling in love and finding his soul.",5.4,230,['Comedy'],3.0
71252,"Final Destination, The (Final Destination 4) (Final Destination in 3-D, The) (2009)",Horror|Thriller,1144884,19912.0,A horrifying premonition saves a young man and his friends from death during a racetrack accident but terrible fates await them nonetheless.,5.622,3698,"['Horror', 'Mystery']",1.5
71520,"Invention of Lying, The (2009)",Comedy,1058017,23082.0,"Set in a world where the concept of lying doesn't exist, a loser changes his lot when he invents lying and uses it to get ahead.",6.2,2212,"['Comedy', 'Fantasy', 'Romance']",1.5
71530,Surrogates (2009),Action|Sci-Fi|Thriller,986263,19959.0,"Set in a futuristic world where humans live in isolation and interact through surrogate robots, a cop is forced to leave his home for the first time in years in order to investigate the murders of others' surrogates.",6.136,3287,"['Science Fiction', 'Action', 'Thriller']",0.5
