movieId,title,genres,imdbId,tmdbId,overview,tmdb_vote_average,tmdb_vote_count,tmdb_genres,rating
1295,"Unbearable Lightness of Being, The (1988)",Drama,96332,10644.0,"Successful surgeon Tomas leaves Prague for an operation, meets a young photographer named Tereza, and brings her back with him. Tereza is surprised to learn that Tomas is already having an affair with the bohemian Sabina, but when the Soviet invasion occurs, all three flee to Switzerland. Sabina begins an affair, Tom continues womanizing, and Tereza, disgusted, returns to Czechoslovakia. Realizing his mistake, Tomas decides to chase after her.",6.911,480,"['Drama', 'Romance']",3.0
1354,Breaking the Waves (1996),Drama|Mystery,115751,145.0,"In a small, conservative Scottish village, an oilman is paralyzed in an accident. His wife, who prayed for his return, feels guilty; even more, when he urges her to have sex with another.",7.496,1055,"['Drama', 'Romance']",1.0
1358,Sling Blade (1996),Drama,117666,12498.0,"Karl Childers, a mentally disabled man, has been in the custody of the state mental hospital since the age of 12 for killing his mother and her lover. Although thoroughly institutionalized, he is deemed fit to be released into the outside world.",7.539,825,['Drama'],4.5
1361,Paradise Lost: The Child Murders at Robin Hood Hills (1996),Documentary,117293,17204.0,A horrific triple child murder leads to an indictment and trial of three nonconformist boys based on questionable evidence.,7.6,187,"['Documentary', 'Crime']",4.5
1394,Raising Arizona (1987),Comedy,93822,378.0,"When a childless couple--an ex-con and an ex-cop--decide to help themselves to one of another family's quintuplets, their lives become more complicated than they anticipated.",7.06,2210,"['Comedy', 'Crime']",3.5
1411,Hamlet (1996),Crime|Drama|Romance,116477,10549.0,"Hamlet, Prince of Denmark, returns home to find his father murdered and his mother now marrying the murderer... his uncle. Meanwhile, war is brewing.",7.331,494,['Drama'],2.0
1446,Kolya (Kolja) (1996),Comedy|Drama,116790,784.0,"After a fictitious marriage with a Russian emigrant, Cellisten Louka, a Czech man, must suddenly take responsibility for her son. However, it’s not long before the communication barrier is broken between the two new family members.",7.332,193,"['Drama', 'Comedy']",3.5
1449,Waiting for Guffman (1996),Comedy,118111,16448.0,Aspiring director Corky St. Clair and the marginally talented amateur cast of his hokey small-town musical production go overboard when they learn that Broadway theater agent Mort Guffman will be in attendance.,7.0,255,"['Comedy', 'Music']",5.0
1527,"Fifth Element, The (1997)",Action|Adventure|Comedy|Sci-Fi,119116,18.0,"In 2257, a taxi driver is unintentionally given the task of saving a young girl who is part of the key that will ensure the survival of humanity.",7.558,11212,"['Science Fiction', 'Action', 'Adventure']",1.5
1611,My Own Private Idaho (1991),Drama|Romance,102494,468.0,"In this loose adaptation of Shakespeare's ""Henry IV,"" Mike Waters is a hustler afflicted with narcolepsy. Scott Favor is the rebellious son of a mayor. Together, the two travel from Portland, Oregon to Idaho and finally to the coast of Italy in a quest to find Mike's estranged mother. Along the way they turn tricks for money and drugs, eventually attracting the attention of a wealthy benefactor and sexual deviant.",7.064,1179,['Drama'],1.5
1614,In & Out (1997),Comedy,119360,10806.0,A midwestern teacher questions his sexuality after a former student makes a comment about him at the Academy Awards.,6.472,710,['Comedy'],1.0
1617,L.A. Confidential (1997),Crime|Film-Noir|Mystery|Thriller,119488,2118.0,Three detectives in the corrupt and brutal L.A. police force of the 1950s use differing methods to uncover a conspiracy behind the shotgun slayings of the patrons at an all-night diner.,7.801,5238,"['Crime', 'Mystery', 'Thriller', 'Drama']",2.0
1635,"Ice Storm, The (1997)",Drama,119349,68924.0,"In the weekend after thanksgiving 1973 the Hood family is skidding out of control. Then an ice storm hits, the worst in a century.",6.871,699,['Drama'],4.0
1639,Chasing Amy (1997),Comedy|Drama|Romance,118842,2255.0,"Holden and Banky are comic book artists. Everything is going good for them until they meet Alyssa, also a comic book artist. Holden falls for her, but his hopes are crushed when he finds out she's a lesbian.",6.8,1458,"['Comedy', 'Drama', 'Romance']",3.5
1649,"Fast, Cheap & Out of Control (1997)",Documentary,119107,25099.0,"Errol Morris’s Fast, Cheap & Out of Control interweaves the stories of four men, each driven to create eccentric worlds from their unique obsessions, all of which involve animals. There’s a lion tamer who shares his theories on the mental processes of wild animals; a topiary gardener who has devoted a lifetime to shaping bears and giraffes out of hedges and trees; a man fascinated with hairless mole rats; and an MIT scientist who has designed complex, autonomous robots that can crawl like bugs.",6.7,41,['Documentary'],3.5
1673,Boogie Nights (1997),Drama,118749,4995.0,"Set in 1977, back when sex was safe, pleasure was a business and business was booming, idealistic porn producer Jack Horner aspires to elevate his craft to an art form. Horner discovers Eddie Adams, a hot young talent working as a busboy in a nightclub, and welcomes him into the extended family of movie-makers, misfits and hangers-on that are always around. Adams' rise from nobody to a celebrity adult entertainer is meteoric, and soon the whole world seems to know his porn alter ego, ""Dirk Diggler"". Now, when disco and drugs are in vogue, fashion is in flux and the party never seems to stop, Adams' dreams of turning sex into stardom are about to collide with cold, hard reality.",7.633,3331,['Drama'],4.0
1694,"Apostle, The (1997)",Drama,118632,2895.0,"After his happy life spins out of control, a preacher from Texas changes his name, goes to Louisiana and starts preaching on the radio.",6.3,149,['Drama'],2.5
1701,Deconstructing Harry (1997),Comedy|Drama,118954,2639.0,"Writer Harry Block draws inspiration from people he knows, and from events that happened to him, sometimes causing these people to become alienated from him as a result.",7.251,998,"['Comedy', 'Drama']",3.0
1704,Good Will Hunting (1997),Drama|Romance,119217,489.0,"Headstrong yet aimless, Will Hunting has a genius-level IQ but chooses to work as a janitor at MIT. When he secretly solves highly difficult graduate-level math problems, his talents are discovered by Professor Gerald Lambeau, who decides to help the misguided youth reach his potential. When Will is arrested for attacking a police officer, Professor Lambeau makes a deal to get leniency for him if he gets court-ordered therapy. Eventually, therapist Dr. Sean Maguire helps Will confront the demons that are holding him back.",8.157,13119,['Drama'],4.0
1719,"Sweet Hereafter, The (1997)",Drama,120255,10217.0,"A small mountain community in Canada is devastated when a school bus accident leaves more than a dozen of its children dead. A big-city lawyer arrives to help the survivors' and victims' families prepare a class-action suit, but his efforts only seem to push the townspeople further apart. At the same time, one teenage survivor of the accident has to reckon with the loss of innocence brought about by a different kind of damage.",6.893,408,['Drama'],4.5
1721,Titanic (1997),Drama|Romance,120338,597.0,"101-year-old Rose DeWitt Bukater tells the story of her life aboard the Titanic, 84 years later. A young Rose boards the ship with her mother and fiancé. Meanwhile, Jack Dawson and Fabrizio De Rossi win third-class tickets aboard the ship. Rose tells the whole story from Titanic's departure through to its death—on its first and last voyage—on April 15, 1912.",7.906,26345,"['Drama', 'Romance']",1.5
1732,"Big Lebowski, The (1998)",Comedy|Crime,118715,115.0,"Jeffrey 'The Dude' Lebowski, a Los Angeles slacker who only wants to bowl and drink White Russians, is mistaken for another Jeffrey Lebowski, a wheelchair-bound millionaire, and finds himself dragged into a strange series of events involving nihilists, adult film producers, ferrets, errant toes, and large sums of money.",7.84,11690,"['Comedy', 'Crime']",5.0
1748,Dark City (1998),Adventure|Film-Noir|Sci-Fi|Thriller,118929,2666.0,"A man struggles with memories of his past, including a wife he cannot remember, in a nightmarish world with no sun and run by beings with telekinetic powers who seek the souls of humans.",7.334,3002,"['Mystery', 'Science Fiction']",2.5
1784,As Good as It Gets (1997),Comedy|Drama|Romance,119822,2898.0,"Melvin Udall, a cranky, bigoted, obsessive-compulsive writer of romantic fiction, is rude to everyone he meets, including his gay neighbor, Simon. After Simon is brutally attacked and hospitalized, Melvin finds his life turned upside down when he has to look after Simon's dog. In addition, Carol, the only waitress at the local diner who will tolerate him, leaves work to care for her chronically ill son, making it impossible for Melvin to eat breakfast.",7.397,3938,"['Drama', 'Comedy', 'Romance']",3.0
1827,"Big One, The (1997)",Comedy|Documentary,124295,1774.0,"The Big One is an investigative documentary from director Michael Moore who goes around the country asking why big American corporations produce their product abroad where labor is cheaper while so many Americans are unemployed, losing their jobs, and would happily be hired by such companies as Nike.",6.7,81,['Documentary'],2.5
1836,"Last Days of Disco, The (1998)",Comedy|Drama,120728,16980.0,Two young women and their friends spend spare time at an exclusive nightclub in 1980s New York.,6.2,198,"['Comedy', 'Drama', 'Romance']",2.0
1883,Bulworth (1998),Comedy|Drama|Romance,118798,9452.0,A suicidally disillusioned liberal politician puts a contract out on himself and takes the opportunity to be bluntly honest with his voters by affecting the rhythms and speech of hip-hop music and culture.,6.336,256,"['Comedy', 'Drama', 'Crime', 'Thriller', 'Romance']",3.0
1885,"Opposite of Sex, The (1998)",Comedy|Drama|Romance,120777,9844.0,"A 16-year-old girl visits her gay half-brother and ends up seducing his boyfriend, thus wreaking havoc on all of their lives.",6.2,211,"['Comedy', 'Drama']",3.5
1895,Can't Hardly Wait (1998),Comedy|Drama|Romance,127723,15037.0,"It's graduation day at Huntington Hills High, and you know what that means - time to party. And not just any party, either. This one will be a night to remember, as the nerds become studs, the jocks are humiliated, and freshman crushes blossom into grown-up romance.",6.2,557,"['Comedy', 'Romance']",1.0
1897,High Art (1998),Drama|Romance,139362,37636.0,"When Syd, a young editor at an influential art magazine,  becomes involved with her neighbor, a drug-addicted lesbian photographer, both seek to exploit each other for their respective careers while slowly falling in love with each other.",6.2,141,"['Drama', 'Romance']",3.5
1945,On the Waterfront (1954),Crime|Drama,47296,654.0,"A prizefighter-turned-longshoreman with a conscience goes up against labor leaders to expose corruption, extortion, and murder among the union ranks.",7.88,1675,"['Crime', 'Drama', 'Romance']",3.0
1953,"French Connection, The (1971)",Action|Crime|Thriller,67116,1051.0,Tough narcotics detective 'Popeye' Doyle is in hot pursuit of a suave French drug dealer who may be the key to a huge heroin-smuggling operation.,7.501,2012,"['Action', 'Crime', 'Thriller']",3.5
1955,Kramer vs. Kramer (1979),Drama,79417,12102.0,"Ted Kramer is a career man for whom his work comes before his family. His wife Joanna cannot take this anymore, so she decides to leave him. Ted is now faced with the tasks of housekeeping and taking care of himself and their young son Billy.",7.573,2325,['Drama'],3.5
1960,"Last Emperor, The (1987)",Drama,93389,746.0,"A dramatic history of Pu Yi, the last of the Emperors of China, from his lofty birth and brief reign in the Forbidden City, the object of worship by half a billion people; through his abdication, his decline and dissolute lifestyle; his exploitation by the invading Japanese, and finally to his obscure existence as just another peasant worker in the People's Republic.",7.591,1799,"['Drama', 'History']",1.5
1961,Rain Man (1988),Drama,95953,380.0,"When car dealer Charlie Babbitt learns that his estranged father has died, he returns home to Cincinnati, where he discovers that he has a savant older brother named Raymond and that his father's $3 million fortune is being left to the mental institution in which Raymond lives. Motivated by his father's money, Charlie checks Raymond out of the facility in order to return with him to Los Angeles. The brothers' cross-country trip ends up changing both their lives.",7.75,6705,['Drama'],3.5
1962,Driving Miss Daisy (1989),Drama,97239,403.0,"The story of an old Jewish widow named Daisy Werthan and her relationship with her black chauffeur, Hoke. From an initial mere work relationship grew in 25 years a strong friendship between the two very different characters, in a time when those types of relationships were shunned.",7.2,1667,['Drama'],4.0
1965,Repo Man (1984),Comedy|Sci-Fi,87995,13820.0,"A down and out young punk gets a job working with a seasoned repo man, but what awaits him in his new career is a series of outlandish adventures revolving around aliens, the CIA, and a most wanted '64 Chevy.",6.648,640,"['Comedy', 'Science Fiction']",1.5
1967,Labyrinth (1986),Adventure|Fantasy|Musical,91369,13597.0,"When Sarah is forced to babysit her half-brother Toby, she inadvertently summons the Goblin King who whisks Toby away to his castle at the center of a labyrinth. Sarah enters into a bargain with the Goblin King where she is given just thirteen hours to solve the labyrinth and rescue Toby, or else lose him forever.",7.3,2576,"['Adventure', 'Family', 'Fantasy']",1.5
2003,Gremlins (1984),Comedy|Horror,87363,927.0,"After receiving an exotic small animal as a Christmas gift, a young man inadvertently breaks three important rules concerning his new pet, which unleashes a horde of malevolently mischievous creatures on a small town.",7.137,6669,"['Fantasy', 'Horror', 'Comedy']",1.0
2005,"Goonies, The (1985)",Action|Adventure|Children|Comedy|Fantasy,89218,9340.0,Young teen Mikey Walsh and his friends set off on a quest to find Pirate One-Eyed Willie's treasure in hopes of saving their homes from demolition.,7.514,5948,"['Adventure', 'Comedy', 'Family']",3.0
2022,"Last Temptation of Christ, The (1988)",Drama,95497,11051.0,"Jesus, a humble Judean carpenter beginning to see that he is the son of God, is drawn into revolutionary action against the Roman occupiers by Judas -- despite his protestations that love, not violence, is the path to salvation. The burden of being the savior of mankind torments Jesus throughout his life, leading him to doubt.",7.2,1128,['Drama'],1.5
2028,Saving Private Ryan (1998),Action|Drama|War,120815,857.0,"As U.S. troops storm the beaches of Normandy, three brothers lie dead on the battlefield, with a fourth trapped behind enemy lines. Ranger captain John Miller and seven men are tasked with penetrating German-held territory and bringing the boy home.",8.22,16540,"['Drama', 'History', 'War']",1.0
2054,"Honey, I Shrunk the Kids (1989)",Adventure|Children|Comedy|Fantasy|Sci-Fi,97523,9354.0,The scientist father of a teenage girl and boy accidentally shrinks his and two other neighborhood teens to the size of insects. Now the teens must fight diminutive dangers as the father searches for them.,6.303,3177,"['Adventure', 'Comedy', 'Family', 'Science Fiction']",0.5
2064,Roger & Me (1989),Documentary,98213,1779.0,"A documentary about the closure of General Motors' plant at Flint, Michigan, which resulted in the loss of 30,000 jobs. Details the attempts of filmmaker Michael Moore to get an interview with GM CEO Roger Smith.",7.1,306,"['Documentary', 'History', 'Comedy']",5.0
2112,Grand Canyon (1991),Crime|Drama,101969,13697.0,Grand Canyon revolved around six residents from different backgrounds whose lives intertwine in modern-day Los Angeles. At the center of the film is the unlikely friendship of two men from different races and classes brought together when one finds himself in jeopardy in the other's rough neighborhood.,6.454,207,['Drama'],3.5
2141,"American Tail, An (1986)",Adventure|Animation|Children|Comedy,90633,4978.0,"A young mouse named Fievel and his family decide to migrate to America, a ""land without cats,"" at the turn of the 20th century. But somehow, Fievel ends up in the New World alone and must fend off not only the felines he never thought he'd have to deal with again but also the loneliness of being away from home.",6.744,1393,"['Animation', 'Comedy', 'Adventure', 'Drama', 'Family']",3.0
2150,"Gods Must Be Crazy, The (1980)",Adventure|Comedy,80801,8393.0,A Coca-Cola bottle dropped from an airplane raises havoc among a normally peaceful tribe of African bushmen who believe it to be a utensil of the gods.,7.269,1233,"['Action', 'Comedy']",3.0
2161,"NeverEnding Story, The (1984)",Adventure|Children|Fantasy,88323,34584.0,"While hiding from bullies in his school's attic, a young boy discovers the extraordinary land of Fantasia, through a magical book called The Neverending Story. The book tells the tale of Atreyu, a young warrior who, with the help of a luck dragon named Falkor, must save Fantasia from the destruction of The Nothing.",7.202,4188,"['Adventure', 'Fantasy', 'Family', 'Drama']",2.0
2248,Say Anything... (1989),Comedy|Drama|Romance,98258,2028.0,"Lloyd, an eternal optimist, seeks to capture the heart of Diane, an unattainable high school beauty and straight-A student. He surprises just about everyone-including himself-when she returns the sentiment. But Diane's over-possessive, divorced Dad disapproves and it's going to take more than just the power of love to conquer all.",7.0,1048,"['Romance', 'Comedy', 'Drama']",4.0
2300,"Producers, The (1968)",Comedy,63462,30197.0,"Broadway producer Max Bialystock and his accountant, Leo Bloom, plan to make money by charming wealthy old biddies to invest in a production many times over the actual cost, and then put on a sure-fire flop, so nobody will ask for their money back – and what can be a more certain flop than a tasteless musical celebrating Hitler.",7.085,834,['Comedy'],4.0
2302,My Cousin Vinny (1992),Comedy,104952,10377.0,"Two carefree pals from Brooklyn traveling through rural Alabama on their way back to college are mistakenly arrested, and charged with murder. Fortunately, one of them has a cousin who's a lawyer - Vincent Gambini, a former auto mechanic from Brooklyn who just passed his bar exam after his sixth try. When he arrives with his leather-clad girlfriend, to try his first case, it's a real shock - for him and the Deep South!",7.5,1699,"['Comedy', 'Drama']",4.0
2303,Nashville (1975),Drama|Musical,73440,3121.0,"The intersecting stories of twenty-four characters—from country star to wannabe to reporter to waitress—connect to the music business in Nashville, Tennessee.",7.271,433,"['Drama', 'Comedy']",4.0
2318,Happiness (1998),Comedy|Drama,147612,10683.0,"The lives of several individuals intertwine as they go about their lives in their own unique ways, engaging in acts which society as a whole might find disturbing in a desperate search for human connection.",7.447,872,"['Comedy', 'Drama']",4.0
2324,Life Is Beautiful (La Vita è bella) (1997),Comedy|Drama|Romance|War,118799,637.0,A touching story of an Italian book seller of Jewish ancestry who lives in his own little fairy tale. His creative and happy life would come to an abrupt halt when his entire family is deported to a concentration camp during World War II. While locked up he tries to convince his son that the whole thing is just a game.,8.44,13553,"['Comedy', 'Drama']",5.0
2329,American History X (1998),Crime|Drama,120586,73.0,"Derek Vineyard is paroled after serving 3 years in prison for killing two African-American men. Through his brother, Danny Vineyard's narration, we learn that before going to prison, Derek was a skinhead and the leader of a violent white supremacist gang that committed acts of racial crime throughout L.A. and his actions greatly influenced Danny. Reformed and fresh out of prison, Derek severs contact with the gang and becomes determined to keep Danny from going down the same violent path as he did.",8.333,12059,['Drama'],3.5
2333,Gods and Monsters (1998),Drama,120684,3033.0,"It's 1957, and James Whale's heyday as the director of ""Frankenstein,"" ""Bride of Frankenstein"" and ""The Invisible Man"" is long behind him. Retired and a semi-recluse, he lives his days accompanied only by images from his past. When his dour housekeeper, Hannah, hires a handsome young gardener, the flamboyant director and simple yard man develop an unlikely friendship, which will change them forever.",7.0,373,['Drama'],4.0
2395,Rushmore (1998),Comedy|Drama,128445,11545.0,"When a beautiful first-grade teacher arrives at a prep school, she soon attracts the attention of an ambitious teenager named Max, who quickly falls in love with her. Max turns to the father of two of his schoolmates for advice on how to woo the teacher. However, the situation soon gets complicated when Max's new friend becomes involved with her, setting the two pals against one another in a war for her attention.",7.395,2594,"['Comedy', 'Drama']",4.0
2396,Shakespeare in Love (1998),Comedy|Drama|Romance,138097,1934.0,"Young Shakespeare is forced to stage his latest comedy, ""Romeo and Ethel, the Pirate's Daughter,"" before it's even written. When a lovely noblewoman auditions for a role, they fall into forbidden love -- and his play finds a new life (and title). As their relationship progresses, Shakespeare's comedy soon transforms into tragedy.",6.848,3096,"['Romance', 'History', 'Comedy']",1.0
2406,Romancing the Stone (1984),Action|Adventure|Comedy|Romance,88011,9326.0,"Though she can spin wild tales of passionate romance, novelist Joan Wilder has no life of her own. Then one day adventure comes her way in the form of a mysterious package. It turns out that the parcel is the ransom she'll need to free her abducted sister, so Joan flies to South America to hand it over. But she gets on the wrong bus and winds up hopelessly stranded in the jungle.",6.761,1933,"['Romance', 'Comedy', 'Action', 'Adventure']",1.0
2423,Christmas Vacation (National Lampoon's Christmas Vacation) (1989),Comedy,97958,5825.0,"It's Christmastime, and the Griswolds are preparing for a family seasonal celebration. But things never run smoothly for Clark, his wife Ellen, and their two kids. Clark's continual bad luck is worsened by his obnoxious family guests, but he manages to keep going, knowing that his Christmas bonus is due soon.",7.232,2530,['Comedy'],0.5
2427,"Thin Red Line, The (1998)",Action|Drama|War,120863,8741.0,"The story of a group of men, an Army Rifle company called C-for-Charlie, who change, suffer, and ultimately make essential discoveries about themselves during the fierce World War II battle of Guadalcanal. It follows their journey, from the surprise of an unopposed landing, through the bloody and exhausting battles that follow, to the ultimate departure of those who survived.",7.446,3140,"['Drama', 'History', 'War']",2.5
2502,Office Space (1999),Comedy|Crime,151804,1542.0,"A depressed white-collar worker tries hypnotherapy, only to find himself in a perpetual state of devil-may-care bliss that prompts him to start living by his own rules, and hatch a hapless attempt to embezzle money from his soul-killing employers.",7.4,3187,['Comedy'],4.5
2505,8MM (1999),Drama|Mystery|Thriller,134273,8224.0,"A small, seemingly innocuous plastic reel of film leads surveillance specialist Tom Welles down an increasingly dark and frightening path. With the help of the streetwise Max, he relentlessly follows a bizarre trail of evidence to determine the fate of a complete stranger. As his work turns into obsession, he drifts farther and farther away from his wife, family and simple life as a small-town PI.",6.458,2127,"['Thriller', 'Crime', 'Mystery']",2.0
2539,Analyze This (1999),Comedy,122933,9535.0,"Countless wiseguy films are spoofed in this film that centers on the neuroses and angst of a powerful Mafia racketeer who suffers from panic attacks. When Paul Vitti needs help dealing with his role in the ""family,"" unlucky shrink Dr. Ben Sobel is given just days to resolve Vitti's emotional crisis and turn him into a happy, well-adjusted gangster.",6.5,1992,"['Comedy', 'Crime']",2.0
2581,Never Been Kissed (1999),Comedy|Romance,151738,11355.0,"Josie Geller, a baby-faced junior copywriter at the Chicago Sun-Times, must pose as a student at her former high school to research contemporary teenage culture. With the help of her brother, Rob, Josie infiltrates the inner circle of the most popular clique on campus. But she hits a major snag in her investigation -- not to mention her own failed love life -- when she falls for her dreamy English teacher, Sam Coulson.",6.163,1533,"['Romance', 'Comedy', 'Drama']",0.5
2599,Election (1999),Comedy,126886,9451.0,"Tracy Flick is running unopposed for this year’s high school student election. But Jim McAllister has a different plan. Partly to establish a more democratic election, and partly to satisfy some deep personal anger toward Tracy, Jim talks football player Paul Metzler to run for president as well.",6.87,1124,"['Comedy', 'Drama']",5.0
2628,Star Wars: Episode I - The Phantom Menace (1999),Action|Adventure|Sci-Fi,120915,1893.0,"Anakin Skywalker, a young slave strong with the Force, is discovered on Tatooine. Meanwhile, the evil Sith have returned, enacting their plot for revenge against the Jedi.",6.565,15249,"['Adventure', 'Action', 'Science Fiction']",0.5
