movieId,title,genres,imdbId,tmdbId,overview,tmdb_vote_average,tmdb_vote_count,tmdb_genres,rating
3681,For a Few Dollars More (Per qualche dollaro in più) (1965),Action|Drama|Thriller|Western,59578,938.0,"Two bounty hunters both pursue the brutal and sadistic bandit, El Indio, who has a large bounty on his head.",8.017,4223,['Western'],4.5
3785,Scary Movie (2000),Comedy|Horror,175142,4247.0,"A familiar-looking group of teenagers find themselves being stalked by a more-than-vaguely recognizable masked killer! As the victims begin to pile up and the laughs pile on, none of your favorite scary movies escape the razor-sharp satire of this outrageously funny parody!",6.376,7310,['Comedy'],0.5
3793,X-Men (2000),Action|Adventure|Sci-Fi,120903,36657.0,"Two mutants, Rogue and Wolverine, come to a private academy for their kind whose resident superhero team, the X-Men, must oppose a terrorist organization with similar powers.",7.006,11773,"['Adventure', 'Action', 'Science Fiction']",3.5
3949,Requiem for a Dream (2000),Drama,180093,641.0,The drug-induced utopias of four Coney Island residents are shattered when their addictions run deep.,8.015,10495,"['Crime', 'Drama']",5.0
3977,Charlie's Angels (2000),Action|Comedy,160127,4327.0,"The captivating crime-fighting trio who are masters of disguise, espionage and martial arts are back! When a devious mastermind embroils them in a plot to destroy individual privacy, the Angels, aided by their loyal sidekick Bosley, set out to bring down the bad guys. But when a terrible secret is revealed, it makes the Angels targets for assassination.",5.847,4324,"['Action', 'Adventure', 'Comedy', 'Crime', 'Thriller']",2.5
3988,How the Grinch Stole Christmas (a.k.a. The Grinch) (2000),Children|Comedy|Fantasy,170016,8871.0,The Grinch decides to rob Whoville of Christmas - but a dash of kindness from little Cindy Lou Who and her family may be enough to melt his heart...,6.773,7883,"['Family', 'Comedy']",3.0
3996,"Crouching Tiger, Hidden Dragon (Wo hu cang long) (2000)",Action|Drama|Romance,190332,146.0,"Two warriors in pursuit of a stolen sword and a notorious fugitive are led to an impetuous, physically-skilled, teenage nobleman's daughter, who is at a crossroads in her life.",7.433,3381,"['Adventure', 'Drama', 'Action', 'Romance']",5.0
4011,Snatch (2000),Comedy|Crime|Thriller,208092,107.0,"Unscrupulous boxing promoters, violent bookies, a Russian gangster, incompetent amateur robbers, and supposedly Jewish jewellers fight to track down a priceless stolen diamond.",7.816,9486,"['Crime', 'Comedy']",4.0
4027,"O Brother, Where Art Thou? (2000)",Adventure|Comedy|Crime,190590,134.0,"In the deep south during the 1930s, three escaped convicts search for hidden treasure while a relentless lawman pursues them.",7.317,4364,"['Adventure', 'Comedy', 'Crime']",5.0
4226,Memento (2000),Mystery|Thriller,209144,77.0,"Leonard Shelby is tracking down the man who raped and murdered his wife. The difficulty of locating his wife's killer, however, is compounded by the fact that he suffers from a rare, untreatable form of short-term memory loss. Although he can recall details of life before his accident, Leonard cannot remember what happened fifteen minutes ago, where he's going, or why.",8.178,15565,"['Mystery', 'Thriller']",4.0
4255,Freddy Got Fingered (2001),Comedy,240515,13166.0,"Unemployed cartoonist Gord Brody moves back in with his parents Jim and Julie and younger brother Freddy. When his parents demand he leave, he retaliates by spreading rumors that Jim is sexually abusing Freddy.",4.723,460,['Comedy'],0.5
4262,Scarface (1983),Action|Crime|Drama,86250,111.0,"After getting a green card in exchange for assassinating a Cuban government official, Tony Montana stakes a claim on the drug trade in Miami. Viciously murdering anyone who stands in his way, Tony eventually becomes the biggest drug lord in the state, controlling nearly all the cocaine that comes through Miami. But increased pressure from the police, wars with Colombian drug cartels and his own drug-fueled paranoia serve to fuel the flames of his eventual downfall.",8.16,12469,"['Action', 'Crime', 'Drama']",5.0
4306,Shrek (2001),Adventure|Animation|Children|Comedy|Fantasy|Romance,126029,808.0,"It ain't easy bein' green -- especially if you're a likable (albeit smelly) ogre named Shrek. On a mission to retrieve a gorgeous princess from the clutches of a fire-breathing dragon, Shrek teams up with an unlikely compatriot -- a wisecracking donkey.",7.752,17986,"['Animation', 'Comedy', 'Fantasy', 'Adventure', 'Family']",3.5
4370,A.I. Artificial Intelligence (2001),Adventure|Drama|Sci-Fi,212720,644.0,"David, a robotic boy—the first of his kind programmed to love—is adopted as a test case by a Cybertronics employee and his wife. Though he gradually becomes their child, a series of unexpected circumstances make this life impossible for David.",7.047,6394,"['Drama', 'Science Fiction', 'Adventure']",3.5
4720,"Others, The (2001)",Drama|Horror|Mystery|Thriller,230600,1933.0,"Grace is a religious woman who lives in an old house kept dark because her two children, Anne and Nicholas, have a rare sensitivity to light. When the family begins to suspect the house is haunted, Grace fights to protect her children at any cost in the face of strange events and disturbing visions.",7.616,6837,"['Horror', 'Mystery', 'Thriller']",2.5
4734,Jay and Silent Bob Strike Back (2001),Adventure|Comedy,261392,2294.0,"When Jay and Silent Bob learn that their comic-book alter egos, Bluntman and Chronic, have been sold to Hollywood as part of a big-screen movie that leaves them out of any royalties, the pair travels to Tinseltown to sabotage the production.",6.442,1634,"['Comedy', 'Adventure']",2.5
4878,Donnie Darko (2001),Drama|Mystery|Sci-Fi|Thriller,246578,141.0,"After narrowly escaping a bizarre accident, a troubled teenager is plagued by visions of a large bunny rabbit that manipulates him to commit a series of crimes.",7.766,12921,"['Fantasy', 'Drama', 'Mystery']",4.0
4886,"Monsters, Inc. (2001)",Adventure|Animation|Children|Comedy|Fantasy,198781,585.0,"Lovable Sulley and his wisecracking sidekick Mike Wazowski are the top scare team at Monsters, Inc., the scream-processing factory in Monstropolis. When a little girl named Boo wanders into their world, it's the monsters who are scared silly, and it's up to Sulley and Mike to keep her out of sight and get her back home.",7.846,19133,"['Animation', 'Comedy', 'Family']",4.0
4963,Ocean's Eleven (2001),Crime|Thriller,240772,161.0,"Less than 24 hours into his parole, charismatic thief Danny Ocean is already rolling out his next plan: In one night, Danny's hand-picked crew of specialists will attempt to steal more than $150 million from three Las Vegas casinos. But to score the cash, Danny risks his chances of reconciling with ex-wife, Tess.",7.451,12060,"['Thriller', 'Crime']",3.0
4973,"Amelie (Fabuleux destin d'Amélie Poulain, Le) (2001)",Comedy|Romance,211915,194.0,"At a tiny Parisian café, the adorable yet painfully shy Amélie accidentally discovers a gift for helping others. Soon Amelie is spending her days as a matchmaker, guardian angel, and all-around do-gooder. But when she bumps into a handsome stranger, will she find the courage to become the star of her very own love story?",7.913,11945,"['Comedy', 'Romance']",5.0
4979,"Royal Tenenbaums, The (2001)",Comedy|Drama,265666,9428.0,"Royal Tenenbaum and his wife Etheline had three children and then they separated. All three children are extraordinary --- all geniuses. Virtually all memory of the brilliance of the young Tenenbaums was subsequently erased by two decades of betrayal, failure, and disaster. Most of this was generally considered to be their father's fault. ""The Royal Tenenbaums"" is the story of the family's sudden, unexpected reunion one recent winter.",7.5,4754,"['Comedy', 'Drama']",5.0
4993,"Lord of the Rings: The Fellowship of the Ring, The (2001)",Adventure|Fantasy,120737,120.0,"Young hobbit Frodo Baggins, after inheriting a mysterious ring from his uncle Bilbo, must leave his home in order to keep it from falling into the hands of its evil creator. Along the way, a fellowship is formed to protect the ringbearer and make sure that the ring arrives at its final destination: Mt. Doom, the only place where it can be destroyed.",8.424,26410,"['Adventure', 'Fantasy', 'Action']",5.0
4995,"Beautiful Mind, A (2001)",Drama|Romance,268978,453.0,"From the heights of notoriety to the depths of depravity, John Forbes Nash Jr. experiences it all. As a brilliant but socially awkward mathematician, he made a groundbreaking discovery early in his career and stands on the brink of international acclaim. But as the handsome and arrogant Nash accepts secret work in cryptography, he becomes entangled in a mysterious conspiracy. His life takes a nightmarish turn and he soon finds himself on a painful and harrowing journey of self-discovery.",7.856,10638,"['Drama', 'Romance']",4.0
5110,Super Troopers (2001),Comedy|Crime|Mystery,247745,39939.0,"Five bored, occasionally high and always ineffective Vermont state troopers must prove their worth to the governor or lose their jobs. After stumbling on a drug ring, they plan to make a bust, but a rival police force is out to steal the glory.",6.55,1156,"['Comedy', 'Crime', 'Mystery']",4.0
5349,Spider-Man (2002),Action|Adventure|Sci-Fi|Thriller,145487,557.0,"After being bitten by a genetically altered spider at Oscorp, nerdy but endearing high school student Peter Parker is endowed with amazing powers to become the superhero known as Spider-Man.",7.316,19918,"['Action', 'Science Fiction']",3.0
5378,Star Wars: Episode II - Attack of the Clones (2002),Action|Adventure|Sci-Fi|IMAX,121765,1894.0,"Following an assassination attempt on Senator Padmé Amidala, Jedi Knights Anakin Skywalker and Obi-Wan Kenobi investigate a mysterious plot that could change the galaxy forever.",6.584,13804,"['Adventure', 'Action', 'Science Fiction']",3.0
5418,"Bourne Identity, The (2002)",Action|Mystery|Thriller,258463,2501.0,"Wounded to the brink of death and suffering from amnesia, Jason Bourne is rescued at sea by a fisherman. With nothing to go on but a Swiss bank account number, he starts to reconstruct his life, but finds that many people he encounters want him dead. However, Bourne realizes that he has the combat and mental skills of a world-class spy—but who does he work for?",7.5,9661,"['Action', 'Drama', 'Mystery', 'Thriller']",4.0
5419,Scooby-Doo (2002),Adventure|Children|Comedy|Fantasy|Mystery,267913,9637.0,"When the Mystery Inc. gang is invited to Spooky Island, a popular amusement park, they soon discover that the attractions aren't the only things that are spooky. Strange things are happening, and it's up to Scooby, Shaggy, Fred, Daphne, and Velma to uncover the truth behind the mysterious happenings.",6.093,4596,"['Mystery', 'Adventure', 'Comedy']",3.5
5445,Minority Report (2002),Action|Crime|Mystery|Sci-Fi|Thriller,181689,180.0,"John Anderton is a top 'Precrime' cop in the late-21st century, when technology can predict crimes before they're committed. But Anderton becomes the quarry when another investigator targets him for a murder charge.",7.351,9169,"['Science Fiction', 'Action', 'Thriller']",3.5
5481,Austin Powers in Goldmember (2002),Comedy,295178,818.0,"The world's most shagadelic spy continues his fight against Dr. Evil. This time, the diabolical doctor and his clone, Mini-Me, team up with a new foe—'70s kingpin Goldmember. While pursuing the team of villains to stop them from world domination, Austin gets help from his dad and an old girlfriend.",5.998,3251,"['Comedy', 'Crime', 'Science Fiction']",4.0
5618,Spirited Away (Sen to Chihiro no kamikakushi) (2001),Adventure|Animation|Fantasy,245429,129.0,"A young girl, Chihiro, becomes trapped in a strange new world of spirits. When her parents undergo a mysterious transformation, she must call upon the courage she never knew she had to free her family.",8.536,17506,"['Animation', 'Family', 'Fantasy']",5.0
5902,Adaptation (2002),Comedy|Drama|Romance,268126,2757.0,"Charlie Kaufman is a confused L.A. screenwriter overwhelmed by feelings of inadequacy, sexual frustration, self-loathing, and by the screenwriting ambitions of his freeloading twin brother Donald. While struggling to adapt ""The Orchid Thief,"" by Susan Orlean, Kaufman's life spins from pathetic to bizarre. The lives of Kaufman, Orlean's book, become strangely intertwined as each one's search for passion collides with the others'.",7.354,2619,"['Comedy', 'Crime', 'Drama']",3.5
5952,"Lord of the Rings: The Two Towers, The (2002)",Adventure|Fantasy,167261,121.0,"Frodo Baggins and the other members of the Fellowship continue on their sacred quest to destroy the One Ring--but on separate paths. Their destinies lie at two towers--Orthanc Tower in Isengard, where the corrupt wizard Saruman awaits, and Sauron's fortress at Barad-dur, deep within the dark lands of Mordor. Frodo and Sam are trekking to Mordor to destroy the One Ring of Power while Gimli, Legolas and Aragorn search for the orc-captured Merry and Pippin. All along, nefarious wizard Saruman awaits the Fellowship members at the Orthanc Tower in Isengard.",8.409,22940,"['Adventure', 'Fantasy', 'Action']",5.0
5995,"Pianist, The (2002)",Drama|War,253474,423.0,"The true story of pianist Władysław Szpilman's experiences in Warsaw during the Nazi occupation. When the Jews of the city find themselves forced into a ghetto, Szpilman finds work playing in a café; and when his family is deported in 1942, he stays behind, works for a while as a laborer, and eventually goes into hiding in the ruins of the war-torn city.",8.381,9693,"['Drama', 'War']",5.0
6016,City of God (Cidade de Deus) (2002),Action|Adventure|Crime|Drama|Thriller,317248,598.0,"In the poverty-stricken favelas of Rio de Janeiro in the 1970s, two young men choose different paths. Rocket is a budding photographer who documents the increasing drug-related violence of his neighborhood, while José “Zé” Pequeno is an ambitious drug dealer diving into a dangerous life of crime.",8.429,7806,"['Drama', 'Crime']",4.0
6333,X2: X-Men United (2003),Action|Adventure|Sci-Fi|Thriller,290334,36658.0,"Professor Charles Xavier and his team of genetically gifted superheroes face a rising tide of anti-mutant sentiment led by Col. William Stryker. Storm, Wolverine and Jean Grey must join their usual nemeses—Magneto and Mystique—to unhinge Stryker's scheme to exterminate all mutants.",7.031,10525,"['Adventure', 'Action', 'Science Fiction']",3.0
6373,Bruce Almighty (2003),Comedy|Drama|Fantasy|Romance,315327,310.0,"Bruce Nolan toils as a ""human interest"" television reporter in Buffalo, NY, but despite his high ratings and the love of his beautiful girlfriend, Bruce remains unfulfilled. At the end of the worst day in his life, he angrily ridicules God — and the Almighty responds, endowing Bruce with all of His divine powers.",6.722,11093,"['Fantasy', 'Comedy']",3.0
6377,Finding Nemo (2003),Adventure|Animation|Children|Comedy,266543,12.0,"Nemo, an adventurous young clownfish, is unexpectedly taken from his Great Barrier Reef home to a dentist's office aquarium. It's up to his worrisome father Marlin and a friendly but forgetful fish Dory to bring Nemo home -- meeting vegetarian sharks, surfer dude turtles, hypnotic jellyfish, hungry seagulls, and more along the way.",7.817,19930,"['Animation', 'Family']",4.5
6539,Pirates of the Caribbean: The Curse of the Black Pearl (2003),Action|Adventure|Comedy|Fantasy,325980,22.0,"After Port Royal is attacked and pillaged by a mysterious pirate crew, capturing the governor's daughter Elizabeth Swann in the process, William Turner asks free-willing pirate Jack Sparrow to help him locate the crew's ship—The Black Pearl—so that he can rescue the woman he loves.",7.814,21462,"['Adventure', 'Fantasy', 'Action']",4.5
6662,"Pink Panther, The (1963)",Comedy|Crime,57413,936.0,"The trademark of The Phantom, a renowned jewel thief, is a glove left at the scene of the crime. Inspector Clouseau, an expert on The Phantom's exploits, feels sure that he knows where The Phantom will strike next and leaves Paris for the Tyrolean Alps, where the famous Lugashi jewel 'The Pink Panther' is going to be. However, he does not know who The Phantom really is, or for that matter who anyone else really is...",6.8,1111,"['Comedy', 'Crime']",4.0
6711,Lost in Translation (2003),Comedy|Drama|Romance,335266,153.0,"Two lost souls visiting Tokyo -- the young, neglected wife of a photographer and a washed-up movie star shooting a TV commercial -- find an odd solace and pensive freedom to be real in each other's company, away from their lives in America.",7.387,7692,"['Drama', 'Romance', 'Comedy']",4.5
6773,"Triplets of Belleville, The (Les triplettes de Belleville) (2003)",Animation|Comedy|Fantasy,286244,9662.0,"When her grandson is kidnapped during the Tour de France, Madame Souza and her beloved pooch Bruno team up with the Belleville Sisters—an aged song-and-dance team from the days of Fred Astaire—to rescue him.",7.395,995,"['Animation', 'Comedy', 'Drama', 'Family']",3.0
6863,School of Rock (2003),Comedy|Musical,332379,1584.0,"Fired from his band and hard up for cash, guitarist and vocalist Dewey Finn finagles his way into a job as a fifth-grade substitute teacher at a private school, where he secretly begins teaching his students the finer points of rock 'n' roll. The school's hard-nosed principal is rightly suspicious of Finn's activities. But Finn's roommate remains in the dark about what he's doing.",7.085,5882,"['Comedy', 'Music']",5.0
6867,"Station Agent, The (2003)",Comedy|Drama,340377,2056.0,"When his only friend dies, a man born with dwarfism moves to rural New Jersey to live a life of solitude, only to meet a chatty hot dog vendor and a woman dealing with her own personal loss.",7.358,718,"['Drama', 'Comedy']",4.0
6870,Mystic River (2003),Crime|Drama|Mystery,327056,322.0,The lives of three men who were childhood friends are shattered when one of them suffers a family tragedy.,7.742,7067,"['Thriller', 'Crime', 'Drama', 'Mystery']",4.0
6874,Kill Bill: Vol. 1 (2003),Action|Crime|Thriller,266697,24.0,"An assassin is shot by her ruthless employer, Bill, and other members of their assassination circle – but she lives to plot her vengeance.",8.0,18154,"['Action', 'Crime']",4.0
6888,Scary Movie 3 (2003),Comedy|Horror,306047,4256.0,"In the third installment of the Scary Movie franchise, news anchorwoman Cindy Campbell has to investigate mysterious crop circles and killing video tapes, and help the President stop an alien invasion in the process.",5.966,4249,['Comedy'],0.5
7147,Big Fish (2003),Drama|Fantasy|Romance,319061,587.0,"Throughout his life Edward Bloom has always been a man of big appetites, enormous passions and tall tales. In his later years, he remains a huge mystery to his son, William. Now, to get to know the real man, Will begins piecing together a true picture of his father from flashbacks of his amazing adventures.",7.755,7478,"['Adventure', 'Fantasy', 'Drama']",3.0
7153,"Lord of the Rings: The Return of the King, The (2003)",Action|Adventure|Drama|Fantasy,167260,122.0,"As armies mass for a final battle that will decide the fate of the world--and powerful, ancient forces of Light and Dark compete to determine the outcome--one member of the Fellowship of the Ring is revealed as the noble heir to the throne of the Kings of Men. Yet, the sole hope for triumph over evil lies with a brave hobbit, Frodo, who, accompanied by his loyal friend Sam and the hideous, wretched Gollum, ventures deep into the very dark heart of Mordor on his seemingly impossible quest to destroy the Ring of Power.​",8.5,25482,"['Adventure', 'Fantasy', 'Action']",4.5
7254,The Butterfly Effect (2004),Drama|Sci-Fi|Thriller,289879,1954.0,"A young man struggles to access sublimated childhood memories. He finds a technique that allows him to travel back into the past, to occupy his childhood body and change history. However, he soon finds that every change he makes has unexpected consequences.",7.573,7851,"['Science Fiction', 'Thriller']",1.0
7317,EuroTrip (2004),Adventure|Comedy,356150,9352.0,"When Scott learns that his longtime cyber-buddy from Berlin is a gorgeous young woman, he and his friends embark on a trip across Europe.",6.609,2757,['Comedy'],2.5
7361,Eternal Sunshine of the Spotless Mind (2004),Drama|Romance|Sci-Fi,338013,38.0,"Joel Barish, heartbroken that his girlfriend underwent a procedure to erase him from her memory, decides to do the same. However, as he watches his memories of her fade away, he realises that he still loves her, and may be too late to correct his mistake.",8.092,15703,"['Science Fiction', 'Drama', 'Romance']",4.0
7438,Kill Bill: Vol. 2 (2004),Action|Drama|Thriller,378194,393.0,"The Bride unwaveringly continues on her roaring rampage of revenge against the band of assassins who had tried to kill her and her unborn child. She visits each of her former associates one-by-one, checking off the victims on her Death List Five until there's nothing left to do … but kill Bill.",7.873,14466,"['Action', 'Crime', 'Thriller']",3.0
7444,13 Going on 30 (2004),Comedy|Fantasy|Romance,337563,10096.0,"After total humiliation at her thirteenth birthday party, Jenna Rink wants to just hide until she's thirty. Thanks to some magic wishing dust, Jenna's prayer has been answered. With a knockout body, a fabulous wardrobe, an athlete boyfriend, a dream job, and superstar friends, this can't be a better life. But soon Jenna realizes that adult life isn’t as easy as she hoped for.",6.76,5344,"['Comedy', 'Fantasy', 'Romance']",2.0
8360,Shrek 2 (2004),Adventure|Animation|Children|Comedy|Musical|Romance,298148,809.0,"Shrek, Fiona, and Donkey set off to Far, Far Away to meet Fiona's mother and father, the Queen and King. But not everyone is happily ever after. Shrek and the King find it difficult to get along, and there's tension in the marriage. The Fairy Godmother discovers that Fiona has married Shrek instead of her son Prince Charming and plots to destroy their marriage.",7.302,12921,"['Animation', 'Family', 'Comedy', 'Fantasy', 'Adventure']",2.0
8874,Shaun of the Dead (2004),Comedy|Horror,365748,747.0,"Shaun lives a supremely uneventful life, which revolves around his girlfriend, his mother, and, above all, his local pub. This gentle routine is threatened when the dead return to life and make strenuous attempts to snack on ordinary Londoners.",7.536,8895,"['Horror', 'Comedy']",5.0
8910,I Heart Huckabees (2004),Comedy,356721,1599.0,"A husband-and-wife team play detective, but not in the traditional sense. Instead, the happy duo helps others solve their existential issues, the kind that keep you up at night, wondering what it all means.",6.3,668,"['Comedy', 'Romance']",5.0
8961,"Incredibles, The (2004)",Action|Adventure|Animation|Children|Comedy,317705,9806.0,"Bob Parr has given up his superhero days to log in time as an insurance adjuster and raise his three children with his formerly heroic wife in suburbia. But when he receives a mysterious assignment, it's time to get back into costume.",7.718,18299,"['Action', 'Adventure', 'Animation', 'Family']",3.5
27773,Old Boy (2003),Mystery|Thriller,364569,670.0,"With no clue how he came to be imprisoned, drugged and tortured for 15 years, a desperate man seeks revenge on his captors.",8.249,9247,"['Drama', 'Thriller', 'Mystery', 'Action']",5.0
30793,Charlie and the Chocolate Factory (2005),Adventure|Children|Comedy|Fantasy|IMAX,367594,118.0,"A young boy wins a tour through the most magnificent chocolate factory in the world, led by the world's most unusual candy maker.",7.042,15669,"['Adventure', 'Comedy', 'Family', 'Fantasy']",2.0
30810,"Life Aquatic with Steve Zissou, The (2004)",Adventure|Comedy|Fantasy,362270,421.0,"Renowned oceanographer Steve Zissou has sworn vengeance upon the rare shark that devoured a member of his crew. In addition to his regular team, he is joined on his boat by Ned, a man who believes Zissou to be his father, and Jane, a journalist pregnant by a married man. They travel the sea, all too often running into pirates and, perhaps more traumatically, various figures from Zissou's past, including his estranged wife, Eleanor.",7.078,3023,"['Adventure', 'Comedy', 'Drama']",5.0
31685,Hitch (2005),Comedy|Romance,386588,8488.0,"Dating coach Alex 'Hitch' Hitchens mentors a bumbling client, Albert, who hopes to win the heart of the glamorous Allegra Cole. While Albert makes progress, Hitch faces his own romantic setbacks when proven techniques fail to work on Sara Melas, a tabloid reporter digging for dirt on Allegra Cole's love life. When Sara discovers Hitch's connection to Albert – now Allegra's boyfriend – it threatens to destroy both relationships.",6.57,6002,"['Comedy', 'Drama', 'Romance']",2.0
32587,Sin City (2005),Action|Crime|Film-Noir|Mystery|Thriller,401792,187.0,"Welcome to Sin City. This town beckons to the tough, the corrupt, the brokenhearted. Some call it dark… Hard-boiled. Then there are those who call it home — Crooked cops, sexy dames, desperate vigilantes. Some are seeking revenge, others lust after redemption, and then there are those hoping for a little of both. A universe of unlikely and reluctant heroes still trying to do the right thing in a city that refuses to care.",7.464,8458,"['Crime', 'Thriller']",3.0
33779,Eddie Izzard: Dress to Kill (1999),Comedy,184424,13589.0,"Eddie Izzard takes her show to San Francisco to give a brief history of pagan and Christian religions, the building of Stonehenge, the birth of the Church of England and of Western empires, and the need for a European dream.",7.8,74,['Comedy'],5.0
