movieId,title,genres,imdbId,tmdbId,overview,tmdb_vote_average,tmdb_vote_count,tmdb_genres,rating
6,Heat (1995),Action|Crime|Thriller,113277,949.0,Obsessive master thief Neil McCauley leads a top-notch crew on various daring heists throughout Los Angeles while determined detective Vincent Hanna pursues him without rest. Each man recognizes and respects the ability and the dedication of the other even though they are aware their cat-and-mouse game may end in violence.,7.922,7811,"['Crime', 'Drama', 'Action']",4.0
25,Leaving Las Vegas (1995),Drama|Romance,113627,451.0,"Ben Sanderson, an alcoholic Hollywood screenwriter who lost everything because of his drinking, arrives in Las Vegas to drink himself to death. There, he meets and forms an uneasy friendship and non-interference pact with prostitute Sera.",7.251,1536,"['Drama', 'Romance']",3.5
32,Twelve Monkeys (a.k.a. 12 Monkeys) (1995),Mystery|Sci-Fi|Thriller,114746,63.0,"In the year 2035, convict James Cole reluctantly volunteers to be sent back in time to discover the origin of a deadly virus that wiped out nearly all of the earth's population and forced the survivors into underground communities. But when Cole is mistakenly sent to 1990 instead of 1996, he's arrested and locked up in a mental hospital. There he meets psychiatrist Dr. Kathryn Railly and the son of a famous virus expert who may hold the key to the Army of the 12 Monkeys; thought to be responsible for unleashing the killer disease.",7.601,8713,"['Science Fiction', 'Thriller', 'Mystery']",4.0
47,Seven (a.k.a. Se7en) (1995),Mystery|Thriller,114369,807.0,"Two homicide detectives are on a desperate hunt for a serial killer whose crimes are based on the ""seven deadly sins"" in this dark and haunting film that takes viewers from the tortured remains of one victim to the next. The seasoned Det. Somerset researches each sin in an effort to get inside the killer's mind, while his novice partner, Mills, scoffs at his efforts to unravel the case.",8.376,22133,"['Crime', 'Mystery', 'Thriller']",4.0
50,"Usual Suspects, The (1995)",Crime|Mystery|Thriller,114814,629.0,"Held in an L.A. interrogation room, Verbal Kint attempts to convince the feds that a mythic crime lord, Keyser Soze, not only exists, but was also responsible for drawing him and his four partners into a multi-million dollar heist that ended with an explosion in San Pedro harbor – leaving few survivors. Verbal lures his interrogators with an incredible story of the crime lord's almost supernatural prowess.",8.172,10878,"['Drama', 'Crime', 'Thriller']",4.0
111,Taxi Driver (1976),Crime|Drama|Thriller,75314,103.0,"Suffering from insomnia, disturbed loner Travis Bickle takes a job as a New York City cabbie, haunting the streets nightly, growing increasingly detached from reality as he dreams of cleaning up the filthy city.",8.135,12893,"['Crime', 'Drama']",4.5
172,Johnny Mnemonic (1995),Action|Sci-Fi|Thriller,113481,9886.0,"In a dystopian 2021, Johnny is a data trafficker who has an implant that allows him to securely store data too sensitive for regular computer networks. On one delivery run, he accepts a package that not only exceeds the implant's safety limits—and will kill him if the data is not removed in time—but also contains information far more important and valuable than he had ever imagined. On a race against time, he must avoid the assassins sent to kill him and remove the data before it, too, ends his life.",5.8,1433,"['Science Fiction', 'Action', 'Adventure']",0.5
293,Léon: The Professional (a.k.a. The Professional) (Léon) (1994),Action|Crime|Drama|Thriller,110413,101.0,"Léon, the top hit man in New York, has earned a rep as an effective ""cleaner"". But when his next-door neighbors are wiped out by a loose-cannon DEA agent, he becomes the unwilling custodian of 12-year-old Mathilda. Before long, Mathilda's thoughts turn to revenge, and she considers following in Léon's footsteps.",8.3,15469,"['Crime', 'Drama', 'Action']",4.0
296,Pulp Fiction (1994),Comedy|Crime|Drama|Thriller,110912,680.0,"A burger-loving hit man, his philosophical partner, a drug-addled gangster's moll and a washed-up boxer converge in this sprawling, comedic crime caper. Their adventures unfurl in three stories that ingeniously trip back and forth in time.",8.487,29112,"['Thriller', 'Crime', 'Comedy', 'Drama']",4.5
316,Stargate (1994),Action|Adventure|Sci-Fi,111282,2164.0,"An interstellar teleportation device, found in Egypt, leads to a planet with humans resembling ancient Egyptians who worship the god Ra.",7.0,3595,"['Action', 'Adventure', 'Science Fiction']",0.5
356,Forrest Gump (1994),Comedy|Drama|Romance|War,109830,13.0,"A man with a low IQ has accomplished great things in his life and been present during significant historic events—in each case, far exceeding what anyone imagined he could do. But despite all he has achieved, his one true love eludes him.",8.466,28663,"['Comedy', 'Drama', 'Romance']",4.0
541,Blade Runner (1982),Action|Sci-Fi|Thriller,83658,78.0,"In the smog-choked dystopian Los Angeles of 2019, blade runner Rick Deckard is called out of retirement to terminate a quartet of replicants who have escaped to Earth seeking their creator for a way to extend their short life spans.",7.941,14393,"['Science Fiction', 'Drama', 'Thriller']",4.0
593,"Silence of the Lambs, The (1991)",Crime|Horror|Thriller,102926,274.0,"Clarice Starling is a top student at the FBI's training academy.  Jack Crawford wants Clarice to interview Dr. Hannibal Lecter, a brilliant psychiatrist who is also a violent psychopath, serving life behind bars for various acts of murder and cannibalism.  Crawford believes that Lecter may have insight into a case and that Starling, as an attractive young woman, may be just the bait to draw him out.",8.347,17131,"['Crime', 'Thriller', 'Drama']",4.0
628,Primal Fear (1996),Crime|Drama|Mystery|Thriller,117381,1592.0,"An arrogant, high-powered attorney takes on the case of a poor altar boy found running away from the scene of the grisly murder of the bishop who has taken him in. The case gets a lot more complex when the accused reveals that there may or may not have been a third person in the room.",7.655,3637,"['Crime', 'Drama', 'Mystery', 'Thriller']",4.0
903,Vertigo (1958),Drama|Mystery|Romance|Thriller,52357,426.0,"A retired San Francisco detective suffering from acrophobia investigates the strange activities of an old friend's wife, all the while becoming dangerously obsessed with her.",8.158,6033,"['Mystery', 'Romance', 'Thriller']",3.0
924,2001: A Space Odyssey (1968),Adventure|Drama|Sci-Fi,62622,62.0,"Humanity finds a mysterious object buried beneath the lunar surface and sets off to find its origins with the help of HAL 9000, the world's most advanced super computer.",8.063,12048,"['Science Fiction', 'Mystery', 'Adventure']",5.0
1080,Monty Python's Life of Brian (1979),Comedy,79470,583.0,"Brian Cohen is an average young Jewish man, but through a series of ridiculous events, he gains a reputation as the Messiah. When he's not dodging his followers or being scolded by his shrill mother, the hapless Brian has to contend with the pompous Pontius Pilate and acronym-obsessed members of a separatist movement. Rife with Monty Python's signature absurdity, the tale finds Brian's life paralleling Biblical lore, albeit with many more laughs.",7.759,4662,['Comedy'],4.0
1089,Reservoir Dogs (1992),Crime|Mystery|Thriller,105236,500.0,"A botched robbery indicates a police informant, and the pressure mounts in the aftermath at a warehouse. Crime begets violence as the survivors -- veteran Mr. White, newcomer Mr. Orange, psychopathic parolee Mr. Blonde, bickering weasel Mr. Pink and Nice Guy Eddie -- unravel.",8.118,14859,"['Crime', 'Thriller']",4.0
1136,Monty Python and the Holy Grail (1975),Adventure|Comedy|Fantasy,71853,762.0,"King Arthur, accompanied by his squire, recruits his Knights of the Round Table, including Sir Bedevere the Wise, Sir Lancelot the Brave, Sir Robin the Not-Quite-So-Brave-As-Sir-Lancelot and Sir Galahad the Pure. On the way, Arthur battles the Black Knight who, despite having had all his limbs chopped off, insists he can still fight. They reach Camelot, but Arthur decides not  to enter, as ""it is a silly place"".",7.803,6095,"['Adventure', 'Comedy', 'Fantasy']",4.0
1199,Brazil (1985),Fantasy|Sci-Fi,88846,68.0,"Low-level bureaucrat Sam Lowry escapes the monotony of his day-to-day life through a recurring daydream of himself as a virtuous hero saving a beautiful damsel. Investigating a case that led to the wrongful arrest and eventual death of an innocent man instead of wanted terrorist Harry Tuttle, he meets the woman from his daydream, and in trying to help her gets caught in a web of mistaken identities, mindless bureaucracy and lies.",7.67,3493,"['Comedy', 'Science Fiction']",4.0
1203,12 Angry Men (1957),Drama,50083,389.0,"The defense and the prosecution have rested and the jury is filing into the jury room to decide if a young Spanish-American is guilty or innocent of murdering his father. What begins as an open and shut case soon becomes a mini-drama of each of the jurors' prejudices and preconceptions about the trial, the accused, and each other.",8.548,9421,['Drama'],4.0
1208,Apocalypse Now (1979),Action|Drama|War,78788,28.0,"At the height of the Vietnam war, Captain Benjamin Willard is sent on a dangerous mission that, officially, ""does not exist, nor will it ever exist."" His goal is to locate - and eliminate - a mysterious Green Beret Colonel named Walter Kurtz, who has been leading his personal army on illegal guerrilla missions into enemy territory.",8.272,8661,"['Drama', 'War']",4.0
1228,Raging Bull (1980),Drama,81398,1578.0,"The life of boxer Jake LaMotta, whose violence and temper that led him to the top in the ring destroyed his life outside of it.",7.923,4531,['Drama'],3.5
1232,Stalker (1979),Drama|Mystery|Sci-Fi,79944,1398.0,"Near a gray and unnamed city is the Zone, a place guarded by barbed wire and soldiers, and where the normal laws of physics are victim to frequent anomalies. A stalker guides two men into the Zone, specifically to an area in which deep-seated desires are granted.",8.113,2357,"['Science Fiction', 'Drama']",4.5
1237,"Seventh Seal, The (Sjunde inseglet, Det) (1957)",Drama,50976,490.0,"When disillusioned Swedish knight Antonius Block returns home from the Crusades to find his country in the grips of the Black Death, he challenges Death to a chess match for his life. Tormented by the belief that God does not exist, Block sets off on a journey, meeting up with traveling players Jof and his wife, Mia, and becoming determined to evade Death long enough to commit one redemptive act while he still lives.",8.173,3180,"['Fantasy', 'Drama']",4.0
1258,"Shining, The (1980)",Horror,81505,694.0,"Jack Torrance accepts a caretaker job at the Overlook Hotel, where he, along with his wife Wendy and their son Danny, must live isolated from the rest of the world for the winter. But they aren't prepared for the madness that lurks within.",8.209,18209,"['Horror', 'Thriller']",4.5
1265,Groundhog Day (1993),Comedy|Fantasy|Romance,107048,137.0,"A narcissistic TV weatherman, along with his attractive-but-distant producer, and his mawkish cameraman, is sent to report on Groundhog Day in the small town of Punxsutawney, where he finds himself repeating the same day over and over.",7.616,8426,"['Romance', 'Fantasy', 'Drama', 'Comedy']",4.0
1391,Mars Attacks! (1996),Action|Comedy|Sci-Fi,116996,75.0,"A fleet of Martian spacecraft surrounds the world's major cities and all of humanity waits to see if the extraterrestrial visitors have, as they claim, ""come in peace."" U.S. President James Dale receives assurance from science professor Donald Kessler that the Martians' mission is a friendly one. But when a peaceful exchange ends in the total annihilation of the U.S. Congress, military men call for a full-scale nuclear retaliation.",6.416,5650,"['Comedy', 'Fantasy', 'Science Fiction']",3.5
1527,"Fifth Element, The (1997)",Action|Adventure|Comedy|Sci-Fi,119116,18.0,"In 2257, a taxi driver is unintentionally given the task of saving a young girl who is part of the key that will ensure the survival of humanity.",7.558,11211,"['Science Fiction', 'Action', 'Adventure']",4.0
1573,Face/Off (1997),Action|Crime|Drama|Thriller,119094,754.0,"In order to foil a terrorist plot, an FBI agent undergoes facial transplant surgery and assumes the identity of a criminal mastermind. The plan turns sour when the criminal wakes up prematurely and seeks revenge.",7.047,5609,"['Action', 'Crime', 'Science Fiction']",4.0
1584,Contact (1997),Drama|Sci-Fi,118884,686.0,"A radio astronomer receives the first extraterrestrial radio signal ever picked up on Earth. As the world powers scramble to decipher the message and decide upon a course of action, she must make some difficult decisions between her beliefs, the truth, and reality.",7.436,4719,"['Drama', 'Science Fiction', 'Mystery']",4.0
1617,L.A. Confidential (1997),Crime|Film-Noir|Mystery|Thriller,119488,2118.0,Three detectives in the corrupt and brutal L.A. police force of the 1950s use differing methods to uncover a conspiracy behind the shotgun slayings of the patrons at an all-night diner.,7.801,5237,"['Crime', 'Mystery', 'Thriller', 'Drama']",4.0
1625,"Game, The (1997)",Drama|Mystery|Thriller,119174,2649.0,"In honor of his birthday, San Francisco banker Nicholas Van Orton, a financial genius and a cold-hearted loner, receives an unusual present from his younger brother, Conrad: a gift certificate to play a unique kind of game. In nary a nanosecond, Nicholas finds himself consumed by a dangerous set of ever-changing rules, unable to distinguish where the charade ends and reality begins.",7.567,6979,"['Drama', 'Thriller', 'Mystery']",4.0
1645,The Devil's Advocate (1997),Drama|Mystery|Thriller,118971,1813.0,"Aspiring Florida defense lawyer Kevin Lomax accepts a job at a New York law firm. With the stakes getting higher every case, Kevin quickly learns that his boss has something far more evil planned.",7.469,6403,"['Drama', 'Mystery', 'Horror']",4.0
1653,Gattaca (1997),Drama|Sci-Fi|Thriller,119177,782.0,"Vincent is an all-too-human man who dares to defy a system obsessed with genetic perfection. He is an ""In-Valid"" who assumes the identity of a member of the genetic elite to pursue his goal of traveling into space with the Gattaca Aerospace Corporation.",7.563,6621,"['Thriller', 'Science Fiction', 'Mystery', 'Romance']",4.5
1682,"Truman Show, The (1998)",Comedy|Drama|Sci-Fi,120382,37165.0,An insurance salesman begins to suspect that his whole life is actually some sort of reality TV show.,8.1,19327,"['Comedy', 'Drama']",4.0
1704,Good Will Hunting (1997),Drama|Romance,119217,489.0,"Headstrong yet aimless, Will Hunting has a genius-level IQ but chooses to work as a janitor at MIT. When he secretly solves highly difficult graduate-level math problems, his talents are discovered by Professor Gerald Lambeau, who decides to help the misguided youth reach his potential. When Will is arrested for attacking a police officer, Professor Lambeau makes a deal to get leniency for him if he gets court-ordered therapy. Eventually, therapist Dr. Sean Maguire helps Will confront the demons that are holding him back.",8.157,13117,['Drama'],4.0
1721,Titanic (1997),Drama|Romance,120338,597.0,"101-year-old Rose DeWitt Bukater tells the story of her life aboard the Titanic, 84 years later. A young Rose boards the ship with her mother and fiancé. Meanwhile, Jack Dawson and Fabrizio De Rossi win third-class tickets aboard the ship. Rose tells the whole story from Titanic's departure through to its death—on its first and last voyage—on April 15, 1912.",7.906,26343,"['Drama', 'Romance']",2.5
1732,"Big Lebowski, The (1998)",Comedy|Crime,118715,115.0,"Jeffrey 'The Dude' Lebowski, a Los Angeles slacker who only wants to bowl and drink White Russians, is mistaken for another Jeffrey Lebowski, a wheelchair-bound millionaire, and finds himself dragged into a strange series of events involving nihilists, adult film producers, ferrets, errant toes, and large sums of money.",7.84,11690,"['Comedy', 'Crime']",4.5
1754,Fallen (1998),Crime|Drama|Fantasy|Thriller,119099,9411.0,"Homicide detective John Hobbes witnesses the execution of serial killer Edgar Reese. Soon after the execution the killings start again, and they are very similar to Reese's style.",6.779,1499,"['Crime', 'Drama', 'Thriller']",4.0
1921,Pi (1998),Drama|Sci-Fi|Thriller,138704,473.0,"A mathematical genius discovers a link between numbers and reality, and thus believes he can predict the future.",7.11,2351,"['Mystery', 'Drama', 'Thriller']",4.0
2058,"Negotiator, The (1998)",Action|Crime|Drama|Mystery|Thriller,120768,9631.0,"The police try to arrest expert hostage negotiator Danny Roman, who insists he's being framed for his partner's murder in what he believes is an elaborate conspiracy. Thinking there's evidence in the Internal Affairs offices that might clear him, he takes everyone in the office hostage and demands that another well-known negotiator be brought in to handle the situation and secretly investigate the conspiracy.",7.103,2228,"['Action', 'Crime', 'Drama', 'Thriller']",4.0
2232,Cube (1997),Horror|Mystery|Sci-Fi|Thriller,123755,431.0,"A group of strangers find themselves trapped in a maze-like prison. It soon becomes clear that each of them possesses the peculiar skills necessary to escape, if they don't wind up dead first.",6.809,4976,"['Thriller', 'Science Fiction', 'Mystery']",4.0
2311,2010: The Year We Make Contact (1984),Sci-Fi,86837,4437.0,"While planet Earth poises on the brink of nuclear self-destruction, a team of Russian and American scientists aboard the Leonov hurtles to a rendezvous with the still-orbiting Discovery spacecraft and its sole known survivor, the homicidal computer HAL.",6.631,999,"['Thriller', 'Science Fiction']",4.0
2571,"Matrix, The (1999)",Action|Sci-Fi|Thriller,133093,603.0,"Set in the 22nd century, The Matrix tells the story of a computer hacker who joins a group of underground insurgents fighting the vast and powerful computers who now rule the earth.",8.232,26831,"['Action', 'Science Fiction']",4.5
2579,Following (1998),Crime|Mystery|Thriller,154506,11660.0,"Bill, an idle, unemployed aspiring writer, walks the crowded streets of London following randomly chosen strangers, a seemingly innocent entertainment that becomes dangerous when he crosses paths with a mysterious character.",7.137,1718,"['Drama', 'Thriller']",4.0
2672,"Thirteenth Floor, The (1999)",Drama|Sci-Fi|Thriller,139809,1090.0,"In Los Angeles, a wealthy man, known as Mr. Fuller, discovers a shocking secret about the world he lives in. Fearing for his life, he leaves a desperate message for a friend of his in the most unexpected place.",7.073,1411,"['Thriller', 'Science Fiction', 'Mystery']",4.0
2691,"Legend of 1900, The (a.k.a. The Legend of the Pianist on the Ocean) (Leggenda del pianista sull'oceano) (1998)",Drama,120731,10376.0,"The story of a virtuoso piano player who lives his entire life aboard an ocean liner. Born and raised on the ship, 1900 learned about the outside world through interactions with passengers, never setting foot on land, even for the love of his life. Years later, the ship may be destroyed, and a former band member fears that 1900 may still be aboard, willing to go down with the ship.",8.248,2351,"['Drama', 'Music']",4.5
2712,Eyes Wide Shut (1999),Drama|Mystery|Thriller,120663,345.0,"After Dr. Bill Harford's wife, Alice, admits to having sexual fantasies about a man she met, Bill becomes obsessed with having a sexual encounter. He discovers an underground sexual group and attends one of their meetings -- and quickly discovers that he is in over his head.",7.483,6587,"['Drama', 'Thriller', 'Mystery']",4.5
2762,"Sixth Sense, The (1999)",Drama|Horror|Mystery,167404,745.0,"Following an unexpected tragedy, child psychologist Malcolm Crowe meets a nine year old boy named Cole Sear, who is hiding a dark secret.",7.949,12275,"['Mystery', 'Thriller', 'Drama']",4.0
2810,Perfect Blue (1997),Animation|Horror|Mystery|Thriller,156887,10494.0,"Rising pop star Mima quits singing to pursue a career as an actress. After she takes up a role on a popular detective show, her handlers and collaborators begin turning up murdered. Harboring feelings of guilt and haunted by visions of her former self, Mima's reality and fantasy meld into a frenzied paranoia.",8.304,2928,"['Animation', 'Thriller']",4.0
2858,American Beauty (1999),Drama|Romance,169547,14.0,"Lester Burnham, a depressed suburban father in a mid-life crisis, decides to turn his hectic life around after developing an infatuation with his daughter's attractive friend.",8.005,12564,['Drama'],4.0
2959,Fight Club (1999),Action|Crime|Drama|Thriller,137523,550.0,"A ticking-time-bomb insomniac and a slippery soap salesman channel primal male aggression into a shocking new form of therapy. Their concept catches on, with underground ""fight clubs"" forming in every town, until an eccentric gets in the way and ignites an out-of-control spiral toward oblivion.",8.438,30794,"['Drama', 'Thriller']",4.5
2997,Being John Malkovich (1999),Comedy|Drama|Fantasy,120601,492.0,"One day at work, unsuccessful puppeteer Craig finds a portal into the head of actor John Malkovich. The portal soon becomes a passion for anybody who enters its mad and controlling world of overtaking another human body.",7.412,4569,"['Comedy', 'Drama', 'Fantasy']",4.0
3147,"Green Mile, The (1999)",Crime|Drama,120689,497.0,"A supernatural tale set on death row in a Southern prison, where gentle giant John Coffey possesses the mysterious power to heal people's ailments. When the cell block's head guard, Paul Edgecomb, recognizes Coffey's miraculous gift, he tries desperately to help stave off the condemned man's execution.",8.503,18392,"['Fantasy', 'Drama', 'Crime']",4.0
3415,"Mirror, The (Zerkalo) (1975)",Drama,72443,1396.0,"A dying man in his forties recalls his childhood, his mother, the war and personal moments that tell of and juxtapose pivotal moments in Soviet history with daily life.",7.963,1022,"['Drama', 'History']",4.0
3481,High Fidelity (2000),Comedy|Drama|Romance,146882,243.0,"After his long-time girlfriend dumps him, a thirty-year-old record store owner seeks to understand why he is unlucky in love while recounting his ""top five breakups of all time"".",7.122,2082,"['Drama', 'Comedy', 'Romance', 'Music']",4.0
3535,American Psycho (2000),Crime|Horror|Mystery|Thriller,144084,1359.0,"A wealthy New York investment banking executive hides his alternate psychopathic ego from his co-workers and friends as he escalates deeper into his illogical, gratuitous fantasies.",7.408,11614,"['Thriller', 'Drama', 'Crime']",4.5
3565,Where the Heart Is (2000),Comedy|Drama,198021,10564.0,"Novalee Nation is a 17-year-old Tennessee transient who has to grow up in a hurry when she's left pregnant and abandoned by her boyfriend on a roadside, and takes refuge in the friendly aisles of Wal-Mart. Eventually, some eccentric but kindly strangers 'adopt' Novalee and her infant daughter, helping them buck the odds and build a new life.",7.111,711,"['Comedy', 'Drama', 'Romance']",0.5
3578,Gladiator (2000),Action|Adventure|Drama,172495,98.0,"After the death of Emperor Marcus Aurelius, his devious son takes power and demotes Maximus, one of Rome's most capable generals who Marcus preferred. Eventually, Maximus is forced to become a gladiator and battle to the death against other men for the amusement of paying audiences.",8.22,20080,"['Action', 'Drama', 'Adventure']",4.0
3615,Dinosaur (2000),Adventure|Animation|Children,130623,10567.0,An orphaned dinosaur raised by lemurs joins an arduous trek to a sancturary after a meteorite shower destroys his family home.,6.547,2640,"['Animation', 'Family', 'Adventure']",3.5
3676,Eraserhead (1977),Drama|Horror,74486,985.0,"First-time father Henry Spencer tries to survive his industrial environment, his angry girlfriend, and the unbearable screams of his newly born mutant child.",7.3,2617,"['Science Fiction', 'Horror']",4.0
3717,Gone in 60 Seconds (2000),Action|Crime,187078,9679.0,"Upon learning that he has to come out of retirement to steal 50 cars in one night to save his brother Kip's life, former car thief Randall ""Memphis"" Raines enlists help from a few ""boost happy"" pals to accomplish a seemingly impossible feat. From countless car chases to relentless cops, the high-octane excitement builds as Randall swerves around more than a few roadblocks to keep Kip alive.",6.445,4648,"['Action', 'Crime', 'Thriller']",4.0
3786,But I'm a Cheerleader (1999),Comedy,179116,20770.0,"Megan is an all-American girl. A cheerleader. She has a boyfriend. But Megan doesn't like kissing her boyfriend very much. And she's pretty touchy with her cheerleader friends. Her conservative parents worry that she must be a lesbian and send her off to ""sexual redirection"" school, where she must, with other lesbians and gays learn how to be straight.",7.058,756,"['Comedy', 'Romance']",0.5
3793,X-Men (2000),Action|Adventure|Sci-Fi,120903,36657.0,"Two mutants, Rogue and Wolverine, come to a private academy for their kind whose resident superhero team, the X-Men, must oppose a terrorist organization with similar powers.",7.006,11773,"['Adventure', 'Action', 'Science Fiction']",2.5
3994,Unbreakable (2000),Drama|Sci-Fi,217869,9741.0,"An ordinary man makes an extraordinary discovery when a train accident leaves his fellow passengers dead — and him unscathed. The answer to this mystery could lie with the mysterious Elijah Price, a man who suffers from a disease that renders his bones as fragile as glass.",7.145,9600,"['Thriller', 'Drama', 'Mystery']",4.0
