movieId,title,genres,imdbId,tmdbId,overview,tmdb_vote_average,tmdb_vote_count,tmdb_genres,rating
1963,Take the Money and Run (1969),Comedy|Crime,65063,11485.0,"Virgil Starkwell is intent on becoming a notorious bank robber. Unfortunately for Virgil and his not-so-budding career, he is completely incompetent.",7.105,760,"['Comedy', 'Crime']",3.5
1964,Klute (1971),Drama|Mystery,67309,466.0,A high-priced call girl is forced to depend on a reluctant private eye when she is stalked by a psychopath.,6.746,482,"['Thriller', 'Mystery', 'Crime']",3.0
1968,"Breakfast Club, The (1985)",Comedy|Drama,88847,2108.0,"Five high school students from different walks of life endure a Saturday detention under a power-hungry principal. The disparate group includes rebel John, princess Claire, outcast Allison, brainy Brian and Andrew, the jock. Each has a chance to tell his or her story, making the others see them a little differently -- and when the day ends, they question whether school will ever be the same.",7.728,8256,"['Comedy', 'Drama']",3.0
2000,Lethal Weapon (1987),Action|Comedy|Crime|Drama,93409,941.0,A veteran cop and an unstable detective become partners who must put their differences aside in order to bring down a heroin-smuggling ring run by ex-Special Forces.,7.285,4782,"['Adventure', 'Action', 'Comedy', 'Thriller', 'Crime']",3.5
2001,Lethal Weapon 2 (1989),Action|Comedy|Crime|Drama,97733,942.0,Riggs and Murtaugh are on the trail of South African diplomats using their immunity to engage in criminal activities.,7.022,3563,"['Action', 'Adventure', 'Comedy', 'Crime', 'Thriller']",3.0
2023,"Godfather: Part III, The (1990)",Crime|Drama|Mystery|Thriller,99674,242.0,"In the midst of trying to legitimize his business dealings in 1979 New York and Italy, aging mafia don, Michael Corleone seeks forgiveness for his sins while taking a young protege under his wing.",7.417,6524,"['Crime', 'Drama', 'Thriller']",4.5
2028,Saving Private Ryan (1998),Action|Drama|War,120815,857.0,"As U.S. troops storm the beaches of Normandy, three brothers lie dead on the battlefield, with a fourth trapped behind enemy lines. Ranger captain John Miller and seven men are tasked with penetrating German-held territory and bringing the boy home.",8.22,16538,"['Drama', 'History', 'War']",4.5
2058,"Negotiator, The (1998)",Action|Crime|Drama|Mystery|Thriller,120768,9631.0,"The police try to arrest expert hostage negotiator Danny Roman, who insists he's being framed for his partner's murder in what he believes is an elaborate conspiracy. Thinking there's evidence in the Internal Affairs offices that might clear him, he takes everyone in the office hostage and demands that another well-known negotiator be brought in to handle the situation and secretly investigate the conspiracy.",7.103,2228,"['Action', 'Crime', 'Drama', 'Thriller']",3.0
2064,Roger & Me (1989),Documentary,98213,1779.0,"A documentary about the closure of General Motors' plant at Flint, Michigan, which resulted in the loss of 30,000 jobs. Details the attempts of filmmaker Michael Moore to get an interview with GM CEO Roger Smith.",7.1,306,"['Documentary', 'History', 'Comedy']",4.0
2067,Doctor Zhivago (1965),Drama|Romance|War,59113,907.0,"The life of a Russian physician and poet who, although married to another, falls in love with a political activist's wife and experiences hardship during World War I and then the October Revolution.",7.5,1207,"['Drama', 'Romance', 'War']",3.0
2078,"Jungle Book, The (1967)",Animation|Children|Comedy|Musical,61852,9325.0,"The boy Mowgli makes his way to the man-village with Bagheera, the wise panther. Along the way he meets jazzy King Louie, the hypnotic snake Kaa and the lovable, happy-go-lucky bear Baloo, who teaches Mowgli ""The Bare Necessities"" of life and the true meaning of friendship.",7.278,6456,"['Family', 'Animation', 'Adventure']",3.5
2115,Indiana Jones and the Temple of Doom (1984),Action|Adventure|Fantasy,87469,87.0,"After arriving in India, Indiana Jones is asked by a desperate village to find a mystical stone. He agrees – and stumbles upon a secret cult plotting a terrible plan in the catacombs of an ancient palace.",7.302,9713,"['Adventure', 'Action']",3.5
2130,Atlantic City (1980),Crime|Drama|Romance,80388,23954.0,"In a corrupt city, a small-time gangster and the estranged wife of a pot dealer find themselves thrown together in an escapade of love, money, drugs and danger.",6.8,283,"['Crime', 'Drama', 'Romance']",3.5
2132,Who's Afraid of Virginia Woolf? (1966),Drama,61184,396.0,"A history professor and his wife entertain a young couple who are new to the university's faculty. As the drinks flow, secrets come to light, and the middle-aged couple unload onto their guests the full force of the bitterness, dysfunction, and animosity that defines their marriage.",7.722,864,['Drama'],4.0
2146,St. Elmo's Fire (1985),Drama|Romance,90060,11557.0,"Reluctant to let go of college life, a close-knit team of seven friends--irresponsible saxophone player Billy, young Republican Alec, his girlfriend Leslie, struggling journalist Kevin, drama queen Jules, lovesick waiter Kirby, and Wendy, a social worker with a heart of gold--realise the party is over. And as the burdens of maturity close in on the young dreamers, the complexities of adulthood and the daily struggle of growing up put their sacred friendship to the test. But everyone knows life is not a bed of roses. It won't be easy, but when all is said and done, what will it take for St. Elmo's clique to find its place in the real world?",6.128,564,"['Drama', 'Romance', 'Comedy']",4.0
2194,"Untouchables, The (1987)",Action|Crime|Drama,94226,117.0,"Elliot Ness, an ambitious prohibition agent, is determined to take down Al Capone. In order to achieve this goal, he forms a group given the nickname “The Untouchables”.",7.756,5930,"['Crime', 'History', 'Thriller']",3.0
2268,"Few Good Men, A (1992)",Crime|Drama|Thriller,104257,881.0,"When cocky military lawyer Lt. Daniel Kaffee and his co-counsel, Lt. Cmdr. JoAnne Galloway, are assigned to a murder case, they uncover a hazing ritual that could implicate high-ranking officials such as shady Col. Nathan Jessep.",7.545,3889,['Drama'],4.0
2289,"Player, The (1992)",Comedy|Crime|Drama,105151,10403.0,A Hollywood studio executive is being sent death threats by a writer whose script he rejected - but which one?,7.21,882,"['Mystery', 'Drama', 'Thriller']",4.0
2291,Edward Scissorhands (1990),Drama|Fantasy|Romance,99487,162.0,A small suburban town receives a visit from a castaway unfinished science experiment named Edward.,7.719,13334,"['Fantasy', 'Drama', 'Romance']",4.0
2300,"Producers, The (1968)",Comedy,63462,30197.0,"Broadway producer Max Bialystock and his accountant, Leo Bloom, plan to make money by charming wealthy old biddies to invest in a production many times over the actual cost, and then put on a sure-fire flop, so nobody will ask for their money back – and what can be a more certain flop than a tasteless musical celebrating Hitler.",7.085,834,['Comedy'],3.0
2302,My Cousin Vinny (1992),Comedy,104952,10377.0,"Two carefree pals from Brooklyn traveling through rural Alabama on their way back to college are mistakenly arrested, and charged with murder. Fortunately, one of them has a cousin who's a lawyer - Vincent Gambini, a former auto mechanic from Brooklyn who just passed his bar exam after his sixth try. When he arrives with his leather-clad girlfriend, to try his first case, it's a real shock - for him and the Deep South!",7.5,1699,"['Comedy', 'Drama']",3.0
2324,Life Is Beautiful (La Vita è bella) (1997),Comedy|Drama|Romance|War,118799,637.0,A touching story of an Italian book seller of Jewish ancestry who lives in his own little fairy tale. His creative and happy life would come to an abrupt halt when his entire family is deported to a concentration camp during World War II. While locked up he tries to convince his son that the whole thing is just a game.,8.44,13552,"['Comedy', 'Drama']",4.0
2336,Elizabeth (1998),Drama,127536,4518.0,"The story of the ascension to the throne and the early reign of Queen Elizabeth the First, the endless attempts by her council to marry her off, the Catholic hatred of her and her romance with Lord Robert Dudley.",7.2,1441,"['Drama', 'History']",4.0
2347,"Pope of Greenwich Village, The (1984)",Drama,87932,32081.0,"Charlie and his troublesome cousin Paulie decide to steal $150000 in order to back a ""sure thing"" race horse that Paulie has inside information on. The aftermath of the robbery gets them into serious trouble with the local Mafia boss and the corrupt New York City police department.",6.388,147,"['Action', 'Comedy', 'Crime']",2.5
2352,"Big Chill, The (1983)",Comedy|Drama,85244,12560.0,Seven old college friends gather for a weekend reunion after the funeral of one of their own.,6.864,621,"['Comedy', 'Drama']",3.5
2353,Enemy of the State (1998),Action|Thriller,120660,9798.0,"The life of labor lawyer and dedicated family man Robert 'Bobby' Dean is turned upside down after a chance meeting with a college buddy while holiday shopping. Unbeknownst to Dean, he's just been burdened with a videotape of a congressman's assassination. Hot on the trail of this tape is a ruthless group of National Security Agents commanded by a belligerently ambitious NSA official named Reynolds. Using satellite surveillance, bugs, and other sophisticated snooping devices, the NSA infiltrates every facet of Dean's existence, tracing each physical and digital footprint he leaves while also framing him for murder. With the help of the mysterious Brill, he attempts to throw the NSA off his trail and prove his innocence.",7.056,4042,"['Action', 'Drama', 'Thriller']",3.5
2355,"Bug's Life, A (1998)",Adventure|Animation|Children|Comedy,120623,9487.0,"On behalf of ""oppressed bugs everywhere,"" an inventive ant named Flik hires a troupe of warrior bugs to defend his bustling colony from a horde of freeloading grasshoppers led by the evil-minded Hopper.",6.972,9464,"['Family', 'Animation', 'Adventure', 'Comedy', 'Drama']",3.0
2391,"Simple Plan, A (1998)",Crime|Drama|Thriller,120324,10223.0,"Captivated by the lure of sudden wealth, the quiet rural lives of two brothers erupt into conflicts of greed, paranoia and distrust when over $4 million in cash is discovered at the remote site of a downed small airplane. Their simple plan to retain the money while avoiding detection opens a Pandora's box when the fear of getting caught triggers panicked behavior and leads to virulent consequences.",7.199,995,"['Crime', 'Drama', 'Thriller']",4.0
2396,Shakespeare in Love (1998),Comedy|Drama|Romance,138097,1934.0,"Young Shakespeare is forced to stage his latest comedy, ""Romeo and Ethel, the Pirate's Daughter,"" before it's even written. When a lovely noblewoman auditions for a role, they fall into forbidden love -- and his play finds a new life (and title). As their relationship progresses, Shakespeare's comedy soon transforms into tragedy.",6.8,3095,"['Romance', 'History', 'Comedy']",3.0
2401,Pale Rider (1985),Western,89767,8879.0,A mysterious preacher protects a humble prospector village from a greedy mining company trying to encroach on their land.,7.167,1132,"['Western', 'Drama']",3.5
2406,Romancing the Stone (1984),Action|Adventure|Comedy|Romance,88011,9326.0,"Though she can spin wild tales of passionate romance, novelist Joan Wilder has no life of her own. Then one day adventure comes her way in the form of a mysterious package. It turns out that the parcel is the ransom she'll need to free her abducted sister, so Joan flies to South America to hand it over. But she gets on the wrong bus and winds up hopelessly stranded in the jungle.",6.76,1932,"['Romance', 'Comedy', 'Action', 'Adventure']",3.5
2424,You've Got Mail (1998),Comedy|Romance,128853,9489.0,"Book superstore magnate, Joe Fox and independent book shop owner, Kathleen Kelly fall in love in the anonymity of the Internet—both blissfully unaware that he's trying to put her out of business.",6.692,3451,"['Comedy', 'Romance']",3.5
2433,"Civil Action, A (1998)",Drama,120633,9422.0,"Jan Schlickmann is a cynical lawyer who goes out to 'get rid of' a case, only to find out it is potentially worth millions. The case becomes his obsession, to the extent that he is willing to give up everything—including his career and his clients' goals—in order to continue the case against all odds.",6.45,462,['Drama'],4.5
2470,Crocodile Dundee (1986),Adventure|Comedy,90555,9671.0,"When a New York reporter plucks crocodile hunter Mick Dundee from the Australian Outback for a visit to the Big Apple, it's a clash of cultures and a recipe for good-natured comedy as naïve Dundee negotiates the concrete jungle. He proves that his instincts are quite useful in the city and adeptly handles everything from wily muggers to high-society snoots without breaking a sweat.",6.418,1993,"['Adventure', 'Comedy']",1.5
2476,Heartbreak Ridge (1986),Action|War,91187,10015.0,"A hard-nosed, hard-living Marine gunnery sergeant clashes with his superiors and his ex-wife as he takes command of a spoiled recon platoon with a bad attitude.",6.887,1057,"['War', 'Drama']",4.0
2502,Office Space (1999),Comedy|Crime,151804,1542.0,"A depressed white-collar worker tries hypnotherapy, only to find himself in a perpetual state of devil-may-care bliss that prompts him to start living by his own rules, and hatch a hapless attempt to embezzle money from his soul-killing employers.",7.373,3187,['Comedy'],4.0
2529,Planet of the Apes (1968),Action|Drama|Sci-Fi,63442,871.0,"Astronaut Taylor crash lands on a distant planet ruled by apes who use a primitive race of humans for experimentation and sport. Soon Taylor finds himself among the hunted, his life in the hands of a benevolent chimpanzee scientist.",7.643,3751,"['Science Fiction', 'Adventure', 'Drama', 'Action']",4.0
2542,"Lock, Stock & Two Smoking Barrels (1998)",Comedy|Crime|Thriller,120735,100.0,A card shark and his unwillingly-enlisted friends need to make a lot of cash quick after losing a sketchy poker match. To do this they decide to pull a heist on a small-time gang who happen to be operating out of the flat next door.,8.107,6879,"['Comedy', 'Crime']",4.0
2580,Go (1999),Comedy|Crime,139239,9430.0,"A supermarket clerk decides to step in for an absent drug dealer, setting off an explosive, comedic chain of events.",7.0,766,"['Crime', 'Comedy', 'Thriller']",1.0
2657,"Rocky Horror Picture Show, The (1975)",Comedy|Horror|Musical|Sci-Fi,73629,36685.0,"After getting a flat tire in the middle of nowhere, newly engaged couple Brad and Janet encounter the eerie mansion of the flamboyant, seductive Dr. Frank-N-Furter and a variety of eccentric characters. Through elaborate dance and rock music, the mad scientist unveils his latest creation: a perfect, muscular man.",7.4,2957,"['Comedy', 'Science Fiction', 'Fantasy', 'Horror']",3.0
2671,Notting Hill (1999),Comedy|Romance,125439,509.0,London bookstore owner William Thacker's quiet life turns upside down when a chance encounter with famous actress Anna Scott sparks an unlikely romance challenged by their vastly different worlds.,7.264,6435,"['Romance', 'Comedy']",3.0
2683,Austin Powers: The Spy Who Shagged Me (1999),Action|Adventure|Comedy,145660,817.0,"When diabolical genius Dr. Evil travels back in time to steal superspy Austin Powers's ‘mojo,’ Austin must return to the swingin' '60s himself - with the help of American agent, Felicity Shagwell - to stop the dastardly plan. Once there, Austin faces off against Dr. Evil's army of minions to try to save the world in his own unbelievably groovy way.",6.288,3482,"['Adventure', 'Comedy', 'Crime', 'Science Fiction']",1.0
2711,My Life So Far (1999),Drama,120899,48958.0,"A memoir of the lives of a family growing up on a post World War I British estate headed up by a strong disciplinarian, her daughter, her inventor husband, their ten year old son and his older sister. Through the household comes a number of suitors hoping to impress the young woman, including an aviator. When the elder woman's son shows up at the estate with his French fiancé, everything gets thrown into turmoil. The young boy takes a sudden interest in her sexual allure and his father is disturbed by his own non-Victorian feelings.",5.7,32,"['Comedy', 'Drama']",3.5
2716,Ghostbusters (a.k.a. Ghost Busters) (1984),Action|Comedy|Sci-Fi,87332,620.0,"After losing their academic posts at a prestigious university, a team of parapsychologists goes into business as proton-pack-toting ""ghostbusters"" who exterminate ghouls, hobgoblins and supernatural pests of all stripes. An ad campaign pays off when a knockout cellist hires the squad to purge her swanky digs of demons that appear to be living in her refrigerator.",7.495,9359,"['Comedy', 'Fantasy']",3.0
2728,Spartacus (1960),Action|Drama|Romance|War,54331,967.0,"The rebellious Thracian Spartacus, born and raised a slave, is sold to Gladiator trainer Batiatus. After weeks of being trained to kill for the arena, Spartacus turns on his owners and leads the other slaves in rebellion. As the rebels move from town to town, their numbers swell as escaped slaves join their ranks. Under the leadership of Spartacus, they make their way to southern Italy, where they will cross the sea and return to their homes.",7.5,2263,"['History', 'War', 'Drama', 'Adventure']",3.5
2739,"Color Purple, The (1985)",Drama,88939,873.0,"An epic tale spanning forty years in the life of Celie, an African-American woman living in the South who survives incredible abuse and bigotry. After Celie's abusive father marries her off to the equally debasing 'Mister' Albert Johnson, things go from bad to worse, leaving Celie to find companionship anywhere she can. She perseveres, holding on to her dream of one day being reunited with her sister in Africa.",7.748,1882,"['Drama', 'History']",4.5
2762,"Sixth Sense, The (1999)",Drama|Horror|Mystery,167404,745.0,"Following an unexpected tragedy, child psychologist Malcolm Crowe meets a nine year old boy named Cole Sear, who is hiding a dark secret.",7.949,12275,"['Mystery', 'Thriller', 'Drama']",4.0
2791,Airplane! (1980),Comedy,80339,813.0,An ex-fighter pilot forced to take over the controls of an airliner when the flight crew succumbs to food poisoning.,7.307,4790,['Comedy'],4.0
2797,Big (1988),Comedy|Drama|Fantasy|Romance,94737,2280.0,When a young boy makes a wish at a carnival machine to be big—he wakes up the following morning to find that it has been granted and his body has grown older overnight. But he is still the same 13-year-old boy inside. Now he must learn how to cope with the unfamiliar world of grown-ups including getting a job and having his first romantic encounter with a woman.,7.183,3793,"['Fantasy', 'Drama', 'Comedy', 'Romance', 'Family']",3.0
2804,"Christmas Story, A (1983)",Children|Comedy,85334,850.0,"The comic mishaps and adventures of a young boy named Ralph, trying to convince his parents, teachers, and Santa that a Red Ryder B.B. gun really is the perfect Christmas gift for the 1940s.",7.22,1318,"['Comedy', 'Family']",4.5
2819,Three Days of the Condor (3 Days of the Condor) (1975),Drama|Mystery|Romance|Thriller,73802,11963.0,"When bookish CIA researcher Joe Turner finds all his co-workers dead, he, together with a woman he has kidnapped, must work together to outwit those responsible until he determines who he can really trust.",7.283,1253,"['Thriller', 'Mystery']",4.0
2858,American Beauty (1999),Drama|Romance,169547,14.0,"Lester Burnham, a depressed suburban father in a mid-life crisis, decides to turn his hectic life around after developing an infatuation with his daughter's attractive friend.",8.005,12564,['Drama'],4.5
2871,Deliverance (1972),Adventure|Drama|Thriller,68473,10669.0,"Intent on seeing the Cahulawassee River before it's turned into one huge lake, outdoor fanatic Lewis Medlock takes his friends on a river-rafting trip they'll never forget into the dangerous American back-country.",7.312,1701,"['Drama', 'Adventure', 'Thriller']",4.5
2890,Three Kings (1999),Action|Adventure|Comedy|Drama|War,120188,6415.0,"A group of American soldiers stationed in Iraq at the end of the Gulf War find a map they believe will take them to a huge cache of stolen Kuwaiti gold hidden near their base, and they embark on a secret mission that's destined to change everything.",6.652,2161,"['Action', 'Comedy', 'War']",2.5
2918,Ferris Bueller's Day Off (1986),Comedy,91042,9377.0,"After high school slacker Ferris Bueller successfully fakes an illness in order to skip school for the day, he goes on a series of adventures throughout Chicago with his girlfriend Sloane and best friend Cameron, all the while trying to outwit his wily school principal and fed-up sister.",7.6,5138,['Comedy'],4.0
2919,"Year of Living Dangerously, The (1982)",Drama|Romance|War,86617,11541.0,A young Australian reporter tries to navigate the political turmoil of Indonesia during the rule of President Sukarno with the help of a diminutive photographer.,6.653,340,"['Romance', 'Drama']",5.0
2921,High Plains Drifter (1973),Western,68699,11901.0,"A gunfighting stranger comes to the small settlement of Lago. After gunning down three gunmen who tried to kill him, the townsfolk decide to hire the Stranger to hold off three outlaws who are on their way.",7.339,1246,"['Western', 'Drama', 'Mystery']",3.5
2932,Days of Heaven (1978),Drama,77405,16642.0,"In 1916, a Chicago steel worker accidentally kills his supervisor and flees to the Texas panhandle with his girlfriend and little sister to work harvesting wheat in the fields of a stoic farmer.",7.511,1091,"['Drama', 'Romance']",3.5
2944,"Dirty Dozen, The (1967)",Action|Drama|War,61578,1654.0,"12 American military prisoners in World War II are ordered to infiltrate a well-guarded enemy château and kill the Nazi officers vacationing there. The soldiers, most of whom are facing death sentences for a variety of violent crimes, agree to the mission and the possible commuting of their sentences.",7.6,1257,"['Action', 'Adventure', 'War']",3.5
2951,"Fistful of Dollars, A (Per un pugno di dollari) (1964)",Action|Western,58461,391.0,"The Man With No Name enters the Mexican village of San Miguel in the midst of a power struggle among the three Rojo brothers and sheriff John Baxter. When a regiment of Mexican soldiers bearing gold intended to pay for new weapons is waylaid by the Rojo brothers, the stranger inserts himself into the middle of the long-simmering battle, selling false information to both sides for his own benefit.",7.828,4491,['Western'],4.0
2959,Fight Club (1999),Action|Crime|Drama|Thriller,137523,550.0,"A ticking-time-bomb insomniac and a slippery soap salesman channel primal male aggression into a shocking new form of therapy. Their concept catches on, with underground ""fight clubs"" forming in every town, until an eccentric gets in the way and ignites an out-of-control spiral toward oblivion.",8.438,30794,"['Drama', 'Thriller']",3.5
2966,"Straight Story, The (1999)",Adventure|Drama,166896,404.0,"A retired farmer and widower in his 70s, Alvin Straight learns one day that his distant brother Lyle has suffered a stroke and may not recover. Alvin is determined to make things right with Lyle while he still can, but his brother lives in Wisconsin, while Alvin is stuck in Iowa with no car and no driver's license. Then he hits on the idea of making the trip on his old lawnmower, thus beginning a picturesque and at times deeply spiritual odyssey.",7.725,1679,['Drama'],3.0
2973,Crimes and Misdemeanors (1989),Comedy|Crime|Drama,97123,11562.0,A renowned ophthalmologist is desperate to cut off an adulterous relationship…which ends up in murder; and a frustrated documentary filmmaker woos an attractive television producer while making a film about her insufferably self-centered boss.,7.418,912,"['Comedy', 'Drama', 'Crime']",3.0
2987,Who Framed Roger Rabbit? (1988),Adventure|Animation|Children|Comedy|Crime|Fantasy|Mystery,96438,856.0,"'Toon star Roger is worried that his wife Jessica is playing pattycake with someone else, so the studio hires detective Eddie Valiant to snoop on her. But the stakes are quickly raised when Marvin Acme is found dead and Roger is the prime suspect.",7.532,5943,"['Fantasy', 'Animation', 'Comedy', 'Crime']",4.5
2997,Being John Malkovich (1999),Comedy|Drama|Fantasy,120601,492.0,"One day at work, unsuccessful puppeteer Craig finds a portal into the head of actor John Malkovich. The portal soon becomes a passion for anybody who enters its mad and controlling world of overtaking another human body.",7.412,4569,"['Comedy', 'Drama', 'Fantasy']",4.0
3006,"Insider, The (1999)",Drama|Thriller,140352,9008.0,A research chemist comes under personal and professional attack when he decides to appear in a 60 Minutes exposé on Big Tobacco.,7.454,1925,"['Drama', 'Thriller']",3.5
3035,Mister Roberts (1955),Comedy|Drama|War,48380,37853.0,Mr. Roberts is a Navy officer who's yearning for battle but is stuck in the backwaters of World War II on a non-commissioned ship run by the bullying Captain Morton.,7.1,163,"['Comedy', 'Drama', 'War']",3.0
3037,Little Big Man (1970),Western,65988,11040.0,"Jack Crabb, looking back from extreme old age, tells of his life being raised by Indians and fighting with General Custer.",7.478,675,"['Western', 'Comedy', 'Adventure']",3.5
3062,"Longest Day, The (1962)",Action|Drama|War,56197,9289.0,"The retelling of June 6, 1944, from the perspectives of the Germans, US, British, Canadians, and the Free French. Marshall Erwin Rommel, touring the defenses being established as part of the Reich's Atlantic Wall, notes to his officers that when the Allied invasion comes they must be stopped on the beach. ""For the Allies as well as the Germans, it will be the longest day""",7.594,977,"['War', 'Action', 'Drama']",4.0
