movieId,title,genres,imdbId,tmdbId,overview,tmdb_vote_average,tmdb_vote_count,tmdb_genres,rating
31685,Hitch (2005),Comedy|Romance,386588,8488.0,"Dating coach Alex 'Hitch' Hitchens mentors a bumbling client, Albert, who hopes to win the heart of the glamorous Allegra Cole. While Albert makes progress, Hitch faces his own romantic setbacks when proven techniques fail to work on Sara Melas, a tabloid reporter digging for dirt on Allegra Cole's love life. When Sara discovers Hitch's connection to Albert – now Allegra's boyfriend – it threatens to destroy both relationships.",6.57,6002,"['Comedy', 'Drama', 'Romance']",3.5
31696,Constantine (2005),Action|Fantasy|Horror|Thriller,360486,561.0,"John Constantine has literally been to Hell and back. When he teams up with a policewoman to solve the mysterious suicide of her twin sister, their investigation takes them through the world of demons and angels that exists beneath the landscape of contemporary Los Angeles.",7.114,7621,"['Fantasy', 'Action', 'Horror']",3.0
31698,Son of the Mask (2005),Adventure|Children|Comedy|Fantasy,362165,10214.0,"Tim Avery, an aspiring cartoonist, finds himself in a predicament when his dog stumbles upon the mask of Loki. Then after conceiving an infant son ""born of the mask"", he discovers just how looney child raising can be.",4.2,1892,"['Fantasy', 'Comedy', 'Family', 'Adventure']",1.0
31878,Kung Fu Hustle (Gong fu) (2004),Action|Comedy,373074,9470.0,"It's the 1940s, and the notorious Axe Gang terrorizes Shanghai. Small-time criminals Sing and Bone hope to join, but they only manage to make lots of very dangerous enemies. Fortunately for them, kung fu masters and hidden strength can be found in unlikely places. Now they just have to take on the entire Axe Gang.",7.479,2982,"['Action', 'Comedy', 'Crime', 'Fantasy']",4.0
32296,Miss Congeniality 2: Armed and Fabulous (2005),Adventure|Comedy|Crime,385307,10040.0,"After her triumph at the Miss United States pageant, FBI agent Gracie Hart becomes an overnight sensation -- and the new ""face of the FBI"". But it's time to spring into action again when the pageant's winner, Cheryl, and emcee, Stan, are abducted.",5.8,1904,"['Action', 'Comedy']",2.0
32587,Sin City (2005),Action|Crime|Film-Noir|Mystery|Thriller,401792,187.0,"Welcome to Sin City. This town beckons to the tough, the corrupt, the brokenhearted. Some call it dark… Hard-boiled. Then there are those who call it home — Crooked cops, sexy dames, desperate vigilantes. Some are seeking revenge, others lust after redemption, and then there are those hoping for a little of both. A universe of unlikely and reluctant heroes still trying to do the right thing in a city that refuses to care.",7.464,8460,"['Crime', 'Thriller']",4.5
32596,Sahara (2005),Action|Adventure|Comedy,318649,7364.0,"Seasoned adventurer and treasure hunter Dirk Pitt, a former Navy SEAL, sets out for the African desert with his wisecracking buddy Al in search of a confederate ironclad battleship rumored to have vanished long ago, the main draw being the treasure supposedly hidden within the lost vessel. When the daring duo come across Dr. Eva Rojas, a beautiful scientist who is juggling an escape from a warlord and a mission to stop the spread of a powerful plague, their desert expedition begins to heat up.",5.913,1556,"['Action', 'Adventure', 'Comedy', 'Drama', 'Mystery']",3.5
32898,"Trip to the Moon, A (Voyage dans la lune, Le) (1902)",Action|Adventure|Fantasy|Sci-Fi,417,775.0,"Professor Barbenfouillis and five of his colleagues from the Academy of Astronomy travel to the Moon aboard a rocket propelled by a giant cannon. Once on the lunar surface, the bold explorers face the many perils hidden in the caves of the mysterious planet.",7.908,1889,"['Adventure', 'Science Fiction']",4.0
33004,"Hitchhiker's Guide to the Galaxy, The (2005)",Adventure|Comedy|Sci-Fi,371724,7453.0,"Mere seconds before the Earth is to be demolished by an alien construction crew, Arthur Dent is swept off the planet by his friend Ford Prefect, a researcher penning a new edition of ""The Hitchhiker's Guide to the Galaxy.""",6.677,4032,"['Adventure', 'Comedy', 'Science Fiction']",3.0
33154,Enron: The Smartest Guys in the Room (2005),Documentary,413845,13020.0,"A documentary about the Enron corporation, its faulty and corrupt business practices, and how they led to its fall.",7.178,281,['Documentary'],4.5
33162,Kingdom of Heaven (2005),Action|Drama|Romance|War,320661,1495.0,"After his wife dies, a blacksmith named Balian is thrust into royalty, political intrigue and bloody holy wars during the Crusades.",7.001,4619,"['Drama', 'Action', 'Adventure', 'History', 'War']",3.0
33166,Crash (2004),Crime|Drama,375679,1640.0,"In post-Sept. 11 Los Angeles, tensions erupt when the lives of a Brentwood housewife, her district attorney husband, a Persian shopkeeper, two cops, a pair of carjackers and a Korean couple converge during a 36-hour period.",7.213,3663,['Drama'],4.5
33493,Star Wars: Episode III - Revenge of the Sith (2005),Action|Adventure|Sci-Fi,121766,1895.0,The evil Darth Sidious enacts his final plan for unlimited power – and the heroic Jedi Anakin Skywalker must choose a side.,7.5,14363,"['Adventure', 'Action', 'Science Fiction']",3.5
33615,Madagascar (2005),Adventure|Animation|Children|Comedy,351283,953.0,Four animal friends get a taste of the wild life when they break out of captivity at the Central Park Zoo and wash ashore on the island of Madagascar.,6.9,11300,"['Family', 'Animation', 'Adventure', 'Comedy']",4.0
33646,"Longest Yard, The (2005)",Comedy|Drama,398165,9291.0,"Disgraced pro football quarterback Paul Crewe lands in a Texas federal penitentiary, where manipulative Warden Hazen recruits him to advise the institution's football team of prison guards. Crewe suggests a tune-up game which lands him quarterbacking a crew of inmates in a game against the guards. Aided by incarcerated ex-NFL coach and player Nate Scarborough, Crewe and his team must overcome not only the bloodthirstiness of the opposition, but also the corrupt warden trying to fix the game against them.",6.667,3529,"['Drama', 'Comedy', 'Crime']",3.0
33660,Cinderella Man (2005),Drama|Romance,352248,921.0,"The true story of boxer Jim Braddock who, following his retirement in the 1930s, makes a surprise comeback in order to lift his family out of poverty.",7.565,2289,"['Romance', 'Drama', 'History']",4.0
33679,Mr. & Mrs. Smith (2005),Action|Adventure|Comedy|Romance,356910,787.0,"A husband and wife struggle to keep their marriage alive until they realize they are both secretly working as assassins. Now, their respective assignments require them to kill each other.",6.687,10807,"['Action', 'Comedy', 'Drama', 'Thriller']",3.0
33794,Batman Begins (2005),Action|Crime|IMAX,372784,272.0,"Driven by tragedy, billionaire Bruce Wayne dedicates his life to uncovering and defeating the corruption that plagues his home, Gotham City.  Unable to work within the system, he instead creates a new identity, a symbol of fear for the criminal underworld - The Batman.",7.717,21820,"['Drama', 'Crime', 'Action']",4.5
33836,Bewitched (2005),Comedy|Fantasy|Romance,374536,9722.0,"Thinking he can overshadow an unknown actress in the part, an egocentric actor unknowingly gets a witch cast in an upcoming television remake of the classic show ""Bewitched"".",5.074,1589,"['Comedy', 'Fantasy', 'Romance']",1.5
34048,War of the Worlds (2005),Action|Adventure|Sci-Fi|Thriller,407304,74.0,"Ray Ferrier is a divorced dockworker and less-than-perfect father. Soon after his ex-wife and her new husband drop off his teenage son and young daughter for a rare weekend visit, a strange and powerful lightning storm touches down.",6.522,8758,"['Adventure', 'Thriller', 'Science Fiction']",4.0
34072,"March of the Penguins (Marche de l'empereur, La) (2005)",Documentary,428803,1667.0,"Every year, thousands of Antarctica's emperor penguins make an astonishing journey to breed their young. They walk, marching day and night in single file 70 miles into the darkest, driest and coldest continent on Earth.  This amazing, true-life tale is touched with humour and alive with thrills. Breathtaking photography captures the transcendent beauty and staggering drama of devoted parent penguins who, in the fierce polar winter, take turns guarding their egg and trekking to the ocean in search of food. Predators hunt them, storms lash them. But the safety of their adorable chicks makes it all worthwhile. So follow the leader... to adventure!!",7.07,1165,"['Documentary', 'Family']",4.0
34150,Fantastic Four (2005),Action|Adventure|Sci-Fi,120667,9738.0,"During a space voyage, four scientists are altered by cosmic rays: Reed Richards gains the ability to stretch his body; Sue Storm can become invisible; Johnny Storm controls fire; and Ben Grimm is turned into a super-strong … thing. Together, these ""Fantastic Four"" must now thwart the evil plans of Dr. Doom and save the world from certain destruction.",5.799,9690,"['Action', 'Fantasy', 'Science Fiction']",3.5
34162,Wedding Crashers (2005),Comedy|Romance,396269,9522.0,"John and his buddy, Jeremy are emotional criminals who know how to use a woman's hopes and dreams for their own carnal gain. Their modus operandi: crashing weddings. Normally, they meet guests who want to toast the romantic day with a random hook-up. But when John meets Claire, he discovers what true love – and heartache – feels like.",6.493,4518,"['Comedy', 'Romance']",3.5
34332,Sky High (2005),Action|Adventure|Children|Comedy,405325,11459.0,"Set in a world where superheroes are commonly known and accepted, young Will Stronghold, the son of the Commander and Jetstream, tries to find a balance between being a normal teenager and an extraordinary being.",6.249,2379,"['Adventure', 'Comedy', 'Family']",3.5
34405,Serenity (2005),Action|Adventure|Sci-Fi,379786,16320.0,"When the renegade crew of Serenity agrees to hide a fugitive on their ship, they find themselves in an action-packed battle between the relentless military might of a totalitarian regime who will destroy anything – or anyone – to get the girl back and the bloodthirsty creatures who roam the uncharted areas of space. But... the greatest danger of all may be on their ship.",7.364,3682,"['Science Fiction', 'Action', 'Adventure', 'Thriller']",4.0
34437,Broken Flowers (2005),Comedy|Drama,412019,308.0,Introverted Don Johnston receives an anonymous letter from an ex-lover informing him that he has a son who may be looking for him. A freelance sleuth neighbor motivates Don to embark on a cross-country search for his past flames seeking answers.,6.92,1405,"['Comedy', 'Drama', 'Mystery', 'Romance']",3.5
34520,"Dukes of Hazzard, The (2005)",Action|Adventure|Comedy,377818,6519.0,"Cousins, Bo and Luke Duke, with the help of their eye-catching cousin, Daisy and moonshine-running Uncle Jesse, try and save the family farm from being destroyed by Hazzard County's corrupt commissioner, Boss Hogg. Their efforts constantly find the 'Duke Boys' eluding authorities in 'The General Lee', their 1969 orange Dodge Charger that keeps them one step ahead of the dimwitted antics of the small southern town's Sheriff, Roscoe P. Coltrane.",5.59,1236,"['Comedy', 'Adventure', 'Action']",2.0
34530,Deuce Bigalow: European Gigolo (2005),Comedy,367652,11453.0,Deuce Bigalow goes to Amsterdam after a little accident including two irritating kids and a bunch of aggressive dolphins. There he meets up with his old friend T.J. Hicks. But a mysterious killer starts killing some of Amsterdam's finest gigolos and T.J. is mistaken for the extremely gay murderer. Deuce must enter the gigolo industry again to find the real murderer and clear T.J.'s name.,5.307,969,['Comedy'],2.5
34534,Four Brothers (2005),Action|Crime|Drama,430105,8292.0,Four adopted brothers return to their Detroit hometown when their mother is murdered and vow to exact revenge on the killers.,6.814,2269,"['Action', 'Crime']",2.5
35836,"40-Year-Old Virgin, The (2005)",Comedy|Romance,405422,6957.0,"Andy Stitzer has a pleasant life with a nice apartment and a job stamping invoices at an electronics store. But at age 40, there's one thing Andy hasn't done, and it's really bothering his sex-obsessed male co-workers: Andy is still a virgin. Determined to help Andy get laid, the guys make it their mission to de-virginize him. But it all seems hopeless until Andy meets small business owner Trish, a single mom.",6.413,6947,"['Comedy', 'Romance']",3.0
35957,Red Eye (2005),Horror|Thriller,421239,11460.0,"An overnight flight to Miami quickly becomes a battle for survival when Lisa realizes her seatmate plans to use her as part of a chilling assassination plot against the Deputy Secretary of Homeland Security. If she refuses to cooperate, her own father will be killed. As the miles tick by, she's in a race against time to find a way to warn the potential victims before it's too late.",6.392,2413,"['Thriller', 'Mystery']",2.5
36401,"Brothers Grimm, The (2005)",Comedy|Fantasy|Horror|Thriller,355295,4442.0,"Folklore collectors and con artists, Jake and Will Grimm, travel from village to village pretending to protect townsfolk from enchanted creatures and performing exorcisms. However, they are put to the test when they encounter a real magical curse in a haunted forest with real magical beings, requiring genuine courage.",5.8,2823,"['Adventure', 'Fantasy', 'Action', 'Comedy', 'Thriller']",3.0
36517,"Constant Gardener, The (2005)",Drama|Thriller,387131,1985.0,"Justin Quayle is a low-level British diplomat who has always gone about his work very quietly, not causing any problems. But after his radical wife Tessa is killed he becomes determined to find out why, thrusting himself into the middle of a very dangerous conspiracy.",7.008,1601,"['Drama', 'Mystery', 'Thriller']",3.5
36529,Lord of War (2005),Action|Crime|Drama|Thriller|War,399295,1830.0,"Yuri Orlov is a globetrotting arms dealer and, through some of the deadliest war zones, he struggles to stay one step ahead of a relentless Interpol agent, his business rivals and even some of his customers who include many of the world's most notorious dictators. Finally, he must also face his own conscience.",7.334,5049,"['Crime', 'Drama', 'Thriller']",3.5
37240,Why We Fight (2005),Documentary,436971,14286.0,Is American foreign policy dominated by the idea of military supremacy? Has the military become too important in American life? Jarecki's shrewd and intelligent polemic would seem to give an affirmative answer to each of these questions.,7.5,115,"['Documentary', 'History']",4.0
37386,Aeon Flux (2005),Action|Sci-Fi,402022,8202.0,"400 years into the future, disease has wiped out the majority of the world's population, except one walled city, Bregna, ruled by a congress of scientists. When Æon Flux, the top operative in the underground 'Monican' rebellion, is sent on a mission to kill a government leader, she uncovers a world of secrets.",5.636,2336,"['Science Fiction', 'Action', 'Thriller']",2.5
37727,Flightplan (2005),Action|Drama|Thriller,408790,9315.0,"Flying at 40,000 feet in a state-of-the art aircraft that she helped design, Kyle Pratt's 6-year-old daughter Julia vanishes without a trace. Or did she? No one on the plane believes Julia was ever onboard. And now Kyle, desperate and alone, can only count on her own wits to unravel the mystery and save her daughter.",6.458,2793,"['Thriller', 'Drama', 'Mystery']",3.0
37729,Corpse Bride (2005),Animation|Comedy|Fantasy|Musical|Romance,121164,3933.0,"In a 19th-century European village, a young man about to be married is whisked away to the underworld and wed to a mysterious corpse bride, while his real bride waits bereft in the land of the living.",7.583,9727,"['Romance', 'Fantasy', 'Animation']",4.0
37830,Final Fantasy VII: Advent Children (2004),Action|Adventure|Animation|Fantasy|Sci-Fi,385700,647.0,"Two years have passed since the final battle with Sephiroth. Though Midgar, city of mako, city of prosperity, has been reduced to ruins, its people slowly but steadily walk the road to reconstruction. However, a mysterious illness called Geostigma torments them. With no cure in sight, it brings death to the afflicted, one after another, robbing the people of their fledgling hope.",7.156,1195,"['Animation', 'Action', 'Adventure', 'Fantasy', 'Science Fiction']",5.0
39183,Brokeback Mountain (2005),Drama|Romance,388795,142.0,"In 1960s Wyoming, two men develop a strong emotional and sexual relationship that endures as a lifelong connection complicating their lives as they get married and start families of their own.",7.786,7287,"['Drama', 'Romance']",4.0
39234,North Country (2005),Drama,395972,9701.0,"A fictionalized account of the first major successful sexual harassment case in the United States — Jenson vs. Eveleth Mines, where a woman who endured a range of abuse while working as a miner filed and won the landmark 1984 lawsuit.",7.254,695,['Drama'],4.0
40278,Jarhead (2005),Action|Drama|War,418763,25.0,"Jarhead is a film about a US Marine Anthony Swofford’s experience in the Gulf War. After putting up with an arduous boot camp, Swofford and his unit are sent to the Persian Gulf where they are eager to fight, but are forced to stay back from the action. Swofford struggles with the possibility of his girlfriend cheating on him, and as his mental state deteriorates, his desire to kill increases.",6.674,3020,"['Drama', 'War']",4.0
40583,Syriana (2005),Drama|Thriller,365737,231.0,"The Middle Eastern oil industry is the backdrop of this tense drama, which weaves together numerous story lines. Bennett Holiday is an American lawyer in charge of facilitating a dubious merger of oil companies, while Bryan Woodman, a Switzerland-based energy analyst, experiences both personal tragedy and opportunity during a visit with Arabian royalty. Meanwhile, veteran CIA agent Bob Barnes uncovers an assassination plot with unsettling origins.",6.4,1419,"['Drama', 'Thriller']",3.5
40815,Harry Potter and the Goblet of Fire (2005),Adventure|Fantasy|Thriller|IMAX,330373,674.0,"When Harry Potter's name emerges from the Goblet of Fire, he becomes a competitor in a grueling battle for glory among three wizarding schools—the Triwizard Tournament. But since Harry never submitted his name for the Tournament, who did? Now Harry must confront a deadly dragon, fierce water demons and an enchanted maze only to find himself in the cruel grasp of He Who Must Not Be Named.",7.8,21464,"['Adventure', 'Fantasy']",3.5
40819,Walk the Line (2005),Drama|Musical|Romance,358273,69.0,"A chronicle of country music legend Johnny Cash's life, from his early days on an Arkansas cotton farm to his rise to fame with Sun Records in Memphis, where he recorded alongside Elvis Presley, Jerry Lee Lewis and Carl Perkins.",7.497,2994,"['Drama', 'Music', 'Romance']",3.5
41285,Match Point (2005),Crime|Drama|Romance,416320,116.0,"Chris, a former tennis pro, takes a job as an instructor and befriends his wealthy young student, Tom. After being introduced to his family, Chris is soon engaged to Tom's sister, Chloe. Despite the professional and financial advantages that this relationship affords him, Chris becomes obsessed with Tom's fiancee, American actress Nola.",7.357,4209,"['Drama', 'Romance', 'Thriller']",3.5
41566,"Chronicles of Narnia: The Lion, the Witch and the Wardrobe, The (2005)",Adventure|Children|Fantasy,363771,411.0,"Siblings Lucy, Edmund, Susan and Peter step through a magical wardrobe and find the land of Narnia. There, they discover a charming, once peaceful kingdom that has been plunged into eternal winter by the evil White Witch, Jadis. Aided by the wise and magnificent lion, Aslan, the children lead Narnia into a spectacular, climactic battle to be free of the Witch's glacial powers forever.",7.133,11085,"['Adventure', 'Family', 'Fantasy']",4.0
41569,King Kong (2005),Action|Adventure|Drama|Fantasy|Thriller,360717,254.0,"In 1933 New York, an overly ambitious movie producer coerces his cast and hired ship crew to travel to mysterious Skull Island, where they encounter Kong, a giant ape who is immediately smitten with the leading lady.",6.89,8196,"['Adventure', 'Drama', 'Action']",2.5
41571,Memoirs of a Geisha (2005),Drama|Romance,397535,1904.0,"In the years before World War II, a penniless Japanese child is torn from her family to work as a maid in a geisha house.",7.656,3210,"['Drama', 'Romance', 'History']",3.0
41997,Munich (2005),Action|Crime|Drama|Thriller,408306,612.0,"During the 1972 Olympic Games in Munich, eleven Israeli athletes are taken hostage and murdered by a Palestinian terrorist group known as Black September. In retaliation, the Israeli government recruits a group of Mossad agents to track down and execute those responsible for the attack.",7.141,2815,"['Drama', 'Action', 'History', 'Thriller']",3.0
42011,Fun with Dick and Jane (2005),Comedy|Crime,369441,7552.0,"After Dick Harper loses his job at Globodyne in an Enron-esque collapse, he and his wife, Jane, turn to crime in order to handle the massive debt they now face. Two intelligent people, Dick and Jane actually get pretty good at robbing people and even enjoy it -- but they have second thoughts when they're reminded that crime can hurt innocent people. When the couple hears that Globodyne boss Jack McCallister actually swindled the company, they plot revenge.",6.205,2532,"['Comedy', 'Crime']",3.5
43871,Firewall (2006),Crime|Drama|Thriller,408345,9754.0,"State-of-the-art security system creator Jack Stanfield has cemented his reputation as a man who's thought of everything. But when a criminal finds a way into his personal life, everything Jack holds dear is suddenly at stake.",5.8,983,"['Action', 'Crime', 'Thriller']",2.5
43928,Ultraviolet (2006),Action|Fantasy|Sci-Fi|Thriller,370032,9920.0,"In the late 21st century, a subculture of humans have emerged who have been modified genetically by a vampire-like disease, giving them enhanced speed, incredible stamina and acute intelligence. As they are set apart from ""normal"" and ""healthy"" humans, the world is pushed to the brink of worldwide civil war  aimed at the destruction of the ""diseased"" population. In the middle of this crossed-fire is - an infected woman - Ultraviolet, who finds herself protecting a nine-year-old boy who has been marked for death by the human government as he is believed to be a threat to humans.",5.228,1647,"['Science Fiction', 'Action', 'Thriller']",1.5
43936,16 Blocks (2006),Crime|Thriller,450232,2207.0,"An aging cop is assigned the ordinary task of escorting a fast-talking witness from police custody to a courthouse, but they find themselves running the gauntlet as other forces try to prevent them from getting there.",6.446,2003,"['Action', 'Adventure', 'Crime', 'Thriller']",3.0
44022,Ice Age 2: The Meltdown (2006),Adventure|Animation|Children|Comedy,438097,950.0,"Diego, Manny and Sid return in this sequel to the hit animated movie Ice Age. This time around, the deep freeze is over, and the ice-covered earth is starting to melt, which will destroy the trio's cherished valley. The impending disaster prompts them to reunite and warn all the other beasts about the desperate situation.",6.7,10053,"['Animation', 'Family', 'Comedy', 'Adventure']",3.0
44191,V for Vendetta (2006),Action|Sci-Fi|Thriller|IMAX,434409,752.0,"In a world in which Great Britain has become a fascist state, a masked vigilante known only as “V” conducts guerrilla warfare against the oppressive British government. When V rescues a young woman from the secret police, he finds in her an ally with whom he can continue his fight to free the people of Britain.",7.9,15023,"['Action', 'Thriller', 'Science Fiction']",4.5
44195,Thank You for Smoking (2006),Comedy|Drama,427944,9388.0,"Nick Naylor is a charismatic spin-doctor for Big Tobacco who'll fight to protect America's right to smoke -- even if it kills him -- while still remaining a role model for his 12-year old son. When he incurs the wrath of a senator bent on snuffing out cigarettes, Nick's powers of ""filtering the truth"" will be put to the test.",7.19,2276,"['Comedy', 'Drama']",4.0
44494,Son of the Pink Panther (1993),Comedy,108187,46828.0,The illegitimate son of Inspector Clouseau is on the case of the kidnapped Princess Yasmin.,4.589,224,"['Comedy', 'Crime']",2.5
44555,"Lives of Others, The (Das leben der Anderen) (2006)",Drama|Romance|Thriller,405094,582.0,"In 1984 East Berlin, dedicated Stasi officer Gerd Wiesler begins spying on a famous playwright and his actress-lover Christa-Maria. Wiesler becomes unexpectedly sympathetic to the couple, and faces conflicting loyalties when his superior takes a liking to Christa-Maria.",8.0,3888,"['Drama', 'Thriller']",4.0
44665,Lucky Number Slevin (2006),Crime|Drama|Mystery,425210,186.0,"Slevin is mistakenly put in the middle of a personal war between the city’s biggest criminal bosses. Under constant watch, Slevin must try not to get killed by an infamous assassin and come up with an idea of how to get out of his current dilemma.",7.48,4248,"['Drama', 'Thriller', 'Crime', 'Mystery']",4.0
45186,Mission: Impossible III (2006),Action|Adventure|Thriller,317919,956.0,"Retired from active duty, and training recruits for the Impossible Mission Force, agent Ethan Hunt faces the toughest foe of his career: Owen Davian, an international broker of arms and information, who's as cunning as he is ruthless. Davian emerges to threaten Hunt and all that he holds dear – including the woman Hunt loves.",6.748,7287,"['Adventure', 'Action', 'Thriller']",3.0
