movieId,title,genres,imdbId,tmdbId,overview,tmdb_vote_average,tmdb_vote_count,tmdb_genres,rating
1,Toy Story (1995),Adventure|Animation|Children|Comedy|Fantasy,114709,862.0,"Led by Woody, Andy's toys live happily in his room until Andy's birthday brings Buzz Lightyear onto the scene. Afraid of losing his place in Andy's heart, Woody plots against Buzz. But when circumstances separate Buzz and Woody from their owner, the duo eventually learns to put aside their differences.",7.969,19165,"['Animation', 'Adventure', 'Family', 'Comedy']",5.0
2,Jumanji (1995),Adventure|Children|Fantasy,113497,8844.0,"When siblings Judy and Peter discover an enchanted board game that opens the door to a magical world, they unwittingly invite Alan -- an adult who's been trapped inside the game for 26 years -- into their living room. Alan's only hope for freedom is to finish the game, which proves risky as all three find themselves running from giant rhinoceroses, evil monkeys and other terrifying creatures.",7.24,10907,"['Adventure', 'Fantasy', 'Family']",3.0
6,Heat (1995),Action|Crime|Thriller,113277,949.0,Obsessive master thief Neil McCauley leads a top-notch crew on various daring heists throughout Los Angeles while determined detective Vincent Hanna pursues him without rest. Each man recognizes and respects the ability and the dedication of the other even though they are aware their cat-and-mouse game may end in violence.,7.922,7811,"['Crime', 'Drama', 'Action']",2.0
10,GoldenEye (1995),Action|Adventure|Thriller,113189,710.0,"When a powerful satellite system falls into the hands of Alec Trevelyan, AKA Agent 006, a former ally-turned-enemy, only James Bond can save the world from a dangerous space weapon that -- in one short pulse -- could destroy the earth! As Bond squares off against his former compatriot, he also battles Xenia Onatopp, an assassin who uses pleasure as her ultimate weapon.",6.897,4105,"['Adventure', 'Action', 'Thriller']",3.5
16,Casino (1995),Crime|Drama,112641,524.0,"In early-1970s Las Vegas, Sam ""Ace"" Rothstein gets tapped by his bosses to head the Tangiers Casino. At first, he's a great success in the job, but over the years, problems with his loose-cannon enforcer Nicky Santoro, his ex-hustler wife Ginger, her con-artist ex Lester Diamond and a handful of corrupt politicians put Sam in ever-increasing danger.",8.0,6189,"['Crime', 'Drama']",5.0
32,Twelve Monkeys (a.k.a. 12 Monkeys) (1995),Mystery|Sci-Fi|Thriller,114746,63.0,"In the year 2035, convict James Cole reluctantly volunteers to be sent back in time to discover the origin of a deadly virus that wiped out nearly all of the earth's population and forced the survivors into underground communities. But when Cole is mistakenly sent to 1990 instead of 1996, he's arrested and locked up in a mental hospital. There he meets psychiatrist Dr. Kathryn Railly and the son of a famous virus expert who may hold the key to the Army of the 12 Monkeys; thought to be responsible for unleashing the killer disease.",7.601,8713,"['Science Fiction', 'Thriller', 'Mystery']",4.0
39,Clueless (1995),Comedy|Romance,112697,9603.0,"Shallow, rich and socially successful Cher is at the top of her Beverly Hills high school's pecking scale. Seeing herself as a matchmaker, Cher first coaxes two teachers into dating each other. Emboldened by her success, she decides to give hopelessly klutzy new student Tai a makeover. When Tai becomes more popular than she is, Cher realizes that her disapproving ex-stepbrother was right about how misguided she was -- and falls for him.",7.267,4619,"['Comedy', 'Romance']",5.0
47,Seven (a.k.a. Se7en) (1995),Mystery|Thriller,114369,807.0,"Two homicide detectives are on a desperate hunt for a serial killer whose crimes are based on the ""seven deadly sins"" in this dark and haunting film that takes viewers from the tortured remains of one victim to the next. The seasoned Det. Somerset researches each sin in an effort to get inside the killer's mind, while his novice partner, Mills, scoffs at his efforts to unravel the case.",8.376,22133,"['Crime', 'Mystery', 'Thriller']",4.5
48,Pocahontas (1995),Animation|Children|Drama|Musical|Romance,114148,10530.0,"Pocahontas, daughter of a Native American tribe chief, falls in love with an English soldier as colonists invade 17th century Virginia.",6.9,5881,"['Adventure', 'Animation', 'Family', 'Romance']",2.5
50,"Usual Suspects, The (1995)",Crime|Mystery|Thriller,114814,629.0,"Held in an L.A. interrogation room, Verbal Kint attempts to convince the feds that a mythic crime lord, Keyser Soze, not only exists, but was also responsible for drawing him and his four partners into a multi-million dollar heist that ended with an explosion in San Pedro harbor – leaving few survivors. Verbal lures his interrogators with an incredible story of the crime lord's almost supernatural prowess.",8.172,10878,"['Drama', 'Crime', 'Thriller']",4.5
62,Mr. Holland's Opus (1995),Drama,113862,2054.0,"In 1965, passionate musician Glenn Holland takes a day job as a high school music teacher, convinced it's just a small obstacle on the road to his true calling: writing a historic opus. As the decades roll by with the composition unwritten but generations of students inspired through his teaching, Holland must redefine his life's purpose.",7.0,430,"['Drama', 'Music']",4.0
65,Bio-Dome (1996),Comedy,115683,9536.0,"Moronic best friends get themselves locked inside the Bio-Dome, a science experiment, along with a group of environmental scientists for one year.",4.5,383,['Comedy'],1.5
104,Happy Gilmore (1996),Comedy,116483,9614.0,"Failed hockey player-turned-golf whiz Happy Gilmore — whose unconventional approach and antics on the green courts the ire of rival Shooter McGavin — is determined to win a PGA tournament so he can save his granny's house with the prize money. Meanwhile, an attractive tour publicist tries to soften Happy's image.",6.67,3099,['Comedy'],3.5
110,Braveheart (1995),Action|Drama|War,112573,197.0,"Enraged at the slaughter of Murron, his new bride and childhood love, Scottish warrior William Wallace slays a platoon of the local English lord's soldiers. This leads the village to revolt and, eventually, the entire country to rise up against English rule.",7.943,10614,"['Action', 'Drama', 'History', 'War']",2.5
111,Taxi Driver (1976),Crime|Drama|Thriller,75314,103.0,"Suffering from insomnia, disturbed loner Travis Bickle takes a job as a New York City cabbie, haunting the streets nightly, growing increasingly detached from reality as he dreams of cleaning up the filthy city.",8.135,12893,"['Crime', 'Drama']",5.0
150,Apollo 13 (1995),Adventure|Drama|IMAX,112384,568.0,"The true story of technical troubles that scuttle the Apollo 13 lunar mission in 1970, risking the lives of astronaut Jim Lovell and his crew, with the failed journey turning into a thrilling saga of heroism. Drifting more than 200,000 miles from Earth, the astronauts work furiously with the ground crew to avert tragedy.",7.452,5616,"['Drama', 'History']",4.5
153,Batman Forever (1995),Action|Adventure|Comedy|Crime,112462,414.0,"Batman faces off against two foes: the schizophrenic, horribly scarred former District Attorney Harvey Dent, aka Two-Face, and the Riddler, a disgruntled ex-Wayne Enterprises inventor seeking revenge against his former employer by unleashing his brain-sucking weapon on Gotham City's residents. As the caped crusader also copes with tortured memories of his parents' murder, he has a new romance, with psychologist Chase Meridian.",5.4,5368,"['Action', 'Crime', 'Fantasy']",4.0
165,Die Hard: With a Vengeance (1995),Action|Crime|Thriller,112864,1572.0,"New York detective John McClane is back and kicking bad-guy butt in the third installment of this action-packed series, which finds him teaming with civilian Zeus Carver to prevent the loss of innocent lives. McClane thought he'd seen it all, until a genius named Simon engages McClane, his new ""partner"" -- and his beloved city -- in a deadly game that demands their concentration.",7.272,6378,"['Action', 'Thriller']",4.5
180,Mallrats (1995),Comedy|Romance,113749,2293.0,"Both dumped by their girlfriends, two best friends seek refuge in the local mall. Eventually, they decide to try and win back their significant others and take care of their respective nemeses.",6.753,1300,"['Romance', 'Comedy']",4.0
216,Billy Madison (1995),Comedy,112508,11017.0,"Billy Madison is the 27 year-old son of Bryan Madison, a very rich man who has made his living in the hotel industry. Billy stands to inherit his father's empire, but only if he can make it through all 12 grades, 2 weeks per grade, to prove that he has what it takes to run the family business.",6.183,1711,['Comedy'],3.0
223,Clerks (1994),Comedy,109445,2292.0,"Convenience and video store clerks Dante and Randal are sharp-witted, potty-mouthed and bored out of their minds. So in between needling customers, the counter jockeys play hockey on the roof, visit a funeral home and deal with their love lives.",7.384,2614,['Comedy'],4.5
231,Dumb & Dumber (Dumb and Dumber) (1994),Adventure|Comedy,109686,8467.0,"Lloyd and Harry are two men whose stupidity is really indescribable. When Mary, a beautiful woman, loses an important suitcase with money before she leaves for Aspen, the two friends (who have found the suitcase) decide to return it to her. After some ""adventures"" they finally get to Aspen where, using the lost money they live it up and fight for Mary's heart.",6.636,6385,['Comedy'],3.5
235,Ed Wood (1994),Comedy|Drama,109707,522.0,"The mostly true story of the legendary ""worst director of all time"", who, with the help of his strange friends, filmed countless B-movies without ever becoming famous or successful.",7.49,2412,"['Comedy', 'Drama', 'History']",4.0
253,Interview with the Vampire: The Vampire Chronicles (1994),Drama|Horror,110148,628.0,"A vampire relates his epic life story of love, betrayal, loneliness, and dark hunger to an over-curious reporter.",7.383,6117,"['Horror', 'Drama', 'Fantasy']",3.5
260,Star Wars: Episode IV - A New Hope (1977),Action|Adventure|Sci-Fi,76759,11.0,Princess Leia is captured and held hostage by the evil Imperial forces in their effort to take over the galactic Empire. Venturesome Luke Skywalker and dashing captain Han Solo team together with the loveable robot duo R2-D2 and C-3PO to rescue the beautiful princess and restore peace and justice in the Empire.,8.205,21518,"['Adventure', 'Action', 'Science Fiction']",5.0
293,Léon: The Professional (a.k.a. The Professional) (Léon) (1994),Action|Crime|Drama|Thriller,110413,101.0,"Léon, the top hit man in New York, has earned a rep as an effective ""cleaner"". But when his next-door neighbors are wiped out by a loose-cannon DEA agent, he becomes the unwilling custodian of 12-year-old Mathilda. Before long, Mathilda's thoughts turn to revenge, and she considers following in Léon's footsteps.",8.3,15469,"['Crime', 'Drama', 'Action']",4.5
296,Pulp Fiction (1994),Comedy|Crime|Drama|Thriller,110912,680.0,"A burger-loving hit man, his philosophical partner, a drug-addled gangster's moll and a washed-up boxer converge in this sprawling, comedic crime caper. Their adventures unfurl in three stories that ingeniously trip back and forth in time.",8.487,29112,"['Thriller', 'Crime', 'Comedy', 'Drama']",5.0
316,Stargate (1994),Action|Adventure|Sci-Fi,111282,2164.0,"An interstellar teleportation device, found in Egypt, leads to a planet with humans resembling ancient Egyptians who worship the god Ra.",7.0,3595,"['Action', 'Adventure', 'Science Fiction']",3.0
318,"Shawshank Redemption, The (1994)",Crime|Drama,111161,278.0,"Imprisoned in the 1940s for the double murder of his wife and her lover, upstanding banker Andy Dufresne begins a new life at the Shawshank prison, where he puts his accounting skills to work for an amoral warden. During his long stretch in prison, Dufresne comes to be admired by the other inmates -- including an older prisoner named Red -- for his integrity and unquenchable sense of hope.",8.713,28938,"['Drama', 'Crime']",5.0
327,Tank Girl (1995),Action|Comedy|Sci-Fi,114614,9067.0,"After a comet disrupts the rain cycle of Earth, the planet has become a desolate, barren desert by the year 2033. With resources scarce, Kesslee, head of the powerful and evil Water & Power Corporation, the de facto government, has taken control of the water supply. Unwilling to cower under Kesslee's tyrannical rule, a pair of outlaws known as Tank Girl and Jet Girl rise up, joining the mysterious rebel Rippers to destroy the corrupt system.",5.4,532,"['Action', 'Comedy', 'Science Fiction', 'Fantasy']",3.0
333,Tommy Boy (1995),Comedy,114694,11381.0,"To save the family business, two ne’er-do-well traveling salesmen hit the road with disastrously funny consequences.",6.795,1001,['Comedy'],4.0
337,What's Eating Gilbert Grape (1993),Drama,108550,1587.0,"Gilbert Grape is a small-town young man with a lot of responsibility. Chief among his concerns are his mother, who is so overweight that she can't leave the house, and his mentally impaired younger brother, Arnie, who has a knack for finding trouble. Settled into a job at a grocery store and an ongoing affair with local woman Betty Carver, Gilbert finally has his life shaken up by the free-spirited Becky.",7.666,4106,"['Romance', 'Drama']",4.0
344,Ace Ventura: Pet Detective (1994),Comedy,109040,3049.0,"He's Ace Ventura: Pet Detective. Jim Carrey is on the case to find the Miami Dolphins' missing mascot and quarterback Dan Marino. He goes eyeball to eyeball with a man-eating shark, stakes out the Miami Dolphins and woos and wows the ladies. Whether he's undercover, under fire or underwater, he always gets his man… or beast!",6.6,6080,"['Comedy', 'Mystery', 'Crime']",2.5
353,"Crow, The (1994)",Action|Crime|Fantasy|Thriller,109506,9495.0,"Exactly one year after young rock guitarist Eric Draven and his fiancée are brutally killed by a ruthless gang of criminals, Draven, watched over by a hypnotic crow, returns from the grave to exact revenge.",7.52,4308,"['Fantasy', 'Action', 'Thriller']",2.0
356,Forrest Gump (1994),Comedy|Drama|Romance|War,109830,13.0,"A man with a low IQ has accomplished great things in his life and been present during significant historic events—in each case, far exceeding what anyone imagined he could do. But despite all he has achieved, his one true love eludes him.",8.466,28663,"['Comedy', 'Drama', 'Romance']",4.0
357,Four Weddings and a Funeral (1994),Comedy|Romance,109831,712.0,"Over the course of five social occasions, a committed bachelor must consider the notion that he may have discovered love.",6.773,2840,"['Comedy', 'Drama', 'Romance']",4.0
364,"Lion King, The (1994)",Adventure|Animation|Children|Drama|Musical|IMAX,110357,8587.0,"Young lion prince Simba, eager to one day become king of the Pride Lands, grows up under the watchful eye of his father Mufasa; all the while his villainous uncle Scar conspires to take the throne for himself. Amid betrayal and tragedy, Simba must confront his past and find his rightful place in the Circle of Life.",8.256,19041,"['Family', 'Animation', 'Drama', 'Fantasy', 'Adventure']",5.0
367,"Mask, The (1994)",Action|Comedy|Crime|Fantasy,110475,854.0,"When timid bank clerk Stanley Ipkiss discovers a magical mask containing the spirit of the Norse god Loki, his entire life changes. While wearing the mask, Ipkiss becomes a supernatural playboy exuding charm and confidence which allows him to catch the eye of local nightclub singer Tina Carlyle. Unfortunately, under the mask's influence, Ipkiss also robs a bank, which angers junior crime lord Dorian Tyrell, whose goons get blamed for the heist.",6.969,10750,"['Romance', 'Comedy', 'Crime', 'Fantasy']",2.0
377,Speed (1994),Action|Romance|Thriller,111257,1637.0,"Jack Traven, an LAPD cop on SWAT detail, and veteran SWAT officer Harry Temple thwart an extortionist-bomber's scheme for a $3 million ransom. As they corner the bomber, he flees and detonates a bomb vest, seemingly killing himself. Weeks later, Jack witnesses a mass transit city bus explode and nearby a pay phone rings. On the phone is that same bomber looking for vengeance and the money he's owed. He gives a personal challenge to Jack: a bomb is rigged on another city bus - if it slows down below 50 mph, it will explode - bad enough any day, but a nightmare in LA traffic. And that's just the beginning...",7.1,6498,"['Action', 'Thriller']",5.0
380,True Lies (1994),Action|Adventure|Comedy|Romance|Thriller,111503,36955.0,"A fearless, globe-trotting, terrorist-battling secret agent has his life turned upside down when he discovers his wife might be having an affair with a used car salesman while terrorists smuggle nuclear war heads into the United States.",7.085,4326,"['Action', 'Thriller']",3.5
413,Airheads (1994),Comedy,109068,13595.0,The Lone Rangers have heavy-metal dreams and a single demo tape they can't get anyone to play. The solution: Hijack an FM rock radio station and hold the deejays hostage until they agree to broadcast the band's tape.,6.2,775,"['Comedy', 'Crime', 'Music']",3.0
471,"Hudsucker Proxy, The (1994)",Comedy,110074,11934.0,A naive business graduate is installed as president of a manufacturing company as part of a stock scam.,7.076,1114,"['Comedy', 'Drama', 'Fantasy']",4.5
480,Jurassic Park (1993),Action|Adventure|Sci-Fi|Thriller,107290,329.0,"A wealthy entrepreneur secretly creates a theme park featuring living dinosaurs drawn from prehistoric DNA. Before opening day, he invites a team of experts and his two eager grandchildren to experience the park and help calm anxious investors. However, the park is anything but amusing as the security systems go off-line and the dinosaurs escape.",7.96,17136,"['Adventure', 'Science Fiction']",5.0
500,Mrs. Doubtfire (1993),Comedy|Drama,107614,788.0,"Loving but irresponsible dad Daniel Hillard, estranged from his exasperated spouse, is crushed by a court order allowing only weekly visits with his kids. When Daniel learns his ex needs a housekeeper, he gets the job -- disguised as a British nanny. Soon he becomes not only his children's best pal but the kind of parent he should have been from the start.",7.195,6357,"['Comedy', 'Drama', 'Family']",3.0
527,Schindler's List (1993),Drama|War,108052,424.0,The true story of how businessman Oskar Schindler saved over a thousand Jewish lives from the Nazis while they worked as slaves in his factory during World War II.,8.566,16730,"['Drama', 'History', 'War']",5.0
541,Blade Runner (1982),Action|Sci-Fi|Thriller,83658,78.0,"In the smog-choked dystopian Los Angeles of 2019, blade runner Rick Deckard is called out of retirement to terminate a quartet of replicants who have escaped to Earth seeking their creator for a way to extend their short life spans.",7.941,14393,"['Science Fiction', 'Drama', 'Thriller']",4.5
546,Super Mario Bros. (1993),Action|Adventure|Children|Comedy|Fantasy|Sci-Fi,108255,9607.0,"Mario and Luigi, plumbers from Brooklyn, find themselves in an alternate universe where evolved dinosaurs live in hi-tech squalor. They're the only hope to save our universe from invasion by the dino dictator, Koopa.",4.456,1374,"['Adventure', 'Fantasy', 'Comedy', 'Family']",0.5
555,True Romance (1993),Crime|Thriller,108399,319.0,"Clarence marries hooker Alabama, steals cocaine from her pimp, and tries to sell it in Hollywood, while the owners of the coke try to reclaim it.",7.546,2879,"['Action', 'Crime', 'Romance']",4.0
586,Home Alone (1990),Children|Comedy,99785,771.0,"Eight-year-old Kevin McCallister makes the most of the situation after his family unwittingly leaves him behind when they go on Christmas vacation. When thieves try to break into his home, he puts up a fight like no other.",7.447,11876,"['Comedy', 'Family']",4.0
588,Aladdin (1992),Adventure|Animation|Children|Comedy|Musical,103639,812.0,"In the boorish city of Agrabah, kind-hearted street urchin Aladdin and Princess Jasmine fall in love, although she can only marry a prince. He and power-hungry Grand Vizier Jafar vie for a magic lamp that can fulfill their wishes.",7.7,11624,"['Animation', 'Family', 'Adventure', 'Fantasy', 'Romance']",5.0
589,Terminator 2: Judgment Day (1991),Action|Sci-Fi,103064,280.0,"Ten years after the events of the original, a reprogrammed T-800 is sent back in time to protect young John Connor from the shape-shifting T-1000. Together with his mother Sarah, he fights to stop Skynet from triggering a nuclear apocalypse.",8.133,13589,"['Action', 'Thriller', 'Science Fiction']",4.5
592,Batman (1989),Action|Crime|Thriller,96895,268.0,"Having witnessed his parents' brutal murder as a child, millionaire philanthropist Bruce Wayne fights crime in Gotham City disguised as Batman, a costumed hero who strikes fear into the hearts of villains. But when a deformed madman known as 'The Joker' seizes control of Gotham's criminal underworld, Batman must face his most ruthless nemesis ever while protecting both his identity and his love interest, reporter Vicki Vale.",7.2,8212,"['Fantasy', 'Action', 'Crime']",3.0
593,"Silence of the Lambs, The (1991)",Crime|Horror|Thriller,102926,274.0,"Clarice Starling is a top student at the FBI's training academy.  Jack Crawford wants Clarice to interview Dr. Hannibal Lecter, a brilliant psychiatrist who is also a violent psychopath, serving life behind bars for various acts of murder and cannibalism.  Crawford believes that Lecter may have insight into a case and that Starling, as an attractive young woman, may be just the bait to draw him out.",8.347,17131,"['Crime', 'Thriller', 'Drama']",4.5
594,Snow White and the Seven Dwarfs (1937),Animation|Children|Drama|Fantasy|Musical,29583,408.0,"A beautiful girl, Snow White, takes refuge in the forest in the house of seven dwarfs to hide from her stepmother, the wicked Queen. The Queen is jealous because she wants to be known as ""the fairest in the land,"" and Snow White's beauty surpasses her own.",7.123,7743,"['Fantasy', 'Animation', 'Family']",2.5
595,Beauty and the Beast (1991),Animation|Children|Fantasy|Musical|Romance|IMAX,101414,10020.0,"Follow the adventures of Belle, a bright young woman who finds herself in the castle of a prince who's been turned into a mysterious beast. With the help of the castle's enchanted staff, Belle soon learns the most important lesson of all -- that true beauty comes from within.",7.73,10315,"['Romance', 'Family', 'Animation', 'Fantasy']",4.0
608,Fargo (1996),Comedy|Crime|Drama|Thriller,116282,275.0,"Jerry, a small-town Minnesota car salesman is bursting at the seams with debt... but he's got a plan. He's going to hire two thugs to kidnap his wife in a scheme to collect a hefty ransom from his wealthy father-in-law. It's going to be a snap and nobody's going to get hurt... until people start dying. Enter Police Chief Marge, a coffee-drinking, parka-wearing - and extremely pregnant - investigator who'll stop at nothing to get her man. And if you think her small-time investigative skills will give the crooks a run for their ransom... you betcha!",7.851,8587,"['Crime', 'Drama', 'Thriller']",5.0
648,Mission: Impossible (1996),Action|Adventure|Mystery|Thriller,117060,954.0,"When Ethan Hunt, the leader of a crack espionage team whose perilous operation has gone awry with no explanation, discovers that a mole has penetrated the CIA, he's surprised to learn that he's the prime suspect. To clear his name, Hunt now must ferret out the real double agent and, in the process, even the score.",7.011,9548,"['Adventure', 'Action', 'Thriller']",4.0
661,James and the Giant Peach (1996),Adventure|Animation|Children|Fantasy|Musical,116683,10539.0,"When the young orphan boy James spills a magic bag of crocodile tongues, he finds himself in possession of a giant peach that flies him away to strange lands.",6.577,1375,"['Adventure', 'Animation', 'Family', 'Fantasy']",2.5
673,Space Jam (1996),Adventure|Animation|Children|Comedy|Fantasy|Sci-Fi,117705,2300.0,"With their freedom on the line, the Looney Tunes seek the help of NBA superstar Michael Jordan to win a basketball game against a team of moronic aliens.",6.8,6205,"['Family', 'Comedy', 'Animation', 'Science Fiction']",4.0
708,"Truth About Cats & Dogs, The (1996)",Comedy|Romance,117979,8866.0,A successful veterinarian and radio show host with low self-esteem asks her model friend to impersonate her when a handsome man wants to see her.,6.1,329,"['Comedy', 'Romance']",3.5
724,"Craft, The (1996)",Drama|Fantasy|Horror|Thriller,115963,9100.0,"A Catholic school newcomer falls in with a clique of teen witches who wield their powers against all who dare to cross them -- be they teachers, rivals or meddlesome parents.",6.789,1956,"['Horror', 'Drama', 'Fantasy']",3.0
733,"Rock, The (1996)",Action|Adventure|Thriller,117500,9802.0,"When vengeful General Francis X. Hummel seizes control of Alcatraz Island and threatens to launch missiles loaded with deadly chemical weapons into San Francisco, only a young FBI chemical weapons expert and notorious Federal prisoner have the skills to penetrate the impregnable island fortress and take him down.",7.137,4934,"['Action', 'Adventure', 'Thriller']",3.5
736,Twister (1996),Action|Adventure|Romance|Thriller,117998,664.0,"An unprecedented series of violent tornadoes is sweeping across Oklahoma. Tornado chasers, headed by Dr. Jo Harding, attempt to release a groundbreaking device that will allow them to track them and create a more advanced warning system. They are joined by Jo's soon to be ex-husband Bill, a former tornado chaser himself, and his girlfriend Melissa.",6.546,3647,"['Action', 'Adventure', 'Drama']",3.5
745,Wallace & Gromit: A Close Shave (1995),Animation|Children|Comedy,112691,532.0,"Wallace's whirlwind romance with the proprietor of the local wool shop puts his head in a spin, and Gromit is framed for sheep-rustling in a fiendish criminal plot.",7.573,879,"['Family', 'Animation', 'Comedy']",4.5
