movieId,title,genres,imdbId,tmdbId,overview,tmdb_vote_average,tmdb_vote_count,tmdb_genres,rating
101864,Oblivion (2013),Action|Adventure|Sci-Fi|IMAX,1483013,75612.0,"Jack Harper is one of the last few drone repairmen stationed on Earth. Part of a massive operation to extract vital resources after decades of war with a terrifying threat known as the Scavs, Jack’s mission is nearly complete. His existence is brought crashing down when he rescues a beautiful  stranger from a downed spacecraft. Her arrival triggers a chain of events that  forces him to question everything he knows and puts the fate of humanity in his hands.",6.661,11086,"['Action', 'Science Fiction', 'Adventure', 'Mystery']",4.0
102903,Now You See Me (2013),Crime|Mystery|Thriller,1670345,75656.0,An FBI agent and an Interpol detective track a team of illusionists who pull off bank heists during their performances and reward their audiences with the money.,7.333,16033,"['Thriller', 'Crime']",4.0
103017,The Body (2012),Mystery|Thriller,1937149,111083.0,"A woman’s body disappears mysteriously from the morgue without a trace. Police inspector Jaime Peña investigates the strange occurrence with the help of Álex Ulloa, the widower of the missing woman.",7.5,1330,"['Thriller', 'Mystery']",4.0
103042,Man of Steel (2013),Action|Adventure|Fantasy|Sci-Fi|IMAX,770828,49521.0,"A young boy learns that he has extraordinary powers and is not of this earth. As a young man, he journeys to discover where he came from and what he was sent here to do. But the hero in him must emerge if he is to save the world from annihilation and become the symbol of hope for all mankind.",6.6,15678,"['Action', 'Adventure', 'Science Fiction']",3.5
103253,Elysium (2013),Action|Drama|Sci-Fi|IMAX,1535108,68724.0,"In the year 2159, two classes of people exist: the very wealthy who live on a pristine man-made space station called Elysium, and the rest, who live on an overpopulated, ruined Earth. Secretary Rhodes, a hard line government ofﬁcial, will stop at nothing to enforce anti-immigration laws and preserve the luxurious lifestyle of the citizens of Elysium. That doesn’t stop the people of Earth from trying to get in, by any means they can. When unlucky Max is backed into a corner, he agrees to take on a daunting mission that, if successful, will not only save his life, but could bring equality to these polarized worlds.",6.512,9201,"['Science Fiction', 'Action', 'Drama', 'Thriller']",3.5
103372,"Heat, The (2013)",Action|Comedy|Crime,2404463,136795.0,"Uptight and straight-laced, FBI Special Agent Sarah Ashburn is a methodical investigator with a reputation for excellence--and hyper-arrogance. Shannon Mullins, one of Boston P.D.'s ""finest,"" is foul-mouthed and has a very short fuse, and uses her gut instinct and street smarts to catch the most elusive criminals. Neither has ever had a partner, or a friend for that matter. When these two wildly incompatible law officers join forces to bring down a ruthless drug lord, they become the last thing anyone expected: buddies.",6.597,4045,"['Action', 'Comedy', 'Crime']",0.5
103384,"Lone Ranger, The (2013)",Action|Adventure|Western|IMAX,1210819,57201.0,"The Texas Rangers chase down a gang of outlaws led by Butch Cavendish, but the gang ambushes the Rangers, seemingly killing them all. One survivor is found, however, by an American Indian named Tonto, who nurses him back to health. The Ranger, donning a mask and riding a white stallion named Silver, teams up with Tonto to bring the unscrupulous gang and others of that ilk to justice.",6.1,5969,"['Action', 'Adventure', 'Western']",3.5
104374,About Time (2013),Drama|Fantasy|Romance,2194499,122906.0,"The night after another unsatisfactory New Year's party, Tim's father tells his son that the men in his family have always had the ability to travel through time. They can't change history, but they can change what happens and has happened in their own lives. Thus begins the start of a lesson in learning to appreciate life itself as it is, as it comes, and most importantly, the people living alongside us.",7.9,8889,"['Drama', 'Romance', 'Fantasy']",4.0
104841,Gravity (2013),Action|Sci-Fi|IMAX,1454468,49047.0,"Dr. Ryan Stone, a brilliant medical engineer, is on her first Shuttle mission, with veteran astronaut Matt Kowalsky in command of his last flight before retiring. But on a seemingly routine spacewalk, disaster strikes. The Shuttle is destroyed, leaving Stone and Kowalsky completely alone-tethered to nothing but each other and spiraling out into the blackness of space. The deafening silence tells them they have lost any link to Earth and any chance for rescue. As fear turns to panic, every gulp of air eats away at what little oxygen is left. But the only way home may be to go further out into the terrifying expanse of space.",7.162,15817,"['Science Fiction', 'Thriller', 'Drama']",4.0
104879,Prisoners (2013),Drama|Mystery|Thriller,1392214,146233.0,"Keller Dover is facing every parent’s worst nightmare. His six-year-old daughter, Anna, is missing, together with her young friend, Joy, and as minutes turn to hours, panic sets in. The only lead is a dilapidated RV that had earlier been parked on their street.",8.099,12460,"['Drama', 'Thriller', 'Crime']",4.5
104913,Rush (2013),Action|Drama,1979320,96721.0,"In the 1970s, a rivalry propels race car drivers Niki Lauda and James Hunt to fame and glory — until a horrible accident threatens to end it all.",7.727,7486,"['Drama', 'Action']",4.0
105213,Don Jon (2013),Comedy|Drama|Romance,2229499,138697.0,"A New Jersey guy dedicated to his family, friends, and church, develops unrealistic expectations from watching porn and works to find happiness and intimacy with his potential true love.",6.017,4428,"['Romance', 'Comedy', 'Drama']",3.5
105593,Filth (2013),Comedy|Crime|Drama,1450321,85889.0,A bigoted junkie cop suffering from borderline personality disorder and drug addiction manipulates and hallucinates his way in a bid to secure promotion.,6.8,1800,"['Crime', 'Drama', 'Comedy']",4.0
105835,"Double, The (2013)",Comedy|Drama|Thriller,1825157,146015.0,An awkward office drone becomes increasingly unhinged after a charismatic and confident look-alike takes a job at his workplace and seduces the woman he desires.,6.523,1029,"['Thriller', 'Drama']",4.0
105844,12 Years a Slave (2013),Drama,2024544,76203.0,"In the pre-Civil War United States, Solomon Northup, a free black man from upstate New York, is abducted and sold into slavery. Facing cruelty as well as unexpected kindnesses Solomon struggles not only to stay alive, but to retain his dignity. In the twelfth year of his unforgettable odyssey, Solomon’s chance meeting with a Canadian abolitionist will forever alter his life.",7.938,11607,"['Drama', 'History']",3.0
106100,Dallas Buyers Club (2013),Drama,790636,152532.0,"Loosely based on the true-life tale of Ron Woodroof, a drug-taking, women-loving, homophobic man who in 1986 was diagnosed with HIV/AIDS and given thirty days to live.",7.9,8746,"['Drama', 'History']",4.0
106766,Inside Llewyn Davis (2013),Drama,2042568,86829.0,"In Greenwich Village in the early 1960s, gifted but volatile folk musician Llewyn Davis struggles with money, relationships, and his uncertain future.",7.2,2795,"['Drama', 'Music']",4.0
106782,"Wolf of Wall Street, The (2013)",Comedy|Crime|Drama,993846,106646.0,"A New York stockbroker refuses to cooperate in a large securities fraud case involving corruption on Wall Street, corporate banking world and mob infiltration. Based on Jordan Belfort's autobiography.",8.028,25012,"['Crime', 'Drama', 'Comedy']",4.0
106920,Her (2013),Drama|Romance|Sci-Fi,1798709,152601.0,"In the not so distant future, Theodore, a lonely writer, purchases a newly developed operating system designed to meet the user's every need. To Theodore's surprise, a romantic relationship develops between him and his operating system. This unconventional love story blends science fiction and romance in a sweet tale that explores the nature of love and the ways that technology isolates and connects us all.",7.846,14771,"['Romance', 'Science Fiction', 'Drama']",4.5
107406,Snowpiercer (2013),Action|Drama|Sci-Fi,1706620,110415.0,"In a future where a failed global-warming experiment kills off most life on the planet, a class system evolves aboard the Snowpiercer; a train that travels around the globe via a perpetual-motion engine.",6.908,10014,"['Action', 'Science Fiction', 'Drama']",3.5
107771,Only Lovers Left Alive (2013),Drama|Horror|Romance,1714915,152603.0,"A depressed musician reunites with his lover. However, their romance, already played over several centuries, is disrupted by the arrival of her uncontrollable younger sister.",7.2,2291,"['Drama', 'Romance', 'Fantasy']",4.5
108729,Enemy (2013),Mystery|Thriller,2316411,181886.0,A mild-mannered college professor discovers a look-alike actor and delves into the other man's private affairs.,6.855,6149,"['Thriller', 'Mystery']",4.0
109187,"Zero Theorem, The (2013)",Drama|Fantasy|Sci-Fi,2333804,157834.0,"A computer hacker's goal to discover the reason for human existence continually finds his work interrupted thanks to the Management; this time, they send a teenager and lusty love interest to distract him.",6.101,1262,"['Drama', 'Fantasy', 'Science Fiction']",3.5
109374,"Grand Budapest Hotel, The (2014)",Comedy|Drama,2278388,120467.0,"The Grand Budapest Hotel tells of a legendary concierge at a famous European hotel between the wars and his friendship with a young employee who becomes his trusted protégé. The story involves the theft and recovery of a priceless Renaissance painting, the battle for an enormous family fortune and the slow and then sudden upheavals that transformed Europe during the first half of the 20th century.",8.035,15427,"['Comedy', 'Drama']",4.5
109487,Interstellar (2014),Sci-Fi|IMAX,816692,157336.0,The adventures of a group of explorers who make use of a newly discovered wormhole to surpass the limitations on human space travel and conquer the vast distances involved in an interstellar voyage.,8.461,37930,"['Adventure', 'Drama', 'Science Fiction']",5.0
109848,Under the Skin (2013),Horror|Sci-Fi|Thriller,1441395,97370.0,A seductive stranger prowls the streets of Glasgow in search of prey: unsuspecting men who fall under her spell.,6.14,3611,"['Thriller', 'Science Fiction', 'Drama']",4.0
110730,Transcendence (2014),Drama|Sci-Fi|IMAX,2209764,157353.0,"Two leading computer scientists work toward their goal of Technological Singularity,  as a radical anti-technology organization fights to prevent them from creating a world where computers can transcend the abilities of the human brain.",6.057,5582,"['Thriller', 'Science Fiction', 'Drama', 'Mystery']",4.5
111360,Lucy (2014),Action|Sci-Fi,2872732,240832.0,"A woman, accidentally caught in a dark deal, turns the tables on her captors and transforms into a merciless warrior evolved beyond human logic.",6.469,16572,"['Action', 'Science Fiction']",3.0
111759,Edge of Tomorrow (2014),Action|Sci-Fi|IMAX,1631867,137113.0,"Major Bill Cage is an officer who has never seen a day of combat when he is unceremoniously demoted and dropped into combat. Cage is killed within minutes, managing to take an alpha alien down with him. He awakens back at the beginning of the same day and is forced to fight and die again... and again - as physical contact with the alien has thrown him into a time loop.",7.6,14445,"['Action', 'Science Fiction']",4.0
112183,Birdman: Or (The Unexpected Virtue of Ignorance) (2014),Comedy|Drama,2562232,194662.0,"A fading actor best known for his portrayal of a popular superhero attempts to mount a comeback by appearing in a Broadway play. As opening night approaches, his attempts to become more altruistic, rebuild his career, and reconnect with friends and family prove more difficult than expected.",7.451,13176,"['Drama', 'Comedy']",4.5
112552,Whiplash (2014),Drama,2582802,244786.0,"Under the direction of a ruthless instructor, a talented young drummer begins to pursue perfection at any cost, even his humanity.",8.376,15932,"['Drama', 'Music']",4.5
112556,Gone Girl (2014),Drama|Thriller,2267998,210577.0,"With his wife's disappearance having become the focus of an intense media circus, a man sees the spotlight turned on him when it's suspected that he may not be innocent.",7.89,19291,"['Mystery', 'Thriller', 'Drama']",4.5
112804,I Origins (2014),Drama|Sci-Fi,2884206,244267.0,A molecular biologist's study of the human eye has far-reaching implications about humanity's scientific and spiritual beliefs.,7.582,3330,"['Science Fiction', 'Drama']",4.0
112852,Guardians of the Galaxy (2014),Action|Adventure|Sci-Fi,2015381,118340.0,"Light years from Earth, 26 years after being abducted, Peter Quill finds himself the prime target of a manhunt after discovering an orb wanted by Ronan the Accuser.",7.905,28900,"['Action', 'Science Fiction', 'Adventure']",3.0
112868,"Signal, The (2014)",Sci-Fi|Thriller,2910814,242095.0,"On a road trip, Nic and two friends are drawn to an isolated area by a computer genius. When everything suddenly goes dark, Nic regains consciousness – only to find himself in a waking nightmare.",6.016,1747,"['Thriller', 'Science Fiction']",4.0
113741,Coherence (2013),Drama|Mystery|Sci-Fi|Thriller,2866360,220289.0,Four couples gather for dinner the night a mysterious and powerful comet passes overhead.,7.2,3165,"['Thriller', 'Science Fiction']",4.0
113829,"One I Love, The (2014)",Comedy|Drama|Romance,2756032,242090.0,"Ethan and Sophie are a married couple on the brink of separation when, at the urging of their therapist, they decide to salvage their relationship by escaping to a beautiful vacation house for the weekend.",6.865,728,"['Romance', 'Comedy', 'Drama']",4.0
114180,"Maze Runner, The (2014)",Action|Mystery|Sci-Fi,1790864,198663.0,"A teenager with no memory of his past finds himself among a group of boys living in a walled enclosure surrounded by a massive, ever-changing maze. As he struggles to adapt to their rules and society, he begins to uncover clues that may lead to escape and the truth behind their confinement.",7.192,17579,"['Action', 'Mystery', 'Science Fiction', 'Thriller']",3.5
114494,Who Am I (Kein System Ist Sicher) (2014),Thriller,3042408,284427.0,"Benjamin, a young German computer whiz, is invited to join a subversive hacker group that wants to be noticed on the world's stage.",7.584,1624,['Thriller'],4.0
114935,Predestination (2014),Action|Mystery|Sci-Fi|Thriller,2397535,206487.0,"Predestination chronicles the life of a Temporal Agent sent on an intricate series of time-travel journeys designed to prevent future killers from committing their crimes. Now, on his final assignment, the Agent must stop the one criminal that has eluded him throughout time and prevent a devastating attack in which thousands of lives will be lost.",7.424,6764,"['Science Fiction', 'Thriller']",4.5
115122,What We Do in the Shadows (2014),Comedy|Horror,3416742,246741.0,Vampire housemates try to cope with the complexities of modern life and show a newly turned hipster some of the perks of being undead.,7.6,3720,"['Comedy', 'Horror']",4.0
115149,John Wick (2014),Action|Thriller,2911666,245891.0,Ex-hitman John Wick comes out of retirement to track down the gangsters that took everything from him.,7.453,20063,"['Action', 'Thriller']",4.0
115569,Nightcrawler (2014),Crime|Drama|Thriller,2872718,242582.0,"When Lou Bloom, desperate for work, muscles into the world of L.A. crime journalism, he blurs the line between observer and participant to become the star of his own story. Aiding him in his effort is Nina, a TV-news veteran.",7.705,11244,"['Crime', 'Drama', 'Thriller']",4.0
115680,Time Lapse (2014),Crime|Drama|Sci-Fi|Thriller,2669336,273271.0,"Three friends discover a mysterious machine that takes pictures 24 hours into the future and conspire to use it for personal gain, until disturbing and dangerous images begin to develop.",6.533,1304,"['Thriller', 'Science Fiction', 'Mystery', 'Horror']",4.0
115713,Ex Machina (2015),Drama|Sci-Fi|Thriller,470752,264660.0,"Caleb, a coder at the world's largest internet company, wins a competition to spend a week at a private mountain retreat belonging to Nathan, the reclusive CEO of the company. But when Caleb arrives at the remote location he finds that he will have to participate in a strange and fascinating experiment in which he must interact with the world's first true artificial intelligence, housed in the body of a beautiful robot girl.",7.573,13722,"['Drama', 'Science Fiction']",4.5
116797,The Imitation Game (2014),Drama|Thriller|War,2084970,205596.0,"Based on the real life story of legendary cryptanalyst Alan Turing, the film portrays the nail-biting race against time by Turing and his brilliant team of code-breakers at Britain's top-secret Government Code and Cypher School at Bletchley Park, during the darkest days of World War II.",7.992,17550,"['History', 'Drama', 'Thriller', 'War']",4.5
117176,The Theory of Everything (2014),Drama|Romance,2980516,266856.0,"The Theory of Everything is the extraordinary story of one of the world’s greatest living minds, the renowned astrophysicist Stephen Hawking, who falls deeply in love with fellow Cambridge student Jane Wilde.",7.839,10832,"['Drama', 'Romance']",4.0
120466,Chappie (2015),Action|Thriller,1823672,198184.0,"Every child comes into the world full of promise, and none more so than Chappie: he is gifted, special, a prodigy. Like any child, Chappie will come under the influence of his surroundings—some good, some bad—and he will rely on his heart and soul to find his way in the world and become his own man. But there's one thing that makes Chappie different from any one else: he is a robot.",6.784,8187,"['Crime', 'Action', 'Science Fiction']",4.0
122904,Deadpool (2016),Action|Adventure|Comedy|Sci-Fi,1431045,293660.0,"The origin story of former Special Forces operative turned mercenary Wade Wilson, who, after being subjected to a rogue experiment that leaves him with accelerated healing powers, adopts the alter ego Deadpool. Armed with his new abilities and a dark, twisted sense of humor, Deadpool hunts down the man who nearly destroyed his life.",7.6,31940,"['Action', 'Adventure', 'Comedy']",4.0
122910,Captain Marvel (2018),Action|Adventure|Sci-Fi,4154664,299537.0,"The story follows Carol Danvers as she becomes one of the universe’s most powerful heroes when Earth is caught in the middle of a galactic war between two alien races. Set in the 1990s, Captain Marvel is an all-new adventure from a previously unseen period in the history of the Marvel Cinematic Universe.",6.793,16267,"['Action', 'Adventure', 'Science Fiction']",2.0
122914,Avengers: Infinity War - Part II (2019),Action|Adventure|Sci-Fi,4154796,299534.0,"After the devastating events of Avengers: Infinity War, the universe is in ruins due to the efforts of the Mad Titan, Thanos. With the help of remaining allies, the Avengers must assemble once more in order to undo Thanos' actions and restore order to the universe once and for all, no matter what consequences may be in store.",8.238,26763,"['Adventure', 'Science Fiction', 'Action']",3.5
122922,Doctor Strange (2016),Action|Adventure|Sci-Fi,1211837,284052.0,"After his career is destroyed, a brilliant but arrogant surgeon gets a new lease on life when a sorcerer takes him under her wing and trains him to defend the world against evil.",7.418,22811,"['Fantasy', 'Adventure', 'Action']",3.5
127096,Project Almanac (2015),Sci-Fi|Thriller,2436386,227719.0,"A group of teens discover secret plans of a time machine, and construct one. However, things start to get out of control.",6.79,2721,"['Science Fiction', 'Thriller']",3.5
128360,The Hateful Eight (2015),Western,3460252,273248.0,Bounty hunters seek shelter from a raging blizzard and get caught up in a plot of betrayal and deception.,7.756,14729,"['Drama', 'Mystery', 'Western']",4.0
130488,The Infinite Man (2014),Comedy,2553424,253307.0,A man's attempts to construct the ultimate romantic weekend backfire when his quest for perfection traps his lover in an infinite loop.,5.9,58,"['Science Fiction', 'Comedy']",4.0
130840,Spring (2015),Horror|Romance|Sci-Fi,3395184,241855.0,"A young man in a personal tailspin flees the US to Italy, where he sparks up a romance with a woman harboring a dark, primordial secret.",6.633,732,"['Horror', 'Romance', 'Science Fiction']",0.5
133419,Pitch Perfect 2 (2015),Comedy,2848292,254470.0,"The Bellas are back, and they are better than ever. After being humiliated in front of none other than the President of the United States of America, the Bellas are taken out of the Aca-Circuit. In order to clear their name, and regain their status, the Bellas take on a seemingly impossible task: winning an international competition no American team has ever won. In order to accomplish this monumental task, they need to strengthen the bonds of friendship and sisterhood and blow away the competition with their amazing aca-magic! With all new friends and old rivals tagging along for the trip, the Bellas can hopefully accomplish their dreams.",6.847,5402,"['Comedy', 'Music']",0.5
133771,The Lobster (2015),Comedy|Romance|Sci-Fi,3464902,254320.0,"In a dystopian near future, single people, according to the laws of The City, are taken to The Hotel, where they are obliged to find a romantic partner in forty-five days or are transformed into animals and sent off into The Woods.",7.041,6560,"['Comedy', 'Drama', 'Romance']",5.0
134130,The Martian (2015),Adventure|Drama|Sci-Fi,3659388,286217.0,"During a manned mission to Mars, Astronaut Mark Watney is presumed dead after a fierce storm and left behind by his crew. But Watney has survived and finds himself stranded and alone on the hostile planet. With only meager supplies, he must draw upon his ingenuity, wit and spirit to subsist and find a way to signal to Earth that he is alive.",7.689,20451,"['Drama', 'Adventure', 'Science Fiction']",3.5
134393,Trainwreck (2015),Comedy|Romance,3152624,271718.0,"Having thought that monogamy was never possible, a commitment-phobic career woman may have to face her fears when she meets a good guy.",5.802,2645,"['Comedy', 'Romance']",0.5
135518,Self/less (2015),Action|Mystery|Sci-Fi|Thriller,2140379,238615.0,An extremely wealthy elderly man dying from cancer undergoes a radical medical procedure that transfers his consciousness to the body of a healthy young man but everything may not be as good as it seems when he starts to uncover the mystery of the body's origins and the secret organization that will kill to keep its secrets.,6.4,3185,"['Science Fiction', 'Action', 'Thriller']",4.0
139385,The Revenant (2015),Adventure|Drama,1663202,281957.0,"In the 1820s, a frontiersman, Hugh Glass, sets out on a path of vengeance against those who left him for dead after a bear mauling.",7.536,18693,"['Western', 'Drama', 'Adventure']",4.0
140247,The Gift (2015),Drama|Horror,4178092,328425.0,Simon and Robyn are a young married couple whose life is going as planned until a chance run-in with Simon's high school acquaintance sends their world into a tailspin.,6.695,3339,"['Thriller', 'Mystery', 'Drama']",4.0
140267,The Witch (2015),Horror,4263482,310131.0,"In 1630, a farmer relocates his family to a remote plot of land on the edge of a forest where strange, unsettling things happen. With suspicion and paranoia mounting, each family member's faith, loyalty and love are tested in shocking ways.",6.992,7339,"['Horror', 'Fantasy', 'Drama']",4.0
140956,Ready Player One,Action|Sci-Fi|Thriller,1677720,333339.0,"When the creator of a popular video game system dies, a virtual contest is created to compete for his fortune.",7.586,16262,"['Adventure', 'Action', 'Science Fiction']",4.0
142222,Demolition (2016),Drama,1172049,303991.0,An emotionally desperate investment banker finds hope through a woman he meets.,6.831,2351,"['Comedy', 'Drama']",4.0
142507,Pawn Sacrifice (2015),Drama,1596345,245698.0,American chess champion Bobby Fischer prepares for a legendary match-up against Russian Boris Spassky.,6.75,1006,"['Thriller', 'Drama']",4.0
143367,Silence (2016),Drama|Thriller,490215,68730.0,"In the 17th century, two Portuguese Jesuit priests travel to Japan in an attempt to locate their mentor, who is rumored to have committed apostasy, and to propagate Catholicism.",7.128,3160,"['Drama', 'History']",4.5
143647,An Inspector Calls (2015),Drama|Thriller,4271918,359305.0,"Northern England, 1912. The dinner of a wealthy family is interrupted by Inspector Goole, who only announces that a young woman has committed suicide. Then, he simply asks everyone present, one by one, if they knew her.",7.4,241,"['Drama', 'Crime', 'Thriller', 'Mystery', 'TV Movie']",3.5
144482,Circle (2015),Drama|Horror|Sci-Fi,3118452,335866.0,"In a massive, mysterious chamber, fifty strangers awaken to find themselves trapped with no memory of how they got there.  Organized in an inward-facing circle and unable to move, they quickly learn that every two minutes, one of them must die…executed by a strange device in the center of the room.",6.017,2050,"['Horror', 'Science Fiction', 'Mystery', 'Thriller']",3.5
147942,Room 8 (2013),(no genres listed),2949338,191850.0,"Thrown to rot in a narrow and gloomy cell of a hideous Soviet prison, a weary new inmate struggles to come to terms with the new reality. Within the grey cage, an unwelcoming fellow convict cautions the newcomer not to touch the intriguingly mysterious red wooden box which rests on the lower bunk, moreover, not even think of opening it. Why is there so much secrecy about the contents of the box? Could there be hiding the means to his escape?",7.5,77,"['Drama', 'Fantasy', 'Science Fiction', 'Thriller', 'Horror']",4.0
