movieId,title,genres,imdbId,tmdbId,overview,tmdb_vote_average,tmdb_vote_count,tmdb_genres,rating
1,Toy Story (1995),Adventure|Animation|Children|Comedy|Fantasy,114709,862.0,"Led by Woody, Andy's toys live happily in his room until Andy's birthday brings Buzz Lightyear onto the scene. Afraid of losing his place in Andy's heart, Woody plots against Buzz. But when circumstances separate Buzz and Woody from their owner, the duo eventually learns to put aside their differences.",7.969,19166,"['Family', 'Comedy', 'Animation']",4.0
2,Jumanji (1995),Adventure|Children|Fantasy,113497,8844.0,"When siblings Judy and Peter discover an enchanted board game that opens the door to a magical world, they unwittingly invite Alan -- an adult who's been trapped inside the game for 26 years -- into their living room. Alan's only hope for freedom is to finish the game, which proves risky as all three find themselves running from giant rhinoceroses, evil monkeys and other terrifying creatures.",7.24,10907,"['Adventure', 'Fantasy', 'Family']",3.5
3,Grumpier Old Men (1995),Comedy|Romance,113228,15602.0,"A family wedding reignites the ancient feud between next-door neighbors and fishing buddies John and Max. Meanwhile, a sultry Italian divorcée opens a restaurant at the local bait shop, alarming the locals who worry she'll scare the fish away. But she's less interested in seafood than she is in cooking up a hot time with Max.",6.474,407,"['Romance', 'Comedy']",3.5
5,Father of the Bride Part II (1995),Comedy,113041,11862.0,"Just when George Banks has recovered from his daughter's wedding, he receives the news that she's pregnant ... and that George's wife is expecting too. He was planning on selling their home, but that's a plan that—like George—will have to change with the arrival of both a grandchild and a kid of his own.",6.26,768,"['Comedy', 'Family']",3.5
6,Heat (1995),Action|Crime|Thriller,113277,949.0,Obsessive master thief Neil McCauley leads a top-notch crew on various daring heists throughout Los Angeles while determined detective Vincent Hanna pursues him without rest. Each man recognizes and respects the ability and the dedication of the other even though they are aware their cat-and-mouse game may end in violence.,7.922,7813,"['Crime', 'Drama', 'Action']",4.0
7,Sabrina (1995),Comedy|Romance,114319,11860.0,"Sabrina Fairchild, a chauffeur's daughter, grew up at the Long Island estate of the wealthy Larrabee family enchanted with their sparkling world of privilege and wealth, but she's especially enamored of younger son David, a charming playboy. After the once plain Sabrina returns from a sojourn in Paris transformed into a glamorous young woman, she at long last catches David's eye. In a calculated effort to manipulate David away from her and into a more financially advantageous marriage, formidable older brother Linus devises a plan to keep them apart.",6.213,651,"['Romance', 'Drama', 'Comedy']",3.5
10,GoldenEye (1995),Action|Adventure|Thriller,113189,710.0,"When a powerful satellite system falls into the hands of Alec Trevelyan, AKA Agent 006, a former ally-turned-enemy, only James Bond can save the world from a dangerous space weapon that -- in one short pulse -- could destroy the earth! As Bond squares off against his former compatriot, he also battles Xenia Onatopp, an assassin who uses pleasure as her ultimate weapon.",6.897,4105,"['Adventure', 'Action', 'Thriller']",3.5
12,Dracula: Dead and Loving It (1995),Comedy|Horror,112896,12110.0,"When a lawyer shows up at the vampire's doorstep, he falls prey to his charms and joins him in his search for fresh blood. Enter Professor Van Helsing, who may be the only one able to vanquish the Count.",6.087,1030,"['Comedy', 'Horror']",2.5
15,Cutthroat Island (1995),Action|Adventure|Romance,112760,1408.0,"Morgan Adams and her slave, William Shaw, are on a quest to recover the three portions of a treasure map. Unfortunately, the final portion is held by her murderous uncle, Dawg. Her crew is skeptical of her leadership abilities, so she must complete her quest before they mutiny against her. This is made yet more difficult by the efforts of the British crown to end her pirate raids.",5.783,587,"['Action', 'Adventure']",2.5
16,Casino (1995),Crime|Drama,112641,524.0,"In early-1970s Las Vegas, Sam ""Ace"" Rothstein gets tapped by his bosses to head the Tangiers Casino. At first, he's a great success in the job, but over the years, problems with his loose-cannon enforcer Nicky Santoro, his ex-hustler wife Ginger, her con-artist ex Lester Diamond and a handful of corrupt politicians put Sam in ever-increasing danger.",8.0,6189,"['Crime', 'Drama']",4.0
17,Sense and Sensibility (1995),Drama|Romance,114388,4584.0,"The Dashwood sisters, sensible Elinor and passionate Marianne, whose chances at marriage seem doomed by their family's sudden loss of fortune.  When Henry Dashwood dies unexpectedly, his estate must pass on by law to his son from his first marriage, John and wife Fanny. But these circumstances leave Mr. Dashwood's current wife, and daughters Elinor, Marianne and Margaret, without a home and with barely enough money to live on. As Elinor and Marianne struggle to find romantic fulfillment in a society obsessed with financial and social status, they must learn to mix sense with sensibility in their dealings with both money and men.",7.418,1758,"['Drama', 'Romance']",3.5
19,Ace Ventura: When Nature Calls (1995),Comedy,112281,9273.0,"Summoned from an ashram in Tibet, Ace finds himself on a perilous journey into the jungles of Africa to find Shikaka, the missing sacred animal of the friendly Wachati tribe. He must accomplish this before the wedding of the Wachati's Princess to the prince of the warrior Wachootoos. If Ace fails, the result will be a vicious tribal war.",6.3,4340,"['Crime', 'Comedy', 'Adventure']",3.0
21,Get Shorty (1995),Comedy|Crime|Thriller,113161,8012.0,"Chili Palmer is a Miami mobster who gets sent to L.A. to collect a bad debt from Harry Zimm, a Hollywood producer who specializes in cheesy horror films. When Chili meets Harry's leading lady, the romantic sparks fly. After pitching his own life story as a movie idea, Chili learns that being a mobster and being a Hollywood producer really aren't all that different.",6.511,1124,"['Comedy', 'Thriller', 'Crime']",4.0
24,Powder (1995),Drama|Sci-Fi,114168,12665.0,"Harassed by classmates who won't accept his shocking appearance, a shy young man known as ""Powder"" struggles to fit in. But the cruel taunts stop when Powder displays a mysterious power that allows him to do incredible things. This phenomenon changes the lives of all those around him in ways they never could have imagined.",7.0,689,"['Drama', 'Fantasy']",3.5
25,Leaving Las Vegas (1995),Drama|Romance,113627,451.0,"Ben Sanderson, an alcoholic Hollywood screenwriter who lost everything because of his drinking, arrives in Las Vegas to drink himself to death. There, he meets and forms an uneasy friendship and non-interference pact with prostitute Sera.",7.251,1536,"['Drama', 'Romance']",4.0
26,Othello (1995),Drama,114057,16420.0,The evil Iago pretends to be friend of Othello in order to manipulate him to serve his own end in the film version of this Shakespeare classic.,6.4,147,['Drama'],3.0
27,Now and Then (1995),Children|Drama,114011,9263.0,"Waxing nostalgic about the bittersweet passage from childhood to puberty, four childhood girlfriends — Teeny, Chrissy, Samantha and Roberta — recall the magical summer of 1970. During their walk down memory lane, they reconcile experiences with boys, secrets, bullies and more.",6.9,456,"['Comedy', 'Drama', 'Romance']",3.5
31,Dangerous Minds (1995),Drama,112792,9909.0,"Former Marine Louanne Johnson lands a gig teaching in a pilot program for bright but underachieving teens at a notorious inner-city high school. After having a terrible first day, she decides she must throw decorum to the wind. When Johnson returns to the classroom, she does so armed with a no-nonsense attitude informed by her military training and a fearless determination to better the lives of her students -- no matter what the cost.",6.977,1203,['Drama'],3.5
32,Twelve Monkeys (a.k.a. 12 Monkeys) (1995),Mystery|Sci-Fi|Thriller,114746,63.0,"In the year 2035, convict James Cole reluctantly volunteers to be sent back in time to discover the origin of a deadly virus that wiped out nearly all of the earth's population and forced the survivors into underground communities. But when Cole is mistakenly sent to 1990 instead of 1996, he's arrested and locked up in a mental hospital. There he meets psychiatrist Dr. Kathryn Railly and the son of a famous virus expert who may hold the key to the Army of the 12 Monkeys; thought to be responsible for unleashing the killer disease.",7.601,8713,"['Science Fiction', 'Thriller', 'Mystery']",4.0
34,Babe (1995),Children|Drama,112431,9598.0,"Babe is a little pig who doesn't quite know his place in the world. With a bunch of odd friends, like Ferdinand the duck who thinks he is a rooster and Fly the dog he calls mum, Babe realises that he has the makings to become the greatest sheep pig of all time, and Farmer Hoggett knows it. With the help of the sheep dogs, Babe learns that a pig can be anything that he wants to be.",6.248,3003,"['Fantasy', 'Drama', 'Comedy', 'Family']",4.0
36,Dead Man Walking (1995),Crime|Drama,112818,687.0,A death row inmate turns for spiritual guidance to a local nun in the days leading up to his scheduled execution for the murders of a young couple.,7.328,1418,['Drama'],4.0
39,Clueless (1995),Comedy|Romance,112697,9603.0,"Shallow, rich and socially successful Cher is at the top of her Beverly Hills high school's pecking scale. Seeing herself as a matchmaker, Cher first coaxes two teachers into dating each other. Emboldened by her success, she decides to give hopelessly klutzy new student Tai a makeover. When Tai becomes more popular than she is, Cher realizes that her disapproving ex-stepbrother was right about how misguided she was -- and falls for him.",7.267,4619,"['Comedy', 'Romance']",2.5
47,Seven (a.k.a. Se7en) (1995),Mystery|Thriller,114369,807.0,"Two homicide detectives are on a desperate hunt for a serial killer whose crimes are based on the ""seven deadly sins"" in this dark and haunting film that takes viewers from the tortured remains of one victim to the next. The seasoned Det. Somerset researches each sin in an effort to get inside the killer's mind, while his novice partner, Mills, scoffs at his efforts to unravel the case.",8.376,22134,"['Crime', 'Mystery', 'Thriller']",4.0
48,Pocahontas (1995),Animation|Children|Drama|Musical|Romance,114148,10530.0,"Pocahontas, daughter of a Native American tribe chief, falls in love with an English soldier as colonists invade 17th century Virginia.",6.914,5883,"['Adventure', 'Animation', 'Family', 'Romance']",3.5
50,"Usual Suspects, The (1995)",Crime|Mystery|Thriller,114814,629.0,"Held in an L.A. interrogation room, Verbal Kint attempts to convince the feds that a mythic crime lord, Keyser Soze, not only exists, but was also responsible for drawing him and his four partners into a multi-million dollar heist that ended with an explosion in San Pedro harbor – leaving few survivors. Verbal lures his interrogators with an incredible story of the crime lord's almost supernatural prowess.",8.172,10880,"['Drama', 'Crime', 'Thriller']",4.5
60,"Indian in the Cupboard, The (1995)",Adventure|Children|Fantasy,113419,11359.0,A nine-year-old boy gets a plastic Indian and a cupboard for his birthday and finds himself involved in adventure when the Indian comes to life and befriends him.,6.5,650,"['Adventure', 'Family', 'Fantasy']",4.0
62,Mr. Holland's Opus (1995),Drama,113862,2054.0,"In 1965, passionate musician Glenn Holland takes a day job as a high school music teacher, convinced it's just a small obstacle on the road to his true calling: writing a historic opus. As the decades roll by with the composition unwritten but generations of students inspired through his teaching, Holland must redefine his life's purpose.",7.0,430,"['Drama', 'Music']",4.5
63,Don't Be a Menace to South Central While Drinking Your Juice in the Hood (1996),Comedy|Crime,116126,10607.0,"When Ashtray moves to South Central L.A. to live with his father (who appears to be the same age he is) and grandmother (who likes to talk tough and smoke reefer), he falls in with his gang-banging cousin Loc Dog, who along with the requisite pistols and Uzi carries a thermo-nuclear warhead for self-defense. Will Ashtray be able to keep living the straight life?",7.031,1403,"['Comedy', 'Crime']",3.0
65,Bio-Dome (1996),Comedy,115683,9536.0,"Moronic best friends get themselves locked inside the Bio-Dome, a science experiment, along with a group of environmental scientists for one year.",4.5,383,['Comedy'],2.0
70,From Dusk Till Dawn (1996),Action|Comedy|Horror|Thriller,116367,755.0,"After kidnapping a father and his two kids, the Gecko brothers head south to a seedy Mexican bar to hide out in safety, unaware of its notorious vampire clientele.",7.029,6195,"['Horror', 'Action', 'Thriller', 'Crime']",1.5
73,"Misérables, Les (1995)",Drama|War,113828,48750.0,"In France during World War II, a poor and illiterate man, Henri Fortin, is introduced to Victor Hugo's classic novel Les Misérables and begins to see parallels between the book and his own life.",6.7,81,"['Drama', 'History']",4.0
74,Bed of Roses (1996),Drama|Romance,115644,20927.0,"The seeds of love are planted when Lisa, a high-powered investment banker, receives flowers from a secret admirer. But when his fairy-tale fantasies clash with her workaholic ways, they soon find out that sometimes, it's harder than it seems for love to conquer all.",5.9,118,"['Drama', 'Romance']",2.5
76,Screamers (1995),Action|Sci-Fi|Thriller,114367,9102.0,"SIRIUS 6B, Year 2078. On a distant mining planet ravaged by a decade of war, scientists have created the perfect weapon: a blade-wielding, self-replicating race of killing devices known as Screamers designed for one purpose only -- to hunt down and destroy all enemy life forms.",6.209,561,"['Horror', 'Science Fiction', 'War']",3.0
88,Black Sheep (1996),Comedy,115697,13997.0,"When dignified Albert Donnelly runs for Governor, his team moves to keep his slow-witted and klutzy younger brother, Mike, out of the eye of the media. To baby-sit Mike, the campaign assigns sarcastic Steve, who gets the experience of a lifetime when he tries to take Mike out of town during the election.",6.1,429,['Comedy'],2.5
89,Nick of Time (1995),Action|Thriller,113972,2086.0,An ordinary man is suddenly forced into a plot to kill a politician in exchange for his kidnapped daughter's freedom.,6.2,761,"['Thriller', 'Crime', 'Action']",3.0
95,Broken Arrow (1996),Action|Adventure|Thriller,115759,9208.0,"When rogue stealth-fighter pilot Vic Deakins deliberately drops off the radar while on maneuvers, the Air Force ends up with two stolen nuclear warheads -- and Deakins's co-pilot, Riley Hale, is the military's only hope for getting them back. Traversing the deserted canyons of Utah, Hale teams with park ranger Terry Carmichael to put Deakins back in his box.",6.062,1589,"['Action', 'Thriller']",2.5
104,Happy Gilmore (1996),Comedy,116483,9614.0,"Failed hockey player-turned-golf whiz Happy Gilmore — whose unconventional approach and antics on the green courts the ire of rival Shooter McGavin — is determined to win a PGA tournament so he can save his granny's house with the prize money. Meanwhile, an attractive tour publicist tries to soften Happy's image.",6.67,3099,['Comedy'],3.0
105,"Bridges of Madison County, The (1995)",Drama|Romance,112579,688.0,Photographer Robert Kincaid wanders into the life of housewife Francesca Johnson for four days in the 1960s.,7.717,2260,"['Drama', 'Romance']",4.0
110,Braveheart (1995),Action|Drama|War,112573,197.0,"Enraged at the slaughter of Murron, his new bride and childhood love, Scottish warrior William Wallace slays a platoon of the local English lord's soldiers. This leads the village to revolt and, eventually, the entire country to rise up against English rule.",7.943,10616,"['Action', 'Drama', 'History', 'War']",4.0
111,Taxi Driver (1976),Crime|Drama|Thriller,75314,103.0,"Suffering from insomnia, disturbed loner Travis Bickle takes a job as a New York City cabbie, haunting the streets nightly, growing increasingly detached from reality as he dreams of cleaning up the filthy city.",8.135,12893,"['Crime', 'Drama']",4.0
112,Rumble in the Bronx (Hont faan kui) (1995),Action|Adventure|Comedy|Crime,113326,33542.0,"Keong comes from Hong Kong to visit New York for his uncle's wedding. His uncle runs a market in the Bronx and Keong offers to help out while Uncle is on his honeymoon. During his stay in the Bronx, Keong befriends a neighbor kid and beats up some neighborhood thugs who cause problems at the market. One of those petty thugs in the local gang stumbles into a criminal situation way over his head.",6.825,1093,"['Crime', 'Action', 'Comedy', 'Thriller']",3.5
122,Boomerang (1992),Comedy|Romance,103859,11066.0,"Marcus is a successful advertising executive who woos and beds women almost at will. After a company merger he finds that his new boss, the ravishing Jacqueline, is treating him in exactly the same way. Completely traumatised by this, his work goes badly downhill.",5.641,592,"['Comedy', 'Romance']",3.5
135,Down Periscope (1996),Comedy,116130,9101.0,"Maverick Navy Lieutenant Commander Tom Dodge will never be a textbook officer, but he's a brilliant seaman who's always wanted to command a nuclear submarine — he's been given one last chance to clean up his record. Unfortunately, Admiral Graham, his nemesis, would rather sink the fleet than give Dodge his own boat. So, Graham stacks the deck against him and assigns Dodge to the Stingray, a diesel-powered WW2 submarine that can barely keep afloat. To make matters worse, Dodge's crew is a collection of maladjusted, mistake-prone misfits. Then, he's tagged the ""enemy"" in a crucial war game, and ordered to take on the U.S. Navy's best.",6.372,492,['Comedy'],2.5
141,"Birdcage, The (1996)",Comedy,115685,11000.0,A gay cabaret owner and his drag queen partner agree to put up a false heterosexual front so that their son can introduce them to his fiancée's conservative parents.,7.049,1241,['Comedy'],4.0
145,Bad Boys (1995),Action|Comedy|Crime|Drama|Thriller,112442,9737.0,"Marcus Burnett is a henpecked family man. Mike Lowrey is a footloose and fancy free ladies' man. Both Miami policemen, they have 72 hours to reclaim a consignment of drugs stolen from under their station's nose. To complicate matters, in order to get the assistance of the sole witness to a murder, they have to pretend to be each other.",6.825,6668,"['Action', 'Comedy', 'Crime', 'Thriller']",3.5
150,Apollo 13 (1995),Adventure|Drama|IMAX,112384,568.0,"The true story of technical troubles that scuttle the Apollo 13 lunar mission in 1970, risking the lives of astronaut Jim Lovell and his crew, with the failed journey turning into a thrilling saga of heroism. Drifting more than 200,000 miles from Earth, the astronauts work furiously with the ground crew to avert tragedy.",7.452,5616,"['Drama', 'History']",4.0
151,Rob Roy (1995),Action|Drama|Romance|War,114287,11780.0,"In the highlands of Scotland in the 1700s, Rob Roy tries to lead his small town to a better future, by borrowing money from the local nobility to buy cattle to herd to market. When the money is stolen, Rob is forced into a Robin Hood lifestyle to defend his family and honour.",6.721,675,"['Adventure', 'History', 'Drama', 'Action', 'War']",4.0
153,Batman Forever (1995),Action|Adventure|Comedy|Crime,112462,414.0,"Batman faces off against two foes: the schizophrenic, horribly scarred former District Attorney Harvey Dent, aka Two-Face, and the Riddler, a disgruntled ex-Wayne Enterprises inventor seeking revenge against his former employer by unleashing his brain-sucking weapon on Gotham City's residents. As the caped crusader also copes with tortured memories of his parents' murder, he has a new romance, with psychologist Chase Meridian.",5.4,5368,"['Action', 'Crime', 'Fantasy']",2.0
158,Casper (1995),Adventure|Children,112642,8839.0,"Casper is a kind young ghost who peacefully haunts a mansion in Maine. When specialist James Harvey arrives to communicate with Casper and his fellow spirits, he brings along his teenage daughter, Kat. Casper quickly falls in love with Kat, but their budding relationship is complicated not only by his transparent state, but also by his troublemaking apparition uncles and their mischievous antics.",6.331,4730,"['Fantasy', 'Comedy', 'Family']",2.5
161,Crimson Tide (1995),Drama|Thriller|War,112740,8963.0,"After the Cold War, a breakaway Russian republic with nuclear warheads becomes a possible worldwide threat. U.S. submarine Capt. Frank Ramsey signs on a relatively green but highly recommended Lt. Cmdr. Ron Hunter to the USS Alabama, which may be the only ship able to stop a possible Armageddon. When Ramsey insists that the Alabama must act aggressively, Hunter, fearing they will start rather than stop a disaster, leads a potential mutiny to stop him.",7.18,1873,"['Thriller', 'Action', 'Drama', 'War']",4.0
163,Desperado (1995),Action|Romance|Western,112851,8068.0,"El Mariachi plunges headfirst into the dark border underworld when he follows a trail of blood to the last of the infamous Mexican drug lords, Bucho, for an action-packed, bullet-riddled showdown. With the help of his friend and a beautiful bookstore owner, El Mariachi tracks Bucho, takes on his army of desperados, and leaves his own trail of blood.",6.926,2988,"['Thriller', 'Action', 'Crime']",3.5
165,Die Hard: With a Vengeance (1995),Action|Crime|Thriller,112864,1572.0,"New York detective John McClane is back and kicking bad-guy butt in the third installment of this action-packed series, which finds him teaming with civilian Zeus Carver to prevent the loss of innocent lives. McClane thought he'd seen it all, until a genius named Simon engages McClane, his new ""partner"" -- and his beloved city -- in a deadly game that demands their concentration.",7.272,6379,"['Action', 'Thriller']",4.0
168,First Knight (1995),Action|Drama|Romance,113071,6520.0,"The timeless tale of King Arthur and the legend of Camelot are retold in this passionate period drama. Arthur is reluctant to hand the crown to Lancelot, and Guinevere is torn between her loyalty to her husband and her growing love for his rival. But Lancelot must balance his loyalty to the throne with the rewards of true love.",6.1,1273,"['Action', 'Adventure', 'Drama', 'Romance']",3.5
172,Johnny Mnemonic (1995),Action|Sci-Fi|Thriller,113481,9886.0,"In a dystopian 2021, Johnny is a data trafficker who has an implant that allows him to securely store data too sensitive for regular computer networks. On one delivery run, he accepts a package that not only exceeds the implant's safety limits—and will kill him if the data is not removed in time—but also contains information far more important and valuable than he had ever imagined. On a race against time, he must avoid the assassins sent to kill him and remove the data before it, too, ends his life.",5.8,1433,"['Science Fiction', 'Action', 'Adventure']",3.5
173,Judge Dredd (1995),Action|Crime|Sci-Fi,113492,9482.0,"In a dystopian future, Dredd, the most famous judge (a cop with instant field judiciary powers) is convicted for a crime he did not commit while his murderous counterpart escapes.",5.844,2588,"['Science Fiction', 'Action']",2.0
180,Mallrats (1995),Comedy|Romance,113749,2293.0,"Both dumped by their girlfriends, two best friends seek refuge in the local mall. Eventually, they decide to try and win back their significant others and take care of their respective nemeses.",6.8,1300,"['Romance', 'Comedy']",2.0
185,"Net, The (1995)",Action|Crime|Thriller,113957,1642.0,"Angela Bennett is a freelance computer systems analyst who tracks down software viruses. At night she hooks up to the internet and chats to others 'surfing the net'. While de-bugging a new high-tech game for a cyber friend, she comes across a top secret program and becomes the target of a mysterious organization who will stop at nothing to erase her identity and her existence, in order to protect the project.",6.036,1435,"['Crime', 'Drama', 'Mystery', 'Thriller', 'Action']",3.5
196,Species (1995),Horror|Sci-Fi,114508,9348.0,"In 1993, the Search for Extra Terrestrial Intelligence Project receives a transmission detailing an alien DNA structure, along with instructions on how to splice it with human DNA. The result is Sil, a sensual but deadly creature who can change from a beautiful woman to an armour-plated killing machine in the blink of an eye.",5.974,1736,"['Science Fiction', 'Horror', 'Action']",3.5
204,Under Siege 2: Dark Territory (1995),Action,114781,3512.0,"A passenger train has been hijacked by an electronics expert and turned into an untraceable command center for a weapons satellite. He has planned to blow up Washington DC and only one man can stop him, former Navy SEAL Casey Ryback.",5.849,959,"['Action', 'Thriller']",3.0
208,Waterworld (1995),Action|Adventure|Sci-Fi,114898,9804.0,"In a futuristic world where the polar ice caps have melted and made Earth a liquid planet, a beautiful barmaid rescues a mutant seafarer from a floating island prison. They escape, along with her young charge, Enola, and sail off aboard his ship. But the trio soon becomes the target of a menacing pirate who covets the map to 'Dryland'—which is tattooed on Enola's back.",6.231,3862,"['Adventure', 'Action', 'Science Fiction']",3.0
