movieId,title,genres,imdbId,tmdbId,overview,tmdb_vote_average,tmdb_vote_count,tmdb_genres,rating
45950,"Inconvenient Truth, An (2006)",Documentary,497116,1781.0,A documentary on Al Gore's campaign to make the issue of global warming a recognized problem worldwide.,7.0,912,['Documentary'],4.0
46572,Edmond (2005),Drama|Thriller,443496,18191.0,"Seemingly mild-mannered businessman Edmond Burke visits a fortuneteller and hears a remark that spurs him to leave his wife abruptly and seek what is missing from his life. Encounters with strangers and unsavory people weaken the barriers encompassing his long-suppressed rage, until Edmond explodes in violence.",5.9,198,"['Drama', 'Thriller']",3.0
46578,Little Miss Sunshine (2006),Adventure|Comedy|Drama,449059,773.0,"A family loaded with quirky, colorful characters piles into an old van and road trips to California for little Olive to compete in a beauty pageant.",7.692,7479,"['Comedy', 'Drama']",4.0
46723,Babel (2006),Drama|Thriller,449467,1164.0,"Tragedy strikes a married couple vacationing in the Moroccan desert, which jumpstarts an interlocking story involving four different families.",7.171,3896,['Drama'],3.5
46850,Wordplay (2006),Documentary,492506,35199.0,"From the masters who create the mind-bending diversions to the tense competition at the American Crossword Puzzle Tournament, Patrick Creadon's documentary reveals a fascinating look at a decidedly addictive pastime. Creadon captures New York Times editor Will Shortz at work, talks to celebrity solvers -- including Bill Clinton and Ken Burns -- and presents an intimate look at the national tournament and its competitors.",7.067,45,['Documentary'],3.5
46976,Stranger than Fiction (2006),Comedy|Drama|Fantasy|Romance,420223,1262.0,Harold Crick is a lonely IRS agent whose mundane existence is transformed when he hears a mysterious voice narrating his life.,7.282,2393,"['Comedy', 'Drama', 'Fantasy', 'Romance']",4.0
47099,"Pursuit of Happyness, The (2006)",Drama,454921,1402.0,A struggling salesman takes custody of his son as he's poised to begin a life-changing professional career.,7.891,10219,['Drama'],3.5
47148,Mrs. Palfrey at the Claremont (2005),Comedy|Drama,421229,47880.0,"All but abandoned by her family in a London retirement hotel, an elderly woman strikes up a curious friendship with a young writer.",6.667,39,"['Drama', 'Comedy']",4.0
47610,"Illusionist, The (2006)",Drama|Fantasy|Mystery|Romance,443543,1491.0,"With his eye on a lovely aristocrat, a gifted illusionist named Eisenheim uses his powers to win her away from her betrothed, a crown prince. But Eisenheim's scheme creates tumult within the monarchy and ignites the suspicion of a dogged inspector.",7.296,5086,"['Fantasy', 'Drama', 'Thriller', 'Romance']",5.0
47629,The Queen (2006),Drama,436697,1165.0,"The Queen is an intimate behind the scenes glimpse at the interaction between HM Elizabeth II and Prime Minister Tony Blair during their struggle, following the death of Diana, to reach a compromise between what was a private tragedy for the Royal family and the public's demand for an overt display of mourning.",6.953,1364,"['Drama', 'History']",4.0
47894,"Wind That Shakes the Barley, The (2006)",Drama|War,460989,1116.0,"In 1920s Ireland young doctor Damien O'Donovan prepares to depart for a new job in a London hospital. As he says his goodbyes at a friend's farm, British Black and Tans arrive, and a young man is killed. Damien joins his brother Teddy in the Irish Republican Army, but political events are soon set in motion that tear the brothers apart.",7.351,847,"['Drama', 'War']",3.5
48142,"Black Dahlia, The (2006)",Crime|Drama|Mystery|Thriller,387877,9676.0,"In 1940s Los Angeles, two former boxers-turned-cops must grapple with corruption, narcissism, stag films and family madness as they pursue the killer of an aspiring young actress.",5.644,1155,"['Crime', 'Thriller', 'Drama']",2.0
48326,All the King's Men (2006),Drama,405676,1717.0,"The story of an idealist's rise to power in the world of Louisiana politics and the corruption that leads to his ultimate downfall. Based on the 1946 Pulitzer Prize-winning novel written by Robert Penn Warren, loosely based on the story of real-life politician Huey Long.",5.8,318,"['Drama', 'Thriller']",3.5
48516,"Departed, The (2006)",Crime|Drama|Thriller,407887,1422.0,"To take down South Boston's Irish Mafia, the police send in one of their own to infiltrate the underworld, not realizing the syndicate has done likewise. While an undercover cop curries favor with the mob kingpin, a career criminal rises through the police ranks. But both sides soon discover there's a mole among them.",8.159,15563,"['Drama', 'Thriller', 'Crime']",4.5
48560,Running With Scissors (2006),Comedy|Drama,439289,7510.0,"Young Augusten Burroughs absorbs experiences that could make for a shocking memoir: the son of an alcoholic father and an unstable mother, he's handed off to his mother's therapist, Dr. Finch, and spends his adolescent years as a member of Finch's bizarre extended family.",5.8,249,"['Drama', 'Comedy']",3.0
48696,Little Children (2006),Drama|Romance,404203,1440.0,"The lives of two lovelorn spouses from separate marriages, a registered sex offender, and a disgraced ex-police officer intersect as they struggle to resist their vulnerabilities and temptations.",7.076,1072,"['Drama', 'Romance']",4.0
48738,"Last King of Scotland, The (2006)",Drama|Thriller,455590,1523.0,"Young Scottish doctor, Nicholas Garrigan decides it's time for an adventure after he finishes his formal education, so he decides to try his luck in Uganda, and arrives during the downfall of President Obote. General Idi Amin comes to power and asks Garrigan to become his personal doctor.",7.42,2240,['Drama'],4.0
48774,Children of Men (2006),Action|Adventure|Drama|Sci-Fi|Thriller,206634,9693.0,"In 2027, in a chaotic world in which humans can no longer procreate, a former activist agrees to help transport a miraculously pregnant woman to a sanctuary at sea, where her child's birth may help scientists save the future of humankind.",7.611,7458,"['Drama', 'Action', 'Thriller', 'Science Fiction']",4.0
48780,"Prestige, The (2006)",Drama|Mystery|Sci-Fi|Thriller,482571,1124.0,"A mysterious story of two magicians whose intense rivalry leads them on a life-long battle for supremacy -- full of obsession, deceit and jealousy with dangerous and deadly consequences.",8.203,16825,"['Drama', 'Mystery', 'Science Fiction']",3.0
48783,Flags of Our Fathers (2006),Drama|War,418689,3683.0,"There were five Marines and one Navy Corpsman photographed raising the U.S. flag on Mt. Suribachi by Joe Rosenthal on February 23, 1945. This is the story of three of the six surviving servicemen - John 'Doc' Bradley, Pvt. Rene Gagnon and Pvt. Ira Hayes - who fought in the battle to take Iwo Jima from the Japanese.",6.857,1918,"['War', 'Drama', 'History']",3.5
48856,"Guide to Recognizing Your Saints, A (2006)",Crime|Drama,473488,8194.0,"Dito Montiel, a successful author, receives a call from his long-suffering mother, asking him to return home and visit his ailing father. Dito recalls his childhood growing up in a violent neighborhood in Queens, N.Y., with friends Antonio, Giuseppe, Nerf and Mike.",6.483,317,"['Crime', 'Drama']",3.5
49272,Casino Royale (2006),Action|Adventure|Thriller,381061,36557.0,"Le Chiffre, a banker to the world's terrorists, is scheduled to participate in a high-stakes poker game in Montenegro, where he intends to use his winnings to establish his financial grip on the terrorist market. M sends Bond—on his maiden mission as a 00 Agent—to attend this game and prevent Le Chiffre from winning. With the help of Vesper Lynd and Felix Leiter, Bond enters the most important poker game in his already dangerous career.",7.6,11167,"['Adventure', 'Action', 'Thriller']",3.0
49274,Happy Feet (2006),Adventure|Animation|Children|Comedy|IMAX,366548,9836.0,"Into the world of the Emperor Penguins, who find their soul mates through song, a penguin is born who cannot sing. But he can tap dance something fierce!",6.211,5277,"['Animation', 'Comedy', 'Family']",4.0
49530,Blood Diamond (2006),Action|Adventure|Crime|Drama|Thriller|War,450259,1372.0,"An ex-mercenary turned smuggler. A Mende fisherman. Amid the explosive civil war overtaking 1999 Sierra Leone, these men join for two desperate missions: recovering a rare pink diamond of immense value and rescuing the fisherman's son, conscripted as a child soldier into the brutal rebel forces ripping a swath of torture and bloodshed countrywide.",7.551,7969,"['Drama', 'Thriller', 'Action']",4.0
49772,"Painted Veil, The (2006)",Drama|Romance,446755,14202.0,"A British medical doctor fights a cholera outbreak in a small Chinese village, while also being trapped at home in a loveless marriage to an unfaithful wife.",7.257,1220,"['Romance', 'Drama']",3.5
49793,We Are Marshall (2006),Drama,758794,11170.0,"When a plane crash claims the lives of members of the Marshall University football team and some of its fans, the team's new coach and his surviving players try to keep the football program alive.",6.9,746,"['Drama', 'History']",3.5
49822,"Good Shepherd, The (2006)",Drama|Thriller,343737,1247.0,"Edward Wilson, the only witness to his father's suicide and member of the Skull and Bones Society while a student at Yale, is a morally upright young man who values honor and discretion, qualities that help him to be recruited for a career in the newly founded OSS. His dedication to his work does not come without a price though, leading him to sacrifice his ideals and eventually his family.",6.353,1214,"['Drama', 'Thriller', 'History']",3.5
49957,"History Boys, The (2006)",Comedy|Drama,464049,8618.0,"The story of an unruly class of bright, funny history students at a Yorkshire grammar school in pursuit of an undergraduate place at Oxford or Cambridge. Bounced between their maverick English master, a young and shrewd teacher hired to up their test scores, a grossly out-numbered history teacher, and a headmaster obsessed with results, the boys attempt to pass.",6.651,209,['Drama'],1.5
49961,Notes on a Scandal (2006),Drama,465551,1259.0,"A veteran high school teacher befriends a younger art teacher, who is having an affair with one of her 15-year-old students. However, her intentions with this new ""friend"" also go well beyond platonic friendship.",7.1,936,"['Drama', 'Romance']",4.0
50068,Letters from Iwo Jima (2006),Drama|War,498380,1251.0,"The story of the battle of Iwo Jima between the United States and Imperial Japan during World War II, as told from the perspective of the Japanese who fought it.",7.477,2154,"['Action', 'Drama', 'War']",4.5
50160,Miss Potter (2006),Drama,482546,13967.0,"Beatrix Potter, the author of the beloved children's book ""The Tale of Peter Rabbit"", struggles for love, happiness and success.",6.625,510,"['Drama', 'Family', 'Romance']",4.0
50274,Venus (2006),Drama|Romance,489327,13771.0,"Maurice is an aging veteran actor who becomes taken with Jessie, the grandniece of his closest friend. When Maurice tries to soften the petulant and provincial young girl with the benefit of his wisdom and London culture, their give-and-take surprises both Maurice and Jessie as they discover what they don't know about themselves.",6.647,150,"['Comedy', 'Drama', 'Romance']",2.5
50651,Kenny (2006),Comedy,822389,13140.0,"From the biggest festival to the smallest church social, Kenny Smyth delivers porta-loos to them all.  Kenny tackles every septic challenge that comes his way, culminating in a visit to the International Pumper and Cleaner Expo in Nashville Tennessee - or as Kenny affectionately calls it, ""Poo HQ"".",6.2,63,['Comedy'],2.0
50872,Ratatouille (2007),Animation|Children|Drama,382932,2062.0,"Remy, a resident of Paris, appreciates good food and has quite a sophisticated palate. He would love to become a chef so he can create and enjoy culinary masterpieces to his heart's delight. The only problem is, Remy is a rat. When he winds up in the sewer beneath one of Paris' finest restaurants, the rodent gourmet finds himself ideally placed to realize his dream.",7.832,17814,"['Animation', 'Comedy', 'Family', 'Fantasy']",3.0
51080,Breach (2007),Drama|Thriller,401997,4169.0,"Eric O'Neill, a low-level surveillance expert with the FBI, believes he is accomplishing his dream of becoming a full-fledged agent, with his unexpected promotion and assignment to clerk for Robert Hanssen, a renowned senior agent with 25 years in the FBI. However, he soon learns the reason for his promotion is to gain Hanssen's trust and find proof that he is a traitor to the country. Determined to draw the suspected double-agent out of deep cover, O'Neill finds himself in a lethal game of spy vs. spy, where nothing is as it seems.",6.613,624,"['Drama', 'Thriller', 'Crime', 'History']",4.0
51471,Amazing Grace (2006),Drama|Romance,454776,15163.0,"The true story of William Wilberforce and his courageous quest to end the British slave trade. Along the way, Wilberforce meets intense opposition, but his minister urges him to see the cause through.",6.899,306,['Drama'],4.0
51540,Zodiac (2007),Crime|Drama|Thriller,443706,1949.0,"The Zodiac murders cause the lives of Paul Avery, David Toschi and Robert Graysmith to intersect.",7.528,11056,"['Crime', 'Mystery', 'Thriller']",4.0
51662,300 (2007),Action|Fantasy|War|IMAX,416449,1271.0,"Based on Frank Miller's graphic novel, ""300"" is very loosely based the 480 B.C. Battle of Thermopylae, where the King of Sparta led his army against the advancing Persians; the battle is said to have inspired all of Greece to band together against the Persians, and helped usher in the world's first democracy.",7.191,14221,"['Action', 'Adventure', 'War']",1.0
51935,Shooter (2007),Action|Drama|Thriller,822854,7485.0,"A top Marine sniper, Bob Lee Swagger, leaves the military after a mission goes horribly awry and disappears, living in seclusion. He is coaxed back into service after a high-profile government official convinces him to help thwart a plot to kill the President of the United States. Ultimately double-crossed and framed for the attempt, Swagger becomes the target of a nationwide manhunt. He goes on the run to track the real killer and find out who exactly set him up, and why, eventually seeking revenge against some of the most powerful and corrupt leaders in the free world.",7.121,5168,"['Drama', 'Action', 'Thriller']",3.0
52042,Black Book (Zwartboek) (2006),Drama|Thriller|War,389557,9075.0,"In the Nazi-occupied Netherlands during World War II, a Jewish singer infiltrates the regional Gestapo headquarters for the Dutch resistance.",7.449,1198,"['Drama', 'Thriller', 'War']",4.5
52241,"Lookout, The (2007)",Crime|Drama|Thriller,427470,8270.0,"Chris is a once promising high school athlete whose life is turned upside down following a tragic accident. As he tries to maintain a normal life, he takes a job as a janitor at a bank, where he ultimately finds himself caught up in a planned heist.",6.666,665,"['Crime', 'Drama', 'Thriller']",4.0
52319,Inglorious Bastards (Quel maledetto treno blindato) (1978),Action|Adventure|Drama|War,76584,22311.0,"Set in Europe during WWII, a group of American soldiers on their way to military prison are beset upon by a German artillery attack, escaping with Switzerland in their sights. Before making it any farther, they volunteer to steal a V2 warhead for the French Underground - taking them deep into the heart of German territory.",6.3,243,"['Action', 'War', 'Adventure']",3.0
52375,"Hoax, The (2007)",Crime|Drama,462338,9903.0,"In what would cause a fantastic media frenzy, Clifford Irving sells his bogus biography of Howard Hughes to a premiere publishing house in the early 1970s.",6.263,219,"['Comedy', 'Drama']",3.0
53125,Pirates of the Caribbean: At World's End (2007),Action|Adventure|Comedy|Fantasy,449088,285.0,"Will Turner and Elizabeth Swann join forces with the revived Captain Barbossa to free Jack Sparrow from Davy Jones' locker. The group must navigate dangerous waters, confront many foes and, ultimately, choose sides in a battle wherein piracy itself hangs in the balance.",7.262,14938,"['Adventure', 'Fantasy', 'Action']",3.0
53550,Rescue Dawn (2006),Action|Adventure|Drama|War,462504,9952.0,A US Fighter pilot's epic struggle of survival after being shot down on a mission over Laos during the Vietnam War.,6.95,1321,"['Adventure', 'Drama', 'War']",4.0
53894,Sicko (2007),Documentary|Drama,386032,2359.0,"A documentary about the corrupt health care system in The United States who's main goal is to make profit even if it means losing people’s lives. ""The more people you deny health insurance the more money we make"" is the business model for health care providers in America.",7.362,732,"['Documentary', 'Comedy', 'Drama']",2.0
54190,Across the Universe (2007),Drama|Fantasy|Musical|Romance,445922,4688.0,"When young dockworker Jude leaves Liverpool to find his estranged father in the United States, he is swept up by the waves of change that are re-shaping the nation. Jude falls in love with Lucy, who joins the growing anti-war movement. As the body count in Vietnam rises, political tensions at home spiral out of control and the star-crossed lovers find themselves in a psychedelic world gone mad.",7.139,1387,"['Drama', 'Romance', 'Fantasy']",4.0
54286,"Bourne Ultimatum, The (2007)",Action|Crime|Thriller,440963,2503.0,"Bourne is brought out of hiding once again by reporter Simon Ross who is trying to unveil Operation Blackbriar, an upgrade to Project Treadstone, in a series of newspaper columns. Information from the reporter stirs a new set of memories, and Bourne must finally uncover his dark past while dodging The Company's best efforts to eradicate him.",7.432,7995,"['Action', 'Drama', 'Mystery', 'Thriller']",4.0
54331,You Kill Me (2007),Comedy|Crime|Thriller,796375,8141.0,"While drying out on the West Coast, an alcoholic hit man befriends a tart-tongued woman who might just come in handy when it's time for him to return to Buffalo and settle some old scores.",6.138,286,"['Comedy', 'Crime', 'Thriller', 'Romance']",4.0
54997,3:10 to Yuma (2007),Action|Crime|Drama|Western,381849,5176.0,"In Arizona in the late 1800s, infamous outlaw Ben Wade and his vicious gang of thieves and murderers have plagued the Southern Railroad. When Wade is captured, Civil War veteran Dan Evans, struggling to survive on his drought-plagued ranch, volunteers to deliver him alive to the ""3:10 to Yuma"", a train that will take the killer to trial.",7.222,3804,['Western'],4.5
55052,Atonement (2007),Drama|Romance|War,783233,4347.0,"As a 13-year-old, fledgling writer Briony Tallis irrevocably changes the course of several lives when she accuses her older sister's lover of a crime he did not commit.",7.642,4476,"['Drama', 'Romance']",4.0
55094,In the Valley of Elah (2007),Drama|Mystery,478134,6973.0,A career officer and his wife work with a police detective to uncover the truth behind their son's disappearance following his return from a tour of duty in Iraq.,6.783,1034,"['History', 'Drama', 'Thriller', 'Crime', 'Mystery']",4.0
55118,Eastern Promises (2007),Crime|Drama|Thriller,765443,2252.0,A Russian teenager living in London dies during childbirth but leaves clues in her diary that could tie her child to a rape involving a violent Russian mob family.,7.4,3517,"['Thriller', 'Crime', 'Mystery']",4.0
55247,Into the Wild (2007),Action|Adventure|Drama,758758,5915.0,"After graduating from Emory University in 1992, top student and athlete Christopher McCandless abandons his possessions, gives his entire $24,000 savings account to charity, and hitchhikes to Alaska to live in the wilderness.",7.797,9808,"['Adventure', 'Drama']",3.5
55276,Michael Clayton (2007),Drama|Thriller,465538,4566.0,"A law firm brings in its ""fixer"" to remedy the situation after a lawyer has a breakdown while representing a chemical company that he knows is guilty in a multi-billion dollar class action suit.",6.788,1842,"['Drama', 'Thriller', 'Crime']",4.5
55290,Gone Baby Gone (2007),Crime|Drama|Mystery,452623,4771.0,"When 4 year old Amanda McCready disappears from her home and the police make little headway in solving the case, the girl's aunt, Beatrice McCready hires two private detectives, Patrick Kenzie and Angie Gennaro. The detectives freely admit that they have little experience with this type of case, but the family wants them for two reasons—they're not cops and they know the tough neighborhood in which they all live.",7.304,3952,"['Crime', 'Drama', 'Mystery']",4.0
55363,"Assassination of Jesse James by the Coward Robert Ford, The (2007)",Crime|Drama|Western,443680,4512.0,"Outlaw Jesse James is rumored to be the 'fastest gun in the West'. An eager recruit into James' notorious gang, Robert Ford eventually grows jealous of the famed outlaw and, when Robert and his brother sense an opportunity to kill James, their murderous action elevates their target to near mythical status.",7.044,2627,"['Drama', 'Western']",3.0
55765,American Gangster (2007),Crime|Drama|Thriller,765429,4982.0,"Loosely based on the criminal career of Frank Lucas, a gangster from La Grange, North Carolina, who smuggled heroin into the United States on American service planes returning from the Vietnam War, before being detained by a task force led by Newark Detective Richie Roberts.",7.591,5736,"['Drama', 'Crime']",4.5
55805,Before the Devil Knows You're Dead (2007),Crime|Drama|Thriller,292963,7972.0,"When two brothers organize the robbery of their parents' jewelry store, the job goes horribly wrong, triggering a series of events that send them and their family hurtling towards a shattering climax.",7.108,1606,"['Crime', 'Drama', 'Thriller']",4.0
55820,No Country for Old Men (2007),Crime|Drama,477348,6977.0,"Llewelyn Moss stumbles upon dead bodies, $2 million and a hoard of heroin in a Texas desert, but methodical killer Anton Chigurh comes looking for it, with local sheriff Ed Tom Bell hot on his trail. The roles of prey and predator blur as the violent pursuit of money and justice collide.",7.946,12688,"['Crime', 'Thriller', 'Western']",4.5
55895,"Desperate Hours, The (1955)",Drama|Film-Noir|Thriller,47985,18612.0,Escaped convicts terrorize a suburban family they're holding hostage.,7.0,167,"['Crime', 'Thriller']",3.5
56333,"Savages, The (2007)",Comedy|Drama,775529,8272.0,A sister and brother face the realities of familial responsibility as they begin to care for their ailing father.,6.88,408,"['Drama', 'Comedy']",3.5
56367,Juno (2007),Comedy|Drama|Romance,467406,7326.0,"Faced with an unplanned pregnancy, sixteen year old high-schooler, Juno MacGuff, makes an unusual decision regarding her unborn child.",7.052,7377,"['Comedy', 'Drama', 'Romance']",3.5
56607,"Kite Runner, The (2007)",Drama,419887,7979.0,"After spending years in California, Amir returns to his homeland in Afghanistan to help his old friend Hassan, whose son is in trouble.",7.3,1198,['Drama'],4.0
56744,Longford (2006),Crime|Drama,759612,36328.0,"A portrait of Lord Longford, a tireless British campaigner whose controversial beliefs often resulted in furious political debate and personal conflict.",6.6,46,"['Crime', 'Drama', 'TV Movie']",4.0
56757,Sweeney Todd: The Demon Barber of Fleet Street (2007),Drama|Horror|Musical|Thriller,408236,13885.0,"The infamous story of Benjamin Barker, a.k.a Sweeney Todd, who sets up a barber shop down in London which is the basis for a sinister partnership with his fellow tenant, Mrs. Lovett. Based on the hit Broadway musical.",7.18,6103,"['Drama', 'Horror']",3.5
56775,National Treasure: Book of Secrets (2007),Action|Adventure,465234,6637.0,"Benjamin Franklin Gates and Abigail Chase re-team with Riley Poole and, now armed with a stack of long-lost pages from John Wilkes Booth's diary, Ben must follow a clue left there to prove his ancestor's innocence in the assassination of Abraham Lincoln.",6.367,5331,"['Action', 'Adventure', 'Mystery', 'Thriller']",2.5
56782,There Will Be Blood (2007),Drama|Western,469494,7345.0,"Ruthless silver miner, turned oil prospector, Daniel Plainview, moves to oil-rich California. Using his son to project a trustworthy, family-man image, Plainview cons local landowners into selling him their valuable properties for a pittance. However, local preacher Eli Sunday suspects Plainview's motives and intentions, starting a slow-burning feud that threatens both their lives.",8.075,6997,['Drama'],4.0
56788,Charlie Wilson's War (2007),Comedy|Drama|War,472062,6538.0,A Texas congressman sets a series of events in motion when he conspires with a CIA operative to aid Afghan mujahideen rebels fighting the Soviets.,6.535,1570,"['Comedy', 'Drama', 'History']",4.5
56885,"Great Debaters, The (2007)",Drama,427309,14047.0,The true story of a brilliant but politically radical debate team coach who uses the power of words to transform a group of underdog African-American college students into a historical powerhouse that took on the Harvard elite.,7.248,664,['Drama'],4.5
57669,In Bruges (2008),Comedy|Crime|Drama|Thriller,780536,8321.0,"Ray and Ken, two hit men, are in Bruges, Belgium, waiting for their next mission. While they are there they have time to think and discuss their previous assignment. When the mission is revealed to Ken, it is not what he expected.",7.495,5448,"['Comedy', 'Drama', 'Crime']",3.5
58103,Vantage Point (2008),Action|Drama|Thriller,443274,7461.0,"During an historic counter-terrorism summit in Spain, the President of the United States is struck down by an assassin's bullet. Eight strangers have a perfect view of the kill, but what did they really see? As the minutes leading up to the fatal shot are replayed through the eyes of each eyewitness, the reality of the assassination takes shape.",6.396,2076,"['Drama', 'Action', 'Thriller', 'Crime']",2.5
