movieId,title,genres,imdbId,tmdbId,overview,tmdb_vote_average,tmdb_vote_count,tmdb_genres,rating
8643,"Cinderella Story, A (2004)",Comedy|Romance,356470,11247.0,"Routinely exploited by her wicked stepmother, the downtrodden Samantha Montgomery is excited about the prospect of meeting her Internet beau at the school's Halloween dance.",6.581,3295,"['Comedy', 'Family', 'Romance']",0.5
8644,"I, Robot (2004)",Action|Adventure|Sci-Fi|Thriller,343818,2048.0,"In 2035, where robots are commonplace and abide by the three laws of robotics, a technophobic cop investigates an apparent suicide. Suspecting that a robot may be responsible for the death, his investigation leads him to believe that humanity may be in danger.",6.957,12219,"['Action', 'Science Fiction']",2.0
8783,"Village, The (2004)",Drama|Mystery|Thriller,368447,6947.0,"When a willful young man tries to venture beyond his sequestered Pennsylvania hamlet, his actions set off a chain of chilling incidents that will alter the community forever.",6.483,4394,"['Drama', 'Mystery', 'Thriller']",4.5
8798,Collateral (2004),Action|Crime|Drama|Thriller,369339,1538.0,Cab driver Max picks up a man who offers him $600 to drive him around. But the promise of easy money sours when Max realizes his fare is an assassin.,7.235,5934,"['Drama', 'Crime', 'Thriller']",4.0
8874,Shaun of the Dead (2004),Comedy|Horror,365748,747.0,"Shaun lives a supremely uneventful life, which revolves around his girlfriend, his mother, and, above all, his local pub. This gentle routine is threatened when the dead return to life and make strenuous attempts to snack on ordinary Londoners.",7.536,8895,"['Horror', 'Comedy']",4.0
8914,Primer (2004),Drama|Sci-Fi,390384,14337.0,"A group of fledgling inventors discover a complex method to manipulate reality. At first, they successfully game the stock market with it, but the consequences of the invention start to catch up with them.",6.764,2283,"['Science Fiction', 'Drama', 'Thriller']",4.5
8950,The Machinist (2004),Drama|Mystery|Thriller,361862,4553.0,"Trevor, an insomniac lathe operator, experiences unusual occurrences at work and home. A strange man follows him everywhere, but no one else seems to notice him.",7.524,5843,"['Thriller', 'Drama']",4.0
8961,"Incredibles, The (2004)",Action|Adventure|Animation|Children|Comedy,317705,9806.0,"Bob Parr has given up his superhero days to log in time as an insurance adjuster and raise his three children with his formerly heroic wife in suburbia. But when he receives a mysterious assignment, it's time to get back into costume.",7.718,18299,"['Action', 'Adventure', 'Animation', 'Family']",4.0
8965,"Polar Express, The (2004)",Adventure|Animation|Children|Fantasy|IMAX,338348,5255.0,"When a doubting young boy takes an extraordinary train ride to the North Pole, he embarks on a journey of self-discovery that shows him that the wonder of life never fades for those who believe.",6.721,6599,"['Animation', 'Adventure', 'Family', 'Fantasy']",4.0
8972,National Treasure (2004),Action|Adventure|Drama|Mystery|Thriller,368891,2059.0,"Modern treasure hunters, led by archaeologist Ben Gates, search for a chest of riches rumored to have been stashed away by George Washington, Thomas Jefferson and Benjamin Franklin during the Revolutionary War. The chest's whereabouts may lie in secret clues embedded in the Constitution and the Declaration of Independence, and Gates is in a race to find the gold before his enemies do.",6.643,6575,"['Adventure', 'Action', 'Thriller', 'Mystery']",3.5
8984,Ocean's Twelve (2004),Action|Comedy|Crime|Thriller,349903,163.0,"Despite pulling off one of the biggest heists in Las Vegas history and splitting the $160 million take, each of the infamous Ocean's crew have tried to go straight, lay low and live a legit life ... but that's proven to be a challenge. Casino owner Terry Benedict demands that Danny Ocean return the money, plus millions more in interest. Unable to come up the cash, the crew is forced to come together to pull off another series of heists, this time in Rome, Paris, and Amsterdam – but a Europol agent is hot on their heels.",6.564,7547,"['Thriller', 'Crime']",4.0
27266,2046 (2004),Drama|Fantasy|Romance|Sci-Fi,212712,844.0,Women enter and exit a science fiction author's life over the course of a few years after the author loses the woman he considers his one true love.,7.2,989,"['Drama', 'Science Fiction', 'Romance']",4.0
27297,Possible Worlds (2000),Crime|Drama|Mystery|Sci-Fi,222293,38987.0,"The same man lives out several parallel lives in different ""worlds"" and in different relationships at the same time.",6.4,42,"['Mystery', 'Science Fiction', 'Thriller']",5.0
27420,Teknolust (2002),Comedy|Drama|Romance|Sci-Fi,270688,81540.0,"Anxious to use artificial life to improve the world, Rosetta Stone, a bio-geneticist creates a Recipe for Cyborgs and uses her own DNA in order to breed three Self Replicating Automatons, part human, part computer named Ruby, Olive and Marine.",4.3,36,"['Comedy', 'Drama', 'Romance', 'Science Fiction']",4.0
27482,Cube 2: Hypercube (2002),Horror|Mystery|Sci-Fi,285492,437.0,"Eight strangers awaken with no memory, in a puzzling cube-shaped room where the laws of physics do not always apply.",5.493,1519,"['Thriller', 'Science Fiction', 'Mystery']",1.0
27660,"Animatrix, The (2003)",Action|Animation|Drama|Sci-Fi,328832,55931.0,"Straight from the creators of the groundbreaking Matrix trilogy, this collection of short animated films from the world's leading anime directors fuses computer graphics and Japanese anime to provide the background of the Matrix universe and the conflict between man and machines. The shorts include Final Flight of the Osiris, The Second Renaissance, Kid's Story, Program, World Record, Beyond, A Detective Story and Matriculated.",7.197,1667,"['Animation', 'Science Fiction']",4.0
27773,Old Boy (2003),Mystery|Thriller,364569,670.0,"With no clue how he came to be imprisoned, drugged and tortured for 15 years, a desperate man seeks revenge on his captors.",8.249,9247,"['Drama', 'Thriller', 'Mystery', 'Action']",3.5
27788,"Jacket, The (2005)",Drama|Mystery|Sci-Fi|Thriller,366627,9667.0,"A military veteran goes on a journey into the future, where he can foresee his death and is left with questions that could save his life and those he loves.",6.87,1582,"['Drama', 'Mystery', 'Science Fiction', 'Thriller', 'Fantasy']",4.0
27801,Ong-Bak: The Thai Warrior (Ong Bak) (2003),Action|Thriller,368909,9316.0,"When the head of a statue sacred to a village is stolen, a young martial artist goes to the big city and finds himself taking on the underworld to retrieve it.",7.131,1756,"['Action', 'Crime']",3.5
27831,Layer Cake (2004),Crime|Drama|Thriller,375912,4836.0,"When a seemingly straight-forward drug deal goes awry, XXXX has to break his die-hard rules and turn up the heat, not only to outwit the old regime and come out on top, but to save his own skin...",6.912,2226,"['Drama', 'Thriller', 'Crime']",4.0
27904,"Scanner Darkly, A (2006)",Animation|Drama|Mystery|Sci-Fi|Thriller,405296,3509.0,An undercover cop in a not-too-distant future becomes involved with a dangerous new drug and begins to lose his own identity as a result.,6.805,1842,"['Animation', 'Science Fiction', 'Thriller']",4.5
31658,Howl's Moving Castle (Hauru no ugoku shiro) (2004),Adventure|Animation|Fantasy|Romance,347149,4935.0,"Sophie, a young milliner, is turned into an elderly woman by a witch who enters her shop and curses her. She encounters a wizard named Howl and gets caught up in his resistance to fighting for the king.",8.396,10542,"['Fantasy', 'Animation', 'Adventure']",4.0
31696,Constantine (2005),Action|Fantasy|Horror|Thriller,360486,561.0,"John Constantine has literally been to Hell and back. When he teams up with a policewoman to solve the mysterious suicide of her twin sister, their investigation takes them through the world of demons and angels that exists beneath the landscape of contemporary Los Angeles.",7.114,7620,"['Fantasy', 'Action', 'Horror']",4.0
33004,"Hitchhiker's Guide to the Galaxy, The (2005)",Adventure|Comedy|Sci-Fi,371724,7453.0,"Mere seconds before the Earth is to be demolished by an alien construction crew, Arthur Dent is swept off the planet by his friend Ford Prefect, a researcher penning a new edition of ""The Hitchhiker's Guide to the Galaxy.""",6.677,4032,"['Adventure', 'Comedy', 'Science Fiction']",3.5
33794,Batman Begins (2005),Action|Crime|IMAX,372784,272.0,"Driven by tragedy, billionaire Bruce Wayne dedicates his life to uncovering and defeating the corruption that plagues his home, Gotham City.  Unable to work within the system, he instead creates a new identity, a symbol of fear for the criminal underworld - The Batman.",7.717,21817,"['Drama', 'Crime', 'Action']",4.0
34048,War of the Worlds (2005),Action|Adventure|Sci-Fi|Thriller,407304,74.0,"Ray Ferrier is a divorced dockworker and less-than-perfect father. Soon after his ex-wife and her new husband drop off his teenage son and young daughter for a rare weekend visit, a strange and powerful lightning storm touches down.",6.522,8757,"['Adventure', 'Thriller', 'Science Fiction']",4.0
34319,"Island, The (2005)",Action|Sci-Fi|Thriller,399201,1635.0,"In 2019, Lincoln Six-Echo is a resident of a seemingly ""Utopian"" but contained facility. Like all of the inhabitants of this carefully-controlled environment, Lincoln hopes to be chosen to go to The Island — reportedly the last uncontaminated location on the planet. But Lincoln soon discovers that everything about his existence is a lie.",6.685,5619,"['Action', 'Thriller', 'Science Fiction', 'Adventure']",4.0
34523,The Chumscrubber (2005),Comedy|Drama,406650,13919.0,"The Chumscrubber is a dark comedy about the lives of people who live in upper-class suburbia. It all begins when Dean Stiffle finds the body of his friend, Troy. He doesn't bother telling any of the adults because he knows they won't care. Everyone in town is too self consumed to worry about anything else than themselves. And everybody is on some form of drug just to get through their days.",6.5,202,"['Comedy', 'Drama']",4.0
36529,Lord of War (2005),Action|Crime|Drama|Thriller|War,399295,1830.0,"Yuri Orlov is a globetrotting arms dealer and, through some of the deadliest war zones, he struggles to stay one step ahead of a relentless Interpol agent, his business rivals and even some of his customers who include many of the world's most notorious dictators. Finally, he must also face his own conscience.",7.334,5048,"['Crime', 'Drama', 'Thriller']",4.0
38061,Kiss Kiss Bang Bang (2005),Comedy|Crime|Mystery|Thriller,373469,5236.0,A petty thief posing as an actor is brought to Los Angeles for an unlikely audition and finds himself in the middle of a murder investigation along with his high school dream girl and a detective who's been training him for his upcoming role...,7.163,2838,"['Comedy', 'Crime', 'Mystery', 'Thriller']",4.0
38798,In Her Shoes (2005),Comedy|Drama,388125,11931.0,"Irresponsible party girl Maggie is kicked out of her father's and stepmother's home—where she lives for free—and is taken in by her hard-working sister, Philadelphia lawyer Rose. After Maggie's disruptive ways ruin her sister's love life, Rose turns her out as well. But when their grandmother, who they never knew existed, comes into their lives, the sisters face some complicated truths about themselves and their family.",6.206,1230,"['Comedy', 'Drama', 'Romance']",0.5
39427,Stay (2005),Thriller,371257,8066.0,"Psychiatrist Sam Foster has a new patient, Henry Letham, who claims to be suicidal. In trying to diagnose him, Sam visits Henry's prior therapist and also finds Henry's mother -- even though Henry has said that he murdered both of his parents. As reality starts to contradict fact, Sam spirals into an unstable mental state. Then he finds a clue as to how and when Henry may try to kill himself, and races to try to stop him.",6.6,1414,"['Mystery', 'Thriller', 'Drama']",4.0
40148,Revolver (2005),Crime|Drama|Thriller,365686,10851.0,"Hotshot gambler Jake Green is long on bravado and seriously short of common sense. Rarely is he allowed in any casino because he's a bona fide winner and, in fact, has taken so much money over the years that he's the sole client of his accountant elder brother, Billy. Invited to a private game, Jake is in fear of losing his life.",6.347,1449,"['Drama', 'Thriller', 'Crime', 'Mystery']",4.0
40815,Harry Potter and the Goblet of Fire (2005),Adventure|Fantasy|Thriller|IMAX,330373,674.0,"When Harry Potter's name emerges from the Goblet of Fire, he becomes a competitor in a grueling battle for glory among three wizarding schools—the Triwizard Tournament. But since Harry never submitted his name for the Tournament, who did? Now Harry must confront a deadly dragon, fierce water demons and an enchanted maze only to find himself in the cruel grasp of He Who Must Not Be Named.",7.8,21464,"['Adventure', 'Fantasy']",4.5
41285,Match Point (2005),Crime|Drama|Romance,416320,116.0,"Chris, a former tennis pro, takes a job as an instructor and befriends his wealthy young student, Tom. After being introduced to his family, Chris is soon engaged to Tom's sister, Chloe. Despite the professional and financial advantages that this relationship affords him, Chris becomes obsessed with Tom's fiancee, American actress Nola.",7.357,4208,"['Drama', 'Romance', 'Thriller']",3.5
41566,"Chronicles of Narnia: The Lion, the Witch and the Wardrobe, The (2005)",Adventure|Children|Fantasy,363771,411.0,"Siblings Lucy, Edmund, Susan and Peter step through a magical wardrobe and find the land of Narnia. There, they discover a charming, once peaceful kingdom that has been plunged into eternal winter by the evil White Witch, Jadis. Aided by the wise and magnificent lion, Aslan, the children lead Narnia into a spectacular, climactic battle to be free of the Witch's glacial powers forever.",7.133,11084,"['Adventure', 'Family', 'Fantasy']",4.0
41569,King Kong (2005),Action|Adventure|Drama|Fantasy|Thriller,360717,254.0,"In 1933 New York, an overly ambitious movie producer coerces his cast and hired ship crew to travel to mysterious Skull Island, where they encounter Kong, a giant ape who is immediately smitten with the leading lady.",6.89,8193,"['Adventure', 'Drama', 'Action']",4.0
42418,"New World, The (2005)",Adventure|Drama|Romance,402399,11400.0,A drama about explorer John Smith and the clash between Native Americans and English settlers in the 17th century.,6.519,1211,"['Drama', 'History', 'Romance']",4.0
44191,V for Vendetta (2006),Action|Sci-Fi|Thriller|IMAX,434409,752.0,"In a world in which Great Britain has become a fascist state, a masked vigilante known only as “V” conducts guerrilla warfare against the oppressive British government. When V rescues a young woman from the secret police, he finds in her an ally with whom he can continue his fight to free the people of Britain.",7.9,15022,"['Action', 'Thriller', 'Science Fiction']",4.5
44193,She's the Man (2006),Comedy|Romance,454945,9655.0,"Viola Hastings is in a real jam. Complications threaten her scheme to pose as her twin brother, Sebastian, and take his place at a new boarding school. She falls in love with her handsome roommate, Duke, who loves beautiful Olivia, who has fallen for Sebastian! As if that were not enough, Viola's twin returns from London ahead of schedule but has no idea that his sister has already replaced him on campus.",6.821,3172,"['Comedy', 'Romance']",0.5
44195,Thank You for Smoking (2006),Comedy|Drama,427944,9388.0,"Nick Naylor is a charismatic spin-doctor for Big Tobacco who'll fight to protect America's right to smoke -- even if it kills him -- while still remaining a role model for his 12-year old son. When he incurs the wrath of a senator bent on snuffing out cigarettes, Nick's powers of ""filtering the truth"" will be put to the test.",7.19,2276,"['Comedy', 'Drama']",4.0
44199,Inside Man (2006),Crime|Drama|Thriller,454848,388.0,"When an armed, masked gang enter a Manhattan bank, lock the doors and take hostages, the detective assigned to effect their release enters negotiations preoccupied with corruption charges he is facing.",7.399,6064,"['Crime', 'Drama', 'Thriller']",4.0
44665,Lucky Number Slevin (2006),Crime|Drama|Mystery,425210,186.0,"Slevin is mistakenly put in the middle of a personal war between the city’s biggest criminal bosses. Under constant watch, Slevin must try not to get killed by an infamous assassin and come up with an idea of how to get out of his current dilemma.",7.48,4247,"['Drama', 'Thriller', 'Crime', 'Mystery']",4.0
44974,Hard Candy (2005),Drama|Thriller,424136,2652.0,"Hayley’s a smart, charming teenage girl. Jeff’s a handsome, smooth fashion photographer. An Internet chat, a coffee shop meet-up, an impromptu fashion shoot back at Jeff’s place. Jeff thinks it’s his lucky night. He’s in for a surprise.",6.816,2670,"['Drama', 'Thriller']",4.0
45186,Mission: Impossible III (2006),Action|Adventure|Thriller,317919,956.0,"Retired from active duty, and training recruits for the Impossible Mission Force, agent Ethan Hunt faces the toughest foe of his career: Owen Davian, an international broker of arms and information, who's as cunning as he is ruthless. Davian emerges to threaten Hunt and all that he holds dear – including the woman Hunt loves.",6.7,7286,"['Adventure', 'Action', 'Thriller']",4.0
45447,"Da Vinci Code, The (2006)",Drama|Mystery|Thriller,382625,591.0,"A murder in Paris’ Louvre Museum and cryptic clues in some of Leonardo da Vinci’s most famous paintings lead to the discovery of a religious mystery. For 2,000 years a secret society closely guards information that — should it come to light — could rock the very foundations of Christianity.",6.73,9694,"['Thriller', 'Mystery']",3.5
46976,Stranger than Fiction (2006),Comedy|Drama|Fantasy|Romance,420223,1262.0,Harold Crick is a lonely IRS agent whose mundane existence is transformed when he hears a mysterious voice narrating his life.,7.282,2393,"['Comedy', 'Drama', 'Fantasy', 'Romance']",4.0
47254,Chaos (2005),Action|Crime|Drama|Thriller,402910,5289.0,"In Seattle, detective Quentin Conners is unfairly suspended and his partner Jason York leaves the police force after a tragic shooting on Pearl Street Bridge, when the hostage and the criminal die. During a bank heist with a hostage situation, Conners is assigned in charge of the operation with the rookie Shane Dekker as his partner. The thieves, lead by Lorenz, apparently do not steal a penny from the bank. While chasing the gangsters, the police team disclose that they planted a virus in the system, stealing one billion dollars from the different accounts, using the principle of the Chaos Theory. Further, they find that Lorenz is killing his accomplices.",6.3,1093,"['Drama', 'Action', 'Crime']",3.5
47491,Adam's Apples (Adams æbler) (2005),Comedy|Drama,418455,1023.0,A neo-nazi sentenced to community service at a church clashes with the blindly devotional priest.,7.439,728,"['Drama', 'Comedy', 'Crime']",4.0
47610,"Illusionist, The (2006)",Drama|Fantasy|Mystery|Romance,443543,1491.0,"With his eye on a lovely aristocrat, a gifted illusionist named Eisenheim uses his powers to win her away from her betrothed, a crown prince. But Eisenheim's scheme creates tumult within the monarchy and ignites the suspicion of a dogged inspector.",7.296,5086,"['Fantasy', 'Drama', 'Thriller', 'Romance']",4.0
47997,Idiocracy (2006),Adventure|Comedy|Sci-Fi|Thriller,387808,7512.0,"To test its top-secret Human Hibernation Project, the Pentagon picks the most average Americans it can find - an Army private and a prostitute - and sends them to the year 2505 after a series of freak events. But when they arrive, they find a civilization so dumbed-down that they're the smartest people around.",6.351,3261,"['Comedy', 'Science Fiction', 'Adventure']",3.5
48043,"Fountain, The (2006)",Drama|Fantasy|Romance,414993,1381.0,"Spanning over one thousand years, and three parallel stories, The Fountain is a story of love, death, spirituality, and the fragility of our existence in this world.",6.907,2932,"['Drama', 'Adventure', 'Science Fiction', 'Romance']",4.5
48394,"Pan's Labyrinth (Laberinto del fauno, El) (2006)",Drama|Fantasy|Thriller,457430,1417.0,"In post–civil war Spain, 10-year-old Ofelia moves with her pregnant mother to live under the control of her cruel stepfather. Drawn into a mysterious labyrinth, she meets a faun who reveals that she may be a lost princess from an underground kingdom. To return to her true father, she must complete a series of surreal and perilous tasks that blur the line between reality and fantasy.",7.756,11003,"['Fantasy', 'Drama', 'War']",4.0
48516,"Departed, The (2006)",Crime|Drama|Thriller,407887,1422.0,"To take down South Boston's Irish Mafia, the police send in one of their own to infiltrate the underworld, not realizing the syndicate has done likewise. While an undercover cop curries favor with the mob kingpin, a career criminal rises through the police ranks. But both sides soon discover there's a mole among them.",8.159,15563,"['Drama', 'Thriller', 'Crime']",4.0
48774,Children of Men (2006),Action|Adventure|Drama|Sci-Fi|Thriller,206634,9693.0,"In 2027, in a chaotic world in which humans can no longer procreate, a former activist agrees to help transport a miraculously pregnant woman to a sanctuary at sea, where her child's birth may help scientists save the future of humankind.",7.611,7458,"['Drama', 'Action', 'Thriller', 'Science Fiction']",4.0
48780,"Prestige, The (2006)",Drama|Mystery|Sci-Fi|Thriller,482571,1124.0,"A mysterious story of two magicians whose intense rivalry leads them on a life-long battle for supremacy -- full of obsession, deceit and jealousy with dangerous and deadly consequences.",8.203,16825,"['Drama', 'Mystery', 'Science Fiction']",5.0
48997,Perfume: The Story of a Murderer (2006),Crime|Drama|Thriller,396171,1427.0,"Jean-Baptiste Grenouille, born in the stench of 18th century Paris, develops a superior olfactory sense, which he uses to create the world's finest perfumes. However, his work takes a dark turn as he tries to preserve scents in the search for the ultimate perfume.",7.369,4771,"['Crime', 'Fantasy', 'Drama']",4.5
49278,Déjà Vu (Deja Vu) (2006),Action|Sci-Fi|Thriller,453467,7551.0,"Called in to recover evidence in the aftermath of a horrific explosion on a New Orleans ferry, Federal agent Doug Carlin gets pulled away from the scene and taken to a top-secret government lab that uses a time-shifting surveillance device to help prevent crime.",6.87,5046,"['Action', 'Thriller', 'Science Fiction']",4.0
50872,Ratatouille (2007),Animation|Children|Drama,382932,2062.0,"Remy, a resident of Paris, appreciates good food and has quite a sophisticated palate. He would love to become a chef so he can create and enjoy culinary masterpieces to his heart's delight. The only problem is, Remy is a rat. When he winds up in the sewer beneath one of Paris' finest restaurants, the rodent gourmet finds himself ideally placed to realize his dream.",7.832,17814,"['Animation', 'Comedy', 'Family', 'Fantasy']",4.0
51255,Hot Fuzz (2007),Action|Comedy|Crime|Mystery,425112,4638.0,"Former London constable Nicholas Angel finds it difficult to adapt to his new assignment in the sleepy British village of Sandford. Not only does he miss the excitement of the big city, but he also has a well-meaning oaf for a partner. However, when a series of grisly accidents rocks Sandford, Angel smells something rotten in the idyllic village.",7.562,7935,"['Crime', 'Action', 'Comedy']",4.0
51540,Zodiac (2007),Crime|Drama|Thriller,443706,1949.0,"The Zodiac murders cause the lives of Paul Avery, David Toschi and Robert Graysmith to intersect.",7.528,11056,"['Crime', 'Mystery', 'Thriller']",5.0
51662,300 (2007),Action|Fantasy|War|IMAX,416449,1271.0,"Based on Frank Miller's graphic novel, ""300"" is very loosely based the 480 B.C. Battle of Thermopylae, where the King of Sparta led his army against the advancing Persians; the battle is said to have inspired all of Greece to band together against the Persians, and helped usher in the world's first democracy.",7.191,14221,"['Action', 'Adventure', 'War']",3.5
51935,Shooter (2007),Action|Drama|Thriller,822854,7485.0,"A top Marine sniper, Bob Lee Swagger, leaves the military after a mission goes horribly awry and disappears, living in seclusion. He is coaxed back into service after a high-profile government official convinces him to help thwart a plot to kill the President of the United States. Ultimately double-crossed and framed for the attempt, Swagger becomes the target of a nationwide manhunt. He goes on the run to track the real killer and find out who exactly set him up, and why, eventually seeking revenge against some of the most powerful and corrupt leaders in the free world.",7.121,5168,"['Drama', 'Action', 'Thriller']",4.0
52287,Meet the Robinsons (2007),Action|Adventure|Animation|Children|Comedy|Sci-Fi,396555,1267.0,"Lewis, a brilliant young inventor, is keen on creating a time machine to find his mother, who abandoned him in an orphanage. Things take a turn when he meets Wilbur Robinson and his family.",6.927,3004,"['Animation', 'Comedy', 'Family']",4.0
52328,Sunshine (2007),Adventure|Drama|Sci-Fi|Thriller,448134,1272.0,"Fifty years into the future, the sun is dying, and Earth is threatened by arctic temperatures. A team of astronauts is sent to revive the Sun — but the mission fails. Seven years later, a new team is sent to finish the mission as mankind’s last hope.",7.0,4004,"['Science Fiction', 'Thriller']",4.0
52885,Paprika (Papurika) (2006),Animation|Mystery|Sci-Fi,851578,4977.0,"When a machine that allows therapists to enter their patient's dreams is stolen, all hell breaks loose. Only a young female therapist can stop it and recover it before damage is done: Paprika.",7.82,2660,"['Animation', 'Science Fiction', 'Thriller']",4.0
