movieId,title,genres,imdbId,tmdbId,overview,tmdb_vote_average,tmdb_vote_count,tmdb_genres,rating
1884,Fear and Loathing in Las Vegas (1998),Adventure|Comedy|Drama,120669,1878.0,"Raoul Duke and his attorney Dr. Gonzo drive a red convertible across the Mojave desert to Las Vegas with a suitcase full of drugs to cover a motorcycle race. As their consumption of drugs increases at an alarming rate, the stoned duo trash their hotel room and fear legal repercussions. Duke begins to drive back to L.A., but after an odd run-in with a cop, he returns to Sin City and continues his wild drug binge.",7.211,4799,"['Adventure', 'Drama', 'Comedy']",4.0
1892,"Perfect Murder, A (1998)",Thriller,120787,1965.0,"Millionaire industrialist Steven Taylor is a man who has everything but what he craves most: the love and fidelity of his wife. A hugely successful player in the New York financial world, he considers her to be his most treasured acquisition. But she needs more than simply the role of dazzling accessory.",6.543,1469,"['Crime', 'Thriller', 'Drama']",2.5
1894,Six Days Seven Nights (1998),Adventure|Comedy|Romance,120828,6068.0,"In the South Pacific island of Makatea, career-driven magazine editor Robin Monroe is on a week-long vacation getaway with her boyfriend, Frank Martin. An emergency work assignment in neighboring Tahiti requires Robin to hire the cantankerous pilot Quinn Harris who had flown them to Makatea on a small transport plane. While flying, a powerful storm forces Quinn to make an emergency landing on a nearby deserted island. The dissimilar pair avoid each other at first, until they're forced to team up to escape from the island -- and some pirates who want their heads.",6.088,1535,"['Comedy', 'Action', 'Adventure', 'Romance']",3.0
1895,Can't Hardly Wait (1998),Comedy|Drama|Romance,127723,15037.0,"It's graduation day at Huntington Hills High, and you know what that means - time to party. And not just any party, either. This one will be a night to remember, as the nerds become studs, the jocks are humiliated, and freshman crushes blossom into grown-up romance.",6.2,557,"['Comedy', 'Romance']",3.0
1907,Mulan (1998),Adventure|Animation|Children|Comedy|Drama|Musical|Romance,120762,10674.0,"To save her father from certain death in the army, a young woman secretly enlists in his place and becomes one of China's greatest heroines in the process.",7.9,10105,"['Animation', 'Family', 'Adventure']",3.5
1911,Dr. Dolittle (1998),Comedy,118998,3050.0,"A successful physician and devoted family man, John Dolittle seems to have the world by the tail, until a long suppressed talent he possessed as a child, the ability to communicate with animals is suddenly reawakened with a vengeance! Now every creature within squawking distance wants the good doctor's advice, unleashing an outrageous chain of events that turns his world upside down!",5.709,3158,"['Comedy', 'Family', 'Fantasy']",3.5
1916,Buffalo '66 (a.k.a. Buffalo 66) (1998),Drama|Romance,118789,9464.0,"Billy is released after five years in prison. In the next moment, he kidnaps teenage student Layla and visits his parents with her, pretending she is his girlfriend and they will soon marry.",7.127,987,"['Drama', 'Romance', 'Comedy']",3.0
1917,Armageddon (1998),Action|Romance|Sci-Fi|Thriller,120591,95.0,"When an asteroid threatens to collide with Earth, NASA honcho Dan Truman determines the only way to stop it is to drill into its surface and detonate a nuclear bomb. This leads him to renowned driller Harry Stamper, who agrees to helm the dangerous space mission provided he can bring along his own hotshot crew. Among them is the cocksure A.J. who Harry thinks isn't good enough for his daughter, until the mission proves otherwise.",6.835,8260,"['Action', 'Thriller', 'Science Fiction', 'Adventure']",3.5
1918,Lethal Weapon 4 (1998),Action|Comedy|Crime|Thriller,122151,944.0,"With personal crises and age weighing in on them, Riggs and Murtaugh must contend with deadly Chinese triads trying to free their former leaders from prison and onto American soil.",6.598,2786,"['Action', 'Adventure', 'Comedy', 'Crime', 'Thriller']",3.5
1920,Small Soldiers (1998),Animation|Children|Fantasy|War,122718,11551.0,"When missile technology is used to enhance toy action figures, the toys soon begin to take their battle programming too seriously.",6.549,2221,"['Comedy', 'Adventure', 'Fantasy', 'Science Fiction', 'Action']",2.5
1921,Pi (1998),Drama|Sci-Fi|Thriller,138704,473.0,"A mathematical genius discovers a link between numbers and reality, and thus believes he can predict the future.",7.11,2351,"['Mystery', 'Drama', 'Thriller']",4.0
1923,There's Something About Mary (1998),Comedy|Romance,129387,544.0,"For Ted, prom night went about as bad as it’s possible for any night to go. Thirteen years later, he finally gets another chance with his old prom date, only to run up against other suitors including the sleazy detective he hired to find her.",6.618,5104,"['Romance', 'Comedy']",3.5
1951,Oliver! (1968),Drama|Musical,63385,17917.0,"Musical adaptation of Charles Dickens' Oliver Twist, a classic tale of an orphan who runs away from the workhouse and joins up with a group of boys headed by the Artful Dodger and trained to be pickpockets by master thief Fagin.",7.033,452,"['Drama', 'Family']",4.5
1952,Midnight Cowboy (1969),Drama,64665,3116.0,"Joe Buck is a wide-eyed hustler from Texas hoping to score big with wealthy New York City women; he finds a companion in Enrico ""Ratso"" Rizzo, an ailing swindler with a bum leg and a quixotic fantasy of escaping to Florida.",7.508,1514,['Drama'],3.0
1954,Rocky (1976),Drama,75148,1366.0,"Rocky Balboa is a Philadelphia club fighter who seems to be going nowhere. But when a stroke of fate puts him in the ring with a world heavyweight champion, Rocky knows that it's his one shot at the big time — a once-in-a-lifetime opportunity to go the distance and come out a winner!",7.79,8246,['Drama'],5.0
1955,Kramer vs. Kramer (1979),Drama,79417,12102.0,"Ted Kramer is a career man for whom his work comes before his family. His wife Joanna cannot take this anymore, so she decides to leave him. Ted is now faced with the tasks of housekeeping and taking care of himself and their young son Billy.",7.573,2325,['Drama'],3.0
1957,Chariots of Fire (1981),Drama,82158,9443.0,"In the class-obsessed and religiously divided UK of the early 1920s, two determined young runners train for the 1924 Paris Olympics. Eric Liddell, a devout Christian born to Scottish missionaries in China, sees running as part of his worship of God's glory and refuses to train or compete on the Sabbath. Harold Abrahams overcomes anti-Semitism and class bias, but neglects his beloved sweetheart in his single-minded quest.",6.789,974,"['Drama', 'History']",3.5
1960,"Last Emperor, The (1987)",Drama,93389,746.0,"A dramatic history of Pu Yi, the last of the Emperors of China, from his lofty birth and brief reign in the Forbidden City, the object of worship by half a billion people; through his abdication, his decline and dissolute lifestyle; his exploitation by the invading Japanese, and finally to his obscure existence as just another peasant worker in the People's Republic.",7.591,1799,"['Drama', 'History']",4.5
1961,Rain Man (1988),Drama,95953,380.0,"When car dealer Charlie Babbitt learns that his estranged father has died, he returns home to Cincinnati, where he discovers that he has a savant older brother named Raymond and that his father's $3 million fortune is being left to the mental institution in which Raymond lives. Motivated by his father's money, Charlie checks Raymond out of the facility in order to return with him to Los Angeles. The brothers' cross-country trip ends up changing both their lives.",7.75,6705,['Drama'],4.5
1962,Driving Miss Daisy (1989),Drama,97239,403.0,"The story of an old Jewish widow named Daisy Werthan and her relationship with her black chauffeur, Hoke. From an initial mere work relationship grew in 25 years a strong friendship between the two very different characters, in a time when those types of relationships were shunned.",7.2,1667,['Drama'],4.0
1967,Labyrinth (1986),Adventure|Fantasy|Musical,91369,13597.0,"When Sarah is forced to babysit her half-brother Toby, she inadvertently summons the Goblin King who whisks Toby away to his castle at the center of a labyrinth. Sarah enters into a bargain with the Goblin King where she is given just thirteen hours to solve the labyrinth and rescue Toby, or else lose him forever.",7.3,2576,"['Adventure', 'Family', 'Fantasy']",3.5
1968,"Breakfast Club, The (1985)",Comedy|Drama,88847,2108.0,"Five high school students from different walks of life endure a Saturday detention under a power-hungry principal. The disparate group includes rebel John, princess Claire, outcast Allison, brainy Brian and Andrew, the jock. Each has a chance to tell his or her story, making the others see them a little differently -- and when the day ends, they question whether school will ever be the same.",7.729,8258,"['Comedy', 'Drama']",4.0
1974,Friday the 13th (1980),Horror|Mystery|Thriller,80761,4488.0,Camp counselors are stalked and murdered by an unknown assailant while trying to reopen a summer camp that was the site of a child's drowning.,6.4,3139,['Horror'],3.0
1981,Friday the 13th Part VIII: Jason Takes Manhattan (1989),Horror,97388,10283.0,"Jason ships out aboard a teen-filled ""love boat"" bound for New York, which he soon transforms into the ultimate voyage of the damned.",4.954,1140,"['Horror', 'Thriller']",1.5
1982,Halloween (1978),Horror,77651,948.0,"Fifteen years after murdering his sister on Halloween Night 1963, Michael Myers escapes from a mental hospital and returns to the small town of Haddonfield, Illinois to kill again.",7.562,5892,"['Horror', 'Thriller']",3.0
1991,Child's Play (1988),Horror|Thriller,94862,10585.0,An innocent-looking doll is inhabited by the soul of a serial killer who refuses to die.,6.725,3153,['Horror'],3.0
1994,Poltergeist (1982),Horror|Thriller,84516,609.0,"Upon realizing that something truly evil haunts his home, Steve Freeling calls in a team of parapsychologists to help before it's too late.",7.2,3158,['Horror'],3.5
1997,"Exorcist, The (1973)",Horror|Mystery,70047,9552.0,"When a charming 12-year-old girl takes on the characteristics and voices of others, doctors say there is nothing they can do. As people begin to die, the girl's mother realizes her daughter has been possessed by the Devil. Her daughter's only possible hope lies with two priests and the ancient rite of demonic exorcism.",7.737,8296,['Horror'],4.0
2000,Lethal Weapon (1987),Action|Comedy|Crime|Drama,93409,941.0,A veteran cop and an unstable detective become partners who must put their differences aside in order to bring down a heroin-smuggling ring run by ex-Special Forces.,7.285,4783,"['Adventure', 'Action', 'Comedy', 'Thriller', 'Crime']",4.5
2001,Lethal Weapon 2 (1989),Action|Comedy|Crime|Drama,97733,942.0,Riggs and Murtaugh are on the trail of South African diplomats using their immunity to engage in criminal activities.,7.023,3564,"['Action', 'Adventure', 'Comedy', 'Crime', 'Thriller']",4.0
2002,Lethal Weapon 3 (1992),Action|Comedy|Crime|Drama,104714,943.0,Riggs and Murtaugh pursue a former officer who uses his knowledge of police procedure and policies to steal and sell confiscated guns and ammunition to local street gangs.,6.703,3061,"['Action', 'Comedy', 'Thriller', 'Crime']",3.5
2003,Gremlins (1984),Comedy|Horror,87363,927.0,"After receiving an exotic small animal as a Christmas gift, a young man inadvertently breaks three important rules concerning his new pet, which unleashes a horde of malevolently mischievous creatures on a small town.",7.137,6669,"['Fantasy', 'Horror', 'Comedy']",4.5
2005,"Goonies, The (1985)",Action|Adventure|Children|Comedy|Fantasy,89218,9340.0,Young teen Mikey Walsh and his friends set off on a quest to find Pirate One-Eyed Willie's treasure in hopes of saving their homes from demolition.,7.514,5948,"['Adventure', 'Comedy', 'Family']",3.5
2006,"Mask of Zorro, The (1998)",Action|Comedy|Romance,120746,9342.0,"It has been twenty years since Don Diego de la Vega fought Spanish oppression in Alta California as the legendary romantic hero, Zorro. Having escaped from prison he transforms troubled bandit Alejandro into his successor, in order to foil the plans of the tyrannical Don Rafael Montero who robbed him of his freedom, his wife and his precious daughter.",6.576,4154,"['Action', 'Adventure']",3.5
2010,Metropolis (1927),Drama|Sci-Fi,17136,19.0,"In a futuristic city sharply divided between the rich and the poor, the son of the city's mastermind meets a prophet who predicts the coming of a savior to mediate their differences.",8.1,2937,"['Drama', 'Science Fiction']",4.5
2011,Back to the Future Part II (1989),Adventure|Comedy|Sci-Fi,96874,165.0,"Marty and Doc are at it again as the time-traveling duo head to 2015 to nip some McFly family woes in the bud. But things go awry thanks to bully Biff Tannen and a pesky sports almanac. In a last-ditch attempt to set things straight, Marty finds himself bound for 1955 and face to face with his teenage parents -- again.",7.772,13378,"['Adventure', 'Comedy', 'Science Fiction']",4.0
2012,Back to the Future Part III (1990),Adventure|Comedy|Sci-Fi|Western,99088,196.0,"The final installment finds Marty digging the trusty DeLorean out of a mineshaft and looking for Doc in the Wild West of 1885. But when their time machine breaks down, the travelers are stranded in a land of spurs. More problems arise when Doc falls for pretty schoolteacher Clara Clayton, and Marty tangles with Buford Tannen.",7.488,11060,"['Adventure', 'Comedy', 'Science Fiction']",4.0
2018,Bambi (1942),Animation|Children|Drama,34492,3170.0,"Bambi's tale unfolds from season to season as the young prince of the forest learns about life, love, and friends.",7.011,5848,"['Animation', 'Drama', 'Family']",4.5
2019,Seven Samurai (Shichinin no samurai) (1954),Action|Adventure|Drama,47478,346.0,"A samurai answers a village's request for protection after he falls on hard times. The town needs protection from bandits, so the samurai gathers six others to help him teach the people how to defend themselves, and the villagers provide the soldiers with food.",8.452,3989,"['Action', 'Drama']",4.0
2021,Dune (1984),Adventure|Sci-Fi,87182,841.0,"In the year 10,191, the most precious substance in the universe is the spice Melange. The spice extends life. The spice expands consciousness. The spice is vital to space travel.  The spice exists on only one planet in the entire universe, the vast desert planet Arrakis, also known as Dune.  Its native inhabitants, the Fremen, have long held a prophecy that a man would come, a messiah who would lead them to true freedom.",6.171,3247,"['Action', 'Science Fiction', 'Adventure']",4.0
2023,"Godfather: Part III, The (1990)",Crime|Drama|Mystery|Thriller,99674,242.0,"In the midst of trying to legitimize his business dealings in 1979 New York and Italy, aging mafia don, Michael Corleone seeks forgiveness for his sins while taking a young protege under his wing.",7.417,6524,"['Crime', 'Drama', 'Thriller']",3.5
2028,Saving Private Ryan (1998),Action|Drama|War,120815,857.0,"As U.S. troops storm the beaches of Normandy, three brothers lie dead on the battlefield, with a fourth trapped behind enemy lines. Ranger captain John Miller and seven men are tasked with penetrating German-held territory and bringing the boy home.",8.22,16540,"['Drama', 'History', 'War']",4.0
2046,Flight of the Navigator (1986),Adventure|Children|Sci-Fi,91059,10122.0,"12-year-old David is accidentally knocked out in the forest near his home, but when he awakens eight years have passed. His family is overjoyed to have him back, but is just as perplexed as he is that he hasn't aged. When a NASA scientist discovers a UFO nearby, David gets the chance to unravel the mystery and recover the life he lost.",6.944,888,"['Family', 'Science Fiction', 'Adventure']",4.0
2050,Herbie Goes Bananas (1980),Adventure|Children|Comedy,80861,12129.0,The adorable little VW helps its owners break up a counterfeiting ring in Mexico.,5.337,239,"['Fantasy', 'Comedy', 'Family', 'Adventure']",3.0
2054,"Honey, I Shrunk the Kids (1989)",Adventure|Children|Comedy|Fantasy|Sci-Fi,97523,9354.0,The scientist father of a teenage girl and boy accidentally shrinks his and two other neighborhood teens to the size of insects. Now the teens must fight diminutive dangers as the father searches for them.,6.303,3177,"['Adventure', 'Comedy', 'Family', 'Science Fiction']",4.0
2058,"Negotiator, The (1998)",Action|Crime|Drama|Mystery|Thriller,120768,9631.0,"The police try to arrest expert hostage negotiator Danny Roman, who insists he's being framed for his partner's murder in what he believes is an elaborate conspiracy. Thinking there's evidence in the Internal Affairs offices that might clear him, he takes everyone in the office hostage and demands that another well-known negotiator be brought in to handle the situation and secretly investigate the conspiracy.",7.103,2229,"['Action', 'Crime', 'Drama', 'Thriller']",3.0
2059,"Parent Trap, The (1998)",Children|Comedy|Romance,120783,9820.0,"Hallie Parker and Annie James are identical twins who were separated at a young age due to their parents' divorce. Unbeknownst to their parents, the girls are sent to the same summer camp, where they meet, discover the truth about their relationship, and come up with a plan to switch places in an effort to reunite their mother and father.",7.219,4356,"['Comedy', 'Family', 'Romance']",3.5
2060,BASEketball (1998),Comedy,131857,14013.0,"Two losers from Milwaukee, Coop and Remer, invent a new game combining basketball with the rules of baseball. When the game becomes a huge success, they, along with a billionaire's help, form the Professional Baseketball League where everyone gets the same pay and no team can change cities. When a rival owner wants to institute major rule changes, Coop and Remer's team is the only one standing in the way.",6.124,610,['Comedy'],2.0
2064,Roger & Me (1989),Documentary,98213,1779.0,"A documentary about the closure of General Motors' plant at Flint, Michigan, which resulted in the loss of 30,000 jobs. Details the attempts of filmmaker Michael Moore to get an interview with GM CEO Roger Smith.",7.1,306,"['Documentary', 'History', 'Comedy']",4.0
2072,"'burbs, The (1989)",Comedy,96734,11974.0,"When secretive new neighbors move in next door, suburbanite Ray Peterson and his friends let their paranoia get the best of them as they start to suspect the newcomers of evildoings and commence an investigation. But it's hardly how Ray, who much prefers drinking beer, reading his newspaper and watching a ball game on the tube expected to spend his vacation.",6.763,1291,"['Comedy', 'Horror', 'Thriller']",3.5
2078,"Jungle Book, The (1967)",Animation|Children|Comedy|Musical,61852,9325.0,"The boy Mowgli makes his way to the man-village with Bagheera, the wise panther. Along the way he meets jazzy King Louie, the hypnotic snake Kaa and the lovable, happy-go-lucky bear Baloo, who teaches Mowgli ""The Bare Necessities"" of life and the true meaning of friendship.",7.278,6458,"['Family', 'Animation', 'Adventure']",4.5
2080,Lady and the Tramp (1955),Animation|Children|Comedy|Romance,48280,10340.0,"Lady, a golden cocker spaniel, meets up with a mongrel dog who calls himself the Tramp. He is obviously from the wrong side of town, but happenings at Lady's home make her decide to travel with him for a while.",7.122,5463,"['Family', 'Animation', 'Romance']",4.5
2081,"Little Mermaid, The (1989)",Animation|Children|Comedy|Musical|Romance,97757,10144.0,This colorful adventure tells the story of an impetuous mermaid princess named Ariel who falls in love with the very human Prince Eric and puts everything on the line for the chance to be with him. Memorable songs and characters -- including the villainous sea witch Ursula.,7.348,8164,"['Animation', 'Family', 'Fantasy']",4.0
2083,"Muppet Christmas Carol, The (1992)",Children|Comedy|Musical,104940,10437.0,"A retelling of the classic Dickens tale of Ebenezer Scrooge, miser extraordinaire. He is held accountable for his dastardly ways during night-time visitations by the Ghosts of Christmas Past, Present and Future.",7.4,1072,"['Music', 'Comedy', 'Family', 'Fantasy', 'Drama']",4.0
2085,101 Dalmatians (One Hundred and One Dalmatians) (1961),Adventure|Animation|Children,55254,12230.0,"When a litter of dalmatian puppies are abducted by the minions of Cruella De Vil, the parents must find them before she uses them for a diabolical fashion statement.",7.173,6466,"['Adventure', 'Animation', 'Comedy', 'Family']",4.0
2087,Peter Pan (1953),Animation|Children|Fantasy|Musical,46183,10693.0,"Leaving the safety of their nursery behind, Wendy, Michael and John follow Peter Pan to a magical world where childhood lasts forever. But while in Neverland, the kids must face Captain Hook and foil his attempts to get rid of Peter for good.",7.197,5562,"['Animation', 'Family', 'Adventure', 'Fantasy']",4.0
2088,Popeye (1980),Adventure|Comedy|Musical,81353,11335.0,"Popeye is a super-strong, spinach-scarfing sailor man who's searching for his father. During a storm that wrecks his ship, Popeye washes ashore and winds up rooming at the Oyl household, where he meets Olive. Before he can win her heart, he must first contend with Olive's fiancé, Bluto.",5.509,656,"['Action', 'Adventure', 'Comedy', 'Family']",3.0
2090,"Rescuers, The (1977)",Adventure|Animation|Children|Crime|Drama,76618,11319.0,Two agents of the mouse-run International Rescue Aid Society search for a little orphan girl kidnapped by sinister treasure hunters.,6.781,2594,"['Fantasy', 'Family', 'Animation', 'Adventure']",4.0
2094,"Rocketeer, The (1991)",Action|Adventure|Sci-Fi,102803,10249.0,"A stunt pilot comes across a prototype jetpack that gives him the ability to fly. However, evil forces of the world also want this jetpack at any cost.",6.473,985,"['Action', 'Adventure', 'Science Fiction', 'Family']",4.0
2096,Sleeping Beauty (1959),Animation|Children|Musical,53285,10882.0,"Cursed to die by the evil fairy Maleficent when she was a baby, Princess Aurora is sent into hiding under protection from three good fairies. As she grows up far away, Maleficent becomes increasingly determined to seal the princess's fate.",6.944,5320,"['Fantasy', 'Animation', 'Romance', 'Family']",4.5
2099,Song of the South (1946),Adventure|Animation|Children|Musical,38969,13850.0,Uncle Remus draws upon his tales of Br'er Rabbit to help little Johnny deal with his confusion over his parents' separation as well as his new life on the plantation.,6.5,288,"['Family', 'Animation']",3.0
2100,Splash (1984),Comedy|Fantasy|Romance,88161,2619.0,"A successful businessman falls in love with the girl of his dreams. There's one big complication though; he's fallen hook, line and sinker for a mermaid.",6.263,1415,"['Comedy', 'Romance', 'Fantasy']",4.0
2102,Steamboat Willie (1928),Animation|Children|Comedy|Musical,19422,53565.0,"Mickey Mouse, piloting a steamboat, delights his passenger, Minnie Mouse, by making musical instruments out of the menagerie on deck.",7.29,575,"['Animation', 'Comedy']",3.5
2105,Tron (1982),Action|Adventure|Sci-Fi,84827,97.0,"When brilliant video game maker Flynn hacks the mainframe of his ex-employer, he is beamed inside an astonishing digital world...And becomes part of the very game he is designing. In his mission through cyberspace, Flynn matches wits with a maniacal Master Control Program and teams up with Tron, a security measure created to bring balance to the digital environment.",6.6,2456,"['Science Fiction', 'Action', 'Adventure']",4.0
2107,Halloween H20: 20 Years Later (Halloween 7: The Revenge of Laurie Strode) (1998),Horror|Thriller,120694,11675.0,"Two decades after surviving a massacre on October 31, 1978, former baby sitter Laurie Strode finds herself hunted by persistent knife-wielder Michael Myers. Laurie now lives in Northern California under an assumed name, where she works as the headmistress of a private school. But it's not far enough to escape Myers, who soon discovers her whereabouts. As Halloween descends upon Laurie's peaceful community, a feeling of dread weighs upon her -- with good reason.",6.048,1719,"['Horror', 'Thriller']",2.0
2108,L.A. Story (1991),Comedy|Romance,102250,2107.0,"With the help of a talking freeway billboard, a ""wacky weatherman"" tries to win the heart of an English newspaper reporter, who is struggling to make sense of the strange world of early-90s Los Angeles.",6.5,358,"['Comedy', 'Fantasy', 'Romance']",4.0
2109,"Jerk, The (1979)",Comedy,79367,6471.0,"After discovering he's not really black like the rest of his family, likable dimwit Navin Johnson sets off on a hilarious misadventure that takes him from rags to riches and back again. The slaphappy jerk strikes it rich, but life in the fast lane isn't all it's cracked up to be and, in the end, all that really matters to Johnson is his true love.",6.906,850,['Comedy'],3.5
2115,Indiana Jones and the Temple of Doom (1984),Action|Adventure|Fantasy,87469,87.0,"After arriving in India, Indiana Jones is asked by a desperate village to find a mystical stone. He agrees – and stumbles upon a secret cult plotting a terrible plan in the catacombs of an ancient palace.",7.302,9714,"['Adventure', 'Action']",4.0
2124,"Addams Family, The (1991)",Children|Comedy|Fantasy,101272,2907.0,"When a man claiming to be long-lost Uncle Fester reappears after 25 years lost, the family plans a celebration to wake the dead. But the kids barely have time to warm up the electric chair before Morticia begins to suspect Fester is fraud when he can't recall any of the details of Fester's life.",7.067,4820,"['Comedy', 'Fantasy']",3.5
