movieId,title,genres,imdbId,tmdbId,overview,tmdb_vote_average,tmdb_vote_count,tmdb_genres,rating
33794,Batman Begins (2005),Action|Crime|IMAX,372784,272.0,"Driven by tragedy, billionaire Bruce Wayne dedicates his life to uncovering and defeating the corruption that plagues his home, Gotham City.  Unable to work within the system, he instead creates a new identity, a symbol of fear for the criminal underworld - The Batman.",7.717,21817,"['Drama', 'Crime', 'Action']",4.0
34405,Serenity (2005),Action|Adventure|Sci-Fi,379786,16320.0,"When the renegade crew of Serenity agrees to hide a fugitive on their ship, they find themselves in an action-packed battle between the relentless military might of a totalitarian regime who will destroy anything – or anyone – to get the girl back and the bloodthirsty creatures who roam the uncharted areas of space. But... the greatest danger of all may be on their ship.",7.363,3681,"['Science Fiction', 'Action', 'Adventure', 'Thriller']",4.5
35836,"40-Year-Old Virgin, The (2005)",Comedy|Romance,405422,6957.0,"Andy Stitzer has a pleasant life with a nice apartment and a job stamping invoices at an electronics store. But at age 40, there's one thing Andy hasn't done, and it's really bothering his sex-obsessed male co-workers: Andy is still a virgin. Determined to help Andy get laid, the guys make it their mission to de-virginize him. But it all seems hopeless until Andy meets small business owner Trish, a single mom.",6.4,6946,"['Comedy', 'Romance']",4.5
38061,Kiss Kiss Bang Bang (2005),Comedy|Crime|Mystery|Thriller,373469,5236.0,A petty thief posing as an actor is brought to Los Angeles for an unlikely audition and finds himself in the middle of a murder investigation along with his high school dream girl and a detective who's been training him for his upcoming role...,7.163,2838,"['Comedy', 'Crime', 'Mystery', 'Thriller']",5.0
40815,Harry Potter and the Goblet of Fire (2005),Adventure|Fantasy|Thriller|IMAX,330373,674.0,"When Harry Potter's name emerges from the Goblet of Fire, he becomes a competitor in a grueling battle for glory among three wizarding schools—the Triwizard Tournament. But since Harry never submitted his name for the Tournament, who did? Now Harry must confront a deadly dragon, fierce water demons and an enchanted maze only to find himself in the cruel grasp of He Who Must Not Be Named.",7.8,21464,"['Adventure', 'Fantasy']",3.5
44191,V for Vendetta (2006),Action|Sci-Fi|Thriller|IMAX,434409,752.0,"In a world in which Great Britain has become a fascist state, a masked vigilante known only as “V” conducts guerrilla warfare against the oppressive British government. When V rescues a young woman from the secret police, he finds in her an ally with whom he can continue his fight to free the people of Britain.",7.9,15022,"['Action', 'Thriller', 'Science Fiction']",3.0
44199,Inside Man (2006),Crime|Drama|Thriller,454848,388.0,"When an armed, masked gang enter a Manhattan bank, lock the doors and take hostages, the detective assigned to effect their release enters negotiations preoccupied with corruption charges he is facing.",7.399,6064,"['Crime', 'Drama', 'Thriller']",4.0
44665,Lucky Number Slevin (2006),Crime|Drama|Mystery,425210,186.0,"Slevin is mistakenly put in the middle of a personal war between the city’s biggest criminal bosses. Under constant watch, Slevin must try not to get killed by an infamous assassin and come up with an idea of how to get out of his current dilemma.",7.48,4247,"['Drama', 'Thriller', 'Crime', 'Mystery']",4.0
44972,Scary Movie 4 (2006),Comedy|Horror,362120,4257.0,"Cindy finds out the house she lives in is haunted by a little boy and goes on a quest to find out who killed him and why. Also, Alien ""Tr-iPods"" are invading the world and she has to uncover the secret in order to stop them.",5.489,3399,['Comedy'],0.5
45517,Cars (2006),Animation|Children|Comedy,317219,920.0,"Lightning McQueen, a hotshot rookie race car driven to succeed, discovers that life is about the journey, not the finish line, when he finds himself unexpectedly detoured in the sleepy Route 66 town of Radiator Springs. On route across the country to the big Piston Cup Championship in California to compete against two seasoned pros, McQueen gets to know the town's offbeat characters.",7.011,14602,"['Animation', 'Adventure', 'Comedy', 'Family']",4.0
45722,Pirates of the Caribbean: Dead Man's Chest (2006),Action|Adventure|Fantasy,383574,58.0,"Captain Jack Sparrow races to recover the heart of Davy Jones to avoid enslaving his soul to Jones' service, as other friends and foes seek the heart for their own agenda as well.",7.371,16607,"['Adventure', 'Fantasy', 'Action']",3.0
46578,Little Miss Sunshine (2006),Adventure|Comedy|Drama,449059,773.0,"A family loaded with quirky, colorful characters piles into an old van and road trips to California for little Olive to compete in a beauty pageant.",7.692,7479,"['Comedy', 'Drama']",4.5
46976,Stranger than Fiction (2006),Comedy|Drama|Fantasy|Romance,420223,1262.0,Harold Crick is a lonely IRS agent whose mundane existence is transformed when he hears a mysterious voice narrating his life.,7.282,2393,"['Comedy', 'Drama', 'Fantasy', 'Romance']",3.5
48385,Borat: Cultural Learnings of America for Make Benefit Glorious Nation of Kazakhstan (2006),Comedy,443453,496.0,"Kazakh journalist Borat Sagdiyev travels to America to make a documentary. As he zigzags across the nation, Borat meets real people in real situations with hysterical consequences. His backwards behavior generates strong reactions around him exposing prejudices and hypocrisies in American culture.",6.783,5662,['Comedy'],4.0
48394,"Pan's Labyrinth (Laberinto del fauno, El) (2006)",Drama|Fantasy|Thriller,457430,1417.0,"In post–civil war Spain, 10-year-old Ofelia moves with her pregnant mother to live under the control of her cruel stepfather. Drawn into a mysterious labyrinth, she meets a faun who reveals that she may be a lost princess from an underground kingdom. To return to her true father, she must complete a series of surreal and perilous tasks that blur the line between reality and fantasy.",7.756,11003,"['Fantasy', 'Drama', 'War']",5.0
48516,"Departed, The (2006)",Crime|Drama|Thriller,407887,1422.0,"To take down South Boston's Irish Mafia, the police send in one of their own to infiltrate the underworld, not realizing the syndicate has done likewise. While an undercover cop curries favor with the mob kingpin, a career criminal rises through the police ranks. But both sides soon discover there's a mole among them.",8.159,15563,"['Drama', 'Thriller', 'Crime']",4.0
48774,Children of Men (2006),Action|Adventure|Drama|Sci-Fi|Thriller,206634,9693.0,"In 2027, in a chaotic world in which humans can no longer procreate, a former activist agrees to help transport a miraculously pregnant woman to a sanctuary at sea, where her child's birth may help scientists save the future of humankind.",7.611,7458,"['Drama', 'Action', 'Thriller', 'Science Fiction']",4.5
48780,"Prestige, The (2006)",Drama|Mystery|Sci-Fi|Thriller,482571,1124.0,"A mysterious story of two magicians whose intense rivalry leads them on a life-long battle for supremacy -- full of obsession, deceit and jealousy with dangerous and deadly consequences.",8.203,16825,"['Drama', 'Mystery', 'Science Fiction']",4.5
49272,Casino Royale (2006),Action|Adventure|Thriller,381061,36557.0,"Le Chiffre, a banker to the world's terrorists, is scheduled to participate in a high-stakes poker game in Montenegro, where he intends to use his winnings to establish his financial grip on the terrorist market. M sends Bond—on his maiden mission as a 00 Agent—to attend this game and prevent Le Chiffre from winning. With the help of Vesper Lynd and Felix Leiter, Bond enters the most important poker game in his already dangerous career.",7.6,11167,"['Adventure', 'Action', 'Thriller']",4.5
50872,Ratatouille (2007),Animation|Children|Drama,382932,2062.0,"Remy, a resident of Paris, appreciates good food and has quite a sophisticated palate. He would love to become a chef so he can create and enjoy culinary masterpieces to his heart's delight. The only problem is, Remy is a rat. When he winds up in the sewer beneath one of Paris' finest restaurants, the rodent gourmet finds himself ideally placed to realize his dream.",7.832,17814,"['Animation', 'Comedy', 'Family', 'Fantasy']",4.0
51255,Hot Fuzz (2007),Action|Comedy|Crime|Mystery,425112,4638.0,"Former London constable Nicholas Angel finds it difficult to adapt to his new assignment in the sleepy British village of Sandford. Not only does he miss the excitement of the big city, but he also has a well-meaning oaf for a partner. However, when a series of grisly accidents rocks Sandford, Angel smells something rotten in the idyllic village.",7.562,7935,"['Crime', 'Action', 'Comedy']",5.0
51662,300 (2007),Action|Fantasy|War|IMAX,416449,1271.0,"Based on Frank Miller's graphic novel, ""300"" is very loosely based the 480 B.C. Battle of Thermopylae, where the King of Sparta led his army against the advancing Persians; the battle is said to have inspired all of Greece to band together against the Persians, and helped usher in the world's first democracy.",7.191,14221,"['Action', 'Adventure', 'War']",3.0
52722,Spider-Man 3 (2007),Action|Adventure|Sci-Fi|Thriller|IMAX,413300,559.0,"The seemingly invincible Spider-Man goes up against an all-new crop of villains—including the shape-shifting Sandman. While Spider-Man’s superpowers are altered by an alien organism, his alter ego, Peter Parker, deals with nemesis Eddie Brock and also gets caught up in a love triangle.",6.446,14695,"['Action', 'Adventure', 'Science Fiction']",1.0
52973,Knocked Up (2007),Comedy|Drama|Romance,478311,4964.0,"A slacker and a career-driven woman accidentally conceive a child after a one-night stand. As they try to make the relationship work, they must navigate the challenges of parenthood and their differences in lifestyle and maturity.",6.298,4098,"['Comedy', 'Romance', 'Drama']",3.0
53121,Shrek the Third (2007),Adventure|Animation|Children|Comedy|Fantasy,413267,810.0,"The King of Far Far Away has died and Shrek and Fiona are to become King & Queen. However, Shrek wants to return to his cozy swamp and live in peace and quiet, so when he finds out there is another heir to the throne, they set off to bring him back to rule the kingdom.",6.298,9412,"['Fantasy', 'Adventure', 'Animation', 'Comedy', 'Family']",1.5
53125,Pirates of the Caribbean: At World's End (2007),Action|Adventure|Comedy|Fantasy,449088,285.0,"Will Turner and Elizabeth Swann join forces with the revived Captain Barbossa to free Jack Sparrow from Davy Jones' locker. The group must navigate dangerous waters, confront many foes and, ultimately, choose sides in a battle wherein piracy itself hangs in the balance.",7.262,14938,"['Adventure', 'Fantasy', 'Action']",3.0
53996,Transformers (2007),Action|Sci-Fi|Thriller|IMAX,418279,1858.0,Young teenager Sam Witwicky becomes involved in the ancient struggle between two extraterrestrial factions of transforming robots – the heroic Autobots and the evil Decepticons. Sam holds the clue to unimaginable power and the Decepticons will stop at nothing to retrieve it.,6.817,11754,"['Adventure', 'Science Fiction', 'Action']",2.0
54272,"Simpsons Movie, The (2007)",Animation|Comedy,462538,35.0,"After Homer accidentally pollutes the town's water supply, Springfield is encased in a gigantic dome by the EPA and the Simpsons are declared fugitives.",7.016,8284,"['Animation', 'Comedy', 'Family']",3.0
54286,"Bourne Ultimatum, The (2007)",Action|Crime|Thriller,440963,2503.0,"Bourne is brought out of hiding once again by reporter Simon Ross who is trying to unveil Operation Blackbriar, an upgrade to Project Treadstone, in a series of newspaper columns. Information from the reporter stirs a new set of memories, and Bourne must finally uncover his dark past while dodging The Company's best efforts to eradicate him.",7.432,7995,"['Action', 'Drama', 'Mystery', 'Thriller']",4.0
54503,Superbad (2007),Comedy,829482,8363.0,Two co-dependent high school seniors are forced to deal with separation anxiety after their plan to stage a booze-soaked party goes awry.,7.258,7679,['Comedy'],4.0
55247,Into the Wild (2007),Action|Adventure|Drama,758758,5915.0,"After graduating from Emory University in 1992, top student and athlete Christopher McCandless abandons his possessions, gives his entire $24,000 savings account to charity, and hitchhikes to Alaska to live in the wilderness.",7.797,9808,"['Adventure', 'Drama']",3.0
55765,American Gangster (2007),Crime|Drama|Thriller,765429,4982.0,"Loosely based on the criminal career of Frank Lucas, a gangster from La Grange, North Carolina, who smuggled heroin into the United States on American service planes returning from the Vietnam War, before being detained by a task force led by Newark Detective Richie Roberts.",7.591,5736,"['Drama', 'Crime']",3.0
55820,No Country for Old Men (2007),Crime|Drama,477348,6977.0,"Llewelyn Moss stumbles upon dead bodies, $2 million and a hoard of heroin in a Texas desert, but methodical killer Anton Chigurh comes looking for it, with local sheriff Ed Tom Bell hot on his trail. The roles of prey and predator blur as the violent pursuit of money and justice collide.",7.946,12688,"['Crime', 'Thriller', 'Western']",5.0
56367,Juno (2007),Comedy|Drama|Romance,467406,7326.0,"Faced with an unplanned pregnancy, sixteen year old high-schooler, Juno MacGuff, makes an unusual decision regarding her unborn child.",7.052,7377,"['Comedy', 'Drama', 'Romance']",3.0
56782,There Will Be Blood (2007),Drama|Western,469494,7345.0,"Ruthless silver miner, turned oil prospector, Daniel Plainview, moves to oil-rich California. Using his son to project a trustworthy, family-man image, Plainview cons local landowners into selling him their valuable properties for a pittance. However, local preacher Eli Sunday suspects Plainview's motives and intentions, starting a slow-burning feud that threatens both their lives.",8.075,6997,['Drama'],5.0
57669,In Bruges (2008),Comedy|Crime|Drama|Thriller,780536,8321.0,"Ray and Ken, two hit men, are in Bruges, Belgium, waiting for their next mission. While they are there they have time to think and discuss their previous assignment. When the mission is revealed to Ken, it is not what he expected.",7.495,5448,"['Comedy', 'Drama', 'Crime']",4.5
58559,"Dark Knight, The (2008)",Action|Crime|Drama|IMAX,468569,155.0,"Batman raises the stakes in his war on crime. With the help of Lt. Jim Gordon and District Attorney Harvey Dent, Batman sets out to dismantle the remaining criminal organizations that plague the streets. The partnership proves to be effective, but they soon find themselves prey to a reign of chaos unleashed by a rising criminal mastermind known to the terrified citizens of Gotham as the Joker.",8.523,34451,"['Drama', 'Action', 'Crime', 'Thriller']",5.0
59315,Iron Man (2008),Action|Adventure|Sci-Fi,371746,1726.0,"After being held captive in an Afghan cave, billionaire engineer Tony Stark creates a unique weaponized suit of armor to fight evil.",7.654,27339,"['Action', 'Science Fiction', 'Adventure']",4.0
59615,Indiana Jones and the Kingdom of the Crystal Skull (2008),Action|Adventure|Comedy|Sci-Fi,367882,217.0,"Set during the Cold War, the Soviets—led by sword-wielding Irina Spalko—are in search of a crystal skull which has supernatural powers related to a mystical Lost City of Gold. Indy is coerced to head to Peru at the behest of a young man whose friend—and Indy's colleague—Professor Oxley has been captured for his knowledge of the skull's whereabouts.",6.017,8671,"['Adventure', 'Action']",2.5
59725,Sex and the City (2008),Comedy|Romance,1000774,4564.0,A New York writer on sex and love is finally getting married to her Mr. Big. But her three best girlfriends must console her after one of them inadvertently leads Mr. Big to jilt her.,6.572,2190,"['Comedy', 'Drama', 'Romance']",0.5
60069,WALL·E (2008),Adventure|Animation|Children|Romance|Sci-Fi,910970,10681.0,"What if mankind had to leave Earth and somebody forgot to turn the last robot off? After hundreds of years doing what he was built for, WALL•E discovers a new purpose in life when he meets a sleek search robot named EVE. EVE comes to realize that WALL•E has inadvertently stumbled upon the key to the planet's future, and races back to space to report to the humans. Meanwhile, WALL•E chases EVE across the galaxy and sets into motion one of the most imaginative adventures ever brought to the big screen.",8.1,19533,"['Animation', 'Family', 'Science Fiction']",4.0
60684,Watchmen (2009),Action|Drama|Mystery|Sci-Fi|Thriller|IMAX,409459,13183.0,"In a gritty and alternate 1985, the glory days of costumed vigilantes have been brought to a close by a government crackdown. But after one of the masked veterans is brutally murdered, an investigation into the killer is initiated. The reunited heroes set out to prevent their own destruction, but in doing so they uncover a sinister plot that puts all of humanity in grave danger.",7.345,9590,"['Mystery', 'Action', 'Science Fiction']",5.0
61323,Burn After Reading (2008),Comedy|Crime|Drama,887883,4944.0,"When a disc containing memoirs of a former CIA analyst falls into the hands of gym employees, Linda and Chad, they see a chance to make enough money for Linda to have life-changing cosmetic surgery. Predictably, events whirl out of control for the duo, and those in their orbit.",6.664,4958,"['Comedy', 'Drama']",3.5
63082,Slumdog Millionaire (2008),Crime|Drama|Romance,1010048,12405.0,"A teenager reflects on his life after being accused of cheating on the Indian version of ""Who Wants to be a Millionaire?"".",7.729,10929,"['Drama', 'Romance']",3.0
63131,Role Models (2008),Comedy,430922,15373.0,"Two salesmen trash a company truck on an energy drink-fueled bender. Upon their arrest, the court gives them a choice: do hard time or spend 150 service hours with a mentorship program. After one day with the kids, however, jail doesn't look half bad.",6.5,2002,['Comedy'],4.5
64614,Gran Torino (2008),Crime|Drama,1205489,13223.0,"Disgruntled Korean War veteran Walt Kowalski sets out to reform his neighbor, Thao Lor, a Hmong teenager who tried to steal Kowalski's prized possession: a 1972 Gran Torino.",7.99,11117,['Drama'],4.5
64957,"Curious Case of Benjamin Button, The (2008)",Drama|Fantasy|Mystery|Romance,421715,4922.0,"Born under unusual circumstances, Benjamin Button springs into being as an elderly man in a New Orleans nursing home and ages in reverse. Twelve years after his birth, he meets Daisy, a child who flits in and out of his life as she grows up to be a dancer. Though he has all sorts of unusual adventures over the course of his life, it is his relationship with Daisy, and the hope that they will come together at the right time, that drives Benjamin forward.",7.595,13266,"['Drama', 'Fantasy', 'Romance']",2.5
65802,Paul Blart: Mall Cop (2009),Action|Comedy|Crime,1114740,14560.0,"Mild-mannered Paul Blart has always had huge dreams of becoming a State Trooper. Until then, he patrols the local mall as a security guard. With his closely cropped moustache, personal transporter and gung-ho attitude, only Blart seems to take his job seriously. All that changes when a team of thugs raids the mall and takes hostages. Untrained, unarmed and a super-size target, Blart has to become a real cop to save the day.",5.428,2603,"['Action', 'Adventure', 'Comedy', 'Family']",1.0
67997,In the Loop (2009),Comedy,1226774,19833.0,"The US President and the UK Prime Minister are planning on launching a war in the Middle East, but—behind the scenes—government officials and advisers are either promoting the war or are trying to prevent it.",7.0,727,['Comedy'],4.5
68157,Inglourious Basterds (2009),Action|Drama|War,361748,16869.0,"In Nazi-occupied France during World War II, a group of Jewish-American soldiers known as ""The Basterds"" are chosen specifically to spread fear throughout the Third Reich by scalping and brutally killing Nazis. The Basterds, lead by Lt. Aldo Raine soon cross paths with a French-Jewish teenage girl who runs a movie theater in Paris which is targeted by the soldiers.",8.215,23251,"['Drama', 'Thriller', 'War']",5.0
68358,Star Trek (2009),Action|Adventure|Sci-Fi|IMAX,796366,13475.0,"The fate of the galaxy rests in the hands of bitter rivals. One, James Kirk, is a delinquent, thrill-seeking Iowa farm boy. The other, Spock, a Vulcan, was raised in a logic-based society that rejects all emotion. As fiery instinct clashes with calm reason, their unlikely but powerful partnership is the only thing capable of leading their crew through unimaginable danger, boldly going where no one has gone before. The human adventure has begun again.",7.426,10156,"['Science Fiction', 'Action', 'Adventure']",4.0
68954,Up (2009),Adventure|Animation|Children|Drama,1049413,14160.0,"Carl Fredricksen spent his entire life dreaming of exploring the globe and experiencing life to its fullest. But at age 78, life seems to have passed him by, until a twist of fate (and a persistent 8-year old Wilderness Explorer named Russell) gives him a new lease on life.",7.959,20983,"['Animation', 'Comedy', 'Family', 'Adventure']",4.0
69122,"Hangover, The (2009)",Comedy|Crime,1119646,18785.0,"When three friends finally come to after a raucous night of bachelor-party revelry, they find a baby in the closet and a tiger in the bathroom. But they can't seem to locate their best friend, Doug – who's supposed to be tying the knot. Launching a frantic search for Doug, the trio perseveres through a nasty hangover to try to make it to the church on time.",7.327,17508,['Comedy'],4.0
69481,"Hurt Locker, The (2008)",Action|Drama|Thriller|War,887912,12162.0,"During the Iraq War, a Sergeant recently assigned to an army bomb squad is put at odds with his squad mates due to his maverick way of handling his work.",7.257,5859,"['Drama', 'Thriller', 'War']",3.5
69526,Transformers: Revenge of the Fallen (2009),Action|Adventure|Sci-Fi|IMAX,1055369,8373.0,"Sam Witwicky leaves the Autobots behind for a normal life. But when his mind is filled with cryptic symbols, the Decepticons target him and he is dragged back into the Transformers' war.",6.2,8838,"['Science Fiction', 'Action', 'Adventure']",0.5
69757,(500) Days of Summer (2009),Comedy|Drama|Romance,1022603,19913.0,"Tom, greeting-card writer and hopeless romantic, is caught completely off-guard when his girlfriend, Summer, suddenly dumps him. He reflects on their 500 days together to try to figure out where their love affair went sour, and in doing so, Tom rediscovers his true passions in life.",7.297,10599,"['Comedy', 'Drama', 'Romance']",5.0
69844,Harry Potter and the Half-Blood Prince (2009),Adventure|Fantasy|Mystery|Romance|IMAX,417741,767.0,"As Lord Voldemort tightens his grip on both the Muggle and wizarding worlds, Hogwarts is no longer a safe haven. Harry suspects perils may even lie within the castle, but Dumbledore is more intent upon preparing him for the final battle fast approaching. Together they work to find the key to unlock Voldemorts defenses and to this end, Dumbledore recruits his old friend and colleague Horace Slughorn, whom he believes holds crucial information. Even as the decisive showdown looms, romance blossoms for Harry, Ron, Hermione and their classmates. Love is in the air, but danger lies ahead and Hogwarts may never be the same again.",7.682,20147,"['Adventure', 'Fantasy']",3.5
70286,District 9 (2009),Mystery|Sci-Fi|Thriller,1136608,17654.0,"Thirty years ago, aliens arrive on Earth. Not to conquer or give aid, but to find refuge from their dying planet. Separated from humans in a South African area called District 9, the aliens are managed by Multi-National United, which is unconcerned with the aliens' welfare but will do anything to master their advanced technology. When a company field agent contracts a mysterious virus that begins to alter his DNA, there is only one place he can hide: District 9.",7.455,9915,['Science Fiction'],4.0
71535,Zombieland (2009),Action|Comedy|Horror,1156398,19908.0,"Columbus has made a habit of running from what scares him. Tallahassee doesn't have fears. If he did, he'd kick their ever-living ass. In a world overrun by zombies, these two are perfectly evolved survivors. But now, they're about to stare down the most terrifying prospect of all: each other.",7.258,12695,"['Comedy', 'Horror']",5.0
72226,Fantastic Mr. Fox (2009),Adventure|Animation|Children|Comedy|Crime,432283,10315.0,"The Fantastic Mr. Fox, bored with his current life, plans a heist against the three local farmers. The farmers, tired of sharing their chickens with the sly fox, seek revenge against him and his family.",7.813,5795,"['Adventure', 'Animation', 'Comedy', 'Family']",5.0
72998,Avatar (2009),Action|Adventure|Sci-Fi|IMAX,499549,19995.0,"In the 22nd century, a paraplegic Marine is dispatched to the moon Pandora on a unique mission, but becomes torn between following orders and protecting an alien civilization.",7.6,32646,"['Action', 'Adventure', 'Fantasy', 'Science Fiction']",3.5
73017,Sherlock Holmes (2009),Action|Crime|Mystery|Thriller,988045,10528.0,Eccentric consulting detective Sherlock Holmes and Doctor John Watson battle to bring down a new nemesis and unravel a deadly plot that could destroy England.,7.216,14345,"['Action', 'Adventure', 'Crime', 'Mystery']",3.5
74458,Shutter Island (2010),Drama|Mystery|Thriller,1130884,11324.0,"World War II soldier-turned-U.S. Marshal Teddy Daniels investigates the disappearance of a patient from a hospital for the criminally insane, but his efforts are compromised by troubling visions and a mysterious doctor.",8.201,24905,"['Drama', 'Thriller', 'Mystery']",3.5
