movieId,title,genres,imdbId,tmdbId,overview,tmdb_vote_average,tmdb_vote_count,tmdb_genres,rating
4085,Beverly Hills Cop (1984),Action|Comedy|Crime|Drama,86960,90.0,"Fast-talking, quick-thinking Detroit street cop Axel Foley has bent more than a few rules and regs in his time, but when his best friend is murdered, he heads to sunny Beverly Hills to work the case like only he can.",7.204,4378,"['Comedy', 'Crime', 'Action']",4.5
4091,Can't Buy Me Love (1987),Comedy|Romance,92718,12919.0,"Nerdy high schooler Ronald Miller rescues cheerleader Cindy Mancini from parental punishment after she accidentally destroys her mother's designer clothes. Ronald agrees to pay for the $1,000 outfit on one condition: that she will act as though they're a couple for an entire month. As the days pass, however, Cindy grows fond of Ronald, making him popular. But when Ronald's former best friend gets left behind, he realizes that social success isn't everything.",6.921,687,"['Drama', 'Comedy', 'Romance']",3.5
4100,Disorderlies (1987),Comedy,92897,24826.0,"As not-quite-orderlies who're downright Disorderlies, rap-music favorites The Fat Boys rule. Playing the freewheeling caretakers of the frail Dennison, they stir up a comedic culture clash in Palm Beach society that only proves laughter is the best medicine this side of a tax refund.",5.0,42,['Comedy'],2.5
4103,Empire of the Sun (1987),Action|Adventure|Drama|War,92965,10110.0,"Jamie Graham, a privileged English boy, is living in Shanghai when the Japanese invade and force all foreigners into prison camps. Jamie is captured with an American sailor, who looks out for him while they are in the camp together. Even though he is separated from his parents and in a hostile environment, Jamie maintains his dignity and youthful spirit, providing a beacon of hope for the others held captive with him.",7.508,2024,"['Drama', 'History', 'War']",4.0
4104,Ernest Goes to Camp (1987),Comedy,92974,18935.0,"Ernest, a lovable loser who works as a summer camp handyman and dreams of becoming a guidance counselor, must find a way to inspire a group of juvenile delinquents while stopping a shady strip mining company from closing the camp as well.",5.316,171,"['Comedy', 'Family']",2.0
4121,Innerspace (1987),Action|Adventure|Comedy|Sci-Fi,93260,2614.0,"Test pilot Tuck Pendleton volunteers to test a special vessel for a miniaturization experiment. Accidentally injected into a neurotic hypochondriac, Jack Putter, Tuck must convince Jack to find his ex-girlfriend, Lydia Maxwell, to help him extract Tuck and his ship and re-enlarge them before his oxygen runs out.",6.825,1312,"['Action', 'Comedy', 'Science Fiction']",4.0
4123,Ishtar (1987),Comedy,93278,12704.0,"Two terrible lounge singers get booked to play a gig in a Moroccan hotel but somehow become pawns in an international power play between the CIA, the Emir of Ishtar, and the rebels trying to overthrow his regime.",4.5,158,"['Comedy', 'Adventure']",3.0
4148,Hannibal (2001),Horror|Thriller,212985,9740.0,"After having successfully eluded the authorities for years, Hannibal peacefully lives in Italy in disguise as an art scholar. Trouble strikes again when he's discovered leaving a deserving few dead in the process. He returns to America to make contact with now disgraced Agent Clarice Starling, who is suffering the wrath of a malicious FBI rival as well as the media.",6.767,4949,"['Crime', 'Drama', 'Thriller']",3.5
4149,Saving Silverman (Evil Woman) (2001),Comedy|Romance,239948,10878.0,"A pair of buddies conspire to save their best friend from marrying the wrong woman, a cold-hearted beauty who snatches him from them and breaks up their Neil Diamond cover band.",5.7,565,"['Comedy', 'Crime', 'Romance']",2.0
4153,Down to Earth (2001),Comedy|Fantasy|Romance,231775,16300.0,"Struggling comic Lance Barton knows what it's like to die on stage. But when his life takes an unexpected turn - straight to heaven - Lance is sure there's been a mistake. Miraculously, he's right! An angel tells Lance he was taken prematurely but assures him he can be returned to Earth - in the aged body of a ruthless white billionaire. In this improbable reincarnation, Lance begins a hilarious quest to realize his showbiz dream...and, along the way, discovers the person he never imagined he could be. Chris Rock delivers a first-rate performance in this romantic comedy remake of HEAVEN CAN WAIT.",5.547,411,"['Fantasy', 'Comedy', 'Romance']",2.5
4159,3000 Miles to Graceland (2001),Action|Thriller,233142,12138.0,"It was an ingenious enough plan: rob the Riviera Casino's count room during an Elvis impersonator convention. But Thomas Murphy decided to keep all the money for himself and shot all his partners, including recently-freed ex-con Michael Zane. With $3.2 million at stake, the Marshals Service closing in, Michael must track down Murphy.",5.857,667,"['Action', 'Adventure', 'Comedy', 'Crime', 'Thriller']",2.5
4214,Revenge of the Nerds (1984),Comedy,88000,14052.0,"At Adams College, the jocks rule the school from their house on high, the Alpha Beta fraternity. So when a group of socially-challenged misfits try to go Greek, they're instantly rejected by every house on campus. Deciding to start their own fraternity to protect their outcast brothers, the campus nerds soon find themselves in a battle royale as the Alpha Betas try to crush their new rivals.",6.5,765,['Comedy'],3.0
4215,Revenge of the Nerds II: Nerds in Paradise (1987),Comedy,93857,16889.0,"The members of the Lambda Lambda Lambda fraternity travel to Fort Lauderdale for a fraternity conference. They'll have to beat off the attacks of their rival frat, the Alphas, if they want to maintain their self-respect -- and, of course, if they want to get anywhere with the pretty girls!",5.6,282,['Comedy'],2.5
4223,Enemy at the Gates (2001),Drama|War,215750,853.0,A Russian and a German sniper play a game of cat-and-mouse during the Battle of Stalingrad in WWII.,7.4,3841,"['Drama', 'War', 'History', 'Romance']",3.5
4226,Memento (2000),Mystery|Thriller,209144,77.0,"Leonard Shelby is tracking down the man who raped and murdered his wife. The difficulty of locating his wife's killer, however, is compounded by the fact that he suffers from a rare, untreatable form of short-term memory loss. Although he can recall details of life before his accident, Leonard cannot remember what happened fifteen minutes ago, where he's going, or why.",8.178,15566,"['Mystery', 'Thriller']",4.0
4232,Spy Kids (2001),Action|Adventure|Children|Comedy,227538,10054.0,"Carmen and Juni think their parents are boring. Little do they know that in their day, Gregorio and Ingrid Cortez were the top secret agents from their respective countries. They gave up that life to raise their children. Now, the disappearances of several of their old colleagues forces the Cortez' return from retirement. What they didn't count on was Carmen and Juni joining the ""family business.""",5.814,3572,"['Family', 'Action', 'Comedy', 'Adventure', 'Science Fiction']",3.5
4246,Bridget Jones's Diary (2001),Comedy|Drama|Romance,243155,634.0,"Bridget Jones is an average woman struggling against her age, her weight, her job, her lack of a man, and her various imperfections. As a New Year's resolution, Bridget decides to take control of her life, starting by keeping a diary in which she will always tell the complete truth. The fireworks begin when her charming though disreputable boss takes an interest in the quirky Miss Jones. Thrown into the mix are Bridget's band of slightly eccentric friends and a rather disagreeable acquaintance into whom Bridget cannot seem to stop running or help finding quietly attractive.",6.745,5295,"['Comedy', 'Romance', 'Drama']",2.5
4254,Crocodile Dundee in Los Angeles (2001),Comedy|Drama,231402,9290.0,"After settling in the tiny Australian town of Walkabout Creek with his significant other and his young son, Mick ""Crocodile"" Dundee is thrown for a loop when a prestigious Los Angeles newspaper offers his honey a job. The family migrates back to the United States, and Croc and son soon find themselves learning some lessons about American life -- many of them inadvertent",5.2,634,"['Adventure', 'Comedy']",2.5
4255,Freddy Got Fingered (2001),Comedy,240515,13166.0,"Unemployed cartoonist Gord Brody moves back in with his parents Jim and Julie and younger brother Freddy. When his parents demand he leave, he retaliates by spreading rumors that Jim is sexually abusing Freddy.",4.723,460,['Comedy'],2.0
4262,Scarface (1983),Action|Crime|Drama,86250,111.0,"After getting a green card in exchange for assassinating a Cuban government official, Tony Montana stakes a claim on the drug trade in Miami. Viciously murdering anyone who stands in his way, Tony eventually becomes the biggest drug lord in the state, controlling nearly all the cocaine that comes through Miami. But increased pressure from the police, wars with Colombian drug cartels and his own drug-fueled paranoia serve to fuel the flames of his eventual downfall.",8.16,12469,"['Action', 'Crime', 'Drama']",4.0
4265,Driven (2001),Action|Thriller,132245,10477.0,"Talented rookie race-car driver Jimmy Bly has started losing his focus and begins to slip in the race rankings. It's no wonder, with the immense pressure being shoveled on him by his overly ambitious promoter brother as well as Bly's romance with his arch rival's girlfriend Sophia. With much riding on Bly, car owner Carl Henry brings former racing star Joe Tanto on board to help Bly. To drive Bly back to the top of the rankings, Tanto must first deal with the emotional scars left over from a tragic racing accident which nearly took his life.",5.149,772,"['Action', 'Drama']",2.0
4270,"Mummy Returns, The (2001)",Action|Adventure|Comedy|Thriller,209163,1734.0,"Rick and Evelyn O’Connell, along with their 8-year-old son Alex, discover the key to the legendary Scorpion King’s might: the fabled Bracelet of Anubis. Unfortunately, a newly resurrected Imhotep has designs on the bracelet as well, and isn’t above kidnapping its new bearer, Alex, to gain control of Anubis’s otherworldly army.",6.382,7343,"['Adventure', 'Action', 'Fantasy']",3.5
4280,"World According to Garp, The (1982)",Comedy|Drama|Romance,84917,11307.0,"A struggling young writer finds his life and work dominated by his unfaithful wife and his radical feminist mother, whose best-selling manifesto turns her into a cultural icon.",6.696,363,"['Drama', 'Comedy']",4.0
4306,Shrek (2001),Adventure|Animation|Children|Comedy|Fantasy|Romance,126029,808.0,"It ain't easy bein' green -- especially if you're a likable (albeit smelly) ogre named Shrek. On a mission to retrieve a gorgeous princess from the clutches of a fire-breathing dragon, Shrek teams up with an unlikely compatriot -- a wisecracking donkey.",7.752,17987,"['Animation', 'Comedy', 'Fantasy', 'Adventure', 'Family']",4.0
4308,Moulin Rouge (2001),Drama|Musical|Romance,203009,824.0,"A celebration of love and creative inspiration takes place in the infamous, gaudy and glamorous Parisian nightclub, at the cusp of the 20th century. A young poet, who is plunged into the heady world of Moulin Rouge, begins a passionate affair with the club's most notorious and beautiful star.",7.545,4672,"['Drama', 'Romance', 'Music']",4.0
4310,Pearl Harbor (2001),Action|Drama|Romance|War,213149,676.0,"The lifelong friendship between Rafe McCawley and Danny Walker is put to the ultimate test when the two ace fighter pilots become entangled in a love triangle with beautiful Naval nurse Evelyn Johnson. But the rivalry between the friends-turned-foes is immediately put on hold when they find themselves at the center of Japan's devastating attack on Pearl Harbor on Dec. 7, 1941.",6.941,6751,"['War', 'Romance', 'History', 'Action']",2.5
4326,Mississippi Burning (1988),Crime|Drama|Thriller,95647,1632.0,"Two FBI agents investigating the murder of civil rights workers during the 60s seek to breach the conspiracy of silence in a small Southern town where segregation divides black and white. The younger agent trained in FBI school runs up against the small town ways of his partner, a former sheriff.",7.679,1818,"['Drama', 'Crime', 'Mystery', 'Thriller']",3.5
4327,"Magnificent Seven, The (1960)",Adventure|Western,54047,966.0,An oppressed Mexican peasant village hires seven gunfighters to help defend their homes.,7.508,1878,"['Western', 'Action', 'Adventure']",3.5
4340,"Animal, The (2001)",Comedy,255798,11090.0,"When loser Marvin Mange is involved in a horrible car accident, he's brought back to life by a deranged scientist as half man and half animal. His newfound powers are awesome -- but their adverse side effects could take over his life. Now, Marvin must fight to control his crazy primal urges around his new squeeze, Rianna, and his rival, Sgt. Sisk, who both think he's one cool cat.",5.123,1301,"['Comedy', 'Science Fiction']",2.0
4343,Evolution (2001),Comedy|Sci-Fi,251075,9397.0,"A comedy that follows the chaos that ensues when a meteor hits the Earth carrying alien life forms that give new meaning to the term ""survival of the fittest."" David Duchovny, Orlando Jones, Seann William Scott, and Julianne Moore are the only people standing between the aliens and world domination... which could be bad news for the Earth.",6.096,2345,"['Comedy', 'Science Fiction', 'Action']",2.0
4344,Swordfish (2001),Action|Crime|Drama,244244,9705.0,"Rogue agent Gabriel Shear is determined to get his mitts on $9 billion stashed in a secret Drug Enforcement Administration account. He wants the cash to fight terrorism, but lacks the computer skills necessary to hack into the government mainframe. Enter Stanley Jobson, a n'er-do-well encryption expert who can log into anything.",6.251,2810,"['Action', 'Crime', 'Thriller']",2.5
4351,Point Break (1991),Action|Crime|Thriller,102685,1089.0,"In Los Angeles, a gang of bank robbers who call themselves The Ex-Presidents commit their crimes while wearing masks of Reagan, Carter, Nixon and Johnson. Believing that the members of the gang could be surfers, the F.B.I. sends young agent Johnny Utah to the beach undercover to mix with the surfers and gather information.",7.159,3766,"['Action', 'Thriller', 'Crime']",3.5
4361,Tootsie (1982),Comedy|Romance,84805,9576.0,"When struggling, out of work actor Michael Dorsey secretly adopts a female alter ego – Dorothy Michaels – in order to land a part in a daytime drama, he unwittingly becomes a feminist icon and ends up in a romantic pickle.",7.212,1839,"['Comedy', 'Romance']",3.5
4367,Lara Croft: Tomb Raider (2001),Action|Adventure,146316,1995.0,"Orphaned heiress, English aristocrat and intrepid archaeologist, Lara Croft, embarks on a dangerous quest to retrieve the two halves of an ancient artifact which controls time before it falls into the wrong hands. As an extremely rare planetary alignment is about to occur for the first time in 5,000 years, the fearless tomb raider will have to team up with rival adventurers and sworn enemies to collect the pieces, while time is running out. But, in the end, who can harness the archaic talisman's unlimited power?",5.905,6288,"['Adventure', 'Action', 'Fantasy']",2.5
4369,"Fast and the Furious, The (2001)",Action|Crime|Thriller,232500,9799.0,"Dominic Toretto is a Los Angeles street racer suspected of masterminding a series of big-rig hijackings. When undercover cop Brian O'Conner infiltrates Toretto's iconoclastic crew, he falls for Toretto's sister and must choose a side: the gang or the LAPD.",6.996,10410,"['Action', 'Crime', 'Thriller']",3.5
4370,A.I. Artificial Intelligence (2001),Adventure|Drama|Sci-Fi,212720,644.0,"David, a robotic boy—the first of his kind programmed to love—is adopted as a test case by a Cybertronics employee and his wife. Though he gradually becomes their child, a series of unexpected circumstances make this life impossible for David.",7.047,6394,"['Drama', 'Science Fiction', 'Adventure']",4.0
4386,Cats & Dogs (2001),Children|Comedy,239395,10992.0,"When a professor develops a vaccine that eliminates human allergies to dogs, he unwittingly upsets the fragile balance of power between cats and dogs and touches off an epic battle for pet supremacy. The fur flies as the feline faction, led by Mr. Tinkles, squares off against wide-eyed puppy Lou and his canine cohorts.",5.387,1682,"['Family', 'Comedy', 'Action', 'Adventure', 'Fantasy']",2.5
4388,Scary Movie 2 (2001),Comedy,257106,4248.0,"While the original parodied slasher flicks like Scream, Keenen Ivory Wayans's sequel to Scary Movie takes comedic aim at haunted house movies. A group of students visit a mansion called ""Hell House,"" and murderous high jinks ensue.",5.809,4866,['Comedy'],2.5
4446,Final Fantasy: The Spirits Within (2001),Adventure|Animation|Fantasy|Sci-Fi,173840,2114.0,"Led by a strange dream, scientist Aki Ross struggles to collect the eight spirits in the hope of creating a force powerful enough to protect the planet. With the aid of the Deep Eyes Squadron and her mentor, Dr. Sid, Aki must save the Earth from its darkest hate and unleash the spirits within.",6.196,1526,"['Adventure', 'Action', 'Fantasy', 'Science Fiction', 'Thriller', 'Romance', 'Animation']",4.0
4447,Legally Blonde (2001),Comedy|Romance,250494,8835.0,"Fashionable sorority queen Elle Woods has it all, but, she wants nothing more than to be Mrs. Warner Huntington III. But he dumps her before heading to Harvard Law School. Elle rallies all of her resources and gets into Harvard, determined to win him back. While there, she figures out that there is more to herself than just good looks.",6.807,4287,"['Comedy', 'Romance']",2.0
4448,"Score, The (2001)",Action|Drama,227445,11371.0,An aging thief hopes to retire and live off his ill-gotten wealth when a young kid convinces him into doing one last heist.,6.701,1746,"['Action', 'Crime', 'Thriller', 'Mystery', 'Drama']",3.5
4467,"Adventures of Baron Munchausen, The (1988)",Adventure|Comedy|Fantasy,96764,14506.0,An account of Baron Munchausen's supposed travels and fantastical experiences with his band of misfits.,7.0,949,"['Fantasy', 'Adventure', 'Comedy']",4.0
4487,Cocktail (1988),Drama|Romance,94889,7520.0,"After being discharged from the Army, Brian Flanagan moves back to Queens and takes a job in a bar run by Doug Coughlin, who teaches Brian the fine art of bar-tending. Brian quickly becomes a patron favorite with his flashy drink-mixing style, and Brian adopts his mentor's cynical philosophy on life and goes for the money.",6.117,1538,"['Romance', 'Drama', 'Comedy']",3.0
4489,Coming to America (1988),Comedy|Romance,94898,9602.0,"An African prince decides it’s time for him to find a princess... and his mission leads him and his most loyal friend to Queens, New York. In disguise as an impoverished immigrant, the pampered prince quickly finds himself a new job, new friends, new digs, new enemies and lots of trouble.",6.878,4547,"['Comedy', 'Romance']",4.5
4545,Short Circuit (1986),Comedy|Sci-Fi,91949,2605.0,"After a lightning bolt zaps a robot named Number 5, the lovable machine starts to think he's human and escapes the lab. Hot on his trail is his designer, Newton, who hopes to get to Number 5 before the military does. In the meantime, a spunky animal lover mistakes the robot for an alien and takes him in, teaching her new guest about life on Earth.",6.635,1544,"['Science Fiction', 'Comedy', 'Family']",4.0
4558,Twins (1988),Comedy,96320,9493.0,Julius and Vincent Benedict are the results of an experiment that would allow for the perfect child. Julius was planned and grows to athletic proportions. Vincent is an accident and is somewhat smaller in stature. Vincent is placed in an orphanage while Julius is taken to a south seas island and raised by philosophers. Vincent becomes the ultimate low life and is about to be killed by loan sharks.,6.0,2372,['Comedy'],3.5
4566,American Ninja 2: The Confrontation (1987),Action|Adventure,92548,25678.0,"On a remote Caribbean island, Army Ranger Joe Armstrong saves an old friend from the clutches of ""The Lion"", an evil super-criminal who has kidnapped a local scientist and mass-produced an army of mutant Ninja warriors.",5.5,300,['Action'],2.5
4571,Bill & Ted's Excellent Adventure (1989),Adventure|Comedy|Sci-Fi,96928,1648.0,"Bill and Ted are high school buddies starting a band. They are also about to fail their history class—which means Ted would be sent to military school—but receive help from Rufus, a traveller from a future where their band is the foundation for a perfect society. With the use of Rufus' time machine, Bill and Ted travel to various points in history, returning with important figures to help them complete their final history presentation.",6.859,1961,"['Adventure', 'Comedy', 'Science Fiction']",3.5
4621,Look Who's Talking (1989),Comedy|Romance,97778,9494.0,"Mollie is a single working mother who's out to find the perfect father for her child. Her baby, Mikey, prefers James, a cab driver turned babysitter who has what it takes to make them both happy. But Mollie won't even consider James. It's going to take all the tricks a baby can think of to bring them together before it's too late.",6.28,2355,"['Comedy', 'Romance']",4.0
4623,Major League (1989),Comedy,97815,9942.0,"When Rachel Phelps inherits the Cleveland Indians from her deceased husband, she's determined to move the team to a warmer climate—but only a losing season will make that possible, which should be easy given the misfits she's hired. Rachel is sure her dream will come true, but she underestimates their will to succeed.",6.879,832,['Comedy'],4.0
4638,Jurassic Park III (2001),Action|Adventure|Sci-Fi|Thriller,163025,331.0,"In need of funds for research, Dr. Alan Grant accepts a large sum of money to accompany Paul and Amanda Kirby on an aerial tour of the infamous Isla Sorna. It isn't long before all hell breaks loose and the stranded wayfarers must fight for survival as a host of new -- and even more deadly -- dinosaurs try to make snacks of them.",6.166,7527,"['Adventure', 'Action', 'Thriller', 'Science Fiction']",2.0
4643,Planet of the Apes (2001),Action|Adventure|Drama|Sci-Fi,133152,869.0,"After a spectacular crash-landing on an uncharted planet, brash astronaut Leo Davidson finds himself trapped in a savage world where talking apes dominate the human race. Desperate to find a way home, Leo must evade the invincible gorilla army led by Ruthless General Thade.",5.761,4238,"['Thriller', 'Science Fiction', 'Action', 'Adventure']",2.5
4673,Tango & Cash (1989),Action|Comedy|Crime|Thriller,98439,9618.0,"Ray Tango and Gabriel Cash are two successful narcotics detectives who can't stand each other. Crime lord Yves Perret, furious at the loss of income they have caused him, plots an elaborate revenge against them.",6.476,2020,"['Action', 'Thriller', 'Comedy', 'Drama', 'Crime']",3.0
4677,Turner & Hooch (1989),Comedy|Crime,98536,6951.0,"Detective Scott Turner has three days left in the local police department before he moves to a bigger city to get some 'real' cases—not just misdemeanors. When Amos Reed is murdered, Scott sets himself on the case, but the closest thing to a witness to the murder is Reed's dog, Hooch, which Scott has to take care of—to avoid Hooch being 'put to sleep'.",6.345,1364,"['Action', 'Comedy', 'Thriller', 'Crime', 'Family']",3.5
4686,Weekend at Bernie's II (1993),Adventure|Comedy,108539,8494.0,"Everybody's favorite stiff is back! Working fools Larry Wilson and Richard Parker have uncovered a dirty, little secret: Their former boss, Bernie Lomax, embezzled $2 million and placed it in a safe deposit box in the Caribbean. Now, the boys are ready to go after the loot, but they can't do it alone -- they need poor Bernie's help. Can the buddies give their ex-boss new life?",5.0,311,"['Comedy', 'Crime', 'Adventure']",2.5
4700,"Princess Diaries, The (2001)",Children|Comedy|Romance,247638,9880.0,"A socially awkward but very bright 15-year-old girl being raised by a single mom discovers that she is the princess of a small European country because of the recent death of her long-absent father, who, unknown to her, was the crown prince of Genovia. She must make a choice between continuing the life of a San Francisco teen or stepping up to the throne.",6.964,5114,"['Comedy', 'Family', 'Romance']",3.0
4701,Rush Hour 2 (2001),Action|Comedy,266915,5175.0,"It's vacation time for Carter as he finds himself alongside Lee in Hong Kong wishing for more excitement. While Carter wants to party and meet the ladies, Lee is out to track down a Triad gang lord who may be responsible for killing two men at the American Embassy. Things get complicated as the pair stumble onto a counterfeiting plot. The boys are soon up to their necks in fist fights and life-threatening situations. A trip back to the U.S. may provide the answers about the bombing, the counterfeiting, and the true allegiance of sexy customs agent Isabella.",6.751,4353,"['Action', 'Comedy', 'Crime']",4.0
4718,American Pie 2 (2001),Comedy,252866,2770.0,"After a year apart - attending different schools, meeting different people - the guys rent a beach house and vow to make this the best summer ever. As it turns out, whether that will happen or not has a lot to do with the girls. Between the wild parties, outrageous revelations and yes, a trip to band camp, they discover that times change and people change, but in the end, it's all about sticking together.",6.248,5088,"['Comedy', 'Romance']",2.5
4720,"Others, The (2001)",Drama|Horror|Mystery|Thriller,230600,1933.0,"Grace is a religious woman who lives in an old house kept dark because her two children, Anne and Nicholas, have a rare sensitivity to light. When the family begins to suspect the house is haunted, Grace fights to protect her children at any cost in the face of strange events and disturbing visions.",7.615,6839,"['Horror', 'Mystery', 'Thriller']",4.5
