movieId,title,genres,imdbId,tmdbId,overview,tmdb_vote_average,tmdb_vote_count,tmdb_genres,rating
1580,Men in Black (a.k.a. MIB) (1997),Action|Comedy|Sci-Fi,119654,607.0,"After a police chase with an otherworldly being, a New York City cop is recruited as an agent in a top-secret organization established to monitor and police alien activity on Earth: the Men in Black. Agent K and new recruit Agent J find themselves in the middle of a deadly plot by an intergalactic terrorist who has arrived on Earth to assassinate two ambassadors from opposing galaxies.",7.213,14299,"['Action', 'Adventure', 'Comedy', 'Science Fiction']",4.0
1590,Event Horizon (1997),Horror|Sci-Fi|Thriller,119081,8413.0,"In 2047, a group of astronauts are sent to investigate and salvage the starship Event Horizon which disappeared mysteriously seven years before on its maiden voyage. However, it soon becomes evident that something sinister resides in its corridors.",6.563,3056,"['Horror', 'Science Fiction', 'Mystery']",1.0
1614,In & Out (1997),Comedy,119360,10806.0,A midwestern teacher questions his sexuality after a former student makes a comment about him at the Academy Awards.,6.472,710,['Comedy'],1.0
1617,L.A. Confidential (1997),Crime|Film-Noir|Mystery|Thriller,119488,2118.0,Three detectives in the corrupt and brutal L.A. police force of the 1950s use differing methods to uncover a conspiracy behind the shotgun slayings of the patrons at an all-night diner.,7.801,5237,"['Crime', 'Mystery', 'Thriller', 'Drama']",5.0
1619,Seven Years in Tibet (1997),Adventure|Drama|War,120102,978.0,"Austrian mountaineer Heinrich Harrer journeys to the Himalayas without his family to head an expedition in 1939. But when World War II breaks out, the arrogant Harrer falls into Allied forces' hands as a prisoner of war. He escapes with a fellow detainee and makes his way to Lhasa, Tibet, where he meets the 14-year-old Dalai Lama, whose friendship ultimately transforms his outlook on life.",7.157,2976,"['Adventure', 'Drama', 'History']",4.0
1639,Chasing Amy (1997),Comedy|Drama|Romance,118842,2255.0,"Holden and Banky are comic book artists. Everything is going good for them until they meet Alyssa, also a comic book artist. Holden falls for her, but his hopes are crushed when he finds out she's a lesbian.",6.8,1458,"['Comedy', 'Drama', 'Romance']",3.0
1645,The Devil's Advocate (1997),Drama|Mystery|Thriller,118971,1813.0,"Aspiring Florida defense lawyer Kevin Lomax accepts a job at a New York law firm. With the stakes getting higher every case, Kevin quickly learns that his boss has something far more evil planned.",7.469,6403,"['Drama', 'Mystery', 'Horror']",4.0
1665,Bean (1997),Comedy,118689,1281.0,"Childlike Englishman, Mr. Bean, is an incompetent watchman at the Royal National Gallery. After the museum's board of directors' attempt to have him fired is blocked by the chairman, who has taken a liking to Bean, they send him to Los Angeles to act as their ambassador for the unveiling of a historic painting to humiliate him. Fooled, Mr. Bean must now successfully unveil the painting or risk his and a hapless Los Angeles curator's termination.",6.47,2493,"['Family', 'Adventure', 'Comedy']",3.0
1681,Mortal Kombat: Annihilation (1997),Action|Adventure|Fantasy,119707,9823.0,"A group of heroic warriors has only six days to save the planet in ""Mortal Kombat Annihilation."" To succeed they must survive the most spectacular series of challenges any human, or god, has ever encountered as they battle an evil warlord bent on taking control of Earth.",4.51,1250,"['Action', 'Fantasy', 'Science Fiction']",3.0
1682,"Truman Show, The (1998)",Comedy|Drama|Sci-Fi,120382,37165.0,An insurance salesman begins to suspect that his whole life is actually some sort of reality TV show.,8.1,19327,"['Comedy', 'Drama']",4.0
1689,"Man Who Knew Too Little, The (1997)",Comedy|Crime|Thriller,120483,9414.0,"An American gets a ticket for an audience participation game in London, then gets involved in a case of mistaken identity. As an international plot unravels around him, he thinks it's all part of the act.",6.4,535,"['Comedy', 'Crime', 'Action']",4.0
1704,Good Will Hunting (1997),Drama|Romance,119217,489.0,"Headstrong yet aimless, Will Hunting has a genius-level IQ but chooses to work as a janitor at MIT. When he secretly solves highly difficult graduate-level math problems, his talents are discovered by Professor Gerald Lambeau, who decides to help the misguided youth reach his potential. When Will is arrested for attacking a police officer, Professor Lambeau makes a deal to get leniency for him if he gets court-ordered therapy. Eventually, therapist Dr. Sean Maguire helps Will confront the demons that are holding him back.",8.157,13117,['Drama'],5.0
1713,Mouse Hunt (1997),Children|Comedy,119715,6283.0,"Down-on-their luck brothers, Lars and Ernie Smuntz, aren't happy with the crumbling old mansion they inherit... until they discover the estate is worth millions. Before they can cash in, they have to rid the house of its single, stubborn occupant—a tiny and tenacious mouse.",6.544,1296,"['Comedy', 'Family']",5.0
1721,Titanic (1997),Drama|Romance,120338,597.0,"101-year-old Rose DeWitt Bukater tells the story of her life aboard the Titanic, 84 years later. A young Rose boards the ship with her mother and fiancé. Meanwhile, Jack Dawson and Fabrizio De Rossi win third-class tickets aboard the ship. Rose tells the whole story from Titanic's departure through to its death—on its first and last voyage—on April 15, 1912.",7.906,26343,"['Drama', 'Romance']",4.0
1732,"Big Lebowski, The (1998)",Comedy|Crime,118715,115.0,"Jeffrey 'The Dude' Lebowski, a Los Angeles slacker who only wants to bowl and drink White Russians, is mistaken for another Jeffrey Lebowski, a wheelchair-bound millionaire, and finds himself dragged into a strange series of events involving nihilists, adult film producers, ferrets, errant toes, and large sums of money.",7.84,11690,"['Comedy', 'Crime']",4.5
1747,Wag the Dog (1997),Comedy,120885,586.0,"During the final weeks of a presidential race, the President is accused of sexual misconduct. To distract the public until the election, the President's adviser hires a Hollywood producer to help him stage a fake war.",6.945,991,"['Comedy', 'Drama']",4.0
1884,Fear and Loathing in Las Vegas (1998),Adventure|Comedy|Drama,120669,1878.0,"Raoul Duke and his attorney Dr. Gonzo drive a red convertible across the Mojave desert to Las Vegas with a suitcase full of drugs to cover a motorcycle race. As their consumption of drugs increases at an alarming rate, the stoned duo trash their hotel room and fear legal repercussions. Duke begins to drive back to L.A., but after an odd run-in with a cop, he returns to Sin City and continues his wild drug binge.",7.211,4798,"['Adventure', 'Drama', 'Comedy']",4.5
1954,Rocky (1976),Drama,75148,1366.0,"Rocky Balboa is a Philadelphia club fighter who seems to be going nowhere. But when a stroke of fate puts him in the ring with a world heavyweight champion, Rocky knows that it's his one shot at the big time — a once-in-a-lifetime opportunity to go the distance and come out a winner!",7.79,8245,['Drama'],5.0
1961,Rain Man (1988),Drama,95953,380.0,"When car dealer Charlie Babbitt learns that his estranged father has died, he returns home to Cincinnati, where he discovers that he has a savant older brother named Raymond and that his father's $3 million fortune is being left to the mental institution in which Raymond lives. Motivated by his father's money, Charlie checks Raymond out of the facility in order to return with him to Los Angeles. The brothers' cross-country trip ends up changing both their lives.",7.751,6704,['Drama'],4.0
2005,"Goonies, The (1985)",Action|Adventure|Children|Comedy|Fantasy,89218,9340.0,Young teen Mikey Walsh and his friends set off on a quest to find Pirate One-Eyed Willie's treasure in hopes of saving their homes from demolition.,7.514,5948,"['Adventure', 'Comedy', 'Family']",4.5
2011,Back to the Future Part II (1989),Adventure|Comedy|Sci-Fi,96874,165.0,"Marty and Doc are at it again as the time-traveling duo head to 2015 to nip some McFly family woes in the bud. But things go awry thanks to bully Biff Tannen and a pesky sports almanac. In a last-ditch attempt to set things straight, Marty finds himself bound for 1955 and face to face with his teenage parents -- again.",7.772,13378,"['Adventure', 'Comedy', 'Science Fiction']",4.5
2012,Back to the Future Part III (1990),Adventure|Comedy|Sci-Fi|Western,99088,196.0,"The final installment finds Marty digging the trusty DeLorean out of a mineshaft and looking for Doc in the Wild West of 1885. But when their time machine breaks down, the travelers are stranded in a land of spurs. More problems arise when Doc falls for pretty schoolteacher Clara Clayton, and Marty tangles with Buford Tannen.",7.488,11059,"['Adventure', 'Comedy', 'Science Fiction']",4.0
2019,Seven Samurai (Shichinin no samurai) (1954),Action|Adventure|Drama,47478,346.0,"A samurai answers a village's request for protection after he falls on hard times. The town needs protection from bandits, so the samurai gathers six others to help him teach the people how to defend themselves, and the villagers provide the soldiers with food.",8.453,3988,"['Action', 'Drama']",4.5
2028,Saving Private Ryan (1998),Action|Drama|War,120815,857.0,"As U.S. troops storm the beaches of Normandy, three brothers lie dead on the battlefield, with a fourth trapped behind enemy lines. Ranger captain John Miller and seven men are tasked with penetrating German-held territory and bringing the boy home.",8.22,16538,"['Drama', 'History', 'War']",5.0
2060,BASEketball (1998),Comedy,131857,14013.0,"Two losers from Milwaukee, Coop and Remer, invent a new game combining basketball with the rules of baseball. When the game becomes a huge success, they, along with a billionaire's help, form the Professional Baseketball League where everyone gets the same pay and no team can change cities. When a rival owner wants to institute major rule changes, Coop and Remer's team is the only one standing in the way.",6.124,610,['Comedy'],4.0
2109,"Jerk, The (1979)",Comedy,79367,6471.0,"After discovering he's not really black like the rest of his family, likable dimwit Navin Johnson sets off on a hilarious misadventure that takes him from rags to riches and back again. The slaphappy jerk strikes it rich, but life in the fast lane isn't all it's cracked up to be and, in the end, all that really matters to Johnson is his true love.",6.906,850,['Comedy'],5.0
2115,Indiana Jones and the Temple of Doom (1984),Action|Adventure|Fantasy,87469,87.0,"After arriving in India, Indiana Jones is asked by a desperate village to find a mystical stone. He agrees – and stumbles upon a secret cult plotting a terrible plan in the catacombs of an ancient palace.",7.302,9713,"['Adventure', 'Action']",4.5
2273,Rush Hour (1998),Action|Comedy|Crime|Thriller,120812,2109.0,"When Hong Kong Inspector Lee is summoned to Los Angeles to investigate a kidnapping, the FBI doesn't want any outside help and assigns cocky LAPD Detective James Carter to distract Lee from the case. Not content to watch the action from the sidelines, Lee and Carter form an unlikely partnership and investigate the case themselves.",7.057,5325,"['Action', 'Comedy', 'Crime']",3.0
2278,Ronin (1998),Action|Crime|Thriller,122690,8195.0,"A briefcase with undisclosed contents – sought by Irish terrorists and the Russian mob – makes its way into criminals' hands. An Irish liaison assembles a squad of mercenaries, or 'ronin', and gives them the thorny task of recovering the case.",6.961,2496,"['Action', 'Thriller', 'Crime']",3.5
2288,"Thing, The (1982)",Action|Horror|Sci-Fi|Thriller,84787,1091.0,"A twelve-man team at a remote Antarctic research station discovers an alien buried in the snow for over 100,000 years. Soon unfrozen, the form-changing creature wreaks havoc, creates terror...And becomes one of them.",8.069,7462,"['Horror', 'Mystery', 'Science Fiction']",5.0
2294,Antz (1998),Adventure|Animation|Children|Comedy|Fantasy,120587,8916.0,"A neurotic worker ant in love with a rebellious princess rises to unlikely stardom when he switches places with a soldier. Signing up to march in a parade, he ends up under the command of a bloodthirsty general. But he's actually been enlisted to fight against a termite army.",6.2,4580,"['Animation', 'Drama', 'Family', 'Comedy', 'Adventure', 'Romance']",3.5
2302,My Cousin Vinny (1992),Comedy,104952,10377.0,"Two carefree pals from Brooklyn traveling through rural Alabama on their way back to college are mistakenly arrested, and charged with murder. Fortunately, one of them has a cousin who's a lawyer - Vincent Gambini, a former auto mechanic from Brooklyn who just passed his bar exam after his sixth try. When he arrives with his leather-clad girlfriend, to try his first case, it's a real shock - for him and the Deep South!",7.5,1699,"['Comedy', 'Drama']",4.5
2324,Life Is Beautiful (La Vita è bella) (1997),Comedy|Drama|Romance|War,118799,637.0,A touching story of an Italian book seller of Jewish ancestry who lives in his own little fairy tale. His creative and happy life would come to an abrupt halt when his entire family is deported to a concentration camp during World War II. While locked up he tries to convince his son that the whole thing is just a game.,8.44,13552,"['Comedy', 'Drama']",5.0
2329,American History X (1998),Crime|Drama,120586,73.0,"Derek Vineyard is paroled after serving 3 years in prison for killing two African-American men. Through his brother, Danny Vineyard's narration, we learn that before going to prison, Derek was a skinhead and the leader of a violent white supremacist gang that committed acts of racial crime throughout L.A. and his actions greatly influenced Danny. Reformed and fresh out of prison, Derek severs contact with the gang and becomes determined to keep Danny from going down the same violent path as he did.",8.333,12058,['Drama'],3.5
2355,"Bug's Life, A (1998)",Adventure|Animation|Children|Comedy,120623,9487.0,"On behalf of ""oppressed bugs everywhere,"" an inventive ant named Flik hires a troupe of warrior bugs to defend his bustling colony from a horde of freeloading grasshoppers led by the evil-minded Hopper.",6.972,9464,"['Family', 'Animation', 'Adventure', 'Comedy', 'Drama']",4.0
2395,Rushmore (1998),Comedy|Drama,128445,11545.0,"When a beautiful first-grade teacher arrives at a prep school, she soon attracts the attention of an ambitious teenager named Max, who quickly falls in love with her. Max turns to the father of two of his schoolmates for advice on how to woo the teacher. However, the situation soon gets complicated when Max's new friend becomes involved with her, setting the two pals against one another in a war for her attention.",7.395,2594,"['Comedy', 'Drama']",4.0
2502,Office Space (1999),Comedy|Crime,151804,1542.0,"A depressed white-collar worker tries hypnotherapy, only to find himself in a perpetual state of devil-may-care bliss that prompts him to start living by his own rules, and hatch a hapless attempt to embezzle money from his soul-killing employers.",7.373,3187,['Comedy'],5.0
2529,Planet of the Apes (1968),Action|Drama|Sci-Fi,63442,871.0,"Astronaut Taylor crash lands on a distant planet ruled by apes who use a primitive race of humans for experimentation and sport. Soon Taylor finds himself among the hunted, his life in the hands of a benevolent chimpanzee scientist.",7.643,3751,"['Science Fiction', 'Adventure', 'Drama', 'Action']",4.5
2542,"Lock, Stock & Two Smoking Barrels (1998)",Comedy|Crime|Thriller,120735,100.0,A card shark and his unwillingly-enlisted friends need to make a lot of cash quick after losing a sketchy poker match. To do this they decide to pull a heist on a small-time gang who happen to be operating out of the flat next door.,8.107,6879,"['Comedy', 'Crime']",4.0
2571,"Matrix, The (1999)",Action|Sci-Fi|Thriller,133093,603.0,"Set in the 22nd century, The Matrix tells the story of a computer hacker who joins a group of underground insurgents fighting the vast and powerful computers who now rule the earth.",8.232,26831,"['Action', 'Science Fiction']",5.0
2599,Election (1999),Comedy,126886,9451.0,"Tracy Flick is running unopposed for this year’s high school student election. But Jim McAllister has a different plan. Partly to establish a more democratic election, and partly to satisfy some deep personal anger toward Tracy, Jim talks football player Paul Metzler to run for president as well.",6.87,1124,"['Comedy', 'Drama']",4.0
2628,Star Wars: Episode I - The Phantom Menace (1999),Action|Adventure|Sci-Fi,120915,1893.0,"Anakin Skywalker, a young slave strong with the Force, is discovered on Tatooine. Meanwhile, the evil Sith have returned, enacting their plot for revenge against the Jedi.",6.565,15247,"['Adventure', 'Action', 'Science Fiction']",3.5
2657,"Rocky Horror Picture Show, The (1975)",Comedy|Horror|Musical|Sci-Fi,73629,36685.0,"After getting a flat tire in the middle of nowhere, newly engaged couple Brad and Janet encounter the eerie mansion of the flamboyant, seductive Dr. Frank-N-Furter and a variety of eccentric characters. Through elaborate dance and rock music, the mad scientist unveils his latest creation: a perfect, muscular man.",7.4,2957,"['Comedy', 'Science Fiction', 'Fantasy', 'Horror']",4.5
2683,Austin Powers: The Spy Who Shagged Me (1999),Action|Adventure|Comedy,145660,817.0,"When diabolical genius Dr. Evil travels back in time to steal superspy Austin Powers's ‘mojo,’ Austin must return to the swingin' '60s himself - with the help of American agent, Felicity Shagwell - to stop the dastardly plan. Once there, Austin faces off against Dr. Evil's army of minions to try to save the world in his own unbelievably groovy way.",6.288,3482,"['Adventure', 'Comedy', 'Crime', 'Science Fiction']",3.0
2700,"South Park: Bigger, Longer and Uncut (1999)",Animation|Comedy|Musical,158983,9473.0,"In this feature film based on the hit animated series, the third graders of South Park sneak into an R-rated film by ultra-vulgar Canadian television personalities Terrance and Phillip, and emerge with expanded vocabularies that leave their parents and teachers scandalized. When outraged Americans try to censor the film, the controversy spirals into a call to wage war on Canada and Terrance and Phillip end up on death row, with the kids their only hope of rescue.",7.28,2811,"['Animation', 'Comedy']",4.5
2706,American Pie (1999),Comedy|Romance,163651,2105.0,"At a high-school party, four friends find that losing their collective virginity isn't as easy as they had thought. But they still believe that they need to do so before college. To motivate themselves, they enter a pact to all ""score"" by their senior prom.",6.6,7968,"['Comedy', 'Romance']",3.0
2716,Ghostbusters (a.k.a. Ghost Busters) (1984),Action|Comedy|Sci-Fi,87332,620.0,"After losing their academic posts at a prestigious university, a team of parapsychologists goes into business as proton-pack-toting ""ghostbusters"" who exterminate ghouls, hobgoblins and supernatural pests of all stripes. An ad campaign pays off when a knockout cellist hires the squad to purge her swanky digs of demons that appear to be living in her refrigerator.",7.495,9359,"['Comedy', 'Fantasy']",4.5
2746,Little Shop of Horrors (1986),Comedy|Horror|Musical,91419,10776.0,"Seymour Krelborn is a nerdy orphan working at Mushnik's; a flower shop in urban Skid Row. He harbors a crush on fellow co-worker, Audrey Fulquard, and is berated by Mr. Mushnik daily. One day, Seymour finds a very mysterious unidentified plant which he calls Audrey II. The plant seems to have a craving for blood and soon begins to sing for his supper.",7.0,1527,"['Horror', 'Comedy']",4.0
2761,"Iron Giant, The (1999)",Adventure|Animation|Children|Drama|Sci-Fi,129167,10386.0,"In the small town of Rockwell, Maine in October 1957, a giant metal machine befriends a nine-year-old boy and ultimately finds its humanity by unselfishly saving people from their own fears and prejudices.",7.953,5883,"['Animation', 'Family', 'Science Fiction', 'Adventure']",5.0
2762,"Sixth Sense, The (1999)",Drama|Horror|Mystery,167404,745.0,"Following an unexpected tragedy, child psychologist Malcolm Crowe meets a nine year old boy named Cole Sear, who is hiding a dark secret.",7.949,12275,"['Mystery', 'Thriller', 'Drama']",4.0
2858,American Beauty (1999),Drama|Romance,169547,14.0,"Lester Burnham, a depressed suburban father in a mid-life crisis, decides to turn his hectic life around after developing an infatuation with his daughter's attractive friend.",8.005,12564,['Drama'],3.5
2959,Fight Club (1999),Action|Crime|Drama|Thriller,137523,550.0,"A ticking-time-bomb insomniac and a slippery soap salesman channel primal male aggression into a shocking new form of therapy. Their concept catches on, with underground ""fight clubs"" forming in every town, until an eccentric gets in the way and ignites an out-of-control spiral toward oblivion.",8.438,30794,"['Drama', 'Thriller']",5.0
2997,Being John Malkovich (1999),Comedy|Drama|Fantasy,120601,492.0,"One day at work, unsuccessful puppeteer Craig finds a portal into the head of actor John Malkovich. The portal soon becomes a passion for anybody who enters its mad and controlling world of overtaking another human body.",7.412,4569,"['Comedy', 'Drama', 'Fantasy']",4.0
3052,Dogma (1999),Adventure|Comedy|Fantasy,120655,1832.0,An abortion clinic worker with a special heritage is called upon to save the existence of humanity from being negated by two renegade angels trying to exploit a loophole and reenter Heaven.,6.924,2650,"['Fantasy', 'Comedy', 'Adventure']",2.5
3114,Toy Story 2 (1999),Adventure|Animation|Children|Comedy|Fantasy,120363,863.0,"Andy heads off to Cowboy Camp, leaving his toys to their own devices. Things shift into high gear when an obsessive toy collector named Al McWhiggen, owner of Al's Toy Barn kidnaps Woody. Andy's toys mount a daring rescue mission, Buzz Lightyear meets his match and Woody has to decide where he and his heart truly belong.",7.602,14382,"['Animation', 'Comedy', 'Family']",5.0
3160,Magnolia (1999),Drama,175880,334.0,"On one random day in the San Fernando Valley, a dying father, a young wife, a male caretaker, a famous lost son, a police officer in love, a boy genius, an ex-boy genius, a game show host and an estranged daughter will each become part of a dazzling multiplicity of plots, but one story.",7.7,3761,['Drama'],5.0
3175,Galaxy Quest (1999),Adventure|Comedy|Sci-Fi,177789,926.0,"For four years, the courageous crew of the NSEA Protector —  Commander Peter Quincy Taggart, Lieutenant Tawny Madison, and Doctor Lazarus — set off on a thrilling and often dangerous mission in space ... until their series was cancelled! Now, twenty years later, aliens under attack have mistaken the Galaxy Quest television transmissions for ""historical documents"" and beam up the crew of has-been actors to save the universe. With no script, no director, and no clue, the actors must turn in the performances of their lives.",7.1,2385,"['Comedy', 'Science Fiction', 'Adventure']",4.0
3253,Wayne's World (1992),Comedy,105793,8872.0,"The adventures of two amiably aimless metal-head friends, Wayne and Garth. From Wayne's basement, the pair broadcast a talk-show called ""Wayne's World"" on local public access television. The show comes to the attention of a sleazy network executive who wants to produce a big-budget version of ""Wayne's World""—and he also wants Wayne's girlfriend, a rock singer named Cassandra. Wayne and Garth have to battle the executive not only to save their show, but also Cassandra.",6.696,2350,['Comedy'],4.5
3317,Wonder Boys (2000),Comedy|Drama,185014,11004.0,Grady is a 50-ish English professor who hasn't had a thing published in years—not since he wrote his award winning 'Great American Novel' 7 years ago. This weekend proves even worse than he could imagine as he finds himself reeling from one misadventure to another in the company of a new wonder boy author.,6.84,620,"['Comedy', 'Drama']",3.0
3421,Animal House (1978),Comedy,77975,8469.0,"At a 1962 College, Dean Vernon Wormer is determined to expel the entire Delta Tau Chi Fraternity, but those troublemakers have other plans for him.",7.0,1594,['Comedy'],4.0
3471,Close Encounters of the Third Kind (1977),Adventure|Drama|Sci-Fi,75860,840.0,"After an encounter with UFOs, an electricity linesman feels undeniably drawn to an isolated area in the wilderness where something spectacular is about to happen.",7.3,4410,"['Science Fiction', 'Drama']",4.0
3477,Empire Records (1995),Comedy|Drama,112950,13531.0,The employees of an independent music store learn about each other as they try to stop the store from being absorbed by a large chain.,6.6,749,"['Music', 'Comedy', 'Drama', 'Romance']",4.5
3481,High Fidelity (2000),Comedy|Drama|Romance,146882,243.0,"After his long-time girlfriend dumps him, a thirty-year-old record store owner seeks to understand why he is unlucky in love while recounting his ""top five breakups of all time"".",7.122,2082,"['Drama', 'Comedy', 'Romance', 'Music']",4.5
3504,Network (1976),Comedy|Drama,74958,10774.0,"When veteran anchorman Howard Beale is forced to retire his 25-year post because of his age, he announces to viewers that he will kill himself during his farewell broadcast. Network executives rethink their decision when his fanatical tirade results in a spike in ratings.",7.811,1882,['Drama'],3.0
3578,Gladiator (2000),Action|Adventure|Drama,172495,98.0,"After the death of Emperor Marcus Aurelius, his devious son takes power and demotes Maximus, one of Rome's most capable generals who Marcus preferred. Eventually, Maximus is forced to become a gladiator and battle to the death against other men for the amusement of paying audiences.",8.22,20080,"['Action', 'Drama', 'Adventure']",3.5
