movieId,title,genres,imdbId,tmdbId,overview,tmdb_vote_average,tmdb_vote_count,tmdb_genres,rating
73017,Sherlock Holmes (2009),Action|Crime|Mystery|Thriller,988045,10528.0,Eccentric consulting detective Sherlock Holmes and Doctor John Watson battle to bring down a new nemesis and unravel a deadly plot that could destroy England.,7.216,14345,"['Action', 'Adventure', 'Crime', 'Mystery']",4.0
73321,"Book of Eli, The (2010)",Action|Adventure|Drama,1037705,20504.0,"A post-apocalyptic tale, in which a lone man fights his way across America in order to protect a sacred book that holds the secrets to saving humankind.",6.795,6393,"['Action', 'Thriller', 'Science Fiction']",4.0
74228,Triangle (2009),Drama|Horror|Mystery|Thriller,1187064,26466.0,"When Jess sets sail on a yacht with a group of friends, she cannot shake the feeling that there is something wrong.",6.919,2796,['Horror'],4.0
74458,Shutter Island (2010),Drama|Mystery|Thriller,1130884,11324.0,"World War II soldier-turned-U.S. Marshal Teddy Daniels investigates the disappearance of a patient from a hospital for the criminally insane, but his efforts are compromised by troubling visions and a mysterious doctor.",8.201,24905,"['Drama', 'Thriller', 'Mystery']",4.5
74545,"Ghost Writer, The (2010)",Drama|Mystery|Thriller,1139328,11439.0,A writer stumbles upon a long-hidden secret when he agrees to help former British Prime Minister Adam Lang complete his memoirs on a remote island after the politician's assistant drowns in a mysterious accident.,6.825,2322,"['Thriller', 'Mystery']",4.0
74740,Fermat's Room (La habitación de Fermat) (2007),Mystery|Thriller,1016301,5595.0,"Four mathematicians are imprisoned in a shrinking room; with the walls closing in, they must try anything to escape this fatal puzzle.",6.6,425,"['Mystery', 'Thriller']",4.5
74946,She's Out of My League (2010),Comedy,815236,34016.0,"When he starts dating drop-dead gorgeous Molly, insecure airport security agent Kirk can't believe it. As his friends and family share their doubts about the relationship lasting, Kirk does everything he can to avoid losing Molly forever.",6.484,2233,"['Romance', 'Comedy']",0.5
78105,Prince of Persia: The Sands of Time (2010),Action|Adventure|Fantasy|Romance|IMAX,473075,9543.0,"A rogue prince reluctantly joins forces with a mysterious princess and together, they race against dark forces to safeguard an ancient dagger capable of releasing the Sands of Time – gift from the gods that can reverse time and allow its possessor to rule the world.",6.291,6939,"['Adventure', 'Fantasy', 'Action']",3.5
78349,Exam (2009),Mystery|Thriller,1258197,29917.0,"Eight talented candidates have reached the final stage of selection to join the ranks of a mysterious and powerful corporation. Entering a windowless room, where an armed guard keeps watch, they are given 80 minutes to answer one simple question.",6.709,2166,"['Thriller', 'Mystery']",4.0
78772,"Twilight Saga: Eclipse, The (2010)",Fantasy|Romance|Thriller|IMAX,1325004,24021.0,"Bella once again finds herself surrounded by danger as Seattle is ravaged by a string of mysterious killings and a malicious vampire continues her quest for revenge. In the midst of it all, she is forced to choose between her love for Edward and her friendship with Jacob, knowing that her decision has the potential to ignite the ageless struggle between vampire and werewolf. With her graduation quickly approaching, Bella is confronted with the most important decision of her life.",6.202,8998,"['Adventure', 'Fantasy', 'Drama', 'Romance']",0.5
78836,Enter the Void (2009),Drama,1191111,34647.0,"This psychedelic tour of life after death is seen entirely from the point of view of Oscar, a young American drug dealer and addict living in Tokyo with his prostitute sister, Linda. When Oscar is killed by police during a bust gone bad, his spirit journeys from the past -- where he sees his parents before their deaths -- to the present -- where he witnesses his own autopsy -- and then to the future, where he looks out for his sister from beyond the grave.",7.304,1889,"['Fantasy', 'Drama']",4.0
79132,Inception (2010),Action|Crime|Drama|Mystery|Sci-Fi|Thriller|IMAX,1375666,27205.0,"Cobb, a skilled thief who commits corporate espionage by infiltrating the subconscious of his targets is offered a chance to regain his old life as payment for a task considered to be impossible: ""inception"", the implantation of another person's idea into a target's subconscious.",8.37,38006,"['Action', 'Science Fiction', 'Adventure']",4.5
79139,"Sorcerer's Apprentice, The (2010)",Action|Adventure|Children|Comedy|Fantasy,963966,27022.0,"Balthazar Blake is a master sorcerer in modern-day Manhattan trying to defend the city from his arch-nemesis, Maxim Horvath. Balthazar can't do it alone, so he recruits Dave Stutler, a seemingly average guy who demonstrates hidden potential, as his reluctant protégé. The sorcerer gives his unwilling accomplice a crash course in the art and science of magic, and together, these unlikely partners work to stop the forces of darkness.",6.13,5100,"['Fantasy', 'Adventure', 'Action']",3.5
79357,Mr. Nobody (2009),Drama|Fantasy|Romance|Sci-Fi,485947,31011.0,"Nemo Nobody leads an ordinary existence with his wife and 3 children; one day, he wakes up as a mortal centenarian in the year 2092.",7.804,6007,"['Science Fiction', 'Drama', 'Romance']",4.0
79702,Scott Pilgrim vs. the World (2010),Action|Comedy|Fantasy|Musical|Romance,446029,22538.0,"As bass guitarist for a garage-rock band, Scott Pilgrim has never had trouble getting a girlfriend; usually, the problem is getting rid of them. But when Ramona Flowers skates into his heart, he finds she has the most troublesome baggage of all: an army of ex-boyfriends who will stop at nothing to eliminate him from her list of suitors.",7.489,8213,"['Action', 'Comedy', 'Romance']",4.0
80463,"Social Network, The (2010)",Drama,1285016,37799.0,"In 2003, Harvard undergrad and computer programmer Mark Zuckerberg begins work on a new concept that eventually turns into the global social network known as Facebook. Six years later, Mark is one of the youngest billionaires ever, but his unprecedented success leads to both personal and legal complications when he ends up on the receiving end of two lawsuits, one involving his former friend.",7.369,12649,['Drama'],4.0
81562,127 Hours (2010),Adventure|Drama|Thriller,1542344,44115.0,The true story of mountain climber Aron Ralston's remarkable adventure to save himself after a fallen boulder crashes on his arm and traps him in an isolated canyon in Utah.,7.085,7782,"['Adventure', 'Drama', 'Thriller']",4.0
81564,Megamind (2010),Action|Animation|Children|Comedy|Sci-Fi|IMAX,1001526,38055.0,"After Megamind, a highly intelligent alien supervillain, defeats his long-time nemesis Metro Man, Megamind creates a new hero to fight, but must act to save the city when his ""creation"" becomes an even worse villain than he was.",7.01,7165,"['Animation', 'Action', 'Comedy', 'Family', 'Science Fiction']",4.0
81591,Black Swan (2010),Drama|Thriller,947798,44214.0,"The story of Nina, a ballerina in a New York City ballet company whose life, like all those in her profession, is completely consumed with dance. She lives with her retired ballerina mother Erica who zealously supports her daughter's professional ambition. When artistic director Thomas Leroy decides to replace prima ballerina Beth MacIntyre for the opening production of their new season, Swan Lake, Nina is his first choice.",7.688,15033,"['Drama', 'Thriller', 'Horror']",4.0
81834,Harry Potter and the Deathly Hallows: Part 1 (2010),Action|Adventure|Fantasy|IMAX,926084,12444.0,"Harry, Ron and Hermione walk away from their last year at Hogwarts to find and destroy the remaining Horcruxes, putting an end to Voldemort's bid for immortality. But with Harry's beloved Dumbledore dead and Voldemort's unscrupulous Death Eaters on the loose, the world is more dangerous than ever.",7.738,19757,"['Adventure', 'Fantasy']",4.0
81932,"Fighter, The (2010)",Drama,964517,45317.0,"Boxer ""Irish"" Micky Ward's unlikely road to the world light welterweight title. His Rocky-like rise was shepherded by half-brother Dicky, a boxer-turned-trainer who rebounded in life after nearly being KO'd by drugs and crime.",7.381,4514,['Drama'],4.0
84152,Limitless (2011),Sci-Fi|Thriller,1219289,51876.0,The life of an unsuccessful writer is transformed by a top-secret 'smart drug' that allows him to use 100% of his brain and become a perfect version of himself. His enhanced abilities soon attract shadowy forces that threaten his new life.,7.192,11024,"['Thriller', 'Mystery', 'Science Fiction']",4.0
84944,Rango (2011),Action|Adventure|Animation|Children|Comedy|Western,1192628,44896.0,"When Rango, a lost family pet, accidentally winds up in the gritty, gun-slinging town of Dirt, the less-than-courageous lizard suddenly finds he stands out. Welcomed as the last hope the town has been waiting for, new Sheriff Rango is forced to play his new role to the hilt.",6.883,6813,"['Animation', 'Comedy', 'Family', 'Western', 'Adventure']",4.0
85414,Source Code (2011),Action|Drama|Mystery|Sci-Fi|Thriller,945513,45612.0,"When decorated soldier Captain Colter Stevens wakes up in the body of an unknown man, he discovers he's part of a mission to find the bomber of a Chicago commuter train.",7.302,8700,"['Thriller', 'Science Fiction', 'Mystery']",4.0
86320,Melancholia (2011),Drama|Sci-Fi,1527186,62215.0,Two sisters find their already strained relationship challenged as a mysterious new planet threatens to collide with Earth.,7.171,3643,"['Drama', 'Science Fiction']",4.0
86882,Midnight in Paris (2011),Comedy|Fantasy|Romance,1605783,59436.0,"While on a trip to Paris with his fiancée's family, a nostalgic screenwriter finds himself mysteriously going back to the 1920s every day at midnight.",7.52,7498,"['Fantasy', 'Comedy', 'Romance']",4.0
86898,"Tree of Life, The (2011)",Drama,478304,8967.0,"The impressionistic story of a Texas family in the 1950s. The film follows the life journey of the eldest son, Jack, through the innocence of childhood to his disillusioned adult years as he tries to reconcile a complicated relationship with his father. Jack finds himself a lost soul in the modern world, seeking answers to the origins and meaning of life while questioning the existence of faith.",6.741,3210,"['Drama', 'Fantasy']",4.5
87232,X-Men: First Class (2011),Action|Adventure|Sci-Fi|Thriller|War,1270798,49538.0,"Before Charles Xavier and Erik Lensherr took the names Professor X and Magneto, they were two young men discovering their powers for the first time. Before they were arch-enemies, they were closest of friends, working together with other mutants (some familiar, some new), to stop the greatest threat the world has ever known.",7.298,13137,"['Action', 'Science Fiction', 'Adventure']",3.5
88140,Captain America: The First Avenger (2011),Action|Adventure|Sci-Fi|Thriller|War,458339,1771.0,"During World War II, Steve Rogers is a sickly man from Brooklyn who's transformed into super-soldier Captain America to aid in the war effort. Rogers must stop the Red Skull – Adolf Hitler's ruthless head of weaponry, and the leader of an organization that intends to use a mysterious device of untold powers for world domination.",7.005,22152,"['Action', 'Adventure', 'Science Fiction']",2.5
89039,Another Earth (2011),Drama|Romance|Sci-Fi,1549572,55420.0,Tragedy connects a young woman and a shattered music professor as an exact replica of Earth is discovered.,6.709,1717,"['Drama', 'Science Fiction']",3.5
89470,Contagion (2011),Sci-Fi|Thriller|IMAX,1598778,39538.0,"As an epidemic of a lethal airborne virus - that kills within days - rapidly grows, the worldwide medical community races to find a cure and control the panic that spreads faster than the virus itself.",6.644,6291,"['Drama', 'Thriller', 'Science Fiction']",4.0
89492,Moneyball (2011),Drama,1210166,60308.0,"The story of Oakland Athletics general manager Billy Beane's successful attempt to put together a baseball team on a budget, by employing computer-generated analysis to draft his players.",7.28,5457,['Drama'],4.0
89745,"Avengers, The (2012)",Action|Adventure|Sci-Fi|IMAX,848228,24428.0,"When an unexpected enemy emerges and threatens global safety and security, Nick Fury, director of the international peacekeeping agency known as S.H.I.E.L.D., finds himself in need of a team to pull the world back from the brink of disaster. Spanning the globe, a daring recruitment effort begins!",7.812,33198,"['Science Fiction', 'Action', 'Adventure']",2.5
89753,Tinker Tailor Soldier Spy (2011),Drama|Film-Noir|Thriller,1340800,49517.0,"In the bleak days of the Cold War, espionage veteran George Smiley is forced from semi-retirement to uncover a Soviet mole within his former colleagues at the heart of MI6.",6.616,2772,"['Drama', 'Thriller', 'Mystery']",4.0
89761,"Dangerous Method, A (2011)",Drama|Thriller,1571222,48231.0,"Seduced by the challenge of an impossible case, the driven Dr. Carl Jung takes the unbalanced yet beautiful Sabina Spielrein as his patient. Jung’s weapon is the method of his master, the renowned Sigmund Freud. Both men fall under Sabina’s spell.",6.357,2133,['Drama'],3.5
90249,Real Steel (2011),Action|Drama|Sci-Fi|IMAX,433035,39254.0,"Charlie Kenton is a washed-up fighter who retired from the ring when robots took over the sport. After his robot is trashed, he reluctantly teams up with his estranged son to rebuild and train an unlikely contender.",7.061,8745,"['Action', 'Science Fiction', 'Drama']",4.0
90405,In Time (2011),Crime|Sci-Fi|Thriller,1637688,49530.0,"In the not-too-distant future, the aging gene has been switched off. To avoid overpopulation, time has become the currency and the way people pay for luxuries and necessities. The rich can live forever, while the rest struggle to negotiate for their immortality. A poor young man who suddenly comes into a fortune of time finds himself on the run from a corrupt police force known as the ""time keepers"".",6.971,11777,"['Action', 'Thriller', 'Science Fiction']",3.5
90600,Headhunters (Hodejegerne) (2011),Action|Crime|Thriller,1614989,70670.0,An accomplished headhunter risks everything to obtain a valuable painting owned by a former mercenary.,7.245,1290,"['Thriller', 'Crime', 'Action']",4.0
90746,"Adventures of Tintin, The (2011)",Action|Animation|Mystery|IMAX,983193,17578.0,"Intrepid young reporter, Tintin, and his loyal dog, Snowy, are thrust into a world of high adventure when they discover a ship carrying an explosive secret. As Tintin is drawn into a centuries-old mystery, Ivan Ivanovitch Sakharine suspects him of stealing a priceless treasure. Tintin and Snowy, with the help of salty, cantankerous Captain Haddock and bumbling detectives, Thompson and Thomson, travel half the world, one step ahead of their enemies, as Tintin endeavors to find the Unicorn, a sunken ship that may hold a vast fortune, but also an ancient curse.",6.912,5587,"['Adventure', 'Animation', 'Mystery']",4.0
90866,Hugo (2011),Children|Drama|Mystery,970179,44826.0,"Orphaned and alone except for an uncle, Hugo Cabret lives in the walls of a train station in 1930s Paris. Hugo's job is to oil and maintain the station's clocks, but to him, his more important task is to protect a broken automaton and notebook left to him by his late father. Accompanied by the goddaughter of an embittered toy merchant, Hugo embarks on a quest to solve the mystery of the automaton and find a place he can call home.",7.175,7417,"['Adventure', 'Drama', 'Family']",3.5
91500,The Hunger Games (2012),Action|Adventure|Drama|Sci-Fi|Thriller,1392170,70160.0,"In a dystopian society where the Capitol forces each district to send two young tributes to fight to the death in a televised spectacle, a girl volunteers to take her sister’s place, setting the stage for a struggle of survival and defiance.",7.219,22651,"['Science Fiction', 'Adventure', 'Action', 'Thriller']",3.0
91529,"Dark Knight Rises, The (2012)",Action|Adventure|Crime|IMAX,1345836,49026.0,"Following the death of District Attorney Harvey Dent, Batman assumes responsibility for Dent's crimes to protect the late attorney's reputation and is subsequently hunted by the Gotham City Police Department. Eight years later, Batman encounters the mysterious Selina Kyle and the villainous Bane, a new terrorist leader who overwhelms Gotham's finest. The Dark Knight resurfaces to protect a city that has branded him an enemy.",7.8,23567,"['Action', 'Crime', 'Drama', 'Thriller']",4.5
91542,Sherlock Holmes: A Game of Shadows (2011),Action|Adventure|Comedy|Crime|Mystery|Thriller,1515091,58574.0,"There is a new criminal mastermind at large (Professor Moriarty) and not only is he Holmes’ intellectual equal, but his capacity for evil and lack of conscience may give him an advantage over the  detective.",7.142,10618,"['Adventure', 'Action', 'Crime', 'Mystery']",4.0
91658,"Girl with the Dragon Tattoo, The (2011)",Drama|Thriller,1568346,65754.0,"Disgraced journalist Mikael Blomkvist investigates the disappearance of a weary patriarch's niece from 40 years ago. He is aided by the pierced, tattooed, punk computer hacker named Lisbeth Salander. As they work together in the investigation, Blomkvist and Salander uncover immense corruption beyond anything they have ever imagined.",7.378,7292,"['Thriller', 'Crime', 'Mystery']",4.0
91976,"Grey, The (2012)",Action|Drama,1601913,75174.0,"Following a grueling five-week shift at an Alaskan oil refinery, workers led by sharpshooter John Ottway are flying home for a much-needed vacation. But a brutal storm causes their plane to crash in the frozen wilderness, and only eight men, including Ottway, survive. As they trek southward toward civilization and safety, Ottway and his companions must battle mortal injuries, the icy elements, and a pack of hungry wolves.",6.569,3958,"['Action', 'Adventure', 'Drama', 'Thriller']",4.0
92259,Intouchables (2011),Comedy|Drama,1675434,77338.0,A true story of two men who should never have met – a quadriplegic aristocrat who was injured in a paragliding accident and a young man from the projects.,8.272,17863,"['Drama', 'Comedy']",4.0
94799,Sound of My Voice (2011),Drama|Mystery|Sci-Fi,1748207,86812.0,A journalist and his girlfriend get pulled in while they investigate a cult whose leader claims to be from the future.,6.301,396,"['Science Fiction', 'Drama', 'Mystery', 'Thriller', 'Horror']",4.0
94864,Prometheus (2012),Action|Horror|Sci-Fi|IMAX,1446714,70981.0,"A team of explorers discover a clue to the origins of mankind on Earth, leading them on a journey to the darkest corners of the universe. There, they must fight a terrifying battle to save the future of the human race.",6.582,12765,"['Science Fiction', 'Adventure', 'Mystery']",4.0
95088,Safety Not Guaranteed (2012),Comedy|Drama,1862079,84332.0,Three magazine employees head out on an assignment to interview a guy who placed a classified ad seeking a companion for time travel.,6.776,1524,"['Comedy', 'Romance', 'Science Fiction']",3.5
95167,Brave (2012),Action|Adventure|Animation|Children,1217209,62177.0,"In the mystical Scottish Highlands, Merida is the princess of a kingdom ruled by King Fergus and Queen Elinor. An unruly daughter and an accomplished archer, Merida one day defies a sacred custom of the land and inadvertently brings turmoil to the kingdom. In an attempt to set things right, Merida seeks out an eccentric old Wise Woman and is granted an ill-fated wish. Also figuring into Merida's quest — and serving as comic relief — are the kingdom's three lords: the enormous Lord MacGuffin, the surly Lord Macintosh, and the disagreeable Lord Dingwall.",7.022,13771,"['Animation', 'Adventure', 'Comedy', 'Family', 'Action', 'Fantasy']",4.0
95510,"Amazing Spider-Man, The (2012)",Action|Adventure|Sci-Fi|IMAX,948470,1930.0,"Peter Parker is an outcast high schooler abandoned by his parents as a boy, leaving him to be raised by his Uncle Ben and Aunt May. Like most teenagers, Peter is trying to figure out who he is and how he got to be the person he is today. As Peter discovers a mysterious briefcase that belonged to his father, he begins a quest to understand his parents' disappearance – leading him directly to Oscorp and the lab of Dr. Curt Connors, his father's former partner. As Spider-Man is set on a collision course with Connors' alter ego, The Lizard, Peter will make life-altering choices to use his powers and shape his destiny to become a hero.",6.722,17954,"['Action', 'Adventure', 'Science Fiction']",4.0
95875,Total Recall (2012),Action|Sci-Fi|Thriller,1386703,64635.0,"Factory worker Doug Quaid takes a virtual mind-trip vacation with the Rekall company, opting for implanted memories of being a spy. When the procedure goes wrong, Quaid becomes a wanted man by the police and joins forces with a rebel fighter to stop the evil Chancellor Cohaagen.",6.024,5649,"['Action', 'Science Fiction', 'Thriller']",3.5
96610,Looper (2012),Action|Crime|Sci-Fi,1276104,59967.0,"In the year 2044, time travel has not yet been invented but in 30 years it will have been. When the mob wants to get rid of someone, they will send their target into the past where a looper, a hired gun, like Joe is waiting to mop up. Joe is getting rich and life is good until the day the mob decides to close the loop, sending back Joe's future self for assassination.",6.896,10497,"['Action', 'Thriller', 'Science Fiction']",4.0
96728,"Master, The (2012)",Drama,1560747,68722.0,"Freddie, a volatile, heavy-drinking veteran who suffers from post-traumatic stress disorder, finds some semblance of a family when he stumbles onto the ship of Lancaster Dodd, the charismatic leader of a new ""religion"" he forms after World War II.",7.1,3115,['Drama'],4.5
96737,Dredd (2012),Action|Sci-Fi,1343727,49049.0,"In the future, America is a dystopian wasteland. The latest scourge is Ma-Ma, a prostitute-turned-drug pusher with a dangerous new drug and aims to take over the city. The only possibility of stopping her is an elite group of urban police called Judges, who combine the duties of judge, jury and executioner to deliver a brutal brand of swift justice. But even the top-ranking Judge, Dredd, discovers that taking down Ma-Ma isn’t as easy as it seems in this explosive adaptation of the hugely popular comic series.",6.851,5282,"['Action', 'Science Fiction']",3.0
96829,"Hunt, The (Jagten) (2012)",Drama,2106476,103663.0,"A teacher lives a lonely life, all the while struggling over his son’s custody. His life slowly gets better as he finds love and receives good news from his son, but his new luck is about to be brutally shattered by an innocent little lie.",8.097,4479,['Drama'],4.0
97188,Sinister (2012),Horror|Thriller,1922777,82507.0,"True-crime writer Ellison Oswald is in a slump; he hasn't had a best seller in more than 10 years and is becoming increasingly desperate for a hit. So, when he discovers the existence of a snuff film showing the deaths of a family, he vows to solve the mystery. He moves his own family into the victims' home and gets to work. However, when old film footage and other clues hint at the presence of a supernatural force, Ellison learns that living in the house may be fatal.",6.867,5774,"['Horror', 'Thriller', 'Mystery']",4.0
97306,Seven Psychopaths (2012),Comedy|Crime,1931533,86838.0,A struggling screenwriter inadvertently becomes entangled in the Los Angeles criminal underworld after his oddball friends kidnap a gangster's beloved Shih Tzu.,6.824,4079,"['Comedy', 'Crime']",3.5
97752,Cloud Atlas (2012),Drama|Sci-Fi|IMAX,1371111,83542.0,"A set of six nested stories spanning time between the 19th century and a distant post-apocalyptic future. Cloud Atlas explores how the actions and consequences of individual lives impact one another throughout the past, the present and the future. Action, mystery and romance weave through the story as one soul is shaped from a killer into a hero and a single act of kindness ripples across centuries to inspire a revolution in the distant future.  Based on the award winning novel by David Mitchell. Directed by Tom Tykwer and the Wachowskis.",6.9,7278,"['Drama', 'Science Fiction']",4.5
97938,Life of Pi (2012),Adventure|Drama|IMAX,454876,87827.0,"The story of an Indian boy named Pi, a zookeeper's son who finds himself in the company of a hyena, zebra, orangutan, and a Bengal tiger after a shipwreck sets them adrift in the Pacific Ocean.",7.407,13415,"['Adventure', 'Drama']",4.0
99114,Django Unchained (2012),Action|Drama|Western,1853728,68718.0,"With the help of a German bounty hunter, a freed slave sets out to rescue his wife from a brutal Mississippi plantation owner.",8.184,27090,"['Drama', 'Western']",4.0
99917,Upstream Color (2013),Romance|Sci-Fi|Thriller,2084989,145197.0,"A man and woman are drawn together, entangled in the lifecycle of an ageless organism. Identity becomes an illusion as they struggle to assemble the loose fragments of wrecked lives.",6.327,761,"['Drama', 'Science Fiction']",4.0
100383,Side Effects (2013),Crime|Drama|Mystery|Thriller,2053463,109421.0,A woman turns to prescription medication as a way of handling her anxiety concerning her husband's upcoming release from prison.,6.609,3181,"['Thriller', 'Crime', 'Drama']",4.0
101741,Trance (2013),Crime|Thriller,1924429,68727.0,A violent gang enlists the help of a hypnotherapist in an attempt to locate a painting which somehow vanished in the middle of a heist.,6.624,2250,"['Thriller', 'Crime', 'Drama', 'Mystery']",4.0
