movieId,title,genres,imdbId,tmdbId,overview,tmdb_vote_average,tmdb_vote_count,tmdb_genres,rating
6301,Straw Dogs (1971),Drama|Thriller,67800,994.0,"David Sumner, a mild-mannered academic from the United States, marries Amy, an Englishwoman. In order to escape a hectic stateside lifestyle, David and his wife relocate to the small town in rural Cornwall where Amy was raised. There, David is ostracized by the brutish men of the village, including Amy's old flame, Charlie. Eventually the taunts escalate.",7.158,998,"['Thriller', 'Drama', 'Crime']",3.0
6303,"Andromeda Strain, The (1971)",Mystery|Sci-Fi,66769,10514.0,"When virtually all of the residents of Piedmont, New Mexico, are found dead after the return to Earth of a space satellite, the head of the US Air Force's Project Scoop declares an emergency. A group of eminent scientists led by Dr. Jeremy Stone scramble to a secure laboratory and try to first isolate the life form while determining why two people from Piedmont - an old alcoholic and a six-month-old baby - survived. The scientists methodically study the alien life form unaware that it has already mutated and presents a far greater danger in the lab, which is equipped with a nuclear self-destruct device designed to prevent the escape of dangerous biological agents.",7.1,736,"['Science Fiction', 'Thriller']",3.0
6337,Owning Mahowny (2003),Crime|Drama|Thriller,285861,15394.0,"Dan Mahowny was a rising star at the Canadian Imperial Bank of Commerce. At twenty-four he was assistant manager of a major branch in the heart of Toronto's financial district. To his colleagues he was a workaholic. To his customers, he was astute, decisive and helpful. To his friends, he was a quiet, but humorous man who enjoyed watching sports on television. To his girlfriend, he was shy but engaging. None of them knew the other side of Dan Mahowny--the side that executed the largest single-handed bank fraud in Canadian history, grossing over $10 million in eighteen months to feed his gambling obsession.",6.74,179,"['Crime', 'Drama', 'Thriller']",3.5
6377,Finding Nemo (2003),Adventure|Animation|Children|Comedy,266543,12.0,"Nemo, an adventurous young clownfish, is unexpectedly taken from his Great Barrier Reef home to a dentist's office aquarium. It's up to his worrisome father Marlin and a friendly but forgetful fish Dory to bring Nemo home -- meeting vegetarian sharks, surfer dude turtles, hypnotic jellyfish, hungry seagulls, and more along the way.",7.817,19930,"['Animation', 'Family']",4.0
6378,"Italian Job, The (2003)",Action|Crime,317740,9654.0,"Charlie Croker pulled off the crime of a lifetime. The one thing that he didn't plan on was being double-crossed. Along with a drop-dead gorgeous safecracker, Croker and his team take off to re-steal the loot and end up in a pulse-pounding, pedal-to-the-metal chase that careens up, down, above and below the streets of Los Angeles.",6.784,5760,"['Action', 'Crime']",3.0
6440,Barton Fink (1991),Drama|Thriller,101410,290.0,A renowned New York playwright is enticed to California to write for the movies and discovers the hellish truth of Hollywood.,7.454,1767,"['Comedy', 'Drama', 'Thriller']",3.0
6539,Pirates of the Caribbean: The Curse of the Black Pearl (2003),Action|Adventure|Comedy|Fantasy,325980,22.0,"After Port Royal is attacked and pillaged by a mysterious pirate crew, capturing the governor's daughter Elizabeth Swann in the process, William Turner asks free-willing pirate Jack Sparrow to help him locate the crew's ship—The Black Pearl—so that he can rescue the woman he loves.",7.814,21462,"['Adventure', 'Fantasy', 'Action']",4.0
6565,Seabiscuit (2003),Drama,329575,4464.0,True story of the undersized Depression-era racehorse whose victories lifted not only the spirits of the team behind it but also those of their nation.,7.053,871,"['Drama', 'History']",3.5
6620,American Splendor (2003),Comedy|Drama,305206,2771.0,An original mix of fiction and reality illuminates the life of comic book hero everyman Harvey Pekar.,7.2,504,"['Comedy', 'Drama']",4.5
6708,Matchstick Men (2003),Comedy|Crime|Drama,325805,7270.0,A phobic con artist and his protege are on the verge of pulling off a lucrative swindle when the con artist's teenage daughter arrives unexpectedly.,7.008,1840,"['Comedy', 'Drama', 'Crime', 'Thriller']",4.0
6711,Lost in Translation (2003),Comedy|Drama|Romance,335266,153.0,"Two lost souls visiting Tokyo -- the young, neglected wife of a photographer and a washed-up movie star shooting a TV commercial -- find an odd solace and pensive freedom to be real in each other's company, away from their lives in America.",7.387,7692,"['Drama', 'Romance', 'Comedy']",4.0
6753,Secondhand Lions (2003),Children|Comedy|Drama,327137,13156.0,"The comedic adventures of an introverted boy left on the doorstep of a pair of reluctant, eccentric great-uncles, whose exotic remembrances stir the boy's spirit and re-ignite the men's lives.",7.195,795,"['Family', 'Comedy']",3.5
6777,Judgment at Nuremberg (1961),Drama,55031,821.0,"In 1947, four German judges who served on the bench during the Nazi regime face a military tribunal to answer charges of crimes against humanity. Chief Justice Haywood hears evidence and testimony not only from lead defendant Ernst Janning and his defense attorney Hans Rolfe, but also from the widow of a Nazi general, an idealistic U.S. Army captain and reluctant witness Irene Wallner.",8.026,868,"['Drama', 'History']",4.5
6787,All the President's Men (1976),Drama|Thriller,74119,891.0,"During the 1972 elections, two reporters' investigation sheds light on the controversial Watergate scandal that compels President Nixon to resign from his post.",7.656,1939,"['Drama', 'Mystery', 'Thriller']",4.5
6796,Boyz N the Hood (1991),Crime|Drama,101507,650.0,"In the middle of the Los Angeles ghetto, drugs, robberies and shootings dominate everyday life. During these times, Furious tries to raise his son Tre to be a decent person. Tre's friends, on the other hand, have little regard for the law and drag the entire neighborhood into a street war...",7.626,2115,"['Crime', 'Drama']",4.0
6808,Where Eagles Dare (1968),Action|Adventure|War,65207,11046.0,"World War II is raging, and an American general has been captured and is being held hostage in the Schloss Adler, a Bavarian castle that's nearly impossible to breach. It's up to a group of skilled Allied soldiers to liberate the general before it's too late.",7.514,928,"['Action', 'Adventure', 'War']",3.5
6852,In Cold Blood (1967),Crime|Drama,61809,18900.0,"After a botched robbery results in the brutal murder of a rural family, two drifters elude police, in the end coming to terms with their own mortality and the repercussions of their vile atrocity.",7.493,401,"['Crime', 'Drama', 'Thriller', 'History']",4.5
6867,"Station Agent, The (2003)",Comedy|Drama,340377,2056.0,"When his only friend dies, a man born with dwarfism moves to rural New Jersey to live a life of solitude, only to meet a chatty hot dog vendor and a woman dealing with her own personal loss.",7.358,718,"['Drama', 'Comedy']",4.0
6870,Mystic River (2003),Crime|Drama|Mystery,327056,322.0,The lives of three men who were childhood friends are shattered when one of them suffers a family tragedy.,7.742,7067,"['Thriller', 'Crime', 'Drama', 'Mystery']",5.0
6936,Elf (2003),Children|Comedy|Fantasy,319343,10719.0,"When young Buddy falls into Santa's gift sack on Christmas Eve, he's transported back to the North Pole and raised as a toy-making elf by Santa's helpers. But as he grows into adulthood, he can't shake the nagging feeling that he doesn't belong. Buddy vows to visit Manhattan and find his real dad, a workaholic.",6.655,4266,"['Comedy', 'Family', 'Fantasy']",3.0
6989,Gorky Park (1983),Crime|Drama|Thriller,85615,8289.0,"Police Inspector Renko tries to solve the case of three bodies found in Moscow's Gorky Park but finds his attempts to solve the crime impeded by his superiors. Working on his own, Renko seeks out more information and stumbles across a conspiracy involving the highest levels of the government.",6.318,321,"['Thriller', 'Crime', 'Drama', 'Mystery']",3.5
6990,The Great Train Robbery (1978),Action|Adventure|Comedy|Crime|Drama,79240,11583.0,"In Victorian England, a master criminal makes elaborate plans to steal a shipment of gold from a moving train.",6.692,408,"['Thriller', 'Adventure', 'Drama', 'Crime']",3.0
6993,Hannah and Her Sisters (1986),Comedy|Drama|Romance,91167,5143.0,"Between two Thanksgivings, Hannah's husband falls in love with her sister Lee, while her hypochondriac ex-husband rekindles his relationship with her sister Holly.",7.495,1089,"['Comedy', 'Drama']",3.0
7013,"Night of the Hunter, The (1955)",Drama|Film-Noir|Thriller,48424,3112.0,"In Depression-era West Virginia, a serial-killing preacher hunts two young children who know the whereabouts of a stash of money.",7.873,1704,"['Crime', 'Drama', 'Thriller']",2.5
7027,Silverado (1985),Action|Western,90022,11509.0,"Four unwitting heroes cross paths on their journey to the sleepy town of Silverado. Little do they know the town where their family and friends reside has been taken over by a corrupt sheriff and a murderous posse. It's up to the sharp-shooting foursome to save the day, but first they have to break each other out of jail, and learn who their real friends are.",7.0,755,"['Western', 'Action']",3.5
7070,Red River (1948),Action|Adventure|Western,40724,3089.0,"Following the Civil War, headstrong rancher Thomas Dunson decides to lead a perilous cattle drive from Texas to Missouri. During the exhausting journey, his persistence becomes tyrannical in the eyes of Matthew Garth, his adopted son and protégé.",7.338,559,['Western'],3.5
7072,Stagecoach (1939),Action|Drama|Romance|Western,31971,995.0,"A group of people traveling on a stagecoach find their journey complicated by the threat of Geronimo, and learn something about each other in the process.",7.625,1175,"['Western', 'Adventure']",3.0
7073,"Shot in the Dark, A (1964)",Comedy|Crime|Mystery,58586,1594.0,"Inspector Jacques Clouseau, smitten with the accused maid Maria Gambrelli, unwittingly turns a straightforward murder investigation into a comedic series of mishaps, testing the patience of his irritable boss Charles Dreyfus as casualties mount.",7.19,590,"['Comedy', 'Mystery', 'Crime']",2.0
7076,Bullitt (1968),Action|Crime|Drama|Thriller,62765,916.0,"Senator Walter Chalmers is aiming to take down mob boss Pete Ross with the help of testimony from the criminal's hothead brother Johnny, who is in protective custody in San Francisco under the watch of police lieutenant Frank Bullitt. When a pair of mob hitmen enter the scene, Bullitt follows their trail through a maze of complications and double-crosses. This thriller includes one of the most famous car chases ever filmed.",7.153,1214,"['Action', 'Crime', 'Thriller', 'Romance', 'Drama']",4.5
7089,Amarcord (1973),Comedy|Drama,71129,7857.0,"In an Italian seaside town, young Titta gets into trouble with his friends and watches various local eccentrics as they engage in often absurd behavior. Frequently clashing with his stern father and defended by his doting mother, Titta witnesses the actions of a wide range of characters, from his extended family to Fascist loyalists to sensual women, with certain moments shifting into fantastical scenarios.",7.908,1156,"['Comedy', 'Drama']",2.0
7132,"Night at the Opera, A (1935)",Comedy|Musical|Romance,26778,37719.0,The Marx Brothers take on high society and the opera world to bring two lovers together. A sly business manager and two wacky friends of two opera singers help them achieve success while humiliating their stuffy and snobbish enemies.,7.4,519,"['Comedy', 'Music']",3.5
7137,"Cooler, The (2003)",Comedy|Drama|Romance,318374,10744.0,"Bernie works at a Las Vegas casino, where he uses his innate ability to bring about misfortune in those around him to jinx gamblers into losing. His imposing boss, Shelly Kaplow, is happy with the arrangement. But Bernie finds unexpected happiness when he begins dating attractive waitress Natalie Belisario.",6.712,372,"['Romance', 'Drama']",4.0
7139,In America (2002),Drama|Romance,298845,10511.0,A family of Irish immigrants adjusts to life on the mean streets of Hell's Kitchen while also grieving the death of a child.,7.2,366,['Drama'],3.5
7143,"Last Samurai, The (2003)",Action|Adventure|Drama|War,325710,616.0,"Nathan Algren is an American hired to instruct the Japanese army in the ways of modern warfare, which finds him learning to respect the samurai and the honorable principles that rule them. Pressed to destroy the samurai's way of life in the name of modernization and open trade, Algren decides to become an ultimate warrior himself and to fight for their right to exist.",7.596,7188,"['Drama', 'Action', 'War']",3.5
7147,Big Fish (2003),Drama|Fantasy|Romance,319061,587.0,"Throughout his life Edward Bloom has always been a man of big appetites, enormous passions and tall tales. In his later years, he remains a huge mystery to his son, William. Now, to get to know the real man, Will begins piecing together a true picture of his father from flashbacks of his amazing adventures.",7.755,7478,"['Adventure', 'Fantasy', 'Drama']",1.0
7151,Girl with a Pearl Earring (2003),Drama|Romance,335119,3635.0,"This film, adapted from a work of fiction by author Tracy Chevalier, tells a story about the events surrounding the creation of the painting ""Girl With A Pearl Earring"" by 17th century Dutch master Johannes Vermeer. A young peasant maid working in the house of painter Johannes Vermeer becomes his talented assistant and the model for one of his most famous works.",6.622,1419,"['Drama', 'Romance']",3.5
7156,"Fog of War: Eleven Lessons from the Life of Robert S. McNamara, The (2003)",Documentary|War,317910,12698.0,"Using archival footage, cabinet conversation recordings, and an interview of the 85-year-old Robert McNamara, The Fog of War depicts his life, from working as a WWII whiz-kid military officer, to being the Ford Motor Company's president, to managing the Vietnam War as defense secretary for presidents Kennedy and Johnson.",7.7,285,"['Documentary', 'TV Movie', 'History', 'War']",2.5
7158,House of Sand and Fog (2003),Drama,315983,11093.0,"Behrani, an Iranian immigrant buys a California bungalow, thinking he can fix it up, sell it again, and make enough money to send his son to college. However, the house is the legal property of former drug addict Kathy. After losing the house in an unfair legal dispute with the county, she is left with nowhere to go. Wanting her house back, she hires a lawyer and befriends a police officer. Neither Kathy nor Behrani have broken the law, so they find themselves involved in a difficult moral dilemma.",7.149,791,['Drama'],4.0
7160,Monster (2003),Crime|Drama,340855,504.0,"An emotionally scarred highway drifter shoots a sadistic trick who rapes her, and ultimately becomes America's first female serial killer.",7.211,2425,"['Crime', 'Drama']",4.5
7162,Cold Mountain (2003),Drama|Romance|War,159365,2289.0,"In this classic story of love and devotion set against the backdrop of the American Civil War, a wounded Confederate soldier named W.P. Inman deserts his unit and travels across the South, aiming to return to his young wife, Ada, who he left behind to tend their farm. As Inman makes his perilous journey home, Ada struggles to keep their home intact with the assistance of Ruby, a mysterious drifter sent to help her by a kindly neighbor.",6.927,1862,"['War', 'History', 'Adventure', 'Romance']",3.5
7210,My Darling Clementine (1946),Western,38762,3088.0,Three brothers stop off for a night in the town of Tombstone. The next morning they find one of their brothers dead and their cattle stolen. They decide to take revenge on the culprits.,7.4,449,"['Western', 'Drama', 'Romance']",4.0
7215,To Have and Have Not (1944),Adventure|Drama|Romance|Thriller|War,37382,22584.0,A Martinique charter boat skipper gets mixed up with the underground French resistance operatives during WWII.,7.463,539,"['Adventure', 'Romance', 'War']",3.5
7218,"Ox-Bow Incident, The (1943)",Drama|Western,36244,980.0,A posse discovers a trio of men they suspect of murder and cow theft and are split between handing them over to the law or lynching them on the spot.,7.707,410,"['Western', 'Drama']",4.5
7263,Miracle (2004),Drama,349825,14292.0,"When college coach Herb Brooks is hired to helm the 1980 U.S. men's Olympic hockey team, he brings a unique and brash style to the ice. After assembling a team of hot-headed college all-stars, who are humiliated in an early match, Brooks unites his squad against a common foe: the heavily-favored Soviet team.",7.1,630,"['Drama', 'History']",3.5
7334,"Front, The (1976)",Comedy|Drama,74554,1723.0,"A cashier poses as a writer for blacklisted talents to submit their work through, but the injustice around him pushes him to take a stand.",7.0,175,"['Comedy', 'Drama']",3.5
7347,Secret Window (2004),Mystery|Thriller,363988,1586.0,"Mort Rainey, a writer just emerging from a painful divorce with his ex-wife, is stalked at his remote lake house by a psychotic stranger and would-be scribe who claims Rainey swiped his best story idea. But as Rainey endeavors to prove his innocence, he begins to question his own sanity.",6.564,3783,"['Mystery', 'Thriller']",3.0
7361,Eternal Sunshine of the Spotless Mind (2004),Drama|Romance|Sci-Fi,338013,38.0,"Joel Barish, heartbroken that his girlfriend underwent a procedure to erase him from her memory, decides to do the same. However, as he watches his memories of her fade away, he realises that he still loves her, and may be too late to correct his mistake.",8.092,15703,"['Science Fiction', 'Drama', 'Romance']",3.0
7438,Kill Bill: Vol. 2 (2004),Action|Drama|Thriller,378194,393.0,"The Bride unwaveringly continues on her roaring rampage of revenge against the band of assassins who had tried to kill her and her unborn child. She visits each of her former associates one-by-one, checking off the victims on her Death List Five until there's nothing left to do … but kill Bill.",7.873,14466,"['Action', 'Crime', 'Thriller']",4.0
7445,Man on Fire (2004),Action|Crime|Drama|Mystery|Thriller,328107,9509.0,"Jaded ex-CIA operative John Creasy reluctantly accepts a job as the bodyguard for a 10-year-old girl in Mexico City. They clash at first, but eventually bond, and when she's kidnapped he's consumed by fury and will stop at nothing to save her life.",7.456,5376,"['Action', 'Drama', 'Thriller']",2.0
7560,Fail-Safe (1964),Drama|Thriller|War,58083,502.0,Because of a technical defect an American bomber team mistakenly orders the destruction of Moscow. The President of the United States has but little time to prevent an atomic catastrophe from occurring.,7.8,433,"['Thriller', 'Drama', 'War']",2.5
7698,"China Syndrome, The (1979)",Drama|Thriller,78966,988.0,"While doing a series of reports on alternative energy sources, opportunistic reporter Kimberly Wells witnesses an accident at a nuclear power plant. Wells is determined to publicize the incident, but soon finds herself entangled in a sinister conspiracy to keep the full impact of the incident a secret.",7.169,490,"['Drama', 'Thriller']",3.5
7706,Animal Crackers (1930),Comedy|Musical,20640,13913.0,"The well-known explorer and hunter Captain Spaulding has just returned from Africa, and is being welcomed home with a lavish party at the estate of influential society matron Mrs. Rittenhouse when a valuable painting goes missing. The intrepid Captain Spaulding attempts to solve the crime with the help of his silly secretary Horatio Jamison, while sparring with the anarchic Signor Emanuel Ravelli and his nutty sidekick The Professor.",6.9,245,"['Comedy', 'Music']",4.0
7792,"Parallax View, The (1974)",Thriller,71970,17365.0,An ambitious reporter gets in trouble while investigating a senator's assassination which leads to a vast conspiracy involving a multinational corporation behind every event in the world's headlines.,6.8,334,"['Crime', 'Drama', 'Thriller']",3.0
7943,"Killers, The (1946)",Crime|Film-Noir,38669,14638.0,"Two hit men walk into a diner asking for a man called ""the Swede"". When the killers find the Swede, he's expecting them and doesn't put up a fight. Since the Swede had a life insurance policy, an investigator, on a hunch, decides to look into the murder. As the Swede's past is laid bare, it comes to light that he was in love with a beautiful woman who may have lured him into pulling off a bank robbery overseen by another man.",7.4,403,"['Crime', 'Mystery', 'Thriller']",3.5
7980,"Bridge Too Far, A (1977)",Action|Drama|War,75784,5902.0,The story of Operation Market Garden—a failed attempt by the allies in the latter stages of WWII to end the war quickly by securing three bridges in Holland allowing access over the Rhine into Germany. A combination of poor allied intelligence and the presence of two crack German panzer divisions meant that the final part of this operation (the bridge in Arnhem over the Rhine) was doomed to failure.,7.222,871,"['Drama', 'History', 'War']",4.0
8042,Mean Streets (1973),Crime|Drama,70379,203.0,"A small-time hood must choose from among love, friendship and the chance to rise within the mob.",7.074,2190,"['Drama', 'Crime']",4.5
8094,Bad Day at Black Rock (1955),Drama|Thriller|Western,47849,14554.0,"One-armed war veteran John J. Macreedy steps off a train at the sleepy little town of Black Rock.  Once there, he begins to unravel a web of lies, secrecy, and murder.",7.3,388,"['Thriller', 'Mystery', 'Drama', 'Western']",4.0
8132,Gladiator (1992),Action|Drama,104346,16219.0,"Tommy Riley has moved with his dad to Chicago from a 'nice place'. He keeps to himself, goes to school. However, after a street fight he is noticed and quickly falls into the world of illegal underground boxing - where punches can kill.",7.6,375,"['Action', 'Drama']",3.5
8207,"Day of the Jackal, The (1973)",Crime|Thriller,69947,4909.0,"An international assassin known as ‘The Jackal’ is employed by disgruntled French generals to kill President Charles de Gaulle, with a dedicated gendarme on the assassin’s trail.",7.5,631,"['Action', 'Thriller']",4.0
8337,"Caine Mutiny, The (1954)",Drama|War,46816,10178.0,"When a US Naval captain shows signs of mental instability that jeopardize his ship, the first officer relieves him of command and faces court martial for mutiny.",7.189,351,"['Drama', 'War']",4.0
8360,Shrek 2 (2004),Adventure|Animation|Children|Comedy|Musical|Romance,298148,809.0,"Shrek, Fiona, and Donkey set off to Far, Far Away to meet Fiona's mother and father, the Queen and King. But not everyone is happily ever after. Shrek and the King find it difficult to get along, and there's tension in the marriage. The Fairy Godmother discovers that Fiona has married Shrek instead of her son Prince Charming and plots to destroy their marriage.",7.302,12921,"['Animation', 'Family', 'Comedy', 'Fantasy', 'Adventure']",3.5
8376,Napoleon Dynamite (2004),Comedy,374900,8193.0,"A listless and alienated teenager decides to help his new friend win the class presidency in their small western high school, while he must deal with his bizarre family life back home.",6.783,2010,['Comedy'],2.5
8529,"Terminal, The (2004)",Comedy|Drama|Romance,362227,594.0,"An Eastern European tourist unexpectedly finds himself stranded in JFK airport, and must take up temporary residence there.",7.353,8284,"['Comedy', 'Drama']",3.5
8622,Fahrenheit 9/11 (2004),Documentary,361596,1777.0,Michael Moore's view on how the Bush administration allegedly used the tragic events on 9/11 to push forward its agenda for unjust wars in Afghanistan and Iraq.,7.1,1461,['Documentary'],4.5
8650,Long Day's Journey Into Night (1962),Drama,56196,43004.0,"An Irish miser, his morphine addicted wife, their debauched older son, and a gravely ill younger son. A quiet Connecticut vacation home on one foggy day in August 1912 becomes the backdrop for domestic decline.",6.997,70,['Drama'],5.0
8665,"Bourne Supremacy, The (2004)",Action|Crime|Thriller,372183,2502.0,"A CIA operation to purchase classified Russian documents is blown by a rival agent, who then shows up in the sleepy seaside village where Bourne and Marie have been living. The pair run for their lives and Bourne, who promised retaliation should anyone from his former life attempt contact, is forced to once again take up his life as a trained assassin to survive.",7.323,7808,"['Action', 'Drama', 'Thriller']",3.5
8772,"Spy Who Came in from the Cold, The (1965)",Drama|Thriller,59749,13580.0,"British agent Alec Leamas refuses to come in from the Cold War during the 1960s, choosing to face another mission, which may prove to be his final one.",7.08,313,"['Drama', 'Thriller']",4.0
8781,"Manchurian Candidate, The (2004)",Thriller,368008,14462.0,"Years after his squad was ambushed during the Gulf War, Major Ben Marco finds himself having terrible nightmares. He begins to doubt that his fellow squad-mate Sergeant Raymond Shaw, now a vice-presidential candidate, is the hero he remembers him being. As Marco's doubts deepen, Shaw's political power grows, and, when Marco finds a mysterious implant embedded in his back, the memory of what really happened begins to return.",6.48,1637,"['Drama', 'Thriller', 'Mystery']",3.0
8784,Garden State (2004),Comedy|Drama|Romance,333766,401.0,"Andrew returns to his hometown for the funeral of his mother, a journey that reconnects him with past friends. The trip coincides with his decision to stop taking his powerful antidepressants. A chance meeting with Sam - a girl also suffering from various maladies - opens up the possibility of rekindling emotional attachments, confronting his psychologist father, and perhaps beginning a new life.",7.086,1931,"['Comedy', 'Drama', 'Romance']",4.0
